published,search_term,category,title,summary,link,matched_words,activity_type,raw_text,entity_source_text,article_fetch_status,resolved_article_url,city_candidates,district_candidates,neighborhood_candidates,street_candidates,facility_candidates,company_candidates,company_candidate_scores,entity_quality_note,maps_queries,maps_candidates,maps_best_guess,maps_status,maps_match_scores,maps_rejected_candidates,record_quality_score,duplicate_group_id
2026-07-01 21:00:16,iflas,İflas / Konkordato / Mali Sorun,ABD'nin 13 milyar dolarlık gemisinde lojistik iflas,ABD'nin 13 milyar dolarlık gemisinde lojistik iflas Yakın Doğu Haber,https://news.google.com/rss/articles/CBMisgFBVV95cUxNQm5KOHNkd2MwdURURkNuQlVtVktkaENLaUlXaGd0WVFzUDFpckhWQUd0XzY1cnlraWVqSTYzdDlhWHBEVUEyTHpCb1R3anAyejNKOHRxM1ItTFdMQlFSMWNLT2NaRmVpRFlqUWlRempJOU1uWUwxMUZ3TlpzVk9WN25jVVVDMVMwYTBwZ0JVY0J6YmZUNUdwSF9TeHM3T3JxSThIWW9QQlJGWXJCdzlrYS13?oc=5,lojistik,,"ABD’nin İran’a yönelik askeri baskı stratejisi kapsamında görev süresi defalarca uzatılan USS Gerald R. Ford uçak gemisi, stratejik hedeflerin ötesinde yapısal ve insani bir krizle karşı karşıya. ABD’nin İran’a yönelik askeri baskı stratejisi kapsamında görev süresi defalarca uzatılan USS Gerald R. Ford uçak gemisi, stratejik hedeflerin ötesinde yapısal ve insani bir krizle karşı karşıya. ABD’nin İran’a yönelik askeri baskı stratejisi kapsamında görev süresi defalarca uzatılan USS Gerald R. Ford uçak gemisi, stratejik hedeflerin ötesinde yapısal ve insani bir krizle karşı karşıya.","ABD'nin 13 milyar dolarlık gemisinde lojistik iflas ABD'nin 13 milyar dolarlık gemisinde lojistik iflas Yakın Doğu Haber ABD’nin İran’a yönelik askeri baskı stratejisi kapsamında görev süresi defalarca uzatılan USS Gerald R. Ford uçak gemisi, stratejik hedeflerin ötesinde yapısal ve insani bir krizle karşı karşıya.",browser_full_article,https://www.ydh.com.tr/d/35718/d/36601/d/39320/amerika-nin-iran-la-anlastik-iddiasina-tahran-dan-kesin-yalanlama,,,,,,,,il yok | ilçe yok | firma yok | faaliyet/tesis yok,,,,maps araması yapılmadı,,,56.37,16
2026-07-02 02:26:00,tasfiye,İflas / Konkordato / Mali Sorun,23 yıllık Türk tekstil devi iflas etti!,23 yıllık Türk tekstil devi iflas etti! Yeni Akit Gazetesi,https://news.google.com/rss/articles/CBMiigFBVV95cUxNYk1zcWg1X29JeVc2T2pVRTc3bjBJWnQtanZEQW1qZ2Jqd2VVS1FSUzVFWmhJLTZudzhXWXhEWkV1UFAwV09Gd3M1V2ZfR3VPZDhNWkJuUDhJT0I5ZFpMbmRoUUtuUnJ2elhYNzZodzdHbmR0VEc1UDBXS3BtWGNnV1ZBYVk5OUtmTnfSAYoBQVVfeXFMTWJNc3FoNV9vSXlXNk9qVUU3N24wSVp0LWp2REFtamdiandlVUtRUlM1RVpoSS02bnc4V1l4RFpFdVBQMFdPRndzNVdmX0d1T2Q4TVpCblA4SU9COWRaTG5kaFFLblJydnpYWDc2aHc3R25kdFRHNVAwV0twbVhjZ1dWQWFZOTlLZk53?oc=5,tekstil,,"Ekonomi 23 yıllık Türk tekstil devi iflas etti! Ege Bölgesi'nde erkek ve kadın giyim sektöründe 23 yıldır faaliyette olan Denfa Moda Tekstil resmen iflas etti. Haber Merkezi 2026-07-02 05:26 Ege Bölgesi'nde erkek ve kadın giyim sektöründe 23 yıldır faaliyette olan Denfa Moda Tekstil resmen iflas etti. İzmir ve Manisa başta olmak üzere Ege Bölgesi'nde erkek ve kadın giyim sektöründe uzun yıllardır faaliyet gösteren Denfa Moda Tekstil Sanayi Ticaret Limited Şirketi hakkında iflas kararı verildi. Bir süredir yaşadığı mali darboğazı aşmak amacıyla konkordato sürecine giren şirketin kurtarma çabaları sonuçsuz kaldı. 23 YILLIK TÜRK TEKSTİL DEVİ İFLAS ETTİ İzmir 1. Asliye Ticaret Mahkemesi, firmaya tanınan 1 yıllık kesin mühletin ardından 25 Haziran 2026 tarihi itibarıyla şirketin iflasına hükmetti. Temelleri 11 Mart 2003 tarihinde Aydın'ın Kurtuluş Mahallesi'nde atılan ve zamanla büyümesini İzmir Gaziemir ile Manisa Alaşehir eksenine taşıyan Denfa Moda, hem mağazacılık hem de e-ticaret üzerinden perakende satışlar gerçekleştiriyordu. MAHKEMEDEN KARAR ÇIKTI Son yıllarda derinleşen ekonomik zorluklar nedeniyle mahkemeye başvurarak konkordato talep eden ve 1 yıllık kesin mühlet hakkı elde eden şirket, bu süreçte mali yapısını toparlayamadı. İzmir 1. Asliye Ticaret Mahkemesi'nin 2025/360 Esas sayılı dosyası üzerinden görülen davada, şirketin adi tasfiye usulüyle iflasına karar verildiği duyuruldu. İzmir İflas Müdürlüğü (2026/17 İflas dosyası) tarafından yayımlanan resmi ilanda, merkezi Gaziemir'de (Irmak Mah. Metin Henkoğlu Cad. No: 20A) bulunan şirketle ilgili hukuki tasfiye sürecinin detayları paylaşıldı.","23 yıllık Türk tekstil devi iflas etti! 23 yıllık Türk tekstil devi iflas etti! Yeni Akit Gazetesi Ekonomi 23 yıllık Türk tekstil devi iflas etti! Ege Bölgesi'nde erkek ve kadın giyim sektöründe 23 yıldır faaliyette olan Denfa Moda Tekstil resmen iflas etti. Haber Merkezi 2026-07-02 05:26 Ege Bölgesi'nde erkek ve kadın giyim sektöründe 23 yıldır faaliyette olan Denfa Moda Tekstil resmen iflas etti. İzmir ve Manisa başta olmak üzere Ege Bölgesi'nde erkek ve kadın giyim sektöründe uzun yıllardır faaliyet gösteren Denfa Moda Tekstil Sanayi Ticaret Limited Şirketi hakkında iflas kararı verildi. Bir süredir yaşadığı mali darboğazı aşmak amacıyla konkordato sürecine giren şirketin kurtarma çabaları sonuçsuz kaldı. 23 YILLIK TÜRK TEKSTİL DEVİ İFLAS ETTİ İzmir 1. Asliye Ticaret Mahkemesi, firmaya tanınan 1 yıllık kesin mühletin ardından 25 Haziran 2026 tarihi itibarıyla şirketin iflasına hükmetti. Temelleri 11 Mart 2003 tarihinde Aydın'ın Kurtuluş Mahallesi'nde atılan ve zamanla büyümesini İzmir Gaziemir ile Manisa Alaşehir eksenine taşıyan Denfa Moda, hem mağazacılık hem de e-ticaret üzerinden perakende satışlar gerçekleştiriyordu. MAHKEMEDEN KARAR ÇIKTI Son yıllarda derinleşen ekonomik zorluklar nedeniyle mahkemeye başvurarak konkordato talep eden ve 1 yıllık kesin mühlet hakkı elde eden şirket, bu süreçte mali yapısını toparlayamadı. Asliye Ticaret Mahkemesi'nin 2025/360 Esas sayılı dosyası üzerinden görülen davada, şirketin adi tasfiye usulüyle iflasına karar verildiği duyuruldu. İzmir İflas Müdürlüğü (2026/17 İflas dosyası) tarafından yayımlanan resmi ilanda, merkezi Gaziemir'de (Irmak Mah. No: 20A) bulunan şirketle ilgili hukuki tasfiye sürecinin detayları paylaşıldı.",browser_full_article,https://m.yeniakit.com.tr/amp/haber/2010461/23-yillik-turk-tekstil-devi-iflas-etti,Aydın | İzmir | Manisa,Gaziemir | Alaşehir,ın Kurtuluş Mahallesi,,,Denfa Moda Tekstil Sanayi Ticaret Limited Şirketi,Denfa Moda Tekstil Sanayi Ticaret Limited Şirketi:57:body | Denfa Moda Tekstil Sanayi Ticaret Limited Şirketi:raw_legal,faaliyet/tesis yok,Denfa Moda Tekstil Sanayi Ticaret Limited Şirketi ın Kurtuluş Mahallesi Gaziemir Aydın Türkiye,DENFA,DENFA,firma adı + güvenli maps adayı var,100.0,,194.4,17
2026-07-01 17:27:00,iflas,İflas / Konkordato / Mali Sorun,Bursa İnegöl'de iflas eden iki firma için yeni süreç başladı!,Bursa İnegöl'de iflas eden iki firma için yeni süreç başladı! Yıldırım Gazetesi,https://news.google.com/rss/articles/CBMilwFBVV95cUxPb2NZeGxYSlI3QS1oVldYZWNoMWV1Vm1NVDlNSjk5Q241MGtZM2lSZjY4YmhJdzZQMDE1WkZGNV92c211eUg3bGlGLTlGM0xCQ3NmUXM5U1p6cFJWdW96OUVxaUttanp0RHpyM1Zvc0NHczVPTzI2ZGxYZTBYSWVfdkgybVFTYlE0M0FjVlpMU0FGMEFmUnNZ?oc=5,firma,şirket / firma,"İnegöl'de daha önce iflasına karar verilen iki şirketle ilgili yargı sürecinde yeni gelişme yaşandı. İcra Dairesi, biri için ek sıra cetvelini, diğeri için ise basit tasfiyede sıra cetvelini ilan etti. İnegöl'de daha önce iflasına karar verilen iki şirketle ilgili yargı sürecinde yeni gelişme yaşandı. İcra Dairesi, biri için ek sıra cetvelini, diğeri için ise basit tasfiyede sıra cetvelini ilan etti. İnegöl'de daha önce iflasına karar verilen iki şirketle ilgili yargı sürecinde yeni gelişme yaşandı. İcra Dairesi, biri için ek sıra cetvelini, diğeri için ise basit tasfiyede sıra cetvelini ilan etti. İnegöl'de faaliyet gösterirken iflas eden iki şirketle ilgili hukuki süreçte yeni bir aşamaya geçildi. İnegöl İcra Dairesi tarafından yayımlanan ilanlarda, Özmin Nakliye Ambalaj İnşaat Taahhüt Taşımacılık Gıda Tarım Hayvancılık Sanayi ve Ticaret Ltd. Şti. ile Wood Dizayn Orman Ürünleri Akaryakıt İnşaat Turizm Gıda Otomotiv Nakliyat Tekstil Mobilya Lojistik Sanayi ve Ticaret Ltd. Şti. hakkında sıra cetveli ilanları yayımlandı. Bursa 1. Asliye Ticaret Mahkemesi'nin 2 Nisan 2024 tarihli kararıyla iflasına hükmedilen Özmin Ltd. Şti. hakkında, daha sonra yapılan yeni alacak kayıtlarının değerlendirilmesi sonucu ek sıra cetveli hazırlandı. İcra ve İflas Kanunu'nun ilgili hükümleri doğrultusunda düzenlenen cetvel incelemeye açıldı. Öte yandan, Bursa 1. Asliye Ticaret Mahkemesi'nin 25 Aralık 2024 tarihli kararıyla iflasına karar verilen Wood Dizayn Ltd. Şti. için ise basit tasfiye kapsamında sıra cetveli ilan edildi. Şirkete ilişkin alacak kayıtlarının incelenmesinin ardından hazırlanan sıra cetveli de dosyada incelemeye hazır hale getirildi. İcra Dairesi tarafından yapılan ilanlara göre, alacağın esası ve miktarına ilişkin itirazlar ilan tarihinden itibaren 15 gün içinde Ticaret Mahkemesi'nde dava açılarak yapılabilecek. Sıraya ilişkin itirazlar ise 7 gün içinde İcra Hukuk Mahkemesi'ne şikâyet yoluyla taşınabilecek. Yayımlanan ilanlarla birlikte iki şirketin iflas dosyalarındaki alacaklılara yönelik hukuki süreçte yeni bir aşamaya geçilmiş oldu. Kaynak: Haber Merkezi Web sitemizden ayrılıyorsunuz Bu bağlantı sizi https://www.yildirimgazetesi.com dışındaki bir siteye yönlendiriyor. Sayfada Kal Devam Et 22:35 İnegöl'ün yeni Kaymakamı Ayhan Akpay'ın göreve başlayacağı tarih belli oldu 22:19 Bursa İnegöl'de suç makinesi yakalandı 22:00 Uzmanı uyardı: ""Düz çizgileri eğri görüyorsanız dikkat"" 21:53 Bursa İnegöl'de otomobil ile motosiklet çarpıştı! Genç sürücü hastanelik oldu 21:42 CHP Sözcüsü Zeynel Emre soruları yanıtladı: Yeni partinin ismi ve tarihi belli mi? 21:27 İnegölspor'un rakibi Altınordu FK Lig'den çekildi 21:09 Bursa Osmangazi'de takla atan araçtan burunları kanamadan çıktılar 20:56 Jandarma 19 yıllık cinayet dosyasını çözdü! 20:27 Bursa İnegöl'de iflas eden iki firma için yeni süreç başladı! 20:00 Bursa Mudanya'da akıma kapılarak ölen genç için hüzünlü veda 19:40 Bursa Nilüfer'de alacak-verecek tartışması sonrası eve ateş açıp kaçtılar 19:15 Yaz sıcakları kalp sağlığını tehdit ediyor Bursa İnegöl'de iflas eden iki firma için yeni süreç başladı! İnegöl'de daha önce iflasına karar verilen iki şirketle ilgili yargı sürecinde yeni gelişme yaşandı. İcra Dairesi, biri için ek sıra cetvelini, diğeri için ise basit tasfiyede sıra cetvelini ilan etti. İnegöl'de faaliyet gösterirken iflas eden iki şirketle ilgili hukuki süreçte yeni bir aşamaya geçildi. İnegöl İcra Dairesi tarafından yayımlanan ilanlarda, Özmin Nakliye Ambalaj İnşaat Taahhüt Taşımacılık Gıda Tarım Hayvancılık Sanayi ve Ticaret Ltd. Şti. ile Wood Dizayn Orman Ürünleri Akaryakıt İnşaat Turizm Gıda Otomotiv Nakliyat Tekstil Mobilya Lojistik Sanayi ve Ticaret Ltd. Şti. hakkında sıra cetveli ilanları yayımlandı. Bursa 1. Asliye Ticaret Mahkemesi'nin 2 Nisan 2024 tarihli kararıyla iflasına hükmedilen Özmin Ltd. Şti. hakkında, daha sonra yapılan yeni alacak kayıtlarının değerlendirilmesi sonucu ek sıra cetveli hazırlandı. İcra ve İflas Kanunu'nun ilgili hükümleri doğrultusunda düzenlenen cetvel incelemeye açıldı. Öte yandan, Bursa 1. Asliye Ticaret Mahkemesi'nin 25 Aralık 2024 tarihli kararıyla iflasına karar verilen Wood Dizayn Ltd. Şti. için ise basit tasfiye kapsamında sıra cetveli ilan edildi. Şirkete ilişkin alacak kayıtlarının incelenmesinin ardından hazırlanan sıra cetveli de dosyada incelemeye hazır hale getirildi. İcra Dairesi tarafından yapılan ilanlara göre, alacağın esası ve miktarına ilişkin itirazlar ilan tarihinden itibaren 15 gün içinde Ticaret Mahkemesi'nde dava açılarak yapılabilecek. Sıraya ilişkin itirazlar ise 7 gün içinde İcra Hukuk Mahkemesi'ne şikâyet yoluyla taşınabilecek. Yayımlanan ilanlarla birlikte iki şirketin iflas dosyalarındaki alacaklılara yönelik hukuki süreçte yeni bir aşamaya geçilmiş oldu. Bu bağlantı sizi https://www.yildirimgazetesi.com dışındaki bir siteye yönlendiriyor.","Bursa İnegöl'de iflas eden iki firma için yeni süreç başladı! Bursa İnegöl'de iflas eden iki firma için yeni süreç başladı! Yıldırım Gazetesi İnegöl'de daha önce iflasına karar verilen iki şirketle ilgili yargı sürecinde yeni gelişme yaşandı. İcra Dairesi, biri için ek sıra cetvelini, diğeri için ise basit tasfiyede sıra cetvelini ilan etti. İnegöl'de faaliyet gösterirken iflas eden iki şirketle ilgili hukuki süreçte yeni bir aşamaya geçildi. İnegöl İcra Dairesi tarafından yayımlanan ilanlarda, Özmin Nakliye Ambalaj İnşaat Taahhüt Taşımacılık Gıda Tarım Hayvancılık Sanayi ve Ticaret Ltd. Şti. ile Wood Dizayn Orman Ürünleri Akaryakıt İnşaat Turizm Gıda Otomotiv Nakliyat Tekstil Mobilya Lojistik Sanayi ve Ticaret Ltd. Şti. hakkında sıra cetveli ilanları yayımlandı. Asliye Ticaret Mahkemesi'nin 2 Nisan 2024 tarihli kararıyla iflasına hükmedilen Özmin Ltd. Şti. hakkında, daha sonra yapılan yeni alacak kayıtlarının değerlendirilmesi sonucu ek sıra cetveli hazırlandı. İcra ve İflas Kanunu'nun ilgili hükümleri doğrultusunda düzenlenen cetvel incelemeye açıldı. Asliye Ticaret Mahkemesi'nin 25 Aralık 2024 tarihli kararıyla iflasına karar verilen Wood Dizayn Ltd. Şti. için ise basit tasfiye kapsamında sıra cetveli ilan edildi. Şirkete ilişkin alacak kayıtlarının incelenmesinin ardından hazırlanan sıra cetveli de dosyada incelemeye hazır hale getirildi. İcra Dairesi tarafından yapılan ilanlara göre, alacağın esası ve miktarına ilişkin itirazlar ilan tarihinden itibaren 15 gün içinde Ticaret Mahkemesi'nde dava açılarak yapılabilecek. Sıraya ilişkin itirazlar ise 7 gün içinde İcra Hukuk Mahkemesi'ne şikâyet yoluyla taşınabilecek. Yayımlanan ilanlarla birlikte iki şirketin iflas dosyalarındaki alacaklılara yönelik hukuki süreçte yeni bir aşamaya geçilmiş oldu. Sayfada Kal Devam Et 22:35 İnegöl'ün yeni Kaymakamı Ayhan Akpay'ın göreve başlayacağı tarih belli oldu 22:19 Bursa İnegöl'de suç makinesi yakalandı 22:00 Uzmanı uyardı: ""Düz çizgileri eğri görüyorsanız dikkat"" 21:53 Bursa İnegöl'de otomobil ile motosiklet çarpıştı! 21:27 İnegölspor'un rakibi Altınordu FK Lig'den çekildi 21:09 Bursa Osmangazi'de takla atan araçtan burunları kanamadan çıktılar 20:56 Jandarma 19 yıllık cinayet dosyasını çözdü! 20:27 Bursa İnegöl'de iflas eden iki firma için yeni süreç başladı! 20:00 Bursa Mudanya'da akıma kapılarak ölen genç için hüzünlü veda 19:40 Bursa Nilüfer'de alacak-verecek tartışması sonrası eve ateş açıp kaçtılar 19:15 Yaz sıcakları kalp sağlığını tehdit ediyor Bursa İnegöl'de iflas eden iki firma için yeni süreç başladı!",browser_full_article,https://www.yildirimgazetesi.com/bursa-inegolde-iflas-eden-iki-firma-icin-yeni-surec-basladi,Bursa,İnegöl | Mudanya | Nilüfer | Osmangazi,,,,Özmin Ltd. Şti | Wood Dizayn Ltd. Şti,Özmin Ltd. Şti:73:body | Özmin Ltd. Şti:raw_legal | Wood Dizayn Ltd. Şti:raw_legal,faaliyet/tesis yok,Özmin Ltd. Şti İnegöl Bursa Türkiye | Wood Dizayn Ltd. Şti İnegöl Bursa Türkiye,KOI WOOD | WOODLENT ORMAN URN. SAN. TİC. LTD. STI | Alya dizayn | İnwood Chair,KOI WOOD,firma adı + güvenli maps adayı var,66.66666666666666 | 70.0 | 70.58823529411765 | 50.0,Kale - Yıldız İnşaat | MY DESİGN-SAVAŞ TURAN,191.85,18
2026-07-02 07:59:00,konkordato,İflas / Konkordato / Mali Sorun,Gaziantep'in Yarım Asırlık Sanayi Devi Konkordato İlan Etti,Gaziantep'in Yarım Asırlık Sanayi Devi Konkordato İlan Etti Haber 342,https://news.google.com/rss/articles/CBMinwFBVV95cUxQN0FnZWp4eXZadnJLRHVTdkJscno1YWl4M0hoMTBXVGoxdmRPYU50SW13MDg0blRmZEM0Y1pZQ2kxM1V2VmV3NV9KZUJ0QUg5bnk1MnlWM3N0QXpjcjVCWTg3YS1KSFU2UjBqSkY2RFNaOWFrbF95YklZVHhHaTdyTnI3V1hfdEwyb01lZkhVWWdpSzF0TGI3ZkNtdHp5Mk3SAaQBQVVfeXFMUDNOZUlGV2NnM3dDY2pKdlhfQWF2YVFNbGdUSEJRb05iWlFiZFBKSzVmb2ppWVVGQjJKaHlfMUlMT2NyWGljdXRCVmlCcWVlaUQ5a1cxUGdIaXV6TDJMaG5mb2FoRjd6cGpma015N3B1b2RqMDlPa3otMktEdDRlU2VNMnlEMHNKX2RCY0NyQ3daWG1ORm1FMW9WSWxmdXozOE0zU2Y?oc=5,sanayi,,"Gaziantep sanayisinin yarım asırlık çınarlarından biri ekonomik darboğaza girdi. Gaziantep Organize Sanayi Bölgesi'nin en eski ve en köklü k... Gaziantep sanayisinin yarım asırlık çınarlarından biri ekonomik darboğaza girdi. Gaziantep Organize Sanayi Bölgesi'nin en eski ve en köklü kuruluşları arasında... Gaziantep sanayisinin yarım asırlık çınarlarından biri ekonomik darboğaza girdi. Gaziantep Organize Sanayi Bölgesi'nin en eski ve en köklü k... Gaziantep sanayisinin yarım asırlık çınarlarından biri ekonomik darboğaza girdi. Gaziantep Organize Sanayi Bölgesi'nin en eski ve en köklü kuruluşları arasında yer alan Boyar Kimya ile aynı grup bünyesindeki Boyar Tekstil için mahkeme tarafından konkordato kapsamında 1 yıllık kesin mühlet kararı verildi. Gaziantep Organize Sanayi Bölgesi'nin en eski ve köklü firmalarından biri olan Boyar Kimya ile Boyar Tekstil, yaşanan ekonomik sıkıntılar nedeniyle konkordato sürecine girdi. Mahkeme, yarım asrı aşkın süredir tekstil sektöründe faaliyet gösteren iki şirket hakkında 1 yıllık kesin mühlet kararı verdi. Karar kapsamında şirketlerin mali yapılarının yeniden düzenlenmesi ve faaliyetlerini sürdürebilmeleri için yasal koruma süreci başlatıldı. Konkordato kararı yalnızca şirketleri değil, şirket ortakları Ayberk Uygun, Hasan Metin Özkargın, Tuba Bozbaş ve Hüseyin Murat Özkargın'ı da kapsadı. Gaziantep sanayisinin önemli üreticileri arasında yer alan ve uzun yıllardır Organize Sanayi Bölgesi'nde faaliyet gösteren şirketlerle ilgili gelişme, iş dünyasında da geniş yankı uyandırdı. # gaziantep 02 Tem 2026 - 10:59 - Ekonomi Gaziantep'in Yarım Asırlık Sanayi Devi Konkordato İlan Etti Gaziantep sanayisinin yarım asırlık çınarlarından biri ekonomik darboğaza girdi. Gaziantep Organize Sanayi Bölgesi'nin en eski ve en köklü kuruluşları arasında yer alan Boyar Kimya ile aynı grup bünyesindeki Boyar Tekstil için mahkeme tarafından konkordato kapsamında 1 yıllık kesin mühlet kararı verildi. Gaziantep sanayisinin yarım asırlık çınarlarından biri ekonomik darboğaza girdi. Gaziantep Organize Sanayi Bölgesi'nin en eski ve en köklü kuruluşları arasında yer alan Boyar Kimya ile aynı grup bünyesindeki Boyar Tekstil için mahkeme tarafından konkordato kapsamında 1 yıllık kesin mühlet kararı verildi. Gaziantep Organize Sanayi Bölgesi'nin en eski ve köklü firmalarından biri olan Boyar Kimya ile Boyar Tekstil, yaşanan ekonomik sıkıntılar nedeniyle konkordato sürecine girdi. Mahkeme, yarım asrı aşkın süredir tekstil sektöründe faaliyet gösteren iki şirket hakkında 1 yıllık kesin mühlet kararı verdi. Karar kapsamında şirketlerin mali yapılarının yeniden düzenlenmesi ve faaliyetlerini sürdürebilmeleri için yasal koruma süreci başlatıldı. Konkordato kararı yalnızca şirketleri değil, şirket ortakları Ayberk Uygun, Hasan Metin Özkargın, Tuba Bozbaş ve Hüseyin Murat Özkargın'ı da kapsadı. Gaziantep sanayisinin önemli üreticileri arasında yer alan ve uzun yıllardır Organize Sanayi Bölgesi'nde faaliyet gösteren şirketlerle ilgili gelişme, iş dünyasında da geniş yankı uyandırdı. # gaziantep 02 Tem 2026 - 10:59 - Ekonomi Yazdır GİRİŞ YAP Yorum yazarak Haber Gazetesi Topluluk Kuralları’nı kabul etmiş bulunuyor ve yorumunuzla ilgili doğrudan veya dolaylı tüm sorumluluğu tek başınıza üstleniyorsunuz. Yazılan yor","Gaziantep'in Yarım Asırlık Sanayi Devi Konkordato İlan Etti Gaziantep'in Yarım Asırlık Sanayi Devi Konkordato İlan Etti Haber 342 Gaziantep sanayisinin yarım asırlık çınarlarından biri ekonomik darboğaza girdi. Gaziantep Organize Sanayi Bölgesi'nin en eski ve en köklü k... Gaziantep Organize Sanayi Bölgesi'nin en eski ve en köklü kuruluşları arasında... Gaziantep Organize Sanayi Bölgesi'nin en eski ve en köklü kuruluşları arasında yer alan Boyar Kimya ile aynı grup bünyesindeki Boyar Tekstil için mahkeme tarafından konkordato kapsamında 1 yıllık kesin mühlet kararı verildi. Gaziantep Organize Sanayi Bölgesi'nin en eski ve köklü firmalarından biri olan Boyar Kimya ile Boyar Tekstil, yaşanan ekonomik sıkıntılar nedeniyle konkordato sürecine girdi. Mahkeme, yarım asrı aşkın süredir tekstil sektöründe faaliyet gösteren iki şirket hakkında 1 yıllık kesin mühlet kararı verdi. Karar kapsamında şirketlerin mali yapılarının yeniden düzenlenmesi ve faaliyetlerini sürdürebilmeleri için yasal koruma süreci başlatıldı. Konkordato kararı yalnızca şirketleri değil, şirket ortakları Ayberk Uygun, Hasan Metin Özkargın, Tuba Bozbaş ve Hüseyin Murat Özkargın'ı da kapsadı. Gaziantep sanayisinin önemli üreticileri arasında yer alan ve uzun yıllardır Organize Sanayi Bölgesi'nde faaliyet gösteren şirketlerle ilgili gelişme, iş dünyasında da geniş yankı uyandırdı. # gaziantep 02 Tem 2026 - 10:59 - Ekonomi Gaziantep'in Yarım Asırlık Sanayi Devi Konkordato İlan Etti Gaziantep sanayisinin yarım asırlık çınarlarından biri ekonomik darboğaza girdi. # gaziantep 02 Tem 2026 - 10:59 - Ekonomi Yazdır GİRİŞ YAP Yorum yazarak Haber Gazetesi Topluluk Kuralları’nı kabul etmiş bulunuyor ve yorumunuzla ilgili doğrudan veya dolaylı tüm sorumluluğu tek başınıza üstleniyorsunuz.",browser_full_article,https://www.haber342.com/haber/28270012/gaziantepin-yarim-asirlik-sanayi-devi-konkordato-ilan-etti,Gaziantep,,Gaziantep Organize Sanayi,,,Yarım Asırlık Sanayi,Yarım Asırlık Sanayi:292:body+summary+title,ilçe yok | faaliyet/tesis yok,Yarım Asırlık Sanayi Gaziantep Organize Sanayi Gaziantep Türkiye,Organize Sanayi 1. Kısım,Organize Sanayi 1. Kısım,firma adı + güvenli maps adayı var,55.81395348837209,,207.75,19
2026-07-01 21:10:00,konkordato,İflas / Konkordato / Mali Sorun,Uşak’ta bir şirket hakkında konkordato kararı verildi,Uşak’ta bir şirket hakkında konkordato kararı verildi yesilsivasligazetesi.com,https://news.google.com/rss/articles/CBMikwFBVV95cUxQRVRWQ19nMWpzRzlfakdTVW1QaU9QWkctem5yUFZOMm9TS0ZmVjRHMzRRMFVkSG5oUGtPcVh4eHFBN21aVGt6QU8zaWZBNXVwZ1dDbS1kV0xqckVLcHI0ek5iMXBoeE1kb0kzYkxkZUFkb2dXbTBHdWtFRHNTSXFCVWExRUE0dHF3ZFVNTWpUaGtnUmc?oc=5,şirket,şirket / firma,"Uşak 4. Asliye Hukuk Mahkemesi, Ercan Aydınlatma Elektrik Ticaret Anonim Şirketi hakkında 3 ay geçici mühlet kararı verdi. Uşak 4. Asliye Hukuk Mahkemesi, Ercan Aydınlatma Elektrik Ticaret Anonim Şirketi hakkında 3 ay geçici mühlet kararı verdi. Uşak 4. Asliye Hukuk Mahkemesi, Ercan Aydınlatma Elektrik Ticaret Anonim Şirketi hakkında 3 ay geçici mühlet kararı verdi. Gündem Uşak’ta bir şirket hakkında konkordato kararı verildi Uşak 4. Asliye Hukuk Mahkemesi, Ercan Aydınlatma Elektrik Ticaret Anonim Şirketi hakkında 3 ay geçici mühlet kararı verdi. Paylaş Linkedin Pinterest Telegram Yazdır Kopyala A - A + Seher ZEYBEK 02.07.2026 - 00:10 “Uşak’ın altını ve suyu gitti sıra ormanlarına mı geldi?” İçeriği Görüntüle Uşak 4. Asliye Hukuk Mahkemesi, bir şirket ve ilgililer hakkında 3 ay süreyle geçici mühlet kararı verdi. Alacaklılara ise 7 gün içinde itiraz hakkı tanındı. Uşak 4. Asliye Hukuk Mahkemesi (Asliye Ticaret Mahkemesi sıfatıyla), kentte faaliyet gösteren Ercan Aydınlatma Elektrik Ticaret Anonim Şirketi ve ilgili kişiler hakkında geçici mühlet kararı verdi. Mahkeme kararına göre, 26 Haziran 2026 tarihinden itibaren geçerli olmak üzere 3 ay süreyle geçici mühlet uygulanmasına hükmedildi. Kararla birlikte alacaklılara da yasal hak tanındı. İlan tarihinden itibaren 7 gün içinde mahkemeye itiraz edilebileceği bildirildi. Kaynak: Haber Merkezi Editörün Seçtiği Uşak’ta kaza kazayı getirdi: çok sayıda kişi yaralandı Editörün Seçtiği Zorunlu kış lastiği uygulamasında yeni karar Editörün Seçtiği Domates Suyu Yapmanın Püf Noktaları Editör Hakkında Seher ZEYBEK Bu","Uşak’ta bir şirket hakkında konkordato kararı verildi Uşak’ta bir şirket hakkında konkordato kararı verildi yesilsivasligazetesi.com Asliye Hukuk Mahkemesi, Ercan Aydınlatma Elektrik Ticaret Anonim Şirketi hakkında 3 ay geçici mühlet kararı verdi. Gündem Uşak’ta bir şirket hakkında konkordato kararı verildi Uşak 4.",browser_full_article,https://www.yesilsivasligazetesi.com/usakita-bi-sirket-hakkinda-konkordato-karari-verildi,Uşak,,,,,Ercan Aydınlatma Elektrik Ticaret Anonim Şirketi,Ercan Aydınlatma Elektrik Ticaret Anonim Şirketi:60:body | Ercan Aydınlatma Elektrik Ticaret Anonim Şirketi:raw_legal,ilçe yok | faaliyet/tesis yok,Ercan Aydınlatma Elektrik Ticaret Anonim Şirketi Uşak Türkiye,Ercan Aydınlatma,Ercan Aydınlatma,firma adı + güvenli maps adayı var,100.0,,157.0,20
