published,search_term,category,title,summary,link,matched_words,activity_type,raw_text,entity_source_text,article_fetch_status,resolved_article_url,city_candidates,district_candidates,neighborhood_candidates,street_candidates,facility_candidates,company_candidates,company_candidate_scores,entity_quality_note,maps_queries,maps_candidates,maps_best_guess,maps_status,maps_match_scores,maps_rejected_candidates,record_quality_score,duplicate_group_id
2026-07-07 13:15:10,fabrika yangını,Fiziksel Risk / Yangın,"Kocaeli'de boya fabrikasında çıkan yangında 1 kişi öldü, 2 kişi dumandan etkilendi (GÜNCELLEME)","Kocaeli'de boya fabrikasında çıkan yangında 1 kişi öldü, 2 kişi dumandan etkilendi (GÜNCELLEME) ensondakika.com.tr",https://news.google.com/rss/articles/CBMi2AFBVV95cUxQYjN0cEJaWDBJbEVMekZlbTFjYjd2YW41Z3lTQmhKQTktdGFLYklaNUw4bG9tcVB5clp0NWphQWFRZXNFUHJMMTNFaEEzRzlOamVRTE0xT0R6clYzSGwySWkwZ1VIVk1PaVA0emdPVjM3d2VYWTdnRjN3cURkZXhXa05OZXpDVGF6Ml9sM2pBV2JxSklSY2JIQUQ2bzZYYV9vTmxldmdndFJVTVc1d3VXZ0FQamc2Wm1kSEVmZFRidmlxUFJpdUdLd3FLekdqc2FGWWRSckxaeXXSAdgBQVVfeXFMUGIzdHBCWlgwSWxFTHpGZW0xY2I3dmFuNWd5U0JoSkE5LXRhS2JJWjVMOGxvbXFQeXJadDVqYUFhUWVzRVByTDEzRWhBM0c5TmplUUxNMU9EenJWM0hsMklpMGdVSFZNT2lQNHpnT1YzN3dlWFk3Z0Yzd3FEZGV4V2tOTmV6Q1RhejJfbDNqQVdicUpJUmNiSEFENm82WGFfb05sZXZnZ3RSVU1XNXd1V2dBUGpnNlptZEhFZmRUYnZpcVBSaXVHS3dxS3pHanNhRllkUnJMWnl1?oc=5,fabrika,fabrika,"Paylaş Tweetle Whatsapp Telegram Diyarbakır'da bir apartmanda çıkan yangında 1 kişi dumandan etkilendi 07 Temmuz 2026 - 16:15 - Güncelleme: 07 Temmuz 2026 - 17:45 TAKİP ET Diyarbakır - Diyarbakır'ın merkez Yenişehir ilçesinde apartman dairesinde çıkan yangında 1 kişi dumandan etkilendi. Diyarbakır Haberleri - Diyarbakır'ın merkez Yenişehir ilçesinde apartman dairesinde çıkan yangında 1 kişi dumandan etkilendi. Fabrika Mahallesi'nde bir sitedeki 13 katlı apartmanın 6'ncı katında bulunan dairede henüz belirlenemeyen nedenle yangın çıktı. İhbar üzerine bölgeye 112 Acil Sağlık, itfaiye ve polis ekipleri sevk edildi. İtfaiye ekiplerince söndürülen yangında, ev kullanılmaz hale geldi. Dumandan etkilenen bir kişiye ambulansta müdahale edildi. Fabrika Yangını Kocaeli Diyarbakır'da bir apartmanda çıkan yangında 1 kişi dumandan etkilendi İlginizi Çekebilecek Haberler Diyarbakır - Diyarbakır'ın merkez Yenişehir ilçesinde apartman dairesinde çıkan yangında 1 kişi dumandan etkilendi. Diyarbakır Haberleri - Diyarbakır'ın merkez Yenişehir ilçesinde apartman dairesinde çıkan yangında 1 kişi dumandan etkilendi. Fabrika Mahallesi'nde bir sitedeki 13 katlı apartmanın 6'ncı katında bulunan dairede henüz belirlenemeyen nedenle yangın çıktı. İhbar üzerine bölgeye 112 Acil Sağlık, itfaiye ve polis ekipleri sevk edildi. İtfaiye ekiplerince söndürülen yangında, ev kullanılmaz hale geldi. Dumandan etkilenen bir kişiye ambulansta müdahale edildi. En son da","Kocaeli'de boya fabrikasında çıkan yangında 1 kişi öldü, 2 kişi dumandan etkilendi (GÜNCELLEME) Kocaeli'de boya fabrikasında çıkan yangında 1 kişi öldü, 2 kişi dumandan etkilendi (GÜNCELLEME) ensondakika.com.tr Paylaş Tweetle Whatsapp Telegram Diyarbakır'da bir apartmanda çıkan yangında 1 kişi dumandan etkilendi 07 Temmuz 2026 - 16:15 - Güncelleme: 07 Temmuz 2026 - 17:45 TAKİP ET Diyarbakır - Diyarbakır'ın merkez Yenişehir ilçesinde apartman dairesinde çıkan yangında 1 kişi dumandan etkilendi. Diyarbakır Haberleri - Diyarbakır'ın merkez Yenişehir ilçesinde apartman dairesinde çıkan yangında 1 kişi dumandan etkilendi. Fabrika Mahallesi'nde bir sitedeki 13 katlı apartmanın 6'ncı katında bulunan dairede henüz belirlenemeyen nedenle yangın çıktı. İhbar üzerine bölgeye 112 Acil Sağlık, itfaiye ve polis ekipleri sevk edildi. İtfaiye ekiplerince söndürülen yangında, ev kullanılmaz hale geldi. Dumandan etkilenen bir kişiye ambulansta müdahale edildi. Fabrika Yangını Kocaeli Diyarbakır'da bir apartmanda çıkan yangında 1 kişi dumandan etkilendi İlginizi Çekebilecek Haberler Diyarbakır - Diyarbakır'ın merkez Yenişehir ilçesinde apartman dairesinde çıkan yangında 1 kişi dumandan etkilendi.",browser_full_article_dom,https://news.google.com/rss/articles/CBMi2AFBVV95cUxQYjN0cEJaWDBJbEVMekZlbTFjYjd2YW41Z3lTQmhKQTktdGFLYklaNUw4bG9tcVB5clp0NWphQWFRZXNFUHJMMTNFaEEzRzlOamVRTE0xT0R6clYzSGwySWkwZ1VIVk1PaVA0emdPVjM3d2VYWTdnRjN3cURkZXhXa05OZXpDVGF6Ml9sM2pBV2JxSklSY2JIQUQ2bzZYYV9vTmxldmdndFJVTVc1d3VXZ0FQamc2Wm1kSEVmZFRidmlxUFJpdUdLd3FLekdqc2FGWWRSckxaeXXSAdgBQVVfeXFMUGIzdHBCWlgwSWxFTHpGZW0xY2I3dmFuNWd5U0JoSkE5LXRhS2JJWjVMOGxvbXFQeXJadDVqYUFhUWVzRVByTDEzRWhBM0c5TmplUUxNMU9EenJWM0hsMklpMGdVSFZNT2lQNHpnT1YzN3dlWFk3Z0Yzd3FEZGV4V2tOTmV6Q1RhejJfbDNqQVdicUpJUmNiSEFENm82WGFfb05sZXZnZ3RSVU1XNXd1V2dBUGpnNlptZEhFZmRUYnZpcVBSaXVHS3dxS3pHanNhRllkUnJMWnl1?oc=5&hl=tr&gl=TR&ceid=TR:tr,Diyarbakır | Kocaeli | Bursa | Mersin,Yenişehir,Fabrika Mahallesi,,,,,firma yok | faaliyet/tesis yok,,,,maps araması yapılmadı,,,156.53,11
2026-07-08 10:54:00,nitelikli dolandırıcılık,Operasyon / Soruşturma / Suç,BOLU’DA USULSÜZ KREDİ SORUŞTURMASINDA YENİ GELİŞME: BANKA MÜDÜRÜ GÖZALTINDA,BOLU’DA USULSÜZ KREDİ SORUŞTURMASINDA YENİ GELİŞME: BANKA MÜDÜRÜ GÖZALTINDA Özgür Bolu,https://news.google.com/rss/articles/CBMisAFBVV95cUxQYkVxU2tEU3YyYVE1WXN3VXJkZ1k4V3hJd2RaQVJheFRnb0lYRVBub3hrWmZ0X2drX2dfSTZyVmtaeFRKaFExS3Z0NWFWaHNrc2RCTDhwSldKVEFnX00waGRCUFFiV0I1OEdIR09RNjFEX0ZFNWZ5OWxlaHlGSFVvZndOVFpBSUc3anRiTFJYT3YxOHpLYmxTNXpiekkzeHMwYkVWNmV5bHBrdVdHN3RXVw?oc=5,banka,finansal kuruluş,BOLU’DA USULSÜZ KREDİ SORUŞTURMASINDA YENİ GELİŞME: BANKA MÜDÜRÜ GÖZALTINDA Özgür Bolu,BOLU’DA USULSÜZ KREDİ SORUŞTURMASINDA YENİ GELİŞME: BANKA MÜDÜRÜ GÖZALTINDA BOLU’DA USULSÜZ KREDİ SORUŞTURMASINDA YENİ GELİŞME: BANKA MÜDÜRÜ GÖZALTINDA Özgür Bolu BOLU’DA USULSÜZ KREDİ SORUŞTURMASINDA YENİ GELİŞME: BANKA MÜDÜRÜ GÖZALTINDA Özgür Bolu,browser_failed,https://news.google.com/rss/articles/CBMisAFBVV95cUxQYkVxU2tEU3YyYVE1WXN3VXJkZ1k4V3hJd2RaQVJheFRnb0lYRVBub3hrWmZ0X2drX2dfSTZyVmtaeFRKaFExS3Z0NWFWaHNrc2RCTDhwSldKVEFnX00waGRCUFFiV0I1OEdIR09RNjFEX0ZFNWZ5OWxlaHlGSFVvZndOVFpBSUc3anRiTFJYT3YxOHpLYmxTNXpiekkzeHMwYkVWNmV5bHBrdVdHN3RXVw?oc=5&hl=tr&gl=TR&ceid=TR:tr,Bolu,,,,,,,ilçe yok | firma yok | faaliyet/tesis yok,,,,maps araması yapılmadı,,,75.86,12
2026-07-08 08:24:00,mali kriz,İflas / Konkordato / Mali Sorun,2 milyar dolarlık borç krizi: Dev telekom şirketi iflas etti! Mobil şebeke faaliyetleri tamamen durdurulacak,2 milyar dolarlık borç krizi: Dev telekom şirketi iflas etti! Mobil şebeke faaliyetleri tamamen durdurulacak babaocagi.com.tr,https://news.google.com/rss/articles/CBMi1gFBVV95cUxOU0xSbTZnb2dGSzdnOHlyak1pbElRQXNhazBrSm1PSmFxSHAySGFnRXo2eFRmSzE3NG9CVWtXcm1fblRiSHlnSmRfRV9PRC1KSGc1U21VM29Va3o1MkZGcXAtN05SMUZLeURoZFRVRHRCdElqWVhJemoyX19tcmdxTDZsamRnT2tqNW5CR21jMWJkY0ZpTUtCbjJpWXlNa3JTb24zZlJnZ0RSRnpBSU5fbXlnRHVveWxoamowTV9uSXJjRXY5VzEyVm00eEZPRjEtRE9UR2l30gHWAUFVX3lxTE5TTFJtNmdvZ0ZLN2c4eXJqTWlsSVFBc2FrMGtKbU9KYXFIcDJIYWdFejZ4VGZLMTc0b0JVa1dybV9uVGJIeWdKZF9FX09ELUpIZzVTbVUzb1VrejUyRkZxcC03TlIxRkt5RGhkVFVEdEJ0SWpZWEl6ajJfX21yZ3FMNmxqZGdPa2o1bkJHbWMxYmRjRmlNS0JuMmlZeU1rclNvbjNmUmdnRFJGekFJTl9teWdEdW95bGhqajBNX25JcmNFdjlXMTJWbTR4Rk9GMS1ET1RHaXc?oc=5,şirket,şirket / firma,"Ekonomi 2 milyar dolarlık borç krizi: Dev telekom şirketi iflas etti! Mobil şebeke faaliyetleri tamamen durdurulacak ABD merkezli telekomünikasyon şirketi Dish Wireless, vadesi gelen milyar dolarlık borcunu ödeyemeyerek resmen iflas koruma (Chapter 11) sürecine girdi. Dev frekans satış takvimindeki gecikmeler nedeniyle nakit sıkışıklığı yaşayan şirket, yeniden yapılandırma planı kapsamında mobil operatörlük faaliyetlerini tamamen sonlandıracağını duyurdu. 08.07.2026 - 11:24 08.07.2026 - 11:24 ABD merkezli telekomünikasyon şirketi Dish Wireless, yaşadığı finansal sıkıntılar nedeniyle resmi olarak iflas koruma sürecine girdi. Şirket, yeniden yapılandırma planı kapsamında mobil operatörlük faaliyetlerini sonlandıracağını açıkladı. Dish Wireless ile çatı kuruluşu Dish DBS, 30 Haziran itibarıyla Chapter 11 kapsamında iflas koruma başvurusunda bulundu. Böylece şirketin uzun süredir büyütmeye çalıştığı mobil şebeke operatörlüğü girişimi de sona erme sürecine girmiş oldu. 2 MİLYAR DOLARLIK BORCUNU ÖDEYEMEDİ Şirketin mali krize sürüklenmesinde, 1 Temmuz'da vadesi gelen 2 milyar dolarlık borç ödemesini gerçekleştirememesi etkili oldu. Yaşanan nakit sıkışıklığı nedeniyle söz konusu yükümlülüğünü yerine getiremeyen şirket, finansal yeniden yapılandırma için mahkeme korumasına başvurdu. 23 MİLYAR DOLARLIK SATIŞ SÜRECİ GECİKTİ Öte yandan EchoStar'ın, AT&T ile yürüttüğü yaklaşık 23 milyar dolarlık frekans (spektrum) satışının planlanan takvimin gerisinde kalması da şirketin finansman arayışını olumsuz etkiledi. Beklenen kaynağın zamanında sağlanamaması, iflas koruma başvurusuna giden sürecin önemli nedenleri arasında yer aldı. MOBİL ŞEBEKE FAALİYETLERİ DURDURULACAK Yeniden yapılandırma planı kapsamında Dish Wireless'ın mobil şebeke işletmeciliği faaliyetleri tamamen sonlandırılacak. Buna karşın şirket bünyesinde faaliyet gösteren Boost Mobile ve Gen Mobile markaları hizmet vermeyi sürdürecek. DİJİTAL YAYIN HİZMETLERİ DEVAM EDECEK Şirketin televizyon ve dijital yayın tarafında faaliyet gösteren Dish TV ile Sling TV platformlarının ise iflas koruma sürecinden etkilenmeyeceği belirtildi. Her iki platformun da faaliyetlerine kesintisiz şekilde devam etmesinin planlandığı ifade edildi. Bunlar da ilg","2 milyar dolarlık borç krizi: Dev telekom şirketi iflas etti! Mobil şebeke faaliyetleri tamamen durdurulacak 2 milyar dolarlık borç krizi: Dev telekom şirketi iflas etti! Mobil şebeke faaliyetleri tamamen durdurulacak babaocagi.com.tr Ekonomi 2 milyar dolarlık borç krizi: Dev telekom şirketi iflas etti! Mobil şebeke faaliyetleri tamamen durdurulacak ABD merkezli telekomünikasyon şirketi Dish Wireless, vadesi gelen milyar dolarlık borcunu ödeyemeyerek resmen iflas koruma (Chapter 11) sürecine girdi. Dev frekans satış takvimindeki gecikmeler nedeniyle nakit sıkışıklığı yaşayan şirket, yeniden yapılandırma planı kapsamında mobil operatörlük faaliyetlerini tamamen sonlandıracağını duyurdu. 08.07.2026 - 11:24 08.07.2026 - 11:24 ABD merkezli telekomünikasyon şirketi Dish Wireless, yaşadığı finansal sıkıntılar nedeniyle resmi olarak iflas koruma sürecine girdi. Şirket, yeniden yapılandırma planı kapsamında mobil operatörlük faaliyetlerini sonlandıracağını açıkladı. Dish Wireless ile çatı kuruluşu Dish DBS, 30 Haziran itibarıyla Chapter 11 kapsamında iflas koruma başvurusunda bulundu. Böylece şirketin uzun süredir büyütmeye çalıştığı mobil şebeke operatörlüğü girişimi de sona erme sürecine girmiş oldu. 2 MİLYAR DOLARLIK BORCUNU ÖDEYEMEDİ Şirketin mali krize sürüklenmesinde, 1 Temmuz'da vadesi gelen 2 milyar dolarlık borç ödemesini gerçekleştirememesi etkili oldu. Yaşanan nakit sıkışıklığı nedeniyle söz konusu yükümlülüğünü yerine getiremeyen şirket, finansal yeniden yapılandırma için mahkeme korumasına başvurdu. 23 MİLYAR DOLARLIK SATIŞ SÜRECİ GECİKTİ Öte yandan EchoStar'ın, AT&T ile yürüttüğü yaklaşık 23 milyar dolarlık frekans (spektrum) satışının planlanan takvimin gerisinde kalması da şirketin finansman arayışını olumsuz etkiledi. Beklenen kaynağın zamanında sağlanamaması, iflas koruma başvurusuna giden sürecin önemli nedenleri arasında yer aldı. MOBİL ŞEBEKE FAALİYETLERİ DURDURULACAK Yeniden yapılandırma planı kapsamında Dish Wireless'ın mobil şebeke işletmeciliği faaliyetleri tamamen sonlandırılacak. Buna karşın şirket bünyesinde faaliyet gösteren Boost Mobile ve Gen Mobile markaları hizmet vermeyi sürdürecek. DİJİTAL YAYIN HİZMETLERİ DEVAM EDECEK Şirketin televizyon ve dijital yayın tarafında faaliyet gösteren Dish TV ile Sling TV platformlarının ise iflas koruma sürecinden etkilenmeyeceği belirtildi.",browser_full_article_dom,https://news.google.com/rss/articles/CBMi1gFBVV95cUxOU0xSbTZnb2dGSzdnOHlyak1pbElRQXNhazBrSm1PSmFxSHAySGFnRXo2eFRmSzE3NG9CVWtXcm1fblRiSHlnSmRfRV9PRC1KSGc1U21VM29Va3o1MkZGcXAtN05SMUZLeURoZFRVRHRCdElqWVhJemoyX19tcmdxTDZsamRnT2tqNW5CR21jMWJkY0ZpTUtCbjJpWXlNa3JTb24zZlJnZ0RSRnpBSU5fbXlnRHVveWxoamowTV9uSXJjRXY5VzEyVm00eEZPRjEtRE9UR2l30gHWAUFVX3lxTE5TTFJtNmdvZ0ZLN2c4eXJqTWlsSVFBc2FrMGtKbU9KYXFIcDJIYWdFejZ4VGZLMTc0b0JVa1dybV9uVGJIeWdKZF9FX09ELUpIZzVTbVUzb1VrejUyRkZxcC03TlIxRkt5RGhkVFVEdEJ0SWpZWEl6ajJfX21yZ3FMNmxqZGdPa2o1bkJHbWMxYmRjRmlNS0JuMmlZeU1rclNvbjNmUmdnRFJGekFJTl9teWdEdW95bGhqajBNX25JcmNFdjlXMTJWbTR4Rk9GMS1ET1RHaXc?oc=5&hl=tr&gl=TR&ceid=TR:tr,,,,,,,,il yok | ilçe yok | firma yok | faaliyet/tesis yok,,,,maps araması yapılmadı,,,116.25,13
2026-07-08 03:25:00,borç krizi,Banka / Finansal Kuruluş,ZAFER ÖZCİVAN: MERKEZ BANKALARININ “İLERİ YÖNLENDİRME” POLİTİKALARI,ZAFER ÖZCİVAN: MERKEZ BANKALARININ “İLERİ YÖNLENDİRME” POLİTİKALARI Haber Ekspres,https://news.google.com/rss/articles/CBMiigFBVV95cUxONmpoaDN2b3p5V1pZWHMyR2x0T0RDM0g0bXhhR0JlYVNRZUNpNGRydkwtalgtcklnS01sSkhuOWdnQUM0TEFabTBDUGNjc2wxaUlNSjVURWpVQkE2dF9PRWh0UVJ0R2pVM2d0SEtjYkF1RVYzcjZjWVJpa3RqZW83QjBXMHlCaWdITkE?oc=5,banka,finansal kuruluş,ZAFER ÖZCİVAN: MERKEZ BANKALARININ “İLERİ YÖNLENDİRME” POLİTİKALARI Haber Ekspres,ZAFER ÖZCİVAN: MERKEZ BANKALARININ “İLERİ YÖNLENDİRME” POLİTİKALARI ZAFER ÖZCİVAN: MERKEZ BANKALARININ “İLERİ YÖNLENDİRME” POLİTİKALARI Haber Ekspres ZAFER ÖZCİVAN: MERKEZ BANKALARININ “İLERİ YÖNLENDİRME” POLİTİKALARI Haber Ekspres,browser_failed,https://news.google.com/rss/articles/CBMiigFBVV95cUxONmpoaDN2b3p5V1pZWHMyR2x0T0RDM0g0bXhhR0JlYVNRZUNpNGRydkwtalgtcklnS01sSkhuOWdnQUM0TEFabTBDUGNjc2wxaUlNSjVURWpVQkE2dF9PRWh0UVJ0R2pVM2d0SEtjYkF1RVYzcjZjWVJpa3RqZW83QjBXMHlCaWdITkE?oc=5&hl=tr&gl=TR&ceid=TR:tr,,,,,,,,il yok | ilçe yok | firma yok | faaliyet/tesis yok,,,,maps araması yapılmadı,,,60.56,14
2026-07-08 05:00:56,iflas,İflas / Konkordato / Mali Sorun,Türkiye'nin ünlü tekstil firması iflas etti: Yıllardır çocuklar için üretiyordu,Türkiye'nin ünlü tekstil firması iflas etti: Yıllardır çocuklar için üretiyordu Yeni Şafak,https://news.google.com/rss/articles/CBMiwgFBVV95cUxOaG1YUDh3UlI0QS1XOFB3Y2hzVkx5WkNKQ2JIMFI5VDFwajQ3bk1pc0cyTzlyenl1cXJfWnRqVlNhODJGWndvOVV4WXFjZDhCMVdMNDdud0dFbXVGTEEzVmxBcjAzaHZFVUNkVmdqVVF0YjgtY3JlcGtjYXZjaTNzbHl5bldPZ0FMZ0hDQkVwaHMybU0wUm03LVl3ck90N1lWM2VhMzhhdHdrRHVvNnBsaS1oQl9xZF83ZlZfVkRUVXR4dw?oc=5,"firma, tekstil",şirket / firma,"Okul ve iş kıyafetleri üretimi yapan bir tekstil firması, konkordato sürecinden beklediği sonucu alamayınca iflas etti. Daha önce şirkete kesin mühlet verilmiş ve konkordato komiserleri görevlendirilmişti ancak yürütülen süreç şirketin mali yapısını kurtarmaya yetmedi. Okul ve iş kıyafetleri üretimi yapan bir tekstil firması, konkordato sürecinden beklediği sonucu alamayınca iflas etti. Daha önce şirkete kesin mühlet verilmiş ve konkordato komiserleri görevlendirilmişti ancak yürütülen süreç şirketin mali yapısını kurtarmaya yetmedi. Anasayfa Hayat Aktüel Türkiye'nin ünlü tekstil firması iflas etti: Yıllardır çocuklar için üretiyordu Türkiye'nin ünlü tekstil firması iflas etti: Yıllardır çocuklar için üretiyordu 08:00, 08/07/2026 , Çarşamba Yeni Şafak Yeni Şafak Haberlerini Daha Sık Gör: Tıkla ve Google'da Favorilere Ekle! Okul ve iş kıyafetleri üretimi yapan bir tekstil firması, konkordato sürecinden beklediği sonucu alamayınca iflas etti. Daha önce şirkete kesin mühlet verilmiş ve konkordato komiserleri görevlendirilmişti ancak yürütülen süreç şirketin mali yapısını kurtarmaya yetmedi. Mahkeme, konkordato sürecinin başarıyla sonuçlanmaması nedeniyle şirket hakkında iflas kararı verdi. Ekonomik sıkıntılar nedeniyle konkordato başvurusunda bulunan İzmir merkezli Cece Tekstil Medikal Sanayi ve Ticaret Limited Şirketi'nin hukuki süreci iflas kararıyla tamamlandı. Okul kıyafetleri ve iş kıyafetleri üretimi alanında faaliyet gösteren Cece Tekstil için daha önce mahkeme tarafından 1 yıllık kesin mühlet kararı verilmişti. Bu süreçte Bağımsız Denetçi Mali Müşavir Vahap Yıldırım geçici konkordato komiseri olarak görev yaparken, hukukçu Sevgi Kanyılmaz ile tekstil mühendisi Atilla Yıldırım da konkordato komiseri olarak atanmıştı. İFLAS SÜRECİ RESMEN BAŞLATILDI Mahkeme kararının ardından İzmir İflas Müdürlüğü tarafından iflas ilanı yayımlandı. Yayımlanan ilanda, iflas işlemlerinin resmen başlatıldığı belirtilirken, söz konusu ilanın 2004 sayılı İcra ve İflas Kanunu'nun 166'ncı maddesi kapsamında yayımlandığı ifade edildi. Başlıklar : türkiye tekstil tekstil firması iflası iflas konkordato Yorumla","Türkiye'nin ünlü tekstil firması iflas etti: Yıllardır çocuklar için üretiyordu Türkiye'nin ünlü tekstil firması iflas etti: Yıllardır çocuklar için üretiyordu Yeni Şafak Okul ve iş kıyafetleri üretimi yapan bir tekstil firması, konkordato sürecinden beklediği sonucu alamayınca iflas etti. Daha önce şirkete kesin mühlet verilmiş ve konkordato komiserleri görevlendirilmişti ancak yürütülen süreç şirketin mali yapısını kurtarmaya yetmedi. Anasayfa Hayat Aktüel Türkiye'nin ünlü tekstil firması iflas etti: Yıllardır çocuklar için üretiyordu Türkiye'nin ünlü tekstil firması iflas etti: Yıllardır çocuklar için üretiyordu 08:00, 08/07/2026 , Çarşamba Yeni Şafak Yeni Şafak Haberlerini Daha Sık Gör: Tıkla ve Google'da Favorilere Ekle! Mahkeme, konkordato sürecinin başarıyla sonuçlanmaması nedeniyle şirket hakkında iflas kararı verdi. Ekonomik sıkıntılar nedeniyle konkordato başvurusunda bulunan İzmir merkezli Cece Tekstil Medikal Sanayi ve Ticaret Limited Şirketi'nin hukuki süreci iflas kararıyla tamamlandı. Okul kıyafetleri ve iş kıyafetleri üretimi alanında faaliyet gösteren Cece Tekstil için daha önce mahkeme tarafından 1 yıllık kesin mühlet kararı verilmişti. Bu süreçte Bağımsız Denetçi Mali Müşavir Vahap Yıldırım geçici konkordato komiseri olarak görev yaparken, hukukçu Sevgi Kanyılmaz ile tekstil mühendisi Atilla Yıldırım da konkordato komiseri olarak atanmıştı. İFLAS SÜRECİ RESMEN BAŞLATILDI Mahkeme kararının ardından İzmir İflas Müdürlüğü tarafından iflas ilanı yayımlandı. Yayımlanan ilanda, iflas işlemlerinin resmen başlatıldığı belirtilirken, söz konusu ilanın 2004 sayılı İcra ve İflas Kanunu'nun 166'ncı maddesi kapsamında yayımlandığı ifade edildi. Başlıklar : türkiye tekstil tekstil firması iflası iflas konkordato Yorumla",browser_full_article,https://www.yenisafak.com/galeri/hayat/turkiyenin-unlu-tekstil-firmasi-iflas-etti-yillardir-cocuklar-icin-uretiyordu-4838659,İzmir | Bursa,Yıldırım,,,,Cece Tekstil Medikal Sanayi ve Ticaret Limited Şirketi,Cece Tekstil Medikal Sanayi ve Ticaret Limited Şirketi:raw_legal,faaliyet/tesis yok,Cece Tekstil Medikal Sanayi ve Ticaret Limited Şirketi Yıldırım İzmir Türkiye,Cece Tekstil,Cece Tekstil,firma adı + güvenli maps adayı var,100.0,,197.0,15
2026-07-08 05:57:00,iflas,İflas / Konkordato / Mali Sorun,Okul kıyafetleri satıyordu… İzmirli firma iflas etti,Okul kıyafetleri satıyordu… İzmirli firma iflas etti İz Gazete,https://news.google.com/rss/articles/CBMiggFBVV95cUxPR2lLSVdDRXVnOGFIZzUybkxhcUNjY1hWLWhHZEhvaWdpMjA2bWFoSTYtRGwxSkZ4czlXcl8zOVg2MEJEZUktYjhKdFMwaGhiUmItWkJVSjdBYkRxM3VqdjhpRUJhWVAteFpqUDRlaFJ3MFVDaU4xYUF2SmZ1eGI1Ylh3?oc=5,firma,şirket / firma,Okul kıyafetleri satıyordu… İzmirli firma iflas etti İz Gazete,Okul kıyafetleri satıyordu… İzmirli firma iflas etti Okul kıyafetleri satıyordu… İzmirli firma iflas etti İz Gazete Okul kıyafetleri satıyordu… İzmirli firma iflas etti İz Gazete,browser_failed,https://news.google.com/rss/articles/CBMiggFBVV95cUxPR2lLSVdDRXVnOGFIZzUybkxhcUNjY1hWLWhHZEhvaWdpMjA2bWFoSTYtRGwxSkZ4czlXcl8zOVg2MEJEZUktYjhKdFMwaGhiUmItWkJVSjdBYkRxM3VqdjhpRUJhWVAteFpqUDRlaFJ3MFVDaU4xYUF2SmZ1eGI1Ylh3?oc=5&hl=tr&gl=TR&ceid=TR:tr,,,,,,,,il yok | ilçe yok | firma yok | faaliyet/tesis yok,,,,maps araması yapılmadı,,,50.12,16
2026-07-07 20:47:59,iflas,İflas / Konkordato / Mali Sorun,Dünyaca ünlü markalara iş yapıyordu! 60 yıllık Türk tekstil devi sessiz sedasız iflas etti,Dünyaca ünlü markalara iş yapıyordu! 60 yıllık Türk tekstil devi sessiz sedasız iflas etti Yeni Akit Gazetesi,https://news.google.com/rss/articles/CBMi0gFBVV95cUxNd21JV21SX3d6WkhQeFRuR2gzTFBsWVJvNVo5dlkzNVlYdzZyREk1UDhINkk5MEhpellhWmY2eEVBaXNQenNSczNncE04TkF1VTJpT3hmdG5nbVpBdEdoVTVic2MteHRHSkFYaDRSd0dJVnBnLURSRUhFSkJqbWNDcTBHMUZtczlFQnBGSVloWmZPZzAtcmdQemFNbm1fNm4yRmxWZ050cXRQYVY2and6aGszWGVIQ05hNklRSlZYWnlwSmxoeFY5TngzcWZtOG9GVXfSAdQBQVVfeXFMUHZ4c2ZkdHJoSHhXcUE5cUl2UkM0U282M0ZZNlUzZUZwRktfSTcxZW9qTGtkU1VvSmE4VTFWd2RYeEZwb2NKYlluakFqbm1aMW5nNVVRT2VkWktGb25oczZmYWszYzN0MmxDUm9PdDNOMExXcmJMMURPWGZJZXpKc2ZQQ0RNcGNxN1VWNWdHRU5NTGdFeTU1cmpQTHp5YlFsU19nLXhzNFBuOG1ycndycThHOGo1Z1BRTDhuOERTekk0OXZZTTZFVFJwLXltVUd2d2tMWUU?oc=5,tekstil,,Dünyaca ünlü markalara iş yapıyordu! 60 yıllık Türk tekstil devi sessiz sedasız iflas etti Yeni Akit Gazetesi,Dünyaca ünlü markalara iş yapıyordu! 60 yıllık Türk tekstil devi sessiz sedasız iflas etti Dünyaca ünlü markalara iş yapıyordu! 60 yıllık Türk tekstil devi sessiz sedasız iflas etti Yeni Akit Gazetesi Dünyaca ünlü markalara iş yapıyordu! 60 yıllık Türk tekstil devi sessiz sedasız iflas etti Yeni Akit Gazetesi,browser_failed,https://news.google.com/rss/articles/CBMi0gFBVV95cUxNd21JV21SX3d6WkhQeFRuR2gzTFBsWVJvNVo5dlkzNVlYdzZyREk1UDhINkk5MEhpellhWmY2eEVBaXNQenNSczNncE04TkF1VTJpT3hmdG5nbVpBdEdoVTVic2MteHRHSkFYaDRSd0dJVnBnLURSRUhFSkJqbWNDcTBHMUZtczlFQnBGSVloWmZPZzAtcmdQemFNbm1fNm4yRmxWZ050cXRQYVY2and6aGszWGVIQ05hNklRSlZYWnlwSmxoeFY5TngzcWZtOG9GVXfSAdQBQVVfeXFMUHZ4c2ZkdHJoSHhXcUE5cUl2UkM0U282M0ZZNlUzZUZwRktfSTcxZW9qTGtkU1VvSmE4VTFWd2RYeEZwb2NKYlluakFqbm1aMW5nNVVRT2VkWktGb25oczZmYWszYzN0MmxDUm9PdDNOMExXcmJMMURPWGZJZXpKc2ZQQ0RNcGNxN1VWNWdHRU5NTGdFeTU1cmpQTHp5YlFsU19nLXhzNFBuOG1ycndycThHOGo1Z1BRTDhuOERTekk0OXZZTTZFVFJwLXltVUd2d2tMWUU?oc=5&hl=tr&gl=TR&ceid=TR:tr,,,,,,,,il yok | ilçe yok | firma yok | faaliyet/tesis yok,,,,maps araması yapılmadı,,,89.34,17
2026-07-08 09:16:00,iflas,İflas / Konkordato / Mali Sorun,Dev telekomünikasyon şirketi iflasın eşiğinde,Dev telekomünikasyon şirketi iflasın eşiğinde Türkinform,https://news.google.com/rss/articles/CBMie0FVX3lxTE9YRjAxYmxXVFVUVmNBOWFKa215NWJDQ0FYU2RwNDZ4dTBWQzlKUkxfTzF0d0trcnhGdWJMdXN2bVpwdEV2eFd0Ylp5VUhnS1RGd1Y3cmdzVGZjQXlNU253T0E5d1ctNVJmOVl0aW1LT1FiTWpNbzlBYWJZTQ?oc=5,şirket,şirket / firma,Dev telekomünikasyon şirketi iflasın eşiğinde Türkinform,Dev telekomünikasyon şirketi iflasın eşiğinde Dev telekomünikasyon şirketi iflasın eşiğinde Türkinform Dev telekomünikasyon şirketi iflasın eşiğinde Türkinform,browser_failed,https://news.google.com/rss/articles/CBMie0FVX3lxTE9YRjAxYmxXVFVUVmNBOWFKa215NWJDQ0FYU2RwNDZ4dTBWQzlKUkxfTzF0d0trcnhGdWJMdXN2bVpwdEV2eFd0Ylp5VUhnS1RGd1Y3cmdzVGZjQXlNU253T0E5d1ctNVJmOVl0aW1LT1FiTWpNbzlBYWJZTQ?oc=5&hl=tr&gl=TR&ceid=TR:tr,,,,,,,,il yok | ilçe yok | firma yok | faaliyet/tesis yok,,,,maps araması yapılmadı,,,45.06,18
2026-07-07 23:16:27,tasfiye,İflas / Konkordato / Mali Sorun,Gayrimenkul şirketlerinin tasfiye dalgası nedeniyle gayrimenkul aracıları zor durumda.,Gayrimenkul şirketlerinin tasfiye dalgası nedeniyle gayrimenkul aracıları zor durumda. Vietnam.vn,https://news.google.com/rss/articles/CBMikAFBVV95cUxNZ1lBTWFOWVp6WnZqTVg5aXJ4MEVHaWxhWEtMVXVRVFZyVF95c01yeVNRVTJJZTdLRTBEdGxxcHhCS3lVMThJdExfWV9qNlRHdHhTYmVhakdwamFDYnppaDdiX0xvSktOSFFBSm9ZemdNUDNXYnJDbW8zbDFpZUZ3SkxBYzVCaTRaU3NNYU9Oai0?oc=5,şirket,şirket / firma,Gayrimenkul şirketlerinin tasfiye dalgası nedeniyle gayrimenkul aracıları zor durumda. Vietnam.vn,Gayrimenkul şirketlerinin tasfiye dalgası nedeniyle gayrimenkul aracıları zor durumda. Gayrimenkul şirketlerinin tasfiye dalgası nedeniyle gayrimenkul aracıları zor durumda. Vietnam.vn Gayrimenkul şirketlerinin tasfiye dalgası nedeniyle gayrimenkul aracıları zor durumda.,browser_failed,https://news.google.com/rss/articles/CBMikAFBVV95cUxNZ1lBTWFOWVp6WnZqTVg5aXJ4MEVHaWxhWEtMVXVRVFZyVF95c01yeVNRVTJJZTdLRTBEdGxxcHhCS3lVMThJdExfWV9qNlRHdHhTYmVhakdwamFDYnppaDdiX0xvSktOSFFBSm9ZemdNUDNXYnJDbW8zbDFpZUZ3SkxBYzVCaTRaU3NNYU9Oai0?oc=5&hl=tr&gl=TR&ceid=TR:tr,,,,,,,,il yok | ilçe yok | firma yok | faaliyet/tesis yok,,,,maps araması yapılmadı,,,84.22,19
