published,search_term,category,title,summary,link,matched_words,activity_type,raw_text,entity_source_text,article_fetch_status,resolved_article_url,city_candidates,district_candidates,neighborhood_candidates,street_candidates,facility_candidates,company_candidates,company_candidate_scores,entity_quality_note,maps_queries,maps_candidates,maps_best_guess,maps_status,maps_match_scores,maps_rejected_candidates,record_quality_score,duplicate_group_id
2026-06-23 17:00:00,MASAK,Diğer,"Akaryakıt sektöründe vergi usulsüzlüğü operasyonu: 6 şirkete el konuldu, 10 şirkete kayyum atandı","Akaryakıt sektöründe vergi usulsüzlüğü operasyonu: 6 şirkete el konuldu, 10 şirkete kayyum atandı Nazilli Havadis Gazetesi",https://news.google.com/rss/articles/CBMiuwFBVV95cUxOWVFfaWYzOHZvTzluVVRkX28yYjZBSWxGNEl0cHRlNkpNX0JxWU9FQmtfYVFKYlp5VFl6OFZBMGJfRVFWWDdkTUhCaU5DNndvRjl4T1Vvc1NwbDBnWmRjMWp3eXUydUt3NVRnNzNDY0FGZTMtMGpsZFlkZjZ0aklGaXdENnVualpIME4yTVpZTmdoR2Y1MTdCNGhtZEdORmhxX04wNXN0aGhyLTBuSFZIQUZMWlF5T2RRNFlV0gHLAUFVX3lxTE5KTDliVFFJaXlWWkM0eXhjbVVDaXlUOTJkU0hrRFczcXdRNV9ESU04SjN5bjI5S0ZOVkZOUGVPRktVN0pUTkFKcEdsLW4wdFFKT3VBZGJJTld3X283b3JiYmR2VE83Ry1kcjQteDZNNURtQ2tyZHpFdnRIYjdZRFJyN2VDR1lRajBJYTIzWk5MQVEyY01XRUxXZEV2Tk81ZXhkZUdHekZuSkJsa2hYQU5TUHFGVGRRUUZzU2U3d3dZUHRiQm5Pd0pFLTJR?oc=5,"el konuldu, şirket",akaryakıt tesisi | şirket / firma,"Akaryakıt sektöründe vergi usulsüzlüğü operasyonu: 6 şirkete el konuldu, 10 şirkete kayyum atandı Nazilli Havadis Gazetesi","Akaryakıt sektöründe vergi usulsüzlüğü operasyonu: 6 şirkete el konuldu, 10 şirkete kayyum atandı Akaryakıt sektöründe vergi usulsüzlüğü operasyonu: 6 şirkete el konuldu, 10 şirkete kayyum atandı Nazilli Havadis Gazetesi Akaryakıt sektöründe vergi usulsüzlüğü operasyonu: 6 şirkete el konuldu, 10 şirkete kayyum atandı Nazilli Havadis Gazetesi",browser_failed,https://news.google.com/rss/articles/CBMiuwFBVV95cUxOWVFfaWYzOHZvTzluVVRkX28yYjZBSWxGNEl0cHRlNkpNX0JxWU9FQmtfYVFKYlp5VFl6OFZBMGJfRVFWWDdkTUhCaU5DNndvRjl4T1Vvc1NwbDBnWmRjMWp3eXUydUt3NVRnNzNDY0FGZTMtMGpsZFlkZjZ0aklGaXdENnVualpIME4yTVpZTmdoR2Y1MTdCNGhtZEdORmhxX04wNXN0aGhyLTBuSFZIQUZMWlF5T2RRNFlV0gHLAUFVX3lxTE5KTDliVFFJaXlWWkM0eXhjbVVDaXlUOTJkU0hrRFczcXdRNV9ESU04SjN5bjI5S0ZOVkZOUGVPRktVN0pUTkFKcEdsLW4wdFFKT3VBZGJJTld3X283b3JiYmR2VE83Ry1kcjQteDZNNURtQ2tyZHpFdnRIYjdZRFJyN2VDR1lRajBJYTIzWk5MQVEyY01XRUxXZEV2Tk81ZXhkZUdHekZuSkJsa2hYQU5TUHFGVGRRUUZzU2U3d3dZUHRiQm5Pd0pFLTJR?oc=5&hl=tr&gl=TR&ceid=TR:tr,,,,,,,,il yok | ilçe yok | firma yok | faaliyet/tesis yok,,,,maps araması yapılmadı,,,96.22,1
2026-06-24 06:30:00,para aklama,Operasyon / Soruşturma / Suç,HSBC'ye büyük şok: Merkez Bankası fonları için soruşturma başlatıldı,HSBC'ye büyük şok: Merkez Bankası fonları için soruşturma başlatıldı Sözcü Gazetesi,https://news.google.com/rss/articles/CBMipwFBVV95cUxOUXc2azBJemFOcHppcUZLTVA3RDd0eEU1SzlhTVRUaUp4ODlzejlRcTJ1SXdXSjk5WTJCUVB3Z003cGkxMDVVTHVTd04xcHpSQjhYaGZlRDJjMTRUTE44VnBZQXdscDh0TTlUVHVOZ2V3T2VzYjllcmg4Y2RaLVEtZkNHdUNrY2VIRmFoaFRfMU1pdGs0U29DbGNQRmVlNzV4c3UwU3pYVQ?oc=5,banka,finansal kuruluş,"Ad Haberler - Ekonomi HSBC'ye büyük şok: Merkez Bankası fonları için soruşturma başlatıldı HSBC’nin İsviçre birimi, Lübnan Merkez Bankası’nın eski başkanı Riad Salameh ve yakınlarının yüz milyonlarca dolarlık kara para aklama faaliyetlerine göz yummakla suçlanıyor. Yayınlanma: 24 Haziran 2026 - 09:30 Güncellenme: Avrupa'nın en büyük bankacılık gruplarından HSBC, İsviçre'deki özel bankacılık birimi üzerinden yürütülen devasa bir yolsuzluk ve kara para aklama skandalının merkezinde yer alıyor. Fransız ve İsviçreli yargı makamları, bankanın Lübnan Merkez Bankası eski Başkanı Riad Salameh ve ortaklarının kamu fonlarını hortumlamasına aracılık ettiği iddiaları üzerine resmi soruşturma başlattı. FRANSIZ SAVCILARDAN ÖN SUÇLAMA Fransız yargısı, Riad Salameh’in kamu fonlarını zimmetine geçirmesine yardımcı olduğu gerekçesiyle HSBC İsviçre Özel Bankası hakkında ön suçlama kararı aldı. Müfettişlerin incelemelerine göre, 2002-2015 yılları arasında Lübnan Merkez Bankası’ndan İngiliz Virjin Adaları menşeili Forry Associates şirketine 330 milyon dolar aktarıldı. Bu tutarın 204 milyon dolarlık kısmı, 174 farklı transferle Riad Salameh'in kardeşi Raja Salameh’in kişisel HSBC hesaplarına gönderildi. İsviçre Finansal Piyasalar Denetleme Kurulu ise bankanın özen borcunu ciddi şekilde ihlal ettiğini ve uyarı sinyallerini görmezden geldiğini açıkladı. İÇ UYARILAR YILLARCA GÖRMEZDEN GELİNDİ Skandalın arka planında banka içi denetim mekanizmalarının devre dışı bırakıldığı görülüyor. HSBC’nin 2000 yılında Republic National Bank of New York’u satın almasıyla kadroya dahil olan kıdemli bankacı Sobhi Tabbara, Salameh kardeşlerle olan yakın ilişkisini kullanarak uyum görevlilerinin şüphelerini bastırdı. 2009 yılında Lübnan Merkez Bankası’ndan gelen bir SWIFT mesajını gerekçe gösteren Tabbara, işlemlerin yasal olduğunu savunarak denetimleri engelledi. 2013 yılında bir uyum görevlisinin hesaplardaki hareketliliği ""şüpheli"" olarak rapor etmesine rağmen, kıdemli yöneticiler ticari ilişkiyi sürdürme kararı aldı. PARAVAN ŞİRKET VE GEÇİŞ KANALLARI Soruşturma dosyasına göre Panama Belgeleri ile tanınan hukuk firması Mossack Fonseca tarafından yönetilen Forry Associates'in hiçbir gerçek ticari faaliyeti, çalışanı veya müşterisi bulunmuyordu. 2015 yılında bankaya sunulan sözleşmelerdeki imza çelişkileri üzerine Mali İstihbarat Birimi harekete geçti. Yapılan incelemelerde şu sonuçlar elde edildi: Paranın önce paravan şirket hesabına aktarıldığı, Buradan Raja Salameh’in kişisel HSBC hesaplarına transfer edildiği, Son aşamada ise fonların izini kaybettirmek amacıyla Lübnan'daki yerel bankalara gönderildiği saptandı. HSBC, 2016 yılında hesapları kapatsa da bunu resmi makamlara bildirmek yerine kayıtlara ""risk iştahı değişimi"" olarak geçti. GEÇ KALINAN BİLDİRİM VE MİLYARLIK SABIKA Lübnan ekonomisinin 2019 yılında çökmesiyle birlikte Riad Salameh’in yürüttüğü finansal sistem ""devlet destekli bir saadet zinciri"" olarak tanımlandı. HSBC, Salameh ile ilişkisini kestikten dört yıl sonra, yani 2020'de İsviçre makamlarına resmi bildirimde bulundu. Finma, bu adımı ""tamamen geç kalmış"" bir müdahale olarak nitelendirdi. HSBC, geçmişte de Meksikalı uyuşturucu kartellerinin kara para aklama faaliyetlerine göz yumduğu gerekçesiyle 2012 yılında ABD'de 1,9 milyar dolar ceza ödemeyi kabul etmişti. Banka yönetimi, yeni soruşturmaların grup üzerinde önemli finansal etkileri olabileceği konusunda yatırımcılarını uyardı. Bu süreçte HSBC, aralarında Suudi Arabistan ve Lübnan'ın da yer aldığı Orta Doğulu 1.000'den fazla varlıklı müşterisiyle ilişkisini sonlandırdı. Bankacılık grubu ise konuyla ilgili resmi bir yorum yapmaktan kaçındı. HSBC'ye büyük şok: Merkez Bankası fonları için soruşturma başlatıldı HSBC’nin İsviçre birimi, Lübnan Merkez Bankası’nın eski başkanı Riad Salameh ve yakınlarının yüz milyonlarca dolarlık kara para aklama faaliyetlerine göz yummakla suçlanıyor. Yayınlanma: 24 Haziran 2026 - 09:30 Güncellenme: Yayınlanma: 24 Haziran 2026 - 09:30 Güncellenme: Avrupa'nın en büyük bankacılık gruplarından HSBC, İsviçre'deki özel bankacılık birimi üzerinden yürütülen devasa bir yolsuzluk ve kara para aklama skandalının merkezinde yer alıyor. Fransız ve İsviçreli yargı makamları, bankanın Lübnan Merkez Bankası eski Başkanı Riad Salameh ve ortaklarının kamu fonlarını hortumlamasına aracılık ettiği iddiaları üzerine resmi soruşturma başlattı. FRANSIZ SAVCILARDAN ÖN SUÇLAMA Fransız yargısı, Riad Salameh’in kamu fonlarını zimmetine geçirmesine yardımcı olduğu gerekçesiyle HSBC İsviçre Özel Bankası hakkında ön suçlama kararı aldı. Müfettişlerin incelemelerine göre, 2002-2015 yılları arasında Lübnan Merkez Bankası’ndan İngiliz Virjin Adaları menşeili Forry Associates şirketine 330 milyon dolar aktarıldı. Bu tutarın 204 milyon dolarlık kısmı, 174 farklı transferle Riad Salameh'in kardeşi Raja Salameh’in kişisel HSBC hesaplarına gönderildi. İsviçre Finansal Piyasalar Denetleme Kurulu ise bankanın özen borcunu ciddi şekilde ihlal ettiğini ve uyarı sinyallerini görmezden geldiğini açıkladı. İÇ UYARILAR YILLARCA GÖRMEZDEN GELİNDİ Skandalın arka planında banka içi denetim mekanizmalarının devre dışı bırakıldığı görülüyor. HSBC’nin 2000 yılında Republic National Bank of New York’u satın almasıyla kadroya dahil olan kıdemli bankacı Sobhi Tabbara, Salameh kardeşlerle olan yakın ilişkisini kullanarak uyum görevlilerinin şüphelerini bastırdı. 2009 yılında Lübnan Merkez Bankası’ndan gelen bir SWIFT mesajını gerekçe gösteren Tabbara, işlemlerin yasal olduğunu savunarak denetimleri engelledi. 2013 yılında bir uyum görevlisinin hesaplardaki hareketliliği ""şüpheli"" olarak rapor etmesine rağmen, kıdemli yöneticiler ticari ilişkiyi sürdürme kararı aldı. PARAVAN ŞİRKET VE GEÇİŞ KANALLARI Soruşturma dosyasına göre Panama Belgeleri ile tanınan hukuk firması Mossack Fonseca tarafından yönetilen Forry Associates'in hiçbir gerçek ticari faaliyeti, çalışanı veya müşterisi bulunmuyordu. 2015 yılında bankaya sunulan sözleşmelerdeki imza çelişkileri üzerine Mali İstihbarat Birimi harekete geçti. Yapılan incelemelerde şu sonuçlar elde edildi: Paranın önce paravan şirket hesabına aktarıldığı, Buradan Raja Salameh’in kişisel HSBC hesaplarına transfer edildiği, Son aşamada ise fonların izini kaybettirmek amacıyla Lübnan'daki yerel bankalara gönderildiği saptandı. HSBC, 2016 yılında hesapları kapatsa da bunu resmi makamlara bildirmek yerine kayıtlara ""risk iştahı değişimi"" olarak geçti. GEÇ KALINAN BİLDİRİM VE MİLYARLIK SABIKA Lübnan ekonomisinin 2019 yılında çökmesiyle birlikte Riad Salameh’in yürüttüğü finansal sistem ""devlet destekli bir saadet zinciri"" olarak tanımlandı. HSBC, Salameh ile ilişkisini kestikten dört yıl sonra, yani 2020'de İsviçre makamlarına resmi bildirimde bulundu. Finma, bu adımı ""tamamen geç kalmış"" bir müdahale olarak nitelendirdi. HSBC, geçmişte de Meksikalı uyuşturucu kartellerinin kara para aklama faaliyetlerine göz yumduğu gerekçesiyle 2012 yılında ABD'de 1,9 milyar dolar ceza ödemeyi kabul etmişti. Banka yönetimi, yeni soruşturmaların grup üzerinde önemli finansal etkileri olabileceği konusunda yatırımcılarını uyardı. Bu süreçte HSBC, aralarında Suudi Arabistan ve Lübnan'ın da yer aldığı Orta Doğulu 1.000'den fazla varlıklı müşterisiyle ilişkisini sonlandırdı. Bankacılık grubu ise konuyla ilgili resmi bir yorum yapmaktan kaçındı. HSBC'ye büyük şok: Merkez Bankası fonları için soruşturma başlatıldı FRANSIZ SAVCILARDAN ÖN SUÇLAMA İÇ UYARILAR YILLARCA GÖRMEZDEN GELİNDİ PARAVAN ŞİRKET VE GEÇİŞ KANALLARI GEÇ KALINAN BİLDİRİM VE MİLYARLIK SABIKA HSBC’nin İsviçre birimi, Lübnan Merkez Bankası’nın eski başkanı Riad Salameh ve yakınlarının yüz milyonlarca dolarlık kara para aklama faaliyetlerine göz yummakla suçlanıyor. Avrupa'nın en büyük bankacılık gruplarından HSBC, İsviçre'deki özel bankacılık birimi üzerinden yürütülen devasa bir yolsuzluk ve kara para aklama skandalının merkezinde yer alıyor. Fransız ve İsviçreli yargı makamları, bankanın Lübnan Merkez Bankası eski Başkanı Riad Salameh ve ortaklarının kamu fonlarını hortumlamasına aracılık ettiği iddiaları üzerine resmi soruşturma başlattı. Fransız yargısı, Riad Salameh’in kamu fonlarını zimmetine geçirmesine yardımcı olduğu gerekçesiyle HSBC İsviçre Özel Bankası hakkında ön suçlama kararı aldı. Müfettişlerin incelemelerine göre, 2002-2015 yılları arasında Lübnan Merkez Bankası’ndan İngiliz Virjin Adaları menşeili Forry Associates şirketine 330 milyon dolar aktarıldı. Bu tutarın 204 milyon dolarlık kısmı, 174 farklı transferle Riad Salameh'in kardeşi Raja Salameh’in kişisel HSBC hesaplarına gönderildi. İsviçre Finansal Piyasalar Denetleme Kurulu ise bankanın özen borcunu ciddi şekilde ihlal ettiğini ve uyarı sinyallerini görmezden geldiğini açıkladı. Skandalın arka planında banka içi denetim mekanizmalarının devre dışı bırakıldığı görülüyor. HSBC’nin 2000 yılında Republic National Bank of New York’u satın almasıyla kadroya dahil olan kıdemli bankacı Sobhi Tabbara, Salameh kardeşlerle olan yakın ilişkisini kullanarak uyum görevlilerinin şüphelerini bastırdı. 2009 yılında Lübnan Merkez Bankası’ndan gelen bir SWIFT mesajını gerekçe gösteren Tabbara, işlemlerin yasal olduğunu savunarak denetimleri engelledi. 2013 yılında bir uyum görevlisinin hesaplardaki hareketliliği ""şüpheli"" olarak rapor etmesine rağmen, kıdemli yöneticiler ticari ilişkiyi sürdürme kararı aldı. Soruşturma dosyasına göre Panama Belgeleri ile tanınan hukuk firması Mossack Fonseca tarafından yönetilen Forry Associates'in hiçbir gerçek ticari faaliyeti, çalışanı veya müşterisi bulunmuyordu. 2015 yılında bankaya sunulan sözleşmelerdeki imza çelişkileri üzerine Mali İstihbarat Birimi harekete geçti. Yapılan incelemelerde şu sonuçlar elde edildi: Paranın önce paravan şirket hesabına aktarıldığı, Buradan Raja Salameh’in kişisel HSBC hesaplarına transfer edildiği, Son aşamada ise fonların izini kaybettirmek amacıyla Lübnan'daki yerel bankalara gönderildiği saptandı. HSBC, 2016 yılında hesapları kapatsa da bunu resmi makamlara bildirmek yerine kayıtlara ""risk iştahı değişimi"" olarak geçti. Lübnan ekonomisinin 2019 yılında çökmesiyle birlikte Riad Salameh’in yürüttüğü finansal sistem ""devlet destekli bir saadet zinciri"" olarak tanımlandı. HSBC, Salameh ile ilişkisini kestikten dört yıl sonra, yani 2020'de İsviçre makamlarına resmi bildirimde bulundu. Finma, bu adımı ""tamamen geç kalmış"" bir müdahale olarak nitelendirdi. HSBC, geçmişte de Meksikalı uyuşturucu kartellerinin kara para aklama faaliyetlerine göz yumduğu gerekçesiyle 2012 yılında ABD'de 1,9 milyar dolar ceza ödemeyi kabul etmişti. Banka yönetimi, yeni soruşturmaların grup üzerinde önemli finansal etkileri olabileceği konusunda yatırımcılarını uyardı. Bu süreçte HSBC, aralarında Suudi Arabistan ve Lübnan'ın da yer aldığı Orta Doğulu 1.000'den fazla varlıklı müşterisiyle ilişkisini sonlandırdı. Bankacılık grubu ise konuyla ilgili resmi bir yorum yapmaktan kaçındı.","HSBC'ye büyük şok: Merkez Bankası fonları için soruşturma başlatıldı HSBC'ye büyük şok: Merkez Bankası fonları için soruşturma başlatıldı Sözcü Gazetesi Ad Haberler - Ekonomi HSBC'ye büyük şok: Merkez Bankası fonları için soruşturma başlatıldı HSBC’nin İsviçre birimi, Lübnan Merkez Bankası’nın eski başkanı Riad Salameh ve yakınlarının yüz milyonlarca dolarlık kara para aklama faaliyetlerine göz yummakla suçlanıyor. Yayınlanma: 24 Haziran 2026 - 09:30 Güncellenme: Avrupa'nın en büyük bankacılık gruplarından HSBC, İsviçre'deki özel bankacılık birimi üzerinden yürütülen devasa bir yolsuzluk ve kara para aklama skandalının merkezinde yer alıyor. Fransız ve İsviçreli yargı makamları, bankanın Lübnan Merkez Bankası eski Başkanı Riad Salameh ve ortaklarının kamu fonlarını hortumlamasına aracılık ettiği iddiaları üzerine resmi soruşturma başlattı. FRANSIZ SAVCILARDAN ÖN SUÇLAMA Fransız yargısı, Riad Salameh’in kamu fonlarını zimmetine geçirmesine yardımcı olduğu gerekçesiyle HSBC İsviçre Özel Bankası hakkında ön suçlama kararı aldı. Müfettişlerin incelemelerine göre, 2002-2015 yılları arasında Lübnan Merkez Bankası’ndan İngiliz Virjin Adaları menşeili Forry Associates şirketine 330 milyon dolar aktarıldı. Bu tutarın 204 milyon dolarlık kısmı, 174 farklı transferle Riad Salameh'in kardeşi Raja Salameh’in kişisel HSBC hesaplarına gönderildi. İsviçre Finansal Piyasalar Denetleme Kurulu ise bankanın özen borcunu ciddi şekilde ihlal ettiğini ve uyarı sinyallerini görmezden geldiğini açıkladı. HSBC’nin 2000 yılında Republic National Bank of New York’u satın almasıyla kadroya dahil olan kıdemli bankacı Sobhi Tabbara, Salameh kardeşlerle olan yakın ilişkisini kullanarak uyum görevlilerinin şüphelerini bastırdı. 2009 yılında Lübnan Merkez Bankası’ndan gelen bir SWIFT mesajını gerekçe gösteren Tabbara, işlemlerin yasal olduğunu savunarak denetimleri engelledi. PARAVAN ŞİRKET VE GEÇİŞ KANALLARI Soruşturma dosyasına göre Panama Belgeleri ile tanınan hukuk firması Mossack Fonseca tarafından yönetilen Forry Associates'in hiçbir gerçek ticari faaliyeti, çalışanı veya müşterisi bulunmuyordu. Yapılan incelemelerde şu sonuçlar elde edildi: Paranın önce paravan şirket hesabına aktarıldığı, Buradan Raja Salameh’in kişisel HSBC hesaplarına transfer edildiği, Son aşamada ise fonların izini kaybettirmek amacıyla Lübnan'daki yerel bankalara gönderildiği saptandı. HSBC, 2016 yılında hesapları kapatsa da bunu resmi makamlara bildirmek yerine kayıtlara ""risk iştahı değişimi"" olarak geçti. HSBC, Salameh ile ilişkisini kestikten dört yıl sonra, yani 2020'de İsviçre makamlarına resmi bildirimde bulundu. HSBC, geçmişte de Meksikalı uyuşturucu kartellerinin kara para aklama faaliyetlerine göz yumduğu gerekçesiyle 2012 yılında ABD'de 1,9 milyar dolar ceza ödemeyi kabul etmişti. Banka yönetimi, yeni soruşturmaların grup üzerinde önemli finansal etkileri olabileceği konusunda yatırımcılarını uyardı. Bu süreçte HSBC, aralarında Suudi Arabistan ve Lübnan'ın da yer aldığı Orta Doğulu 1.000'den fazla varlıklı müşterisiyle ilişkisini sonlandırdı. HSBC'ye büyük şok: Merkez Bankası fonları için soruşturma başlatıldı HSBC’nin İsviçre birimi, Lübnan Merkez Bankası’nın eski başkanı Riad Salameh ve yakınlarının yüz milyonlarca dolarlık kara para aklama faaliyetlerine göz yummakla suçlanıyor. Yayınlanma: 24 Haziran 2026 - 09:30 Güncellenme: Yayınlanma: 24 Haziran 2026 - 09:30 Güncellenme: Avrupa'nın en büyük bankacılık gruplarından HSBC, İsviçre'deki özel bankacılık birimi üzerinden yürütülen devasa bir yolsuzluk ve kara para aklama skandalının merkezinde yer alıyor. HSBC'ye büyük şok: Merkez Bankası fonları için soruşturma başlatıldı FRANSIZ SAVCILARDAN ÖN SUÇLAMA İÇ UYARILAR YILLARCA GÖRMEZDEN GELİNDİ PARAVAN ŞİRKET VE GEÇİŞ KANALLARI GEÇ KALINAN BİLDİRİM VE MİLYARLIK SABIKA HSBC’nin İsviçre birimi, Lübnan Merkez Bankası’nın eski başkanı Riad Salameh ve yakınlarının yüz milyonlarca dolarlık kara para aklama faaliyetlerine göz yummakla suçlanıyor. Avrupa'nın en büyük bankacılık gruplarından HSBC, İsviçre'deki özel bankacılık birimi üzerinden yürütülen devasa bir yolsuzluk ve kara para aklama skandalının merkezinde yer alıyor. Fransız yargısı, Riad Salameh’in kamu fonlarını zimmetine geçirmesine yardımcı olduğu gerekçesiyle HSBC İsviçre Özel Bankası hakkında ön suçlama kararı aldı. Soruşturma dosyasına göre Panama Belgeleri ile tanınan hukuk firması Mossack Fonseca tarafından yönetilen Forry Associates'in hiçbir gerçek ticari faaliyeti, çalışanı veya müşterisi bulunmuyordu.",browser_full_article,https://www.sozcu.com.tr/amp/hsbc-ye-buyuk-sok-merkez-bankasi-fonlari-icin-sorusturma-baslatildi-p330663,,,,,,,,il yok | ilçe yok | firma yok | faaliyet/tesis yok,,,,maps araması yapılmadı,,,75.75,2
2026-06-24 12:30:41,mal varlığına el konuldu,Diğer,"Muhtardan gelen tebligatları yırttı, sonucu ağır oldu! Tüm mal varlığına el konuldu","Muhtardan gelen tebligatları yırttı, sonucu ağır oldu! Tüm mal varlığına el konuldu Türkiye Gazetesi",https://news.google.com/rss/articles/CBMiygFBVV95cUxOMDlISll5NHg5Q2pKOHhPRHFzSDJGM1gyYVhaUzc1V244WGVOVkNpZjluSXdycDZvUlVscHVJS0VLb214NVRmYnZFQW93U1VSRmp3elN3cmh1V0xnQ19XNGNpUVY2eG56aFlkZnZ0Z3FnQjYzTzlNazdUSzR6dVQ5LUNkSGphLVdBS0tfdHlJX3dRS2VXQVhpUXVNN2loRUdzZXlyZWlDSTlqYzJsaVgxZ0JlYU1zdlRzRGdMVVVWRVFqVzNYSWlDdkxB?oc=5,"el konuldu, mal varlığı",,"Samsun’da yaşayan yüzde 70 engelli Abdullah Aslan, görüşmediği kızının borçları nedeniyle hesaplarına ve mal varlığına bloke konulduğunu iddia ederek yardım istedi. Uzmanlar ise icra tebligatlarının dikkate alınmaması halinde üçüncü kişilerin de hukuki sorumlulukla karşı karşıya kalabileceğini belirtti. Samsun’da yaşayan yüzde 70 engelli Abdullah Aslan, görüşmediği kızının borçları nedeniyle hesaplarına ve mal varlığına bloke konulduğunu iddia ederek yardım istedi. Uzmanlar ise icra tebligatlarının dikkate alınmaması halinde üçüncü kişilerin de hukuki sorumlulukla karşı karşıya kalabileceğini belirtti. Samsun’da yaşayan yüzde 70 engelli Abdullah Aslan, görüşmediği kızının borçları nedeniyle hesaplarına ve mal varlığına bloke konulduğunu iddia ederek yardım istedi. Uzmanlar ise icra tebligatlarının dikkate alınmaması halinde üçüncü kişilerin de hukuki sorumlulukla karşı karşıya kalabileceğini belirtti. İhlas Haber Ajansı Son Güncelleme: 24 Haziran, 2026 - 16:15 Muhtardan gelen tebligatları yırttı, sonucu ağır oldu! Tüm mal varlığına el konuldu BAKMADAN GEÇME YAŞAM Duyulmamış olay! Kirasını alamadı, muhatap bulamayınca mezarlığa koştu Yayın Tarihi | 24 Haziran, 2026 - 15:30 Haberle İlgili Daha Fazlası Yaşam Haber Verin Editör masamıza bilgi ve materyal göndermek için tıklayın Kaçırmayın Ücretsiz üye olun, gündemi şekillendiren gelişmeleri önce siz duyun Gaziantep'te ""Yeni Bahçelievler"" projesi başlıyor Kaydet Hakemin saatini çalmıştı: Türkiye maçı için 'tekra... Kaydet Yargıtay Hukuk Genel Kurulu'ndan ezber bozan emekl... Kaydet Çölyak hastaları ve zayıflamak isteyenlerin favori... Kaydet Servet ödenecek: ""En pahalı teknik adamlar"" listes... Kaydet Cem Küçük Naylon fatura ve hayalî ihracatın üzerine daha çok gidilsin! Kaydet Atilla Yayla Unutulmaması gereken bir isim: Nuh Naci Yazgan Kaydet İsa Karakaş Yargıtay Hukuk Genel Kurulu'ndan ezber bozan emeklilik kararı Kaydet Ferhat Ünlü 'Siper savaşı’ndan ‘siber savaş’a Kaydet Meryem Aybike Sinan Hey Afroditi! Kaydet Dünya Kupası'nda drone avı! FBI 300'den fazla cihaza el koydu: Milli Takım sıkı takipte Kaydet Ay ay faizsiz finansman hesabı! Kaydet 2 yıllık bankaya uluslararası güven! Dünya Katılım’a Fitch’ten ilk not Kaydet Görüntüler Türkiye'den! Görenler, büyütmeden geçmiyor Kaydet Borsada yeni rekor heyecanı! Kaydet YAŞAM Duyulmamış olay! Kirasını alamadı, muhatap bulamayınca mezarlığa koştu Bize Haber Verin Editör masasıyla bilgi ve materyal pay","Muhtardan gelen tebligatları yırttı, sonucu ağır oldu! Tüm mal varlığına el konuldu Muhtardan gelen tebligatları yırttı, sonucu ağır oldu! Tüm mal varlığına el konuldu Türkiye Gazetesi Samsun’da yaşayan yüzde 70 engelli Abdullah Aslan, görüşmediği kızının borçları nedeniyle hesaplarına ve mal varlığına bloke konulduğunu iddia ederek yardım istedi. Uzmanlar ise icra tebligatlarının dikkate alınmaması halinde üçüncü kişilerin de hukuki sorumlulukla karşı karşıya kalabileceğini belirtti. İhlas Haber Ajansı Son Güncelleme: 24 Haziran, 2026 - 16:15 Muhtardan gelen tebligatları yırttı, sonucu ağır oldu! Tüm mal varlığına el konuldu BAKMADAN GEÇME YAŞAM Duyulmamış olay! Kirasını alamadı, muhatap bulamayınca mezarlığa koştu Yayın Tarihi | 24 Haziran, 2026 - 15:30 Haberle İlgili Daha Fazlası Yaşam Haber Verin Editör masamıza bilgi ve materyal göndermek için tıklayın Kaçırmayın Ücretsiz üye olun, gündemi şekillendiren gelişmeleri önce siz duyun Gaziantep'te ""Yeni Bahçelievler"" projesi başlıyor Kaydet Hakemin saatini çalmıştı: Türkiye maçı için 'tekra... Kaydet Yargıtay Hukuk Genel Kurulu'ndan ezber bozan emekl... Kaydet Çölyak hastaları ve zayıflamak isteyenlerin favori... Kaydet Servet ödenecek: ""En pahalı teknik adamlar"" listes... Kaydet Dünya Kupası'nda drone avı! Kaydet YAŞAM Duyulmamış olay!",browser_full_article,https://www.turkiyegazetesi.com.tr/yasam/muhtardan-gelen-tebligatlari-yirtti-sonucu-agir-oldu-tum-mal-varligina-el-konuldu-1799099,Gaziantep | Samsun,,,,,,,ilçe yok | firma yok | faaliyet/tesis yok,,,,maps araması yapılmadı,,,107.5,3
