published,search_term,category,title,summary,link,matched_words,activity_type,raw_text,entity_source_text,article_fetch_status,resolved_article_url,city_candidates,district_candidates,neighborhood_candidates,street_candidates,facility_candidates,company_candidates,company_candidate_scores,entity_quality_note,maps_queries,maps_candidates,maps_best_guess,maps_status,maps_match_scores,maps_rejected_candidates,record_quality_score,duplicate_group_id
2026-07-18 07:55:31,MASAK,Kara Para / MASAK / Bahis,MASAK'tan Yeni Terör Finansmanı Mücadelesi,MASAK'tan Yeni Terör Finansmanı Mücadelesi SonDakika,https://news.google.com/rss/articles/CBMikgFBVV95cUxNVktTWVJpWXptSm90T0NNcmcwb20xNDQtak1rckNDeFpwVXR5NlRXbTBZQ2QxdFNBeVRkRXVEcTlud1dDS3lKWmlkWTByMEgyLVdUVWVnLW1xQVNWeHZEZUtLbW82UnNTcDdxSzZZaTZGYkt0VXhTQjBFLXNNV3M4em9FdXNsenNtdHI4OUVUTk9xZ9IBkgFBVV95cUxNVktTWVJpWXptSm90T0NNcmcwb20xNDQtak1rckNDeFpwVXR5NlRXbTBZQ2QxdFNBeVRkRXVEcTlud1dDS3lKWmlkWTByMEgyLVdUVWVnLW1xQVNWeHZEZUtLbW82UnNTcDdxSzZZaTZGYkt0VXhTQjBFLXNNV3M4em9FdXNsenNtdHI4OUVUTk9xZw?oc=5,masak,,"MASAK, terörizmin finansmanı için eş zamanlı soruşturmalar başlatacak, yeni önlemler alacak. MASAK, terörizmin finansmanı için eş zamanlı soruşturmalar başlatacak, yeni önlemler alacak. MASAK, terörizmin finansmanı için eş zamanlı soruşturmalar başlatacak, yeni önlemler alacak. MASAK'tan Yeni Terör Finansmanı Mücadelesi MASAK, terörizmin finansmanı için eş zamanlı soruşturmalar başlatacak, yeni önlemler alacak. 1- MASAK'tan kara para aklama ve terörün finansmanına karşı yeni yol haritası Finansman unsuru taşıyan tüm terörizm vakalarında eş zamanlı ""terörizmin finansmanı"" soruşturması açılacak Pay defterinin elektronik ortamda tutulması zorunluluğunun kapsamı genişletilecek ve eski kayıtların elektronik ortama aktarılması sağlanacak Gerçek faydalanıcılık sicilindeki olası hatalı bildirimlerin tespiti amacıyla Ticaret Bakanlığı ve Gelir İdaresi Başkanlığınca asgari olarak 6 aylık periyotlarda ortaklaşa çalışmalar yürütülecek (Hülya Ömür Uylaş-Mert Davut/Ankara) 2- Ticaret Bakanlığından tanıtımlardaki ""indirim oyunları""na yakın takip 3- Türkiye'de geçen yıl yaklaşık 500 bin kişi iş ve tayin için taşındı Geçen yıl, iç göç gerçekleştiren her 5 kişiden biri, iş gerekçesiyle farklı bir şehre taşındı Vatandaşlar iş için en çok İstanbul'a, en az Ardahan'a göç etti 4- Türkiye'nin AB'nin yeşil ve dijital dönüşümünde ""tedarikçi"" değil, ""kurucu ortak"" olması bekleniyor DEİK Türkiye-Avrupa İş Konseyleri Koordinatör Başkanı Mehmet Ali Yalçındağ: ""Türkiye'nin Avrupa pazarına uyum sağlayan bir tedarikçi olmanın ötesine geçerek, Avrupa'nın yeşil, dijital ve dirençli sanayi dönüşümünün kurucu ortaklarından biri olarak konumlanması gerekiyor. Türkiye, AB için sadece ürün sattığı bir pazar değil, tedarik zincirlerinin ayrılmaz bir parçası olan stratejik ortak konumundadır"" ""Avrupa'nın yüksek faiz ve enflasyon kıskacında temkinli büyüme kaydedeceğini tahmin ettiğimiz 2026 yılının ikinci yarısında Türkiye'nin, lojistik ve dijital altyapısını güçlendirmesi ve mevcut avantajlarını yapısal yeşil dönüşüm reformlarıyla birleştirmesi durumunda, durgun AB pazarından en çok pay alan ülke olmaya devam edeceğine inanıyoruz"" 5- Türkiye'nin dondurma ihracatı dört ayda 23,5 milyon dolara ulaştı En fazla dondurma ihracatı yapılan ülkeler arasında Irak, ABD, KKTC, Kosova ve Kazakistan ilk sıralarda bulunuyor Ambalajlı Süt ve Süt Ürünleri Sanayicileri Derneği Genel Sekreteri Burhan Sakkaoğlu: ""Türkiye, dondurmada güçlü üretici ve ihracatçı ülkeler arasında bulunuyor, Avrupa Birliği'ne ihracat onayına sahip 43 süt ürünleri tesisinden 8'inde dondurma üretimi yapılıyor"" (Hülya Ömür Uylaş/Ankara) 6- ABD'nin 4 başkanıyla gerilim yaşayan Netanyahu'nun döneminde Amerikan yeni neslinin İsrail'e bakışı dönüşüyor Netanyahu, Trump'ın yanı sıra eski ABD Başkanları Clinton, Obama ve George W. Bush ile başta Filistin meselesi olmak üzere İran ve Orta Doğu politikaları konusunda birçok kez anlaşmazlığa düştü ABD'deki Columbia Üniversitesinden Prof. Dr. Betts'e göre, ABD kamuoyunun İsrail konusundaki tutumu son yıllarda önceki kuşaklara göre değişirken, yeni nesil artık İkinci Dünya Savaşı psikolojisini taşımıyor 7- İngiltere'deki eğitiminin ardından İstanbul'a dönen genç girişimci topraksız tarımla ihracatı hedefliyor Manchester Üniversitesi mezunu Aylin Erdoğan, Avusturya'daki kariyerini bırakarak İstanbul'da yerli teknoloji ve tohumlarla kurduğu dikey tarım tesisinde üretime başlayıp Michelin yıldızlı restoranlara satış gerçekleştirirken, rotasını Avrupa'ya ihracata çevirdi (Kaan Ulu/İstanbul) (Fotoğraflı-Görüntülü) 8- Yenilenebilir santrallerin yaygınlaşmasıyla oluşan toptan elektrik piyasalarındaki negatif fiyatlar batarya kurulumlarını hızlandıracak Almanya, Fransa, Hollanda, Belçika, İspanya ve Danimarka gibi yenilenebilir enerji kapasitesi yüksek ülkelerde negatif elektrik fiyatlarının görüldüğü saatlerin artması, enerji depolama yatırımlarını öne çıkarıyor EDEDER Yönetim Kurulu Başkanı Doğa Can Bayram: ""Depolama sistemleri, düşük fiyatlı saatlerde enerjiyi depolayıp yüksek fiyatlı saatlerde sisteme vererek gelir elde ediyor"" 9- Kartal Anadolu İmam Hatip Lisesi öğrencisi, uluslararası matematik yarışmasından altın madalyayla döndü Japonya'da düzenlenen WMI 2026 Dünya Finali'nde altın madalya kazanan Kartal Anadolu İmam Hatip Lisesi 11. sınıf öğrencisi Muhammed Enes Demirel: ""Ağustos ayının başında Vietnam'da düzenlenecek Asya Matematik Olimpiyatları'nın finali var. İnşallah orada da yine daha güzel başarı elde etmek isterim. Bunun dışında Uluslararası Matematik Olimpiyatları (IMO) adı verilen ve en prestijli matematik olimpiyatı olarak kabul edilen farklı bir yarışma var. Benim matematik olimpiyatlarına başlamamdaki en büyük motivasyon da ülkemi altın madalyayla temsil edebilmek"" ""Herhangi bir alanda kendini geliştirmek isteyen öğrencilere hocalarımız desteklerini esirgemiyor. 'Ben şunu yapmak istiyorum.' dediğimizde önümüzü açmak için ellerinden geleni yapıyorlar"" (Hamdi Dindirek/İstanbul) (Fotoğraflı-Görüntülü) 10- 2026 FIFA Dünya Kupası finali ""ilk""lere sahne olacak İspanya ve Arjantin'in karşı karşıya geleceği turnuvanın tarihinde ilk kez devre arasında sahne performansı sergilenecek Turnuvanın 96 yıllık tarihinde ilk kez kupayı kazanan takımın sporcularına şampiyonluk yüzüğü verilecek Final mücadelesinde İspanya 2010'dan sonra tarihindeki ikinci, Arjantin ise 1978, 1986 ve 2022'nin ardından 4. şampiyonluğu hedefliyor 39 yaşındaki Lionel Messi, forma giymesi halinde Brezilyalı Cafu'dan sonra 3 Dünya Kupası finalinde oynayan 2'nci futbolcu olacak","MASAK'tan Yeni Terör Finansmanı Mücadelesi MASAK'tan Yeni Terör Finansmanı Mücadelesi SonDakika MASAK, terörizmin finansmanı için eş zamanlı soruşturmalar başlatacak, yeni önlemler alacak. MASAK'tan Yeni Terör Finansmanı Mücadelesi MASAK, terörizmin finansmanı için eş zamanlı soruşturmalar başlatacak, yeni önlemler alacak. 1- MASAK'tan kara para aklama ve terörün finansmanına karşı yeni yol haritası Finansman unsuru taşıyan tüm terörizm vakalarında eş zamanlı ""terörizmin finansmanı"" soruşturması açılacak Pay defterinin elektronik ortamda tutulması zorunluluğunun kapsamı genişletilecek ve eski kayıtların elektronik ortama aktarılması sağlanacak Gerçek faydalanıcılık sicilindeki olası hatalı bildirimlerin tespiti amacıyla Ticaret Bakanlığı ve Gelir İdaresi Başkanlığınca asgari olarak 6 aylık periyotlarda ortaklaşa çalışmalar yürütülecek (Hülya Ömür Uylaş-Mert Davut/Ankara) 2- Ticaret Bakanlığından tanıtımlardaki ""indirim oyunları""na yakın takip 3- Türkiye'de geçen yıl yaklaşık 500 bin kişi iş ve tayin için taşındı Geçen yıl, iç göç gerçekleştiren her 5 kişiden biri, iş gerekçesiyle farklı bir şehre taşındı Vatandaşlar iş için en çok İstanbul'a, en az Ardahan'a göç etti 4- Türkiye'nin AB'nin yeşil ve dijital dönüşümünde ""tedarikçi"" değil, ""kurucu ortak"" olması bekleniyor DEİK Türkiye-Avrupa İş Konseyleri Koordinatör Başkanı Mehmet Ali Yalçındağ: ""Türkiye'nin Avrupa pazarına uyum sağlayan bir tedarikçi olmanın ötesine geçerek, Avrupa'nın yeşil, dijital ve dirençli sanayi dönüşümünün kurucu ortaklarından biri olarak konumlanması gerekiyor. Türkiye, AB için sadece ürün sattığı bir pazar değil, tedarik zincirlerinin ayrılmaz bir parçası olan stratejik ortak konumundadır"" ""Avrupa'nın yüksek faiz ve enflasyon kıskacında temkinli büyüme kaydedeceğini tahmin ettiğimiz 2026 yılının ikinci yarısında Türkiye'nin, lojistik ve dijital altyapısını güçlendirmesi ve mevcut avantajlarını yapısal yeşil dönüşüm reformlarıyla birleştirmesi durumunda, durgun AB pazarından en çok pay alan ülke olmaya devam edeceğine inanıyoruz"" 5- Türkiye'nin dondurma ihracatı dört ayda 23,5 milyon dolara ulaştı En fazla dondurma ihracatı yapılan ülkeler arasında Irak, ABD, KKTC, Kosova ve Kazakistan ilk sıralarda bulunuyor Ambalajlı Süt ve Süt Ürünleri Sanayicileri Derneği Genel Sekreteri Burhan Sakkaoğlu: ""Türkiye, dondurmada güçlü üretici ve ihracatçı ülkeler arasında bulunuyor, Avrupa Birliği'ne ihracat onayına sahip 43 süt ürünleri tesisinden 8'inde dondurma üretimi yapılıyor"" (Hülya Ömür Uylaş/Ankara) 6- ABD'nin 4 başkanıyla gerilim yaşayan Netanyahu'nun döneminde Amerikan yeni neslinin İsrail'e bakışı dönüşüyor Netanyahu, Trump'ın yanı sıra eski ABD Başkanları Clinton, Obama ve George W. Bush ile başta Filistin meselesi olmak üzere İran ve Orta Doğu politikaları konusunda birçok kez anlaşmazlığa düştü ABD'deki Columbia Üniversitesinden Prof. Betts'e göre, ABD kamuoyunun İsrail konusundaki tutumu son yıllarda önceki kuşaklara göre değişirken, yeni nesil artık İkinci Dünya Savaşı psikolojisini taşımıyor 7- İngiltere'deki eğitiminin ardından İstanbul'a dönen genç girişimci topraksız tarımla ihracatı hedefliyor Manchester Üniversitesi mezunu Aylin Erdoğan, Avusturya'daki kariyerini bırakarak İstanbul'da yerli teknoloji ve tohumlarla kurduğu dikey tarım tesisinde üretime başlayıp Michelin yıldızlı restoranlara satış gerçekleştirirken, rotasını Avrupa'ya ihracata çevirdi (Kaan Ulu/İstanbul) (Fotoğraflı-Görüntülü) 8- Yenilenebilir santrallerin yaygınlaşmasıyla oluşan toptan elektrik piyasalarındaki negatif fiyatlar batarya kurulumlarını hızlandıracak Almanya, Fransa, Hollanda, Belçika, İspanya ve Danimarka gibi yenilenebilir enerji kapasitesi yüksek ülkelerde negatif elektrik fiyatlarının görüldüğü saatlerin artması, enerji depolama yatırımlarını öne çıkarıyor EDEDER Yönetim Kurulu Başkanı Doğa Can Bayram: ""Depolama sistemleri, düşük fiyatlı saatlerde enerjiyi depolayıp yüksek fiyatlı saatlerde sisteme vererek gelir elde ediyor"" 9- Kartal Anadolu İmam Hatip Lisesi öğrencisi, uluslararası matematik yarışmasından altın madalyayla döndü Japonya'da düzenlenen WMI 2026 Dünya Finali'nde altın madalya kazanan Kartal Anadolu İmam Hatip Lisesi 11. sınıf öğrencisi Muhammed Enes Demirel: ""Ağustos ayının başında Vietnam'da düzenlenecek Asya Matematik Olimpiyatları'nın finali var. İnşallah orada da yine daha güzel başarı elde etmek isterim. Bunun dışında Uluslararası Matematik Olimpiyatları (IMO) adı verilen ve en prestijli matematik olimpiyatı olarak kabul edilen farklı bir yarışma var. Benim matematik olimpiyatlarına başlamamdaki en büyük motivasyon da ülkemi altın madalyayla temsil edebilmek"" ""Herhangi bir alanda kendini geliştirmek isteyen öğrencilere hocalarımız desteklerini esirgemiyor. 'Ben şunu yapmak istiyorum.' dediğimizde önümüzü açmak için ellerinden geleni yapıyorlar"" (Hamdi Dindirek/İstanbul) (Fotoğraflı-Görüntülü) 10- 2026 FIFA Dünya Kupası finali ""ilk""lere sahne olacak İspanya ve Arjantin'in karşı karşıya geleceği turnuvanın tarihinde ilk kez devre arasında sahne performansı sergilenecek Turnuvanın 96 yıllık tarihinde ilk kez kupayı kazanan takımın sporcularına şampiyonluk yüzüğü verilecek Final mücadelesinde İspanya 2010'dan sonra tarihindeki ikinci, Arjantin ise 1978, 1986 ve 2022'nin ardından 4. şampiyonluğu hedefliyor 39 yaşındaki Lionel Messi, forma giymesi halinde Brezilyalı Cafu'dan sonra 3 Dünya Kupası finalinde oynayan 2'nci futbolcu olacak",browser_full_article,https://www.sondakika.com/amp/haber-masak-tan-yeni-teror-finansmani-mucadelesi-20063836/,İstanbul,,,,,,,ilçe yok | firma yok | faaliyet/tesis yok,,,,maps araması yapılmadı,,,67.0,28
2026-07-18 07:43:32,MASAK,Kara Para / MASAK / Bahis,Oğuzhan Uğur ve 8 kişi gözaltında! MASAK radarına fahiş transferler takıldı,Oğuzhan Uğur ve 8 kişi gözaltında! MASAK radarına fahiş transferler takıldı A Haber,https://news.google.com/rss/articles/CBMiwAFBVV95cUxQMGNLOHlXWGsxRnFNMW9hYnE2b09vLUFGczhPd1VTb2hEOGNaQjdkSUZhdC1qcXYzVlFRd1p1VmxuME5xbXpZV2pMcFFIZ3Y4LUxsNW51enBLNFpUc3h0VV9vVF9zdUF0R3c2Q0t4bThaeU9JSmVBZklyRlpnTnRKQWF5bVhfZldKQUYyZ0lkQlF2WHZsR2lER2VOMmV0OGF5MGNUTGJocG81aVlENHhDeVo1bUZTZ0lwSjA0VVoyUnM?oc=5,masak,,"İstanbul Cumhuriyet Başsavcılığı tarafından yürütülen Ahbap Derneği soruşturmasında operasyonun kapsamı genişliyor. Sosyal medya platformu YouTube üzerinden... İstanbul Cumhuriyet Başsavcılığı tarafından yürütülen Ahbap Derneği soruşturmasında operasyonun kapsamı genişliyor. Sosyal medya platformu YouTube üzerinden... Haberin detayları için tıklayınız. Gündem Rojin Kabaiş soruşturmasında 'Feth-i kabir' talebi Yaşam El ve yüz havlularında görünmeyen tehlike Gündem MSB'den Rum terörüne tarihi yanıt! Gündem Ahbap Derneği MASAK incelemesinde Gündem CHP'den çıkacak yeni partinin adı ne? Kulis bilgileri A Haber'de Gündem Akıllı saat ve kulaklıklardaki gizli tehlike! Oğuzhan Uğur ve 8 kişi gözaltında! MASAK radarına fahiş transferler takıldı İstanbul Cumhuriyet Başsavcılığı tarafından yürütülen Ahbap Derneği soruşturmasında operasyonun kapsamı genişliyor. Sosyal medya platformu YouTube üzerinden yayın yapan Babala TV kurucusu Oğuzhan Uğur ve beraberindeki 8 kişi, mali suçlar ve şüpheli para trafikleri gerekçesiyle gözaltına alındı. İstanbul Emniyet Müdürlüğü Vatan Yerleşkesi’nde ifade işlemleri devam eden Uğur’un, özellikle yurt dışı kaynaklı fahiş para transferleri ve 6 Şubat depremleri dönemindeki bağış yönlendirmeleri mercek altına alındı. A Haber muhabiri Hasan Zahid Ezim soruşturmanın odağındaki mali detayları aktardı. Malatya’da korkutan deprem! Şükrü Ersoy’dan uyarı Aziz Üstel 80 yaşında hayatını kaybetti Malatya'da 5 büyüklüğünde deprem! Damak çatlatan Divriği pilavının sırrı! İki katlı müstakil evde kısmi göçük Giriş Tarihi: 18 Temmuz 2026 10:43 ahaber.com.tr Haber Merkezi Giriş Tarihi: 18 Temmuz 2026 10:43 ahaber.com.tr Haber Merkezi İstanbul Cumhuriyet Başsavcılığı tarafından yürütülen Ahbap Derneği soruşturmasında operasyonun kapsamı genişliyor. Sosyal medya platformu YouTube üzerinden yayın yapan Babala TV kurucusu Oğuzhan Uğur ve beraberindeki 8 kişi, mali suçlar ve şüpheli para trafikleri gerekçesiyle gözaltına alındı. İstanbul Emniyet Müdürlüğü Vatan Yerleşkesi’nde ifade işlemleri devam eden Uğur’un, özellikle yurt dışı kaynaklı fahiş para transferleri ve 6 Şubat depremleri dönemindeki bağış yönlendirmeleri mercek altına alındı. A Haber muhabiri Hasan Zahid Ezim soruşturmanın odağındaki mali detayları aktardı. Önceki haber Ahbap Derneği MASAK incelemesinde Sonraki haber Bakan Gürlek: 6 faili meçhul cinayet aydınlatıldı Önceki haber Ahbap Derneği MASAK incelemesinde Sonraki haber Bakan Gürlek: 6 faili meçhul cinayet aydınlatıldı Oğuzhan Uğur ve 8 kişi gözaltında! MASAK radarına fahiş transferler takıldı","Oğuzhan Uğur ve 8 kişi gözaltında! MASAK radarına fahiş transferler takıldı Oğuzhan Uğur ve 8 kişi gözaltında! MASAK radarına fahiş transferler takıldı A Haber İstanbul Cumhuriyet Başsavcılığı tarafından yürütülen Ahbap Derneği soruşturmasında operasyonun kapsamı genişliyor. Sosyal medya platformu YouTube üzerinden... Gündem Rojin Kabaiş soruşturmasında 'Feth-i kabir' talebi Yaşam El ve yüz havlularında görünmeyen tehlike Gündem MSB'den Rum terörüne tarihi yanıt! Gündem Ahbap Derneği MASAK incelemesinde Gündem CHP'den çıkacak yeni partinin adı ne? Oğuzhan Uğur ve 8 kişi gözaltında! MASAK radarına fahiş transferler takıldı İstanbul Cumhuriyet Başsavcılığı tarafından yürütülen Ahbap Derneği soruşturmasında operasyonun kapsamı genişliyor. Sosyal medya platformu YouTube üzerinden yayın yapan Babala TV kurucusu Oğuzhan Uğur ve beraberindeki 8 kişi, mali suçlar ve şüpheli para trafikleri gerekçesiyle gözaltına alındı. İstanbul Emniyet Müdürlüğü Vatan Yerleşkesi’nde ifade işlemleri devam eden Uğur’un, özellikle yurt dışı kaynaklı fahiş para transferleri ve 6 Şubat depremleri dönemindeki bağış yönlendirmeleri mercek altına alındı. A Haber muhabiri Hasan Zahid Ezim soruşturmanın odağındaki mali detayları aktardı. Malatya’da korkutan deprem! Şükrü Ersoy’dan uyarı Aziz Üstel 80 yaşında hayatını kaybetti Malatya'da 5 büyüklüğünde deprem! İki katlı müstakil evde kısmi göçük Giriş Tarihi: 18 Temmuz 2026 10:43 ahaber.com.tr Haber Merkezi Giriş Tarihi: 18 Temmuz 2026 10:43 ahaber.com.tr Haber Merkezi İstanbul Cumhuriyet Başsavcılığı tarafından yürütülen Ahbap Derneği soruşturmasında operasyonun kapsamı genişliyor. Önceki haber Ahbap Derneği MASAK incelemesinde Sonraki haber Bakan Gürlek: 6 faili meçhul cinayet aydınlatıldı Önceki haber Ahbap Derneği MASAK incelemesinde Sonraki haber Bakan Gürlek: 6 faili meçhul cinayet aydınlatıldı Oğuzhan Uğur ve 8 kişi gözaltında! MASAK radarına fahiş transferler takıldı",browser_full_article,https://www.ahaber.com.tr/video/gundem-videolari/oguzhan-ugur-ve-8-kisi-gozaltinda-masak-radarina-fahis-transferler-takildi,İstanbul | Malatya,,,,,,,ilçe yok | firma yok | faaliyet/tesis yok,,,,maps araması yapılmadı,,,99.25,29
2026-07-18 05:45:00,MASAK,Kara Para / MASAK / Bahis,MASAK Ulusal Strateji Belgesi (2026-2030),MASAK Ulusal Strateji Belgesi (2026-2030) Bağımsız Denetim Türkiye,https://news.google.com/rss/articles/CBMickFVX3lxTE9QSVptRnlCdGZnbTZscDFza0ZfcnhZSS1waGs4ejhzQ2RqeWdid24tdV9BT0ZEc1hHUEIyd1BJSmw4Q3oxcV92ejF2Ny1YM2Z4WXJOdXI0ak1WUnZtcWhBaU05YXlwNTE4U1R3Q2xPbHAwUdIBd0FVX3lxTFBzQkVMUmN5YVVRYTY4eVFTNWpPemRQWWJqcEZvU3doTlNIVXFyYXRZVlNWQTZEQ1ZFbnF0NlZsc1ZNVFBfNnk2cGRpWFNsb3FKV05mXzdMSXc3LVI2MnMybl94UV96dTB1VmpGY1pZOVZVdFZad1BN?oc=5,masak,,MASAK Ulusal Strateji Belgesi (2026-2030) Bağımsız Denetim Türkiye,MASAK Ulusal Strateji Belgesi (2026-2030) MASAK Ulusal Strateji Belgesi (2026-2030) Bağımsız Denetim Türkiye MASAK Ulusal Strateji Belgesi (2026-2030) Bağımsız Denetim Türkiye,browser_failed,https://news.google.com/rss/articles/CBMickFVX3lxTE9QSVptRnlCdGZnbTZscDFza0ZfcnhZSS1waGs4ejhzQ2RqeWdid24tdV9BT0ZEc1hHUEIyd1BJSmw4Q3oxcV92ejF2Ny1YM2Z4WXJOdXI0ak1WUnZtcWhBaU05YXlwNTE4U1R3Q2xPbHAwUdIBd0FVX3lxTFBzQkVMUmN5YVVRYTY4eVFTNWpPemRQWWJqcEZvU3doTlNIVXFyYXRZVlNWQTZEQ1ZFbnF0NlZsc1ZNVFBfNnk2cGRpWFNsb3FKV05mXzdMSXc3LVI2MnMybl94UV96dTB1VmpGY1pZOVZVdFZad1BN?oc=5&hl=tr&gl=TR&ceid=TR:tr,,,,,,,,il yok | ilçe yok | firma yok | faaliyet/tesis yok,,,,maps araması yapılmadı,,,45.66,30
2026-07-17 18:15:45,MASAK,Kara Para / MASAK / Bahis,Ahbap Derneği MASAK incelemesinde,Ahbap Derneği MASAK incelemesinde ATV,https://news.google.com/rss/articles/CBMikgFBVV95cUxNTzdnSExHY2psWUxNcG9ZQzRiMVFzMmYwZVhrZmpVeWNDX3U4bFg5RFByZEdIbDZzaTc4c0J0aGVmYnBSUi11cGtybVIxXzRTdUJ1RXhNUkpsN3BsR2hFZUF6VlVubVB0NDJMb01JbEN6ejNWS2NGNTBBSUw1ZVl0YkRaNFV2VDRPOUZibXJRRnEzZw?oc=5,masak,,Ahbap Derneği MASAK incelemesinde ATV,Ahbap Derneği MASAK incelemesinde Ahbap Derneği MASAK incelemesinde ATV Ahbap Derneği MASAK incelemesinde ATV,browser_failed,https://news.google.com/rss/articles/CBMikgFBVV95cUxNTzdnSExHY2psWUxNcG9ZQzRiMVFzMmYwZVhrZmpVeWNDX3U4bFg5RFByZEdIbDZzaTc4c0J0aGVmYnBSUi11cGtybVIxXzRTdUJ1RXhNUkpsN3BsR2hFZUF6VlVubVB0NDJMb01JbEN6ejNWS2NGNTBBSUw1ZVl0YkRaNFV2VDRPOUZibXJRRnEzZw?oc=5&hl=tr&gl=TR&ceid=TR:tr,,,,,,,,il yok | ilçe yok | firma yok | faaliyet/tesis yok,,,,maps araması yapılmadı,,,34.12,31
2026-07-17 13:57:51,MASAK,Kara Para / MASAK / Bahis,Oğuzhan Uğur'un bağlantılı olduğu Babala TV hakkında MASAK bildirimi iddiası,Oğuzhan Uğur'un bağlantılı olduğu Babala TV hakkında MASAK bildirimi iddiası Söz Bursa,https://news.google.com/rss/articles/CBMitgFBVV95cUxQTVZ3aW5KOFpVZVZfSXRCMzJFZ2VQLVZXb29EWkxjeWFqOXhuWERQN2MxTWJ1VE5HaERxT2FtUWRkbkxDNlZtQ1dGYkVyUTNRNENfYkpUQVhSWjVWSUtydkEyQjNlWXZlNlY3NnhldDN0TWFzU0JHc2psSkNCMnZzZFlZNnhoMWpVaG1LM3o3elJlQmlsbE82M0dwNVRCdGJTb0UtdTgxdWlweDRFeGtCSTN1RUJSdw?oc=5,masak,,Oğuzhan Uğur'un bağlantılı olduğu Babala TV hakkında MASAK bildirimi iddiası Söz Bursa,Oğuzhan Uğur'un bağlantılı olduğu Babala TV hakkında MASAK bildirimi iddiası Oğuzhan Uğur'un bağlantılı olduğu Babala TV hakkında MASAK bildirimi iddiası Söz Bursa Oğuzhan Uğur'un bağlantılı olduğu Babala TV hakkında MASAK bildirimi iddiası Söz Bursa,browser_failed,https://news.google.com/rss/articles/CBMitgFBVV95cUxQTVZ3aW5KOFpVZVZfSXRCMzJFZ2VQLVZXb29EWkxjeWFqOXhuWERQN2MxTWJ1VE5HaERxT2FtUWRkbkxDNlZtQ1dGYkVyUTNRNENfYkpUQVhSWjVWSUtydkEyQjNlWXZlNlY3NnhldDN0TWFzU0JHc2psSkNCMnZzZFlZNnhoMWpVaG1LM3o3elJlQmlsbE82M0dwNVRCdGJTb0UtdTgxdWlweDRFeGtCSTN1RUJSdw?oc=5&hl=tr&gl=TR&ceid=TR:tr,,,,,,,,il yok | ilçe yok | firma yok | faaliyet/tesis yok,,,,maps araması yapılmadı,,,76.36,32
