published,search_term,category,title,summary,link,matched_words,activity_type,raw_text,entity_source_text,article_fetch_status,resolved_article_url,city_candidates,district_candidates,neighborhood_candidates,street_candidates,facility_candidates,company_candidates,company_candidate_scores,entity_quality_note,maps_queries,maps_candidates,maps_best_guess,maps_status,maps_match_scores,maps_rejected_candidates,record_quality_score,duplicate_group_id
2026-07-07 12:14:00,fabrika yangını,Fiziksel Risk / Yangın,Kaçak fabrika yangınında bir işçi yanarak can verdi,Kaçak fabrika yangınında bir işçi yanarak can verdi Kocaeli Gündem,https://news.google.com/rss/articles/CBMilwFBVV95cUxNR1FsaU91NEdlWW1fNl93X3lUYjI4MXBFUzdXZU5zQ3p3VGtBS3dqLXdOdFk3ekZodWM0RlB6ZTRHTllGQWZxWHBlbmQ2TWpNdmtSYk1jYWVYa0hDcUlyQ0x3Mmw2ZExlaWctb2hWYk5VNjhKaXdwME9mMGgxT1UzbEg4WHNranlGX09NSkUxMEFEeGdPemVR0gGcAUFVX3lxTE5Ic1pwbDN4MlVSb3ZnUi1iTDJoS1hvMDhQbFJIcGdtcXllTjlSdmtmZGpaSEp0SHF2ZzdFQ0V4WjNXb2oxM1BPemUxXzFEcmVoeVhhcjdORlZfZ0ZnTWExbW1KWjdwRDQ0c2xIcUNIMTdsbkxFNS1jaDgtZl9HeWs5eXQ2OUl3YmVvNUg4UjFuZjZsTE10VC03eW9wdQ?oc=5,fabrika,fabrika,"Derince sınırlarında bulunan ve ocak ayında Büyükşehir Belediyesi tarafından mühürlenen Pamir Boya Fabrikası'nda çıkan yangında 25 yaşındaki Samet S. hayatını kaybetti. İddiaya göre yangın tüpünü almak için yeniden fabrikanın içine giren genç işçi bir daha dışarı çıkamadı. Yangında Yunus Çalban ile ismi öğrenilemeyen bir işçi Derince Eğitim ve Araştırma Hastanesi'ne kaldırılırken, dumandan etkilenen 3 işçiye ise olay yerinde sağlık ekipleri tarafından müdahale edildi. Derince sınırlarında bulunan ve ocak ayında Büyükşehir Belediyesi tarafından mühürlenen Pamir Boya Fabrikası'nda çıkan yangında 25 yaşındaki Samet S. hayatını k... Derince sınırlarında bulunan ve ocak ayında Büyükşehir Belediyesi tarafından mühürlenen Pamir Boya Fabrikası'nda çıkan yangında 25 yaşındaki Samet S. hayatını kaybetti. İddiaya göre yangın tüpünü almak için yeniden fabrikanın içine giren genç işçi bir daha dışarı çıkamadı. Yangında Yunus Çalban ile ismi öğrenilemeyen bir işçi Derince Eğitim ve Araştırma Hastanesi'ne kaldırılırken, dumandan etkilenen 3 işçiye ise olay yerinde sağlık ekipleri tarafından müdahale edildi. 01 Taksi - Yangın çıkıp bırısı ölünce mi kaçak olduğu anlaşılıyor yetkılilerde sorumlu bu olumden Yanıtla . 0 Beğen . 0 Beğenme 08 Temmuz 00:45 ÖĞLE SAATLERİNDE BAŞLADI Derince sınırlarında kalan Pamir Boya Fabrikası'nda öğle saatlerinde başlayan yangın kent genelinde büyük paniğe neden oldu. Yangın çıktığı sırada fabrikadan çıkamayan 25 yaşındaki Samet S.’nin yanarak yaşamını yitirdiği öğrenildi. Dumandan etkilenen Yunus Çalban ve ismi öğrenilmeyen bir işçinin Derince Eğitim ve Araştırma Hastanesi’ne kaldırılarak tedavi altına alındığı, 3 işçinin de ayakta tedavi edildiği belirtildi. Bu haberi kaçırmayın Derince’de yanan fabrika kaçak çıktı Devamını Oku Bu haberi kaçırmayın Boya fabrikasında korkutan yangın! Çok sayıda ekip sevk edildi Devamını Oku DERİNCE EĞİTİM ARAŞTIRMA HASTANESİNE KALDIRILDI Derince sınırlarında 2015 yılında kurulan ve 10 yıl boyunca kaçak üretim yapan Pamir Boya fabrikası ocak ayında Büyükşehir tarafından ruhsatsız olduğu için mühürlendi ve faaliyetten men edildi. Buna rağmen üretim yaptığı iddia edilen fabrikada bugün yangın çıktı. İtfaiye ve AFAD ekipleri dışında 4 ambulans ve UMKE ekibinin hazır bulunduğu olayda vatandaşların yangın bölgesine yaklaşmaması için 500 metrelik bir koruma bandı oluşturuldu. Kent için büyük bir çevre felaketi olarak nitelendirilen yangında Samet S. isimli 25 yaşındaki bir işçinin yaşamını yitirdiği belirtildi. Yangın sırasında dumandan etkilenen işçilerden Yunus Çalban ise Derince Eğitim ve Araştırma Hastanesi'ne kaldırıldı. Bu haberi kaçırmayın Kandıra'da orman yangını: Sahildeki vatandaşlar büyük korku yaşadı Devamını Oku Kaçak fabrika yangınında bir işçi yanarak can verdi DERİNCE EĞİTİM ARAŞTIRMA HASTANESİNE KALDIRILDI Derince sınırlarında bulunan ve ocak ayında Büyükşehir Belediyesi tarafından mühürlenen Pamir Boya Fabrikası'nda çıkan yangında 25 yaşındaki Samet S. hayatını kaybetti. İddiaya göre yangın tüpünü almak için yeniden fabrikanın içine giren genç işçi bir daha dışarı çıkamadı. Yangında Yunus Çalban ile ismi öğrenilemeyen bir işçi Derince Eğitim ve Araştırma Hastanesi'ne kaldırılırken, dumandan etkilenen 3 işçiye ise olay yerinde sağlık ekipleri tarafından müdahale edildi. Derince sınırlarında kalan Pamir Boya Fabrikası'nda öğle saatlerinde başlayan yangın kent genelinde büyük paniğe neden oldu. Yangın çıktığı sırada fabrikadan çıkamayan 25 yaşındaki Samet S.’nin yanarak yaşamını yitirdiği öğrenildi. Dumandan etkilenen Yunus Çalban ve ismi öğrenilmeyen bir işçinin Derince Eğitim ve Araştırma Hastanesi’ne kaldırılarak tedavi altına alındığı, 3 işçinin de ayakta tedavi edildiği belirtildi. Derince sınırlarında 2015 yılında kurulan ve 10 yıl boyunca kaçak üretim yapan Pamir Boya fabrikası ocak ayında Büyükşehir tarafından ruhsatsız olduğu için mühürlendi ve faaliyetten men edildi. Buna rağmen üretim yaptığı iddia edilen fabrikada bugün yangın çıktı. İtfaiye ve AFAD ekipleri dışında 4 ambulans ve UMKE ekibinin hazır bulunduğu olayda vatandaşların yangın bölgesine yaklaşmaması için 500 metrelik bir koruma bandı oluşturuldu. Kent için büyük bir çevre felaketi olarak nitelendirilen yangında Samet S. isimli 25 yaşındaki bir işçinin yaşamını yitirdiği belirtildi. Yangın sırasında dumandan etkilenen işçilerden Yunus Çalban ise Derince Eğitim ve Araştırma Hastanesi'ne kaldırıldı. 07 Tem 2026 - 15:14 - Asayiş Yazdır Yorum yazarak Kocaeli Gündem Topluluk Kuralları’nı kabul etmiş bulunuyor ve yorumunuzla ilgili doğrudan veya dolaylı tüm sorumluluğu tek başınıza üstleniyorsunuz. Yazılan yorumlardan Ko","Kaçak fabrika yangınında bir işçi yanarak can verdi Kaçak fabrika yangınında bir işçi yanarak can verdi Kocaeli Gündem Derince sınırlarında bulunan ve ocak ayında Büyükşehir Belediyesi tarafından mühürlenen Pamir Boya Fabrikası'nda çıkan yangında 25 yaşındaki Samet S. İddiaya göre yangın tüpünü almak için yeniden fabrikanın içine giren genç işçi bir daha dışarı çıkamadı. Yangında Yunus Çalban ile ismi öğrenilemeyen bir işçi Derince Eğitim ve Araştırma Hastanesi'ne kaldırılırken, dumandan etkilenen 3 işçiye ise olay yerinde sağlık ekipleri tarafından müdahale edildi. 01 Taksi - Yangın çıkıp bırısı ölünce mi kaçak olduğu anlaşılıyor yetkılilerde sorumlu bu olumden Yanıtla . 0 Beğenme 08 Temmuz 00:45 ÖĞLE SAATLERİNDE BAŞLADI Derince sınırlarında kalan Pamir Boya Fabrikası'nda öğle saatlerinde başlayan yangın kent genelinde büyük paniğe neden oldu. Yangın çıktığı sırada fabrikadan çıkamayan 25 yaşındaki Samet S.’nin yanarak yaşamını yitirdiği öğrenildi. Dumandan etkilenen Yunus Çalban ve ismi öğrenilmeyen bir işçinin Derince Eğitim ve Araştırma Hastanesi’ne kaldırılarak tedavi altına alındığı, 3 işçinin de ayakta tedavi edildiği belirtildi. Bu haberi kaçırmayın Derince’de yanan fabrika kaçak çıktı Devamını Oku Bu haberi kaçırmayın Boya fabrikasında korkutan yangın! Çok sayıda ekip sevk edildi Devamını Oku DERİNCE EĞİTİM ARAŞTIRMA HASTANESİNE KALDIRILDI Derince sınırlarında 2015 yılında kurulan ve 10 yıl boyunca kaçak üretim yapan Pamir Boya fabrikası ocak ayında Büyükşehir tarafından ruhsatsız olduğu için mühürlendi ve faaliyetten men edildi. Buna rağmen üretim yaptığı iddia edilen fabrikada bugün yangın çıktı. İtfaiye ve AFAD ekipleri dışında 4 ambulans ve UMKE ekibinin hazır bulunduğu olayda vatandaşların yangın bölgesine yaklaşmaması için 500 metrelik bir koruma bandı oluşturuldu. Kent için büyük bir çevre felaketi olarak nitelendirilen yangında Samet S. isimli 25 yaşındaki bir işçinin yaşamını yitirdiği belirtildi. Yangın sırasında dumandan etkilenen işçilerden Yunus Çalban ise Derince Eğitim ve Araştırma Hastanesi'ne kaldırıldı. Bu haberi kaçırmayın Kandıra'da orman yangını: Sahildeki vatandaşlar büyük korku yaşadı Devamını Oku Kaçak fabrika yangınında bir işçi yanarak can verdi DERİNCE EĞİTİM ARAŞTIRMA HASTANESİNE KALDIRILDI Derince sınırlarında bulunan ve ocak ayında Büyükşehir Belediyesi tarafından mühürlenen Pamir Boya Fabrikası'nda çıkan yangında 25 yaşındaki Samet S. Derince sınırlarında kalan Pamir Boya Fabrikası'nda öğle saatlerinde başlayan yangın kent genelinde büyük paniğe neden oldu. Derince sınırlarında 2015 yılında kurulan ve 10 yıl boyunca kaçak üretim yapan Pamir Boya fabrikası ocak ayında Büyükşehir tarafından ruhsatsız olduğu için mühürlendi ve faaliyetten men edildi. 07 Tem 2026 - 15:14 - Asayiş Yazdır Yorum yazarak Kocaeli Gündem Topluluk Kuralları’nı kabul etmiş bulunuyor ve yorumunuzla ilgili doğrudan veya dolaylı tüm sorumluluğu tek başınıza üstleniyorsunuz.",browser_full_article,https://kocaeligundem.com/haber/28300489/kacak-fabrika-yangininda-bir-isci-yanarak-can-verdi,Kocaeli,Derince | Kandıra,,,Pamir Boya Fabrikası | Pamir Boya fabrikası,,,firma yok,Pamir Boya Fabrikası Derince Kocaeli Türkiye,PAMİR BOYA,PAMİR BOYA,"firma adı yok, tesis/lokasyon ile maps tahmini var",64.51612903225806,,159.0,31
2026-07-07 14:47:00,ihale yolsuzluğu,Diğer,At eti satan firmaya ihale yasağı,At eti satan firmaya ihale yasağı Mersin Haberci Gazetesi,https://news.google.com/rss/articles/CBMijgFBVV95cUxOd1NsRmhBSFRyTjB2SExVSkdaUVVBT3FEYl9xUUM0STVOemlQOEJSM3F1UFpGeGRvREpDTG5aM0paaXNJOGt2T0VXSndXREVJd05VRjRVODFtRE5ZNmZVamUxRnFwZThiemRWMTZyV2dDVWNuMlVnUHZkNlpTSlZjWHlfUGhHSzhsNU9UbU5B?oc=5,firma,şirket / firma,At eti satan firmaya ihale yasağı Mersin Haberci Gazetesi,At eti satan firmaya ihale yasağı At eti satan firmaya ihale yasağı Mersin Haberci Gazetesi At eti satan firmaya ihale yasağı Mersin Haberci Gazetesi,browser_failed,https://news.google.com/rss/articles/CBMijgFBVV95cUxOd1NsRmhBSFRyTjB2SExVSkdaUVVBT3FEYl9xUUM0STVOemlQOEJSM3F1UFpGeGRvREpDTG5aM0paaXNJOGt2T0VXSndXREVJd05VRjRVODFtRE5ZNmZVamUxRnFwZThiemRWMTZyV2dDVWNuMlVnUHZkNlpTSlZjWHlfUGhHSzhsNU9UbU5B?oc=5&hl=tr&gl=TR&ceid=TR:tr,,,,,,,,il yok | ilçe yok | firma yok | faaliyet/tesis yok,,,,maps araması yapılmadı,,,29.32,32
2026-07-08 07:47:42,yangın,Fiziksel Risk / Yangın,Gebze'de Geri Dönüşüm Tesisinde Yangın,Gebze'de Geri Dönüşüm Tesisinde Yangın Son Dakika,https://news.google.com/rss/articles/CBMijAFBVV95cUxNWTlGLU4xdnRaazVWaDViZktGVE85RXVlU3NjSnpsRVZuTU1yUXFvaldKUnV1YVloaV9adkpsdnJxbmV2T3FtN2tDcTYyZUFKU1cxUDdhd3F5Z0Ewai1PU2VvLTBjdlNTemw1Z2o3UjRYbDVMcnl4R2x2TThBa2VXWG1NdWhPOFJyb244c9IBjAFBVV95cUxNWTlGLU4xdnRaazVWaDViZktGVE85RXVlU3NjSnpsRVZuTU1yUXFvaldKUnV1YVloaV9adkpsdnJxbmV2T3FtN2tDcTYyZUFKU1cxUDdhd3F5Z0Ewai1PU2VvLTBjdlNTemw1Z2o3UjRYbDVMcnl4R2x2TThBa2VXWG1NdWhPOFJyb244cw?oc=5,tesis,,"Kocaeli'nin Gebze ilçesindeki geri dönüşüm tesisinde çıkan yangın, itfaiye ekiplerince söndürüldü. Kocaeli'nin Gebze ilçesindeki geri dönüşüm tesisinde çıkan yangın, itfaiye ekiplerince söndürüldü. Kocaeli'nin Gebze ilçesindeki geri dönüşüm tesisinde çıkan yangın, itfaiye ekiplerince söndürüldü. Gebze'de Geri Dönüşüm Tesisinde Yangın Son Güncelleme: 08.07.2026 10:47 Kocaeli'nin Gebze ilçesindeki geri dönüşüm tesisinde çıkan yangın, itfaiye ekiplerince söndürüldü. Kocaeli 'nin Gebze ilçesinde bir geri dönüşüm tesisindeki konteynerlerde çıkan yangın, itfaiye ekiplerince söndürüldü. Pelitli Mahallesi Yeni Mezarlık Yolu Caddesi'nde bulunan geri dönüşüm tesisinde, içerisinde köpük panellerin bulunduğu konteynerde yangın çıktı. Kısa sürede büyüyen alevler, yanındaki diğer konteynere de sıçradı. İhbar üzerine bölgeye sevk edilen itfaiye ekipleri, yaklaşık 1 saatlik çalışmayla yangını söndürdü. Yangında iki konteyner kullanılamaz hale geldi. Kaynak: AA Kocaeli 'nin Gebze ilçesinde bir geri dönüşüm tesisindeki konteynerlerde çıkan yangın, itfaiye ekiplerince söndürüldü. Pelitli Mahallesi Yeni Mezarlık Yolu Caddesi'nde bulunan geri dönüşüm tesisinde, içerisinde köpük panellerin bulunduğu konteynerde yangın çıktı. Kısa sürede büyüyen alevler, yanındaki diğer konteynere de sıçradı. İhbar üzerine bölgeye sevk edilen itfaiye ekipleri, yaklaşık 1 saatlik çalışmayla yangını söndürdü. Yangında iki konteyner kullanılamaz hale geldi. Gebze'de Geri Dönüşüm Tesisinde Yangın Kocaeli'nin Gebze ilçesindeki geri dönüşüm tesisinde çıkan yangın, itfaiye ekiplerince söndürüldü. Kocaeli 'nin Gebze ilçesinde bir geri dönüşüm tesisindeki konteynerlerde çıkan yangın, itfaiye ekiplerince söndürüldü. Pelitli Mahallesi Yeni Mezarlık Yolu Caddesi'nde bulunan geri dönüşüm tesisinde, içerisinde köpük panellerin bulunduğu konteynerde yangın çıktı. Kısa sürede büyüyen alevler, yanındaki diğer konteynere de sıçradı. İhbar üzerine bölgeye sevk edilen itfaiye ekipleri, yaklaşık 1 saatlik çalışmayla yangını söndürdü. Yangında iki konteyner kullanılamaz hale geldi.","Gebze'de Geri Dönüşüm Tesisinde Yangın Gebze'de Geri Dönüşüm Tesisinde Yangın Son Dakika Kocaeli'nin Gebze ilçesindeki geri dönüşüm tesisinde çıkan yangın, itfaiye ekiplerince söndürüldü. Gebze'de Geri Dönüşüm Tesisinde Yangın Son Güncelleme: 08.07.2026 10:47 Kocaeli'nin Gebze ilçesindeki geri dönüşüm tesisinde çıkan yangın, itfaiye ekiplerince söndürüldü. Kocaeli 'nin Gebze ilçesinde bir geri dönüşüm tesisindeki konteynerlerde çıkan yangın, itfaiye ekiplerince söndürüldü. Pelitli Mahallesi Yeni Mezarlık Yolu Caddesi'nde bulunan geri dönüşüm tesisinde, içerisinde köpük panellerin bulunduğu konteynerde yangın çıktı. Kısa sürede büyüyen alevler, yanındaki diğer konteynere de sıçradı. İhbar üzerine bölgeye sevk edilen itfaiye ekipleri, yaklaşık 1 saatlik çalışmayla yangını söndürdü. Yangında iki konteyner kullanılamaz hale geldi. Kaynak: AA Kocaeli 'nin Gebze ilçesinde bir geri dönüşüm tesisindeki konteynerlerde çıkan yangın, itfaiye ekiplerince söndürüldü. Gebze'de Geri Dönüşüm Tesisinde Yangın Kocaeli'nin Gebze ilçesindeki geri dönüşüm tesisinde çıkan yangın, itfaiye ekiplerince söndürüldü.",browser_full_article,https://www.sondakika.com/amp/haber-gebze-de-geri-donusum-tesisinde-yangin-20030010/,Kocaeli,Gebze,Pelitli Mahallesi,Mahallesi Yeni Mezarlık Yolu Caddesi,,,,firma yok | faaliyet/tesis yok,,,,maps araması yapılmadı,,,116.25,33
2026-07-08 10:13:00,yangın,Fiziksel Risk / Yangın,"Malatya Organize Sanayi Bölgesi'nde bulunan tekstil fabrikasının atık deposunda yangın çıktı, itfaiye müdahale etti.","Malatya Organize Sanayi Bölgesi'nde bulunan tekstil fabrikasının atık deposunda yangın çıktı, itfaiye müdahale etti. Mersin Haber",https://news.google.com/rss/articles/CBMi6gFBVV95cUxQVHNIM09NZWhCTjljN2x0OTRTOGo1Sk9wcS13Yjdnb1VWVHM4dDhDcGduSzUtbzNYV2Q1OEkxaTBBNF9Zd3V3ZElwNUhHbGxaRnUzbTV2ZHdkamQ0VVlJUHhKUVhtWEFhQnZXeVFKTnoxZkNDYXNBX0RfZzRUSDQzNEpjQnZYVmJud2RJTzZmdk1pMTNFalNjWFpRaWdJTjVCeDVzREQyel9yZFo3d2lVOGtXSXFXU3owdmFqeDdXdXNTWUxrdk1xNkRjb1Y4RFptbXA2THFpT0FhdldCcG9iQVh6blRPZ1RtdFHSAVdBVV95cUxOd0txTEo3TlBaeWlrNnRaM2c1QWlPVlhFemNFdTdDeGh6dEZhNmFleUxZTFMtcElOaXVLZWRDU09nVlRSMkdERUw0eG00UkdEakhRT3hyMUU?oc=5,"depo, fabrika, organize sanayi, sanayi, tekstil",fabrika | depo,"Mersin'den haberiniz olsun! Mersin ve ilçelerinden son dakika ve önemli haberler, gelişmeler olayları sunar. Malatya'da Organize Sanayi Bölgesi'nde yer alan bir tekstil fabrikasının atık deposunda meydana gelen yangın, itfaiye ekiplerinin hızlı müdahalesiyle Mersin'den haberiniz olsun! Mersin ve ilçelerinden son dakika ve önemli haberler, gelişmeler olayları sunar. Edinilen bilgilere göre, 1. Organize Sanayi Bölgesi 4. Cadde üzerinde faaliyet gösteren tekstil fabrikasının atık deposunda henüz belirlenemeyen bir nedenle yangın çıktığı bildirildi. Olayın bildirilmesinin ardından Malatya Büyükşehir Belediyesi İtfaiye Daire Başkanlığı'na bağlı ekipler hızla olay yerine sevk edildi. Yangına müdahale için 5 araç ve 22 personel ile müdahale eden ekipler, alevleri kısa sürede kontrol altına alarak söndürdü. Yangın sonucunda can kaybı ya da yaralanma yaşanmazken, atık deposunda maddi hasar meydana geldi. Yangının çıkış nedeninin tespit edilmesi amacıyla detaylı bir inceleme başlatıldığı ifade edildi. Malatya Organize Sanayi Bölgesi'nde bulunan tekstil fabrikasının atık deposunda yangın çıktı, itfaiye müdahale etti. Haber Merkezi • 08 Temmuz 2026 13:13 • Güncellendi: 08 Temmuz 2026 13:16 Malatya'da Organize Sanayi Bölgesi'nde yer alan bir tekstil fabrikasının atık deposunda meydana gelen yangın, itfaiye ekiplerinin hızlı müdahalesiyle kontrol altına alındı. Haber Merkezi • 08 Temmuz 2026 13:13 • Güncellendi: 08 Temmuz 2026 13:16 Malatya'da Organize Sanayi Bölgesi'nde yer alan bir tekstil fabrikasının atık deposunda meydana gelen yangın, itfaiye ekiplerinin hızlı müdahalesiyle kontrol altına alındı. Malatya Organize Sanayi Bölgesi'nde bulunan tekstil fabrikasının atık deposunda yangın çıktı, itfaiye müdahale etti.","Malatya Organize Sanayi Bölgesi'nde bulunan tekstil fabrikasının atık deposunda yangın çıktı, itfaiye müdahale etti. Malatya Organize Sanayi Bölgesi'nde bulunan tekstil fabrikasının atık deposunda yangın çıktı, itfaiye müdahale etti. Mersin Haber Mersin'den haberiniz olsun! Malatya'da Organize Sanayi Bölgesi'nde yer alan bir tekstil fabrikasının atık deposunda meydana gelen yangın, itfaiye ekiplerinin hızlı müdahalesiyle Mersin'den haberiniz olsun! Edinilen bilgilere göre, 1. Organize Sanayi Bölgesi 4. Cadde üzerinde faaliyet gösteren tekstil fabrikasının atık deposunda henüz belirlenemeyen bir nedenle yangın çıktığı bildirildi. Olayın bildirilmesinin ardından Malatya Büyükşehir Belediyesi İtfaiye Daire Başkanlığı'na bağlı ekipler hızla olay yerine sevk edildi. Yangına müdahale için 5 araç ve 22 personel ile müdahale eden ekipler, alevleri kısa sürede kontrol altına alarak söndürdü. Yangın sonucunda can kaybı ya da yaralanma yaşanmazken, atık deposunda maddi hasar meydana geldi. Yangının çıkış nedeninin tespit edilmesi amacıyla detaylı bir inceleme başlatıldığı ifade edildi. Malatya Organize Sanayi Bölgesi'nde bulunan tekstil fabrikasının atık deposunda yangın çıktı, itfaiye müdahale etti. Haber Merkezi • 08 Temmuz 2026 13:13 • Güncellendi: 08 Temmuz 2026 13:16 Malatya'da Organize Sanayi Bölgesi'nde yer alan bir tekstil fabrikasının atık deposunda meydana gelen yangın, itfaiye ekiplerinin hızlı müdahalesiyle kontrol altına alındı.",browser_full_article,https://www.mersinhaber.com/haber-malatya-organize-sanayi-bolgesinde-bulunan-tekstil-fabrikasinin-atik-deposunda-yangin-cikti-itfaiye-mudahale-etti/698014,Malatya | Mersin,,Malatya Organize Sanayi | da Organize Sanayi,,,Malatya Organize Sanayi,Malatya Organize Sanayi:292:body+summary+title,ilçe yok | faaliyet/tesis yok,Malatya Organize Sanayi Malatya Organize Sanayi Malatya Türkiye,Malatya 1.Organize Sanayi Bölgesi,Malatya 1.Organize Sanayi Bölgesi,firma adı + güvenli maps adayı var,100.0,,259.25,34
2026-07-08 10:22:00,yangın,Fiziksel Risk / Yangın,Kayseri Melikgazi'de Bir Çelik Eşya Atölyesinde Çıkan Yangın Ekipler Tarafından Söndürüldü,Kayseri Melikgazi'de Bir Çelik Eşya Atölyesinde Çıkan Yangın Ekipler Tarafından Söndürüldü Mersin Haber,https://news.google.com/rss/articles/CBMiygFBVV95cUxNTU1MQjJ6dS1WVVB3MDduVFo0b0pFRWRxRE1BSTZfUHRGS1JlLVoxbG1Vd01XMmxBQW9ER2ZiZzYxZDRMZ0xVQ2F0ekxoNjdoNzhVTkxwZ0NHdUFZUUI4UWtUYXh4MENGUVNacDFrV0JJaGpOT2tZSjF5R0Q5eU45cHlJMWk5TUdBd3RSLVFvQXhTNmtKMjhXdjdIV1NFTm1sZnVmN1hYWUlKY0RkZjBjdHFzbDV0eVJrVlVkb1RneGZmUEh0S28xZVd30gFXQVVfeXFMUHU4YWE5M0VmU0d0enIzLVlSWng1UjUxT0xTdk8tMy1QUVF0SW9uNkdFYllPMmdXQ25maXVrZndGTC1uWGw4R3djWWpoUGJGVUJXelNRODVZ?oc=5,atölye,atölye,Kayseri Melikgazi'de Bir Çelik Eşya Atölyesinde Çıkan Yangın Ekipler Tarafından Söndürüldü Mersin Haber,Kayseri Melikgazi'de Bir Çelik Eşya Atölyesinde Çıkan Yangın Ekipler Tarafından Söndürüldü Kayseri Melikgazi'de Bir Çelik Eşya Atölyesinde Çıkan Yangın Ekipler Tarafından Söndürüldü Mersin Haber Kayseri Melikgazi'de Bir Çelik Eşya Atölyesinde Çıkan Yangın Ekipler Tarafından Söndürüldü Mersin Haber,summary_only,https://news.google.com/rss/articles/CBMiygFBVV95cUxNTU1MQjJ6dS1WVVB3MDduVFo0b0pFRWRxRE1BSTZfUHRGS1JlLVoxbG1Vd01XMmxBQW9ER2ZiZzYxZDRMZ0xVQ2F0ekxoNjdoNzhVTkxwZ0NHdUFZUUI4UWtUYXh4MENGUVNacDFrV0JJaGpOT2tZSjF5R0Q5eU45cHlJMWk5TUdBd3RSLVFvQXhTNmtKMjhXdjdIV1NFTm1sZnVmN1hYWUlKY0RkZjBjdHFzbDV0eVJrVlVkb1RneGZmUEh0S28xZVd30gFXQVVfeXFMUHU4YWE5M0VmU0d0enIzLVlSWng1UjUxT0xTdk8tMy1QUVF0SW9uNkdFYllPMmdXQ25maXVrZndGTC1uWGw4R3djWWpoUGJGVUJXelNRODVZ?oc=5&hl=en-US&gl=US&ceid=US:en,Kayseri,Melikgazi,,,,Bir Çelik,Bir Çelik:292:body+summary+title,faaliyet/tesis yok,Bir Çelik Melikgazi Kayseri Türkiye,Demir Çelik - Demir Çelik | Birlik Metal Ticaret | Kayseri Çelik Para Kasası | Kayseri Çelik Kapı Firmaları,Demir Çelik - Demir Çelik,firma adı + güvenli maps adayı var,80.0 | 48.275862068965516 | 71.42857142857143 | 71.42857142857143,Kayseri Prefabrik,221.78,35
2026-07-08 07:43:14,yangın,Fiziksel Risk / Yangın,Alanya ve Korkuteli'de Çiftçilere Üretim ve Yangın Uyarıları,Alanya ve Korkuteli'de Çiftçilere Üretim ve Yangın Uyarıları Akdeniz Gerçek,https://news.google.com/rss/articles/CBMiqwFBVV95cUxNSmZXRzZxcDF1NHRoTnhSOHY5bjJwYkhTVTF1T28wZmk5ZVBYdmxaajVSWGhfd3QzbnlSUmtvWTJMbzZiWUM3NjY4SDBfRTBkZC1PWUtYeTczVmpnNmROTW5HZDVGMmlJUTJNajBPY0l5dFZNY1JMM2s5VEczeGJ5VUpXamdUSXkwZ2lYWTZlQjBSLUxST0o4eEFLZjZHUndlRExFUWVPeUVzNlk?oc=5,üretim,üretim tesisi,Alanya ve Korkuteli'de Çiftçilere Üretim ve Yangın Uyarıları Akdeniz Gerçek,Alanya ve Korkuteli'de Çiftçilere Üretim ve Yangın Uyarıları Alanya ve Korkuteli'de Çiftçilere Üretim ve Yangın Uyarıları Akdeniz Gerçek Alanya ve Korkuteli'de Çiftçilere Üretim ve Yangın Uyarıları Akdeniz Gerçek,browser_failed,https://news.google.com/rss/articles/CBMiqwFBVV95cUxNSmZXRzZxcDF1NHRoTnhSOHY5bjJwYkhTVTF1T28wZmk5ZVBYdmxaajVSWGhfd3QzbnlSUmtvWTJMbzZiWUM3NjY4SDBfRTBkZC1PWUtYeTczVmpnNmROTW5HZDVGMmlJUTJNajBPY0l5dFZNY1JMM2s5VEczeGJ5VUpXamdUSXkwZ2lYWTZlQjBSLUxST0o4eEFLZjZHUndlRExFUWVPeUVzNlk?oc=5&hl=tr&gl=TR&ceid=TR:tr,Antalya,Korkuteli,,,,,,firma yok | faaliyet/tesis yok,,,,maps araması yapılmadı,,,85.5,36
2026-07-08 10:08:14,banka soruşturma,Operasyon / Soruşturma / Suç,Geredeli Banka Müdürü Gözaltına Alındı,Geredeli Banka Müdürü Gözaltına Alındı Gerede Medya Takip,https://news.google.com/rss/articles/CBMijwFBVV95cUxQQ2d1WFZ4akNQUnhqaHZtbzg5THUzYU5oMkJ3cy1fMnFBYVJQY2lNQ3dRSVAwRDlMeEdnYUxzZ3FlSThxdXlIZE9rSHFqRHRkNWpSdzNxTFFZMDNkOGZob0lsYmhOX3dCSlh2WUJ6U0Exek1RREdTc3BWQy1nekRwa0lPQ1NnRFdyQjdVelpDZw?oc=5,banka,finansal kuruluş,Geredeli Banka Müdürü Gözaltına Alındı Gerede Medya Takip,Geredeli Banka Müdürü Gözaltına Alındı Geredeli Banka Müdürü Gözaltına Alındı Gerede Medya Takip Geredeli Banka Müdürü Gözaltına Alındı Gerede Medya Takip,browser_failed,https://news.google.com/rss/articles/CBMijwFBVV95cUxQQ2d1WFZ4akNQUnhqaHZtbzg5THUzYU5oMkJ3cy1fMnFBYVJQY2lNQ3dRSVAwRDlMeEdnYUxzZ3FlSThxdXlIZE9rSHFqRHRkNWpSdzNxTFFZMDNkOGZob0lsYmhOX3dCSlh2WUJ6U0Exek1RREdTc3BWQy1nekRwa0lPQ1NnRFdyQjdVelpDZw?oc=5&hl=tr&gl=TR&ceid=TR:tr,,,,,,,,il yok | ilçe yok | firma yok | faaliyet/tesis yok,,,,maps araması yapılmadı,,,31.82,37
2026-07-08 09:15:00,rüşvet,Diğer,İBB’deki ‘kumpasın’ ispatı! Kayıp 72 kg altın ve yargıda rüşvet ağı,İBB’deki ‘kumpasın’ ispatı! Kayıp 72 kg altın ve yargıda rüşvet ağı Halk TV,https://news.google.com/rss/articles/CBMiogFBVV95cUxOOERCWEdwbElqTTI1WExpcmRrb2xibUVQdVFScUM2T0w2dzJmZEV4SVllVzVCWl94WlBPdVFyZ214bnBTbFI2UDc4UHJNYk5meFJqOXJNeTFDLVlRUFNRTmJ2VUl2QTJ6ZGJKMndCaUJxUEl4RjBkeXI3UXNfYVZxMUhqbmh2aVFsMVJCR2x4eFhZMkh0Y3Y3NUVfREtkZ3J0UXc?oc=5,gıda,,Bahadır Özgür yazdı: İBB’deki ‘kumpasın’ ispatı! Kayıp 72 kg altın ve yargıda rüşvet ağı Bahadır Özgür yazdı: İBB’deki ‘kumpasın’ ispatı! Kayıp 72 kg altın ve yargıda rüşvet ağı Bahadır Özgür yazdı: İBB’deki ‘kumpasın’ ispatı! Kayıp 72 kg altın ve yargıda rüşvet ağı,İBB’deki ‘kumpasın’ ispatı! Kayıp 72 kg altın ve yargıda rüşvet ağı İBB’deki ‘kumpasın’ ispatı! Kayıp 72 kg altın ve yargıda rüşvet ağı Halk TV Bahadır Özgür yazdı: İBB’deki ‘kumpasın’ ispatı! Kayıp 72 kg altın ve yargıda rüşvet ağı Bahadır Özgür yazdı: İBB’deki ‘kumpasın’ ispatı! Kayıp 72 kg altın ve yargıda rüşvet ağı,browser_full_article,https://halktv.com.tr/makale/ibbdeki-kumpasin-ispati-kayip-72-kg-altin-ve-yargida-rusvet-agi-1041190,,,,,,,,il yok | ilçe yok | firma yok | faaliyet/tesis yok,,,,maps araması yapılmadı,,,62.91,38
