published,search_term,category,title,summary,link,matched_words,activity_type,raw_text,entity_source_text,article_fetch_status,resolved_article_url,city_candidates,district_candidates,neighborhood_candidates,street_candidates,facility_candidates,company_candidates,company_candidate_scores,entity_quality_note,maps_queries,maps_candidates,maps_best_guess,maps_status,maps_match_scores,maps_rejected_candidates,record_quality_score,duplicate_group_id
2026-07-07 12:55:00,fabrika yangını,Fiziksel Risk / Yangın,Körfez’de Fabrika Yangını Son Dakika,Körfez’de Fabrika Yangını Son Dakika Adapostası Gazetesi,https://news.google.com/rss/articles/CBMiiAFBVV95cUxQdEhiNXF1UVJvVmxmUE8zX2E1YzQ4YXZMOVpnamRhSWVzRnZWT29fZlZTVjlKa3QyMkJpRlh5RzJwQVI2dlAxZmo1RnY3WjNieHFqLUZhOTJSeU1INDdzcW9FWFdkUlQ0SDlyNlVJa05WclRaRVlzcE45bGx0TjBBWDEwTVhfWTJB0gGIAUFVX3lxTFB0SGI1cXVRUm9WbGZQTzNfYTVjNDhhdkw5WmdqZGFJZXNGdlZPb19mVlNWOUprdDIyQmlGWHlHMnBBUjZ2UDFmajVGdjdaM2J4cWotRmE5MlJ5TUg0N3Nxb0VYV2RSVDRIOXI2VUlrTlZyVFpFWXNwTjlsbHROMEFYMTBNWF9ZMkE?oc=5,fabrika,fabrika,"Kocaeli’de boya fabrikasında çıkan yangında 1 kişi hayatını kaybetti, 2 kişi dumandan etkilendi. Son dakika gelişmeleri ve detaylar için hemen okuyun Kocaeli’de boya fabrikasında çıkan yangında 1 kişi hayatını kaybetti, 2 kişi dumandan etkilendi. Son dakika gelişmeleri ve detaylar için hemen okuyun Kocaeli’de boya fabrikasında çıkan yangında 1 kişi hayatını kaybetti, 2 kişi dumandan etkilendi. Son dakika gelişmeleri ve detaylar için hemen okuyun 07 Temmuz 2026 - Asayiş Körfez’de Fabrika Yangını Son Dakika Kocaeli’de boya fabrikasında çıkan yangında 1 kişi hayatını kaybetti, 2 kişi dumandan etkilendi. Son dakika gelişmeleri ve detaylar için hemen okuyun Körfez ve Derince ilçeleri sınırında bulunan bir boya fabrikasında henüz belirlenemeyen nedenle yangın çıktı. İhbar üzerine bölgeye çok sayıda itfaiye ve sağlık ekibi sevk edildi. Dumandan etkilenen 2 kişi ambulansla hastaneye kaldırıldı. Yangın, itfaiye ekiplerinin yaklaşık 3 saat süren çalışması sonucu kontrol altına alındı. İtfaiye ekipleri, alevlerin söndürülmesinin ardından fabrikada Samet S'nin (26) cansız bedenine ulaştı. Ekiplerin bölgedeki soğutma çalışmaları devam ediyor. Öte yandan, Kocaeli Cumhuriyet Başsavcısı Semih Akgün, Körfez Kaymakamı Uğur Kalkar, Derince Kaymakamı Mustafa Demirelli, Körfez Belediye Başkanı Şener Söğüt, Derince Belediye Başkanı Sertif Gökçe, Körfez Cumhuriyet Başsavcısı İsa Büyük olay yerinde incelemelerde bulundu. YORUM YAP Sakarya dahil 23 İlde Dolandırıcılık Operasyonu: 307 Gözaltı Tavşanlı’da Otomobil-Traktör Kazası: 3 Yaralı 2 çocuk babası, eşinden ayrılınca kendini astı! Bandırma’da otluk alanda çıkan yangın söndürüldü İpsala’da Buğday Tarlasında Yangın Kontrol Altında 07 Temmuz 2026 - Asayiş Körfez’de Fabrika Yangını Son Dakika Kocaeli’de boya fabrikasında çıkan yangında 1 kişi hayatını kaybetti, 2 kişi dumandan etkilendi. Son dakika gelişmeleri ve detaylar için hemen okuyun Körfez ve Derince ilçeleri sınırında bulunan bir boya fabrikasında henüz belirlenemeyen nedenle yangın çıktı. İhbar üzerine bölgeye çok sayıda itfaiye ve sağlık ekibi sevk edildi. Dumandan etkilenen 2 kişi ambulansla hastaneye kaldırıldı. Yangın, itfaiye ekiplerinin yaklaşık 3 saat süren çalışması sonucu kontrol altına alındı. İtfaiye ekipleri, alevlerin söndürülmesinin ardından fabrikada Samet S'nin (26) cansız bedenine ulaştı. Ekiplerin bölgedeki soğutma çalışmaları devam ediyor. Öte yandan, Kocaeli Cumhuriyet Başsavcısı Semih Akgün, Körfez Kaymakamı Uğur Kalkar, Derince Kaymakamı Mustafa Demirelli, Körfez Belediye Başkanı Şener Söğüt, Derince Belediye Başkanı Sertif Gökçe, Körfez Cumhuriyet Başsavcısı İsa Büyük olay yerinde incelemelerde bulundu. Körfez’de Fabrika Yangını Son Dakika","Körfez’de Fabrika Yangını Son Dakika Körfez’de Fabrika Yangını Son Dakika Adapostası Gazetesi Kocaeli’de boya fabrikasında çıkan yangında 1 kişi hayatını kaybetti, 2 kişi dumandan etkilendi. Son dakika gelişmeleri ve detaylar için hemen okuyun Kocaeli’de boya fabrikasında çıkan yangında 1 kişi hayatını kaybetti, 2 kişi dumandan etkilendi. Son dakika gelişmeleri ve detaylar için hemen okuyun 07 Temmuz 2026 - Asayiş Körfez’de Fabrika Yangını Son Dakika Kocaeli’de boya fabrikasında çıkan yangında 1 kişi hayatını kaybetti, 2 kişi dumandan etkilendi. Son dakika gelişmeleri ve detaylar için hemen okuyun Körfez ve Derince ilçeleri sınırında bulunan bir boya fabrikasında henüz belirlenemeyen nedenle yangın çıktı. İhbar üzerine bölgeye çok sayıda itfaiye ve sağlık ekibi sevk edildi. Dumandan etkilenen 2 kişi ambulansla hastaneye kaldırıldı. Yangın, itfaiye ekiplerinin yaklaşık 3 saat süren çalışması sonucu kontrol altına alındı. İtfaiye ekipleri, alevlerin söndürülmesinin ardından fabrikada Samet S'nin (26) cansız bedenine ulaştı. Ekiplerin bölgedeki soğutma çalışmaları devam ediyor. Öte yandan, Kocaeli Cumhuriyet Başsavcısı Semih Akgün, Körfez Kaymakamı Uğur Kalkar, Derince Kaymakamı Mustafa Demirelli, Körfez Belediye Başkanı Şener Söğüt, Derince Belediye Başkanı Sertif Gökçe, Körfez Cumhuriyet Başsavcısı İsa Büyük olay yerinde incelemelerde bulundu. YORUM YAP Sakarya dahil 23 İlde Dolandırıcılık Operasyonu: 307 Gözaltı Tavşanlı’da Otomobil-Traktör Kazası: 3 Yaralı 2 çocuk babası, eşinden ayrılınca kendini astı! Bandırma’da otluk alanda çıkan yangın söndürüldü İpsala’da Buğday Tarlasında Yangın Kontrol Altında 07 Temmuz 2026 - Asayiş Körfez’de Fabrika Yangını Son Dakika Kocaeli’de boya fabrikasında çıkan yangında 1 kişi hayatını kaybetti, 2 kişi dumandan etkilendi. Körfez’de Fabrika Yangını Son Dakika",browser_full_article,https://www.adapostasi.com/amp/haber/28300896/korfezde-fabrika-yangini-son-dakika,Kocaeli | Balıkesir | Edirne | Kütahya,Bandırma | İpsala | Körfez | Tavşanlı,,,,,,firma yok | faaliyet/tesis yok,,,,maps araması yapılmadı,,,58.0,26
2026-07-07 13:59:51,fabrika yangını,Fiziksel Risk / Yangın,Bursa’da fabrika bahçesinde çıkan yangın korkuttu,Bursa’da fabrika bahçesinde çıkan yangın korkuttu Bursapost,https://news.google.com/rss/articles/CBMikgFBVV95cUxOeHBXMUYyRGQ1ZzBiMXNlNWJRYUw0RUdHLS1vc0g2VlpDQnFBZWNlUVo3UjhQaDBUVTlxc0VidDBDbzc3YmVJWUo5dHNLSkZzRUtCQXYyUEpJMGs2eXlUbGNDT2s4QXpCT0VWTlFnNlpTd0stRWJnSExBVWRXMW95c3JqV3ljVkQtaFp2NlpvUnh6QQ?oc=5,fabrika,fabrika,Bursa’da fabrika bahçesinde çıkan yangın korkuttu Bursapost,Bursa’da fabrika bahçesinde çıkan yangın korkuttu Bursa’da fabrika bahçesinde çıkan yangın korkuttu Bursapost Bursa’da fabrika bahçesinde çıkan yangın korkuttu Bursapost,browser_failed,https://news.google.com/rss/articles/CBMikgFBVV95cUxOeHBXMUYyRGQ1ZzBiMXNlNWJRYUw0RUdHLS1vc0g2VlpDQnFBZWNlUVo3UjhQaDBUVTlxc0VidDBDbzc3YmVJWUo5dHNLSkZzRUtCQXYyUEpJMGs2eXlUbGNDT2s4QXpCT0VWTlFnNlpTd0stRWJnSExBVWRXMW95c3JqV3ljVkQtaFp2NlpvUnh6QQ?oc=5&hl=tr&gl=TR&ceid=TR:tr,Bursa,,,,,,,ilçe yok | firma yok | faaliyet/tesis yok,,,,maps araması yapılmadı,,,57.84,27
2026-07-07 13:12:20,fabrika yangını,Fiziksel Risk / Yangın,"Kocaeli'deki boya fabrikası yangını: 26 yaşındaki işçi hayatını kaybetti, 2 yaralı","Kocaeli'deki boya fabrikası yangını: 26 yaşındaki işçi hayatını kaybetti, 2 yaralı Saray Medya",https://news.google.com/rss/articles/CBMivAFBVV95cUxPb0ZCRFNBcW40a0oxR1pYU0Q0dThhNmtYcGprbVgyM1U1RC1YR3BVSWp0OGdnTlJrSmJfWE1XdVZBZWNxRVFMQzVGdmtSdWFGaWVtdlVMTkFDeW1rdkVQcndyd1ZFZVU1UnQ0RUxBVlJyRTllM2tEeVdOTUFIeEFhUzZycGM5Y2FKZ1NTOTRIak0xaExXWXhTOTl2UnpyOHZDV1RmLVp5S2JHdThwOXYtX3lSTGt3dkltMEVtcQ?oc=5,fabrika,fabrika,"Kocaeli'deki boya fabrikası yangınında 26 yaşındaki işçi Samet Sarıkaya hayatını kaybetti. Yangında 2 kişi de dumandan etkilendi. Bölgede inceleme ve soğutma çalışmaları sürüyor. Kocaeli'deki boya fabrikası yangınında 26 yaşındaki işçi Samet Sarıkaya hayatını kaybetti. Yangında 2 kişi de dumandan etkilendi. Bölgede inceleme ve soğutma çalışmaları sürüyor. Kocaeli'deki boya fabrikası yangınında 26 yaşındaki işçi Samet Sarıkaya hayatını kaybetti. Yangında 2 kişi de dumandan etkilendi. Bölgede inceleme ve soğutma çalışmaları sürüyor. Kocaeli'deki boya fabrikası yangını: 26 yaşındaki işçi hayatını kaybetti, 2 yaralı Paylaş Paylaş Paylaş 07 Temmuz 2026 16:08 Kocaeli'nin Körfez-Derince sınırında bulunan bir boya fabrikasında öğle saatlerinde çıkan yangın, yürek burkan bir sonla noktalandı. Alevlerin kısa sürede yayıldığı ve çevre ilçelerden takviye ekiplerin müdahale ettiği yangında, 26 yaşındaki işçi Samet Sarıkaya'nın cansız bedenine ulaşıldı. Olayda ayrıca 2 kişi de dumandan etkilendi. Yangının kontrol altına alınmasının ardından, bölgede soğutma ve kapsamlı inceleme çalışmaları başlatıldı. İtfaiye ekiplerinin titiz çalışmaları sırasında, fabrika içerisinde Samet Sarıkaya'ya ait cansız bedenin bulunması, acı gerçeği ortaya çıkardı. Sağlık durumları hakkında müdahale yapıldığı bildirilen dumandan etkilenen 2 kişinin ise tedavileri sürüyor. Olay yeri inceleme ekipleri, fabrikanın bulunduğu alanda geniş çaplı güvenlik önlemleri alarak tespit çalışmalarına devam ediyor. Hayatını kaybeden Samet Sarıkaya'nın cenazesinin bulunduğu yerden çıkarılmasına yönelik çalışmalar da sürüyor. Henüz belirlenemeyen bir nedenle başlayan ve kısa sürede büyüyerek geri dönüşüm tesisine sıçrayan yangının nedenlerine ilişkin soruşturma başlatıldı. #Boyafabrikası #İş Kazası İHA Yorum Yaz Popüler Trajedi sonrası kan döküldü: Baba, 6 ay önce ölen oğlunun ölümünden sorumlu tuttuğu sürücüyü vurdu! Konya'da feci kaza: Kırmızı ışıkta bekleyen otomobil ikiye bölündü, 1 ölü Van Erciş'te silahlı saldırı: Bir kardeş hayatını kaybetti Şampiyonluk maçı sonrası gergin anlar: Saha karıştı Akçakoca'da şok gelişme: Başkan vekilliği için tansiyon yükseldi Öğrencisi tarafından öldürülen öğretmenin yürek burkan sözleri: 'Can güvenliğimiz yok Trajedi sonrası kan döküldü: Baba, 6 ay önce ölen oğlunun ölümünden sorumlu tuttuğu sürücüyü vurdu! Konya'da feci kaza: Kırmızı ışıkta bekleyen otomobil ikiye bölündü, 1 ölü Van Erciş'te silahlı saldırı: Bir kardeş hayatını kaybetti Şampiyonluk maçı sonrası gergin anlar: Saha karıştı Akçakoca'da şok gelişme: Başkan vekilliği için tansiyon yükseldi Öğrencisi tarafından öldürülen öğretmenin yürek burkan sözleri: 'Can güvenliğimiz yok Kocaeli'deki boya fabrikası yangını: 26 yaşındaki işçi hayatını kaybetti, 2 yaralı Beğen, Paylaş, Takip Et... Kocaeli'nin Körfez-Derince sınırında bulunan bir boya fabrikasında öğle saatlerinde çıkan yangın, yürek burkan bir sonla noktalandı. Alevlerin kısa sürede yayıldığı ve çevre ilçelerden takviye ekiplerin müdahale ettiği yangında, 26 yaşındaki işçi Samet Sarıkaya'nın cansız bedenine ulaşıldı. Olayda ayrıca 2 kişi de dumandan etkilendi. Yangının kontrol altına alınmasının ardından, bölgede soğutma ve kapsamlı inceleme çalışmaları başlatıldı. İtfaiye ekiplerinin titiz çalışmaları sırasında, fabrika içerisinde Samet Sarıkaya'ya ait cansız bedenin bulunması, acı gerçeği ortaya çıkardı. Sağlık durumları hakkında müdahale yapıldığı bildirilen dumandan etkilenen 2 kişinin ise tedavileri sürüyor. Olay yeri inceleme ekipleri, fabrikanın bulunduğu alanda geniş çaplı güvenlik önlemleri alarak tespit çalışmalarına devam ediyor. Hayatını kaybeden Samet Sarıkaya'nın cenazesinin bulunduğu yerden çıkarılmasına yönelik çalışmalar da sürüyor. Henüz belirlenemeyen bir nedenle başlayan ve kısa sürede büyüyerek geri dönüşüm tesisine sıçrayan yangının nedenlerine ilişkin soruşturma başlatıldı.","Kocaeli'deki boya fabrikası yangını: 26 yaşındaki işçi hayatını kaybetti, 2 yaralı Kocaeli'deki boya fabrikası yangını: 26 yaşındaki işçi hayatını kaybetti, 2 yaralı Saray Medya Kocaeli'deki boya fabrikası yangınında 26 yaşındaki işçi Samet Sarıkaya hayatını kaybetti. Yangında 2 kişi de dumandan etkilendi. Bölgede inceleme ve soğutma çalışmaları sürüyor. Kocaeli'deki boya fabrikası yangını: 26 yaşındaki işçi hayatını kaybetti, 2 yaralı Paylaş Paylaş Paylaş 07 Temmuz 2026 16:08 Kocaeli'nin Körfez-Derince sınırında bulunan bir boya fabrikasında öğle saatlerinde çıkan yangın, yürek burkan bir sonla noktalandı. Alevlerin kısa sürede yayıldığı ve çevre ilçelerden takviye ekiplerin müdahale ettiği yangında, 26 yaşındaki işçi Samet Sarıkaya'nın cansız bedenine ulaşıldı. Olayda ayrıca 2 kişi de dumandan etkilendi. Yangının kontrol altına alınmasının ardından, bölgede soğutma ve kapsamlı inceleme çalışmaları başlatıldı. İtfaiye ekiplerinin titiz çalışmaları sırasında, fabrika içerisinde Samet Sarıkaya'ya ait cansız bedenin bulunması, acı gerçeği ortaya çıkardı. Olay yeri inceleme ekipleri, fabrikanın bulunduğu alanda geniş çaplı güvenlik önlemleri alarak tespit çalışmalarına devam ediyor. Hayatını kaybeden Samet Sarıkaya'nın cenazesinin bulunduğu yerden çıkarılmasına yönelik çalışmalar da sürüyor. Henüz belirlenemeyen bir nedenle başlayan ve kısa sürede büyüyerek geri dönüşüm tesisine sıçrayan yangının nedenlerine ilişkin soruşturma başlatıldı. #Boyafabrikası #İş Kazası İHA Yorum Yaz Popüler Trajedi sonrası kan döküldü: Baba, 6 ay önce ölen oğlunun ölümünden sorumlu tuttuğu sürücüyü vurdu! Konya'da feci kaza: Kırmızı ışıkta bekleyen otomobil ikiye bölündü, 1 ölü Van Erciş'te silahlı saldırı: Bir kardeş hayatını kaybetti Şampiyonluk maçı sonrası gergin anlar: Saha karıştı Akçakoca'da şok gelişme: Başkan vekilliği için tansiyon yükseldi Öğrencisi tarafından öldürülen öğretmenin yürek burkan sözleri: 'Can güvenliğimiz yok Trajedi sonrası kan döküldü: Baba, 6 ay önce ölen oğlunun ölümünden sorumlu tuttuğu sürücüyü vurdu! Konya'da feci kaza: Kırmızı ışıkta bekleyen otomobil ikiye bölündü, 1 ölü Van Erciş'te silahlı saldırı: Bir kardeş hayatını kaybetti Şampiyonluk maçı sonrası gergin anlar: Saha karıştı Akçakoca'da şok gelişme: Başkan vekilliği için tansiyon yükseldi Öğrencisi tarafından öldürülen öğretmenin yürek burkan sözleri: 'Can güvenliğimiz yok Kocaeli'deki boya fabrikası yangını: 26 yaşındaki işçi hayatını kaybetti, 2 yaralı Beğen, Paylaş, Takip Et... Kocaeli'nin Körfez-Derince sınırında bulunan bir boya fabrikasında öğle saatlerinde çıkan yangın, yürek burkan bir sonla noktalandı.",browser_full_article,https://www.saraymedya.com/foto/kocaeli-deki-boya-fabrikasi-yangini-26-yasindaki-isci-hayatini-kaybetti-2-yarali_279755/,Kocaeli | Konya | Düzce | Van | Yozgat,Akçakoca | Erciş | Sarıkaya,,,deki boya fabrikası,,,firma yok,deki boya fabrikası Akçakoca Kocaeli Türkiye,Kcc Boya,Kcc Boya,"firma adı yok, tesis/lokasyon ile maps tahmini var",66.66666666666666,,189.5,28
2026-07-07 13:54:45,fabrika yangını,Fiziksel Risk / Yangın,Haberi Yapay Zeka ile Özetinden Okuyun,Haberi Yapay Zeka ile Özetinden Okuyun - Kocaeli'deki Boya Fabrikası Yangınında Acı Haber: 1 İşçi Hayatını Kaybetti habokado.com,https://news.google.com/rss/articles/CBMiswFBVV95cUxOT0JVTm1CWVRQdW9RYVpjMk9tc202MDZ0MFQ2YTVJUlFPdzJDOXQ3WktCM05WSzNTYktuN0pqalFMUHJQaG8wWjdXNTBWTUc3RFJDbTh5X1V0OUZtR1hWNUxKNzdJc1N6SWQzUTNEd19JOGQwTVlydGluRWR6R1cwZWdZUmdZY19WUTdNRnRtNDkyRE45bnQ5WVRhN0NvUzNDU1p3aGlELUJFeXBaZ3ZCTXd1cw?oc=5,fabrika,fabrika,Haberi Yapay Zeka ile Özetinden Okuyun - Kocaeli'deki Boya Fabrikası Yangınında Acı Haber: 1 İşçi Hayatını Kaybetti habokado.com,Haberi Yapay Zeka ile Özetinden Okuyun Haberi Yapay Zeka ile Özetinden Okuyun - Kocaeli'deki Boya Fabrikası Yangınında Acı Haber: 1 İşçi Hayatını Kaybetti habokado.com Haberi Yapay Zeka ile Özetinden Okuyun - Kocaeli'deki Boya Fabrikası Yangınında Acı Haber: 1 İşçi Hayatını Kaybetti habokado.com,browser_failed,https://news.google.com/rss/articles/CBMiswFBVV95cUxOT0JVTm1CWVRQdW9RYVpjMk9tc202MDZ0MFQ2YTVJUlFPdzJDOXQ3WktCM05WSzNTYktuN0pqalFMUHJQaG8wWjdXNTBWTUc3RFJDbTh5X1V0OUZtR1hWNUxKNzdJc1N6SWQzUTNEd19JOGQwTVlydGluRWR6R1cwZWdZUmdZY19WUTdNRnRtNDkyRE45bnQ5WVRhN0NvUzNDU1p3aGlELUJFeXBaZ3ZCTXd1cw?oc=5&hl=tr&gl=TR&ceid=TR:tr,,,,,deki Boya Fabrikası,,,il yok | ilçe yok | firma yok,,,,maps araması yapılmadı,,,82.28,29
2026-07-07 13:15:11,fabrika yangını,Fiziksel Risk / Yangın,"Kocaeli'de boya fabrikasında çıkan yangında 1 kişi öldü, 2 kişi dumandan etkilendi (GÜNCELLEME)","Kocaeli'de boya fabrikasında çıkan yangında 1 kişi öldü, 2 kişi dumandan etkilendi (GÜNCELLEME) Canlı Gaste",https://news.google.com/rss/articles/CBMi0wFBVV95cUxOMWlhalNGT2hsak9QZWpLd2lEcl9iWjRlMW5ZeGJRRDVtbmVKNWNHR2pMdG80NVVmcGQ5TWkzQVc4Z2Y2UHgwTVhJWmJjZ2lOTDJ5cDF1dlRfR2xSdktBMW5fT2ZfcTFMTlU2S09vWFBLOVc3ZEhpeG1STWlnbVQzb3RDTjdUbFduRU9LMmJvbnBJRmFHRUNQNTJidmZscEZNRWVhcGtNM0Y0dlZwcTBXbWRDTW1rdVpDUjJ3Rmt1TUJjVjlZd0J1UGtJUmdXMWV1LVdF0gHTAUFVX3lxTE4xaWFqU0ZPaGxqT1Blakt3aURyX2JaNGUxbll4YlFENW1uZUo1Y0dHakx0bzQ1VWZwZDlNaTNBVzhnZjZQeDBNWElaYmNnaU5MMnlwMXV2VF9HbFJ2S0Exbl9PZl9xMUxOVTZLT29YUEs5VzdkSGl4bVJNaWdtVDNvdENON1RsV25FT0syYm9ucElGYUdFQ1A1MmJ2ZmxwRk1FZWFwa00zRjR2VnBxMFdtZENNbWt1WkNSMndGa3VNQmNWOVl3QnVQa0lSZ1cxZXUtV0U?oc=5,fabrika,fabrika,"Paylaş Tweetle Whatsapp Telegram Diyarbakır'da bir apartmanda çıkan yangında 1 kişi dumandan etkilendi 07 Temmuz 2026 - 16:15 - Güncelleme: 07 Temmuz 2026 - 17:45 TAKİP ET Diyarbakır — Diyarbakır'ın merkez Yenişehir ilçesinde apartman dairesinde çıkan yangında 1 kişi dumandan etkilendi. Diyarbakır Haberleri — Diyarbakır'ın merkez Yenişehir ilçesinde apartman dairesinde çıkan yangında 1 kişi dumandan etkilendi. Fabrika Mahallesi'nde bir sitedeki 13 katlı apartmanın 6'ncı katında bulunan dairede henüz belirlenemeyen nedenle yangın çıktı. İhbar üzerine bölgeye 112 Acil Sağlık, itfaiye ve polis ekipleri sevk edildi. İtfaiye ekiplerince söndürülen yangında, ev kullanılmaz hale geldi. Dumandan etkilenen bir kişiye ambulansta müdahale edildi. Fabrika Yangını Kocaeli Diyarbakır'da bir apartmanda çıkan yangında 1 kişi dumandan etkilendi İlginizi Çekebilecek Haberler Diyarbakır — Diyarbakır'ın merkez Yenişehir ilçesinde apartman dairesinde çıkan yangında 1 kişi dumandan etkilendi. Diyarbakır Haberleri — Diyarbakır'ın merkez Yenişehir ilçesinde apartman dairesinde çıkan yangında 1 kişi dumandan etkilendi. Fabrika Mahallesi'nde bir sitedeki 13 katlı apartmanın 6'ncı katında bulunan dairede henüz belirlenemeyen nedenle yangın çıktı. İhbar üzerine bölgeye 112 Acil Sağlık, itfaiye ve polis ekipleri sevk edildi. İtfaiye ekiplerince söndürülen yangında, ev kullanılmaz hale geldi. Dumandan etkilenen bir kişiye ambulansta müdahale edildi. Sitemizde bulunan yazı , video, fotoğraf ve haberlerin her hakkı saklıdır. İzinsiz veya kaynak gösterilemeden kullanılamaz.","Kocaeli'de boya fabrikasında çıkan yangında 1 kişi öldü, 2 kişi dumandan etkilendi (GÜNCELLEME) Kocaeli'de boya fabrikasında çıkan yangında 1 kişi öldü, 2 kişi dumandan etkilendi (GÜNCELLEME) Canlı Gaste Paylaş Tweetle Whatsapp Telegram Diyarbakır'da bir apartmanda çıkan yangında 1 kişi dumandan etkilendi 07 Temmuz 2026 - 16:15 - Güncelleme: 07 Temmuz 2026 - 17:45 TAKİP ET Diyarbakır — Diyarbakır'ın merkez Yenişehir ilçesinde apartman dairesinde çıkan yangında 1 kişi dumandan etkilendi. Diyarbakır Haberleri — Diyarbakır'ın merkez Yenişehir ilçesinde apartman dairesinde çıkan yangında 1 kişi dumandan etkilendi. Fabrika Mahallesi'nde bir sitedeki 13 katlı apartmanın 6'ncı katında bulunan dairede henüz belirlenemeyen nedenle yangın çıktı. İhbar üzerine bölgeye 112 Acil Sağlık, itfaiye ve polis ekipleri sevk edildi. İtfaiye ekiplerince söndürülen yangında, ev kullanılmaz hale geldi. Dumandan etkilenen bir kişiye ambulansta müdahale edildi. Fabrika Yangını Kocaeli Diyarbakır'da bir apartmanda çıkan yangında 1 kişi dumandan etkilendi İlginizi Çekebilecek Haberler Diyarbakır — Diyarbakır'ın merkez Yenişehir ilçesinde apartman dairesinde çıkan yangında 1 kişi dumandan etkilendi.",browser_full_article_dom,https://news.google.com/rss/articles/CBMi0wFBVV95cUxOMWlhalNGT2hsak9QZWpLd2lEcl9iWjRlMW5ZeGJRRDVtbmVKNWNHR2pMdG80NVVmcGQ5TWkzQVc4Z2Y2UHgwTVhJWmJjZ2lOTDJ5cDF1dlRfR2xSdktBMW5fT2ZfcTFMTlU2S09vWFBLOVc3ZEhpeG1STWlnbVQzb3RDTjdUbFduRU9LMmJvbnBJRmFHRUNQNTJidmZscEZNRWVhcGtNM0Y0dlZwcTBXbWRDTW1rdVpDUjJ3Rmt1TUJjVjlZd0J1UGtJUmdXMWV1LVdF0gHTAUFVX3lxTE4xaWFqU0ZPaGxqT1Blakt3aURyX2JaNGUxbll4YlFENW1uZUo1Y0dHakx0bzQ1VWZwZDlNaTNBVzhnZjZQeDBNWElaYmNnaU5MMnlwMXV2VF9HbFJ2S0Exbl9PZl9xMUxOVTZLT29YUEs5VzdkSGl4bVJNaWdtVDNvdENON1RsV25FT0syYm9ucElGYUdFQ1A1MmJ2ZmxwRk1FZWFwa00zRjR2VnBxMFdtZENNbWt1WkNSMndGa3VNQmNWOVl3QnVQa0lSZ1cxZXUtV0U?oc=5&hl=tr&gl=TR&ceid=TR:tr,Diyarbakır | Kocaeli | Bursa | Mersin,Yenişehir,Fabrika Mahallesi,,,,,firma yok | faaliyet/tesis yok,,,,maps araması yapılmadı,,,155.25,30
