published,search_term,category,title,summary,link,matched_words,activity_type,raw_text,entity_source_text,article_fetch_status,resolved_article_url,city_candidates,district_candidates,neighborhood_candidates,street_candidates,facility_candidates,company_candidates,company_candidate_scores,entity_quality_note,maps_queries,maps_candidates,maps_best_guess,maps_status,maps_match_scores,maps_rejected_candidates,record_quality_score,duplicate_group_id
2026-06-30 12:30:24,firmalara operasyon,Banka / Finansal Kuruluş,İstanbul'da KOBİ'lerin Dijital Dönüşümünü Hızlandırmak İçin İSO ve Türkiye İş Bankası İş Birliği Başladı.,İstanbul'da KOBİ'lerin Dijital Dönüşümünü Hızlandırmak İçin İSO ve Türkiye İş Bankası İş Birliği Başladı. Mersin Haber,https://news.google.com/rss/articles/CBMiV0FVX3lxTFBhd21xNldYNW9mZnh0QXFCWjA5aGRpWW9hZk5oenVuVkRSUEc0Nk5nQTMySXZPTFk1Ri1TWWlyN3ltQjdaR3RnNDhJaHRPdllXMWdKem9Id9IBV0FVX3lxTFBhd21xNldYNW9mZnh0QXFCWjA5aGRpWW9hZk5oenVuVkRSUEc0Nk5nQTMySXZPTFk1Ri1TWWlyN3ltQjdaR3RnNDhJaHRPdllXMWdKem9Idw?oc=5,banka,finansal kuruluş,"İstanbul'da KOBİ'lerin Dijital Dönüşümünü Hızlandırmak İçin İSO ve Türkiye İş Bankası İş Birliği Başladı. İstanbul Sanayi Odası ve Türkiye İş Bankası, KOBİ'lerin dönüşüm süreçlerini hızlandırmak amacıyla önemli bir iş birliği gerçekleştirdi. Proje ile KOBİ'lerin dijitalleşme ve değer odaklı büyüme alanlarında ihtiyacı olan çözümler sunulacak. 30 Haziran 2026 @mersinhaber 'i takip et İstanbul Sanayi Odası (İSO), Türkiye sanayisinin küresel rekabet gücünü artırmak ve KOBİ'lerin dönüşüm süreçlerini hızlandırmak amacıyla kurduğu Stratejik Dönüşüm Merkezi'nin (İSO SDM) ilk kapsamlı saha iş birliğini Türkiye İş Bankası ile hayata geçiriyor. İSO Yönetim Kurulu Başkanı Erdal Bahçıvan ile Türkiye İş Bankası Genel Müdürü Hakan Aran tarafından imzalanan iş birliği protokolü kapsamında hayata geçirilen ""Dijitalleşme ve Değer Odaklı Büyüme Programı"", üretim sektörüne yönelik olarak tasarlanmış ilk program olma özelliğine sahip. Bu iş birliği ile Türk sanayisinin dijitalleşme, verimlilik, sürdürülebilirlik ve yüksek katma değer üretimi alanlarında güçlü bir yapı kazanması hedefleniyor. Program ile KOBİ'lerin dijitalleşme, değer odaklı büyüme ve servisleşme konularındaki ihtiyaçlarına bütüncül ve ölçeklenebilir çözümler sunulması amaçlanıyor. Küresel ekonomide yaşanan jeopolitik risklerin artması, teknolojik dönüşüm ve yapay zeka uygulamalarının hız kazanması, sanayi kuruluşlarının dönüşümünü zorunlu hale getiriyor. Bu bağlamda, sanayi kuruluşlarının teknoloji geliştirme yetkinliği, veri yönetimi, yüksek verimlilik ve sürdürülebilirlik gibi unsurlar, gelecekte rekabet avantajı sağlamada kritik rol oynayacak. İSO, üç yıl önce bünyesinde kurduğu Stratejik Dönüşüm Merkezi’nde Future Ally Yönetim Danışmanlığı ile gerçekleştirdiği kapsamlı çalışmalar sonucunda Türk sanayisinin teknolojik dönüşümünü sahaya taşıyacak yeni nesil bir rehberlik modeli oluşturdu. İSO SDM, sanayicilerin karşılaştığı risk ve fırsatları analiz eden, dönüşüm alanlarını belirleyen ve firmalara uygulanabilir yol haritaları hazırlayan bir strateji ve operasyon modeli sunuyor. KOBİ Dönüşüm Programı, şirketlerin operasyonel dijital dönüşüm, yeşil dönüşüm, değer odaklı büyüme, insan odaklı dönüşüm ve jeostratejik gelişmelere uyum gibi beş ana eksende dönüşümlerine rehberlik etmek üzere tasarlandı. Bu program, entegre bir yaklaşım sergileyerek KOBİ'lerin dönüşüm süreçlerini destekliyor. Türkiye İş Bankası ile gerçekleştirilen iş birliği, sadece finansman desteği sunmakla kalmayıp, sanayi ve finans ekosistemini aynı dönüşüm vizyonunda bir araya getiriyor. İş Bankası’nın kurumsal deneyimi ve finansal çözümleri, İSO SDM’nin saha uygulamalarıyla birleşerek KOBİ'lerin dönüşüm projelerinin hayata geçirilmesinde önemli bir etken oluşturacak. İSO Yönetim Kurulu Başkanı Erdal Bahçıvan, sanayi stratejisi çalışmalarının ülke geleceği açısından kritik öneme sahip olduğunu belirterek, Türkiye İş Bankası ile başlatılan bu programın KOBİ'lere bütüncül rehberlik sunacağını ifade etti. Bahçıvan, ""Bu iş birliğiyle sanayicimizin yarınını güvence altına alıyor, KOBİ'lerimizi bu yolculukta yalnız bırakmıyoruz"" dedi. Türkiye İş Bankası Genel Müdürü Hakan Aran ise, programın KOBİ'ler için önemli bir dönüşüm fırsatı sunduğunu vurguladı. Aran, KOBİ'lerin sadece ayakta kalmasının yeterli olmadığını, uluslararası pazarlara açılmaları ve rekabette fark yaratacak iş modellerini geliştirmeleri gerektiğini ifade etti. Programın, sanayinin verimliliğini artıracak önemli kazanımlar ortaya çıkaracağını belirtti. İstanbul'da KOBİ'lerin Dijital Dönüşümünü Hızlandırmak İçin İSO ve Türkiye İş Bankası İş Birliği Başladı. İstanbul Sanayi Odası ve Türkiye İş Bankası, KOBİ'lerin dönüşüm süreçlerini hızlandırmak amacıyla önemli bir iş birliği gerçekleştirdi. Proje ile KOBİ'lerin dijitalleşme ve değer odaklı büyüme alanlarında ihtiyacı olan çözümler sunulacak. 30 Haziran 2026 @mersinhaber 'i takip et İstanbul Sanayi Odası (İSO), Türkiye sanayisinin küresel rekabet gücünü artırmak ve KOBİ'lerin dönüşüm süreçlerini hızlandırmak amacıyla kurduğu Stratejik Dönüşüm Merkezi'nin (İSO SDM) ilk kapsamlı saha iş birliğini Türkiye İş Bankası ile hayata geçiriyor. İSO Yönetim Kurulu Başkanı Erdal Bahçıvan ile Türkiye İş Bankası Genel Müdürü Hakan Aran tarafından imzalanan iş birliği protokolü kapsamında hayata geçirilen ""Dijitalleşme ve Değer Odaklı Büyüme Programı"", üretim sektörüne yönelik olarak tasarlanmış ilk program olma özelliğine sahip. Bu iş birliği ile Türk sanayisinin dijitalleşme, verimlilik, sürdürülebilirlik ve yüksek katma değer üretimi alanlarında güçlü bir yapı kazanması hedefleniyor. Program ile KOBİ'lerin dijitalleşme, değer odaklı büyüme ve servisleşme konularındaki ihtiyaçlarına bütüncül ve ölçeklenebilir çözümler sunulması amaçlanıyor. Küresel ekonomide yaşanan jeopolitik risklerin artması, teknolojik dönüşüm ve yapay zeka uygulamalarının hız kazanması, sanayi kuruluşlarının dönüşümünü zorunlu hale getiriyor. Bu bağlamda, sanayi kuruluşlarının teknoloji geliştirme yetkinliği, veri yönetimi, yüksek verimlilik ve sürdürülebilirlik gibi unsurlar, gelecekte rekabet avantajı sağlamada kritik rol oynayacak. İSO, üç yıl önce bünyesinde kurduğu Stratejik Dönüşüm Merkezi’nde Future Ally Yönetim Danışmanlığı ile gerçekleştirdiği kapsamlı çalışmalar sonucunda Türk sanayisinin teknolojik dönüşümünü sahaya taşıyacak yeni nesil bir rehberlik modeli oluşturdu. İSO SDM, sanayicilerin karşılaştığı risk ve fırsatları analiz eden, dönüşüm alanlarını belirleyen ve firmalara uygulanabilir yol haritaları hazırlayan bir strateji ve operasyon modeli sunuyor. KOBİ Dönüşüm Programı, şirketlerin operasyonel dijital dönüşüm, yeşil dönüşüm, değer odaklı büyüme, insan odaklı dönüşüm ve jeostratejik gelişmelere uyum gibi beş ana eksende dönüşümlerine rehberlik etmek üzere tasarlandı. Bu program, entegre bir yaklaşım sergileyerek KOBİ'lerin dönüşüm süreçlerini destekliyor. Türkiye İş Bankası ile gerçekleştirilen iş birliği, sadece finansman desteği sunmakla kalmayıp, sanayi ve finans ekosistemini aynı dönüşüm vizyonunda bir araya getiriyor. İş Bankası’nın kurumsal deneyimi ve finansal çözümleri, İSO SDM’nin saha uygulamalarıyla birleşerek KOBİ'lerin dönüşüm projelerinin hayata geçirilmesinde önemli bir etken oluşturacak. İSO Yönetim Kurulu Başkanı Erdal Bahçıvan, sanayi stratejisi çalışmalarının ülke geleceği açısından kritik öneme sahip olduğunu belirterek, Türkiye İş Bankası ile başlatılan bu programın KOBİ'lere bütüncül rehberlik sunacağını ifade etti. Bahçıvan, ""Bu iş birliğiyle sanayicimizin yarınını güvence altına alıyor, KOBİ'lerimizi bu yolculukta yalnız bırakmıyoruz"" dedi. Türkiye İş Bankası Genel Müdürü Hakan Aran ise, programın KOBİ'ler için önemli bir dönüşüm fırsatı sunduğunu vurguladı. Aran, KOBİ'lerin sadece ayakta kalmasının yeterli olmadığını, uluslararası pazarlara açılmaları ve rekabette fark yaratacak iş modellerini geliştirmeleri gerektiğini ifade etti. Programın, sanayinin verimliliğini artıracak önemli kazanımlar ortaya çıkaracağını belirtti. Daha fazlası ve daha hızlı bilgi için sizde; Facebook'ta @mersihnaber 'i Instagram'da @mersinhaber 'i veya Twitter'da @mersinhaber 'i takip edebilirsiniz. İlk olarak anlık gelişmeleri sosyal medya hesaplarımızdan paylaşıyoruz.. Dilerseniz sosyal medya hesapları üzerinden sizlerde","İstanbul'da KOBİ'lerin Dijital Dönüşümünü Hızlandırmak İçin İSO ve Türkiye İş Bankası İş Birliği Başladı. İstanbul'da KOBİ'lerin Dijital Dönüşümünü Hızlandırmak İçin İSO ve Türkiye İş Bankası İş Birliği Başladı. Mersin Haber İstanbul'da KOBİ'lerin Dijital Dönüşümünü Hızlandırmak İçin İSO ve Türkiye İş Bankası İş Birliği Başladı. İstanbul Sanayi Odası ve Türkiye İş Bankası, KOBİ'lerin dönüşüm süreçlerini hızlandırmak amacıyla önemli bir iş birliği gerçekleştirdi. Proje ile KOBİ'lerin dijitalleşme ve değer odaklı büyüme alanlarında ihtiyacı olan çözümler sunulacak. 30 Haziran 2026 @mersinhaber 'i takip et İstanbul Sanayi Odası (İSO), Türkiye sanayisinin küresel rekabet gücünü artırmak ve KOBİ'lerin dönüşüm süreçlerini hızlandırmak amacıyla kurduğu Stratejik Dönüşüm Merkezi'nin (İSO SDM) ilk kapsamlı saha iş birliğini Türkiye İş Bankası ile hayata geçiriyor. İSO Yönetim Kurulu Başkanı Erdal Bahçıvan ile Türkiye İş Bankası Genel Müdürü Hakan Aran tarafından imzalanan iş birliği protokolü kapsamında hayata geçirilen ""Dijitalleşme ve Değer Odaklı Büyüme Programı"", üretim sektörüne yönelik olarak tasarlanmış ilk program olma özelliğine sahip. Bu iş birliği ile Türk sanayisinin dijitalleşme, verimlilik, sürdürülebilirlik ve yüksek katma değer üretimi alanlarında güçlü bir yapı kazanması hedefleniyor. Program ile KOBİ'lerin dijitalleşme, değer odaklı büyüme ve servisleşme konularındaki ihtiyaçlarına bütüncül ve ölçeklenebilir çözümler sunulması amaçlanıyor. Küresel ekonomide yaşanan jeopolitik risklerin artması, teknolojik dönüşüm ve yapay zeka uygulamalarının hız kazanması, sanayi kuruluşlarının dönüşümünü zorunlu hale getiriyor. Bu bağlamda, sanayi kuruluşlarının teknoloji geliştirme yetkinliği, veri yönetimi, yüksek verimlilik ve sürdürülebilirlik gibi unsurlar, gelecekte rekabet avantajı sağlamada kritik rol oynayacak. İSO, üç yıl önce bünyesinde kurduğu Stratejik Dönüşüm Merkezi’nde Future Ally Yönetim Danışmanlığı ile gerçekleştirdiği kapsamlı çalışmalar sonucunda Türk sanayisinin teknolojik dönüşümünü sahaya taşıyacak yeni nesil bir rehberlik modeli oluşturdu. İSO SDM, sanayicilerin karşılaştığı risk ve fırsatları analiz eden, dönüşüm alanlarını belirleyen ve firmalara uygulanabilir yol haritaları hazırlayan bir strateji ve operasyon modeli sunuyor. KOBİ Dönüşüm Programı, şirketlerin operasyonel dijital dönüşüm, yeşil dönüşüm, değer odaklı büyüme, insan odaklı dönüşüm ve jeostratejik gelişmelere uyum gibi beş ana eksende dönüşümlerine rehberlik etmek üzere tasarlandı. Bu program, entegre bir yaklaşım sergileyerek KOBİ'lerin dönüşüm süreçlerini destekliyor. Türkiye İş Bankası ile gerçekleştirilen iş birliği, sadece finansman desteği sunmakla kalmayıp, sanayi ve finans ekosistemini aynı dönüşüm vizyonunda bir araya getiriyor. İş Bankası’nın kurumsal deneyimi ve finansal çözümleri, İSO SDM’nin saha uygulamalarıyla birleşerek KOBİ'lerin dönüşüm projelerinin hayata geçirilmesinde önemli bir etken oluşturacak. İSO Yönetim Kurulu Başkanı Erdal Bahçıvan, sanayi stratejisi çalışmalarının ülke geleceği açısından kritik öneme sahip olduğunu belirterek, Türkiye İş Bankası ile başlatılan bu programın KOBİ'lere bütüncül rehberlik sunacağını ifade etti. Bahçıvan, ""Bu iş birliğiyle sanayicimizin yarınını güvence altına alıyor, KOBİ'lerimizi bu yolculukta yalnız bırakmıyoruz"" dedi. Türkiye İş Bankası Genel Müdürü Hakan Aran ise, programın KOBİ'ler için önemli bir dönüşüm fırsatı sunduğunu vurguladı. Aran, KOBİ'lerin sadece ayakta kalmasının yeterli olmadığını, uluslararası pazarlara açılmaları ve rekabette fark yaratacak iş modellerini geliştirmeleri gerektiğini ifade etti. Programın, sanayinin verimliliğini artıracak önemli kazanımlar ortaya çıkaracağını belirtti.",browser_full_article_dom,https://news.google.com/rss/articles/CBMiV0FVX3lxTFBhd21xNldYNW9mZnh0QXFCWjA5aGRpWW9hZk5oenVuVkRSUEc0Nk5nQTMySXZPTFk1Ri1TWWlyN3ltQjdaR3RnNDhJaHRPdllXMWdKem9Id9IBV0FVX3lxTFBhd21xNldYNW9mZnh0QXFCWjA5aGRpWW9hZk5oenVuVkRSUEc0Nk5nQTMySXZPTFk1Ri1TWWlyN3ltQjdaR3RnNDhJaHRPdllXMWdKem9Idw?oc=5&hl=tr&gl=TR&ceid=TR:tr,İstanbul,,,,,,,ilçe yok | firma yok | faaliyet/tesis yok,,,,maps araması yapılmadı,,,113.0,32
2026-06-30 12:52:43,firmalara operasyon,Banka / Finansal Kuruluş,İSO ve Türkiye İş Bankası’ndan KOBİ’lerin dönüşümü için stratejik iş birliği,İSO ve Türkiye İş Bankası’ndan KOBİ’lerin dönüşümü için stratejik iş birliği kayseri gürhaber,https://news.google.com/rss/articles/CBMiuwFBVV95cUxPVk52c3pHME9FbVo5c1NidE1ZdlZkR1RxY2Q3M3hBem5NOHJOd2w2VnpmaDN2N0FLeFpLQ2NIbGsyNzBSelRHdFVFVDBGRTRyVXV2ZDBKT2cyajUtVG4xblUyM0VKdVBxMXZaYTlUOFJGcmJ2TndqemJQVUsxYXBXemRzX3ZZeV9hMzlEMVc2Nm9mcHJhVTdCZUxwSGMyV21zbUVYQ2NCNlRCSmFMRUQ1d3JVM0lUYjRIVlM40gG7AUFVX3lxTE9WTnZzekcwT0VtWjlzU2J0TVl2VmRHVHFjZDczeEF6bk04ck53bDZWemZoM3Y3QUt4WktDY0hsazI3MFJ6VEd0VUVUMEZFNHJVdXZkMEpPZzJqNS1UbjFuVTIzRUp1UHExdlphOVQ4UkZyYnZOd2p6YlBVSzFhcFd6ZHNfdll5X2EzOUQxVzY2b2ZwcmFVN0JlTHBIYzJXbXNtRVhDY0I2VEJKYUxFRDV3clUzSVRiNEhWUzg?oc=5,banka,finansal kuruluş,İSO ve Türkiye İş Bankası’ndan KOBİ’lerin dönüşümü için stratejik iş birliği kayseri gürhaber,İSO ve Türkiye İş Bankası’ndan KOBİ’lerin dönüşümü için stratejik iş birliği İSO ve Türkiye İş Bankası’ndan KOBİ’lerin dönüşümü için stratejik iş birliği kayseri gürhaber İSO ve Türkiye İş Bankası’ndan KOBİ’lerin dönüşümü için stratejik iş birliği kayseri gürhaber,browser_failed,https://news.google.com/rss/articles/CBMiuwFBVV95cUxPVk52c3pHME9FbVo5c1NidE1ZdlZkR1RxY2Q3M3hBem5NOHJOd2w2VnpmaDN2N0FLeFpLQ2NIbGsyNzBSelRHdFVFVDBGRTRyVXV2ZDBKT2cyajUtVG4xblUyM0VKdVBxMXZaYTlUOFJGcmJ2TndqemJQVUsxYXBXemRzX3ZZeV9hMzlEMVc2Nm9mcHJhVTdCZUxwSGMyV21zbUVYQ2NCNlRCSmFMRUQ1d3JVM0lUYjRIVlM40gG7AUFVX3lxTE9WTnZzekcwT0VtWjlzU2J0TVl2VmRHVHFjZDczeEF6bk04ck53bDZWemZoM3Y3QUt4WktDY0hsazI3MFJ6VEd0VUVUMEZFNHJVdXZkMEpPZzJqNS1UbjFuVTIzRUp1UHExdlphOVQ4UkZyYnZOd2p6YlBVSzFhcFd6ZHNfdll5X2EzOUQxVzY2b2ZwcmFVN0JlTHBIYzJXbXNtRVhDY0I2VEJKYUxFRDV3clUzSVRiNEhWUzg?oc=5&hl=tr&gl=TR&ceid=TR:tr,,,,,,,,il yok | ilçe yok | firma yok | faaliyet/tesis yok,,,,maps araması yapılmadı,,,68.18,33
2026-06-30 10:58:56,vergi cezası,Diğer,Beylikdüzü'nde aracı durdurup saldıran sürücüye 180 bin lira ceza: Ehliyetine el konuldu,Beylikdüzü'nde aracı durdurup saldıran sürücüye 180 bin lira ceza: Ehliyetine el konuldu Pembe Pusula,https://news.google.com/rss/articles/CBMizgFBVV95cUxQaHROUTRaZ2xKZ092Z3NOUWEzRjVLN190TFRuWXVya3lNWks5RzR1TGtlZ1Y0TjFpcF90MnlfbENFOUl2T25xaEo5NEYzWGVocnoySWx3eTB6YkRRZUpPXzRtNlRYeW1nQ0U1ekRETGFhUThkNjhaUlpTWGtxcndVLVc2bmdwTUhvT1dJRk9fY3RMSEdESUJwby1aU1NpeEJkT1FLbzg2a2R4S3NBcjB0MWVoV3lqT1dnZXBQLThiazVWcDhVek1adlhEVW96QdIBzgFBVV95cUxQaHROUTRaZ2xKZ092Z3NOUWEzRjVLN190TFRuWXVya3lNWks5RzR1TGtlZ1Y0TjFpcF90MnlfbENFOUl2T25xaEo5NEYzWGVocnoySWx3eTB6YkRRZUpPXzRtNlRYeW1nQ0U1ekRETGFhUThkNjhaUlpTWGtxcndVLVc2bmdwTUhvT1dJRk9fY3RMSEdESUJwby1aU1NpeEJkT1FLbzg2a2R4S3NBcjB0MWVoV3lqT1dnZXBQLThiazVWcDhVek1adlhEVW96QQ?oc=5,el konuldu,,"Paylaş Tweetle Whatsapp Telegram Beylikdüzü'nde aracı durdurup saldıran sürücüye 180 bin lira ceza: Ehliyetine el konuldu 30 Haziran 2026 - 13:58 - Güncelleme: 30 Haziran 2026 - 15:08 İstanbul'un Beylikdüzü ilçesinde trafikte başka bir aracı ısrarla takip ederek, saldıran sürücü yakalandı. Sürücüye 180 bin lira para cezası uygulanırken, aracı 60 gün trafikten men edildi, ehliyetine ise 60 gün süreyle el konuldu. İstanbul'un Beylikdüzü ilçesinde trafikte başka bir aracı ısrarla takip ederek, saldıran sürücü yakalandı. Sürücüye 180 bin lira para cezası uygulanırken, aracı 60 gün trafikten men edildi, ehliyetine ise 60 gün süreyle el konuldu. İstanbul Emniyet Müdürlüğü Trafik Denetleme Şube Müdürlüğü Sanal Devriye ekipleri, sosyal medyada paylaşılan araca saldırı görüntüleri üzerine çalışma başlattı. Yapılan incelemelerde araç sürücüsünün İ.S. olduğu tespit edildi. Olayın Beylikdüzü ilçesinde meydana geldiği belirlenirken, sürücüye 2918 sayılı Karayolları Trafik Kanunu kapsamında Trafikte saldırı amacıyla başka bir aracı ısrarla takip etmek veya bu amaçla araçtan inmek maddesinden toplam 180 bin lira idari para cezası uygulandı. Ayrıca araç 60 gün süreyle trafikten men edilirken, sürücü belgesine de 60 gün süreyle geçici olarak el konuldu. Öte yandan sürücü İ.S. hakkında adli işlem yapılması amacıyla Polis Merkezi Amirliği'ne teslim edildi. Beylikdüzü'nde aracı durdurup saldıran sürücüye 180 bin lira ceza: Ehliyetine el konuldu İlginizi Çekebilecek Haberler İstanbul'un Beylikdüzü ilçesinde trafikte başka bir aracı ısrarla takip ederek, saldıran sürücü yakalandı. Sürücüye 180 bin lira para cezası uygulanırken, aracı 60 gün trafikten men edildi, ehliyetine ise 60 gün süreyle el konuldu. İstanbul Emniyet Müdürlüğü Trafik Denetleme Şube Müdürlüğü Sanal Devriye ekipleri, sosyal medyada paylaşılan araca saldırı görüntüleri üzerine çalışma başlattı. Yapılan incelemelerde araç sürücüsünün İ.S. olduğu tespit edildi. Olayın Beylikdüzü ilçesinde meydana geldiği belirlenirken, sürücüye 2918 sayılı Karayolları Trafik Kanunu kapsamında Trafikte saldırı amacıyla başka bir aracı ısrarla takip etmek veya bu amaçla araçtan inmek maddesinden toplam 180 bin lira idari para cezası uygulandı. Ayrıca araç 60 gün süreyle trafikten men edilirken, sürücü belgesine de 60 gün süreyle geçici olarak el konuldu. Öte yandan sürücü İ.S. hakkında adli işlem yapılması amacıyla Polis Merkezi Amirliği'ne teslim edildi. Sitemizde bulunan yazı , video, fotoğraf ve haberlerin her hakkı saklıdır. İzinsiz veya kaynak gösterilemeden kullanılamaz.","Beylikdüzü'nde aracı durdurup saldıran sürücüye 180 bin lira ceza: Ehliyetine el konuldu Beylikdüzü'nde aracı durdurup saldıran sürücüye 180 bin lira ceza: Ehliyetine el konuldu Pembe Pusula Paylaş Tweetle Whatsapp Telegram Beylikdüzü'nde aracı durdurup saldıran sürücüye 180 bin lira ceza: Ehliyetine el konuldu 30 Haziran 2026 - 13:58 - Güncelleme: 30 Haziran 2026 - 15:08 İstanbul'un Beylikdüzü ilçesinde trafikte başka bir aracı ısrarla takip ederek, saldıran sürücü yakalandı. Sürücüye 180 bin lira para cezası uygulanırken, aracı 60 gün trafikten men edildi, ehliyetine ise 60 gün süreyle el konuldu. İstanbul'un Beylikdüzü ilçesinde trafikte başka bir aracı ısrarla takip ederek, saldıran sürücü yakalandı. İstanbul Emniyet Müdürlüğü Trafik Denetleme Şube Müdürlüğü Sanal Devriye ekipleri, sosyal medyada paylaşılan araca saldırı görüntüleri üzerine çalışma başlattı. Yapılan incelemelerde araç sürücüsünün İ.S. Olayın Beylikdüzü ilçesinde meydana geldiği belirlenirken, sürücüye 2918 sayılı Karayolları Trafik Kanunu kapsamında Trafikte saldırı amacıyla başka bir aracı ısrarla takip etmek veya bu amaçla araçtan inmek maddesinden toplam 180 bin lira idari para cezası uygulandı. Ayrıca araç 60 gün süreyle trafikten men edilirken, sürücü belgesine de 60 gün süreyle geçici olarak el konuldu. hakkında adli işlem yapılması amacıyla Polis Merkezi Amirliği'ne teslim edildi. Beylikdüzü'nde aracı durdurup saldıran sürücüye 180 bin lira ceza: Ehliyetine el konuldu İlginizi Çekebilecek Haberler İstanbul'un Beylikdüzü ilçesinde trafikte başka bir aracı ısrarla takip ederek, saldıran sürücü yakalandı.",browser_full_article_dom,https://news.google.com/rss/articles/CBMizgFBVV95cUxQaHROUTRaZ2xKZ092Z3NOUWEzRjVLN190TFRuWXVya3lNWks5RzR1TGtlZ1Y0TjFpcF90MnlfbENFOUl2T25xaEo5NEYzWGVocnoySWx3eTB6YkRRZUpPXzRtNlRYeW1nQ0U1ekRETGFhUThkNjhaUlpTWGtxcndVLVc2bmdwTUhvT1dJRk9fY3RMSEdESUJwby1aU1NpeEJkT1FLbzg2a2R4S3NBcjB0MWVoV3lqT1dnZXBQLThiazVWcDhVek1adlhEVW96QdIBzgFBVV95cUxQaHROUTRaZ2xKZ092Z3NOUWEzRjVLN190TFRuWXVya3lNWks5RzR1TGtlZ1Y0TjFpcF90MnlfbENFOUl2T25xaEo5NEYzWGVocnoySWx3eTB6YkRRZUpPXzRtNlRYeW1nQ0U1ekRETGFhUThkNjhaUlpTWGtxcndVLVc2bmdwTUhvT1dJRk9fY3RMSEdESUJwby1aU1NpeEJkT1FLbzg2a2R4S3NBcjB0MWVoV3lqT1dnZXBQLThiazVWcDhVek1adlhEVW96QQ?oc=5&hl=tr&gl=TR&ceid=TR:tr,İstanbul,Beylikdüzü,,,,,,firma yok | faaliyet/tesis yok,,,,maps araması yapılmadı,,,128.25,34
2026-07-01 02:26:41,bankaya soruşturma,Banka / Finansal Kuruluş,Banka hesaplarını satma tekliflerinin sakıncaları.,Banka hesaplarını satma tekliflerinin sakıncaları. Vietnam.vn,https://news.google.com/rss/articles/CBMif0FVX3lxTE05dktselhMb1FWZk5ZenpHZEQ3MmIxSkdaSjJHUFBXbVk2SnhuLVZrbzZYQlg3MVRxajdUSy1aa3dxS2dQQ2NURU1TazFhM250YnJYcnRiSTFjNThFWVY5NWMtNEN3VmdJaDBUNlRuTl9yMVF1QUxOTS0zNTlQdEU?oc=5,banka,finansal kuruluş,Banka hesaplarını satma tekliflerinin sakıncaları. Vietnam.vn,Banka hesaplarını satma tekliflerinin sakıncaları. Banka hesaplarını satma tekliflerinin sakıncaları. Vietnam.vn Banka hesaplarını satma tekliflerinin sakıncaları.,browser_failed,https://news.google.com/rss/articles/CBMif0FVX3lxTE05dktselhMb1FWZk5ZenpHZEQ3MmIxSkdaSjJHUFBXbVk2SnhuLVZrbzZYQlg3MVRxajdUSy1aa3dxS2dQQ2NURU1TazFhM250YnJYcnRiSTFjNThFWVY5NWMtNEN3VmdJaDBUNlRuTl9yMVF1QUxOTS0zNTlQdEU?oc=5&hl=tr&gl=TR&ceid=TR:tr,,,,,,,,il yok | ilçe yok | firma yok | faaliyet/tesis yok,,,,maps araması yapılmadı,,,38.86,35
2026-07-01 07:59:00,bankaya soruşturma,Banka / Finansal Kuruluş,"Burdur'da Pes Dedirten Hırsızlık! Bankaya Girdi, Çıktığında Şoke Oldu!","Burdur'da Pes Dedirten Hırsızlık! Bankaya Girdi, Çıktığında Şoke Oldu! Burdur Yenigün",https://news.google.com/rss/articles/CBMinAFBVV95cUxOUWtxMXdwNmdneVV4ZmZENWh1Q0tvUDQ1SUYtOWl3akRjc2NrZ0VLTWVpa1VMZjlOTV9MU3lZb3ZFV0d2OENzRXltVk1FcVlnNVNpcFViVFRSYVpvelVaaE96RmoycVdwRmFpOTB5dF9lRUkybi1MRVN0Z0hiWjc4eEd1OFBjSVY3cThNblVhQmRmcktRR29zMDJRRzg?oc=5,banka,finansal kuruluş,"Burdur'da Pes Dedirten Hırsızlık! Bankaya Girdi, Çıktığında Şoke Oldu! Burdur Yenigün","Burdur'da Pes Dedirten Hırsızlık! Bankaya Girdi, Çıktığında Şoke Oldu! Burdur'da Pes Dedirten Hırsızlık! Bankaya Girdi, Çıktığında Şoke Oldu! Burdur Yenigün Burdur'da Pes Dedirten Hırsızlık! Bankaya Girdi, Çıktığında Şoke Oldu!",browser_failed,https://news.google.com/rss/articles/CBMinAFBVV95cUxOUWtxMXdwNmdneVV4ZmZENWh1Q0tvUDQ1SUYtOWl3akRjc2NrZ0VLTWVpa1VMZjlOTV9MU3lZb3ZFV0d2OENzRXltVk1FcVlnNVNpcFViVFRSYVpvelVaaE96RmoycVdwRmFpOTB5dF9lRUkybi1MRVN0Z0hiWjc4eEd1OFBjSVY3cThNblVhQmRmcktRR29zMDJRRzg?oc=5&hl=tr&gl=TR&ceid=TR:tr,Burdur,,,,,,,ilçe yok | firma yok | faaliyet/tesis yok,,,,maps araması yapılmadı,,,73.1,36
2026-06-30 20:57:00,bankaya soruşturma,Banka / Finansal Kuruluş,Bankada Silahlı Panik,Bankada Silahlı Panik Merzifon Bilgi Gazetesi,https://news.google.com/rss/articles/CBMifEFVX3lxTE5raGRWMWcyb2xLVWl3R0xtdEZQZXBxTTZfTEo2SFIzRVZvUmVaaC1rLXZ3WUpnQmoyRDNiMGR0YzhoRWZmOU1SVzFfRVQ3bTF0UDdUYkQ3UU5FRnVNbnF1Yk1HTU81QU0yQTBOS21FMkptTXl3cVcyMWtVMlk?oc=5,banka,finansal kuruluş,Bankada Silahlı Panik Merzifon Bilgi Gazetesi,Bankada Silahlı Panik Bankada Silahlı Panik Merzifon Bilgi Gazetesi Bankada Silahlı Panik Merzifon Bilgi Gazetesi,browser_failed,https://news.google.com/rss/articles/CBMifEFVX3lxTE5raGRWMWcyb2xLVWl3R0xtdEZQZXBxTTZfTEo2SFIzRVZvUmVaaC1rLXZ3WUpnQmoyRDNiMGR0YzhoRWZmOU1SVzFfRVQ3bTF0UDdUYkQ3UU5FRnVNbnF1Yk1HTU81QU0yQTBOS21FMkptTXl3cVcyMWtVMlk?oc=5&hl=tr&gl=TR&ceid=TR:tr,,,,,,,,il yok | ilçe yok | firma yok | faaliyet/tesis yok,,,,maps araması yapılmadı,,,20.2,37
