published,search_term,category,title,summary,link,matched_words,activity_type,raw_text,entity_source_text,article_fetch_status,resolved_article_url,city_candidates,district_candidates,neighborhood_candidates,street_candidates,facility_candidates,company_candidates,company_candidate_scores,entity_quality_note,maps_queries,maps_candidates,maps_best_guess,maps_status,maps_match_scores,maps_rejected_candidates,record_quality_score,duplicate_group_id
2026-06-30 11:37:46,üretim tesisi yangını,Fiziksel Risk / Yangın,Sanayi bölgelerinde yangın önleme ve yangın söndürme kapasitesini artırmak.,Sanayi bölgelerinde yangın önleme ve yangın söndürme kapasitesini artırmak. Vietnam.vn,https://news.google.com/rss/articles/CBMikgFBVV95cUxObGVzWEVxcl9YZjctTTlpaWlzLVlKNURkSlZzLVJ3azU5b3kzYUY3b2RKbEMyc0ttMmJyUldJT21WQ1FuZXg0ak9uTEdGLXdjeHlGeE9GZFRzOGN0YTQ2bEo3NkpMN1RsUVEwT3ZsMUlwYUhZVFNhZjBGbnN2UGVqR2w0RkFHYm5WSDJOSmpCbjQ4QQ?oc=5,sanayi,,Sanayi bölgelerinde yangın önleme ve yangın söndürme kapasitesini artırmak. Vietnam.vn,Sanayi bölgelerinde yangın önleme ve yangın söndürme kapasitesini artırmak. Sanayi bölgelerinde yangın önleme ve yangın söndürme kapasitesini artırmak. Vietnam.vn Sanayi bölgelerinde yangın önleme ve yangın söndürme kapasitesini artırmak.,browser_failed,https://news.google.com/rss/articles/CBMikgFBVV95cUxObGVzWEVxcl9YZjctTTlpaWlzLVlKNURkSlZzLVJ3azU5b3kzYUY3b2RKbEMyc0ttMmJyUldJT21WQ1FuZXg0ak9uTEdGLXdjeHlGeE9GZFRzOGN0YTQ2bEo3NkpMN1RsUVEwT3ZsMUlwYUhZVFNhZjBGbnN2UGVqR2w0RkFHYm5WSDJOSmpCbjQ4QQ?oc=5&hl=tr&gl=TR&ceid=TR:tr,,,,,,,,il yok | ilçe yok | firma yok | faaliyet/tesis yok,,,,maps araması yapılmadı,,,75.86,1
2026-06-30 10:00:02,üretim tesisi yangını,Fiziksel Risk / Yangın,Sanayi yangınlarında patlama yaşanıyor,Sanayi yangınlarında patlama yaşanıyor Kadırga TV,https://news.google.com/rss/articles/CBMihAFBVV95cUxOa2Q2VmV4c3VqdTJUbnNsak00QjlORldLdy1Pd1dOSVlMSG1XQmtvcWlWY1pLWTdWNmpyS1FWbW1WOWpvN1oxVlJKQnowUkFDOEF3ZDZJZF9sczRyOUhfUlBCd2xFd1VQNmNvMjRudElPWVlud0dFekF5RW5leFdsc3FiN2Y?oc=5,sanayi,,Sanayi yangınlarında patlama yaşanıyor Kadırga TV,Sanayi yangınlarında patlama yaşanıyor Sanayi yangınlarında patlama yaşanıyor Kadırga TV Sanayi yangınlarında patlama yaşanıyor Kadırga TV,browser_failed,https://news.google.com/rss/articles/CBMihAFBVV95cUxOa2Q2VmV4c3VqdTJUbnNsak00QjlORldLdy1Pd1dOSVlMSG1XQmtvcWlWY1pLWTdWNmpyS1FWbW1WOWpvN1oxVlJKQnowUkFDOEF3ZDZJZF9sczRyOUhfUlBCd2xFd1VQNmNvMjRudElPWVlud0dFekF5RW5leFdsc3FiN2Y?oc=5&hl=tr&gl=TR&ceid=TR:tr,,,,,,,,il yok | ilçe yok | firma yok | faaliyet/tesis yok,,,,maps araması yapılmadı,,,39.74,2
