published,search_term,category,title,summary,link,matched_words,activity_type,raw_text,entity_source_text,article_fetch_status,resolved_article_url,city_candidates,district_candidates,neighborhood_candidates,street_candidates,facility_candidates,company_candidates,company_candidate_scores,entity_quality_note,maps_queries,maps_candidates,maps_best_guess,maps_status,maps_match_scores,maps_rejected_candidates,record_quality_score,duplicate_group_id
2026-06-30 09:07:43,MASAK,Kara Para / MASAK / Bahis,Türkiye’nin başına bela olan örgütün 5 milyarlık sırrını MASAK çözdü! Teker teker gözaltına alındılar,Türkiye’nin başına bela olan örgütün 5 milyarlık sırrını MASAK çözdü! Teker teker gözaltına alındılar Yeni Akit Gazetesi,https://news.google.com/rss/articles/CBMi3wFBVV95cUxQWmlFeWxHc1VZN0hQZWRjWE02Y1M0QkY4VnBNaHNnZi1VaFkxWE4wTy12a25pYnFvdk9QMWx0cUZsYTYyekNhUG5qT2p0c1lsSlVWQmlMV2VwUklfRUwwWTEwVTZ5UmZzUHF6UVlwdG1abDAydGVKbFZfelQwUTVOWHRsbnNrWUhYX2l6YmZqc2lmVTI3QmJWalo3cXRoVFpyWHQ5NGc2TF9JLVA0akFzUnAwOGYtb2ZLZlF1dUVGTHUyR1RSMjFpa3Y5RlJLSGo3Vl82bGs2Tnc1ck9tLUYw0gHiAUFVX3lxTFAzUV85aHpXeHR5blZQdDQwOGpTQmJQRC10T2lObDZjVGE1S19ZWkExaC00RHpyelJkbVJkZXk2a25tRXVKWnpXUHZ0U2o0NnJQLUFlR3JLZXBJTTVSR0p6SXhWN2tTcHZyTmVWZWc1T1J5a1oxOWpfaTJaS3ZwaVR2THFVS0dRSnlHSVVjVXNycWZsY3hua0U0WndaajBKQXZSSW5QSTF2LXlkQ2Vjc2ZMMFVWYkpKcDJyUkJoUVZpWVlldkp0RXZ2QXg5ZEZUbkdiUXZ4ZUpEbW9laGpra0lXSUE?oc=5,masak,,"İstanbul merkezli 5 ilde Çapkanlar suç örgütüne yönelik yasa dışı bahis operasyonunda, hakkında gözaltı kararı verilen 28 şüpheliden 24'ü yakalandı. 5 milya.. İstanbul merkezli 5 ilde Çapkanlar suç örgütüne yönelik yasa dışı bahis operasyonunda, hakkında gözaltı kararı verilen 28 şüpheliden 24'ü yakalandı. 5 milya.. İstanbul merkezli 5 ilde Çapkanlar suç örgütüne yönelik yasa dışı bahis operasyonunda, hakkında gözaltı kararı verilen 28 şüpheliden 24'ü yakalandı. 5 milya..","Türkiye’nin başına bela olan örgütün 5 milyarlık sırrını MASAK çözdü! Teker teker gözaltına alındılar Türkiye’nin başına bela olan örgütün 5 milyarlık sırrını MASAK çözdü! Teker teker gözaltına alındılar Yeni Akit Gazetesi İstanbul merkezli 5 ilde Çapkanlar suç örgütüne yönelik yasa dışı bahis operasyonunda, hakkında gözaltı kararı verilen 28 şüpheliden 24'ü yakalandı.",browser_full_article,https://www.yeniakit.com.tr/foto-galeri/turkiyenin-basina-bela-olan-orgutun-5-milyarlik-sirrini-masak-cozdu-teker-teker-gozaltina-alindilar-163324/3,İstanbul,,,,,,,ilçe yok | firma yok | faaliyet/tesis yok,,,,maps araması yapılmadı,,,111.26,19
2026-06-30 19:22:46,iflas,İflas / Konkordato / Mali Sorun,Türkiye'nin 23 yıllık tekstil devi iflas etti: Firmalar arasında öncülerdendi...,Türkiye'nin 23 yıllık tekstil devi iflas etti: Firmalar arasında öncülerdendi... Artı Gerçek,https://news.google.com/rss/articles/CBMivwFBVV95cUxOS0RaZ3dOOFJfWndOVU1nd3RxVkpMYTVtMlJMWFZfRzlBOENZbi1jaXJrM3Vvek1pem5oVHFiSVlJNE1FZk9YVUVwQmVCZWhxMjFTaVlNYVJEYTlOYkw2M2hmR2s4VzE4d0wta2dsdmM0aTBBOXhoWU1hblpqcFlaajY3TVRxVmJaZGxPcnNycldxLWNWOThjSDZUVmpzM09tZTFDcUY1UFFubFVlQUdCT0ZhMmU0cGZvLW1BRWduMA?oc=5,"firma, tekstil",şirket / firma,"Ege Bölgesi'nin köklü tekstil firmalarından biri daha ekonomik zorluklara yenik düştü. Erkek ve kadın giyim alanında 23 yıldır faaliyet gösteren Denfa Moda Tekstil hakkında mahkeme iflas kararı verirken, şirketin mali yapısını toparlayamadığı belirtildi.","Türkiye'nin 23 yıllık tekstil devi iflas etti: Firmalar arasında öncülerdendi... Türkiye'nin 23 yıllık tekstil devi iflas etti: Firmalar arasında öncülerdendi... Artı Gerçek Ege Bölgesi'nin köklü tekstil firmalarından biri daha ekonomik zorluklara yenik düştü. Erkek ve kadın giyim alanında 23 yıldır faaliyet gösteren Denfa Moda Tekstil hakkında mahkeme iflas kararı verirken, şirketin mali yapısını toparlayamadığı belirtildi.",browser_full_article,https://artigercek.com/gozden-kacmasin/turkiyenin-23-yillik-tekstil-devi-iflas-etti-firmalar-arasinda-onculerdendi-347890h,,,,,,,,il yok | ilçe yok | firma yok | faaliyet/tesis yok,,,,maps araması yapılmadı,,,81.54,20
2026-06-30 11:40:27,konkordato,İflas / Konkordato / Mali Sorun,Ege Bölgesi'nde tekstil depremi: 23 yıllık dev marka resmen iflas etti!,Ege Bölgesi'nde tekstil depremi: 23 yıllık dev marka resmen iflas etti! Sözcü Gazetesi,https://news.google.com/rss/articles/CBMiqgFBVV95cUxPdGEwVUFvWnpFa3NuaDRvSU55Rks5VTNrVDZWZ3N4UXNYSFo4V19UVzk4OTRLZVdqXzFweFdtQWl5NnZjdEtibURENXdXR2NJZVgzNnRSOG5jdUVINk5OVlRmSlQyTXYtSDhxS1Ezb2NVSmpsUHQ4dFpvdkdmT3pjRFllamwtTjNvTmxKSEIwM0dWX1pfUWpPaUI5a2tQcjQwTzVRbmdSc1ozUQ?oc=5,tekstil,,"Haberler - Ekonomi Ege Bölgesi'nde tekstil depremi: 23 yıllık dev marka resmen iflas etti! Ege'de 23 yıllık dev tekstil çınarı devrildi. Bölgenin önde gelen giyim markalarından Denfa Moda Tekstil, girdiği mali darboğazı aşamayarak resmen iflas etti. Konkordato sürecinden de sonuç alamayan İzmir merkezli dev firmanın tasfiye süreci başlarken, alacaklılar için kritik ilk toplantının tarihi de netleşti. Yayınlanma: 30 Haziran 2026 - 14:40 Güncellenme: Ege Bölgesi'nde erkek ve kadın giyim sektöründe uzun yıllardır faaliyette olan 23 yıllık Denfa Moda Tekstil resmen iflas etti. İzmir ve Manisa başta olmak üzere Ege Bölgesi'nde erkek ve kadın giyim sektöründe uzun yıllardır faaliyet gösteren Denfa Moda Tekstil Sanayi Ticaret Limited Şirketi hakkında iflas kararı verildi. Bir süredir yaşadığı mali darboğazı aşmak amacıyla konkordato sürecine giren şirketin kurtarma çabaları sonuçsuz kaldı. İzmir 1. Asliye Ticaret Mahkemesi, firmaya tanınan 1 yıllık kesin mühletin ardından 25 Haziran 2026 tarihi itibarıyla şirketin iflasına hükmetti. Temelleri 11 Mart 2003 tarihinde Aydın'ın Kurtuluş Mahallesi'nde atılan ve zamanla büyümesini İzmir Gaziemir ile Manisa Alaşehir eksenine taşıyan Denfa Moda, hem fiziksel mağazacılık hem de e-ticaret üzerinden perakende satışlar gerçekleştiriyordu. KONKORDATO TALEP ETMİŞTİ Son yıllarda derinleşen ekonomik zorluklar nedeniyle mahkemeye başvurarak konkordato talep eden ve 1 yıllık kesin mühlet hakkı elde eden şirket, bu süreçte mali yapısını toparlayamadı. İzmir 1. Asliye Ticaret Mahkemesi'nin 2025/360 Esas sayılı dosyası üzerinden görülen davada, şirketin adi tasfiye usulüyle iflasına karar verildiği kamuoyuna duyuruldu. İzmir İflas Müdürlüğü (2026/17 İflas dosyası) tarafından yayımlanan resmi ilanda, merkezi Gaziemir'de (Irmak Mah. Metin Henkoğlu Cad. No: 20A) bulunan şirketle ilgili hukuki tasfiye sürecinin detayları paylaşıldı","Ege Bölgesi'nde tekstil depremi: 23 yıllık dev marka resmen iflas etti! Ege Bölgesi'nde tekstil depremi: 23 yıllık dev marka resmen iflas etti! Sözcü Gazetesi Haberler - Ekonomi Ege Bölgesi'nde tekstil depremi: 23 yıllık dev marka resmen iflas etti! Ege'de 23 yıllık dev tekstil çınarı devrildi. Bölgenin önde gelen giyim markalarından Denfa Moda Tekstil, girdiği mali darboğazı aşamayarak resmen iflas etti. Konkordato sürecinden de sonuç alamayan İzmir merkezli dev firmanın tasfiye süreci başlarken, alacaklılar için kritik ilk toplantının tarihi de netleşti. Yayınlanma: 30 Haziran 2026 - 14:40 Güncellenme: Ege Bölgesi'nde erkek ve kadın giyim sektöründe uzun yıllardır faaliyette olan 23 yıllık Denfa Moda Tekstil resmen iflas etti. İzmir ve Manisa başta olmak üzere Ege Bölgesi'nde erkek ve kadın giyim sektöründe uzun yıllardır faaliyet gösteren Denfa Moda Tekstil Sanayi Ticaret Limited Şirketi hakkında iflas kararı verildi. Bir süredir yaşadığı mali darboğazı aşmak amacıyla konkordato sürecine giren şirketin kurtarma çabaları sonuçsuz kaldı. Asliye Ticaret Mahkemesi, firmaya tanınan 1 yıllık kesin mühletin ardından 25 Haziran 2026 tarihi itibarıyla şirketin iflasına hükmetti. Temelleri 11 Mart 2003 tarihinde Aydın'ın Kurtuluş Mahallesi'nde atılan ve zamanla büyümesini İzmir Gaziemir ile Manisa Alaşehir eksenine taşıyan Denfa Moda, hem fiziksel mağazacılık hem de e-ticaret üzerinden perakende satışlar gerçekleştiriyordu. KONKORDATO TALEP ETMİŞTİ Son yıllarda derinleşen ekonomik zorluklar nedeniyle mahkemeye başvurarak konkordato talep eden ve 1 yıllık kesin mühlet hakkı elde eden şirket, bu süreçte mali yapısını toparlayamadı. Asliye Ticaret Mahkemesi'nin 2025/360 Esas sayılı dosyası üzerinden görülen davada, şirketin adi tasfiye usulüyle iflasına karar verildiği kamuoyuna duyuruldu. İzmir İflas Müdürlüğü (2026/17 İflas dosyası) tarafından yayımlanan resmi ilanda, merkezi Gaziemir'de (Irmak Mah. No: 20A) bulunan şirketle ilgili hukuki tasfiye sürecinin detayları paylaşıldı",browser_full_article,https://www.sozcu.com.tr/amp/ege-bolgesi-nde-tekstil-depremi-23-yillik-dev-marka-resmen-iflas-etti-p332499,Aydın | İzmir | Manisa,Gaziemir | Alaşehir,ın Kurtuluş Mahallesi,,,Denfa Moda Tekstil Sanayi Ticaret Limited Şirketi,Denfa Moda Tekstil Sanayi Ticaret Limited Şirketi:raw_legal,faaliyet/tesis yok,Denfa Moda Tekstil Sanayi Ticaret Limited Şirketi ın Kurtuluş Mahallesi Gaziemir Aydın Türkiye,DENFA,DENFA,firma adı + güvenli maps adayı var,100.0,,214.0,21
2026-07-01 07:00:05,konkordato,İflas / Konkordato / Mali Sorun,Harveys Supermarket iflası: 102 yıllık gıda devi ABD'de son mağazalarını da kapattı,Harveys Supermarket iflası: 102 yıllık gıda devi ABD'de son mağazalarını da kapattı | Ekonomi Haberleri GZT,https://news.google.com/rss/articles/CBMi0AFBVV95cUxPVFFoOHdRamJwM2ZoX3hXSjVhb3BibVlhMktfYUl0TmUwREloS2tKOTZRVEV3QllXRzdlYzF4Tm8zSkN1ZHA1b0dwZmhfWVg5TzNYZFBPN3I4Q0t5eHFBTUdxbEZMbWczVHl0R0JjZVV6R2w3SWFpWE84ZU5HcUlwSTdIM1I0aGp5MGsyQnluY1M1Y1hlOGlGRTYtWHd0Vy1WSE5hT0wzMHN5dnc0VXMya3VlQWI3T0NZb1U0aFFvbUVvNDJZcTAzSjV6N05rM1lM?oc=5,gıda,,Harveys Supermarket iflası: 102 yıllık gıda devi ABD'de son mağazalarını da kapattı | Ekonomi Haberleri GZT,Harveys Supermarket iflası: 102 yıllık gıda devi ABD'de son mağazalarını da kapattı Harveys Supermarket iflası: 102 yıllık gıda devi ABD'de son mağazalarını da kapattı | Ekonomi Haberleri GZT Harveys Supermarket iflası: 102 yıllık gıda devi ABD'de son mağazalarını da kapattı | Ekonomi Haberleri GZT,browser_failed,https://news.google.com/rss/articles/CBMi0AFBVV95cUxPVFFoOHdRamJwM2ZoX3hXSjVhb3BibVlhMktfYUl0TmUwREloS2tKOTZRVEV3QllXRzdlYzF4Tm8zSkN1ZHA1b0dwZmhfWVg5TzNYZFBPN3I4Q0t5eHFBTUdxbEZMbWczVHl0R0JjZVV6R2w3SWFpWE84ZU5HcUlwSTdIM1I0aGp5MGsyQnluY1M1Y1hlOGlGRTYtWHd0Vy1WSE5hT0wzMHN5dnc0VXMya3VlQWI3T0NZb1U0aFFvbUVvNDJZcTAzSjV6N05rM1lM?oc=5&hl=tr&gl=TR&ceid=TR:tr,,,,,,,,il yok | ilçe yok | firma yok | faaliyet/tesis yok,,,,maps araması yapılmadı,,,85.32,22
2026-07-01 06:57:06,iflas,İflas / Konkordato / Mali Sorun,"Bursa'da 2 şirketle ilgili kritik iflas süreci! Mahkeme duyurdu, süre verildi...","Bursa'da 2 şirketle ilgili kritik iflas süreci! Mahkeme duyurdu, süre verildi... Bursa Hakimiyet",https://news.google.com/rss/articles/CBMiwAFBVV95cUxOOG1NdWlJSHhvUVVEcTdDYXNVS0JoT0wyRFBYYTZQNHJfRXNEbHlUQ0Z1NnE5Z25LaGhXeDR2OE5JWHpITEk1eHlpRU1lZmNVM2RvR0FURVA3aTctZm5tRXN2TVAyNUVxRTlXTXNXUENyUE05TDRPMERJYnhiQlMyMnpOY1NablRIZEs2MVJMSUFJM3V5NnY4c0JhbDdlTGVHRzFtWW9BakwzMEdXcEtxc3ItS0JlWWxHeDVZWFRwam0?oc=5,şirket,şirket / firma,"Bursa'da 2 şirketle ilgili kritik iflas süreci! Mahkeme duyurdu, süre verildi... Bursa Hakimiyet","Bursa'da 2 şirketle ilgili kritik iflas süreci! Mahkeme duyurdu, süre verildi... Bursa'da 2 şirketle ilgili kritik iflas süreci! Mahkeme duyurdu, süre verildi... Bursa Hakimiyet Bursa'da 2 şirketle ilgili kritik iflas süreci! Mahkeme duyurdu, süre verildi...",browser_failed,https://news.google.com/rss/articles/CBMiwAFBVV95cUxOOG1NdWlJSHhvUVVEcTdDYXNVS0JoT0wyRFBYYTZQNHJfRXNEbHlUQ0Z1NnE5Z25LaGhXeDR2OE5JWHpITEk1eHlpRU1lZmNVM2RvR0FURVA3aTctZm5tRXN2TVAyNUVxRTlXTXNXUENyUE05TDRPMERJYnhiQlMyMnpOY1NablRIZEs2MVJMSUFJM3V5NnY4c0JhbDdlTGVHRzFtWW9BakwzMEdXcEtxc3ItS0JlWWxHeDVZWFRwam0?oc=5&hl=tr&gl=TR&ceid=TR:tr,Bursa,,,,,,,ilçe yok | firma yok | faaliyet/tesis yok,,,,maps araması yapılmadı,,,90.96,23
2026-06-30 16:51:00,iflas,İflas / Konkordato / Mali Sorun,İnegöl'de iflas eden şirket için mahkemeden yeni karar,İnegöl'de iflas eden şirket için mahkemeden yeni karar Yıldırım Gazetesi,https://news.google.com/rss/articles/CBMijwFBVV95cUxQYTdCdHVLazJSa0d0SnAtOFlFR2FNdDZwZW9kWTdDRFJndE5YWWV2LUROVEVNaEo3azZZS3BiTklONUVIZmZaNWdZb1NJOF84ZU84SlNtSXYtOVBDdmplYTlGRE0xTm1tc0FUOXY0VUs5WnhXcmVtaE8zeUNYT3NWYV92bmVKbS1ldEhwQjNBYw?oc=5,şirket,şirket / firma,"İnegöl İcra Dairesi, iflasına karar verilen İmd Taşımacılık Depolama Gıda Tarım Hayvancılık Ambalaj İnşaat Taahhüt Mobilya Sanayi ve Ticaret Limited Şirketi'ne ilişkin ek sıra cetvelinin hazırlandığını duyurdu. İnegöl İcra Dairesi, iflasına karar verilen İmd Taşımacılık Depolama Gıda Tarım Hayvancılık Ambalaj İnşaat Taahhüt Mobilya Sanayi ve Ticaret Limited Şirketi'ne ilişkin ek sıra cetvelinin hazırlandığını duyurdu. İnegöl İcra Dairesi, iflasına karar verilen İmd Taşımacılık Depolama Gıda Tarım Hayvancılık Ambalaj İnşaat Taahhüt Mobilya Sanayi ve Ticaret Limited Şirketi'ne ilişkin ek sıra cetvelinin hazırlandığını duyurdu.","İnegöl'de iflas eden şirket için mahkemeden yeni karar İnegöl'de iflas eden şirket için mahkemeden yeni karar Yıldırım Gazetesi İnegöl İcra Dairesi, iflasına karar verilen İmd Taşımacılık Depolama Gıda Tarım Hayvancılık Ambalaj İnşaat Taahhüt Mobilya Sanayi ve Ticaret Limited Şirketi'ne ilişkin ek sıra cetvelinin hazırlandığını duyurdu.",browser_full_article,https://www.yildirimgazetesi.com/inegolde-iflas-eden-sirket-icin-mahkemeden-yeni-karar,Bursa,İnegöl,,,,,,firma yok | faaliyet/tesis yok,,,,maps araması yapılmadı,,,77.32,24
2026-07-01 07:10:00,yasadışı bahis,Diğer,"Kocaeli'de dev siber operasyon: 6,6 milyar TL’ye el konuldu","Kocaeli'de dev siber operasyon: 6,6 milyar TL’ye el konuldu Kocaeli Gazetesi",https://news.google.com/rss/articles/CBMiqAFBVV95cUxPdWE3a2M1LVFBNUpiVVFraWtzcWV3Mk5LVG55bmdITi1IRUV0QmN5SzYzeHhmTC1LUTVmUWlacHpyYlJaQ2JtUXRYSVdKTTNzV0NtS3hlckRGWW90eGFuSWNyS1pwODRzU3ZNR2FFRnkxUHN6LVc2V2MtLV9kSl9XZUhYZkREaUw0akdHMWw3NkQ1QkducUw4b0tfQXh3NTdNYjR1TXR4akQ?oc=5,el konuldu,,"Kocaeli Emniyet Müdürlüğü Siber Suçlarla Mücadele Şube Müdürlüğü, Cumhuriyet tarihinin en büyük yasadışı bahis operasyonlarından birine imza attı. Kocaeli merkezli 31 ilde eş zamanlı düzenlenen dev operasyonda, yasadışı bahis paralarını gizlemek için 15 paravan şirket kuran suç örgütü çökertildi. Örgütün sadece 3 ayda hesaplarında döndürdüğü tam 6 milyar 657 milyon 746 bin 26 TL’ye el konulurken, 118 şüpheli kıskıvrak yakalandı. Kocaeli Emniyet Müdürlüğü Siber Suçlarla Mücadele Şube Müdürlüğü, Cumhuriyet tarihinin en büyük yasadışı bahis operasyonlarından birine imza attı. Kocaeli merke... Kocaeli Emniyet Müdürlüğü Siber Suçlarla Mücadele Şube Müdürlüğü, Cumhuriyet tarihinin en büyük yasadışı bahis operasyonlarından birine imza attı. Kocaeli merkezli 31 ilde eş zamanlı düzenlenen dev operasyonda, yasadışı bahis paralarını gizlemek için 15 paravan şirket kuran suç örgütü çökertildi. Örgütün sadece 3 ayda hesaplarında döndürdüğü tam 6 milyar 657 milyon 746 bin 26 TL’ye el konulurken, 118 şüpheli kıskıvrak yakalandı. +1 Haber albümü için resme tıklayın Kocaeli merkezli 31 ilde yasa dışı bahis ve kumar oynatan suç örgütüne yönelik düzenlenen eş zamanlı operasyonda 118 şüpheli gözaltına alındı. Suç örgütünün kurduğu 15 paravan şirket üzerinden altın hesabı ve kripto para işlemleriyle yaklaşık 3 ayda 6 milyar 657 milyon liralık para trafiği yürüttüğü tespit edildi. İl Emniyet Müdürlüğü Siber Suçlarla Mücadele Şube Müdürlüğü ekipleri, yasa dışı bahis ve kumar siteleri üzerinden faaliyet yürüten suç örgütünün deşifre edilmesine yönelik çalışma başlattı. Kocaeli Cumhuriyet Başsavcılığı koordinesinde yürütülen teknik ve fiziki takipler sonucunda, şüphelilerin yasa dışı faaliyetlerini gizlemek amacıyla 15 paravan şirket kurduğu belirlendi. Suç örgütünün bahis işlemlerini, bu şirketler aracılığıyla altın hesabı veya kripto para alımı yaparak gerçekleştirdiği tespit edildi. 3 ayda yaklaşık 6,6 milyar liralık para trafiği Ekiplerin yaptığı detaylı incelemelerde, bahis sitelerindeki hesapların yanı sıra paravan şirketlere ait hesaplara son 3 aylık süre içerisinde yaklaşık 6 milyar 657 milyon 746 bin lira para aktarıldığı ortaya çıkarıldı. Suçtan elde edildiği değerlendirilen bu hesaplara el konuldu. 118 şüpheli gözaltında Yürütülen soruşturma kapsamında, şüphelilerin yakalanması için 30 Haziran'da Kocaeli merkezli 31 ilde eş zamanlı operasyon düzenlendi. Operasyonlarda 118 şüpheli gözaltına alınırken, şahısların ikamet ve iş yerlerinde yapılan aramalarda çok sayıda dijital materyal, 2 ruhsatsız tabanca ve 108 fişek ele geçirildi. Şüphelilerin emniyetteki işlemleri sürüyor. # operasyon , emniyet , uzman , Soruşturma 01 Cemaltürk - Ülke hırsız , dolandırıcı , rüşvetçi, karapara aklamacı, mafya, mufyadan geçilmiyor . Bunlar buzdağının görünen kısmı , ağa babaları boğazda , bodrumda, lüks teknelerde , dubai, singapur , paris , bakın bakalım şebeke üyeleri kimler sık sık gidiyor buralara sıra ile. Yanıtla . 0 Beğen . 0 Beğenme 01 Temmuz 10:36 01 Tem 2026 - 10:10 - Asayiş G üncelleme : 01 Tem 2026 - 10:15 Kocaeli'de dev siber operasyon: 6,6 milyar TL’ye el konuldu Kocaeli Emniyet Müdürlüğü Siber Suçlarla Mücadele Şube Müdürlüğü, Cumhuriyet tarihinin en büyük yasadışı bahis operasyonlarından birine imza attı. Kocaeli merkezli 31 ilde eş zamanlı düzenlenen dev operasyonda, yasadışı bahis paralarını gizlemek için 15 paravan şirket kuran suç örgütü çökertildi. Örgütün sadece 3 ayda hesaplarında döndürdüğü tam 6 milyar 657 milyon 746 bin 26 TL’ye el konulurken, 118 şüpheli kıskıvrak yakalandı. İhlas Haber Ajansı Tüm Haberleri +1 Haber albümü için resme tıklayın Kocaeli merkezli 31 ilde yasa dışı bahis ve kumar oynatan suç örgütüne yönelik düzenlenen eş zamanlı operasyonda 118 şüpheli gözaltına alındı. Suç örgütünün kurduğu 15 paravan şirket üzerinden altın hesabı ve kripto para işlemleriyle yaklaşık 3 ayda 6 milyar 657 milyon liralık para trafiği yürüttüğü tespit edildi. İl Emniyet Müdürlüğü Siber Suçlarla Mücadele Şube Müdürlüğü ekipleri, yasa dışı bahis ve kumar siteleri üzerinden faaliyet yürüten suç örgütünün deşifre edilmesine yönelik çalışma başlattı. Kocaeli Cumhuriyet Başsavcılığı koordinesinde yürütülen teknik ve fiziki takipler sonucunda, şüphelilerin yasa dışı faaliyetlerini gizlemek amacıyla 15 paravan şirket kurduğu belirlendi. Suç örgütünün bahis işlemlerini, bu şirketler aracılığıyla altın hesabı veya kripto para alımı yaparak gerçekleştirdiği tespit edildi. 3 ayda yaklaşık 6,6 milyar liralık para trafiği Ekiplerin yaptığı detaylı incelemelerde, bahis sitelerindeki hesapların yanı sıra paravan şirketlere ait hesaplara son 3 aylık süre içerisinde yaklaşık 6 milyar 657 milyon 746 bin lira para aktarıldığı ortaya çıkarıldı. Suçtan elde edildiği değerlendirilen bu hesaplara el konuldu. 118 şüpheli gözaltında Yürütülen soruşturma kapsamında, şüphelilerin yakalanması için 30 Haziran'da Kocaeli merkezli 31 ilde eş zamanlı operasyon düzenlendi. Operasyonlarda 118 şüpheli gözaltına alınırken, şahısların ikamet ve iş yerlerinde yapılan aramalarda çok sayıda dijital materyal, 2 ruhsatsız tabanca ve 108 fişek ele geçirildi. Şüphelilerin emniyetteki işlemleri sürüyor. # operasyon , emniyet , uzman , Soruşturma 01 Tem 2026 - 10:10 - Asayiş Yazdır Mahreç İhlas Haber Ajansı Son bir ayda kocaeligazetesi.com.tr sitesinde 2.553.981 gösterim gerçekleşti. GİRİŞ YAP Yorum yazarak Kocaeli Gazetesi Topluluk Kuralları’nı kabul etmiş bulunuyor ve yorumunuzla ilgili doğrudan veya dolaylı tüm sorumluluğu tek başınıza üstleniyorsunuz. Yazılan yoruml","Kocaeli'de dev siber operasyon: 6,6 milyar TL’ye el konuldu Kocaeli'de dev siber operasyon: 6,6 milyar TL’ye el konuldu Kocaeli Gazetesi Kocaeli Emniyet Müdürlüğü Siber Suçlarla Mücadele Şube Müdürlüğü, Cumhuriyet tarihinin en büyük yasadışı bahis operasyonlarından birine imza attı. Kocaeli merkezli 31 ilde eş zamanlı düzenlenen dev operasyonda, yasadışı bahis paralarını gizlemek için 15 paravan şirket kuran suç örgütü çökertildi. Örgütün sadece 3 ayda hesaplarında döndürdüğü tam 6 milyar 657 milyon 746 bin 26 TL’ye el konulurken, 118 şüpheli kıskıvrak yakalandı. +1 Haber albümü için resme tıklayın Kocaeli merkezli 31 ilde yasa dışı bahis ve kumar oynatan suç örgütüne yönelik düzenlenen eş zamanlı operasyonda 118 şüpheli gözaltına alındı. Suç örgütünün kurduğu 15 paravan şirket üzerinden altın hesabı ve kripto para işlemleriyle yaklaşık 3 ayda 6 milyar 657 milyon liralık para trafiği yürüttüğü tespit edildi. İl Emniyet Müdürlüğü Siber Suçlarla Mücadele Şube Müdürlüğü ekipleri, yasa dışı bahis ve kumar siteleri üzerinden faaliyet yürüten suç örgütünün deşifre edilmesine yönelik çalışma başlattı. Kocaeli Cumhuriyet Başsavcılığı koordinesinde yürütülen teknik ve fiziki takipler sonucunda, şüphelilerin yasa dışı faaliyetlerini gizlemek amacıyla 15 paravan şirket kurduğu belirlendi. Suç örgütünün bahis işlemlerini, bu şirketler aracılığıyla altın hesabı veya kripto para alımı yaparak gerçekleştirdiği tespit edildi. 3 ayda yaklaşık 6,6 milyar liralık para trafiği Ekiplerin yaptığı detaylı incelemelerde, bahis sitelerindeki hesapların yanı sıra paravan şirketlere ait hesaplara son 3 aylık süre içerisinde yaklaşık 6 milyar 657 milyon 746 bin lira para aktarıldığı ortaya çıkarıldı. Suçtan elde edildiği değerlendirilen bu hesaplara el konuldu. 118 şüpheli gözaltında Yürütülen soruşturma kapsamında, şüphelilerin yakalanması için 30 Haziran'da Kocaeli merkezli 31 ilde eş zamanlı operasyon düzenlendi. Operasyonlarda 118 şüpheli gözaltına alınırken, şahısların ikamet ve iş yerlerinde yapılan aramalarda çok sayıda dijital materyal, 2 ruhsatsız tabanca ve 108 fişek ele geçirildi. # operasyon , emniyet , uzman , Soruşturma 01 Cemaltürk - Ülke hırsız , dolandırıcı , rüşvetçi, karapara aklamacı, mafya, mufyadan geçilmiyor . Bunlar buzdağının görünen kısmı , ağa babaları boğazda , bodrumda, lüks teknelerde , dubai, singapur , paris , bakın bakalım şebeke üyeleri kimler sık sık gidiyor buralara sıra ile. 0 Beğenme 01 Temmuz 10:36 01 Tem 2026 - 10:10 - Asayiş G üncelleme : 01 Tem 2026 - 10:15 Kocaeli'de dev siber operasyon: 6,6 milyar TL’ye el konuldu Kocaeli Emniyet Müdürlüğü Siber Suçlarla Mücadele Şube Müdürlüğü, Cumhuriyet tarihinin en büyük yasadışı bahis operasyonlarından birine imza attı. İhlas Haber Ajansı Tüm Haberleri +1 Haber albümü için resme tıklayın Kocaeli merkezli 31 ilde yasa dışı bahis ve kumar oynatan suç örgütüne yönelik düzenlenen eş zamanlı operasyonda 118 şüpheli gözaltına alındı. # operasyon , emniyet , uzman , Soruşturma 01 Tem 2026 - 10:10 - Asayiş Yazdır Mahreç İhlas Haber Ajansı Son bir ayda kocaeligazetesi.com.tr sitesinde 2.553.981 gösterim gerçekleşti. GİRİŞ YAP Yorum yazarak Kocaeli Gazetesi Topluluk Kuralları’nı kabul etmiş bulunuyor ve yorumunuzla ilgili doğrudan veya dolaylı tüm sorumluluğu tek başınıza üstleniyorsunuz.",browser_full_article,https://www.kocaeligazetesi.com.tr/haber/28263399/kocaelide-dev-siber-operasyon-66-milyar-tlye-el-konuldu,Kocaeli,,,,,,,ilçe yok | firma yok | faaliyet/tesis yok,,,,maps araması yapılmadı,,,81.5,25
