published,search_term,category,title,summary,link,matched_words,activity_type,raw_text,entity_source_text,article_fetch_status,resolved_article_url,city_candidates,district_candidates,neighborhood_candidates,street_candidates,facility_candidates,company_candidates,company_candidate_scores,entity_quality_note,maps_queries,maps_candidates,maps_best_guess,maps_status,maps_match_scores,maps_rejected_candidates,record_quality_score,duplicate_group_id
2026-07-03 17:40:32,tesis yangını,Fiziksel Risk / Yangın,Adana'da narenciye paketleme tesisinde yangın: Alevler kontrol altına alındı,Adana'da narenciye paketleme tesisinde yangın: Alevler kontrol altına alındı | YEREL HABERLER GZT,https://news.google.com/rss/articles/CBMiwgFBVV95cUxQbFdPU1BkWGVHN0VaSjVlZDhfV2twMzFZZUVjUG5RalRMNXEyOGlUTkwwckctQzNBcVlNZnVnT0RLd2RHWmxhQ1o4Zm1TWWpPSXpXNUlRdUhFZ21oQnhCa0dEcWpRVG8tZFg5QjY0Vlh0a1ZTbHFOUmtGZzhTRkhyWVVUNWVzRUdBMXoxT2pydGVjMTByQWt3WmJkdGtBVDB0Rmc0QUN6QmZyQkxTdDBJNWhZUE9sOHdkMlg5S1pTVGN0Zw?oc=5,tesis,,"Adana'nın Yüreğir ilçesinde bulunan bir narenciye paketleme tesisinde çıkan yangın paniğe neden oldu. Kısa sürede tesisi saran alevler, itfaiye ekiplerinin yoğun müdahalesiyle kontrol altına alınırken, olayla ilgili inceleme başlatıldı. Adana'nın Yüreğir ilçesinde bulunan bir narenciye paketleme tesisinde çıkan yangın paniğe neden oldu. Kısa sürede tesisi saran alevler, itfaiye ekiplerinin yoğun müdahalesiyle kontrol altına alınırken, olayla ilgili inceleme başlatıldı.","Adana'da narenciye paketleme tesisinde yangın: Alevler kontrol altına alındı Adana'da narenciye paketleme tesisinde yangın: Alevler kontrol altına alındı | YEREL HABERLER GZT Adana'nın Yüreğir ilçesinde bulunan bir narenciye paketleme tesisinde çıkan yangın paniğe neden oldu. Kısa sürede tesisi saran alevler, itfaiye ekiplerinin yoğun müdahalesiyle kontrol altına alınırken, olayla ilgili inceleme başlatıldı.",browser_full_article,https://www.gzt.com/gundem/adanada-narenciye-paketleme-tesisinde-yangin-alevler-kontrol-altina-alindi-yerel-haberler-4238185,Adana,Yüreğir,,,Kısa sürede tesisi,,,firma yok,Kısa sürede tesisi Yüreğir Adana Türkiye,ASKİ Yüreğir Atıksu Arıtma Tesisi | Songül Paksoy Tesisleri | Misis Köprüsü,ASKİ Yüreğir Atıksu Arıtma Tesisi,"firma adı yok, tesis/lokasyon ile maps tahmini var",54.90196078431372 | 58.53658536585366 | 45.16129032258065,CASFİT HANGAR SPOR KOMPLEKSİ | Yüreğir Belediyesi İbrahim Metin Türel Spor Tesisleri Halı Saha,176.98,1
2026-07-04 10:17:00,MASAK raporu,Kara Para / MASAK / Bahis,"Tunç Soyer cezaevinden yazdı: 'MASAK raporu hayatımı akladı, az kaldı kavuşacağız'","Tunç Soyer cezaevinden yazdı: 'MASAK raporu hayatımı akladı, az kaldı kavuşacağız' Ege Postası",https://news.google.com/rss/articles/CBMiuwFBVV95cUxPeGJqbnJGTXZlbnBWYVlPV20ybTRpREFKcVF6MWNHWG0xU1AtdXJVeGtfLUNSWjJnc3RkaVRSZEFwc2xUUmdHazlpUEYzZE5FQXlKdV9SS0wwZWtNQnlHOWs4aEMyS0YtaUQ0RUVwMGJnWXpYQ21JWFktdnhRMk5TbHN3UktLekFHZ18wbUVHV1EyQy1WdzZxVU11SmN5SjRIZEpJOWwzOXAtclRmWXM5SFpVX1dHSHNYNng0?oc=5,masak,,"İzmir Büyükşehir Belediyesi önceki dönem Başkanı Tunç Soyer, cezaevindeki birinci yılında Buca Kırıklar dan mektup gönderdi. MASAK raporuyla tüm hayatının aklandığını belirten Soyer, kızlarıyla paylaştığı fotoğrafa Sezen Aksu nun Gülümse şarkısını ekleyerek, Az kaldı kavuşacağız, kaldığımız yerden aşkla devam edeceğiz mesajını verdi. İzmir Büyükşehir Belediyesi önceki dönem Başkanı Tunç Soyer, cezaevindeki birinci yılında Buca Kırıklar dan mektup gönderdi. MASAK raporuyla tüm hayatının aklandığını belirten Soyer, kızlarıyla paylaştığı fotoğrafa Sezen Aksu nun Gülümse şarkısını ekleyerek, Az kaldı kavuşacağız, kaldığımız yerden aşkla devam edeceğiz mesajını verdi. Anasayfa Güncel Tunç Soyer cezaevinden yazdı: 'MASAK raporu hayatımı akladı, az kaldı kavuşacağız' Tunç Soyer cezaevinden yazdı: 'MASAK raporu hayatımı akladı, az kaldı kavuşacağız' İzmir Büyükşehir Belediyesi önceki dönem Başkanı Tunç Soyer, cezaevindeki birinci yılında Buca Kırıklar'dan mektup gönderdi. MASAK raporuyla tüm hayatının aklandığını belirten Soyer, kızlarıyla paylaştığı fotoğrafa Sezen Aksu'nun ""Gülümse"" şarkısını ekleyerek, ""Az kaldı kavuşacağız, kaldığımız yerden aşkla devam edeceğiz"" mesajını verdi. Ege Postası 04.07.2026 - 13:17 Güncelleme: 04.07.2026 - 13:35 Telegram ile paylaş Google News'te takip et EGE POSTASI - İzmir Büyükşehir Belediyesi önceki dönem Başkanı Tunç Soyer, cezaevinde geçirdiği bir yılın ardından kaleme aldığı yazıyı kamuoyuyla paylaştı. Buca Kırıklar F Tipi Cezaevi’nden seslenen Soyer, “Bedenim içerideydi ama ruhum, zihnim zinde ve özgürdü” ifadelerini kullandı. Soyer, paylaşımında kızlarıyla birlikte yer aldığı fotoğrafa Sezen Aksu’nun hafızalara kazınan “Gülümse” şarkısı eşliğinde yer verdi. Soyer’in paylaşımında kızlarıyla birlikte yer aldığı fotoğrafa Sezen Aksu’nun hafızalara kazınan “Gülümse” şarkısını eklemesi ise mesajına duygusal bir anlam kattı. 4 Temmuz 2025 gecesi cezaevindeki koğuşuna getirildiğini belirten Soyer, geçen bir yıllık sürece ilişkin değerlendirmelerde bulundu. Soyer, bir yıl içinde ülkede çok şeyin değiştiğini ancak kendisinin 16 metrekare kapalı, 40 metrekare açık alanda tutsak kaldığını ifade etti. Soyer, haklı ve masum olmanın kendisine güç verdiğini belirterek, “Haklı ve masum olmanın hakikatini, tel örgüler de demir parmaklıklar da hapsedemiyor, bozamıyor” dedi. “1 YILDIR PİŞTİM, YANDIM, OLDUM” Cezaevinde geçirdiği sürede kendisini daha güçlü hissettiğini dile getiren Soyer, geçmişiyle hesaplaştığını ve gelecek vizyonunu tazelediğini söyledi. Soyer, “1 yıl öncesine göre daha fazla enerji doluyum. Tefekküre zaman bularak, geçmişimle daha objektif hesaplaşarak ve gelecek vizyonumu tazeleyerek daha da güçlendim. Dostu düşmandan ayırmakta ustalaştım. 1 yıldır piştim, yandım, oldum” ifadelerini kullandı. “TEMİZ BİR İSİM EN BÜYÜK MİRASTIR” Siyasi hayatı boyunca dürüst ve temiz siyaset yaptığını vurgulayan Soyer, MASAK raporuna da dikkat çekti. Soyer, “Hayatım boyunca dürüst, namuslu, temiz siyaset yapmanın gururuyla yaşadım. Şimdi artık bunu kanıtlayan, 41 yıl öncesinden başlayarak tüm hayatımı aklayan bir de MASAK raporum var. Bu raporu evlatlarıma bırakacağım. Çünkü bir babanın bırakabileceği en büyük miras temiz bir isimdir herhalde” dedi. “AZ KALDI, KAVUŞACAĞIZ” Cezaevi sürecini bir okul gibi gördüğünü belirten Soyer, dışarı çıktığında inandığı değerler doğrultusunda daha güçlü mücadele edeceğini söyledi. Soyer, “Hücremi ve avlumu bir okul gibi gördüm. Çıktığım zaman, inandığım değerler doğrultusunda daha güçlü bir mücadele verebilmek için bir dakikamı boş geçirmedim. Heyecanımı, umutlarımı biriktirip büyüttüm” ifadelerini kullandı. Soyer, mesajının sonunda ise sevenlerine umut çağrısı yaptı. “Biliyorum, az kaldı, kavuşacağız, kaldığımız yerden aşkla yolumuza devam edeceğiz” diyen Soyer, “Siyasi iklime bakıp asla enseyi karartmayın. Hep birlikte hayal ettiğimiz o güzel memleketi mutlaka kuracağız” ifadelerine yer verdi. Tunç Soyer, yazısını “Hepinizi çok özledim, sevgiyle, saygıyla, hasretle kucaklıyorum. Sağlıcakla kalın” sözleriyle tamamladı. Değerli Dostlar, 4 Temmuz 2025 gecesi Buca Kırıklar F Tipi cezaevindeki koğuşuma getirildim. 1 yıl içinde memlekette çok şey değişti. Bense 1 yıldır 16 m2 kapalı, 40 m2 açık alanda tutsak kaldım. Bedenim içerideydi ama ruhum, zihnim zinde ve özgürdü. Çünkü haklı ve masum olmanın… pic.twitter.com/Hp1k4eLCCo — Tunç Soyer (@tuncsoyer) July 4, 2026 Güncel Karabağlar’daki kadın cinayetinde gerekçeli karar açıklandı Güncel Deniz Göktaş cezaevinde Kılıçdaroğlu'na ‘CHP’yi salın’ dediğini doğruladı Güncel Sıcaktan bitkin düşen ebabil kuşuna yardım eli Güncel İzmirli sektör temsilcisinden ‘aynı gün işe giriş’ talebi Güncel Ankara'daki NATO Zirvesi'nin programı belli oldu Güncel Oyuncu Ece İrtem'in ölümüyle ilgili yeni gelişme: Ön rapor ortaya çıktı Güncel İmamoğlu gündem olan o kareyi paylaştı: 'Bu fotoğrafı görünce içim yandı' Anasayfa Güncel Tunç Soyer cezaevinden yazdı: 'MASAK raporu hayatımı akladı, az kaldı kavuşacağız' Tunç Soyer cezaevinden yazdı: 'MASAK raporu hayatımı akladı, az kaldı kavuşacağız' İzmir Büyükşehir Belediyesi önceki dönem Başkanı Tunç Soyer, cezaevindeki birinci yılında Buca Kırıklar'dan mektup gönderdi. MASAK raporuyla tüm hayatının aklandığını belirten Soyer, kızlarıyla paylaştığı fotoğrafa Sezen Aksu'nun ""Gülümse"" şarkısını ekleyerek, ""Az kaldı kavuşacağız, kaldığımız yerden aşkla devam edeceğiz"" mesajını verdi. Ege Postası 04.07.2026 - 13:17 Güncelleme: 04.07.2026 - 13:35 Telegram ile paylaş Google News'te takip et EGE POSTASI - İzmir Büyükşehir Belediyesi önceki dönem Başkanı Tunç Soyer, cezaevinde geçirdiği bir yılın ardından kaleme aldığı yazıyı kamuoyuyla paylaştı. Buca Kırıklar F Tipi Cezaevi’nden seslenen Soyer, “Bedenim içerideydi ama ruhum, zihnim zinde ve özgürdü” ifadelerini kullandı. Soyer, paylaşımında kızlarıyla birlikte yer aldığı fotoğrafa Sezen Aksu’nun hafızalara kazınan “Gülümse” şarkısı eşliğinde yer verdi. Soyer’in paylaşımında kızlarıyla birlikte yer aldığı fotoğrafa Sezen Aksu’nun hafızalara kazınan “Gülümse” şarkısını eklemesi ise mesajına duygusal bir anlam kattı. 4 Temmuz 2025 gecesi cezaevindeki koğuşuna getirildiğini belirten Soyer, geçen bir yıllık sürece ilişkin değerlendirmelerde bulundu. Soyer, bir yıl içinde ülkede çok şeyin değiştiğini ancak kendisinin 16 metrekare kapalı, 40 metrekare açık alanda tutsak kaldığını ifade etti. Soyer, haklı ve masum olmanın kendisine güç verdiğini belirterek, “Haklı ve masum olmanın hakikatini, tel örgüler de demir parmaklıklar da hapsedemiyor, bozamıyor” dedi. “1 YILDIR PİŞTİM, YANDIM, OLDUM” Cezaevinde geçirdiği sürede kendisini daha güçlü hissettiğini dile getiren Soyer, geçmişiyle hesaplaştığını ve gelecek vizyonunu tazelediğini söyledi. Soyer, “1 yıl öncesine göre daha fazla enerji doluyum. Tefekküre zaman bularak, geçmişimle daha objektif hesaplaşarak ve gelecek vizyonumu tazeleyerek daha da güçlendim. Dostu düşmandan ayırmakta ustalaştım. 1 yıldır piştim, yandım, oldum” ifadelerini kullandı. “TEMİZ BİR İSİM EN BÜYÜK MİRASTIR” Siyasi hayatı boyunca dürüst ve temiz siyaset yaptığını vurgulayan Soyer, MASAK raporuna da dikkat çekti. Soyer, “Hayatım boyunca dürüst, namuslu, temiz siyaset yapmanın gururuyla yaşadım. Şimdi artık bunu kanıtlayan, 41 yıl öncesinden başlayarak tüm hayatımı aklayan bir de MASAK raporum var. Bu raporu evlatlarıma bırakacağım. Çünkü bir babanın bırakabileceği en büyük miras temiz bir isimdir herhalde” dedi. “AZ KALDI, KAVUŞACAĞIZ” Cezaevi sürecini bir okul gibi gördüğünü belirten Soyer, dışarı çıktığında inandığı değerler doğrultusunda daha güçlü mücadele edeceğini söyledi. Soyer, “Hücremi ve avlumu bir okul gibi gördüm. Çıktığım zaman, inandığım değerler doğrultusunda daha güçlü bir mücadele verebilmek için bir dakikamı boş geçirmedim. Heyecanımı, umutlarımı biriktirip büyüttüm” ifadelerini kullandı. Soyer, mesajının sonunda ise sevenlerine umut çağrısı yaptı. “Biliyorum, az kaldı, kavuşacağız, kaldığımız yerden aşkla yolumuza devam edeceğiz” diyen Soyer, “Siyasi iklime bakıp asla enseyi karartmayın. Hep birlikte hayal ettiğimiz o güzel memleketi mutlaka kuracağız” ifadelerine yer verdi. Tunç Soyer, yazısını “Hepinizi çok özledim, sevgiyle, saygıyla, hasretle kucaklıyorum. Sağlıcakla kalın” sözleriyle tamamladı. Değerli Dostlar, 4 Temmuz 2025 gecesi Buca Kırıklar F Tipi cezaevindeki koğuşuma getirildim. 1 yıl içinde memlekette çok şey değişti. Bense 1 yıldır 16 m2 kapalı, 40 m2 açık alanda tutsak kaldım. Bedenim içerideydi ama ruhum, zihnim zinde ve özgürdü. Çünkü haklı ve masum olmanın… pic.twitter.com/Hp1k4eLCCo — Tunç Soyer (@tuncsoyer) July 4, 2026 İlginizi çekebilir Güncel Karabağlar’daki kadın cinayetinde gerekçeli karar açıklandı Güncel Deniz Göktaş cezaevinde Kılıçdaroğlu'na ‘CHP’yi salın’ dediğini doğruladı Güncel Sıcaktan bitkin düşen ebabil kuşuna yardım eli Whatsapp ile paylaş Facebook ile paylaş Twitter ile paylaş Yorum Yap Yorum Yazın Yorumlar Yeniden eskiye","Tunç Soyer cezaevinden yazdı: 'MASAK raporu hayatımı akladı, az kaldı kavuşacağız' Tunç Soyer cezaevinden yazdı: 'MASAK raporu hayatımı akladı, az kaldı kavuşacağız' Ege Postası İzmir Büyükşehir Belediyesi önceki dönem Başkanı Tunç Soyer, cezaevindeki birinci yılında Buca Kırıklar dan mektup gönderdi. MASAK raporuyla tüm hayatının aklandığını belirten Soyer, kızlarıyla paylaştığı fotoğrafa Sezen Aksu nun Gülümse şarkısını ekleyerek, Az kaldı kavuşacağız, kaldığımız yerden aşkla devam edeceğiz mesajını verdi. Anasayfa Güncel Tunç Soyer cezaevinden yazdı: 'MASAK raporu hayatımı akladı, az kaldı kavuşacağız' Tunç Soyer cezaevinden yazdı: 'MASAK raporu hayatımı akladı, az kaldı kavuşacağız' İzmir Büyükşehir Belediyesi önceki dönem Başkanı Tunç Soyer, cezaevindeki birinci yılında Buca Kırıklar'dan mektup gönderdi. Ege Postası 04.07.2026 - 13:17 Güncelleme: 04.07.2026 - 13:35 Telegram ile paylaş Google News'te takip et EGE POSTASI - İzmir Büyükşehir Belediyesi önceki dönem Başkanı Tunç Soyer, cezaevinde geçirdiği bir yılın ardından kaleme aldığı yazıyı kamuoyuyla paylaştı. Buca Kırıklar F Tipi Cezaevi’nden seslenen Soyer, “Bedenim içerideydi ama ruhum, zihnim zinde ve özgürdü” ifadelerini kullandı. Soyer, paylaşımında kızlarıyla birlikte yer aldığı fotoğrafa Sezen Aksu’nun hafızalara kazınan “Gülümse” şarkısı eşliğinde yer verdi. Soyer’in paylaşımında kızlarıyla birlikte yer aldığı fotoğrafa Sezen Aksu’nun hafızalara kazınan “Gülümse” şarkısını eklemesi ise mesajına duygusal bir anlam kattı. 4 Temmuz 2025 gecesi cezaevindeki koğuşuna getirildiğini belirten Soyer, geçen bir yıllık sürece ilişkin değerlendirmelerde bulundu. Soyer, bir yıl içinde ülkede çok şeyin değiştiğini ancak kendisinin 16 metrekare kapalı, 40 metrekare açık alanda tutsak kaldığını ifade etti. Soyer, haklı ve masum olmanın kendisine güç verdiğini belirterek, “Haklı ve masum olmanın hakikatini, tel örgüler de demir parmaklıklar da hapsedemiyor, bozamıyor” dedi. “1 YILDIR PİŞTİM, YANDIM, OLDUM” Cezaevinde geçirdiği sürede kendisini daha güçlü hissettiğini dile getiren Soyer, geçmişiyle hesaplaştığını ve gelecek vizyonunu tazelediğini söyledi. Soyer, “1 yıl öncesine göre daha fazla enerji doluyum. Tefekküre zaman bularak, geçmişimle daha objektif hesaplaşarak ve gelecek vizyonumu tazeleyerek daha da güçlendim. Dostu düşmandan ayırmakta ustalaştım. “TEMİZ BİR İSİM EN BÜYÜK MİRASTIR” Siyasi hayatı boyunca dürüst ve temiz siyaset yaptığını vurgulayan Soyer, MASAK raporuna da dikkat çekti. Soyer, “Hayatım boyunca dürüst, namuslu, temiz siyaset yapmanın gururuyla yaşadım. Şimdi artık bunu kanıtlayan, 41 yıl öncesinden başlayarak tüm hayatımı aklayan bir de MASAK raporum var. Bu raporu evlatlarıma bırakacağım. Çünkü bir babanın bırakabileceği en büyük miras temiz bir isimdir herhalde” dedi. “AZ KALDI, KAVUŞACAĞIZ” Cezaevi sürecini bir okul gibi gördüğünü belirten Soyer, dışarı çıktığında inandığı değerler doğrultusunda daha güçlü mücadele edeceğini söyledi. Soyer, “Hücremi ve avlumu bir okul gibi gördüm. Soyer, mesajının sonunda ise sevenlerine umut çağrısı yaptı. “Biliyorum, az kaldı, kavuşacağız, kaldığımız yerden aşkla yolumuza devam edeceğiz” diyen Soyer, “Siyasi iklime bakıp asla enseyi karartmayın. Tunç Soyer, yazısını “Hepinizi çok özledim, sevgiyle, saygıyla, hasretle kucaklıyorum. Çünkü haklı ve masum olmanın… pic.twitter.com/Hp1k4eLCCo — Tunç Soyer (@tuncsoyer) July 4, 2026 Güncel Karabağlar’daki kadın cinayetinde gerekçeli karar açıklandı Güncel Deniz Göktaş cezaevinde Kılıçdaroğlu'na ‘CHP’yi salın’ dediğini doğruladı Güncel Sıcaktan bitkin düşen ebabil kuşuna yardım eli Güncel İzmirli sektör temsilcisinden ‘aynı gün işe giriş’ talebi Güncel Ankara'daki NATO Zirvesi'nin programı belli oldu Güncel Oyuncu Ece İrtem'in ölümüyle ilgili yeni gelişme: Ön rapor ortaya çıktı Güncel İmamoğlu gündem olan o kareyi paylaştı: 'Bu fotoğrafı görünce içim yandı' Anasayfa Güncel Tunç Soyer cezaevinden yazdı: 'MASAK raporu hayatımı akladı, az kaldı kavuşacağız' Tunç Soyer cezaevinden yazdı: 'MASAK raporu hayatımı akladı, az kaldı kavuşacağız' İzmir Büyükşehir Belediyesi önceki dönem Başkanı Tunç Soyer, cezaevindeki birinci yılında Buca Kırıklar'dan mektup gönderdi.",browser_full_article,https://www.egepostasi.com/haber/Tunc-Soyer-cezaevinden-yazdi-MASAK-raporu-hayatimi-akladi-az-kaldi-kavusacagiz-/393040,Antalya | Isparta,Aksu,,,,,,firma yok | faaliyet/tesis yok,,,,maps araması yapılmadı,,,123.5,2
2026-07-03 16:47:05,depo yangını,Fiziksel Risk / Yangın,Viyana'da Korkutan Yangın: Lojistik Depo Alevlere Teslim Oldu,Viyana'da Korkutan Yangın: Lojistik Depo Alevlere Teslim Oldu HaberGo,https://news.google.com/rss/articles/CBMimAFBVV95cUxOLUlYTWFFOFlHTEh6WHRvT0lpaGtmTzRkbURCV0lfMXNFYTdZLTAtdEFpRFdPMndHWGtHOFlSYXV5OHQ3NGt4OERRbVNUVVllOG1ZUllWRVdGbnFFbUo2bmp3MEpuUjJDZGlOSlNaU2Vrb09iRUF0c3lzc0VYQzN1YmYzWEFUSmJGbkRSLVRLWTBBRnVmV1hUQdIBngFBVV95cUxQazJ6QWJzYm13NWNaT0d0MGxHbHZ0SENsajI5SjRlM0VhcldWZ0pBNnFCTnk2SmYzRGNrcTREN1R5cXlCeFBQZ0l6dHhmam5qamJCLWJpZkZIZkkyanp6cTI3LU9QcEd1cVRSM2NybkJfT0JPS2x1LVZ6UUNIQ3VUM3ItVVhoazhxZ0ZjM2c3WU9IS2xqckgyTHppT1JTUQ?oc=5,"depo, lojistik",depo,"Viyana Donaustadt'ta bir atık deposunda çıkan yangın sonrası A23 otoyolu ve U2 metrosunda ulaşım aksadı. Son durum ve detaylar haberimizde. Viyana Donaustadt'ta bir atık deposunda çıkan yangın sonrası A23 otoyolu ve U2 metrosunda ulaşım aksadı. Son durum ve detaylar haberimizde. Viyana Donaustadt'ta bir atık deposunda çıkan yangın sonrası A23 otoyolu ve U2 metrosunda ulaşım aksadı. Son durum ve detaylar haberimizde. Dünya Viyana'da Korkutan Yangın: Lojistik Depo Alevlere Teslim Oldu Avusturya'nın başkenti Viyana'da bir atık depolama tesisinde çıkan yangın nedeniyle ulaşım felç oldu, Stadlau tüneli trafiğe kapatıldı. HM Haber Merkezi","Viyana'da Korkutan Yangın: Lojistik Depo Alevlere Teslim Oldu Viyana'da Korkutan Yangın: Lojistik Depo Alevlere Teslim Oldu HaberGo Viyana Donaustadt'ta bir atık deposunda çıkan yangın sonrası A23 otoyolu ve U2 metrosunda ulaşım aksadı. Dünya Viyana'da Korkutan Yangın: Lojistik Depo Alevlere Teslim Oldu Avusturya'nın başkenti Viyana'da bir atık depolama tesisinde çıkan yangın nedeniyle ulaşım felç oldu, Stadlau tüneli trafiğe kapatıldı.",browser_full_article,https://www.habergo.com.tr/haber/viyana-da-korkutan-yangin-lojistik-depo-alevlere-teslim-oldu,,,,,,,,il yok | ilçe yok | firma yok | faaliyet/tesis yok,,,,maps araması yapılmadı,,,62.15,3
