published,search_term,category,title,summary,link,matched_words,activity_type,raw_text,entity_source_text,article_fetch_status,resolved_article_url,city_candidates,district_candidates,neighborhood_candidates,street_candidates,facility_candidates,company_candidates,company_candidate_scores,entity_quality_note,maps_queries,maps_candidates,maps_best_guess,maps_status,maps_match_scores,maps_rejected_candidates,record_quality_score,duplicate_group_id
2026-06-30 10:00:02,üretim tesisi yangını,Fiziksel Risk / Yangın,Sanayi yangınlarında patlama yaşanıyor,Sanayi yangınlarında patlama yaşanıyor Kadırga TV,https://news.google.com/rss/articles/CBMihAFBVV95cUxOa2Q2VmV4c3VqdTJUbnNsak00QjlORldLdy1Pd1dOSVlMSG1XQmtvcWlWY1pLWTdWNmpyS1FWbW1WOWpvN1oxVlJKQnowUkFDOEF3ZDZJZF9sczRyOUhfUlBCd2xFd1VQNmNvMjRudElPWVlud0dFekF5RW5leFdsc3FiN2Y?oc=5,sanayi,,"2025 yılında İstanbul’da 323, Kocaeli’nde 100 sanayi yangını yaşanırken, ülke genelinde bu sayı yılın tamamında atölyelerle birlikte 3 bini aştı. Temmuz ve Ağustos aylarında artan kavurucu sıcaklar ile tatil dönemi kaynaklı personel eksikliği, fabrikaları daha da açık hedef haline getiriyor. 2025 yılında İstanbul’da 323, Kocaeli’nde 100 sanayi yangını yaşanırken, ülke genelinde bu sayı yılın tamamında atölyelerle birlikte 3 bini aştı. Temmuz ve Ağustos aylarında artan kavurucu sıcaklar ile tatil dönemi kaynaklı personel eksikliği, fabrikaları daha da açık hedef haline getiriyor. Sanayi yangınlarında patlama yaşanıyor 2025 yılında İstanbul'da 323, Kocaeli'nde 100 sanayi yangını yaşanırken, ülke genelinde bu sayı yılın tamamında atölyelerle birlikte 3 bini aştı. Temmuz ve Ağustos aylarında artan kavurucu sıcaklar ile tatil dönemi kaynaklı personel eksikliği, fabrikaları daha da açık hedef haline getiriyor. 30.06.2026 08:05 Sanayi yangınlarında patlama yaşanıyor","Sanayi yangınlarında patlama yaşanıyor Sanayi yangınlarında patlama yaşanıyor Kadırga TV 2025 yılında İstanbul’da 323, Kocaeli’nde 100 sanayi yangını yaşanırken, ülke genelinde bu sayı yılın tamamında atölyelerle birlikte 3 bini aştı. Temmuz ve Ağustos aylarında artan kavurucu sıcaklar ile tatil dönemi kaynaklı personel eksikliği, fabrikaları daha da açık hedef haline getiriyor. Sanayi yangınlarında patlama yaşanıyor 2025 yılında İstanbul'da 323, Kocaeli'nde 100 sanayi yangını yaşanırken, ülke genelinde bu sayı yılın tamamında atölyelerle birlikte 3 bini aştı. 30.06.2026 08:05 Sanayi yangınlarında patlama yaşanıyor",browser_full_article,https://www.kadirga.com.tr/sanayi-yanginlarinda-patlama-yasaniyor-H1909415.htm,İstanbul,,,,,,,ilçe yok | firma yok | faaliyet/tesis yok,,,,maps araması yapılmadı,,,58.98,1
2026-06-30 10:54:00,MASAK,Kara Para / MASAK / Bahis,MASAK raporları ortaya çıkardı: 561 milyon doların izi 10 ülkeye uzandı,MASAK raporları ortaya çıkardı: 561 milyon doların izi 10 ülkeye uzandı AKŞAM,https://news.google.com/rss/articles/CBMitwFBVV95cUxNWHVNOXdIX1NTMG5NLTg1MEF1bkd2cXY1VlpnbUg1YUdEVkNGVlFhRXZjdDc3Z0ZCOGE2Ym1NeklaMlUyYU5JV2VjLVBFMzZFaEptUEhYQlpLV0NFZXo0OUx3R1hCbmtDdVFWWTF0V3BVeGVzMHZKTmViam9jOEZtdmgxRkhGRWoxaHItN0NVRUZOeWkxaG5uWkROU25hNlUyeHZQMW5JMktHdHVnbFdsYVVVZEYwenfSAboBQVVfeXFMTnZiYW1Wd2NmdVU5Y05jRzVpRmFjZEFmdTZZQ2pGV3lrejVGUWZZZm95Ni02a3J0c1dkb1ZDZWJiOFpxYzZFQ2JVamtTNThwN3RoTGFlWUczdFpFWjJjVElvWnBkcVNGWmdIeWlrTl8teUNNb0IyZDIybWIzaFBKcWtiemc3aE1VbkxOWlFMQTM5T094d2h3em1xSTRTdTRsbUYyTXV0WmRzcFNha1JhZHV1VTJseEwzTW53?oc=5,masak,,"Haberin detayları için tıklayınız İstanbul merkezli 9 ilde yasa dışı bahis ve kara para operasyonuna ilişkin yeni detaylar ortaya çıktı. MASAK raporlarıyla derinleştirilen soruşturmada, 37 paravan şirket üzerinden 10 ülkeye 561 milyon doların üzerinde para kaçırıldığı ve şüpheli işlem hacminin 30 milyar liraya ulaştığı belirlendi. Haberin detayları için tıklayınız Edinilen bilgiye göre, İstanbul Cumhuriyet Başsavcılığınca yürütülen yasa dışı bahis üzerinden kara para soruşturmasında çok sayıda şüpheli hakkında gözaltı kararı verilmiş, İstanbul Emniyet Müdürlüğü Mali Suçlarla Mücadele Şube Müdürlüğü ekipleri tarafından İstanbul, Ankara, Gaziantep, Hatay, İzmir, Kilis, Kırklareli, Kocaeli ve Tokat'ta düzenlenen eş zamanlı operasyonda 37 şüpheli yakalanmıştı. Mali Suçları Araştırma Kurulu (MASAK) tarafından hazırlanan mali analiz raporları doğrultusunda büyük çaplı vurgunun ortaya çıkarıldığı soruşturmada çarpıcı ayrıntılara ulaşıldı. Paravan döviz şirketleri ile finansal ağların yer aldığı suç ağının, özellikle kara para aklama, yasa dışı altın ticareti, gümrük kaçakçılığı ve hayali ticaret operasyonlarında aktif rol oynadığı tespit edildi. Yurtdışına bankacılık sistemi dışından nakit para giriş-çıkışındaki trafiği kuryeler üzerinden organize ettikleri adli raporlara yansıyan örgütün, mali denetimlerin delinmesi ve rüşvet çarkının dönmesinde de yer aldıkları anlaşıldı. PARANIN İZİNİ YURTDIŞINDA KAYBETTİRMEYE ÇALIŞTILAR Banka hareketleri ile teknik ve fiziki takip çalışmaları sonucunda elde edilen bulgular doğrultusunda, yasa dışı bahis ve kumar faaliyetlerinden elde edildiği değerlendirilen suç gelirlerinin finansal sisteme sokulması, aklanması ve yurt dışına aktarılmasına yönelik organize bir faaliyet ağının bulunduğunu tespit eden emniyet ekipleri, suç örgütü tarafından Türkiye'de kurulan 37 ayrı paravan şirket üzerinden Kuzey Kıbrıs Türk Cumhuriyeti (KKTC), Almanya, Çekya, Gürcistan, Birleşik krallık, İrlanda, İsveç, Litvanya, Malta ve Polonya gibi 10 farklı ülkeye toplam 561 milyon dolarlık para kaçırıldığı tespit edildi. Kara para soruşturmasının merkezindeki suç ağının, elde edilen illegal paranın izini kaybettirmek için bu yolu tercih ettikleri, bu kapsamda, birbirleriyle yoğun ve organize şekilde para transferi gerçekleştirdikleri ve vurgundaki geliri yurt dışına kaçırdıkları belirlendi. POLİS, MUHATAP ÜLKELERLE TEMASA GEÇEREK İZ SÜRDÜ Gerçekleştirilen mali analizlerde, söz konusu şirketlerin işlem hacminin yaklaşık 30 milyar liraya ulaştığı aktarılan soruşturmada, bu işlem hacminin incelenen kişi ve şirketlerin beyan edilen ticari faaliyetleriyle uyumlu olmadığı görülünce adı geçen ülkelerle temasa geçildi. Türk makamları ile paranın kaçırıldığı ülkelerdeki mahkemeler arası adli yardımlaşma (adli istinabe) gerçekleştirildi. O ülkelerin adli ve kolluk birimleri ile kurulan temas ve yazışma rapora dönüştü. Bazı ülkelerden gelen cevabi yazılarda; transfere konu paraların kaynağının son derece şüpheli olduğu, uyuşturucu ticareti, silah ticareti, terörizm, fuhuş, altın kaçakçılığı suçları kaynaklı olabileceği, hiçbir mal ve hizmet faaliyeti karşılığı olmayan para transferleri gerçekleştirildiği istihbaratına ulaşıldı. ÜLKELER ARASI MAHKEMELERİN ADLİ YAZIŞMA VE YARDIMLAŞMASI SAĞLANDI Mali Şube Polisi tarafından uzun süre devam eden teknik ve fiziki takibin ardından MASAK raporları, banka kayıtları, dijital incelemeler, iletişim kayıtları, ifade içerikleri ve diğer deliller doğrultusunda, soruşturmaya konu faaliyetlerle bağlantılı oldukları belirlenen şirketlere yönelik inceleme derinleştirildi. Kapsamlı çalışmalarda, söz konusu firmaların kuruluşundan itibaren kısa süre içerisinde çok yüksek hacme ulaştığı, döviz bürosuna havale gönderen gerçek ve tüzel kişilerin faaliyet göstermediği, döviz bürosuna gelen meblağların normal bir döviz bürosunun faaliyetlerine benzerlik göstermediği tespit edildi. 37 ZANLININ İFADELERİ ALINIYOR Öte yandan bu sabah İstanbul, Ankara, Gaziantep, Hatay, İzmir, Kilis, Kırklareli, Kocaeli ve Tokat'ta düzenlenen eş zamanlı operasyonda yakalanan 37 şüphelinin emniyetteki sorguları sürüyor. Suçtan elde edildiği anlaşılan malvarlığı değerlerine yönelik adli tedbir uygulanarak 19 konut, 9 arsa, 1 iş yeri, 31 motorlu araç ile 32 şirkete el koyma işleminin ise sonuçlandığı öğrenildi. MASAK raporları ortaya çıkardı: 561 milyon doların izi 10 ülkeye uzandı İstanbul merkezli 9 ilde yasa dışı bahis ve kara para operasyonuna ilişkin yeni detaylar ortaya çıktı. MASAK raporlarıyla derinleştirilen soruşturmada, 37 paravan şirket üzerinden 10 ülkeye 561 milyon doların üzerinde para kaçırıldığı ve şüpheli işlem hacminin 30 milyar liraya ulaştığı belirlendi. Edinilen bilgiye göre, İstanbul Cumhuriyet Başsavcılığınca yürütülen yasa dışı bahis üzerinden kara para soruşturmasında çok sayıda şüpheli hakkında gözaltı kararı verilmiş, İstanbul Emniyet Müdürlüğü Mali Suçlarla Mücadele Şube Müdürlüğü ekipleri tarafından İstanbul, Ankara, Gaziantep, Hatay, İzmir, Kilis, Kırklareli, Kocaeli ve Tokat'ta düzenlenen eş zamanlı operasyonda 37 şüpheli yakalanmıştı. Mali Suçları Araştırma Kurulu (MASAK) tarafından hazırlanan mali analiz raporları doğrultusunda büyük çaplı vurgunun ortaya çıkarıldığı soruşturmada çarpıcı ayrıntılara ulaşıldı. Paravan döviz şirketleri ile finansal ağların yer aldığı suç ağının, özellikle kara para aklama, yasa dışı altın ticareti, gümrük kaçakçılığı ve hayali ticaret operasyonlarında aktif rol oynadığı tespit edildi. Yurtdışına bankacılık sistemi dışından nakit para giriş-çıkışındaki trafiği kuryeler üzerinden organize ettikleri adli raporlara yansıyan örgütün, mali denetimlerin delinmesi ve rüşvet çarkının dönmesinde de yer aldıkları anlaşıldı. PARANIN İZİNİ YURTDIŞINDA KAYBETTİRMEYE ÇALIŞTILAR Banka hareketleri ile teknik ve fiziki takip çalışmaları sonucunda elde edilen bulgular doğrultusunda, yasa dışı bahis ve kumar faaliyetlerinden elde edildiği değerlendirilen suç gelirlerinin finansal sisteme sokulması, aklanması ve yurt dışına aktarılmasına yönelik organize bir faaliyet ağının bulunduğunu tespit eden emniyet ekipleri, suç örgütü tarafından Türkiye'de kurulan 37 ayrı paravan şirket üzerinden Kuzey Kıbrıs Türk Cumhuriyeti (KKTC), Almanya, Çekya, Gürcistan, Birleşik krallık, İrlanda, İsveç, Litvanya, Malta ve Polonya gibi 10 farklı ülkeye toplam 561 milyon dolarlık para kaçırıldığı tespit edildi. Kara para soruşturmasının merkezindeki suç ağının, elde edilen illegal paranın izini kaybettirmek için bu yolu tercih ettikleri, bu kapsamda, birbirleriyle yoğun ve organize şekilde para transferi gerçekleştirdikleri ve vurgundaki geliri yurt dışına kaçırdıkları belirlendi. POLİS, MUHATAP ÜLKELERLE TEMASA GEÇEREK İZ SÜRDÜ Gerçekleştirilen mali analizlerde, söz konusu şirketlerin işlem hacminin yaklaşık 30 milyar liraya ulaştığı aktarılan soruşturmada, bu işlem hacminin incelenen kişi ve şirketlerin beyan edilen ticari faaliyetleriyle uyumlu olmadığı görülünce adı geçen ülkelerle temasa geçildi. Türk makamları ile paranın kaçırıldığı ülkelerdeki mahkemeler arası adli yardımlaşma (adli istinabe) gerçekleştirildi. O ülkelerin adli ve kolluk birimleri ile kurulan temas ve yazışma rapora dönüştü. Bazı ülkelerden gelen cevabi yazılarda; transfere konu paraların kaynağının son derece şüpheli olduğu, uyuşturucu ticareti, silah ticareti, terörizm, fuhuş, altın kaçakçılığı suçları kaynaklı olabileceği, hiçbir mal ve hizmet faaliyeti karşılığı olmayan para transferleri gerçekleştirildiği istihbaratına ulaşıldı. ÜLKELER ARASI MAHKEMELERİN ADLİ YAZIŞMA VE YARDIMLAŞMASI SAĞLANDI Mali Şube Polisi tarafından uzun süre devam eden teknik ve fiziki takibin ardından MASAK raporları, banka kayıtları, dijital incelemeler, iletişim kayıtları, ifade içerikleri ve diğer deliller doğrultusunda, soruşturmaya konu faaliyetlerle bağlantılı oldukları belirlenen şirketlere yönelik inceleme derinleştirildi. Kapsamlı çalışmalarda, söz konusu firmaların kuruluşundan itibaren kısa süre içerisinde çok yüksek hacme ulaştığı, döviz bürosuna havale gönderen gerçek ve tüzel kişilerin faaliyet göstermediği, döviz bürosuna gelen meblağların normal bir döviz bürosunun faaliyetlerine benzerlik göstermediği tespit edildi. 37 ZANLININ İFADELERİ ALINIYOR Öte yandan bu sabah İstanbul, Ankara, Gaziantep, Hatay, İzmir, Kilis, Kırklareli, Kocaeli ve Tokat'ta düzenlenen eş zamanlı operasyonda yakalanan 37 şüphelinin emniyetteki sorguları sürüyor. Suçtan elde edildiği anlaşılan malvarlığı değerlerine yönelik adli tedbir uygulanarak 19 konut, 9 arsa, 1 iş yeri, 31 motorlu araç ile 32 şirkete el koyma işleminin ise sonuçlandığı öğrenildi.","MASAK raporları ortaya çıkardı: 561 milyon doların izi 10 ülkeye uzandı MASAK raporları ortaya çıkardı: 561 milyon doların izi 10 ülkeye uzandı AKŞAM Haberin detayları için tıklayınız İstanbul merkezli 9 ilde yasa dışı bahis ve kara para operasyonuna ilişkin yeni detaylar ortaya çıktı. MASAK raporlarıyla derinleştirilen soruşturmada, 37 paravan şirket üzerinden 10 ülkeye 561 milyon doların üzerinde para kaçırıldığı ve şüpheli işlem hacminin 30 milyar liraya ulaştığı belirlendi. Haberin detayları için tıklayınız Edinilen bilgiye göre, İstanbul Cumhuriyet Başsavcılığınca yürütülen yasa dışı bahis üzerinden kara para soruşturmasında çok sayıda şüpheli hakkında gözaltı kararı verilmiş, İstanbul Emniyet Müdürlüğü Mali Suçlarla Mücadele Şube Müdürlüğü ekipleri tarafından İstanbul, Ankara, Gaziantep, Hatay, İzmir, Kilis, Kırklareli, Kocaeli ve Tokat'ta düzenlenen eş zamanlı operasyonda 37 şüpheli yakalanmıştı. Mali Suçları Araştırma Kurulu (MASAK) tarafından hazırlanan mali analiz raporları doğrultusunda büyük çaplı vurgunun ortaya çıkarıldığı soruşturmada çarpıcı ayrıntılara ulaşıldı. Paravan döviz şirketleri ile finansal ağların yer aldığı suç ağının, özellikle kara para aklama, yasa dışı altın ticareti, gümrük kaçakçılığı ve hayali ticaret operasyonlarında aktif rol oynadığı tespit edildi. Yurtdışına bankacılık sistemi dışından nakit para giriş-çıkışındaki trafiği kuryeler üzerinden organize ettikleri adli raporlara yansıyan örgütün, mali denetimlerin delinmesi ve rüşvet çarkının dönmesinde de yer aldıkları anlaşıldı. PARANIN İZİNİ YURTDIŞINDA KAYBETTİRMEYE ÇALIŞTILAR Banka hareketleri ile teknik ve fiziki takip çalışmaları sonucunda elde edilen bulgular doğrultusunda, yasa dışı bahis ve kumar faaliyetlerinden elde edildiği değerlendirilen suç gelirlerinin finansal sisteme sokulması, aklanması ve yurt dışına aktarılmasına yönelik organize bir faaliyet ağının bulunduğunu tespit eden emniyet ekipleri, suç örgütü tarafından Türkiye'de kurulan 37 ayrı paravan şirket üzerinden Kuzey Kıbrıs Türk Cumhuriyeti (KKTC), Almanya, Çekya, Gürcistan, Birleşik krallık, İrlanda, İsveç, Litvanya, Malta ve Polonya gibi 10 farklı ülkeye toplam 561 milyon dolarlık para kaçırıldığı tespit edildi. Kara para soruşturmasının merkezindeki suç ağının, elde edilen illegal paranın izini kaybettirmek için bu yolu tercih ettikleri, bu kapsamda, birbirleriyle yoğun ve organize şekilde para transferi gerçekleştirdikleri ve vurgundaki geliri yurt dışına kaçırdıkları belirlendi. POLİS, MUHATAP ÜLKELERLE TEMASA GEÇEREK İZ SÜRDÜ Gerçekleştirilen mali analizlerde, söz konusu şirketlerin işlem hacminin yaklaşık 30 milyar liraya ulaştığı aktarılan soruşturmada, bu işlem hacminin incelenen kişi ve şirketlerin beyan edilen ticari faaliyetleriyle uyumlu olmadığı görülünce adı geçen ülkelerle temasa geçildi. Türk makamları ile paranın kaçırıldığı ülkelerdeki mahkemeler arası adli yardımlaşma (adli istinabe) gerçekleştirildi. O ülkelerin adli ve kolluk birimleri ile kurulan temas ve yazışma rapora dönüştü. Bazı ülkelerden gelen cevabi yazılarda; transfere konu paraların kaynağının son derece şüpheli olduğu, uyuşturucu ticareti, silah ticareti, terörizm, fuhuş, altın kaçakçılığı suçları kaynaklı olabileceği, hiçbir mal ve hizmet faaliyeti karşılığı olmayan para transferleri gerçekleştirildiği istihbaratına ulaşıldı. ÜLKELER ARASI MAHKEMELERİN ADLİ YAZIŞMA VE YARDIMLAŞMASI SAĞLANDI Mali Şube Polisi tarafından uzun süre devam eden teknik ve fiziki takibin ardından MASAK raporları, banka kayıtları, dijital incelemeler, iletişim kayıtları, ifade içerikleri ve diğer deliller doğrultusunda, soruşturmaya konu faaliyetlerle bağlantılı oldukları belirlenen şirketlere yönelik inceleme derinleştirildi. Kapsamlı çalışmalarda, söz konusu firmaların kuruluşundan itibaren kısa süre içerisinde çok yüksek hacme ulaştığı, döviz bürosuna havale gönderen gerçek ve tüzel kişilerin faaliyet göstermediği, döviz bürosuna gelen meblağların normal bir döviz bürosunun faaliyetlerine benzerlik göstermediği tespit edildi. 37 ZANLININ İFADELERİ ALINIYOR Öte yandan bu sabah İstanbul, Ankara, Gaziantep, Hatay, İzmir, Kilis, Kırklareli, Kocaeli ve Tokat'ta düzenlenen eş zamanlı operasyonda yakalanan 37 şüphelinin emniyetteki sorguları sürüyor. Suçtan elde edildiği anlaşılan malvarlığı değerlerine yönelik adli tedbir uygulanarak 19 konut, 9 arsa, 1 iş yeri, 31 motorlu araç ile 32 şirkete el koyma işleminin ise sonuçlandığı öğrenildi. MASAK raporları ortaya çıkardı: 561 milyon doların izi 10 ülkeye uzandı İstanbul merkezli 9 ilde yasa dışı bahis ve kara para operasyonuna ilişkin yeni detaylar ortaya çıktı. Edinilen bilgiye göre, İstanbul Cumhuriyet Başsavcılığınca yürütülen yasa dışı bahis üzerinden kara para soruşturmasında çok sayıda şüpheli hakkında gözaltı kararı verilmiş, İstanbul Emniyet Müdürlüğü Mali Suçlarla Mücadele Şube Müdürlüğü ekipleri tarafından İstanbul, Ankara, Gaziantep, Hatay, İzmir, Kilis, Kırklareli, Kocaeli ve Tokat'ta düzenlenen eş zamanlı operasyonda 37 şüpheli yakalanmıştı.",browser_full_article,https://www.aksam.com.tr/guncel/masak-raporlari-ortaya-cikardi-561-milyon-dolarin-izi-10-ulkeye-uzandi/haber-1678983,İstanbul | Tokat,,,,,,,ilçe yok | firma yok | faaliyet/tesis yok,,,,maps araması yapılmadı,,,87.75,2
