published,search_term,category,title,summary,link,matched_words,activity_type,raw_text,entity_source_text,article_fetch_status,resolved_article_url,city_candidates,district_candidates,neighborhood_candidates,street_candidates,facility_candidates,company_candidates,company_candidate_scores,entity_quality_note,maps_queries,maps_candidates,maps_best_guess,maps_status,maps_match_scores,maps_rejected_candidates,record_quality_score,duplicate_group_id
2026-07-17 14:09:38,üretim tesisi yangını,Fiziksel Risk / Yangın,Eskişehir OSB’de Fabrika Yangını: İncelemeler Başladı,Eskişehir OSB’de Fabrika Yangını: İncelemeler Başladı bolgegundemi.com,https://news.google.com/rss/articles/CBMiowFBVV95cUxQRUxJWGNVMWR0c1JITzNlZFVVenhaZ181XzczNmhENUFjcjQtSjBkRFp4QVBSakZLWmxYdHE2eGRGMnJJdzVQSldTRjhpTkl3eE1oMGFxLW9QdjZsenRKNUZRQzZKdmNjYXdheXlPUzZjMmpiVUp2SllOV3otTjRNSlZVTEZvbUN2R1NQbUQ2MV9kdTJyWERvN0RSN0ZhVHRVTDl3?oc=5,"fabrika, osb",fabrika,15:15 Eskişehir OSB’de Fabrika Yangını: İncelemeler Başladı 15:12 Kayseri İncesu’nun İş Dünyasındaki Yükselen Gücü 15:05 Genel Cerrahi Uzmanı Orhan Gözeneli Vefat Etti 15:02 2026 Dünya Kupası Şampiyonuna 130 Bin Euroluk Yüzük 14:54 Erciyes Üniversitesi 39. Dönem Mezunlarını Verdi,Eskişehir OSB’de Fabrika Yangını: İncelemeler Başladı Eskişehir OSB’de Fabrika Yangını: İncelemeler Başladı bolgegundemi.com 15:15 Eskişehir OSB’de Fabrika Yangını: İncelemeler Başladı 15:12 Kayseri İncesu’nun İş Dünyasındaki Yükselen Gücü 15:05 Genel Cerrahi Uzmanı Orhan Gözeneli Vefat Etti 15:02 2026 Dünya Kupası Şampiyonuna 130 Bin Euroluk Yüzük 14:54 Erciyes Üniversitesi 39.,browser_full_article_dom,https://news.google.com/rss/articles/CBMiowFBVV95cUxQRUxJWGNVMWR0c1JITzNlZFVVenhaZ181XzczNmhENUFjcjQtSjBkRFp4QVBSakZLWmxYdHE2eGRGMnJJdzVQSldTRjhpTkl3eE1oMGFxLW9QdjZsenRKNUZRQzZKdmNjYXdheXlPUzZjMmpiVUp2SllOV3otTjRNSlZVTEZvbUN2R1NQbUQ2MV9kdTJyWERvN0RSN0ZhVHRVTDl3?oc=5&hl=tr&gl=TR&ceid=TR:tr,Eskişehir | Kayseri,İncesu,Eskişehir OSB | İncelemeler Başladı Eskişehir OSB | 15 Eskişehir OSB,,,,,firma yok | faaliyet/tesis yok,,,,maps araması yapılmadı,,,104.8,1
2026-07-17 09:37:00,üretim tesisi yangını,Fiziksel Risk / Yangın,Kuveyt'te İran Saldırısında Su Arıtma Tesisinde Yangın Çıktı,Kuveyt'te İran Saldırısında Su Arıtma Tesisinde Yangın Çıktı Mersin Haber,https://news.google.com/rss/articles/CBMiogFBVV95cUxOdUpPTXY2UHpMa2Npbi1tQWxad21BWUhOVlBGTkdEMVl5QjdNZzlwU2xueWFHVnV4X2hZVE9pazkzaVVPUHp5SzFOcEd5XzFGVjNQWFRPMEJINnpGemJFekdMQVRDQVJjdDNMVG93eC1fZUtnMnZsQmx3Xzg4MHBiS1hwNVBvN0dhNmQxU2dGSF9XMUR0SnJaUFRkRXdmMUdPelHSAVdBVV95cUxQWDNHY0FNNVpxZ0tKeTlab1hEZHhfQTRseGY4alRaWDNseXJzSzBZSE5NMGJ4Qklnb0pSb19NUGVRTGpXalVCSWpXdy1PdWw2OHVUZFdZZ3c?oc=5,tesis,,"Kuveyt'te meydana gelen İran saldırısında su arıtma tesisi hasar gördü ve yangın çıktı. Olay sonrası ekipler yangını kontrol altına aldı ve onarım çalışmalarına başladı. Facebook X WhatsApp 17 Temmuz 2026 12:37 Kuveyt'te, İran'ın ABD'ye yönelik saldırılarına misilleme olarak düzenlediği saldırıda, elektrik üretim ve su arıtma tesisi hedef alındı. Saldırı sonucunda tesisin bir kısmında yangın çıktı. Kuveyt Elektrik, Su ve Yenilenebilir Enerji Bakanlığı, saldırının etkilerini doğruladı ve yangının hemen kontrol altına alındığını duyurdu. Bakanlık, olay sonrası ekiplerin hızlı bir şekilde yangını söndürdüğünü ve hasar gören alanlarda onarım çalışmalarının sürdüğünü belirtti. Saldırının ardından tesisin yeniden faaliyete geçmesi için ekiplerin yoğun çaba sarf ettiği ifade edildi. Olayın ardından, Kuveyt yönetimi, halkın su ve enerji ihtiyaçlarının karşılanması için gerekli önlemleri alacaklarını açıkladı. Ayrıca, saldırının neden olduğu hasarın boyutlarıyla ilgili detaylı bir inceleme başlatıldığı bildirildi. İstanbul'da Başlayacak Anadolu Dostluk Rallisi, 11 Şehri Kapsayacak Ankara'da Bakan Ersoy, Türkiye Uluslararası İslam, Bilim ve Teknoloji Üniversitesi'ni Ziyaret Etti Kaynak: Mersin Haber + IHA İlgili Haberler Facebook X WhatsApp Son Eklenen Haberler 09:58 Aynı sokakta peş peşe kazalar kamerada 09:59 Hasköy’de yüzyıllık mezarlıklara defineci tahribatı 09:59 Bursa Platformu’ndan ‘Kent Anayasası’ çağrısı: ""Daha fazla beklememeli"" 09:56 Adalet Bakanı Gürlek'ten Cinayet Açıklaması 09:56 Yüksekova'da Tarım Denetimleri Gerçekleştirildi 09:57 Mersin'de Otluk Yangını Kontrol Altına Alındı 09:57 Ankara'da Yazıcıoğlu Dosyasında Yeni Gelişmeler 09:57 Şemdinli'de Genç Ölü Bulundu 09:54 Samsun'da Motosiklet Kazası Görüntülendi 09:52 Elazığ'da Yüzme Başarısı 09:52 Avcılar'da Scooter Hırsızlığı Kamerada 09:52 Tunceli'de Diyaliz Ünitesi Açıldı 09:53 Kuveyt'te İran Saldırısında Su Arıtma Tesisinde Yangın Çıktı Haber Merkezi • 17 Temmuz 2026 12:37 • Güncellendi: 17 Temmuz 2026 12:40 Kuveyt'te meydana gelen İran saldırısında su arıtma tesisi hasar gördü ve yangın çıktı. Olay sonrası ekipler yangını kontrol altına aldı ve onarım çalışmalarına başladı. Anasayfa Haberler Kategoriler Asayiş Kuveyt'te Su Arıtma Tesisi Hasar Gördü Kuveyt'te meydana gelen İran saldırısında su arıtma tesisi hasar gördü ve yangın çıktı. Olay sonrası ekipler yangını kontrol altına aldı ve onarım çalışmalarına başladı. Facebook X WhatsApp 17 Temmuz 2026 12:37 Kuveyt'te, İran'ın ABD'ye yönelik saldırılarına misilleme olarak düzenlediği saldırıda, elektrik üretim ve su arıtma tesisi hedef alındı. Saldırı sonucunda tesisin bir kısmında yangın çıktı. Kuveyt Elektrik, Su ve Yenilenebilir Enerji Bakanlığı, saldırının etkilerini doğruladı ve yangının hemen kontrol altına alındığını duyurdu. Bakanlık, olay sonrası ekiplerin hızlı bir şekilde yangını söndürdüğünü ve hasar gören alanlarda onarım çalışmalarının sürdüğünü belirtti. Saldırının ardından tesisin yeniden faaliyete geçmesi için ekiplerin yoğun çaba sarf ettiği ifade edildi. Olayın ardından, Kuveyt yönetimi, halkın su ve enerji ihtiyaçlarının karşılanması için gerekli önlemleri alacaklarını açıkladı. Ayrıca, saldırının neden olduğu hasarın boyutlarıyla ilgili detaylı bir inceleme başlatıldığı bildirildi. İstanbul'da Başlayacak Anadolu Dostluk Rallisi, 11 Şehri Kapsayacak Ankara'da Bakan Ersoy, Türkiye Uluslararası İslam, Bilim ve Teknoloji Üniversitesi'ni Ziyaret Etti Kaynak: Mersin Haber + IHA İlgili Haberler Facebook X WhatsApp Son Eklenen Haberler 09:58 Aynı sokakta peş peşe kazalar kamerada 09:59 Hasköy’de yüzyıllık mezarlıklara defineci tahribatı 09:59 Bursa Platformu’ndan ‘Kent Anayasası’ çağrısı: ""Daha fazla beklememeli"" 09:56 Adalet Bakanı Gürlek'ten Cinayet Açıklaması 09:56 Yüksekova'da Tarım Denetimleri Gerçekleştirildi 09:57 Mersin'de Otluk Yangını Kontrol Altına Alındı 09:57 Ankara'da Yazıcıoğlu Dosyasında Yeni Gelişmeler 09:57 Şemdinli'de Genç Ölü Bulundu 09:54 Samsun'da Motosiklet Kazası Görüntülendi 09:52 Elazığ'da Yüzme Başarısı 09:52 Avcılar'da Scooter Hırsızlığı Kamerada 09:52 Tunceli'de Diyaliz Ünitesi Açıldı 09:53 Kuveyt'te, İran'ın ABD'ye yönelik saldırılarına misilleme olarak düzenlediği saldırıda, elektrik üretim ve su arıtma tesisi hedef alındı. Saldırı sonucunda tesisin bir kısmında yangın çıktı. Kuveyt Elektrik, Su ve Yenilenebilir Enerji Bakanlığı, saldırının etkilerini doğruladı ve yangının hemen kontrol altına alındığını duyurdu. Bakanlık, olay sonrası ekiplerin hızlı bir şekilde yangını söndürdüğünü ve hasar gören alanlarda onarım çalışmalarının sürdüğünü belirtti. Saldırının ardından tesisin yeniden faaliyete geçmesi için ekiplerin yoğun çaba sarf ettiği ifade edildi. Olayın ardından, Kuveyt yönetimi, halkın su ve enerji ihtiyaçlarının karşılanması için gerekli önlemleri alacaklarını açıkladı. Ayrıca, saldırının neden olduğu hasarın boyutlarıyla ilgili detaylı bir inceleme başlatıldığı bildirildi. Kuveyt'te İran Saldırısında Su Arıtma Tesisinde Yangın Çıktı Haber Merkezi • 17 Temmuz 2026 12:37 • Güncellendi: 17 Temmuz 2026 12:40 Kuveyt'te meydana gelen İran saldırısında su arıtma tesisi hasar gördü ve yangın çıktı. Olay sonrası ekipler yangını kontrol altına aldı ve onarım çalışmalarına başladı. Haber Merkezi • 17 Temmuz 2026 12:37 • Güncellendi: 17 Temmuz 2026 12:40 Anasayfa Haberler Kategoriler Asayiş Kuveyt'te Su Arıtma Tesisi Hasar Gördü Kuveyt'te meydana gelen İran saldırısında su arıtma tesisi hasar gördü ve yangın çıktı. Olay sonrası ekipler yangını kontrol altına aldı ve onarım çalışmalarına başladı. Facebook X WhatsApp 17 Temmuz 2026 12:37 Kuveyt'te, İran'ın ABD'ye yönelik saldırılarına misilleme olarak düzenlediği saldırıda, elektrik üretim ve su arıtma tesisi hedef alındı. Saldırı sonucunda tesisin bir kısmında yangın çıktı. Kuveyt Elektrik, Su ve Yenilenebilir Enerji Bakanlığı, saldırının etkilerini doğruladı ve yangının hemen kontrol altına alındığını duyurdu. Bakanlık, olay sonrası ekiplerin hızlı bir şekilde yangını söndürdüğünü ve hasar gören alanlarda onarım çalışmalarının sürdüğünü belirtti. Saldırının ardından tesisin yeniden faaliyete geçmesi için ekiplerin yoğun çaba sarf ettiği ifade edildi. Olayın ardından, Kuveyt yönetimi, halkın su ve enerji ihtiyaçlarının karşılanması için gerekli önlemleri alacaklarını açıkladı. Ayrıca, saldırının neden olduğu hasarın boyutlarıyla ilgili detaylı bir inceleme başlatıldığı bildirildi. İstanbul'da Başlayacak Anadolu Dostluk Rallisi, 11 Şehri Kapsayacak Ankara'da Bakan Ersoy, Türkiye Uluslararası İslam, Bilim ve Teknoloji Üniversitesi'ni Ziyaret Etti Kaynak: Mersin Haber + IHA İlgili Haberler Facebook X WhatsApp Son Eklenen Haberler 09:58 Aynı sokakta peş peşe kazalar kamerada 09:59 Hasköy’de yüzyıllık mezarlıklara defineci tahribatı 09:59 Bursa Platformu’ndan ‘Kent Anayasası’ çağrısı: ""Daha fazla beklememeli"" 09:56 Adalet Bakanı Gürlek'ten Cinayet Açıklaması 09:56 Yüksekova'da Tarım Denetimleri Gerçekleştirildi 09:57 Mersin'de Otluk Yangını Kontrol Altına Alındı 09:57 Ankara'da Yazıcıoğlu Dosyasında Yeni Gelişmeler 09:57 Şemdinli'de Genç Ölü Bulundu 09:54 Samsun'da Motosiklet Kazası Görüntülendi 09:52 Elazığ'da Yüzme Başarısı 09:52 Avcılar'da Scooter Hırsızlığı Kamerada 09:52 Tunceli'de Diyaliz Ünitesi Açıldı 09:53 Kuveyt'te meydana gelen İran saldırısında su arıtma tesisi hasar gördü ve yangın çıktı. Olay sonrası ekipler yangını kontrol altına aldı ve onarım çalışmalarına başladı. Kuveyt'te İran Saldırısında Su Arıtma Tesisinde Yangın Çıktı Kuveyt'te, İran'ın ABD'ye yönelik saldırılarına misilleme olarak düzenlediği saldırıda, elektrik üretim ve su arıtma tesisi hedef alındı. Saldırı sonucunda tesisin bir kısmında yangın çıktı. Kuveyt Elektrik, Su ve Yenilenebilir Enerji Bakanlığı, saldırının etkilerini doğruladı ve yangının hemen kontrol altına alındığını duyurdu. Bakanlık, olay sonrası ekiplerin hızlı bir şekilde yangını söndürdüğünü ve hasar gören alanlarda onarım çalışmalarının sürdüğünü belirtti. Saldırının ardından tesisin yeniden faaliyete geçmesi için ekiplerin yoğun çaba sarf ettiği ifade edildi. Olayın ardından, Kuveyt yönetimi, halkın su ve enerji ihtiyaçlarının karşılanması için gerekli önlemleri alacaklarını açıkladı. Ayrıca, saldırının neden olduğu hasarın boyutlarıyla ilgili detaylı bir inceleme başlatıldığı bildirildi.","Kuveyt'te İran Saldırısında Su Arıtma Tesisinde Yangın Çıktı Kuveyt'te İran Saldırısında Su Arıtma Tesisinde Yangın Çıktı Mersin Haber Kuveyt'te meydana gelen İran saldırısında su arıtma tesisi hasar gördü ve yangın çıktı. Olay sonrası ekipler yangını kontrol altına aldı ve onarım çalışmalarına başladı. Facebook X WhatsApp 17 Temmuz 2026 12:37 Kuveyt'te, İran'ın ABD'ye yönelik saldırılarına misilleme olarak düzenlediği saldırıda, elektrik üretim ve su arıtma tesisi hedef alındı. Saldırı sonucunda tesisin bir kısmında yangın çıktı. Kuveyt Elektrik, Su ve Yenilenebilir Enerji Bakanlığı, saldırının etkilerini doğruladı ve yangının hemen kontrol altına alındığını duyurdu. Bakanlık, olay sonrası ekiplerin hızlı bir şekilde yangını söndürdüğünü ve hasar gören alanlarda onarım çalışmalarının sürdüğünü belirtti. Saldırının ardından tesisin yeniden faaliyete geçmesi için ekiplerin yoğun çaba sarf ettiği ifade edildi. Olayın ardından, Kuveyt yönetimi, halkın su ve enerji ihtiyaçlarının karşılanması için gerekli önlemleri alacaklarını açıkladı. Ayrıca, saldırının neden olduğu hasarın boyutlarıyla ilgili detaylı bir inceleme başlatıldığı bildirildi. İstanbul'da Başlayacak Anadolu Dostluk Rallisi, 11 Şehri Kapsayacak Ankara'da Bakan Ersoy, Türkiye Uluslararası İslam, Bilim ve Teknoloji Üniversitesi'ni Ziyaret Etti Kaynak: Mersin Haber + IHA İlgili Haberler Facebook X WhatsApp Son Eklenen Haberler 09:58 Aynı sokakta peş peşe kazalar kamerada 09:59 Hasköy’de yüzyıllık mezarlıklara defineci tahribatı 09:59 Bursa Platformu’ndan ‘Kent Anayasası’ çağrısı: ""Daha fazla beklememeli"" 09:56 Adalet Bakanı Gürlek'ten Cinayet Açıklaması 09:56 Yüksekova'da Tarım Denetimleri Gerçekleştirildi 09:57 Mersin'de Otluk Yangını Kontrol Altına Alındı 09:57 Ankara'da Yazıcıoğlu Dosyasında Yeni Gelişmeler 09:57 Şemdinli'de Genç Ölü Bulundu 09:54 Samsun'da Motosiklet Kazası Görüntülendi 09:52 Elazığ'da Yüzme Başarısı 09:52 Avcılar'da Scooter Hırsızlığı Kamerada 09:52 Tunceli'de Diyaliz Ünitesi Açıldı 09:53 Kuveyt'te İran Saldırısında Su Arıtma Tesisinde Yangın Çıktı Haber Merkezi • 17 Temmuz 2026 12:37 • Güncellendi: 17 Temmuz 2026 12:40 Kuveyt'te meydana gelen İran saldırısında su arıtma tesisi hasar gördü ve yangın çıktı. Anasayfa Haberler Kategoriler Asayiş Kuveyt'te Su Arıtma Tesisi Hasar Gördü Kuveyt'te meydana gelen İran saldırısında su arıtma tesisi hasar gördü ve yangın çıktı. İstanbul'da Başlayacak Anadolu Dostluk Rallisi, 11 Şehri Kapsayacak Ankara'da Bakan Ersoy, Türkiye Uluslararası İslam, Bilim ve Teknoloji Üniversitesi'ni Ziyaret Etti Kaynak: Mersin Haber + IHA İlgili Haberler Facebook X WhatsApp Son Eklenen Haberler 09:58 Aynı sokakta peş peşe kazalar kamerada 09:59 Hasköy’de yüzyıllık mezarlıklara defineci tahribatı 09:59 Bursa Platformu’ndan ‘Kent Anayasası’ çağrısı: ""Daha fazla beklememeli"" 09:56 Adalet Bakanı Gürlek'ten Cinayet Açıklaması 09:56 Yüksekova'da Tarım Denetimleri Gerçekleştirildi 09:57 Mersin'de Otluk Yangını Kontrol Altına Alındı 09:57 Ankara'da Yazıcıoğlu Dosyasında Yeni Gelişmeler 09:57 Şemdinli'de Genç Ölü Bulundu 09:54 Samsun'da Motosiklet Kazası Görüntülendi 09:52 Elazığ'da Yüzme Başarısı 09:52 Avcılar'da Scooter Hırsızlığı Kamerada 09:52 Tunceli'de Diyaliz Ünitesi Açıldı 09:53 Kuveyt'te, İran'ın ABD'ye yönelik saldırılarına misilleme olarak düzenlediği saldırıda, elektrik üretim ve su arıtma tesisi hedef alındı. Kuveyt'te İran Saldırısında Su Arıtma Tesisinde Yangın Çıktı Haber Merkezi • 17 Temmuz 2026 12:37 • Güncellendi: 17 Temmuz 2026 12:40 Kuveyt'te meydana gelen İran saldırısında su arıtma tesisi hasar gördü ve yangın çıktı. Haber Merkezi • 17 Temmuz 2026 12:37 • Güncellendi: 17 Temmuz 2026 12:40 Anasayfa Haberler Kategoriler Asayiş Kuveyt'te Su Arıtma Tesisi Hasar Gördü Kuveyt'te meydana gelen İran saldırısında su arıtma tesisi hasar gördü ve yangın çıktı. İstanbul'da Başlayacak Anadolu Dostluk Rallisi, 11 Şehri Kapsayacak Ankara'da Bakan Ersoy, Türkiye Uluslararası İslam, Bilim ve Teknoloji Üniversitesi'ni Ziyaret Etti Kaynak: Mersin Haber + IHA İlgili Haberler Facebook X WhatsApp Son Eklenen Haberler 09:58 Aynı sokakta peş peşe kazalar kamerada 09:59 Hasköy’de yüzyıllık mezarlıklara defineci tahribatı 09:59 Bursa Platformu’ndan ‘Kent Anayasası’ çağrısı: ""Daha fazla beklememeli"" 09:56 Adalet Bakanı Gürlek'ten Cinayet Açıklaması 09:56 Yüksekova'da Tarım Denetimleri Gerçekleştirildi 09:57 Mersin'de Otluk Yangını Kontrol Altına Alındı 09:57 Ankara'da Yazıcıoğlu Dosyasında Yeni Gelişmeler 09:57 Şemdinli'de Genç Ölü Bulundu 09:54 Samsun'da Motosiklet Kazası Görüntülendi 09:52 Elazığ'da Yüzme Başarısı 09:52 Avcılar'da Scooter Hırsızlığı Kamerada 09:52 Tunceli'de Diyaliz Ünitesi Açıldı 09:53 Kuveyt'te meydana gelen İran saldırısında su arıtma tesisi hasar gördü ve yangın çıktı. Kuveyt'te İran Saldırısında Su Arıtma Tesisinde Yangın Çıktı Kuveyt'te, İran'ın ABD'ye yönelik saldırılarına misilleme olarak düzenlediği saldırıda, elektrik üretim ve su arıtma tesisi hedef alındı.",browser_full_article_dom,https://news.google.com/rss/articles/CBMiogFBVV95cUxOdUpPTXY2UHpMa2Npbi1tQWxad21BWUhOVlBGTkdEMVl5QjdNZzlwU2xueWFHVnV4X2hZVE9pazkzaVVPUHp5SzFOcEd5XzFGVjNQWFRPMEJINnpGemJFekdMQVRDQVJjdDNMVG93eC1fZUtnMnZsQmx3Xzg4MHBiS1hwNVBvN0dhNmQxU2dGSF9XMUR0SnJaUFRkRXdmMUdPelHSAVdBVV95cUxQWDNHY0FNNVpxZ0tKeTlab1hEZHhfQTRseGY4alRaWDNseXJzSzBZSE5NMGJ4Qklnb0pSb19NUGVRTGpXalVCSWpXdy1PdWw2OHVUZFdZZ3c?oc=5&hl=tr&gl=TR&ceid=TR:tr,Ankara | Elazığ | İstanbul | Mersin | Samsun,Şemdinli | Yüksekova | Avcılar | Hasköy,,,su arıtma tesisi | te Su Arıtma Tesisi,,,firma yok,su arıtma tesisi Şemdinli Ankara Türkiye,Çınar Su Arıtma Sistemleri | Aski İvedik su arıtma tesisleri | Güzelkaya Su Arıtma Tesisi | Miss Su Arıtma,Çınar Su Arıtma Sistemleri,"firma adı yok, tesis/lokasyon ile maps tahmini var",72.0 | 72.0 | 100.0 | 80.0,,165.25,2
