published,search_term,category,title,summary,link,matched_words,activity_type,raw_text,entity_source_text,article_fetch_status,resolved_article_url,city_candidates,district_candidates,neighborhood_candidates,street_candidates,facility_candidates,company_candidates,company_candidate_scores,entity_quality_note,maps_queries,maps_candidates,maps_best_guess,maps_status,maps_match_scores,maps_rejected_candidates,record_quality_score,duplicate_group_id
2026-07-17 08:41:49,MASAK,Kara Para / MASAK / Bahis,"Banka İhbar Etti, MASAK Rapor Hazırladı! Babala TV Hesabındaki Gizemli Döviz Trafiği Deşifre Oldu!","Banka İhbar Etti, MASAK Rapor Hazırladı! Babala TV Hesabındaki Gizemli Döviz Trafiği Deşifre Oldu! Avaz Türk",https://news.google.com/rss/articles/CBMiygFBVV95cUxOZ0t5UHExakRBTzBqdnlHM0k1aWoxY2REVDVOekRZV1diN01acHViOE5SM0tPM2dUelpNNmRyMXFWTmhFOXZGY3NpZllmSUp4UHZrcEZlMFhIaTJqbnBVeUEzeGhHT2stX0QwSTFlSEpmX0lDZlMwWWlrb0VFUmE4MkR0eGdidEpRQVk1OFVwUmV4cVhoV0U2Qy1tVDRxVlRxbEdXZElveWg1WmlOT1dmbGUyLWlSX1E4MmhFSkpNNl9RQXBlTzdaczdB0gHKAUFVX3lxTE5nS3lQcTFqREFPMGp2eUczSTVpajFjZERUNU56RFlXV2I3TVpwdWI4TlIzS08zZ1R6Wk02ZHIxcVZOaEU5dkZjc2lmWWZJSnhQdmtwRmUwWEhpMmpucFV5QTN4aEdPay1fRDBJMWVISmZfSUNmUzBZaWtvRUVSYTgyRHR4Z2J0SlFBWTU4VXBSZXhxWGhXRTZDLW1UNHFWVHFsR1dkSW95aDVaaU5PV2ZsZTItaVJfUTgyaEVKSk02X1FBcGVPN1pzN0E?oc=5,"banka, masak",finansal kuruluş,"Banka İhbar Etti, MASAK Rapor Hazırladı! Babala TV Hesabındaki Gizemli Döviz Trafiği Deşifre Oldu! İstanbul Cumhuriyet Başsavcılığı tarafından Ahbap Derneği’ne yönelik yürütülen ve kamuoyunda geniş yankı uyandıran soruşturmada yeni detaylar gün yüzüne çıkmaya devam ediyor. 17 Temmuz 2026 Cuma 11:41 İstanbul Cumhuriyet Başsavcılığı tarafından Ahbap Derneği’ne yönelik yürütülen ve kamuoyunda geniş yankı uyandıran soruşturmada yeni detaylar gün yüzüne çıkmaya devam ediyor. Sabah saatlerinde evinde arama yapılarak gözaltına alınan Babala TV kurucusu Oğuzhan Uğur’un emniyete götürülme gerekçesinin arkasında, şirket hesaplarına yurt dışından gelen yüklü miktardaki şüpheli bir döviz transferi olduğu öğrenildi. Bankanın MASAK İhbarı Operasyonun Önünü Açtı Soruşturma dosyasına giren bilgilere göre kriz, özel bir bankanın Babala TV’nin resmi hesap hareketlerinde olağan dışı bir hareketlilik tespit etmesiyle başladı. Şirket hesabına yurt dışı kaynaklı çok yüksek tutarda döviz girişi yapıldığını fark eden banka yönetimi, yasal yükümlülükleri gereği Mali Suçları Araştırma Kurulu’na (MASAK) ""şüpheli işlem"" bildiriminde bulundu. MASAK uzmanlarının bildirim üzerine başlattığı hızlı inceleme ve hazırlanan mali rapor, İstanbul Cumhuriyet Başsavcılığı koordinesinde yürütülen mevcut Ahbap Derneği soruşturma dosyasıyla birleştirildi. Bu sıcak gelişmenin ardından savcılık, Oğuzhan Uğur’un da aralarında bulunduğu 9 şüpheli hakkında acil gözaltı kararı verdi. Sağlık Kontrolü Görüntüleri Ortaya Çıktı Gözaltı kararının ardından polis ekiplerince ikametinden alınan Oğuzhan Uğur, hastaneye götürülerek sağlık kontrolünden geçirildi. Ünlü fenomenin sağlık kontrolüne götürüldüğü anlara ilişkin ilk görüntüler de basın organlarına yansıdı. Kontrol işlemlerinin tamamlanmasının ardından Uğur, ifadesi alınmak üzere Vatan Caddesi'ndeki İstanbul İl Emniyet Müdürlüğü Yerleşkesi'ne nakledildi. Uğur ile birlikte haklarında işlem başlatılan Gülgün Öztürk, Suzan Düşküner, Emir Taşar, Emre Kartaloğlu, Hüseyin Küçük ve Fatih Eke de gözaltına alınırken, adreslerinde bulunamayan diğer 2 şüphelinin yakalanması için polis ekiplerinin çalışmaları devam ediyor. Soruşturmada Örgüt ve Kara Para Aklama Suçlaması Mali Suçlarla Mücadele Şube Müdürlüğü ekiplerince yürütülen geniş çaplı soruşturma; ""suç işlemek amacıyla örgüt kurma"", ""nitelikli dolandırıcılık"" ve ""suçtan kaynaklanan mal varlığı değerlerini aklama"" suçlamalarıyla yürütülüyor. Soruşturma kapsamında daha önce yapılan teknik ve fiziki takiplerde; şüphelilerin mali profilleriyle tamamen uyumsuz çok yüksek miktarlı para transferleri gerçekleştirdikleri, dernek üzerinden toplanan bazı yardımları şans oyunları hesaplarına aktararak sanal bahislerde kaybettikleri ve kısa süre içinde kendi aralarında dikkat çekici tapu devirleri yaptıkları saptanmıştı. Soruşturmanın ilk etabında gözaltına alınan ve adliyeye sevk edilen 23 şüpheliden, aralarında Ahbap Derneği Başkanı şarkıcı Haluk Levent'in de bulunduğu 14 kişi tutuklanarak cezaevine gönderilmişti. Yeni gözaltılar ve MASAK'ın döviz transferi incelemesiyle soruşturmanın seyrinin daha da derinleşmesi bekleniyor. Gündem Haberleri İstanbul Cumhuriyet Başsavcılığı tarafından Ahbap Derneği’ne yönelik yürütülen ve kamuoyunda geniş yankı uyandıran soruşturmada yeni detaylar gün yüzüne çıkmaya devam ediyor. Sabah saatlerinde evinde arama yapılarak gözaltına alınan Babala TV kurucusu Oğuzhan Uğur’un emniyete götürülme gerekçesinin arkasında, şirket hesaplarına yurt dışından gelen yüklü miktardaki şüpheli bir döviz transferi olduğu öğrenildi. Bankanın MASAK İhbarı Operasyonun Önünü Açtı Soruşturma dosyasına giren bilgilere göre kriz, özel bir bankanın Babala TV’nin resmi hesap hareketlerinde olağan dışı bir hareketlilik tespit etmesiyle başladı. Şirket hesabına yurt dışı kaynaklı çok yüksek tutarda döviz girişi yapıldığını fark eden banka yönetimi, yasal yükümlülükleri gereği Mali Suçları Araştırma Kurulu’na (MASAK) ""şüpheli işlem"" bildiriminde bulundu. MASAK uzmanlarının bildirim üzerine başlattığı hızlı inceleme ve hazırlanan mali rapor, İstanbul Cumhuriyet Başsavcılığı koordinesinde yürütülen mevcut Ahbap Derneği soruşturma dosyasıyla birleştirildi. Bu sıcak gelişmenin ardından savcılık, Oğuzhan Uğur’un da aralarında bulunduğu 9 şüpheli hakkında acil gözaltı kararı verdi. Sağlık Kontrolü Görüntüleri Ortaya Çıktı Gözaltı kararının ardından polis ekiplerince ikametinden alınan Oğuzhan Uğur, hastaneye götürülerek sağlık kontrolünden geçirildi. Ünlü fenomenin sağlık kontrolüne götürüldüğü anlara ilişkin ilk görüntüler de basın organlarına yansıdı. Kontrol işlemlerinin tamamlanmasının ardından Uğur, ifadesi alınmak üzere Vatan Caddesi'ndeki İstanbul İl Emniyet Müdürlüğü Yerleşkesi'ne nakledildi. Uğur ile birlikte haklarında işlem başlatılan Gülgün Öztürk, Suzan Düşküner, Emir Taşar, Emre Kartaloğlu, Hüseyin Küçük ve Fatih Eke de gözaltına alınırken, adreslerinde bulunamayan diğer 2 şüphelinin yakalanması için polis ekiplerinin çalışmaları devam ediyor. Soruşturmada Örgüt ve Kara Para Aklama Suçlaması Mali Suçlarla Mücadele Şube Müdürlüğü ekiplerince yürütülen geniş çaplı soruşturma; ""suç işlemek amacıyla örgüt kurma"", ""nitelikli dolandırıcılık"" ve ""suçtan kaynaklanan mal varlığı değerlerini aklama"" suçlamalarıyla yürütülüyor. Soruşturma kapsamında daha önce yapılan teknik ve fiziki takiplerde; şüphelilerin mali profilleriyle tamamen uyumsuz çok yüksek miktarlı para transferleri gerçekleştirdikleri, dernek üzerinden toplanan bazı yardımları şans oyunları hesaplarına aktararak sanal bahislerde kaybettikleri ve kısa süre içinde kendi aralarında dikkat çekici tapu devirleri yaptıkları saptanmıştı. Soruşturmanın ilk etabında gözaltına alınan ve adliyeye sevk edilen 23 şüpheliden, aralarında Ahbap Derneği Başkanı şarkıcı Haluk Levent'in de bulunduğu 14 kişi tutuklanarak cezaevine gönderilmişti. Yeni gözaltılar ve MASAK'ın döviz transferi incelemesiyle soruşturmanın seyrinin daha da derinleşmesi bekleniyor. Banka İhbar Etti, MASAK Rapor Hazırladı! Babala TV Hesabındaki Gizemli Döviz Trafiği Deşifre Oldu! İstanbul Cumhuriyet Başsavcılığı tarafından Ahbap Derneği’ne yönelik yürütülen ve kamuoyunda geniş yankı uyandıran soruşturmada yeni detaylar gün yüzüne çıkmaya devam ediyor. Bankanın MASAK İhbarı Operasyonun Önünü Açtı Sağlık Kontrolü Görüntüleri Ortaya Çıktı Soruşturmada Örgüt ve Kara Para Aklama Suçlaması İstanbul Cumhuriyet Başsavcılığı tarafından Ahbap Derneği’ne yönelik yürütülen ve kamuoyunda geniş yankı uyandıran soruşturmada yeni detaylar gün yüzüne çıkmaya devam ediyor. Sabah saatlerinde evinde arama yapılarak gözaltına alınan Babala TV kurucusu Oğuzhan Uğur’un emniyete götürülme gerekçesinin arkasında, şirket hesaplarına yurt dışından gelen yüklü miktardaki şüpheli bir döviz transferi olduğu öğrenildi. Soruşturma dosyasına giren bilgilere göre kriz, özel bir bankanın Babala TV’nin resmi hesap hareketlerinde olağan dışı bir hareketlilik tespit etmesiyle başladı. Şirket hesabına yurt dışı kaynaklı çok yüksek tutarda döviz girişi yapıldığını fark eden banka yönetimi, yasal yükümlülükleri gereği Mali Suçları Araştırma Kurulu’na (MASAK) ""şüpheli işlem"" bildiriminde bulundu. MASAK uzmanlarının bildirim üzerine başlattığı hızlı inceleme ve hazırlanan mali rapor, İstanbul Cumhuriyet Başsavcılığı koordinesinde yürütülen mevcut Ahbap Derneği soruşturma dosyasıyla birleştirildi. Bu sıcak gelişmenin ardından savcılık, Oğuzhan Uğur’un da aralarında bulunduğu 9 şüpheli hakkında acil gözaltı kararı verdi. Gözaltı kararının ardından polis ekiplerince ikametinden alınan Oğuzhan Uğur, hastaneye götürülerek sağlık kontrolünden geçirildi. Ünlü fenomenin sağlık kontrolüne götürüldüğü anlara ilişkin ilk görüntüler de basın organlarına yansıdı. Kontrol işlemlerinin tamamlanmasının ardından Uğur, ifadesi alınmak üzere Vatan Caddesi'ndeki İstanbul İl Emniyet Müdürlüğü Yerleşkesi'ne nakledildi. Uğur ile birlikte haklarında işlem başlatılan Gülgün Öztürk, Suzan Düşküner, Emir Taşar, Emre Kartaloğlu, Hüseyin Küçük ve Fatih Eke de gözaltına alınırken, adreslerinde bulunamayan diğer 2 şüphelinin yakalanması için polis ekiplerinin çalışmaları devam ediyor. Mali Suçlarla Mücadele Şube Müdürlüğü ekiplerince yürütülen geniş çaplı soruşturma; ""suç işlemek amacıyla örgüt kurma"", ""nitelikli dolandırıcılık"" ve ""suçtan kaynaklanan mal varlığı değerlerini aklama"" suçlamalarıyla yürütülüyor. Soruşturma kapsamında daha önce yapılan teknik ve fiziki takiplerde; şüphelilerin mali profilleriyle tamamen uyumsuz çok yüksek miktarlı para transferleri gerçekleştirdikleri, dernek üzerinden toplanan bazı yardımları şans oyunları hesaplarına aktararak sanal bahislerde kaybettikleri ve kısa süre içinde kendi aralarında dikkat çekici tapu devirleri yaptıkları saptanmıştı. Soruşturmanın ilk etabında gözaltına alınan ve adliyeye sevk edilen 23 şüpheliden, aralarında Ahbap Derneği Başkanı şarkıcı Haluk Levent'in de bulunduğu 14 kişi tutuklanarak cezaevine gönderilmişti. Yeni gözaltılar ve MASAK'ın döviz transferi incelemesiyle soruşturmanın seyrinin daha da derinleşmesi bekleniyor.","Banka İhbar Etti, MASAK Rapor Hazırladı! Babala TV Hesabındaki Gizemli Döviz Trafiği Deşifre Oldu! Banka İhbar Etti, MASAK Rapor Hazırladı! Babala TV Hesabındaki Gizemli Döviz Trafiği Deşifre Oldu! Avaz Türk Banka İhbar Etti, MASAK Rapor Hazırladı! Babala TV Hesabındaki Gizemli Döviz Trafiği Deşifre Oldu! İstanbul Cumhuriyet Başsavcılığı tarafından Ahbap Derneği’ne yönelik yürütülen ve kamuoyunda geniş yankı uyandıran soruşturmada yeni detaylar gün yüzüne çıkmaya devam ediyor. 17 Temmuz 2026 Cuma 11:41 İstanbul Cumhuriyet Başsavcılığı tarafından Ahbap Derneği’ne yönelik yürütülen ve kamuoyunda geniş yankı uyandıran soruşturmada yeni detaylar gün yüzüne çıkmaya devam ediyor. Sabah saatlerinde evinde arama yapılarak gözaltına alınan Babala TV kurucusu Oğuzhan Uğur’un emniyete götürülme gerekçesinin arkasında, şirket hesaplarına yurt dışından gelen yüklü miktardaki şüpheli bir döviz transferi olduğu öğrenildi. Bankanın MASAK İhbarı Operasyonun Önünü Açtı Soruşturma dosyasına giren bilgilere göre kriz, özel bir bankanın Babala TV’nin resmi hesap hareketlerinde olağan dışı bir hareketlilik tespit etmesiyle başladı. Şirket hesabına yurt dışı kaynaklı çok yüksek tutarda döviz girişi yapıldığını fark eden banka yönetimi, yasal yükümlülükleri gereği Mali Suçları Araştırma Kurulu’na (MASAK) ""şüpheli işlem"" bildiriminde bulundu. MASAK uzmanlarının bildirim üzerine başlattığı hızlı inceleme ve hazırlanan mali rapor, İstanbul Cumhuriyet Başsavcılığı koordinesinde yürütülen mevcut Ahbap Derneği soruşturma dosyasıyla birleştirildi. Sağlık Kontrolü Görüntüleri Ortaya Çıktı Gözaltı kararının ardından polis ekiplerince ikametinden alınan Oğuzhan Uğur, hastaneye götürülerek sağlık kontrolünden geçirildi. Ünlü fenomenin sağlık kontrolüne götürüldüğü anlara ilişkin ilk görüntüler de basın organlarına yansıdı. Kontrol işlemlerinin tamamlanmasının ardından Uğur, ifadesi alınmak üzere Vatan Caddesi'ndeki İstanbul İl Emniyet Müdürlüğü Yerleşkesi'ne nakledildi. Uğur ile birlikte haklarında işlem başlatılan Gülgün Öztürk, Suzan Düşküner, Emir Taşar, Emre Kartaloğlu, Hüseyin Küçük ve Fatih Eke de gözaltına alınırken, adreslerinde bulunamayan diğer 2 şüphelinin yakalanması için polis ekiplerinin çalışmaları devam ediyor. Soruşturmada Örgüt ve Kara Para Aklama Suçlaması Mali Suçlarla Mücadele Şube Müdürlüğü ekiplerince yürütülen geniş çaplı soruşturma; ""suç işlemek amacıyla örgüt kurma"", ""nitelikli dolandırıcılık"" ve ""suçtan kaynaklanan mal varlığı değerlerini aklama"" suçlamalarıyla yürütülüyor. Soruşturma kapsamında daha önce yapılan teknik ve fiziki takiplerde; şüphelilerin mali profilleriyle tamamen uyumsuz çok yüksek miktarlı para transferleri gerçekleştirdikleri, dernek üzerinden toplanan bazı yardımları şans oyunları hesaplarına aktararak sanal bahislerde kaybettikleri ve kısa süre içinde kendi aralarında dikkat çekici tapu devirleri yaptıkları saptanmıştı. Soruşturmanın ilk etabında gözaltına alınan ve adliyeye sevk edilen 23 şüpheliden, aralarında Ahbap Derneği Başkanı şarkıcı Haluk Levent'in de bulunduğu 14 kişi tutuklanarak cezaevine gönderilmişti. Yeni gözaltılar ve MASAK'ın döviz transferi incelemesiyle soruşturmanın seyrinin daha da derinleşmesi bekleniyor. Gündem Haberleri İstanbul Cumhuriyet Başsavcılığı tarafından Ahbap Derneği’ne yönelik yürütülen ve kamuoyunda geniş yankı uyandıran soruşturmada yeni detaylar gün yüzüne çıkmaya devam ediyor. Bankanın MASAK İhbarı Operasyonun Önünü Açtı Sağlık Kontrolü Görüntüleri Ortaya Çıktı Soruşturmada Örgüt ve Kara Para Aklama Suçlaması İstanbul Cumhuriyet Başsavcılığı tarafından Ahbap Derneği’ne yönelik yürütülen ve kamuoyunda geniş yankı uyandıran soruşturmada yeni detaylar gün yüzüne çıkmaya devam ediyor. Soruşturma dosyasına giren bilgilere göre kriz, özel bir bankanın Babala TV’nin resmi hesap hareketlerinde olağan dışı bir hareketlilik tespit etmesiyle başladı. Mali Suçlarla Mücadele Şube Müdürlüğü ekiplerince yürütülen geniş çaplı soruşturma; ""suç işlemek amacıyla örgüt kurma"", ""nitelikli dolandırıcılık"" ve ""suçtan kaynaklanan mal varlığı değerlerini aklama"" suçlamalarıyla yürütülüyor.",browser_full_article_dom,https://news.google.com/rss/articles/CBMiygFBVV95cUxOZ0t5UHExakRBTzBqdnlHM0k1aWoxY2REVDVOekRZV1diN01acHViOE5SM0tPM2dUelpNNmRyMXFWTmhFOXZGY3NpZllmSUp4UHZrcEZlMFhIaTJqbnBVeUEzeGhHT2stX0QwSTFlSEpmX0lDZlMwWWlrb0VFUmE4MkR0eGdidEpRQVk1OFVwUmV4cVhoV0U2Qy1tVDRxVlRxbEdXZElveWg1WmlOT1dmbGUyLWlSX1E4MmhFSkpNNl9RQXBlTzdaczdB0gHKAUFVX3lxTE5nS3lQcTFqREFPMGp2eUczSTVpajFjZERUNU56RFlXV2I3TVpwdWI4TlIzS08zZ1R6Wk02ZHIxcVZOaEU5dkZjc2lmWWZJSnhQdmtwRmUwWEhpMmpucFV5QTN4aEdPay1fRDBJMWVISmZfSUNmUzBZaWtvRUVSYTgyRHR4Z2J0SlFBWTU4VXBSZXhxWGhXRTZDLW1UNHFWVHFsR1dkSW95aDVaaU5PV2ZsZTItaVJfUTgyaEVKSk02X1FBcGVPN1pzN0E?oc=5&hl=tr&gl=TR&ceid=TR:tr,İstanbul,,Levent,ifadesi alınmak üzere Vatan Caddesi,,,,ilçe yok | firma yok | faaliyet/tesis yok,,,,maps araması yapılmadı,,,141.0,11
2026-07-17 11:29:00,depo yangını,Fiziksel Risk / Yangın,Mersin'de depo yangını! Faciaya dönüşmeden söndürüldü,Mersin'de depo yangını! Faciaya dönüşmeden söndürüldü tv100 Haber,https://news.google.com/rss/articles/CBMijwFBVV95cUxOTUxlOENGUUJUa0R4N0RQSkV2VFJ2UFhzeU9qNHE5NlVRYW9USVhiY1BsUkVlU01hZHVHS2F1YV82RUxKNlMtc3lRa21DSVgtREZsek9KWEI3ZU0zWC14NDdEMzgxdWROandDRzVWTGpRS01IWFMzQzFRTXNIWTlSMGpwMXlrMmRzSy1ZWk4tY9IBlAFBVV95cUxOdWdSYUdnWkdxYzhEX2d4TW9jbWJ4RWk4Mi1mVExyekRIeEJoWV8yeVdXM1dZaGdzTzlxZ0pKWDhEWkhlZTAwRWRWdXp6ZXBqYjN1d0NQNTNBRTU1cXdkYlVOQnd6ZnF0cFBKdGhTQ3oycG5EM3piQjgySHlVcmpxNVl3cmRnYnZMb01KbS12V003VUli?oc=5,depo,depo,"TV100 Mersin'de hal kompleksinde plastik kasa ve ahşap paletlerin olduğu depoda çatı tamiratı sırasında çıkan yangın kontrol altına alındı. Yangınla ilgili inceleme başlatıldı. TV100 Haberler Yaşam Mersin'de depo yangını! Faciaya dönüşmeden söndürüldü Mersin'de depo yangını! Faciaya dönüşmeden söndürüldü Mersin'de hal kompleksinde plastik kasa ve ahşap paletlerin olduğu depoda çatı tamiratı sırasında çıkan yangın kontrol altına alındı. Yangınla ilgili inceleme başlatıldı. Gökçe Ekal 17.07.2026 14:29 Güncelleme: 17.07.2026 15:28 Akdeniz ilçesindeki Toptancı ve Sebze Meyve Hal Kompleksi'nde faaliyet gösteren bir deponun çatı kısmındaki tadilat sırasında yangın çıktı. EKİPLER SEVK EDİLDİ Depodaki plastik kasa ve ahşap paletlerin tutuşması sonucu alevler yükselmeye başladı. İhbar üzerine bölgeye sağlık, itfaiye, polis ekipleri sevk edildi. İNCELEME BAŞLATILDI Yangın, itfaiye ekiplerinin yaptığı müdahale ile kontrol altına alınırken, soğutma çalışması başlatıldı. Yangınla ilgili inceleme başlatıldı. Son Video Haber Mersin Yangın Kaynak: DHA Öne Çıkanlar Trabzonspor'dan Onuachu için inanılmaz talep! Fenerbahçe'de Musaba'ya sürpriz teklif Samsun'da gece 22.00'dan sonra çıkmaya başladılar Çok O","Mersin'de depo yangını! Faciaya dönüşmeden söndürüldü Mersin'de depo yangını! Faciaya dönüşmeden söndürüldü tv100 Haber TV100 Mersin'de hal kompleksinde plastik kasa ve ahşap paletlerin olduğu depoda çatı tamiratı sırasında çıkan yangın kontrol altına alındı. Yangınla ilgili inceleme başlatıldı. TV100 Haberler Yaşam Mersin'de depo yangını! Faciaya dönüşmeden söndürüldü Mersin'de depo yangını! Faciaya dönüşmeden söndürüldü Mersin'de hal kompleksinde plastik kasa ve ahşap paletlerin olduğu depoda çatı tamiratı sırasında çıkan yangın kontrol altına alındı. Gökçe Ekal 17.07.2026 14:29 Güncelleme: 17.07.2026 15:28 Akdeniz ilçesindeki Toptancı ve Sebze Meyve Hal Kompleksi'nde faaliyet gösteren bir deponun çatı kısmındaki tadilat sırasında yangın çıktı. EKİPLER SEVK EDİLDİ Depodaki plastik kasa ve ahşap paletlerin tutuşması sonucu alevler yükselmeye başladı. İhbar üzerine bölgeye sağlık, itfaiye, polis ekipleri sevk edildi. İNCELEME BAŞLATILDI Yangın, itfaiye ekiplerinin yaptığı müdahale ile kontrol altına alınırken, soğutma çalışması başlatıldı. Son Video Haber Mersin Yangın Kaynak: DHA Öne Çıkanlar Trabzonspor'dan Onuachu için inanılmaz talep! Fenerbahçe'de Musaba'ya sürpriz teklif Samsun'da gece 22.00'dan sonra çıkmaya başladılar Çok O",browser_full_article,https://www.tv100.com/mersinde-depo-yangini-faciaya-donusmeden-sonduruldu-haber-864813,Mersin | Samsun,,,,,,,ilçe yok | firma yok | faaliyet/tesis yok,,,,maps araması yapılmadı,,,72.8,12
2026-07-17 10:54:00,depo yangını,Fiziksel Risk / Yangın,Mersin Sebze Hali'nde Korkutan Yangın! Alevler Depoyu Sardı,Mersin Sebze Hali'nde Korkutan Yangın! Alevler Depoyu Sardı Mersin Portal,https://news.google.com/rss/articles/CBMilAFBVV95cUxQWThXaDcxQjdGb3ItTjJlTTVadXpNbzlrVFc1bVNKUm4yT01pTmhhZW9ONzBUMkVXUUdxbVVPOVlhMEdidWR3aTE4aDFuR1JtTmNmYVFXeURHdXZaemh2OW9NQXNidHl4bnFaS1JoUjBFQVVTT0FldHVMaW5KeERzQndGTUxpVjRyY0pCNnVIVi0ya2xt?oc=5,depo,depo,"MERSİN Mersin Sebze Hali'nde Korkutan Yangın! Alevler Depoyu Sardı Mersin Sebze ve Meyve Hali'nde çıkan depo yangını, itfaiye ekiplerinin zamanında müdahalesi sayesinde çevredeki iş yerlerine sıçramadan söndürüldü. 17.07.2026 - 13:54 17.07.2026 - 13:54 Ahşap ve plastik kasaların bulunduğu depoda çıkan yangın, hal esnafına korku dolu anlar yaşattı. Edinilen bilgilere göre yangın, Akdeniz ilçesindeki Mersin Sebze ve Meyve Hali'nde yaş sebze ve meyve ticareti yapan bir işletmeye ait depoda henüz belirlenemeyen nedenle çıktı. Depodan yükselen yoğun dumanı fark eden çevredeki esnaf, ilk müdahaleyi kendi imkânlarıyla yapmaya çalıştı. Ancak kasaların tutuşmasıyla alevler kısa sürede büyüyünce durum 112 Acil Çağrı Merkezi'ne bildirildi. İtfaiyenin hızlı müdahalesi faciayı önledi İhbar üzerine olay yerine Mersin Büyükşehir Belediyesi İtfaiye Dairesi Başkanlığına bağlı Akdeniz Grup Amirliği ekipleri sevk edilirken, Merkez Grup Amirliği ekipleri de söndürme çalışmalarına destek verdi. Koordineli müdahale sayesinde yangın kısa sürede kontrol altına alınarak söndürüldü. Ekiplerin hızlı çalışmasıyla alevlerin hal içerisindeki diğer depolara ve iş yerlerine sıçraması önlenirken, olası büyük bir felaketin de önüne geçildi. Can kaybı yaşanmadı Yangın sırasında hal esnafı kısa süreli panik yaşarken, olayda can kaybı ya da yaralanma olmaması en büyük teselli oldu. Ancak yangının çıktığı depoda bulunan ahşap ve plastik kasalar kullanılamaz hale gelirken, işletmede maddi hasar oluştu. Yangının kesin çıkış nedeninin belirlenmesi için ekipler tarafından inceleme başlatıldı. Yetkililer, özellikle yanıcı malzemelerin yoğun olarak bulunduğu depolarda yangın güvenliği tedbirlerinin önemine dikkat çekerken, benzer olayların önüne geçebilmek amacıyla gerekli kontrollerin sürdürüleceğini belirtti. Bunl","Mersin Sebze Hali'nde Korkutan Yangın! Alevler Depoyu Sardı Mersin Sebze Hali'nde Korkutan Yangın! Alevler Depoyu Sardı Mersin Portal MERSİN Mersin Sebze Hali'nde Korkutan Yangın! Alevler Depoyu Sardı Mersin Sebze ve Meyve Hali'nde çıkan depo yangını, itfaiye ekiplerinin zamanında müdahalesi sayesinde çevredeki iş yerlerine sıçramadan söndürüldü. 17.07.2026 - 13:54 17.07.2026 - 13:54 Ahşap ve plastik kasaların bulunduğu depoda çıkan yangın, hal esnafına korku dolu anlar yaşattı. Edinilen bilgilere göre yangın, Akdeniz ilçesindeki Mersin Sebze ve Meyve Hali'nde yaş sebze ve meyve ticareti yapan bir işletmeye ait depoda henüz belirlenemeyen nedenle çıktı. Depodan yükselen yoğun dumanı fark eden çevredeki esnaf, ilk müdahaleyi kendi imkânlarıyla yapmaya çalıştı. Ancak kasaların tutuşmasıyla alevler kısa sürede büyüyünce durum 112 Acil Çağrı Merkezi'ne bildirildi. İtfaiyenin hızlı müdahalesi faciayı önledi İhbar üzerine olay yerine Mersin Büyükşehir Belediyesi İtfaiye Dairesi Başkanlığına bağlı Akdeniz Grup Amirliği ekipleri sevk edilirken, Merkez Grup Amirliği ekipleri de söndürme çalışmalarına destek verdi. Koordineli müdahale sayesinde yangın kısa sürede kontrol altına alınarak söndürüldü. Ekiplerin hızlı çalışmasıyla alevlerin hal içerisindeki diğer depolara ve iş yerlerine sıçraması önlenirken, olası büyük bir felaketin de önüne geçildi. Can kaybı yaşanmadı Yangın sırasında hal esnafı kısa süreli panik yaşarken, olayda can kaybı ya da yaralanma olmaması en büyük teselli oldu. Ancak yangının çıktığı depoda bulunan ahşap ve plastik kasalar kullanılamaz hale gelirken, işletmede maddi hasar oluştu. Yangının kesin çıkış nedeninin belirlenmesi için ekipler tarafından inceleme başlatıldı. Yetkililer, özellikle yanıcı malzemelerin yoğun olarak bulunduğu depolarda yangın güvenliği tedbirlerinin önemine dikkat çekerken, benzer olayların önüne geçebilmek amacıyla gerekli kontrollerin sürdürüleceğini belirtti.",browser_full_article_dom,https://news.google.com/rss/articles/CBMilAFBVV95cUxQWThXaDcxQjdGb3ItTjJlTTVadXpNbzlrVFc1bVNKUm4yT01pTmhhZW9ONzBUMkVXUUdxbVVPOVlhMEdidWR3aTE4aDFuR1JtTmNmYVFXeURHdXZaemh2OW9NQXNidHl4bnFaS1JoUjBFQVVTT0FldHVMaW5KeERzQndGTUxpVjRyY0pCNnVIVi0ya2xt?oc=5&hl=tr&gl=TR&ceid=TR:tr,,,,,,,,il yok | ilçe yok | firma yok | faaliyet/tesis yok,,,,maps araması yapılmadı,,,70.75,13
