published,search_term,category,title,summary,link,matched_words,activity_type,raw_text,entity_source_text,article_fetch_status,resolved_article_url,city_candidates,district_candidates,neighborhood_candidates,street_candidates,facility_candidates,company_candidates,company_candidate_scores,entity_quality_note,maps_queries,maps_candidates,maps_best_guess,maps_status,maps_match_scores,maps_rejected_candidates,record_quality_score,duplicate_group_id
2026-06-30 06:03:05,sahtecilik,Diğer,Kahramanmaraş’ta ‘sahte altın’ operasyonu; kalıp ve altınlara el konuldu,Kahramanmaraş’ta ‘sahte altın’ operasyonu; kalıp ve altınlara el konuldu Tr724,https://news.google.com/rss/articles/CBMilgFBVV95cUxPMHFHcWFZZEdHdDFzNHg4R0NMOEZQbzRqZ3ZLN09kdWtUYi02cU5qei1DVFVzM0MxOURLTm1QSzI1cGU3V0xHRE9FRGVwa2kzQy1Sd1pMb2tBM0VmUkxDRVFBdzFOeDg3SnZOZjRzRmtRZnlvZWhfdTFsREdnd1ZlcEZ1M3JtVkVXTzM0UWY2Vy01ZEJHa3c?oc=5,el konuldu,,"Kahramanmaraş merkezli 10 ilde sahte altın üretimi ve pazarlaması iddiasıyla eş zamanlı operasyon düzenlendi. Adalet Bakanı Akın Gürlek, operasyon kapsamında kuyumcu, atölyeci, çantacı ve kalıpçılardan oluşan 71 şüpheli hakkında işlem başlatıldığını açıkladı. Soruşturmada, olması gereken ayar ve ağırlığın altında basıldığı öne sürülen ziynet altınları ile sahte kalıplara el konulduğu bildirildi. Soruşturma “parada sahtecilik”, “paraya eşit […] Güncel Manşet Kahramanmaraş’ta ‘sahte altın’ operasyonu; kalıp ve altınlara el konuldu TR724 HABER - 30 Haziran 2026 PAYLAŞ Facebook X WhatsApp Email Yazdır Gerçekler bizimle anlaşılır. Tıklayın güvenilir haber kaynağınıza ekleyin! Kahramanmaraş merkezli 10 ilde sahte altın üretimi ve pazarlaması iddiasıyla eş zamanlı operasyon düzenlendi. Adalet Bakanı Akın Gürlek, operasyon kapsamında kuyumcu, atölyeci, çantacı ve kalıpçılardan oluşan 71 şüpheli hakkında işlem başlatıldığını açıkladı. Soruşturmada, olması gereken ayar ve ağırlığın altında basıldığı öne sürülen ziynet altınları ile sahte kalıplara el konulduğu bildirildi. Soruşturma “parada sahtecilik”, “paraya eşit sayılan değerde sahtecilik” ve “nitelikli dolandırıcılık” suçlamalarıyla yürütülüyor. Kahramanmaraş merkezli yürütülen sahte altın soruşturması kapsamında 10 ilde eş zamanlı operasyon düzenlendi. Adalet Bakanı Akın Gürlek, operasyonun kuyumculuk sektöründe sahte altın üretimi ve pazarlaması yaptığı iddia edilen yapılara yönelik gerçekleştirildiğini duyurdu. Gürlek’in açıklamasına göre soruşturmada, Darphane tarafından basılması gereken ziynet altınlarının olması gereken ayar ve ağırlığın altında üretildiği belirlendi. Bu yöntemle hem vatandaşların mağdur edildiği hem de kamu zararına yol açıldığı iddia edildi. Kahramanmaraş Cumhuriyet Başsavcılığı’nın yürüttüğü soruşturma kapsamında, kuyumcu, atölyeci, çantacı ve kalıpçılardan oluşan 71 şüpheli hedef alındı. Şüpheliler hakkında “parada sahtecilik”, “paraya eşit sayılan değerde sahtecilik” ve “nitelikli dolandırıcılık” suçlarından işlem başlatıldı. Operasyon kapsamında yapılan aramalarda suçta kullanıldığı belirtilen çok sayıda sahte kalıp, yasa dışı basılmış altın ve çeşitli suç unsuru materyallere el konulduğu açıklandı. Bakan Gürlek, soruşturmanın Kahramanmaraş Cumhuriyet Başsavcılığı koordinasyonunda çok yönlü sürdüğünü belirtti. Gürlek, vatandaşların birikimlerinin korunacağını ve kuyumculuk sektöründeki güveni zedeleyen yapılara karşı işlem yapılacağını ifade etti. Soruşturmada gözaltına alınan şüphelilerin sayısı ve operasyonun düzenlendiği diğer illerin isimleri henüz açıklanmadı. Facebook Instagram X Youtube Ana Sayfa Güncel Kahramanmaraş’ta ‘sahte altın’ operasyonu; kalıp ve altınlara el konuldu Güncel Manşet Kahramanmaraş’ta ‘sahte altın’ operasyonu; kalıp ve altınlara el konuldu TR724 HABER - 30 Haziran 2026 PAYLAŞ Facebook X WhatsApp Email Yazdır Gerçekler bizimle anlaşılır. Tıklayın güvenilir haber kaynağınıza ekleyin! Kahramanmaraş merkezli 10 ilde sahte altın üretimi ve pazarlaması iddiasıyla eş zamanlı operasyon düzenlendi. Adalet Bakanı Akın Gürlek, operasyon kapsamında kuyumcu, atölyeci, çantacı ve kalıpçılardan oluşan 71 şüpheli hakkında işlem başlatıldığını açıkladı. Soruşturmada, olması gereken ayar ve ağırlığın altında basıldığı öne sürülen ziynet altınları ile sahte kalıplara el konulduğu bildirildi. Soruşturma “parada sahtecilik”, “paraya eşit sayılan değerde sahtecilik” ve “nitelikli dolandırıcılık” suçlamalarıyla yürütülüyor. Kahramanmaraş merkezli yürütülen sahte altın soruşturması kapsamında 10 ilde eş zamanlı operasyon düzenlendi. Adalet Bakanı Akın Gürlek, operasyonun kuyumculuk sektöründe sahte altın üretimi ve pazarlaması yaptığı iddia edilen yapılara yönelik gerçekleştirildiğini duyurdu. Gürlek’in açıklamasına göre soruşturmada, Darphane tarafından basılması gereken ziynet altınlarının olması gereken ayar ve ağırlığın altında üretildiği belirlendi. Bu yöntemle hem vatandaşların mağdur edildiği hem de kamu zararına yol açıldığı iddia edildi. Kahramanmaraş Cumhuriyet Başsavcılığı’nın yürüttüğü soruşturma kapsamında, kuyumcu, atölyeci, çantacı ve kalıpçılardan oluşan 71 şüpheli hedef alındı. Şüpheliler hakkında “parada sahtecilik”, “paraya eşit sayılan değerde sahtecilik” ve “nitelikli dolandırıcılık” suçlarından işlem başlatıldı. Operasyon kapsamında yapılan aramalarda suçta kullanıldığı belirtilen çok sayıda sahte kalıp, yasa dışı basılmış altın ve çeşitli suç unsuru materyallere el konulduğu açıklandı. Bakan Gürlek, soruşturmanın Kahramanmaraş Cumhuriyet Başsavcılığı koordinasyonunda çok yönlü sürdüğünü belirtti. Gürlek, vatandaşların birikimlerinin korunacağını ve kuyumculuk sektöründeki güveni zedeleyen yapılara karşı işlem yapılacağını ifade etti. Soruşturmada gözaltına alınan şüphelilerin sayısı ve operasyonun düzenlendiği diğer illerin isimleri henüz açıklanmadı. YORUM YAZIN İPTAL Güncel Manşet Kahramanmaraş’ta ‘sahte altın’ operasyonu; kalıp ve altınlara el konuldu TR724 HABER - 30 Haziran 2026 PAYLAŞ Facebook X WhatsApp Email Yazdır Gerçekler bizimle anlaşılır. Tıklayın güvenilir haber kaynağınıza ekleyin! Kahramanmaraş merkezli 10 ilde sahte altın üretimi ve pazarlaması iddiasıyla eş zamanlı operasyon düzenlendi. Adalet Bakanı Akın Gürlek, operasyon kapsamında kuyumcu, atölyeci, çantacı ve kalıpçılardan oluşan 71 şüpheli hakkında işlem başlatıldığını açıkladı. Soruşturmada, olması gereken ayar ve ağırlığın altında basıldığı öne sürülen ziynet altınları ile sahte kalıplara el konulduğu bildirildi. Soruşturma “parada sahtecilik”, “paraya eşit sayılan değerde sahtecilik” ve “nitelikli dolandırıcılık” suçlamalarıyla yürütülüyor. Kahramanmaraş merkezli yürütülen sahte altın soruşturması kapsamında 10 ilde eş zamanlı operasyon düzenlendi. Adalet Bakanı Akın Gürlek, operasyonun kuyumculuk sektöründe sahte altın üretimi ve pazarlaması yaptığı iddia edilen yapılara yönelik gerçekleştirildiğini duyurdu. Gürlek’in açıklamasına göre soruşturmada, Darphane tarafından basılması gereken ziynet altınlarının olması gereken ayar ve ağırlığın altında üretildiği belirlendi. Bu yöntemle hem vatandaşların mağdur edildiği hem de kamu zararına yol açıldığı iddia edildi. Kahramanmaraş Cumhuriyet Başsavcılığı’nın yürüttüğü soruşturma kapsamında, kuyumcu, atölyeci, çantacı ve kalıpçılardan oluşan 71 şüpheli hedef alındı. Şüpheliler hakkında “parada sahtecilik”, “paraya eşit sayılan değerde sahtecilik” ve “nitelikli dolandırıcılık” suçlarından işlem başlatıldı. Operasyon kapsamında yapılan aramalarda suçta kullanıldığı belirtilen çok sayıda sahte kalıp, yasa dışı basılmış altın ve çeşitli suç unsuru materyallere el konulduğu açıklandı. Bakan Gürlek, soruşturmanın Kahramanmaraş Cumhuriyet Başsavcılığı koordinasyonunda çok yönlü sürdüğünü belirtti. Gürlek, vatandaşların birikimlerinin korunacağını ve kuyumculuk sektöründeki güveni zedeleyen yapılara karşı işlem yapılacağını ifade etti. Soruşturmada gözaltına alınan şüphelilerin sayısı ve operasyonun düzenlendiği diğer illerin isimleri henüz açıklanmadı. YORUM YAZIN İPTAL Kahramanmaraş merkezli 10 ilde sahte altın üretimi ve pazarlaması iddiasıyla eş zamanlı operasyon düzenlendi. Adalet Bakanı Akın Gürlek, operasyon kapsamında kuyumcu, atölyeci, çantacı ve kalıpçılardan oluşan 71 şüpheli hakkında işlem başlatıldığını açıkladı. Soruşturmada, olması gereken ayar ve ağırlığın altında basıldığı öne sürülen ziynet altınları ile sahte kalıplara el konulduğu bildirildi. Soruşturma “parada sahtecilik”, “paraya eşit sayılan değerde sahtecilik” ve “nitelikli dolandırıcılık” suçlamalarıyla yürütülüyor. Kahramanmaraş merkezli yürütülen sahte altın soruşturması kapsamında 10 ilde eş zamanlı operasyon düzenlendi. Adalet Bakanı Akın Gürlek, operasyonun kuyumculuk sektöründe sahte altın üretimi ve pazarlaması yaptığı iddia edilen yapılara yönelik gerçekleştirildiğini duyurdu. Gürlek’in açıklamasına göre soruşturmada, Darphane tarafından basılması gereken ziynet altınlarının olması gereken ayar ve ağırlığın altında üretildiği belirlendi. Bu yöntemle hem vatandaşların mağdur edildiği hem de kamu zararına yol açıldığı iddia edildi. Kahramanmaraş Cumhuriyet Başsavcılığı’nın yürüttüğü soruşturma kapsamında, kuyumcu, atölyeci, çantacı ve kalıpçılardan oluşan 71 şüpheli hedef alındı. Şüpheliler hakkında “parada sahtecilik”, “paraya eşit sayılan değerde sahtecilik” ve “nitelikli dolandırıcılık” suçlarından işlem başlatıldı. Operasyon kapsamında yapılan aramalarda suçta kullanıldığı belirtilen çok sayıda sahte kalıp, yasa dışı basılmış altın ve çeşitli suç unsuru materyallere el konulduğu açıklandı. Bakan Gürlek, soruşturmanın Kahramanmaraş Cumhuriyet Başsavcılığı koordinasyonunda çok yönlü sürdüğünü belirtti. Gürlek, vatandaşların birikimlerinin korunacağını ve kuyumculuk sektöründeki güveni zedeleyen yapılara karşı işlem yapılacağını ifade etti. Soruşturmada gözaltına alınan şüphelilerin sayısı ve operasyonun düzenlendiği diğer illerin isimleri henüz açıklanmadı. Kahramanmaraş’ta ‘sahte altın’ operasyonu; kalıp ve altınlara el konuldu Kahramanmaraş merkezli yürütülen sahte altın soruşturması kapsamında 10 ilde eş zamanlı operasyon düzenlendi. Adalet Bakanı Akın Gürlek, operasyonun kuyumculuk sektöründe sahte altın üretimi ve pazarlaması yaptığı iddia edilen yapılara yönelik gerçekleştirildiğini duyurdu. Gürlek’in açıklamasına göre soruşturmada, Darphane tarafından basılması gereken ziynet altınlarının olması gereken ayar ve ağırlığın altında üretildiği belirlendi. Bu yöntemle hem vatandaşların mağdur edildiği hem de kamu zararına yol açıldığı iddia edildi. Kahramanmaraş Cumhuriyet Başsavcılığı’nın yürüttüğü soruşturma kapsamında, kuyumcu, atölyeci, çantacı ve kalıpçılardan oluşan 71 şüpheli hedef alındı. Şüpheliler hakkında “parada sahtecilik”, “paraya eşit sayılan değerde sahtecilik” ve “nitelikli dolandırıcılık” suçlarından işlem başlatıldı. Operasyon kapsamında yapılan aramalarda suçta kullanıldığı belirtilen çok sayıda sahte kalıp, yasa dışı basılmış altın ve çeşitli suç unsuru materyallere el konulduğu açıklandı. Bakan Gürlek, soruşturmanın Kahramanmaraş Cumhuriyet Başsavcılığı koordinasyonunda çok yönlü sürdüğünü belirtti. Gürlek, vatandaşların birikimlerinin korunacağını ve kuyumculuk sektöründeki güveni zedeleyen yapılara karşı işlem yapılacağını ifade etti. Soruşturmada gözaltına alınan şüphelilerin sayısı ve operasyonun düzenlendiği diğer illerin isimleri henüz açıklanmadı. GERÇEKLER BİZİMLE ANLAŞILIR Tarafsız, doğru haberlerimiz, isabetli yorum, analiz ve yazı dizilerimizle gerçek bilgiye ulaşmanız için varız. Sosyal medya hesaplarımızı lütfen takibe alınız.","Kahramanmaraş’ta ‘sahte altın’ operasyonu; kalıp ve altınlara el konuldu Kahramanmaraş’ta ‘sahte altın’ operasyonu; kalıp ve altınlara el konuldu Tr724 Kahramanmaraş merkezli 10 ilde sahte altın üretimi ve pazarlaması iddiasıyla eş zamanlı operasyon düzenlendi. Adalet Bakanı Akın Gürlek, operasyon kapsamında kuyumcu, atölyeci, çantacı ve kalıpçılardan oluşan 71 şüpheli hakkında işlem başlatıldığını açıkladı. Soruşturmada, olması gereken ayar ve ağırlığın altında basıldığı öne sürülen ziynet altınları ile sahte kalıplara el konulduğu bildirildi. Soruşturma “parada sahtecilik”, “paraya eşit […] Güncel Manşet Kahramanmaraş’ta ‘sahte altın’ operasyonu; kalıp ve altınlara el konuldu TR724 HABER - 30 Haziran 2026 PAYLAŞ Facebook X WhatsApp Email Yazdır Gerçekler bizimle anlaşılır. Soruşturma “parada sahtecilik”, “paraya eşit sayılan değerde sahtecilik” ve “nitelikli dolandırıcılık” suçlamalarıyla yürütülüyor. Kahramanmaraş merkezli yürütülen sahte altın soruşturması kapsamında 10 ilde eş zamanlı operasyon düzenlendi. Adalet Bakanı Akın Gürlek, operasyonun kuyumculuk sektöründe sahte altın üretimi ve pazarlaması yaptığı iddia edilen yapılara yönelik gerçekleştirildiğini duyurdu. Gürlek’in açıklamasına göre soruşturmada, Darphane tarafından basılması gereken ziynet altınlarının olması gereken ayar ve ağırlığın altında üretildiği belirlendi. Bu yöntemle hem vatandaşların mağdur edildiği hem de kamu zararına yol açıldığı iddia edildi. Kahramanmaraş Cumhuriyet Başsavcılığı’nın yürüttüğü soruşturma kapsamında, kuyumcu, atölyeci, çantacı ve kalıpçılardan oluşan 71 şüpheli hedef alındı. Şüpheliler hakkında “parada sahtecilik”, “paraya eşit sayılan değerde sahtecilik” ve “nitelikli dolandırıcılık” suçlarından işlem başlatıldı. Operasyon kapsamında yapılan aramalarda suçta kullanıldığı belirtilen çok sayıda sahte kalıp, yasa dışı basılmış altın ve çeşitli suç unsuru materyallere el konulduğu açıklandı. Bakan Gürlek, soruşturmanın Kahramanmaraş Cumhuriyet Başsavcılığı koordinasyonunda çok yönlü sürdüğünü belirtti. Gürlek, vatandaşların birikimlerinin korunacağını ve kuyumculuk sektöründeki güveni zedeleyen yapılara karşı işlem yapılacağını ifade etti. Soruşturmada gözaltına alınan şüphelilerin sayısı ve operasyonun düzenlendiği diğer illerin isimleri henüz açıklanmadı. Facebook Instagram X Youtube Ana Sayfa Güncel Kahramanmaraş’ta ‘sahte altın’ operasyonu; kalıp ve altınlara el konuldu Güncel Manşet Kahramanmaraş’ta ‘sahte altın’ operasyonu; kalıp ve altınlara el konuldu TR724 HABER - 30 Haziran 2026 PAYLAŞ Facebook X WhatsApp Email Yazdır Gerçekler bizimle anlaşılır. YORUM YAZIN İPTAL Güncel Manşet Kahramanmaraş’ta ‘sahte altın’ operasyonu; kalıp ve altınlara el konuldu TR724 HABER - 30 Haziran 2026 PAYLAŞ Facebook X WhatsApp Email Yazdır Gerçekler bizimle anlaşılır. YORUM YAZIN İPTAL Kahramanmaraş merkezli 10 ilde sahte altın üretimi ve pazarlaması iddiasıyla eş zamanlı operasyon düzenlendi. Kahramanmaraş’ta ‘sahte altın’ operasyonu; kalıp ve altınlara el konuldu Kahramanmaraş merkezli yürütülen sahte altın soruşturması kapsamında 10 ilde eş zamanlı operasyon düzenlendi.",browser_full_article,https://www.tr724.com/kahramanmarasta-sahte-altin-operasyonu-kalip-ve-altinlara-el-konuldu/,Kahramanmaraş,,,,,,,ilçe yok | firma yok | faaliyet/tesis yok,,,,maps araması yapılmadı,,,88.5,17
2026-06-30 06:05:44,sahtecilik,Operasyon / Soruşturma / Suç,"Vatandaşın birikimine göz dikmişlerdi! 10 ilde sahte altın operasyonu: Kuyumcu, atölyeci ve çantacılar gözaltında!","Vatandaşın birikimine göz dikmişlerdi! 10 ilde sahte altın operasyonu: Kuyumcu, atölyeci ve çantacılar gözaltında! SuperHaber",https://news.google.com/rss/articles/CBMixAFBVV95cUxNaDUtaWVON2lrbklCVWRYS3FJVlVBN0tUV2dYZVJZdHl2OFBYWXl4dWEwcGp0a3dlUTVFT2RVNi11QWczR0NNN3JXUWU1c3JZYzRpRFBYcjVaYnlhRTZUNVV2SFBTRFA5eEtLUmhPbjQxejJmb1dCTHNVV1E0XzFaTGlPcHBwMk84bXE0MHozMlFUWWlGUFhjTU5WWWhFNFJyR256cU5vMzJiTk1aTWlNaUw0Mi1iRXhZZnJVbEZQeUVrRFl20gHEAUFVX3lxTE1oNS1pZU43aWtuSUJVZFhLcUlWVUE3S1RXZ1hlUll0eXY4UFhZeXh1YTBwanRrd2VRNUVPZFU2LXVBZzNHQ003cldRZTVzclljNGlEUFhyNVpieWFFNlQ1VXZIUFNEUDl4S0tSaE9uNDF6MmZvV0JMc1VXUTRfMVpMaU9wcHAyTzhtcTQwejMyUVRZaUZQWGNNTlZZaEU0UnJHbnpxTm8zMmJOTVpNaU1pTDQyLWJFeFlmclVsRlB5RWtEWXY?oc=5,atölye,atölye,"www.superhaber.com Güvenlik doğrulaması yapılıyor Bu web sitesi, kötü niyetli botlara karşı korunmak için bir güvenlik hizmeti kullanıyor. Web sitesi bir bot olmadığınızı doğrularken bu sayfa görüntülenir. Doğrulama başarılı. www.superhaber.com adresinin yanıt vermesi bekleniyor Güvenlik doğrulaması yapılıyor Doğrulama başarılı. www.superhaber.com adresinin yanıt vermesi bekleniyor Bu web sitesi, kötü niyetli botlara karşı korunmak için bir güvenlik hizmeti kullanıyor. Web sitesi bir bot olmadığınızı doğrularken bu sayfa görüntülenir.","Vatandaşın birikimine göz dikmişlerdi! 10 ilde sahte altın operasyonu: Kuyumcu, atölyeci ve çantacılar gözaltında! Vatandaşın birikimine göz dikmişlerdi! 10 ilde sahte altın operasyonu: Kuyumcu, atölyeci ve çantacılar gözaltında! SuperHaber www.superhaber.com Güvenlik doğrulaması yapılıyor Bu web sitesi, kötü niyetli botlara karşı korunmak için bir güvenlik hizmeti kullanıyor. Web sitesi bir bot olmadığınızı doğrularken bu sayfa görüntülenir. www.superhaber.com adresinin yanıt vermesi bekleniyor Güvenlik doğrulaması yapılıyor Doğrulama başarılı. www.superhaber.com adresinin yanıt vermesi bekleniyor Bu web sitesi, kötü niyetli botlara karşı korunmak için bir güvenlik hizmeti kullanıyor.",browser_full_article,https://www.superhaber.com/amp/vatandasin-birikimine-goz-dikmislerdi-10-ilde-sahte-altin-operasyonu-kuyumcu-atolyeci-ve-579675,,,,,,,,il yok | ilçe yok | firma yok | faaliyet/tesis yok,,,,maps araması yapılmadı,,,109.65,18
2026-06-30 04:43:00,kara para,Kara Para / MASAK / Bahis,"Yasa dışı bahis, kara para aklama ve vergi kaçakçılığı suçlarına yönelik İstanbul merkezli 9 ilde düzenlenen operasyonda 37 şüpheli yakalandı. Soruşturmaya konu şirketlerin işlem hacminin yaklaşık 30 milyar lirayı aştığı ope","Yasa dışı bahis, kara para aklama ve vergi kaçakçılığı suçlarına yönelik İstanbul merkezli 9 ilde düzenlenen operasyonda 37 şüpheli yakalandı. Soruşturmaya konu şirketlerin işlem hacminin yaklaşık 30 milyar lirayı aştığı ope Kars Manşet",https://news.google.com/rss/articles/CBMixwFBVV95cUxQTGxwRUptS25XMFBiQTJjM0p6NHFmaDlWTXhDeG40b2ZnWVNBZjBaUGlWSDUzSThYUDJGeGxDN0VGdm1aUG5WYXg5bE1oazVOa3cxelgxWkVTcExxci1HdExQSE5EUHhDUU00Vkd0U2JFS3g3YmhfOU93bEhXcHlRMW1tM0paaGdrYmdUNXQtSEp5ek9PXzNfVk9qZ1o3a0FVYk1RcDhFbmpqNXBOSzNKZ0FoUk1HVFpKV3RmN2VoVHdGRnZQVEJn0gHHAUFVX3lxTFBMbHBFSm1LblcwUGJBMmMzSno0cWZoOVZNeEN4bjRvZmdZU0FmMFpQaVZINTNJOFhQMkZ4bEM3RUZ2bVpQblZheDlsTWhrNU5rdzF6WDFaRVNwTHFyLUd0TFBITkRQeENRTTRWR3RTYkVLeDdiaF85T3dsSFdweVExbW0zSlpoZ2tiZ1Q1dC1ISnl6T09fM19WT2pnWjdrQVViTVFwOEVuamo1cE5LM0pnQWhSTUdUWkpXdGY3ZWhUd0ZGdlBUQmc?oc=5,şirket,şirket / firma,"Yasa dışı bahis, kara para aklama ve vergi kaçakçılığı suçlarına yönelik İstanbul merkezli 9 ilde düzenlenen operasyonda 37 şüpheli yakalandı. Yasa dışı bahis, kara para aklama ve vergi kaçakçılığı suçlarına yönelik İstanbul merkezli 9 ilde düzenlenen operasyonda 37 şüpheli yakalandı. Yasa dışı bahis, kara para aklama ve vergi kaçakçılığı suçlarına yönelik İstanbul merkezli 9 ilde düzenlenen operasyonda 37 şüpheli yakalandı. Yasa dışı bahis, kara para aklama ve vergi kaçakçılığı suçlarına yönelik İstanbul merkezli 9 ilde düzenlenen operasyonda 37 şüpheli yakalandı. Soruşturmaya konu şirketlerin işlem hacminin yaklaşık 30 milyar lirayı aştığı ope 30 Haziran 2026 Salı 07:43 Yasa dışı bahis, kara para aklama ve vergi kaçakçılığı suçlarına yönelik İstanbul merkezli 9 ilde düzenlenen operasyonda 37 şüpheli yakalandı. Yasa dışı bahis, kara para aklama ve vergi kaçakçılığı suçlarına yönelik İstanbul merkezli 9 ilde düzenlenen operasyonda 37 şüpheli yakalandı. Soruşturmaya konu şirketlerin işlem hacminin yaklaşık 30 milyar lirayı aştığı operasyonda, 19 konut, 9 arsa, 1 iş yeri, 31 motorlu araç ile 32 şirkete el konulduğu bildirildi. İlk yorum yazan siz olun Türkiye Gündem Haberleri Yasa dışı bahis, kara para aklama ve vergi kaçakçılığı suçlarına yönelik İstanbul merkezli 9 ilde düzenlenen operasyonda 37 şüpheli yakalandı. Soruşturmaya konu şirketlerin işlem hacminin yaklaşık 30 milyar lirayı aştığı operasyonda, 19 konut, 9 arsa, 1 iş yeri, 31 motorlu araç ile 32 şirkete el konulduğu bildirildi. Yasa dışı bahis, kara para aklama ve vergi kaçakçılığı suçlarına yönelik İstanbul merkezli 9 ilde düzenlenen operasyonda 37 şüpheli yakalandı. Soruşturmaya konu şirketlerin işlem hacminin yaklaşık 30 milyar lirayı aştığı ope","Yasa dışı bahis, kara para aklama ve vergi kaçakçılığı suçlarına yönelik İstanbul merkezli 9 ilde düzenlenen operasyonda 37 şüpheli yakalandı. Soruşturmaya konu şirketlerin işlem hacminin yaklaşık 30 milyar lirayı aştığı ope Yasa dışı bahis, kara para aklama ve vergi kaçakçılığı suçlarına yönelik İstanbul merkezli 9 ilde düzenlenen operasyonda 37 şüpheli yakalandı. Soruşturmaya konu şirketlerin işlem hacminin yaklaşık 30 milyar lirayı aştığı ope Kars Manşet Yasa dışı bahis, kara para aklama ve vergi kaçakçılığı suçlarına yönelik İstanbul merkezli 9 ilde düzenlenen operasyonda 37 şüpheli yakalandı. Soruşturmaya konu şirketlerin işlem hacminin yaklaşık 30 milyar lirayı aştığı ope 30 Haziran 2026 Salı 07:43 Yasa dışı bahis, kara para aklama ve vergi kaçakçılığı suçlarına yönelik İstanbul merkezli 9 ilde düzenlenen operasyonda 37 şüpheli yakalandı. Soruşturmaya konu şirketlerin işlem hacminin yaklaşık 30 milyar lirayı aştığı operasyonda, 19 konut, 9 arsa, 1 iş yeri, 31 motorlu araç ile 32 şirkete el konulduğu bildirildi. İlk yorum yazan siz olun Türkiye Gündem Haberleri Yasa dışı bahis, kara para aklama ve vergi kaçakçılığı suçlarına yönelik İstanbul merkezli 9 ilde düzenlenen operasyonda 37 şüpheli yakalandı. Soruşturmaya konu şirketlerin işlem hacminin yaklaşık 30 milyar lirayı aştığı ope",browser_full_article,https://www.karsmanset.com/service/amp/haber/yasa-disi-bahis-kara-para-aklama-ve-vergi-kacakciligi-suclarina-yonelik-1731070.htm,İstanbul,,,,,,,ilçe yok | firma yok | faaliyet/tesis yok,,,,maps araması yapılmadı,,,220.0,19
