published,search_term,category,title,summary,link,matched_words,activity_type,raw_text,entity_source_text,article_fetch_status,resolved_article_url,city_candidates,district_candidates,neighborhood_candidates,street_candidates,facility_candidates,company_candidates,company_candidate_scores,entity_quality_note,maps_queries,maps_candidates,maps_best_guess,maps_status,maps_match_scores,maps_rejected_candidates,record_quality_score,duplicate_group_id
2026-07-03 05:30:00,ödeme güçlüğü,Banka / Finansal Kuruluş,"FATSO Başkanı Karataş: ""Bankalar Şimdi Değilse Ne Zaman İşe Yarayacak?""","FATSO Başkanı Karataş: ""Bankalar Şimdi Değilse Ne Zaman İşe Yarayacak?"" Ordu Olay Gazetesi",https://news.google.com/rss/articles/CBMiqwFBVV95cUxPVkRvNnY2ejFERndYSXFsRllxbmFpMUpHcFA2S2FJMHpkRkFMNUkzQUJURE9OaTZJUllZSHhBVzA1aWttVW1JM2NhU3NtX0picUJWaDRWTFNCNldfVUx5TzZpeTVjdTRsT1owbWl6ZWNxY2REcmxqRU1YQk83cmZOUWU2aFZaaENuSkZ0MnFLbENBTE80dGVWZzF3RXFKdlZkNVc0LTJTWF83QVXSAbABQVVfeXFMT0had0FFcndzbG9FaVA2ZXk0Qi1BbzFGNUJFRFFkbkFIMnhqSV9wYU1WcFBoVEdCbVBNdnZEZ2RzSDE2bVVMMThDQ3dhb1VQTDZoY2swY3NlbWlrOVhPakhBdTBaS0V6ZWFIbmk4YU5NSm9COGFETUVLSFBzWmFWV0RlYnJtcDVuNTctdkJOUEJMbXgtM1gza3hQaDZWaC10TlkyQXZTb3JZTWd6NWJUbDI?oc=5,banka,finansal kuruluş,"Fatsa Ticaret ve Sanayi Odası (FATSO) Başkanı Tayfun Karataş, iş dünyasının finansmana erişimde tarihi bir darboğaz yaşadığını belirterek, başta kamu bankaları olmak üzere bankacılık sektörüne sert eleştiriler yöneltti. Fatsa Ticaret ve Sanayi Odası (FATSO) Başkanı Tayfun Karataş, iş dünyasının finansmana erişimde tarihi bir darboğaz yaşadığını belirterek, başta kamu bankaları... Fatsa Ticaret ve Sanayi Odası (FATSO) Başkanı Tayfun Karataş, iş dünyasının finansmana erişimde tarihi bir darboğaz yaşadığını belirterek, başta kamu bankaları olmak üzere bankacılık sektörüne sert eleştiriler yöneltti. Krediye ulaşmanın her geçen gün zorlaştığını, kredi kullanan işletmelerin ise yüksek faiz, komisyon ve ek maliyetlerle karşı karşıya bırakıldığını söyleyen Karataş, ""İş dünyası sabrının ve fedakârlığının son noktasına gelmiştir. Bankalar artık ekonomiye destek vermek zorundadır"" dedi. Fatsa Ticaret ve Sanayi Odası Başkanı Tayfun Karataş, yaptığı yazılı açıklamada Türkiye'de iş dünyasının karşı karşıya bulunduğu ekonomik tabloyu değerlendirdi. Son dönemde finansmana erişim konusunda yaptıkları uyarıları defalarca dile getirdiklerini hatırlatan Karataş, buna rağmen herhangi bir iyileşme yaşanmadığını ifade etti. Ekonomide yaşanan sorunların artık ertelenemez noktaya geldiğini belirten Karataş, ülke gündeminin merkezine ekonominin yerleştirilmesi gerektiğini söyledi: ""Gözlerin farklı gündemlerden çekilip ekonomiye çevrilmesi gerekiyor. Çünkü bugün ülkemizin sadece birinci değil, ikinci, üçüncü ve diğer bütün gündem maddesi de ekonomi olmalıdır."" ""DEZENFLASYON PROGRAMI BEKLENEN SONUCU VERMEDİ"" Uygulanan ekonomik programın iş dünyası üzerindeki yükü artırdığını savunan Karataş, enflasyonla mücadelede istenen sonucun elde edilemediğini söyledi. Özellikle küçük ve orta ölçekli işletmeler ile sanayi kuruluşlarının ağır finansman maliyetleri altında ezildiğini belirten Karataş, mevcut ekonomik şartların üretim yapan kesimleri her geçen gün daha fazla zorladığını dile getirdi. ""BANKALAR KREDİ VERMEMEK İÇİN HER YOLU DENİYOR"" İş dünyasının en büyük sorununun finansmana erişim olduğunu belirten Karataş, özellikle kamu bankalarının kredi süreçlerinde işletmeleri zorladığını ifade etti. Üyelerinden sürekli aynı yönde şikâyetler aldıklarını belirten Karataş, bankaların kredi kullandırmamak adına çok sayıda prosedür uyguladığını öne sürdü: ""Herhangi bir finansman talebinde bütün imkânlar adeta kredi kullandırmamak üzerine seferber ediliyor."" ""KREDİ KOMİSYONLARI VE MASRAFLAR İŞLETMELERİ ZORLUYOR"" Kredi kullanabilen işletmelerin de yüksek maliyetlerle karşı karşıya kaldığını belirten Karataş, kredi tahsis ücretleri, komisyonlar ve ilave masrafların üreticiyi ve sanayiciyi zor durumda bıraktığını söyledi. Bankaların uyguladığı ek maliyetleri eleştiren Karataş, işletmelerin üretim yaptığına ve istihdam sağladığına pişman olacak noktaya getirildiğini savundu. ""POS KOMİSYONLARI ESNAFIN KAZANCINI ERİTİYOR"" Karataş, bankaların POS cihazlarından aldığı komisyonların da işletmeler üzerinde ağır yük oluşturduğunu belirtti. Birçok işletmenin yüzde 5 ila 10 arasında değişen kâr marjıyla faaliyet gösterdiğini ifade eden Karataş, bunun yaklaşık yüzde 4'ünün banka komisyonu olarak kesildiğini söyledi. Bu durumun sürdürülebilir ticareti tehdit ettiğini belirten Karataş, bankaların POS komisyonlarını yeniden değerlendirmesi gerektiğini kaydetti. ""BCH KREDİLERİNDEKİ ÖDEME GÜÇLÜĞÜ ALARM VERİYOR"" Rotatif işletme kredileri (BCH) kullanan çok sayıda işletmenin geri ödemelerde zorlandığını ifade eden Karataş, maliyetlerin kontrol edilemez seviyelere ulaştığını söyledi. Borçların katlanarak büyüdüğünü belirten Karataş, bu sürecin devam etmesi halinde hem iş dünyasının hem de bankacılık sektörünün olumsuz etkileneceğini dile getirdi. ""BANKALAR REKOR KÂR EDERKEN REEL SEKTÖR DESTEK BEKLİYOR"" Bankacılık Düzenleme ve Denetleme Kurumu'nun (BDDK) açıkladığı verilere de değinen Karataş, bankacılık sektörünün kârlılığını artırmaya devam ettiğini söyledi. İlk beş ayda bankaların net dönem kârının geçen yılın aynı dönemine göre yüzde 29 arttığını hatırlatan Karataş, bu büyümenin reel sektöre yeterince yansımadığını ifade etti. Son beş yılda bankacılık sektörünün önemli kâr artışları elde ettiğini belirten Karataş, bunun artık iş dünyasına destek olarak geri dönmesi gerektiğini söyledi. Haber Merkezi FATSO Başkanı Karataş: ""Bankalar Şimdi Değilse Ne Zaman İşe Yarayacak?"" ""DEZENFLASYON PROGRAMI BEKLENEN SONUCU VERMEDİ"" ""BANKALAR KREDİ VERMEMEK İÇİN HER YOLU DENİYOR"" ""KREDİ KOMİSYONLARI VE MASRAFLAR İŞLETMELERİ ZORLUYOR"" ""POS KOMİSYONLARI ESNAFIN KAZANCINI ERİTİYOR"" ""BCH KREDİLERİNDEKİ ÖDEME GÜÇLÜĞÜ ALARM VERİYOR"" ""BANKALAR REKOR KÂR EDERKEN REEL SEKTÖR DESTEK BEKLİYOR"" Fatsa Ticaret ve Sanayi Odası (FATSO) Başkanı Tayfun Karataş, iş dünyasının finansmana erişimde tarihi bir darboğaz yaşadığını belirterek, başta kamu bankaları olmak üzere bankacılık sektörüne sert eleştiriler yöneltti. Krediye ulaşmanın her geçen gün zorlaştığını, kredi kullanan işletmelerin ise yüksek faiz, komisyon ve ek maliyetlerle karşı karşıya bırakıldığını söyleyen Karataş, ""İş dünyası sabrının ve fedakârlığının son noktasına gelmiştir. Bankalar artık ekonomiye destek vermek zorundadır"" dedi. Fatsa Ticaret ve Sanayi Odası Başkanı Tayfun Karataş, yaptığı yazılı açıklamada Türkiye'de iş dünyasının karşı karşıya bulunduğu ekonomik tabloyu değerlendirdi. Son dönemde finansmana erişim konusunda yaptıkları uyarıları defalarca dile getirdiklerini hatırlatan Karataş, buna rağmen herhangi bir iyileşme yaşanmadığını ifade etti. Ekonomide yaşanan sorunların artık ertelenemez noktaya geldiğini belirten Karataş, ülke gündeminin merkezine ekonominin yerleştirilmesi gerektiğini söyledi: ""Gözlerin farklı gündemlerden çekilip ekonomiye çevrilmesi gerekiyor. Çünkü bugün ülkemizin sadece birinci değil, ikinci, üçüncü ve diğer bütün gündem maddesi de ekonomi olmalıdır."" Uygulanan ekonomik programın iş dünyası üzerindeki yükü artırdığını savunan Karataş, enflasyonla mücadelede istenen sonucun elde edilemediğini söyledi. Özellikle küçük ve orta ölçekli işletmeler ile sanayi kuruluşlarının ağır finansman maliyetleri altında ezildiğini belirten Karataş, mevcut ekonomik şartların üretim yapan kesimleri her geçen gün daha fazla zorladığını dile getirdi. İş dünyasının en büyük sorununun finansmana erişim olduğunu belirten Karataş, özellikle kamu bankalarının kredi süreçlerinde işletmeleri zorladığını ifade etti. Üyelerinden sürekli aynı yönde şikâyetler aldıklarını belirten Karataş, bankaların kredi kullandırmamak adına çok sayıda prosedür uyguladığını öne sürdü: ""Herhangi bir finansman talebinde bütün imkânlar adeta kredi kullandırmamak üzerine seferber ediliyor."" Kredi kullanabilen işletmelerin de yüksek maliyetlerle karşı karşıya kaldığını belirten Karataş, kredi tahsis ücretleri, komisyonlar ve ilave masrafların üreticiyi ve sanayiciyi zor durumda bıraktığını söyledi. Bankaların uyguladığı ek maliyetleri eleştiren Karataş, işletmelerin üretim yaptığına ve istihdam sağladığına pişman olacak noktaya getirildiğini savundu. Karataş, bankaların POS cihazlarından aldığı komisyonların da işletmeler üzerinde ağır yük oluşturduğunu belirtti. Birçok işletmenin yüzde 5 ila 10 arasında değişen kâr marjıyla faaliyet gösterdiğini ifade eden Karataş, bunun yaklaşık yüzde 4'ünün banka komisyonu olarak kesildiğini söyledi. Bu durumun sürdürülebilir ticareti tehdit ettiğini belirten Karataş, bankaların POS komisyonlarını yeniden değerlendirmesi gerektiğini kaydetti. Rotatif işletme kredileri (BCH) kullanan çok sayıda işletmenin geri ödemelerde zorlandığını ifade eden Karataş, maliyetlerin kontrol edilemez seviyelere ulaştığını söyledi. Borçların katlanarak büyüdüğünü belirten Karataş, bu sürecin devam etmesi halinde hem iş dünyasının hem de bankacılık sektörünün olumsuz etkileneceğini dile getirdi. Bankacılık Düzenleme ve Denetleme Kurumu'nun (BDDK) açıkladığı verilere de değinen Karataş, bankacılık sektörünün kârlılığını artırmaya devam ettiğini söyledi. İlk beş ayda bankaların net dönem kârının geçen yılın aynı dönemine göre yüzde 29 arttığını hatırlatan Karataş, bu büyümenin reel sektöre yeterince yansımadığını ifade etti. Son beş yılda bankacılık sektörünün önemli kâr artışları elde ettiğini belirten Karataş, bunun artık iş dünyasına destek olarak geri dönmesi gerektiğini söyledi. 03 Tem 2026 - 08:30 - Ekonomi Yazdır Yorum yazarak Ordu Olay Gazetesi Topluluk Kuralları’nı kabul etmiş bulunuyor ve yorumunuzla ilgili doğrudan veya dolaylı tüm sorumluluğu tek başınıza üstleniyorsunuz. Yazılan yorumlardan Ordu Olay Gazetesi hiçbir şek","FATSO Başkanı Karataş: ""Bankalar Şimdi Değilse Ne Zaman İşe Yarayacak?"" FATSO Başkanı Karataş: ""Bankalar Şimdi Değilse Ne Zaman İşe Yarayacak?"" Ordu Olay Gazetesi Fatsa Ticaret ve Sanayi Odası (FATSO) Başkanı Tayfun Karataş, iş dünyasının finansmana erişimde tarihi bir darboğaz yaşadığını belirterek, başta kamu bankaları olmak üzere bankacılık sektörüne sert eleştiriler yöneltti. Fatsa Ticaret ve Sanayi Odası (FATSO) Başkanı Tayfun Karataş, iş dünyasının finansmana erişimde tarihi bir darboğaz yaşadığını belirterek, başta kamu bankaları... Krediye ulaşmanın her geçen gün zorlaştığını, kredi kullanan işletmelerin ise yüksek faiz, komisyon ve ek maliyetlerle karşı karşıya bırakıldığını söyleyen Karataş, ""İş dünyası sabrının ve fedakârlığının son noktasına gelmiştir. Bankalar artık ekonomiye destek vermek zorundadır"" dedi. Fatsa Ticaret ve Sanayi Odası Başkanı Tayfun Karataş, yaptığı yazılı açıklamada Türkiye'de iş dünyasının karşı karşıya bulunduğu ekonomik tabloyu değerlendirdi. Son dönemde finansmana erişim konusunda yaptıkları uyarıları defalarca dile getirdiklerini hatırlatan Karataş, buna rağmen herhangi bir iyileşme yaşanmadığını ifade etti. Ekonomide yaşanan sorunların artık ertelenemez noktaya geldiğini belirten Karataş, ülke gündeminin merkezine ekonominin yerleştirilmesi gerektiğini söyledi: ""Gözlerin farklı gündemlerden çekilip ekonomiye çevrilmesi gerekiyor. Çünkü bugün ülkemizin sadece birinci değil, ikinci, üçüncü ve diğer bütün gündem maddesi de ekonomi olmalıdır."" ""DEZENFLASYON PROGRAMI BEKLENEN SONUCU VERMEDİ"" Uygulanan ekonomik programın iş dünyası üzerindeki yükü artırdığını savunan Karataş, enflasyonla mücadelede istenen sonucun elde edilemediğini söyledi. Özellikle küçük ve orta ölçekli işletmeler ile sanayi kuruluşlarının ağır finansman maliyetleri altında ezildiğini belirten Karataş, mevcut ekonomik şartların üretim yapan kesimleri her geçen gün daha fazla zorladığını dile getirdi. ""BANKALAR KREDİ VERMEMEK İÇİN HER YOLU DENİYOR"" İş dünyasının en büyük sorununun finansmana erişim olduğunu belirten Karataş, özellikle kamu bankalarının kredi süreçlerinde işletmeleri zorladığını ifade etti. Üyelerinden sürekli aynı yönde şikâyetler aldıklarını belirten Karataş, bankaların kredi kullandırmamak adına çok sayıda prosedür uyguladığını öne sürdü: ""Herhangi bir finansman talebinde bütün imkânlar adeta kredi kullandırmamak üzerine seferber ediliyor."" ""KREDİ KOMİSYONLARI VE MASRAFLAR İŞLETMELERİ ZORLUYOR"" Kredi kullanabilen işletmelerin de yüksek maliyetlerle karşı karşıya kaldığını belirten Karataş, kredi tahsis ücretleri, komisyonlar ve ilave masrafların üreticiyi ve sanayiciyi zor durumda bıraktığını söyledi. Bankaların uyguladığı ek maliyetleri eleştiren Karataş, işletmelerin üretim yaptığına ve istihdam sağladığına pişman olacak noktaya getirildiğini savundu. ""POS KOMİSYONLARI ESNAFIN KAZANCINI ERİTİYOR"" Karataş, bankaların POS cihazlarından aldığı komisyonların da işletmeler üzerinde ağır yük oluşturduğunu belirtti. Birçok işletmenin yüzde 5 ila 10 arasında değişen kâr marjıyla faaliyet gösterdiğini ifade eden Karataş, bunun yaklaşık yüzde 4'ünün banka komisyonu olarak kesildiğini söyledi. Bu durumun sürdürülebilir ticareti tehdit ettiğini belirten Karataş, bankaların POS komisyonlarını yeniden değerlendirmesi gerektiğini kaydetti. ""BCH KREDİLERİNDEKİ ÖDEME GÜÇLÜĞÜ ALARM VERİYOR"" Rotatif işletme kredileri (BCH) kullanan çok sayıda işletmenin geri ödemelerde zorlandığını ifade eden Karataş, maliyetlerin kontrol edilemez seviyelere ulaştığını söyledi. Borçların katlanarak büyüdüğünü belirten Karataş, bu sürecin devam etmesi halinde hem iş dünyasının hem de bankacılık sektörünün olumsuz etkileneceğini dile getirdi. ""BANKALAR REKOR KÂR EDERKEN REEL SEKTÖR DESTEK BEKLİYOR"" Bankacılık Düzenleme ve Denetleme Kurumu'nun (BDDK) açıkladığı verilere de değinen Karataş, bankacılık sektörünün kârlılığını artırmaya devam ettiğini söyledi. İlk beş ayda bankaların net dönem kârının geçen yılın aynı dönemine göre yüzde 29 arttığını hatırlatan Karataş, bu büyümenin reel sektöre yeterince yansımadığını ifade etti. Son beş yılda bankacılık sektörünün önemli kâr artışları elde ettiğini belirten Karataş, bunun artık iş dünyasına destek olarak geri dönmesi gerektiğini söyledi. Haber Merkezi FATSO Başkanı Karataş: ""Bankalar Şimdi Değilse Ne Zaman İşe Yarayacak?"" ""DEZENFLASYON PROGRAMI BEKLENEN SONUCU VERMEDİ"" ""BANKALAR KREDİ VERMEMEK İÇİN HER YOLU DENİYOR"" ""KREDİ KOMİSYONLARI VE MASRAFLAR İŞLETMELERİ ZORLUYOR"" ""POS KOMİSYONLARI ESNAFIN KAZANCINI ERİTİYOR"" ""BCH KREDİLERİNDEKİ ÖDEME GÜÇLÜĞÜ ALARM VERİYOR"" ""BANKALAR REKOR KÂR EDERKEN REEL SEKTÖR DESTEK BEKLİYOR"" Fatsa Ticaret ve Sanayi Odası (FATSO) Başkanı Tayfun Karataş, iş dünyasının finansmana erişimde tarihi bir darboğaz yaşadığını belirterek, başta kamu bankaları olmak üzere bankacılık sektörüne sert eleştiriler yöneltti. Çünkü bugün ülkemizin sadece birinci değil, ikinci, üçüncü ve diğer bütün gündem maddesi de ekonomi olmalıdır."" Uygulanan ekonomik programın iş dünyası üzerindeki yükü artırdığını savunan Karataş, enflasyonla mücadelede istenen sonucun elde edilemediğini söyledi. İş dünyasının en büyük sorununun finansmana erişim olduğunu belirten Karataş, özellikle kamu bankalarının kredi süreçlerinde işletmeleri zorladığını ifade etti. Üyelerinden sürekli aynı yönde şikâyetler aldıklarını belirten Karataş, bankaların kredi kullandırmamak adına çok sayıda prosedür uyguladığını öne sürdü: ""Herhangi bir finansman talebinde bütün imkânlar adeta kredi kullandırmamak üzerine seferber ediliyor."" Kredi kullanabilen işletmelerin de yüksek maliyetlerle karşı karşıya kaldığını belirten Karataş, kredi tahsis ücretleri, komisyonlar ve ilave masrafların üreticiyi ve sanayiciyi zor durumda bıraktığını söyledi. Karataş, bankaların POS cihazlarından aldığı komisyonların da işletmeler üzerinde ağır yük oluşturduğunu belirtti. Rotatif işletme kredileri (BCH) kullanan çok sayıda işletmenin geri ödemelerde zorlandığını ifade eden Karataş, maliyetlerin kontrol edilemez seviyelere ulaştığını söyledi. Bankacılık Düzenleme ve Denetleme Kurumu'nun (BDDK) açıkladığı verilere de değinen Karataş, bankacılık sektörünün kârlılığını artırmaya devam ettiğini söyledi. 03 Tem 2026 - 08:30 - Ekonomi Yazdır Yorum yazarak Ordu Olay Gazetesi Topluluk Kuralları’nı kabul etmiş bulunuyor ve yorumunuzla ilgili doğrudan veya dolaylı tüm sorumluluğu tek başınıza üstleniyorsunuz.",browser_full_article,https://www.orduolay.com/haber/28275014/fatso-baskani-karatas-bankalar-simdi-degilse-ne-zaman-ise-yarayacak,,,,,,,,il yok | ilçe yok | firma yok | faaliyet/tesis yok,,,,maps araması yapılmadı,,,79.0,19
2026-07-02 21:39:22,yangın,Fiziksel Risk / Yangın,Etimesgut'ta Şeker Fabrikası yakınındaki boş arazide yangın,Etimesgut'ta Şeker Fabrikası yakınındaki boş arazide yangın Manşet Haber,https://news.google.com/rss/articles/CBMiowFBVV95cUxOYVpfTVo2bUpTc3VjNmQxbWk3NTZjZGNYWXBLN1N2WHpqREhHb2tlN3Mta01ueTVfTHBNMWpVWjI1Z25tWG5WX1IxLTRyVDFyR29oTGEybHFCTWh4LWxvbUVCc2JWbFgzVnRTbVVEeGRWNnpEQ3pta2R0VFdyWmNyZVIwSlRrYTFldHVIT3pOUmhRdW9rZ05TSmt5dnhWQ2d2WXI0?oc=5,fabrika,fabrika,Etimesgut'ta Şeker Fabrikası yakınındaki boş arazide yangın Manşet Haber,Etimesgut'ta Şeker Fabrikası yakınındaki boş arazide yangın Etimesgut'ta Şeker Fabrikası yakınındaki boş arazide yangın Manşet Haber Etimesgut'ta Şeker Fabrikası yakınındaki boş arazide yangın Manşet Haber,browser_failed,https://news.google.com/rss/articles/CBMiowFBVV95cUxOYVpfTVo2bUpTc3VjNmQxbWk3NTZjZGNYWXBLN1N2WHpqREhHb2tlN3Mta01ueTVfTHBNMWpVWjI1Z25tWG5WX1IxLTRyVDFyR29oTGEybHFCTWh4LWxvbUVCc2JWbFgzVnRTbVVEeGRWNnpEQ3pta2R0VFdyWmNyZVIwSlRrYTFldHVIT3pOUmhRdW9rZ05TSmt5dnhWQ2d2WXI0?oc=5&hl=tr&gl=TR&ceid=TR:tr,Ankara,Etimesgut,,,ta Şeker Fabrikası,,,firma yok,ta Şeker Fabrikası Etimesgut Ankara Türkiye,Türk Şeker Fabrikası,Türk Şeker Fabrikası,"firma adı yok, tesis/lokasyon ile maps tahmini var",100,,150.22,20
2026-07-02 19:08:41,yangın,Fiziksel Risk / Yangın,İstanbul'da hayvancılık işletmesinde yangın,İstanbul'da hayvancılık işletmesinde yangın Malatya Güncel,https://news.google.com/rss/articles/CBMijwFBVV95cUxQY1JtSUhWTC1JMmFpZ2JQZF9MY1o3NmNZSzc4R0MtcnE4RzdEazdyWHlhVG5mRi1LVHVwemFwUnFZYWMzbkFjWFhYWW5yRFgxV3lhbTBPa0RidXdXMDljclBLVHpiNEhJVDI3eTJWQkxKbmxOdTZYQ3Zab2VQYm8zel9SaTZQU1VEQTdzNXB5ONIBlAFBVV95cUxNcEk1aDhXTExsWGNLLXVHMkFuak9vTkgxS05kR2RwLTRYLUIxREtJUEVRb01Md1U4WG8zdE5CWHR1LWNacmQ3c1oyOWMwTDVRc2RZT2RwMS1fMUE3SGNLeFpjMEY5aEV0RkVyY0NFUDJfZTlSY3ZpTWtPcUF5V255MWRtekdqMWoxOU01RExUTGtOY3Bp?oc=5,işletme,,Silivri ilçesi Büyükkılıçlı Mahallesi Çeberlitaş Sokak'ta bulunan hayvan üretim ve bakım merkezli bir iş yerinde yangın çıktı. Haber verilmesi üzerine olay itfaiye ekipleri sevk edildi. Olay yerine ulaşan ekiplerin müdahalesiyle yangın kontrol altına alın Silivri ilçesi Büyükkılıçlı Mahallesi Çeberlitaş Sokak'ta bulunan hayvan üretim ve bakım merkezli bir iş yerinde yangın çıktı. Haber verilmesi üzerine olay itfaiye ekipleri sevk edildi. Olay yerine ulaşan ekiplerin müdahalesiyle yangın kontrol altına alın Silivri ilçesi Büyükkılıçlı Mahallesi Çeberlitaş Sokak'ta bulunan hayvan üretim ve bakım merkezli bir iş yerinde yangın çıktı. Haber verilmesi üzerine olay itfaiye ekipleri sevk edildi. Olay yerine ulaşan ekiplerin müdahalesiyle yangın kontrol altına alın,İstanbul'da hayvancılık işletmesinde yangın İstanbul'da hayvancılık işletmesinde yangın Malatya Güncel Silivri ilçesi Büyükkılıçlı Mahallesi Çeberlitaş Sokak'ta bulunan hayvan üretim ve bakım merkezli bir iş yerinde yangın çıktı. Olay yerine ulaşan ekiplerin müdahalesiyle yangın kontrol altına alın Silivri ilçesi Büyükkılıçlı Mahallesi Çeberlitaş Sokak'ta bulunan hayvan üretim ve bakım merkezli bir iş yerinde yangın çıktı. Olay yerine ulaşan ekiplerin müdahalesiyle yangın kontrol altına alın,browser_full_article,https://www.malatyaguncel.com/istanbul-da-hayvancilik-isletmesinde-yangin-3098743h.htm,İstanbul,Silivri,Güncel Silivri ilçesi Büyükkılıçlı Mahallesi | alın Silivri ilçesi Büyükkılıçlı Mahallesi,,,,,firma yok | faaliyet/tesis yok,,,,maps araması yapılmadı,,,101.67,21
2026-07-03 04:23:58,yangın,Fiziksel Risk / Yangın,Ayvalı Çöp Depolama Alanında Yangın,Ayvalı Çöp Depolama Alanında Yangın darendepostasi.com,https://news.google.com/rss/articles/CBMihAFBVV95cUxPZTlfUmR3Rl91UFNWZGFHYVdWVjdSQ196OHZRNVZyY0F5bFJCSXRWQldqaDhOb3dGMlJ3MlJIUFBCYlo1Ynk0a18yOUdLU1ZibHNxVUUzYXlGc0JEMGYzMXpFdXBONVNaS29zQkUyZE5BVEp2bHhWNm1lMjZEYjZxUTdkOHI?oc=5,depo,depo,Ayvalı Çöp Depolama Alanında Yangın darendepostasi.com,Ayvalı Çöp Depolama Alanında Yangın Ayvalı Çöp Depolama Alanında Yangın darendepostasi.com Ayvalı Çöp Depolama Alanında Yangın darendepostasi.com,browser_failed,https://news.google.com/rss/articles/CBMihAFBVV95cUxPZTlfUmR3Rl91UFNWZGFHYVdWVjdSQ196OHZRNVZyY0F5bFJCSXRWQldqaDhOb3dGMlJ3MlJIUFBCYlo1Ynk0a18yOUdLU1ZibHNxVUUzYXlGc0JEMGYzMXpFdXBONVNaS29zQkUyZE5BVEp2bHhWNm1lMjZEYjZxUTdkOHI?oc=5&hl=tr&gl=TR&ceid=TR:tr,,,,,,,,il yok | ilçe yok | firma yok | faaliyet/tesis yok,,,,maps araması yapılmadı,,,39.54,22
