published,search_term,category,title,summary,link,matched_words,activity_type,raw_text,entity_source_text,article_fetch_status,resolved_article_url,city_candidates,district_candidates,neighborhood_candidates,street_candidates,facility_candidates,company_candidates,company_candidate_scores,entity_quality_note,maps_queries,maps_candidates,maps_best_guess,maps_status,maps_match_scores,maps_rejected_candidates,record_quality_score,duplicate_group_id
2026-07-17 07:57:38,iflas,İflas / Konkordato / Mali Sorun,Arifiye 1. Organize Sanayi Bölgesi'nde İflas Kararı: ART Giyim İçin Tasfiye Süreci Başladı,Arifiye 1. Organize Sanayi Bölgesi'nde İflas Kararı: ART Giyim İçin Tasfiye Süreci Başladı Arifiye'den Haber,https://news.google.com/rss/articles/CBMixgFBVV95cUxPOXBkRTdJa2g4Zy1RUjRsNXo3M2JIbS1qTExkWXpxQ2ZVYlRscGtHMjU3aGYtVkdZdG5UTEZ5U1FPTWtJSmpScTd6eWg1N2VDR2JXTDI4TU1iZlF6OG1nM0dkVmp4YmtDRmNieGJNQ2NRMGxfRTV2NHhoUVhsYjlEZTRNWmp5SjJHX1VUY1NydnhQazdrRE90WHBXYW9oT2NyMWJhUHJJajQ5RXV0YldwejFfbklMUkhMTnRQT2l4cEx1d3dsUGfSAdMBQVVfeXFMUERPbjBZRS1uazF5M0NjbjRCSXVkS0NGUFRBc3gtc0xQN19fNDViNzVKeHI2MmtJMEtMRV9KZ1FKQWlaWFNScllVVUJzV0RCNUo4RjU2T0k5TFVNWDF6S1BNbFpkMzJfNHpxaHVISnFTRW92ZXJRZnZxZlNoSnJEQVpOX3FpclNoQkxnRlJvZTkyMXBFZTZKd1oxdThxVjFMZ1JTRXFkZThoS1JQOXBRdHUtbHZoTVZaR3RKdEs1NU1sMjhxd3ZoYmczdUtIVDZpWUxzVQ?oc=5,"organize sanayi, sanayi",,Arifiye 1. Organize Sanayi Bölgesi'nde İflas Kararı: ART Giyim İçin Tasfiye Süreci Başladı Arifiye'den Haber,Arifiye 1. Organize Sanayi Bölgesi'nde İflas Kararı: ART Giyim İçin Tasfiye Süreci Başladı Arifiye 1. Organize Sanayi Bölgesi'nde İflas Kararı: ART Giyim İçin Tasfiye Süreci Başladı Arifiye'den Haber Organize Sanayi Bölgesi'nde İflas Kararı: ART Giyim İçin Tasfiye Süreci Başladı Arifiye'den Haber,summary_only,https://news.google.com/rss/articles/CBMixgFBVV95cUxPOXBkRTdJa2g4Zy1RUjRsNXo3M2JIbS1qTExkWXpxQ2ZVYlRscGtHMjU3aGYtVkdZdG5UTEZ5U1FPTWtJSmpScTd6eWg1N2VDR2JXTDI4TU1iZlF6OG1nM0dkVmp4YmtDRmNieGJNQ2NRMGxfRTV2NHhoUVhsYjlEZTRNWmp5SjJHX1VUY1NydnhQazdrRE90WHBXYW9oT2NyMWJhUHJJajQ5RXV0YldwejFfbklMUkhMTnRQT2l4cEx1d3dsUGfSAdMBQVVfeXFMUERPbjBZRS1uazF5M0NjbjRCSXVkS0NGUFRBc3gtc0xQN19fNDViNzVKeHI2MmtJMEtMRV9KZ1FKQWlaWFNScllVVUJzV0RCNUo4RjU2T0k5TFVNWDF6S1BNbFpkMzJfNHpxaHVISnFTRW92ZXJRZnZxZlNoSnJEQVpOX3FpclNoQkxnRlJvZTkyMXBFZTZKd1oxdThxVjFMZ1JTRXFkZThoS1JQOXBRdHUtbHZoTVZaR3RKdEs1NU1sMjhxd3ZoYmczdUtIVDZpWUxzVQ?oc=5&hl=en-US&gl=US&ceid=US:en,Sakarya,Arifiye,Arifiye,,,Organize Sanayi | ART Giyim,Organize Sanayi:292:body+summary+title | ART Giyim:284:body+summary+title,faaliyet/tesis yok,Organize Sanayi Arifiye Arifiye Sakarya Türkiye | ART Giyim Arifiye Arifiye Sakarya Türkiye,Organize Sanayi | Art Giyim,Organize Sanayi,firma adı + güvenli maps adayı var,100.0 | 100.0,,235.08,24
2026-07-17 07:15:00,iflas,İflas / Konkordato / Mali Sorun,OSB’deki o firma için iflas kararı verildi,OSB’deki o firma için iflas kararı verildi Haberlisin,https://news.google.com/rss/articles/CBMid0FVX3lxTE5PVlRJbTZHTFA0WGdWSGhyWDVEN0pnel8xVmJna05tNW9qdUhWbDdZOVFfcEN4RUVNV2xrQXBXbFdFRlNOSk00MU16aEtZLVZDRmRrS2pyaGtaSnVPQzJUUUZjQXltX0ZUZTBBRENWbHJMdE1SdG04?oc=5,"firma, osb",şirket / firma,"Sakarya’nın Arifiye ilçesinde 1. Organize Sanayi Bölgesi’nde bulunan ART Giyim firması için verilen konkordato tedbirleri kaldırılırken, şirketin iflasına karar verildi. Sakarya’nın Arifiye ilçesinde 1. Organize Sanayi Bölgesi’nde bulunan ART Giyim firması için verilen konkordato tedbirleri kaldırılırken, şirketin iflasına karar verildi. Sakarya’nın Arifiye ilçesinde 1. Organize Sanayi Bölgesi’nde bulunan ART Giyim firması için verilen konkordato tedbirleri kaldırılırken, şirketin iflasına karar verildi.","OSB’deki o firma için iflas kararı verildi OSB’deki o firma için iflas kararı verildi Haberlisin Sakarya’nın Arifiye ilçesinde 1. Organize Sanayi Bölgesi’nde bulunan ART Giyim firması için verilen konkordato tedbirleri kaldırılırken, şirketin iflasına karar verildi.",browser_full_article,https://www.haberlisin.com/osbdeki-o-firma-icin-iflas-karari-verildi,Sakarya,Arifiye,Arifiye,,,,,firma yok | faaliyet/tesis yok,,,,maps araması yapılmadı,,,87.34,25
2026-07-17 07:27:00,konkordato,İflas / Konkordato / Mali Sorun,İthalatın zirvesindeki Taban Gıda konkordato ilan etti,İthalatın zirvesindeki Taban Gıda konkordato ilan etti habererk.com,https://news.google.com/rss/articles/CBMimAFBVV95cUxPZzdJUDEtVDBLQzBTT18xV2g1ZC03Rm1tMjdOWlZqVUdPM0FPcVFaZzIyWGdwTkJNMVQ4NGxoZVM0dGQ1OUVWUEVIZ2NrVENTTFBVczBGa2dVUWRsRG55dkRXT1Z4VjVOb2YtZWZUQldfV3JkTzQxWUNLZ1RlYWZLd1dtZGlwWmV1eENsd0pHZWJYU1NBb1l1dg?oc=5,gıda,,İthalatın zirvesindeki Taban Gıda konkordato ilan etti habererk.com,İthalatın zirvesindeki Taban Gıda konkordato ilan etti İthalatın zirvesindeki Taban Gıda konkordato ilan etti habererk.com İthalatın zirvesindeki Taban Gıda konkordato ilan etti habererk.com,browser_failed,https://news.google.com/rss/articles/CBMimAFBVV95cUxPZzdJUDEtVDBLQzBTT18xV2g1ZC03Rm1tMjdOWlZqVUdPM0FPcVFaZzIyWGdwTkJNMVQ4NGxoZVM0dGQ1OUVWUEVIZ2NrVENTTFBVczBGa2dVUWRsRG55dkRXT1Z4VjVOb2YtZWZUQldfV3JkTzQxWUNLZ1RlYWZLd1dtZGlwWmV1eENsd0pHZWJYU1NBb1l1dg?oc=5&hl=tr&gl=TR&ceid=TR:tr,,,,,,Taban Gıda,Taban Gıda:292:body+summary+title,il yok | ilçe yok | faaliyet/tesis yok,,,,maps araması yapılmadı,,,116.42,26
2026-07-17 12:58:47,mali kriz,Banka / Finansal Kuruluş,İngiltere Merkez Bankası repo piyasasında daha sıkı kurallar istiyor,İngiltere Merkez Bankası repo piyasasında daha sıkı kurallar istiyor Paratic Haber,https://news.google.com/rss/articles/CBMikwFBVV95cUxOdHJOakw2U1ZIYXVhVDJvakZwQ1NSZHFvemNYMmZJbTM1UWM0T09xMEIxZy1sQV9JbFJhVW5fVno1OGxIbzlyRmVPOUJGaU1HLVcxdlhKbVVueEZOTHdsSjhKbmtKMFZmT1d2Rm1nLWI3WkE3QnBQbGNtdC1Hd3ZzWWUwTGNkUFNOYWYwZ0FOUHJwS1U?oc=5,banka,finansal kuruluş,İngiltere Merkez Bankası repo piyasasında daha sıkı kurallar istiyor Paratic Haber,İngiltere Merkez Bankası repo piyasasında daha sıkı kurallar istiyor İngiltere Merkez Bankası repo piyasasında daha sıkı kurallar istiyor Paratic Haber İngiltere Merkez Bankası repo piyasasında daha sıkı kurallar istiyor Paratic Haber,browser_failed,https://news.google.com/rss/articles/CBMikwFBVV95cUxOdHJOakw2U1ZIYXVhVDJvakZwQ1NSZHFvemNYMmZJbTM1UWM0T09xMEIxZy1sQV9JbFJhVW5fVno1OGxIbzlyRmVPOUJGaU1HLVcxdlhKbVVueEZOTHdsSjhKbmtKMFZmT1d2Rm1nLWI3WkE3QnBQbGNtdC1Hd3ZzWWUwTGNkUFNOYWYwZ0FOUHJwS1U?oc=5&hl=tr&gl=TR&ceid=TR:tr,,,,,,,,il yok | ilçe yok | firma yok | faaliyet/tesis yok,,,,maps araması yapılmadı,,,61.32,27
2026-07-17 18:15:32,MASAK,Kara Para / MASAK / Bahis,MASAK’tan Aklamayla Mücadelede Yeni Strateji Belgesi,MASAK’tan Aklamayla Mücadelede Yeni Strateji Belgesi alomaliye.com,https://news.google.com/rss/articles/CBMikwFBVV95cUxPSnZLMHE4TDNzNERpdG9JZWpsLU5WUmZWVXB3OVBtQkRib09NLVZRdjVuUHp4b2dLNmMwZm1KQ2JQVnNCdnBfVGdkVXlPUHF6d2FWUXlnMm0zSkZadDJuaktORDB6dW85Y0xiQ0pfV3MteEZGbW5JckNuakhKLU5aNHNGNUo2bzNqN0dyaXJldTkwQnfSAZgBQVVfeXFMTlBZa0ZhQWVUVkxlaTlLX2Q4YzVnOFA4bXZwd28zMnRNYWJXeVZLanZNc01fZjRnODFxcmkwOXA5TEZ3d3NpSklOVDQzT2FqZGNQUTM4clptZWJPQUxQV3FOMWNPZnRGYWNnOFluazVheFpjNXZUeFN3TmVnN0t3YjlJZEtGbk1WeG02RkVQbktwRUZZOXdrUkQ?oc=5,masak,,MASAK’tan Aklamayla Mücadelede Yeni Strateji Belgesi alomaliye.com,MASAK’tan Aklamayla Mücadelede Yeni Strateji Belgesi MASAK’tan Aklamayla Mücadelede Yeni Strateji Belgesi alomaliye.com MASAK’tan Aklamayla Mücadelede Yeni Strateji Belgesi alomaliye.com,browser_failed,https://news.google.com/rss/articles/CBMikwFBVV95cUxPSnZLMHE4TDNzNERpdG9JZWpsLU5WUmZWVXB3OVBtQkRib09NLVZRdjVuUHp4b2dLNmMwZm1KQ2JQVnNCdnBfVGdkVXlPUHF6d2FWUXlnMm0zSkZadDJuaktORDB6dW85Y0xiQ0pfV3MteEZGbW5JckNuakhKLU5aNHNGNUo2bzNqN0dyaXJldTkwQnfSAZgBQVVfeXFMTlBZa0ZhQWVUVkxlaTlLX2Q4YzVnOFA4bXZwd28zMnRNYWJXeVZLanZNc01fZjRnODFxcmkwOXA5TEZ3d3NpSklOVDQzT2FqZGNQUTM4clptZWJPQUxQV3FOMWNPZnRGYWNnOFluazVheFpjNXZUeFN3TmVnN0t3YjlJZEtGbk1WeG02RkVQbktwRUZZOXdrUkQ?oc=5&hl=tr&gl=TR&ceid=TR:tr,,,,,,,,il yok | ilçe yok | firma yok | faaliyet/tesis yok,,,,maps araması yapılmadı,,,51.16,28
2026-07-17 07:33:11,MASAK,Kara Para / MASAK / Bahis,"Oğuzhan Uğur’un ""gerçek faydalanıcısı"" olduğu Babala TV’nin banka hesabına yurt dışından gelen yüklü bir miktar döviz nedeniyle, özel bir bankanın MASAK’a şüpheli işlem bildiriminde bulunduğu öğrenildi. İhlas Haber Ajansı","Oğuzhan Uğur’un ""gerçek faydalanıcısı"" olduğu Babala TV’nin banka hesabına yurt dışından gelen yüklü bir miktar döviz nedeniyle, özel bir bankanın MASAK’a şüpheli işlem bildiriminde bulunduğu öğrenildi. İhlas Haber Ajansı İhlas Haber Ajansı",https://news.google.com/rss/articles/CBMi4wJBVV95cUxOdGI2aElEWFJYa3lONzRFbmk3WEhqOG9XN0lkNnFFQjZZeXlCZklJdkRrdDFXUERMZWg0SWl4d2xjV3JpejROTHJXVFNXcFkzcGIwUDBPLXBqZmlPWlRXQ2o5TVlHT0hCZ1pkMW9wNUtYVHdDTXZtWldVcXJwUXNBUk1rbDJPWGFZOFFfd3NBNXVNRjA1SE1CTWxHQkg5VUw0X1l4S1lRTFpNc0xycG1lM2tUTWdOSXptbEVWQlhxdWJPenBwRERZakdMVkRqODlRbVN3RS1uR2hzOGt4UGRBT3FYSy1pTmEwUXpLRm85TTZHMHhfOGphRTk1WVVpeHdFZVYxb3I5YWNCX24xZEo4Ti1zXzBCbGJTNUNXX1RWM0JaLWpLUVRJLWhCZXVVbUQySFJmckdRZ29oUFFzMXItN3lldHRtSWtBN2tRT2VLNVlLdm5ISXo1ODBmV216Mk5FNHpR?oc=5,"banka, banka hesabı, masak, şüpheli işlem",finansal kuruluş,"Oğuzhan Uğur’un ""gerçek faydalanıcısı"" olduğu Babala TV’nin banka hesabına yurt dışından gelen yüklü bir miktar döviz nedeniyle, özel bir bankanın MASAK’a şüpheli işlem bildiriminde bulunduğu öğrenildi. İhlas Haber Ajansı İhlas Haber Ajansı","Oğuzhan Uğur’un ""gerçek faydalanıcısı"" olduğu Babala TV’nin banka hesabına yurt dışından gelen yüklü bir miktar döviz nedeniyle, özel bir bankanın MASAK’a şüpheli işlem bildiriminde bulunduğu öğrenildi. İhlas Haber Ajansı Oğuzhan Uğur’un ""gerçek faydalanıcısı"" olduğu Babala TV’nin banka hesabına yurt dışından gelen yüklü bir miktar döviz nedeniyle, özel bir bankanın MASAK’a şüpheli işlem bildiriminde bulunduğu öğrenildi. İhlas Haber Ajansı İhlas Haber Ajansı Oğuzhan Uğur’un ""gerçek faydalanıcısı"" olduğu Babala TV’nin banka hesabına yurt dışından gelen yüklü bir miktar döviz nedeniyle, özel bir bankanın MASAK’a şüpheli işlem bildiriminde bulunduğu öğrenildi. İhlas Haber Ajansı İhlas Haber Ajansı",browser_failed,https://news.google.com/rss/articles/CBMi4wJBVV95cUxOdGI2aElEWFJYa3lONzRFbmk3WEhqOG9XN0lkNnFFQjZZeXlCZklJdkRrdDFXUERMZWg0SWl4d2xjV3JpejROTHJXVFNXcFkzcGIwUDBPLXBqZmlPWlRXQ2o5TVlHT0hCZ1pkMW9wNUtYVHdDTXZtWldVcXJwUXNBUk1rbDJPWGFZOFFfd3NBNXVNRjA1SE1CTWxHQkg5VUw0X1l4S1lRTFpNc0xycG1lM2tUTWdOSXptbEVWQlhxdWJPenBwRERZakdMVkRqODlRbVN3RS1uR2hzOGt4UGRBT3FYSy1pTmEwUXpLRm85TTZHMHhfOGphRTk1WVVpeHdFZVYxb3I5YWNCX24xZEo4Ti1zXzBCbGJTNUNXX1RWM0JaLWpLUVRJLWhCZXVVbUQySFJmckdRZ29oUFFzMXItN3lldHRtSWtBN2tRT2VLNVlLdm5ISXo1ODBmV216Mk5FNHpR?oc=5&hl=tr&gl=TR&ceid=TR:tr,,,,,,,,il yok | ilçe yok | firma yok | faaliyet/tesis yok,,,,maps araması yapılmadı,,,186.9,29
2026-07-17 18:15:45,MASAK,Kara Para / MASAK / Bahis,Ahbap Derneği MASAK incelemesinde,Ahbap Derneği MASAK incelemesinde ATV,https://news.google.com/rss/articles/CBMikgFBVV95cUxNTzdnSExHY2psWUxNcG9ZQzRiMVFzMmYwZVhrZmpVeWNDX3U4bFg5RFByZEdIbDZzaTc4c0J0aGVmYnBSUi11cGtybVIxXzRTdUJ1RXhNUkpsN3BsR2hFZUF6VlVubVB0NDJMb01JbEN6ejNWS2NGNTBBSUw1ZVl0YkRaNFV2VDRPOUZibXJRRnEzZw?oc=5,masak,,Ahbap Derneği MASAK incelemesinde ATV,Ahbap Derneği MASAK incelemesinde Ahbap Derneği MASAK incelemesinde ATV Ahbap Derneği MASAK incelemesinde ATV,browser_failed,https://news.google.com/rss/articles/CBMikgFBVV95cUxNTzdnSExHY2psWUxNcG9ZQzRiMVFzMmYwZVhrZmpVeWNDX3U4bFg5RFByZEdIbDZzaTc4c0J0aGVmYnBSUi11cGtybVIxXzRTdUJ1RXhNUkpsN3BsR2hFZUF6VlVubVB0NDJMb01JbEN6ejNWS2NGNTBBSUw1ZVl0YkRaNFV2VDRPOUZibXJRRnEzZw?oc=5&hl=tr&gl=TR&ceid=TR:tr,,,,,,,,il yok | ilçe yok | firma yok | faaliyet/tesis yok,,,,maps araması yapılmadı,,,34.12,30
2026-07-17 08:33:00,MASAK,Kara Para / MASAK / Bahis,Oğuzhan Uğur'un Babala TV'si için MASAK harekete geçti: Hesaba yüklü döviz gelmiş,Oğuzhan Uğur'un Babala TV'si için MASAK harekete geçti: Hesaba yüklü döviz gelmiş Kamudan Haber,https://news.google.com/rss/articles/CBMisAFBVV95cUxNNEVYeThBNkxVeEc5aDhZSVBlYi1oX2w3QkdlSEpHMDF3V0thSW90RE5ucGF1dzg4YmdYWnlQbEhEdjBxYWRxN1hlQnZET1FUd0xmczN3OHdPQXpkNThUdjNLNFNfR1ZaV1hKbWxIUWtTa0djcHktZzZ2QVdpd1VwbWNjVzhKRFNsQzlPaU1ieUw3dGdBc2R5S0pDOXZ2VzBxQnQ4OWpwVnVEdjVDTVA3YtIBsAFBVV95cUxNNEVYeThBNkxVeEc5aDhZSVBlYi1oX2w3QkdlSEpHMDF3V0thSW90RE5ucGF1dzg4YmdYWnlQbEhEdjBxYWRxN1hlQnZET1FUd0xmczN3OHdPQXpkNThUdjNLNFNfR1ZaV1hKbWxIUWtTa0djcHktZzZ2QVdpd1VwbWNjVzhKRFNsQzlPaU1ieUw3dGdBc2R5S0pDOXZ2VzBxQnQ4OWpwVnVEdjVDTVA3Yg?oc=5,masak,,"Ahbap Derneği'ne yönelik yürütülen soruşturma kapsamında yeni bir gelişme yaşandı. Soruşturma kapsamında sunucu ve müzisyen Oğuzhan Uğur'un da aralarında bulunduğu bazı kişiler hakkında gözaltı işlemi uygulanırken, Babala TV'nin banka hesabına ilişkin bir finansal hareketin MASAK incelemesine konu olduğu bildirildi. Edinilen bilgilere göre, Oğuzhan Uğur'un ""gerçek faydalanıcısı"" olduğu belirtilen Babala TV hesabına yurt dışından gelen yüksek tutarlı döviz transferi nedeniyle bir özel banka tarafından MASAK'a şüpheli işlem bildirimi yapıldığı öne sürüldü. İstanbul Emniyet Müdürlüğü Mali Suçlarla Mücadele Şube Müdürlüğü ekipleri tarafından gerçekleştirilen operasyon kapsamında, Ahbap Derneği ile bağlantılı çalışmalar nedeniyle daha önce kamuoyunda gündeme gelen Oğuzhan Uğur'un da aralarında bulunduğu 9 kişi hakkında gözaltı kararı verildi. Şüphelilerden 7'sinin yakalandığı, diğer iki kişinin yakalanması için çalışmaların sürdüğü belirtildi. Operasyon kapsamında şüphelilerin adreslerinde arama yapılırken, gözaltına alınan kişilerin emniyetteki işlemlerinin devam ettiği öğrenildi. Ahbap soruşturmasında önceki operasyon Ahbap Derneği'ne yönelik soruşturmanın önceki aşamasında aralarında dernek kurucusu Haluk Levent'in de bulunduğu çok sayıda kişi hakkında işlem yapılmıştı. Soruşturma kapsamında bazı şüpheliler tutuklanırken, bazıları hakkında adli kontrol tedbiri uygulanmıştı. Dosya kapsamında yer alan iddialar; dernek faaliyetleri, para hareketleri ve mali işlemler üzerine yoğunlaşıyor. Şüpheliler hakkındaki suçlamalar ve finansal işlemlere ilişkin değerlendirmeler, devam eden soruşturma ve yargı süreci sonucunda kesinlik kazanacak. Oğuzhan Uğur'un Babala TV'si için MASAK harekete geçti: Hesaba yüklü döviz gelmiş Ahbap Derneği'ne yönelik yürütülen soruşturma kapsamında yeni bir gelişme yaşandı. Soruşturma kapsamında sunucu ve müzisyen Oğuzhan Uğur'un da aralarında bulunduğu bazı kişiler hakkında gözaltı işlemi uygulanırken, Babala TV'nin banka hesabına ilişkin bir finansal hareketin MASAK incelemesine konu olduğu bildirildi. Ahbap soruşturmasında önceki operasyon Edinilen bilgilere göre, Oğuzhan Uğur'un ""gerçek faydalanıcısı"" olduğu belirtilen Babala TV hesabına yurt dışından gelen yüksek tutarlı döviz transferi nedeniyle bir özel banka tarafından MASAK'a şüpheli işlem bildirimi yapıldığı öne sürüldü. İstanbul Emniyet Müdürlüğü Mali Suçlarla Mücadele Şube Müdürlüğü ekipleri tarafından gerçekleştirilen operasyon kapsamında, Ahbap Derneği ile bağlantılı çalışmalar nedeniyle daha önce kamuoyunda gündeme gelen Oğuzhan Uğur'un da aralarında bulunduğu 9 kişi hakkında gözaltı kararı verildi. Şüphelilerden 7'sinin yakalandığı, diğer iki kişinin yakalanması için çalışmaların sürdüğü belirtildi. Operasyon kapsamında şüphelilerin adreslerinde arama yapılırken, gözaltına alınan kişilerin emniyetteki işlemlerinin devam ettiği öğrenildi. Ahbap Derneği'ne yönelik soruşturmanın önceki aşamasında aralarında dernek kurucusu Haluk Levent'in de bulunduğu çok sayıda kişi hakkında işlem yapılmıştı. Soruşturma kapsamında bazı şüpheliler tutuklanırken, bazıları hakkında adli kontrol tedbiri uygulanmıştı. Dosya kapsamında yer alan iddialar; dernek faaliyetleri, para hareketleri ve mali işlemler üzerine yoğunlaşıyor. Şüpheliler hakkındaki suçlamalar ve finansal işlemlere ilişkin değerlendirmeler, devam eden soruşturma ve yargı süreci sonucunda kesinlik kazanacak.","Oğuzhan Uğur'un Babala TV'si için MASAK harekete geçti: Hesaba yüklü döviz gelmiş Oğuzhan Uğur'un Babala TV'si için MASAK harekete geçti: Hesaba yüklü döviz gelmiş Kamudan Haber Ahbap Derneği'ne yönelik yürütülen soruşturma kapsamında yeni bir gelişme yaşandı. Soruşturma kapsamında sunucu ve müzisyen Oğuzhan Uğur'un da aralarında bulunduğu bazı kişiler hakkında gözaltı işlemi uygulanırken, Babala TV'nin banka hesabına ilişkin bir finansal hareketin MASAK incelemesine konu olduğu bildirildi. Edinilen bilgilere göre, Oğuzhan Uğur'un ""gerçek faydalanıcısı"" olduğu belirtilen Babala TV hesabına yurt dışından gelen yüksek tutarlı döviz transferi nedeniyle bir özel banka tarafından MASAK'a şüpheli işlem bildirimi yapıldığı öne sürüldü. İstanbul Emniyet Müdürlüğü Mali Suçlarla Mücadele Şube Müdürlüğü ekipleri tarafından gerçekleştirilen operasyon kapsamında, Ahbap Derneği ile bağlantılı çalışmalar nedeniyle daha önce kamuoyunda gündeme gelen Oğuzhan Uğur'un da aralarında bulunduğu 9 kişi hakkında gözaltı kararı verildi. Şüphelilerden 7'sinin yakalandığı, diğer iki kişinin yakalanması için çalışmaların sürdüğü belirtildi. Operasyon kapsamında şüphelilerin adreslerinde arama yapılırken, gözaltına alınan kişilerin emniyetteki işlemlerinin devam ettiği öğrenildi. Ahbap soruşturmasında önceki operasyon Ahbap Derneği'ne yönelik soruşturmanın önceki aşamasında aralarında dernek kurucusu Haluk Levent'in de bulunduğu çok sayıda kişi hakkında işlem yapılmıştı. Soruşturma kapsamında bazı şüpheliler tutuklanırken, bazıları hakkında adli kontrol tedbiri uygulanmıştı. Dosya kapsamında yer alan iddialar; dernek faaliyetleri, para hareketleri ve mali işlemler üzerine yoğunlaşıyor. Şüpheliler hakkındaki suçlamalar ve finansal işlemlere ilişkin değerlendirmeler, devam eden soruşturma ve yargı süreci sonucunda kesinlik kazanacak. Oğuzhan Uğur'un Babala TV'si için MASAK harekete geçti: Hesaba yüklü döviz gelmiş Ahbap Derneği'ne yönelik yürütülen soruşturma kapsamında yeni bir gelişme yaşandı. Ahbap soruşturmasında önceki operasyon Edinilen bilgilere göre, Oğuzhan Uğur'un ""gerçek faydalanıcısı"" olduğu belirtilen Babala TV hesabına yurt dışından gelen yüksek tutarlı döviz transferi nedeniyle bir özel banka tarafından MASAK'a şüpheli işlem bildirimi yapıldığı öne sürüldü. Ahbap Derneği'ne yönelik soruşturmanın önceki aşamasında aralarında dernek kurucusu Haluk Levent'in de bulunduğu çok sayıda kişi hakkında işlem yapılmıştı.",browser_full_article_dom,https://news.google.com/rss/articles/CBMisAFBVV95cUxNNEVYeThBNkxVeEc5aDhZSVBlYi1oX2w3QkdlSEpHMDF3V0thSW90RE5ucGF1dzg4YmdYWnlQbEhEdjBxYWRxN1hlQnZET1FUd0xmczN3OHdPQXpkNThUdjNLNFNfR1ZaV1hKbWxIUWtTa0djcHktZzZ2QVdpd1VwbWNjVzhKRFNsQzlPaU1ieUw3dGdBc2R5S0pDOXZ2VzBxQnQ4OWpwVnVEdjVDTVA3YtIBsAFBVV95cUxNNEVYeThBNkxVeEc5aDhZSVBlYi1oX2w3QkdlSEpHMDF3V0thSW90RE5ucGF1dzg4YmdYWnlQbEhEdjBxYWRxN1hlQnZET1FUd0xmczN3OHdPQXpkNThUdjNLNFNfR1ZaV1hKbWxIUWtTa0djcHktZzZ2QVdpd1VwbWNjVzhKRFNsQzlPaU1ieUw3dGdBc2R5S0pDOXZ2VzBxQnQ4OWpwVnVEdjVDTVA3Yg?oc=5&hl=tr&gl=TR&ceid=TR:tr,İstanbul,,Levent,,,,,ilçe yok | firma yok | faaliyet/tesis yok,,,,maps araması yapılmadı,,,127.25,31
2026-07-17 09:28:00,MASAK,Kara Para / MASAK / Bahis,Babala TV Hesabına Yurt Dışından Yüklü Miktarda Döviz! MASAK'a Şüpheli İşlem Bildirimi,Babala TV Hesabına Yurt Dışından Yüklü Miktarda Döviz! MASAK'a Şüpheli İşlem Bildirimi Beyaz Gazete,https://news.google.com/rss/articles/CBMi1AFBVV95cUxNVHRqamhua09JS1ZwQVVNOWQ4NGRXa0tsdmZTNGl5UUx2X04xODNjMWJlVTVkdWpKYVhzOG5HRm1MVk1TckVuUjllR3MzcXJXSHg0YkE0ZDNxMlYydVdLLW5Eb0dYZV96ajRtamJ6SGp3V1Joa3FJMG82Mjk2Vy1GVE1rVWdrRU9oa2F0b0NvS1RyNm9pQ2ZwMjV6a1lMY0NDSTI4VnZQYmRRb1BGZnRxU0JSekx0VmVxVnp3NGoyM19aX3J6SVd4M3dOQXlHbnh1WDlBVQ?oc=5,masak,,"AHBAP Derneği’ne yönelik bir operasyon daha yapıldı. AHBAP Derneği ile yürüttüğü çalışmalar nedeniyle bir dönem eleştirilerin hedefi olan sunucu ve müzisyen Oğuzhan Uğur’un da aralarında olduğu 9 kişi hakkında gözaltı kararı verildi. 7 kişi gözaltına alındı. Öte yandan; Oğuzhan Uğur’un “gerçek faydalanıcısı” olduğu Babala TV’nin banka hesabına yurt dışından gelen yüklü bir miktar döviz nedeniyle, özel bir bankanın MASAK’a şüpheli işlem bildiriminde bulunduğu öğrenildi., AHBAP Derneği’ne yönelik bir operasyon daha yapıldı. AHBAP Derneği ile yürüttüğü çalışmalar nedeniyle bir dönem eleştirilerin hedefi olan sunucu ve müzisyen Oğuzhan Uğur’un da aralarında olduğu 9 kişi hakkında gözaltı kararı verildi. 7 kişi gözaltına alındı. Öte yandan; Oğuzhan Uğur’un “gerçek faydalanıcısı” olduğu Babala TV’nin banka hesabına yurt dışından gelen yüklü bir miktar döviz nedeniyle, özel bir bankanın MASAK’a şüpheli işlem bildiriminde bulunduğu öğrenildi., AHBAP Derneği’ne yönelik bir operasyon daha yapıldı. AHBAP Derneği ile yürüttüğü çalışmalar nedeniyle bir dönem eleştirilerin hedefi olan sunucu ve müzisyen Oğuzhan Uğur’un da aralarında olduğu 9 kişi hakkında gözaltı kararı verildi. 7 kişi gözaltına alındı. Öte yandan; Oğuzhan Uğur’un “gerçek faydalanıcısı” olduğu Babala TV’nin banka hesabına yurt dışından gelen yüklü bir miktar döviz nedeniyle, özel bir bankanın MASAK’a şüpheli işlem bildiriminde bulunduğu öğrenildi.","Babala TV Hesabına Yurt Dışından Yüklü Miktarda Döviz! MASAK'a Şüpheli İşlem Bildirimi Babala TV Hesabına Yurt Dışından Yüklü Miktarda Döviz! MASAK'a Şüpheli İşlem Bildirimi Beyaz Gazete AHBAP Derneği’ne yönelik bir operasyon daha yapıldı. Öte yandan; Oğuzhan Uğur’un “gerçek faydalanıcısı” olduğu Babala TV’nin banka hesabına yurt dışından gelen yüklü bir miktar döviz nedeniyle, özel bir bankanın MASAK’a şüpheli işlem bildiriminde bulunduğu öğrenildi., AHBAP Derneği’ne yönelik bir operasyon daha yapıldı. Öte yandan; Oğuzhan Uğur’un “gerçek faydalanıcısı” olduğu Babala TV’nin banka hesabına yurt dışından gelen yüklü bir miktar döviz nedeniyle, özel bir bankanın MASAK’a şüpheli işlem bildiriminde bulunduğu öğrenildi.",browser_full_article,https://beyazgazete.com/haber/2026/7/17/babala-tv-hesabina-yurt-disindan-yuklu-miktarda-doviz-masak-a-supheli-islem-bildirimi-7174724.html,,,,,,,,il yok | ilçe yok | firma yok | faaliyet/tesis yok,,,,maps araması yapılmadı,,,97.98,32
2026-07-17 13:57:51,MASAK,Kara Para / MASAK / Bahis,Oğuzhan Uğur'un bağlantılı olduğu Babala TV hakkında MASAK bildirimi iddiası,Oğuzhan Uğur'un bağlantılı olduğu Babala TV hakkında MASAK bildirimi iddiası Söz Bursa,https://news.google.com/rss/articles/CBMitgFBVV95cUxQTVZ3aW5KOFpVZVZfSXRCMzJFZ2VQLVZXb29EWkxjeWFqOXhuWERQN2MxTWJ1VE5HaERxT2FtUWRkbkxDNlZtQ1dGYkVyUTNRNENfYkpUQVhSWjVWSUtydkEyQjNlWXZlNlY3NnhldDN0TWFzU0JHc2psSkNCMnZzZFlZNnhoMWpVaG1LM3o3elJlQmlsbE82M0dwNVRCdGJTb0UtdTgxdWlweDRFeGtCSTN1RUJSdw?oc=5,masak,,Oğuzhan Uğur'un bağlantılı olduğu Babala TV hakkında MASAK bildirimi iddiası Söz Bursa,Oğuzhan Uğur'un bağlantılı olduğu Babala TV hakkında MASAK bildirimi iddiası Oğuzhan Uğur'un bağlantılı olduğu Babala TV hakkında MASAK bildirimi iddiası Söz Bursa Oğuzhan Uğur'un bağlantılı olduğu Babala TV hakkında MASAK bildirimi iddiası Söz Bursa,browser_failed,https://www.sozbursa.com/gundem/oguzhan-ugur-un-baglantili-oldugu-babala-tv-hakkinda-masak-bildirimi-iddiasi-331766,,,,,,,,il yok | ilçe yok | firma yok | faaliyet/tesis yok,,,,maps araması yapılmadı,,,76.36,33
