published,search_term,category,title,summary,link,matched_words,activity_type,raw_text,entity_source_text,article_fetch_status,resolved_article_url,city_candidates,district_candidates,neighborhood_candidates,street_candidates,facility_candidates,company_candidates,company_candidate_scores,entity_quality_note,maps_queries,maps_candidates,maps_best_guess,maps_status,maps_match_scores,maps_rejected_candidates,record_quality_score,duplicate_group_id
2026-07-17 14:09:38,fabrika yangını,Fiziksel Risk / Yangın,Eskişehir OSB’de Fabrika Yangını: İncelemeler Başladı,Eskişehir OSB’de Fabrika Yangını: İncelemeler Başladı bolgegundemi.com,https://news.google.com/rss/articles/CBMiowFBVV95cUxQRUxJWGNVMWR0c1JITzNlZFVVenhaZ181XzczNmhENUFjcjQtSjBkRFp4QVBSakZLWmxYdHE2eGRGMnJJdzVQSldTRjhpTkl3eE1oMGFxLW9QdjZsenRKNUZRQzZKdmNjYXdheXlPUzZjMmpiVUp2SllOV3otTjRNSlZVTEZvbUN2R1NQbUQ2MV9kdTJyWERvN0RSN0ZhVHRVTDl3?oc=5,"fabrika, osb",fabrika,Eskişehir OSB’de Fabrika Yangını: İncelemeler Başladı bolgegundemi.com,Eskişehir OSB’de Fabrika Yangını: İncelemeler Başladı Eskişehir OSB’de Fabrika Yangını: İncelemeler Başladı bolgegundemi.com Eskişehir OSB’de Fabrika Yangını: İncelemeler Başladı bolgegundemi.com,browser_timeout,https://news.google.com/rss/articles/CBMiowFBVV95cUxQRUxJWGNVMWR0c1JITzNlZFVVenhaZ181XzczNmhENUFjcjQtSjBkRFp4QVBSakZLWmxYdHE2eGRGMnJJdzVQSldTRjhpTkl3eE1oMGFxLW9QdjZsenRKNUZRQzZKdmNjYXdheXlPUzZjMmpiVUp2SllOV3otTjRNSlZVTEZvbUN2R1NQbUQ2MV9kdTJyWERvN0RSN0ZhVHRVTDl3?oc=5&hl=en-US&gl=US&ceid=US:en,Eskişehir,,Eskişehir OSB | İncelemeler Başladı Eskişehir OSB,,,,,ilçe yok | firma yok | faaliyet/tesis yok,,,,maps araması yapılmadı,,,84.7,1
2026-07-18 10:08:16,yangın,Fiziksel Risk / Yangın,İran saldırısında Kuveyt’teki elektrik ve su tesisinde yangın çıktı,İran saldırısında Kuveyt’teki elektrik ve su tesisinde yangın çıktı Bloomberght,https://news.google.com/rss/articles/CBMipAFBVV95cUxNdkpROThvWHFqN0UtbE9lNWgtWjBNT0p1M3BLMnF5SDRXWEpFNHBhcU9GX0ZLWVF5RVQ0YktVaDBaY0ZUQmVNdmJobWQ3NnlMT21FTE43dWRPOXZzY3oyU2N3ZDhqaElBVkFmdHpYendJVE0wWFBsSkRqM3pXX2FHdkM5LWh6eW8xVjdLUnN2UkdiMV92SmtrMVlDZTgwdnZwdm5MSw?oc=5,tesis,,"Kuveyt Elektrik, Su ve Yenilenebilir Enerji Bakanlığı, İran’ın saldırısında elektrik üretimi ve su arıtma tesislerinden birinin hedef alındığını, tesiste yangın çıktığını açıkladı. Kuveyt Elektrik, Su ve Yenilenebilir Enerji Bakanlığı, İran’ın saldırısında elektrik üretimi ve su arıtma tesislerinden birinin hedef alındığını, tesiste yangın çıktığını açıkladı. Kuveyt Elektrik, Su ve Yenilenebilir Enerji Bakanlığı, İran’ın saldırısında elektrik üretimi ve su arıtma tesislerinden birinin hedef alındığını, tesiste yangın çıktığını açıkladı. Bloomberg HT Haberler İran saldırısında Kuveyt’teki elektrik ve su tesisinde yangın çıktı İran saldırısında Kuveyt'teki elektrik ve su tesisinde yangın çıktı Kuveyt Elektrik, Su ve Yenilenebilir Enerji Bakanlığı, İran'ın saldırısında elektrik üretimi ve su arıtma tesislerinden birinin hedef alındığını, tesiste yangın çıktığını açıkladı. Türkiye'nin ekonomi platformu Bloomberg HT'yi Google listesine ekleyin 18 Temmuz 2026, 13:08 Güncelleme : 18 Temmuz 2026, 13:08 Kuveyt Elektrik, Su ve Yenilenebilir Enerji Bakanlığının, ABD merkezli X şirketinin hesabından yapılan açıklamada, İran’ın Kuveyt’e yönelik saldırısı kapsamında elektrik üretimi ve su arıtma tesislerinden birinin “düşman saldırısına” maruz kaldığı belirtildi. Saldırı sonucu tesiste yangın çıktığı aktarılan açıklamada, santralin güvenliğinin ve elektrik şebekesinin istikrarının korunması amacıyla bazı üretim ünitelerinin tedbiren devre dışı bırakıldığı kaydedildi. Bakanlığın acil durum planlarını devreye aldığı, yangını söndürme ve tesiste onarım çalışmalarının sürdüğü bildirildi. Açıklamada ayrıca vatandaşlardan, özellikle 11.00 ile 17.00 saatleri arasında elektrik tüketimini azaltmaları istendi. İlgili Haberler Yabancı yatırımcının tahvil alımı altı ayın zirvesinde Döviz mevduatları artışa geçti ABD'de konut başlangıçları toparlandı Almanya, Commerzbank konusunda Unicredit ile görüşmelere hazırlanıyor Bankacılık sektörü toplam mevduatında artış Konutta reel kayıp yedinci ayında Konutta yılın en yüksek aylık satışı Mevcut ve yeni kiracı enflasyon makası kapanmadı Kısa vadeli dış borç stokunda artış Bloomberg Businessweek Türkiye'nin 139. sayısı çıktı Fed faiz artışına yönelik pozisyonlar kapatılıyor Küresel piyasalarda 'teknolojik' satış Yabancı yatırımcının tahvil alımı altı ayın zirvesinde Döviz mevduatları artışa geçti ABD'de konut başlangıçları toparlandı Almanya, Commerzbank konusunda Unicredit ile görüşmelere hazırlanıyor Bankacılık sektörü toplam mevduatında artış Konutta reel kayıp yedinci ayında Konutta yılın en yüksek aylık satışı Mevcut ve yeni kiracı enflasyon makası kapanmadı Kısa vadeli dış borç stokunda artış Bloomberg Businessweek Türkiye'nin 139. sayısı çıktı Fed faiz artışına yönelik pozisyonlar kapatılıyor Küresel piyasalarda 'teknolojik' satış Kuveyt Elektrik, Su ve Yenilenebilir Enerji Bakanlığının, ABD merkezli X şirketinin hesabından yapılan açıklamada, İran’ın Kuveyt’e yönelik saldırısı kapsamında elektrik üretimi ve su arıtma tesislerinden birinin “düşman saldırısına” maruz kaldığı belirtildi. Saldırı sonucu tesiste yangın çıktığı aktarılan açıklamada, santralin güvenliğinin ve elektrik şebekesinin istikrarının korunması amacıyla bazı üretim ünitelerinin tedbiren devre dışı bırakıldığı kaydedildi. Bakanlığın acil durum planlarını devreye aldığı, yangını söndürme ve tesiste onarım çalışmalarının sürdüğü bildirildi. Açıklamada ayrıca vatandaşlardan, özellikle 11.00 ile 17.00 saatleri arasında elektrik tüketimini azaltmaları istendi. Yabancı yatırımcının tahvil alımı altı ayın zirvesinde Döviz mevduatları artışa geçti ABD'de konut başlangıçları toparlandı Almanya, Commerzbank konusunda Unicredit ile görüşmelere hazırlanıyor Bankacılık sektörü toplam mevduatında artış Konutta reel kayıp yedinci ayında Konutta yılın en yüksek aylık satışı Mevcut ve yeni kiracı enflasyon makası kapanmadı Kısa vadeli dış borç stokunda artış Bloomberg Businessweek Türkiye'nin 139. sayısı çıktı Fed faiz artışına yönelik pozisyonlar kapatılıyor Küresel piyasalarda 'teknolojik' satış İran saldırısında Kuveyt'teki elektrik ve su tesisinde yangın çıktı Kuveyt Elektrik, Su ve Yenilenebilir Enerji Bakanlığı, İran'ın saldırısında elektrik üretimi ve su arıtma tesislerinden birinin hedef alındığını, tesiste yangın çıktığını açıkladı. Kuveyt Elektrik, Su ve Yenilenebilir Enerji Bakanlığının, ABD merkezli X şirketinin hesabından yapılan açıklamada, İran’ın Kuveyt’e yönelik saldırısı kapsamında elektrik üretimi ve su arıtma tesislerinden birinin “düşman saldırısına” maruz kaldığı belirtildi. Saldırı sonucu tesiste yangın çıktığı aktarılan açıklamada, santralin güvenliğinin ve elektrik şebekesinin istikrarının korunması amacıyla bazı üretim ünitelerinin tedbiren devre dışı bırakıldığı kaydedildi. Bakanlığın acil durum planlarını devreye aldığı, yangını söndürme ve tesiste onarım çalışmalarının sürdüğü bildirildi. Açıklamada ayrıca vatandaşlardan, özellikle 11.00 ile 17.00 saatleri arasında elektrik tüketimini azaltmaları istendi.","İran saldırısında Kuveyt’teki elektrik ve su tesisinde yangın çıktı İran saldırısında Kuveyt’teki elektrik ve su tesisinde yangın çıktı Bloomberght Kuveyt Elektrik, Su ve Yenilenebilir Enerji Bakanlığı, İran’ın saldırısında elektrik üretimi ve su arıtma tesislerinden birinin hedef alındığını, tesiste yangın çıktığını açıkladı. Bloomberg HT Haberler İran saldırısında Kuveyt’teki elektrik ve su tesisinde yangın çıktı İran saldırısında Kuveyt'teki elektrik ve su tesisinde yangın çıktı Kuveyt Elektrik, Su ve Yenilenebilir Enerji Bakanlığı, İran'ın saldırısında elektrik üretimi ve su arıtma tesislerinden birinin hedef alındığını, tesiste yangın çıktığını açıkladı. Türkiye'nin ekonomi platformu Bloomberg HT'yi Google listesine ekleyin 18 Temmuz 2026, 13:08 Güncelleme : 18 Temmuz 2026, 13:08 Kuveyt Elektrik, Su ve Yenilenebilir Enerji Bakanlığının, ABD merkezli X şirketinin hesabından yapılan açıklamada, İran’ın Kuveyt’e yönelik saldırısı kapsamında elektrik üretimi ve su arıtma tesislerinden birinin “düşman saldırısına” maruz kaldığı belirtildi. Saldırı sonucu tesiste yangın çıktığı aktarılan açıklamada, santralin güvenliğinin ve elektrik şebekesinin istikrarının korunması amacıyla bazı üretim ünitelerinin tedbiren devre dışı bırakıldığı kaydedildi. Bakanlığın acil durum planlarını devreye aldığı, yangını söndürme ve tesiste onarım çalışmalarının sürdüğü bildirildi. Açıklamada ayrıca vatandaşlardan, özellikle 11.00 ile 17.00 saatleri arasında elektrik tüketimini azaltmaları istendi. İlgili Haberler Yabancı yatırımcının tahvil alımı altı ayın zirvesinde Döviz mevduatları artışa geçti ABD'de konut başlangıçları toparlandı Almanya, Commerzbank konusunda Unicredit ile görüşmelere hazırlanıyor Bankacılık sektörü toplam mevduatında artış Konutta reel kayıp yedinci ayında Konutta yılın en yüksek aylık satışı Mevcut ve yeni kiracı enflasyon makası kapanmadı Kısa vadeli dış borç stokunda artış Bloomberg Businessweek Türkiye'nin 139. sayısı çıktı Fed faiz artışına yönelik pozisyonlar kapatılıyor Küresel piyasalarda 'teknolojik' satış Yabancı yatırımcının tahvil alımı altı ayın zirvesinde Döviz mevduatları artışa geçti ABD'de konut başlangıçları toparlandı Almanya, Commerzbank konusunda Unicredit ile görüşmelere hazırlanıyor Bankacılık sektörü toplam mevduatında artış Konutta reel kayıp yedinci ayında Konutta yılın en yüksek aylık satışı Mevcut ve yeni kiracı enflasyon makası kapanmadı Kısa vadeli dış borç stokunda artış Bloomberg Businessweek Türkiye'nin 139. sayısı çıktı Fed faiz artışına yönelik pozisyonlar kapatılıyor Küresel piyasalarda 'teknolojik' satış Kuveyt Elektrik, Su ve Yenilenebilir Enerji Bakanlığının, ABD merkezli X şirketinin hesabından yapılan açıklamada, İran’ın Kuveyt’e yönelik saldırısı kapsamında elektrik üretimi ve su arıtma tesislerinden birinin “düşman saldırısına” maruz kaldığı belirtildi. sayısı çıktı Fed faiz artışına yönelik pozisyonlar kapatılıyor Küresel piyasalarda 'teknolojik' satış İran saldırısında Kuveyt'teki elektrik ve su tesisinde yangın çıktı Kuveyt Elektrik, Su ve Yenilenebilir Enerji Bakanlığı, İran'ın saldırısında elektrik üretimi ve su arıtma tesislerinden birinin hedef alındığını, tesiste yangın çıktığını açıkladı. Kuveyt Elektrik, Su ve Yenilenebilir Enerji Bakanlığının, ABD merkezli X şirketinin hesabından yapılan açıklamada, İran’ın Kuveyt’e yönelik saldırısı kapsamında elektrik üretimi ve su arıtma tesislerinden birinin “düşman saldırısına” maruz kaldığı belirtildi.",browser_full_article,https://www.bloomberght.com/iran-saldirisinda-kuveytteki-elektrik-ve-su-tesisinde-yangin-cikti-3783160,,,,,,,,il yok | ilçe yok | firma yok | faaliyet/tesis yok,,,,maps araması yapılmadı,,,76.25,2
2026-07-17 12:17:32,MASAK,Kara Para / MASAK / Bahis,Oğuzhan Uğur gözaltında: Babala TV hesaplarına yurt dışından gelen döviz için MASAK devrede,Oğuzhan Uğur gözaltında: Babala TV hesaplarına yurt dışından gelen döviz için MASAK devrede ehamedya.com.tr,https://news.google.com/rss/articles/CBMiygFBVV95cUxQVl8zSlo3R0ZPQkdQM1JzWDBlUGRJOEs0OEIzd2N5a1ZLanppV3FqSkxEMW1ocDMwVHdzVENqSG1FdVBrNmdjcXBNRlNhMXJGOU4tVmp3ajJ2Umtva3JCLVpfQXhSYzdvVEZuLThEcjV3MDFUTmdEcU5GNEo0aXZCalg5d2ZWbXFXWHdpdXdfN2RyS2pWemhTcTltcFhmQ21XU0VCMS1fRW5GRXdqMTktZzhyV1FXQjl4VXlsVXhEQmZmY0h0VGRoYUVR?oc=5,masak,,Oğuzhan Uğur gözaltında: Babala TV hesaplarına yurt dışından gelen döviz için MASAK devrede ehamedya.com.tr,Oğuzhan Uğur gözaltında: Babala TV hesaplarına yurt dışından gelen döviz için MASAK devrede Oğuzhan Uğur gözaltında: Babala TV hesaplarına yurt dışından gelen döviz için MASAK devrede ehamedya.com.tr Oğuzhan Uğur gözaltında: Babala TV hesaplarına yurt dışından gelen döviz için MASAK devrede ehamedya.com.tr,browser_failed,https://news.google.com/rss/articles/CBMiygFBVV95cUxQVl8zSlo3R0ZPQkdQM1JzWDBlUGRJOEs0OEIzd2N5a1ZLanppV3FqSkxEMW1ocDMwVHdzVENqSG1FdVBrNmdjcXBNRlNhMXJGOU4tVmp3ajJ2Umtva3JCLVpfQXhSYzdvVEZuLThEcjV3MDFUTmdEcU5GNEo0aXZCalg5d2ZWbXFXWHdpdXdfN2RyS2pWemhTcTltcFhmQ21XU0VCMS1fRW5GRXdqMTktZzhyV1FXQjl4VXlsVXhEQmZmY0h0VGRoYUVR?oc=5&hl=tr&gl=TR&ceid=TR:tr,,,,,,,,il yok | ilçe yok | firma yok | faaliyet/tesis yok,,,,maps araması yapılmadı,,,89.32,3
2026-07-18 08:46:48,MASAK,Kara Para / MASAK / Bahis,Ahbap soruşturmasında flaş gelişme: Etkin pişmanlıktan yararlanan Alper Çelik’in ifadesi ve MASAK raporundaki tespitler dosyada!,Ahbap soruşturmasında flaş gelişme: Etkin pişmanlıktan yararlanan Alper Çelik’in ifadesi ve MASAK raporundaki tespitler dosyada! SON TV,https://news.google.com/rss/articles/CBMi3gFBVV95cUxQWUhCZWYwS0R4eWI0VHNuek9scElLRkxCVXBqNEJmVkFmbGJkUFVTeDRaeDJnVzJWSzBldVlnUGFWREJFSmF0amRVaVlhNXNtakhrbE9fRXhrd3I4V3UxZzNfN0pCeC1tMUhxYnVSLVcteENMbnFIbkhPMnlaVnd0Z19TSFlObXlQNnJpNFJFcDEzY01sdDdUNWdNdnZ1bDJkU1R3V0NTN0s0aGMwZ1dQSmlqZm5ubTNvMHBKM2cwb0ZaOWh4SFlrLTJqWHE4Y1M1Njg0VHBoa25HUHRMdlE?oc=5,masak,,Ahbap soruşturmasında flaş gelişme: Etkin pişmanlıktan yararlanan Alper Çelik’in ifadesi ve MASAK raporundaki tespitler dosyada! SON TV,Ahbap soruşturmasında flaş gelişme: Etkin pişmanlıktan yararlanan Alper Çelik’in ifadesi ve MASAK raporundaki tespitler dosyada! Ahbap soruşturmasında flaş gelişme: Etkin pişmanlıktan yararlanan Alper Çelik’in ifadesi ve MASAK raporundaki tespitler dosyada! SON TV Ahbap soruşturmasında flaş gelişme: Etkin pişmanlıktan yararlanan Alper Çelik’in ifadesi ve MASAK raporundaki tespitler dosyada!,browser_failed,https://www.son.tv/ahbap-sorusturmasinda-flas-gelisme-etkin-pismanliktan-yararlanan-alper-celikin-ifadesi-ve-masak-raporundaki-tespitler-dosyada/,,,,,,Alper Çelik,Alper Çelik:284:body+summary+title,il yok | ilçe yok | faaliyet/tesis yok,Alper Çelik Türkiye,ALPER ÇELİK A.Ş. DİLOVASI MAKİNA OSB | ALPER ÇELİK // ÇERKEZKÖY | ALPER ÇELİK A.Ş. İDARİ BİNA | Av. Uzm. Arb. Alper Çelik | Prof. Dr. Alper Çelik - Şeker Ameliyatı - Diyabet Ameliyatı - Metabolik Cerrahi,ALPER ÇELİK A.Ş. DİLOVASI MAKİNA OSB,firma adı + güvenli maps adayı var,62.5 | 66.66666666666666 | 62.5 | 100.0 | 100.0,,221.1,4
2026-07-17 20:48:26,MASAK raporu,Kara Para / MASAK / Bahis,Ahbaplar soruşturmasında bahis trafiği MASAK raporunda! “Bu daha buz dağının ucu”,Ahbaplar soruşturmasında bahis trafiği MASAK raporunda! “Bu daha buz dağının ucu” A Haber,https://news.google.com/rss/articles/CBMivgFBVV95cUxNU3BJdHdSTW9wenpTb2pKRnp6alJUclZoQ3pBVllrLTBybERqUTNHdGVFSEFDMmZqd0JjNFlkMmw4dWZwQjF3VkVNX0FPWEdTamJ0MW9pek16QlIzb0hXd1Q4S1dFc3lUSVFmcmFqNFZ3WDNJVkNRZTkwMWhsdVNiNjBDRkt5V3BnNmFWcjIzN3lTU3JEeFVHWUZNSEtXcC1MaGxuYmJYWVJreHdodFlIdThfeVJLRl9IaWhvenFB?oc=5,masak,,"Türkiye’nin gündemine bomba gibi düşen Ahbap skandalı sonrası yayınlanan MASAK raporu yeni detayları ortaya çıkardı. 990 milyon lirayı bulan işlem hacmi ve 390... Türkiye’nin gündemine bomba gibi düşen Ahbap skandalı sonrası yayınlanan MASAK raporu yeni detayları ortaya çıkardı. 990 milyon lirayı bulan işlem hacmi ve 390... Haberin detayları için tıklayınız. Gündem CHP'den çıkacak yeni partinin adı ne? Kulis bilgileri A Haber'de Gündem Akıllı saat ve kulaklıklardaki gizli tehlike! Gündem Ahbap Derneği MASAK incelemesinde Gündem Rojin Kabaiş soruşturmasında 'Feth-i kabir' talebi Gündem MSB'den Rum terörüne tarihi yanıt! Yaşam El ve yüz havlularında görünmeyen tehlike Ahbaplar soruşturmasında bahis trafiği MASAK raporunda! “Bu daha buz dağının ucu” Türkiye’nin gündemine bomba gibi düşen Ahbap skandalı sonrası yayınlanan MASAK raporu yeni detayları ortaya çıkardı. 990 milyon lirayı bulan işlem hacmi ve 390 milyon liralık kayıp iddialarıyla sarsılan dosyada, ""HL5"" kodlu telefon hatları üzerinden yürütülen bahis trafiği ve dernek yöneticilerinin milyarlarca liralık para transferleri mercek altına alındı. A Haber’de değerlendirmelerde bulunan Hukukçu Av. Hadi Dündar ve Emekli İstihbarat Albay Coşkun Başbuğ, “Bu daha buz dağının ucu” diyerek konuyu deşifre etti. Malatya’da korkutan deprem! Şükrü Ersoy’dan uyarı Aziz Üstel 80 yaşında hayatını kaybetti Malatya'da 5 büyüklüğünde deprem! Damak çatlatan Divriği pilavının sırrı! İki katlı müstakil evde kısmi göçük Giriş Tarihi: 17 Temmuz 2026 23:48 ahaber.com.tr Haber Merkezi Giriş Tarihi: 17 Temmuz 2026 23:48 ahaber.com.tr Haber Merkezi Türkiye’nin gündemine bomba gibi düşen Ahbap skandalı sonrası yayınlanan MASAK raporu yeni detayları ortaya çıkardı. 990 milyon lirayı bulan işlem hacmi ve 390 milyon liralık kayıp iddialarıyla sarsılan dosyada, ""HL5"" kodlu telefon hatları üzerinden yürütülen bahis trafiği ve dernek yöneticilerinin milyarlarca liralık para transferleri mercek altına alındı. A Haber’de değerlendirmelerde bulunan Hukukçu Av. Hadi Dündar ve Emekli İstihbarat Albay Coşkun Başbuğ, “Bu daha buz dağının ucu” diyerek konuyu deşifre etti. Önceki haber ABD-İran hattında 7. Gece! Hürmüz'de kritik hesaplaşma Sonraki haber İsmail Güneş'in eşi A Haber'e konuştu: ""17 yıldır ilk kez yüzümüz güldü"" Önceki haber ABD-İran hattında 7. Gece! Hürmüz'de kritik hesaplaşma Sonraki haber İsmail Güneş'in eşi A Haber'e konuştu: ""17 yıldır ilk kez yüzümüz güldü"" Ahbaplar soruşturmasında bahis trafiği MASAK raporunda! “Bu daha buz dağının ucu”","Ahbaplar soruşturmasında bahis trafiği MASAK raporunda! “Bu daha buz dağının ucu” Ahbaplar soruşturmasında bahis trafiği MASAK raporunda! “Bu daha buz dağının ucu” A Haber Türkiye’nin gündemine bomba gibi düşen Ahbap skandalı sonrası yayınlanan MASAK raporu yeni detayları ortaya çıkardı. 990 milyon lirayı bulan işlem hacmi ve 390... Gündem Ahbap Derneği MASAK incelemesinde Gündem Rojin Kabaiş soruşturmasında 'Feth-i kabir' talebi Gündem MSB'den Rum terörüne tarihi yanıt! Yaşam El ve yüz havlularında görünmeyen tehlike Ahbaplar soruşturmasında bahis trafiği MASAK raporunda! “Bu daha buz dağının ucu” Türkiye’nin gündemine bomba gibi düşen Ahbap skandalı sonrası yayınlanan MASAK raporu yeni detayları ortaya çıkardı. 990 milyon lirayı bulan işlem hacmi ve 390 milyon liralık kayıp iddialarıyla sarsılan dosyada, ""HL5"" kodlu telefon hatları üzerinden yürütülen bahis trafiği ve dernek yöneticilerinin milyarlarca liralık para transferleri mercek altına alındı. Hadi Dündar ve Emekli İstihbarat Albay Coşkun Başbuğ, “Bu daha buz dağının ucu” diyerek konuyu deşifre etti. Malatya’da korkutan deprem! Şükrü Ersoy’dan uyarı Aziz Üstel 80 yaşında hayatını kaybetti Malatya'da 5 büyüklüğünde deprem! İki katlı müstakil evde kısmi göçük Giriş Tarihi: 17 Temmuz 2026 23:48 ahaber.com.tr Haber Merkezi Giriş Tarihi: 17 Temmuz 2026 23:48 ahaber.com.tr Haber Merkezi Türkiye’nin gündemine bomba gibi düşen Ahbap skandalı sonrası yayınlanan MASAK raporu yeni detayları ortaya çıkardı. Hürmüz'de kritik hesaplaşma Sonraki haber İsmail Güneş'in eşi A Haber'e konuştu: ""17 yıldır ilk kez yüzümüz güldü"" Önceki haber ABD-İran hattında 7. Hürmüz'de kritik hesaplaşma Sonraki haber İsmail Güneş'in eşi A Haber'e konuştu: ""17 yıldır ilk kez yüzümüz güldü"" Ahbaplar soruşturmasında bahis trafiği MASAK raporunda! “Bu daha buz dağının ucu”",browser_full_article,https://www.ahaber.com.tr/video/ozel-haber/ahbaplar-sorusturmasinda-bahis-trafigi-masak-raporunda-bu-daha-buz-daginin-ucu,Malatya,,,,,,,ilçe yok | firma yok | faaliyet/tesis yok,,,,maps araması yapılmadı,,,103.75,5
2026-07-18 05:30:09,MASAK raporu,Kara Para / MASAK / Bahis,MASAK ihbarı sonrası Oğuzhan Uğur hakkında soruşturma,MASAK ihbarı sonrası Oğuzhan Uğur hakkında soruşturma Manşet Haber,https://news.google.com/rss/articles/CBMiigFBVV95cUxQNVJXbmdRZWtnYXc1YVVRcUpKbk1GNWt2VHVOUGV4U0E2WUZBeDZSY1FPczZsV2ljOV8wSHZCQ2ptaklnR0ZmRzlzSm9ZNk5OWkE1TmtfSm5NNmc0Yk1Nb2RGeEZLSlphSWhHMHk4blhncTQyQjdUZm1DSl9YblVGYk01Y2g0RHpyOFE?oc=5,masak,,MASAK ihbarı sonrası Oğuzhan Uğur hakkında soruşturma Manşet Haber,MASAK ihbarı sonrası Oğuzhan Uğur hakkında soruşturma MASAK ihbarı sonrası Oğuzhan Uğur hakkında soruşturma Manşet Haber MASAK ihbarı sonrası Oğuzhan Uğur hakkında soruşturma Manşet Haber,browser_failed,https://news.google.com/rss/articles/CBMiigFBVV95cUxQNVJXbmdRZWtnYXc1YVVRcUpKbk1GNWt2VHVOUGV4U0E2WUZBeDZSY1FPczZsV2ljOV8wSHZCQ2ptaklnR0ZmRzlzSm9ZNk5OWkE1TmtfSm5NNmc0Yk1Nb2RGeEZLSlphSWhHMHk4blhncTQyQjdUZm1DSl9YblVGYk01Y2g0RHpyOFE?oc=5&hl=tr&gl=TR&ceid=TR:tr,,,,,,,,il yok | ilçe yok | firma yok | faaliyet/tesis yok,,,,maps araması yapılmadı,,,51.66,6
2026-07-18 08:59:53,MASAK raporu,Kara Para / MASAK / Bahis,MASAK'tan terör ve kara paraya karşı yeni taktik: Finansmanla ilgili her dosyada eş zamanlı soruşturma!,MASAK'tan terör ve kara paraya karşı yeni taktik: Finansmanla ilgili her dosyada eş zamanlı soruşturma! Haberhergün,https://news.google.com/rss/articles/CBMi2gFBVV95cUxNb1RQVjVCMjJvUlR5TDN0cFJRV2RLMEI1Q3Z2d25WT0hJbEEtblFHbHc1OHZSTWRuWVk4U09fUzJEN0pzVnhwZWg5RzFjOTU4VnIwQTNMMXZqU0tsZGFKblpZQWZWMnQ0QXRqTlFiNmFvOHRfR3lfR1p1UzhQN2JYV0tBQVFJcTFYNVhPdHR0dmkzS0xiTGd2bExnR3hRSE8wbndHTXZ5UFBtNmpUZlBnVTVjbWd1dFZHOVlIVGVzV0xIVWd5WEhjRXVpeGVUQzdKVzN1VXBMNUZXQQ?oc=5,masak,,MASAK'tan terör ve kara paraya karşı yeni taktik: Finansmanla ilgili her dosyada eş zamanlı soruşturma! Haberhergün,MASAK'tan terör ve kara paraya karşı yeni taktik: Finansmanla ilgili her dosyada eş zamanlı soruşturma! MASAK'tan terör ve kara paraya karşı yeni taktik: Finansmanla ilgili her dosyada eş zamanlı soruşturma! Haberhergün MASAK'tan terör ve kara paraya karşı yeni taktik: Finansmanla ilgili her dosyada eş zamanlı soruşturma!,browser_failed,https://news.google.com/rss/articles/CBMi2gFBVV95cUxNb1RQVjVCMjJvUlR5TDN0cFJRV2RLMEI1Q3Z2d25WT0hJbEEtblFHbHc1OHZSTWRuWVk4U09fUzJEN0pzVnhwZWg5RzFjOTU4VnIwQTNMMXZqU0tsZGFKblpZQWZWMnQ0QXRqTlFiNmFvOHRfR3lfR1p1UzhQN2JYV0tBQVFJcTFYNVhPdHR0dmkzS0xiTGd2bExnR3hRSE8wbndHTXZ5UFBtNmpUZlBnVTVjbWd1dFZHOVlIVGVzV0xIVWd5WEhjRXVpeGVUQzdKVzN1VXBMNUZXQQ?oc=5&hl=tr&gl=TR&ceid=TR:tr,,,,,,,,il yok | ilçe yok | firma yok | faaliyet/tesis yok,,,,maps araması yapılmadı,,,97.4,7
