published,search_term,category,title,summary,link,matched_words,activity_type,raw_text,entity_source_text,article_fetch_status,resolved_article_url,city_candidates,district_candidates,neighborhood_candidates,street_candidates,facility_candidates,company_candidates,company_candidate_scores,entity_quality_note,maps_queries,maps_candidates,maps_best_guess,maps_status,maps_match_scores,maps_rejected_candidates,record_quality_score,duplicate_group_id
2026-06-30 05:34:00,yasa dışı bahis,Operasyon / Soruşturma / Suç,"Cumhurbaşkanı Erdoğan talimatı vermişti! 32 şirkete el konuldu, onlarca gözaltı var...","Cumhurbaşkanı Erdoğan talimatı vermişti! 32 şirkete el konuldu, onlarca gözaltı var... Bursada Bugün",https://news.google.com/rss/articles/CBMiyAFBVV95cUxOMEdpbUtSVWpXZk9QQXh0dVhvWHI0RnRvbE5WVDM5VkZTVXp2Zkd0OWUwTExfcG91U1RuT2xDVVNHeFdRSFNncHlia09TWTRwMjBYa3ZWNzNta0lmcXR1WEhuR0JJUkI4RDA2LXd4VXJPQXkycndpWngxd0xzOTZHZGZmV2dkLVItSXhzNUNJRkNFc1oyM2szMDVzdlJmOW9GUndUWDlfUGxNVWEwMTZrTkF3bHkwaXcyRzM5X0dtN3I0V1lWTUhGbdIBywFBVV95cUxOWWxzcDdTLTY5THVQZ2pwczdIeXo3bHRzb1RUWlBmczlCMWhpX2ppRmxhWkFLNG5MRk5rYzlodXhqaEpUSWhYTkZybFJld3N6TGlDZWF4MDU4Ry1YZDhMWUF2blB5aV8ybGlCT3BfTFMzT29yTUlJSjBRbDRsTm9HNXM3M21sMVIzR0dObjB4VUR4ajFySGlVZHZEdmJTMC1aVUtKbUpYQkNNazFMVFBLdWJuREdCNm1sYkp6ME9aLWdjcmY0TVIwbzBzUQ?oc=5,"el konuldu, şirket",şirket / firma,"İstanbul'da yürütülen geniş çaplı bir soruşturmada, yasa dışı bahis ve kumar gelirlerinin finansal sisteme sokulduğu iddia edilen yapıya yönelik operasyon düzenlendi. 9 ili kapsayan eş zamanlı baskınlarda 37 şüpheli gözaltına alınırken, yaklaşık 30 milyar liralık para trafiğine ulaşıldığı tespit edildi. Soruşturma kapsamında çok sayıda şirket ve taşınmaz mal varlığına da el konuldu. İstanbul'da yürütülen geniş çaplı bir soruşturmada, yasa dışı bahis ve kumar gelirlerinin finansal sisteme sokulduğu iddia edilen yapıya yönelik operasyon düzenlendi. 9 ili kapsayan eş zamanlı baskınlarda 37 şüpheli gözaltına alınırken, yaklaşık 30 milyar liralık para trafiğine ulaşıldığı tespit edildi. Soruşturma kapsamında çok sayıda şirket ve taşınmaz mal varlığına da el konuldu. İstanbul'da yürütülen geniş çaplı bir soruşturmada, yasa dışı bahis ve kumar gelirlerinin finansal sisteme sokulduğu iddia edilen yapıya yönelik operasyon düzenlendi. 9 ili kapsayan eş zamanlı baskınlarda 37 şüpheli gözaltına alınırken, yaklaşık 30 milyar liralık para trafiğine ulaşıldığı tespit edildi. Soruşturma kapsamında çok sayıda şirket ve taşınmaz mal varlığına da el konuldu. Cumhurbaşkanı Erdoğan talimatı vermişti! 32 şirkete el konuldu, onlarca gözaltı var... 30 MİLYAR LİRALIK ŞÜPHELİ İŞLEM HACMİ MAL VARLIKLARINA EL KONULDU YASA DIŞI BAHİSLE MÜCADELE VURGUSU İstanbul'da yürütülen geniş çaplı bir soruşturmada, yasa dışı bahis ve kumar gelirlerinin finansal sisteme sokulduğu iddia edilen yapıya yönelik operasyon düzenlendi. 9 ili kapsayan eş zamanlı baskınlarda 37 şüpheli gözaltına alınırken, yaklaşık 30 milyar liralık para trafiğine ulaşıldığı tespit edildi. Soruşturma kapsamında çok sayıda şirket ve taşınmaz mal varlığına da el konuldu. Soruşturma, İstanbul Emniyet Müdürlüğü Mali Suçlarla Mücadele Şube ekiplerinin İstanbul Cumhuriyet Başsavcılığı koordinasyonunda yürüttüğü çalışmalarla başladı. Mali Suçları Araştırma Kurulu (MASAK) tarafından hazırlanan analiz raporlarında, şüpheli para hareketleri dikkat çekti. Banka kayıtları, dijital veriler ve teknik takip sonuçlarının bir araya getirilmesiyle oluşturulan dosyada, yasa dışı bahis ve sanal kumar gelirlerinin farklı şirketler üzerinden aklanarak finansal sisteme dahil edildiği belirlendi. İncelemelerde, söz konusu para akışının beyan edilen ticari faaliyetlerle örtüşmediği tespit edildi. Yapılan detaylı mali analizlerde, soruşturmaya konu şirketlerin yaklaşık 30 milyar liralık işlem hacmine ulaştığı ortaya çıkarıldı. Yetkililer, bu büyüklükteki para hareketinin organize bir yapı tarafından yönetildiği değerlendirmesinde bulundu. Soruşturma dosyasına yansıyan bilgilere göre, şüpheli ağın elde edilen gelirleri farklı kanallara yayarak izini kaybettirmeye çalıştığı, bazı transferlerin ise yurt dışına yönlendirildiği belirlendi. Hazırlıkların tamamlanmasının ardından İstanbul merkezli olmak üzere Ankara, Gaziantep, Hatay, İzmir, Kilis, Kırklareli, Kocaeli ve Tokat'ta belirlenen adreslere eş zamanlı operasyon düzenlendi. Güvenlik güçleri tarafından gerçekleştirilen baskınlarda 37 kişi yakalanarak gözaltına alındı. Operasyonların, yasa dışı bahis ve siber dolandırıcılık bağlantılı yapıya yönelik yürütülen en kapsamlı çalışmalardan biri olduğu ifade edildi. Soruşturma kapsamında suçtan elde edildiği değerlendirilen varlıklara da adli tedbir uygulandı. Bu kapsamda 32 şirketin yanı sıra 19 konut, 9 arsa, 1 iş yeri ve 31 araca el konuldu. El konulan mal varlıklarının toplam değerinin soruşturma sürecinde daha da netleşeceği belirtildi. Şüphelilerle ilgili adli sürecin devam ettiği, elde edilen dijital materyaller ve finansal kayıtların incelemeye alındığı öğrenildi. Cumhurbaşkanı Recep Tayyip Erdoğan'ın son dönemde yasa dışı bahis, sanal kumar ve dolandırıcılık şebekelerine karşı sert mücadele mesajları verdiği biliniyor. Erdoğan, bu yapılarla ilgili ""kökünü kazıyacağız"" ifadelerini kullanmıştı. Gerçekleştirilen son operasyonun da, Türkiye genelinde yasa dışı bahis ve siber suç ağlarına yönelik sürdürülen mücadelenin önemli bir ayağı olduğu değerlendiriliyor. Diğer Güncel Haberler için tıklayın Bursa'nın dev şirketinden 60 milyon TL'lik yer altı hamlesi! Saniyede 50 litre çıkarılacak... Bursa'da banka tadilatı yola taştı! Şaşkına çeviren operasyon! Tuvalete elini sokan polis neler çıkardı neler Bursa'da evde kurulan yasa dışı dövüş ringine operasyon! Bitap halde bulundu, 650 bin liralık ceza kesildi... Manifest'in yıldızı Sueda Ulucalı ile Berkcan Güven ilk kez birlikte görüntülendi! Türkiye'de 1 Temmuz'da hayat değişiyor!","Cumhurbaşkanı Erdoğan talimatı vermişti! 32 şirkete el konuldu, onlarca gözaltı var... Cumhurbaşkanı Erdoğan talimatı vermişti! 32 şirkete el konuldu, onlarca gözaltı var... Bursada Bugün İstanbul'da yürütülen geniş çaplı bir soruşturmada, yasa dışı bahis ve kumar gelirlerinin finansal sisteme sokulduğu iddia edilen yapıya yönelik operasyon düzenlendi. 9 ili kapsayan eş zamanlı baskınlarda 37 şüpheli gözaltına alınırken, yaklaşık 30 milyar liralık para trafiğine ulaşıldığı tespit edildi. Soruşturma kapsamında çok sayıda şirket ve taşınmaz mal varlığına da el konuldu. Cumhurbaşkanı Erdoğan talimatı vermişti! 32 şirkete el konuldu, onlarca gözaltı var... 30 MİLYAR LİRALIK ŞÜPHELİ İŞLEM HACMİ MAL VARLIKLARINA EL KONULDU YASA DIŞI BAHİSLE MÜCADELE VURGUSU İstanbul'da yürütülen geniş çaplı bir soruşturmada, yasa dışı bahis ve kumar gelirlerinin finansal sisteme sokulduğu iddia edilen yapıya yönelik operasyon düzenlendi. Soruşturma, İstanbul Emniyet Müdürlüğü Mali Suçlarla Mücadele Şube ekiplerinin İstanbul Cumhuriyet Başsavcılığı koordinasyonunda yürüttüğü çalışmalarla başladı. Mali Suçları Araştırma Kurulu (MASAK) tarafından hazırlanan analiz raporlarında, şüpheli para hareketleri dikkat çekti. Banka kayıtları, dijital veriler ve teknik takip sonuçlarının bir araya getirilmesiyle oluşturulan dosyada, yasa dışı bahis ve sanal kumar gelirlerinin farklı şirketler üzerinden aklanarak finansal sisteme dahil edildiği belirlendi. Yapılan detaylı mali analizlerde, soruşturmaya konu şirketlerin yaklaşık 30 milyar liralık işlem hacmine ulaştığı ortaya çıkarıldı. Soruşturma dosyasına yansıyan bilgilere göre, şüpheli ağın elde edilen gelirleri farklı kanallara yayarak izini kaybettirmeye çalıştığı, bazı transferlerin ise yurt dışına yönlendirildiği belirlendi. Hazırlıkların tamamlanmasının ardından İstanbul merkezli olmak üzere Ankara, Gaziantep, Hatay, İzmir, Kilis, Kırklareli, Kocaeli ve Tokat'ta belirlenen adreslere eş zamanlı operasyon düzenlendi. Güvenlik güçleri tarafından gerçekleştirilen baskınlarda 37 kişi yakalanarak gözaltına alındı. Operasyonların, yasa dışı bahis ve siber dolandırıcılık bağlantılı yapıya yönelik yürütülen en kapsamlı çalışmalardan biri olduğu ifade edildi. Soruşturma kapsamında suçtan elde edildiği değerlendirilen varlıklara da adli tedbir uygulandı. Bu kapsamda 32 şirketin yanı sıra 19 konut, 9 arsa, 1 iş yeri ve 31 araca el konuldu. El konulan mal varlıklarının toplam değerinin soruşturma sürecinde daha da netleşeceği belirtildi. Cumhurbaşkanı Recep Tayyip Erdoğan'ın son dönemde yasa dışı bahis, sanal kumar ve dolandırıcılık şebekelerine karşı sert mücadele mesajları verdiği biliniyor. Erdoğan, bu yapılarla ilgili ""kökünü kazıyacağız"" ifadelerini kullanmıştı. Gerçekleştirilen son operasyonun da, Türkiye genelinde yasa dışı bahis ve siber suç ağlarına yönelik sürdürülen mücadelenin önemli bir ayağı olduğu değerlendiriliyor. Diğer Güncel Haberler için tıklayın Bursa'nın dev şirketinden 60 milyon TL'lik yer altı hamlesi! Bursa'da banka tadilatı yola taştı! Şaşkına çeviren operasyon! Tuvalete elini sokan polis neler çıkardı neler Bursa'da evde kurulan yasa dışı dövüş ringine operasyon!",browser_full_article,https://www.bursadabugun.com/haber/cumhurbaskani-erdogan-talimati-vermisti-32-sirkete-el-konuldu-onlarca-gozalti-var-1932157.html,Bursa | İstanbul | Tokat,,,,,,,ilçe yok | firma yok | faaliyet/tesis yok,,,,maps araması yapılmadı,,,109.0,36
2026-06-29 19:16:44,vergi cezası,Diğer,Irak'ta eski vergi müdürüne hapis: Türkiye'deki 12 mülküne el konuldu,Irak'ta eski vergi müdürüne hapis: Türkiye'deki 12 mülküne el konuldu Rudaw,https://news.google.com/rss/articles/CBMiXkFVX3lxTE9OTFdqbVJ5N3dyMkUxOXB1bzhzUlZnU0s4ZkZLRXdKeURfR0ppZTU3RGNIYmlIUVplZjJubkl2cmJwX3QwT1FTanY4akl2UFJJbll5c3VuVWEwOThqV1E?oc=5,el konuldu,,"Irak’ta kamu kaynaklarını sömüren yolsuzluk ağlarına yönelik yürütülen soruşturmada devasa bir karar çıktı. Eski Vergi Genel Müdürü ve eşi, kara para aklama suçundan hapis cezasına çarptırılırken; ara Irak’ta kamu kaynaklarını sömüren yolsuzluk ağlarına yönelik yürütülen soruşturmada devasa bir karar çıktı. Eski Vergi Genel Müdürü ve eşi, kara para aklama suçundan hapis cezasına çarptırılırken; ara Irak’ta kamu kaynaklarını sömüren yolsuzluk ağlarına yönelik yürütülen soruşturmada devasa bir karar çıktı. Eski Vergi Genel Müdürü ve eşi, kara para aklama suçundan hapis cezasına çarptırılırken; ara Erbil (Rûdaw) - Irak’ta kamu kaynaklarını sömüren yolsuzluk ağlarına yönelik yürütülen soruşturmada devasa bir karar çıktı. Eski Vergi Genel Müdürü ve eşi, kara para aklama suçundan hapis cezasına çarptırılırken; aralarında Türkiye’de bulunan 12 mülkün de olduğu devasa bir servete el konuldu. Irak Federal Dürüstlük Komisyonu, devlet yönetimindeki yolsuzluklara karşı yürütülen en kapsamlı davalardan birinin sonuçlandığını duyurdu. Irak Vergi Genel Müdürlüğü’nün eski genel müdürü Usame Hüsam Cevdet ve eşi, milyonlarca dolarlık kara para aklama trafiğini yönetmek suçundan ağır hapis ve para cezalarına mahkûm edildi. Hapis ve rekor para cezası Merkezi Yolsuzlukla Mücadele Ceza Mahkemesi’nde görülen davada, elde edilen deliller ışığında karar bağlandı. Mahkeme, eski Genel Müdür Usame Hüsam Cevdet’e 10 yıl, eşine ise 5 yıl 1 ay hapis cezası verdi. Mahkumiyetin yanı sıra çift, Irak hazinesine toplam 32 milyar 496 milyon 107 bin dinar (yaklaşık 25 milyon dolar) para cezası ödemeye mahkûm edildi. Servetlerine el konuldu: 12 mülk Türkiye’de Mahkeme kararıyla, yolsuzluk yoluyla elde edildiği tespit edilen taşınır ve taşınmaz tüm mal varlığına el konulmasına hükmedildi. El konulan servetin dökümü ise dudak uçuklattı: -Türkiye’de 12, Bağdat’ta 10 olmak üzere toplam 22 lüks mülk -Türkiye ve Kuveyt bankalarında bulunan yüksek miktarlı hesaplar -Yüklü miktarda nakit para ve taşınmazlardan elde edilen tüm kira gelirleri -Çok sayıda altın ve ziynet eşyası ""Deliller ikna edici ve eksiksiz"" Söz konusu karar, 2015 yılı 39 sayılı ""Kara Para Aklama ve Terörizmin Finansmanı ile Mücadele Kanunu""nun 36. maddesi uyarınca verildi. Mahkeme heyeti, dosya kapsamında sunulan belgelerin, hesap hareketlerinin ve mülkiyet kayıtlarının suçun işlendiğine dair ""eksiksiz ve ikna edici"" olduğunu belirtti. IRAK 30-06-2026 Irak ile ABD'li şirket arasında enerji ve teknoloji alanında mutabakat zaptı imzalandı IRAK 30-06-2026 Irak’ta yolsuzluk operasyonu: Sınır kontrol noktasında 4 milyon dolar ele geçirildi IRAK 30-06-2026 Irak’ta Yolsuzluk Depremi: Bakan yardımcısının evinden milyarlarca dinar ve kilolarca altın çıktı Irak'ta eski vergi müdürüne hapis: Türkiye'deki 12 mülküne el konuldu Erbil (Rûdaw) - Irak’ta kamu kaynaklarını sömüren yolsuzluk ağlarına yönelik yürütülen soruşturmada devasa bir karar çıktı. Eski Vergi Genel Müdürü ve eşi, kara para aklama suçundan hapis cezasına çarptırılırken; aralarında Türkiye’de bulunan 12 mülkün de olduğu devasa bir servete el konuldu. Irak Federal Dürüstlük Komisyonu, devlet yönetimindeki yolsuzluklara karşı yürütülen en kapsamlı davalardan birinin sonuçlandığını duyurdu. Irak Vergi Genel Müdürlüğü’nün eski genel müdürü Usame Hüsam Cevdet ve eşi, milyonlarca dolarlık kara para aklama trafiğini yönetmek suçundan ağır hapis ve para cezalarına mahkûm edildi. Hapis ve rekor para cezası Merkezi Yolsuzlukla Mücadele Ceza Mahkemesi’nde görülen davada, elde edilen deliller ışığında karar bağlandı. Mahkeme, eski Genel Müdür Usame Hüsam Cevdet’e 10 yıl, eşine ise 5 yıl 1 ay hapis cezası verdi. Mahkumiyetin yanı sıra çift, Irak hazinesine toplam 32 milyar 496 milyon 107 bin dinar (yaklaşık 25 milyon dolar) para cezası ödemeye mahkûm edildi. Servetlerine el konuldu: 12 mülk Türkiye’de Mahkeme kararıyla, yolsuzluk yoluyla elde edildiği tespit edilen taşınır ve taşınmaz tüm mal varlığına el konulmasına hükmedildi. El konulan servetin dökümü ise dudak uçuklattı: -Türkiye’de 12, Bağdat’ta 10 olmak üzere toplam 22 lüks mülk -Türkiye ve Kuveyt bankalarında bulunan yüksek miktarlı hesaplar -Yüklü miktarda nakit para ve taşınmazlardan elde edilen tüm kira gelirleri -Çok sayıda altın ve ziynet eşyası ""Deliller ikna edici ve eksiksiz"" Söz konusu karar, 2015 yılı 39 sayılı ""Kara Para Aklama ve Terörizmin Finansmanı ile Mücadele Kanunu""nun 36. maddesi uyarınca verildi. Mahkeme heyeti, dosya kapsamında sunulan belgelerin, hesap hareketlerinin ve mülkiyet kayıtlarının suçun işlendiğine dair ""eksiksiz ve ikna edici"" olduğunu belirtti.","Irak'ta eski vergi müdürüne hapis: Türkiye'deki 12 mülküne el konuldu Irak'ta eski vergi müdürüne hapis: Türkiye'deki 12 mülküne el konuldu Rudaw Irak’ta kamu kaynaklarını sömüren yolsuzluk ağlarına yönelik yürütülen soruşturmada devasa bir karar çıktı. Eski Vergi Genel Müdürü ve eşi, kara para aklama suçundan hapis cezasına çarptırılırken; ara Irak’ta kamu kaynaklarını sömüren yolsuzluk ağlarına yönelik yürütülen soruşturmada devasa bir karar çıktı. Eski Vergi Genel Müdürü ve eşi, kara para aklama suçundan hapis cezasına çarptırılırken; ara Erbil (Rûdaw) - Irak’ta kamu kaynaklarını sömüren yolsuzluk ağlarına yönelik yürütülen soruşturmada devasa bir karar çıktı. Eski Vergi Genel Müdürü ve eşi, kara para aklama suçundan hapis cezasına çarptırılırken; aralarında Türkiye’de bulunan 12 mülkün de olduğu devasa bir servete el konuldu. Irak Federal Dürüstlük Komisyonu, devlet yönetimindeki yolsuzluklara karşı yürütülen en kapsamlı davalardan birinin sonuçlandığını duyurdu. Irak Vergi Genel Müdürlüğü’nün eski genel müdürü Usame Hüsam Cevdet ve eşi, milyonlarca dolarlık kara para aklama trafiğini yönetmek suçundan ağır hapis ve para cezalarına mahkûm edildi. Hapis ve rekor para cezası Merkezi Yolsuzlukla Mücadele Ceza Mahkemesi’nde görülen davada, elde edilen deliller ışığında karar bağlandı. Mahkeme, eski Genel Müdür Usame Hüsam Cevdet’e 10 yıl, eşine ise 5 yıl 1 ay hapis cezası verdi. Mahkumiyetin yanı sıra çift, Irak hazinesine toplam 32 milyar 496 milyon 107 bin dinar (yaklaşık 25 milyon dolar) para cezası ödemeye mahkûm edildi. Servetlerine el konuldu: 12 mülk Türkiye’de Mahkeme kararıyla, yolsuzluk yoluyla elde edildiği tespit edilen taşınır ve taşınmaz tüm mal varlığına el konulmasına hükmedildi. El konulan servetin dökümü ise dudak uçuklattı: -Türkiye’de 12, Bağdat’ta 10 olmak üzere toplam 22 lüks mülk -Türkiye ve Kuveyt bankalarında bulunan yüksek miktarlı hesaplar -Yüklü miktarda nakit para ve taşınmazlardan elde edilen tüm kira gelirleri -Çok sayıda altın ve ziynet eşyası ""Deliller ikna edici ve eksiksiz"" Söz konusu karar, 2015 yılı 39 sayılı ""Kara Para Aklama ve Terörizmin Finansmanı ile Mücadele Kanunu""nun 36. Mahkeme heyeti, dosya kapsamında sunulan belgelerin, hesap hareketlerinin ve mülkiyet kayıtlarının suçun işlendiğine dair ""eksiksiz ve ikna edici"" olduğunu belirtti. IRAK 30-06-2026 Irak ile ABD'li şirket arasında enerji ve teknoloji alanında mutabakat zaptı imzalandı IRAK 30-06-2026 Irak’ta yolsuzluk operasyonu: Sınır kontrol noktasında 4 milyon dolar ele geçirildi IRAK 30-06-2026 Irak’ta Yolsuzluk Depremi: Bakan yardımcısının evinden milyarlarca dinar ve kilolarca altın çıktı Irak'ta eski vergi müdürüne hapis: Türkiye'deki 12 mülküne el konuldu Erbil (Rûdaw) - Irak’ta kamu kaynaklarını sömüren yolsuzluk ağlarına yönelik yürütülen soruşturmada devasa bir karar çıktı.",browser_full_article,https://rudaw.net/turkish/categories/iraq/1278938,,,,,,,,il yok | ilçe yok | firma yok | faaliyet/tesis yok,,,,maps araması yapılmadı,,,76.25,37
2026-06-29 12:00:59,bankaya soruşturma,Banka / Finansal Kuruluş,Banka müşterilerine müjde! Findeks kredi notu sorgulama tamamen ücretsiz oldu,Banka müşterilerine müjde! Findeks kredi notu sorgulama tamamen ücretsiz oldu SuperHaber,https://news.google.com/rss/articles/CBMirwFBVV95cUxPUURhbTJLcWUzWlhtQVZ0QURORnZGcDBNY3pLYWdnSy1lRDBDUmtpdmd1TnJDbkI3cWZVMUpYdlptUS16QUhWNG9say1HbWFtYUJkQzRkclh6QTNOMkptY196Y3dmT0xtdVRDWmF1Rm9oZUJuV01oR29yNTIwdTFfeThQN2lOTWRGRXZaNkRhdzNwdVRLME1lZUdxRnZMWlVuUVhZUkNocjR3VExqRFM00gG0AUFVX3lxTFA0bV84Y0pLZlB3eGduS2NDVDFUNmhyWHRRY3NhNnYzeW1PWjhWZWNEVmRERHVKdGhZRlBPMWN3aE5wa05ZbC0xOTI3R2RtaGw1SjhYWDRoT2lYY1dxSHRZdHd4Znl6b09uM2NkZG81OHNvVnIxWjZKLUlfdThpWUtyX1c3N3VrUHRQLXp1YUpOU29fcnNiVm03cjFoUFpoQk8xSGdzZU56MDJLeG9pTlZUYmRtZQ?oc=5,banka,finansal kuruluş,"www.superhaber.com Güvenlik doğrulaması yapılıyor Bu web sitesi, kötü niyetli botlara karşı korunmak için bir güvenlik hizmeti kullanıyor. Web sitesi bir bot olmadığınızı doğrularken bu sayfa görüntülenir. Doğrulama başarılı. www.superhaber.com adresinin yanıt vermesi bekleniyor Güvenlik doğrulaması yapılıyor Doğrulama başarılı. www.superhaber.com adresinin yanıt vermesi bekleniyor Bu web sitesi, kötü niyetli botlara karşı korunmak için bir güvenlik hizmeti kullanıyor. Web sitesi bir bot olmadığınızı doğrularken bu sayfa görüntülenir.","Banka müşterilerine müjde! Findeks kredi notu sorgulama tamamen ücretsiz oldu Banka müşterilerine müjde! Findeks kredi notu sorgulama tamamen ücretsiz oldu SuperHaber www.superhaber.com Güvenlik doğrulaması yapılıyor Bu web sitesi, kötü niyetli botlara karşı korunmak için bir güvenlik hizmeti kullanıyor. Web sitesi bir bot olmadığınızı doğrularken bu sayfa görüntülenir. www.superhaber.com adresinin yanıt vermesi bekleniyor Güvenlik doğrulaması yapılıyor Doğrulama başarılı. www.superhaber.com adresinin yanıt vermesi bekleniyor Bu web sitesi, kötü niyetli botlara karşı korunmak için bir güvenlik hizmeti kullanıyor.",browser_full_article,https://www.superhaber.com/banka-musterilerine-mujde-findeks-kredi-notu-sorgulama-tamamen-ucretsiz-oldu-579616,,,,,,,,il yok | ilçe yok | firma yok | faaliyet/tesis yok,,,,maps araması yapılmadı,,,71.9,38
2026-06-30 09:06:26,ödeme kuruluşu,Banka / Finansal Kuruluş,"Belçika merkezli finans kuruluşu Euroclear, Rusya Merkez Bankasına dava açtı","Belçika merkezli finans kuruluşu Euroclear, Rusya Merkez Bankasına dava açtı Haberler",https://news.google.com/rss/articles/CBMiogFBVV95cUxPVnJqWTNXQ0NtRW5MUWhlSkhwSVJ6SHhmNUszWHdPY1BsamkxMG8yRjZQVlREV2RpeEpxMFpnZkJnZ2szclJiX2FpMWRlNnp4a3hGdm9WTUpQaDV4X0ZTMVFvX2sya0xmLU03eGwtUVFxWUhuaDZHekJ6WnEya2UydExMNTA2YmljT3pTTUxqM3VlM00xSDNWdWhzM2JfS0Fxa3fSAaIBQVVfeXFMT1ZyalkzV0NDbUVuTFFoZUpIcElSekh4ZjVLM1h3T2NQbGppMTBvMkY2UFZURFdkaXhKcTBaZ2ZCZ2drM3JSYl9haTFkZTZ6eGt4RnZvVk1KUGg1eF9GUzFRb19rMmtMZi1NN3hsLVFRcVlIbmg2R3pCelpxMmtlMnRMTDUwNmJpY096U01MajN1ZTNNMUgzVnVoczNiX0tBcWt3?oc=5,"banka, finans kuruluşu, kuruluş",finansal kuruluş,"Belçika merkezli finans kuruluşu Euroclear, Rusya Merkez Bankası aleyhine Brüksel Ticaret Mahkemesi'nde dava açtı. Euroclear, Rus mahkemesinin 220 milyar avro ödeme kararını engellemek için yasal işlem başlattı ve davanın ilk duruşması yapıldı. Belçika merkezli finans kuruluşu Euroclear, Rusya Merkez Bankası aleyhine Brüksel Ticaret Mahkemesi'nde dava açtı. Euroclear, Rus mahkemesinin 220 milyar avro ödeme kararını engellemek için yasal işlem başlattı ve davanın ilk duruşması yapıldı. Belçika merkezli finans kuruluşu Euroclear, Rusya Merkez Bankası aleyhine Brüksel Ticaret Mahkemesi'nde dava açtı. Euroclear, Rus mahkemesinin 220 milyar avro ödeme kararını engellemek için yasal işlem başlattı ve davanın ilk duruşması yapıldı. Belçika merkezli finans kuruluşu Euroclear, Rusya Merkez Bankasına dava açtı Belçika merkezli finans kuruluşu Euroclear, Rusya Merkez Bankası aleyhine Brüksel Ticaret Mahkemesi'nde dava açtı. Euroclear, Rus mahkemesinin 220 milyar avro ödeme kararını engellemek için yasal işlem başlattı ve davanın ilk duruşması yapıldı.","Belçika merkezli finans kuruluşu Euroclear, Rusya Merkez Bankasına dava açtı Belçika merkezli finans kuruluşu Euroclear, Rusya Merkez Bankasına dava açtı Haberler Belçika merkezli finans kuruluşu Euroclear, Rusya Merkez Bankası aleyhine Brüksel Ticaret Mahkemesi'nde dava açtı. Euroclear, Rus mahkemesinin 220 milyar avro ödeme kararını engellemek için yasal işlem başlattı ve davanın ilk duruşması yapıldı. Belçika merkezli finans kuruluşu Euroclear, Rusya Merkez Bankasına dava açtı Belçika merkezli finans kuruluşu Euroclear, Rusya Merkez Bankası aleyhine Brüksel Ticaret Mahkemesi'nde dava açtı.",browser_full_article,https://www.haberler.com/amp/euroclear-rusya-merkez-bankasi-na-bruksel-de-dava-acti-20004219-haberi/,,,,,,,,il yok | ilçe yok | firma yok | faaliyet/tesis yok,,,,maps araması yapılmadı,,,75.81,39
