published,search_term,category,title,summary,link,matched_words,activity_type,raw_text,entity_source_text,article_fetch_status,resolved_article_url,city_candidates,district_candidates,neighborhood_candidates,street_candidates,facility_candidates,company_candidates,company_candidate_scores,entity_quality_note,maps_queries,maps_candidates,maps_best_guess,maps_status,maps_match_scores,maps_rejected_candidates,record_quality_score,duplicate_group_id
2026-06-26 10:29:54,MASAK raporu,Kara Para / MASAK / Bahis,12 milyarlık para trafiği MASAK raporunda,12 milyarlık para trafiği MASAK raporunda Nefes Gazetesi,https://news.google.com/rss/articles/CBMifkFVX3lxTE1tRW1OUm13SG5YaHdtZnk3SjVMME8tYkJlcDdUb0JNeXZzQ2wyMlk0Vi11Y1ZKUlNjaV8xaXYxaUJiMjNqR18wWlJfckZmLXV1M3FhU2xQY0lsU0FTS1FwdzlXRUgydTBYOUNCN3ZtUU0zQW9VQ0ppR184eDBoQdIBgwFBVV95cUxQNWxVNkNHRHhUcnYxcUQyQks1R0lyT2U5VWg2SlZic0IybjdldXhNR1lPb1djSHE1VHBYaG15RGZETW54Rjg2UjlBS2liTjR6VmZSRE1rZURJRjBSTUdVbmNlVGctUGhqdlRSNEFwa2RHSV9maC1tMXF5ZlE2ZEhzREdoVQ?oc=5,masak,,12 milyarlık para trafiği MASAK raporunda Nefes Gazetesi,12 milyarlık para trafiği MASAK raporunda 12 milyarlık para trafiği MASAK raporunda Nefes Gazetesi 12 milyarlık para trafiği MASAK raporunda Nefes Gazetesi,browser_failed,https://www.nefes.com.tr/12-milyarlik-para-trafigi-masak-raporunda-134528,,,,,,,,il yok | ilçe yok | firma yok | faaliyet/tesis yok,,,,maps araması yapılmadı,,,43.06,1
2026-06-25 19:08:56,MASAK raporu,Kara Para / MASAK / Bahis,"MASAK raporu ve gözaltıların ardından... Cemil Tugay, Veli Ağbaba'nın yeğenini görevden aldı!","MASAK raporu ve gözaltıların ardından... Cemil Tugay, Veli Ağbaba'nın yeğenini görevden aldı! Türkiye Gazetesi",https://news.google.com/rss/articles/CBMizwFBVV95cUxQcnE1U2lWY3hvbFVzclp3TmNFUnFseTNHeUJJTGl5TlJfLURIeTl5c2hnUkhYOXNVUllKdW5mYkpvdkJ0dHQxd1g0OGwyTWgwbXRmVW10b3RDOEJ3eENjQks2X2hGc3A1T3c5SGMyY0lQTWRTdEc0cFpOQjBfaGVYNlJKZVFKR05JT0dpbXZmREtQR3NqVW1oWDlIcW5iUTJYOVY4NlNDREJEOFQ0UnpMWmV2ZTg4WHUtbDhmMjJLU1Izbl9uQ0RzekkwU0Z2cVE?oc=5,masak,,"İzmir Büyükşehir Belediye Başkanı Cemil Tugay, Malatya Milletvekili Veli Ağbaba’nın öz yeğeni olan özel kalem müdürü Nermin Özgül’ü görevden aldı. Karar, İzmir’de yürütülen rüşvet ve yolsuzluk soruşturması kapsamında art arda gelen gözaltıların ardından geldi. İzmir Büyükşehir Belediye Başkanı Cemil Tugay, Malatya Milletvekili Veli Ağbaba’nın öz yeğeni olan özel kalem müdürü Nermin Özgül’ü görevden aldı. Karar, İzmir’de yürütülen rüşvet ve yolsuzluk soruşturması kapsamında art arda gelen gözaltıların ardından geldi. İzmir Büyükşehir Belediye Başkanı Cemil Tugay, Malatya Milletvekili Veli Ağbaba’nın öz yeğeni olan özel kalem müdürü Nermin Özgül’ü görevden aldı. Karar, İzmir’de yürütülen rüşvet ve yolsuzluk soruşturması kapsamında art arda gelen gözaltıların ardından geldi.","MASAK raporu ve gözaltıların ardından... Cemil Tugay, Veli Ağbaba'nın yeğenini görevden aldı! MASAK raporu ve gözaltıların ardından... Cemil Tugay, Veli Ağbaba'nın yeğenini görevden aldı! Türkiye Gazetesi İzmir Büyükşehir Belediye Başkanı Cemil Tugay, Malatya Milletvekili Veli Ağbaba’nın öz yeğeni olan özel kalem müdürü Nermin Özgül’ü görevden aldı. Karar, İzmir’de yürütülen rüşvet ve yolsuzluk soruşturması kapsamında art arda gelen gözaltıların ardından geldi.",browser_full_article,https://www.turkiyegazetesi.com.tr/gundem/masak-raporu-ve-tutuklamalarin-ardindan-cemil-tugay-veli-agbabanin-yegenini-gorevden-1799401,İzmir,,,,,,,ilçe yok | firma yok | faaliyet/tesis yok,,,,maps araması yapılmadı,,,107.82,2
2026-06-26 11:36:40,kara para,Kara Para / MASAK / Bahis,8 ilde yasa dışı bahis operasyonu: 53 gözaltı kararı! 12 milyar liralık para trafiği MASAK raporuyla deşifre edildi,8 ilde yasa dışı bahis operasyonu: 53 gözaltı kararı! 12 milyar liralık para trafiği MASAK raporuyla deşifre edildi Hürriyet,https://news.google.com/rss/articles/CBMitAFBVV95cUxPVzBid1lrWHp3MVRMM2dXTU9ReDRpcFJ1U282bEJBa0ZfakxDV3RKeDFuU1pyd19aeXZfdFdlTDI3Vm9fejkxY3lBX1BfbERGSExqU3drTHAydGlNUWVkVWVkeWZ5ZWdEeU1aMzBZb0prLV9nMHNYOFFaT00wd2dZdDZJUVhXbVBraFNyanZqcUZRU2hTbTBmZUxSVzhtd0VPdndHdVE4b0pzR0RMS2txRmhTeDM?oc=5,masak,,"Ankara Cumhuriyet Başsavcılığı koordinesinde, yasa dışı bahis, kara para aklama ve vergi kaçakçılığı suçlarına yönelik Ankara merkezli 8 ilde düzenlenen... Son Dakika Haberleri - Ankara Cumhuriyet Başsavcılığı koordinesinde, yasa dışı bahis, kara para aklama ve vergi kaçakçılığı suçlarına yönelik Ankara merkezli 8 ilde düzenlenen operasyonda 53 şüpheli hakkında gözaltı kararı verildi, 42 şüpheli yakalandı. Organize suç örgütünün yasa dışı bahis​​​​​​​ ve şans oyunları... Ankara Cumhuriyet Başsavcılığı koordinesinde, yasa dışı bahis, kara para aklama ve vergi kaçakçılığı suçlarına yönelik Ankara merkezli 8 ilde düzenlenen... AA Oluşturulma Tarihi: Haziran 26, 2026 08:36 2dk okuma Ankara Cumhuriyet Başsavcılığı koordinesinde, yasa dışı bahis, kara para aklama ve vergi kaçakçılığı suçlarına yönelik Ankara merkezli 8 ilde düzenlenen operasyonda 53 şüpheli hakkında gözaltı kararı verildi, 42 şüpheli yakalandı. Organize suç örgütünün yasa dışı bahis​​​​​​​ ve şans oyunları üzerinden yürüttüğü sistemin toplam işlem hacminin tam 12 milyar 100 milyon lira olduğu tespit edildi. Haberin Devamı Ankara Cumhuriyet Başsavcılığınca yasa dışı bahis, kara para aklama ve vergi kaçakçılığı suçlarını işlediği belirlenen organize suç örgütüne yönelik yürütülen soruşturmanın detaylarına ulaşıldı. Yargı kaynaklarından alınan bilgiye göre, Ankara merkezli 8 ilde düzenlenen eş zamanlı operasyonlarda, jandarma ekipleri tarafından 12 milyar 100 milyon liralık para trafiğini yönettiği belirlenen 53 şüpheliden 42'si gözaltına alındı. Ankara İl Jandarma Komutanlığı ekiplerinin uzun süreli istihbari ve teknik takibi sonucunda, suç örgütünün finansal hareketleri takip edildi. Haberlerimizi Google’da Takip Edin En güncel haberlere ve son dakika gelişmelerine Google üzerinden anında ulaşmak için bizi favorilerinize ekleyin. Google’da tercih edilen kaynak olarak ekleyin 12 MİLYAR 100 MİLYON LİRA İŞLEM HACMİ TESPİT EDİLDİ Mali Suçları Araştırma Kurulu (MASAK) tarafından hazırlanan analiz raporlarında, organize suç örgütünün yasa dışı bahis​​​​​​​ ve şans oyunları üzerinden yürüttüğü sistemin toplam işlem hacminin tam 12 milyar 100 milyon lira olduğu tespit edildi. Haberin Devamı Suçtan elde edilen gelirlerin vergi kaçırmak ve izini kaybettirmek amacıyla organize bir şekilde aklandığı savcılık dosyasında yer aldı. Suç örgütü üyelerinin ev ve iş yerlerinde yapılan aramalarda, yasa dışı bahis platformlarını yönetmekte kullandıkları çok sayıda dijital materyal ele geçirildi. Adreslerde suç unsuru olduğu değerlendirilen 43 cep telefonu, 43 SIM kart, 10 dizüstü bilgisayar, 7 masaüstü bilgisayar, 25 USB bellek ve 1 tablete el konuldu. Ele geçirilen dijital materyaller, şifrelerinin kırılması, suç örgütünün yurt dışı bağlantılarının ve organizasyon şemasının tamamen deşifre edilebilmesi amacıyla Siber Suçlarla Mücadele ekiplerince incelemeye alındı. Ankara Cumhuriyet Başsavcılığı, ""suç işlemek amacıyla örgüt kurma"" ve ""7258 sayılı Kanun'a muhalefet"" suçlarının yanı sıra kara para aklama ve vergi kaçakçılığı boyutlarını da kapsayan soruşturmayı çok yönlü sürdürüyor. Gözden Kaçmasın Diyarbakır’da yasa dışı bahis operasyonu: 24 şüpheli tutuklandı! 6 milyar 942 milyonluk işlem hacmi tespit edildi Haberi görüntüle Haber Bültenleri ve E-Posta Tercihleri Türkiye ve dünyadaki en güncel gelişmelerden haberdar olmak için, bültenlerin gönderileceği e-posta adresini girin. Haberle ilgili daha fazlası: #ANKARA #Yasa Dışı Bahis #Kara Para Aklama AA Oluşturulma Tarihi: Haziran 26, 2026 08:36 2dk okuma Ankara Cumhuriyet Başsavcılığı koordinesinde, yasa dışı bahis, kara para aklama ve vergi kaçakçılığı suçlarına yönelik Ankara merkezli 8 ilde düzenlenen operasyonda 53 şüpheli hakkında gözaltı kararı verildi, 42 şüpheli yakalandı. Organize suç örgütünün yasa dışı bahis​​​​​​​ ve şans oyunları üzerinden yürüttüğü sistemin toplam işlem hacminin tam 12 milyar 100 milyon lira olduğu tespit edildi. Haberin Devamı Ankara Cumhuriyet Başsavcılığınca yasa dışı bahis, kara para aklama ve vergi kaçakçılığı suçlarını işlediği belirlenen organize suç örgütüne yönelik yürütülen soruşturmanın detaylarına ulaşıldı. Yargı kaynaklarından alınan bilgiye göre, Ankara merkezli 8 ilde düzenlenen eş zamanlı operasyonlarda, jandarma ekipleri tarafından 12 milyar 100 milyon liralık para trafiğini yönettiği belirlenen 53 şüpheliden 42'si gözaltına alındı. Ankara İl Jandarma Komutanlığı ekiplerinin uzun süreli istihbari ve teknik takibi sonucunda, suç örgütünün finansal hareketleri takip edildi. Haberlerimizi Google’da Takip Edin En güncel haberlere ve son dakika gelişmelerine Google üzerinden anında ulaşmak için bizi favorilerinize ekleyin. Google’da tercih edilen kaynak olarak ekleyin 12 MİLYAR 100 MİLYON LİRA İŞLEM HACMİ TESPİT EDİLDİ Mali Suçları Araştırma Kurulu (MASAK) tarafından hazırlanan analiz raporlarında, organize suç örgütünün yasa dışı bahis​​​​​​​ ve şans oyunları üzerinden yürüttüğü sistemin toplam işlem hacminin tam 12 milyar 100 milyon lira olduğu tespit edildi. Haberin Devamı Suçtan elde edilen gelirlerin vergi kaçırmak ve izini kaybettirmek amacıyla organize bir şekilde aklandığı savcılık dosyasında yer aldı. Suç örgütü üyelerinin ev ve iş yerlerinde yapılan aramalarda, yasa dışı bahis platformlarını yönetmekte kullandıkları çok sayıda dijital materyal ele geçirildi. Adreslerde suç unsuru olduğu değerlendirilen 43 cep telefonu, 43 SIM kart, 10 dizüstü bilgisayar, 7 masaüstü bilgisayar, 25 USB bellek ve 1 tablete el konuldu. Ele geçirilen dijital materyaller, şifrelerinin kırılması, suç örgütünün yurt dışı bağlantılarının ve organizasyon şemasının tamamen deşifre edilebilmesi amacıyla Siber Suçlarla Mücadele ekiplerince incelemeye alındı. Ankara Cumhuriyet Başsavcılığı, ""suç işlemek amacıyla örgüt kurma"" ve ""7258 sayılı Kanun'a muhalefet"" suçlarının yanı sıra kara para aklama ve vergi kaçakçılığı boyutlarını da kapsayan soruşturmayı çok yönlü sürdürüyor. Gözden Kaçmasın Diyarbakır’da yasa dışı bahis operasyonu: 24 şüpheli tutuklandı! 6 milyar 942 milyonluk işlem hacmi tespit edildi Haberi görüntüle Haber Bültenleri ve E-Posta Tercihleri Türkiye ve dünyadaki en güncel gelişmelerden haberdar olmak için, bültenlerin gönderileceği e-posta adresini girin. Haberlerimizi Google’da Takip Edin En güncel haberlere ve son dakika gelişmelerine Google üzerinden anında ulaşmak için bizi favorilerinize ekleyin. Gözden Kaçmasın Diyarbakır’da yasa dışı bahis operasyonu: 24 şüpheli tutuklandı! 6 milyar 942 milyonluk işlem hacmi tespit edildi Haberi görüntüle 8 ilde yasa dışı bahis operasyonu: 53 gözaltı kararı! 12 milyar liralık para trafiği MASAK raporuyla deşifre edildi #ANKARA Serinlemek isterken risk büyük: Soğuk suya girmenin gizli tehlikeleri #Sağlık Isırığı hastanelik ediyor! Kıyafetler bile engel olamıyor, gündüzleri saldırıyor... Uzmanlar anlattı: Kalıcı hale mi geldi ve salgın riski var mı? #Sağlık TBMM’den ‘IBAN mağdurları’ için önemli adım: 3 kritik nokta! Şimdi neler olacak? #IBAN Mağdurları YKS soruları tartışılıyor... Matematik ve Edebiyatta iptaller olacak mı #Yükseköğretim Kurumları Sınavı × GÜNDEM DÜNYA BİGPARA ANASAYFA BORSA DÖVİZ ALTIN VİOP&VARANT ANALİZ KOBİ KRİPTO PARALAR SPOR ARENA ANASAYFA FUTBOL BASKETBOL VOLEYBOL CANLI SKOR KELEBEK ANASAYFA EKRANDA HAYAT SEYAHAT STİL FAKİR HAUSGERATE İLE LEZZETLİ TARİFLER SAĞLIK YAŞAM ANASAYFA CUMARTESİ PAZAR LEZZETLİ HAYAT ÇOCUKLA HAYAT SEYAHAT YAZARLAR RESMİ İLANLAR ASTROLOJİ TÜMÜ EKONOMİ TV REHBERİ MAHMURE HÜRRİYET AİLE VİDEO ASTROLOJİ HESAPLAMA ARAÇLARI BULMACA EN İYİ ON CUMA LEZİZZ TEKNOLOJİ FOTO GALERİ RAMAZAN KİTAP SANAT HAVA DURUMU","8 ilde yasa dışı bahis operasyonu: 53 gözaltı kararı! 12 milyar liralık para trafiği MASAK raporuyla deşifre edildi 8 ilde yasa dışı bahis operasyonu: 53 gözaltı kararı! 12 milyar liralık para trafiği MASAK raporuyla deşifre edildi Hürriyet Ankara Cumhuriyet Başsavcılığı koordinesinde, yasa dışı bahis, kara para aklama ve vergi kaçakçılığı suçlarına yönelik Ankara merkezli 8 ilde düzenlenen... Son Dakika Haberleri - Ankara Cumhuriyet Başsavcılığı koordinesinde, yasa dışı bahis, kara para aklama ve vergi kaçakçılığı suçlarına yönelik Ankara merkezli 8 ilde düzenlenen operasyonda 53 şüpheli hakkında gözaltı kararı verildi, 42 şüpheli yakalandı. Organize suç örgütünün yasa dışı bahis​​​​​​​ ve şans oyunları... AA Oluşturulma Tarihi: Haziran 26, 2026 08:36 2dk okuma Ankara Cumhuriyet Başsavcılığı koordinesinde, yasa dışı bahis, kara para aklama ve vergi kaçakçılığı suçlarına yönelik Ankara merkezli 8 ilde düzenlenen operasyonda 53 şüpheli hakkında gözaltı kararı verildi, 42 şüpheli yakalandı. Organize suç örgütünün yasa dışı bahis​​​​​​​ ve şans oyunları üzerinden yürüttüğü sistemin toplam işlem hacminin tam 12 milyar 100 milyon lira olduğu tespit edildi. Haberin Devamı Ankara Cumhuriyet Başsavcılığınca yasa dışı bahis, kara para aklama ve vergi kaçakçılığı suçlarını işlediği belirlenen organize suç örgütüne yönelik yürütülen soruşturmanın detaylarına ulaşıldı. Yargı kaynaklarından alınan bilgiye göre, Ankara merkezli 8 ilde düzenlenen eş zamanlı operasyonlarda, jandarma ekipleri tarafından 12 milyar 100 milyon liralık para trafiğini yönettiği belirlenen 53 şüpheliden 42'si gözaltına alındı. Ankara İl Jandarma Komutanlığı ekiplerinin uzun süreli istihbari ve teknik takibi sonucunda, suç örgütünün finansal hareketleri takip edildi. Google’da tercih edilen kaynak olarak ekleyin 12 MİLYAR 100 MİLYON LİRA İŞLEM HACMİ TESPİT EDİLDİ Mali Suçları Araştırma Kurulu (MASAK) tarafından hazırlanan analiz raporlarında, organize suç örgütünün yasa dışı bahis​​​​​​​ ve şans oyunları üzerinden yürüttüğü sistemin toplam işlem hacminin tam 12 milyar 100 milyon lira olduğu tespit edildi. Haberin Devamı Suçtan elde edilen gelirlerin vergi kaçırmak ve izini kaybettirmek amacıyla organize bir şekilde aklandığı savcılık dosyasında yer aldı. Suç örgütü üyelerinin ev ve iş yerlerinde yapılan aramalarda, yasa dışı bahis platformlarını yönetmekte kullandıkları çok sayıda dijital materyal ele geçirildi. Adreslerde suç unsuru olduğu değerlendirilen 43 cep telefonu, 43 SIM kart, 10 dizüstü bilgisayar, 7 masaüstü bilgisayar, 25 USB bellek ve 1 tablete el konuldu. Ele geçirilen dijital materyaller, şifrelerinin kırılması, suç örgütünün yurt dışı bağlantılarının ve organizasyon şemasının tamamen deşifre edilebilmesi amacıyla Siber Suçlarla Mücadele ekiplerince incelemeye alındı. Ankara Cumhuriyet Başsavcılığı, ""suç işlemek amacıyla örgüt kurma"" ve ""7258 sayılı Kanun'a muhalefet"" suçlarının yanı sıra kara para aklama ve vergi kaçakçılığı boyutlarını da kapsayan soruşturmayı çok yönlü sürdürüyor. Gözden Kaçmasın Diyarbakır’da yasa dışı bahis operasyonu: 24 şüpheli tutuklandı! 6 milyar 942 milyonluk işlem hacmi tespit edildi Haberi görüntüle Haber Bültenleri ve E-Posta Tercihleri Türkiye ve dünyadaki en güncel gelişmelerden haberdar olmak için, bültenlerin gönderileceği e-posta adresini girin. Haberle ilgili daha fazlası: #ANKARA #Yasa Dışı Bahis #Kara Para Aklama AA Oluşturulma Tarihi: Haziran 26, 2026 08:36 2dk okuma Ankara Cumhuriyet Başsavcılığı koordinesinde, yasa dışı bahis, kara para aklama ve vergi kaçakçılığı suçlarına yönelik Ankara merkezli 8 ilde düzenlenen operasyonda 53 şüpheli hakkında gözaltı kararı verildi, 42 şüpheli yakalandı. 6 milyar 942 milyonluk işlem hacmi tespit edildi Haberi görüntüle 8 ilde yasa dışı bahis operasyonu: 53 gözaltı kararı! 12 milyar liralık para trafiği MASAK raporuyla deşifre edildi #ANKARA Serinlemek isterken risk büyük: Soğuk suya girmenin gizli tehlikeleri #Sağlık Isırığı hastanelik ediyor!",browser_full_article,https://www.hurriyet.com.tr/gundem/8-ile-yasa-disi-bahis-ve-kara-para-aklama-operasyonu-53-gozalti-karari-43218975,Ankara | Diyarbakır,,,,,,,ilçe yok | firma yok | faaliyet/tesis yok,,,,maps araması yapılmadı,,,119.5,3
2026-06-26 13:57:00,depo yangını,Fiziksel Risk / Yangın,Trabzon Arsin OSB'de Korkutan Yangın!,Trabzon Arsin OSB'de Korkutan Yangın! Gunebakış,https://news.google.com/rss/articles/CBMifkFVX3lxTE5PSi1tNzVkaHN1Nk12TmlQS0hNcDBUakRqQzVPQWpVVTM5Uk41a2xIYzhyUVp5ZlgybjNxOHhSUFRFTENXUVF6b1dlQ2gxeFBNWWRrZHpiekdVY0dqeExJdks5VzZvSl9qQzU1UkVyclh1d0I1VHdacnNQMTZyd9IBgwFBVV95cUxOcTZMU1JRWU1xdlV4ZExIMWRNTkxmTEliaWpWc0tObW9EU1VvREVqWGNTVG1QeTFkNnJBaVlLeHZpaVJUY2hlSUx5RkUxUEt0RW5wS0xhdHM5WFFnanFFOU5UcEpTcXpEV0loQllyTFRjSVBmZ0REcnFoYXdYLWx3SDlsOA?oc=5,osb,,"Trabzon Arsin Organize Sanayi Bölgesi’ndeki Gündoğdu Mobilya fabrikasında yangın çıktı. Trabzon Arsin Organize Sanayi Bölgesi’ndeki Gündoğdu Mobilya fabrikasında yangın çıktı. Trabzon Arsin Organize Sanayi Bölgesi’ndeki Gündoğdu Mobilya fabrikasında yangın çıktı. Trabzon’un Arsin ilçesinde bulunan Organize Sanayi Bölgesi’nde (OSB) korku dolu anlar yaşandı. Bölgenin en çok işçi çalıştıran köklü kuruluşlarından biri olan Gündoğdu Mobilya fabrikasında yangın çıktı. Hızar Tozu Deposu Alev Aldı Günebakış Trabzon Haber WhatsApp İhbar Hattı’na gelen ilk görüntülere göre, yangının fabrikanın baca kısmında başladığı görüldü. Elde edilen bilgilere göre, fabrikaya ait hızar tozu deposunda henüz belirlenemeyen bir nedenle alevler yükseldi. İtfaiye Ekipleri Sevk Edildi Çevredeki vatandaşların ve fabrika görevlilerinin durumu fark ederek ihbarda bulunması üzerine, olay yerine çok sayıda itfaiye ekibi sevk edildi. Can Kaybı ve Yaralı Yok Korkutan yangında ilk belirlemelere göre herhangi bir can kaybı ya da yaralanmanın olmadığı öğrenildi. İtfaiye ekiplerinin fabrikadaki yangını kontrol altına alma, söndürme ve soğutma çalışmaları ise tüm hızıyla devam ettiği kaydedildi. Trabzon Arsin OSB'de Korkutan Yangın! Hızar Tozu Deposu Alev Aldı İtfaiye Ekipleri Sevk Edildi Trabzon ve Trabzonspor haberlerini öncelikli olarak görmek istiyorum. Trabzon Arsin Organize Sanayi Bölgesi’ndeki Gündoğdu Mobilya fabrikasında yangın çıktı. Trabzon’un Arsin ilçesinde bulunan Organize Sanayi Bölgesi’nde (OSB) korku dolu anlar yaşandı. Bölgenin en çok işçi çalıştıran köklü kuruluşlarından biri olan Gündoğdu Mobilya fabrikasında yangın çıktı. Günebakış Trabzon Haber WhatsApp İhbar Hattı’na gelen ilk görüntülere göre, yangının fabrikanın baca kısmında başladığı görüldü. Elde edilen bilgilere göre, fabrikaya ait hızar tozu deposunda henüz belirlenemeyen bir nedenle alevler yükseldi. Çevredeki vatandaşların ve fabrika görevlilerinin durumu fark ederek ihbarda bulunması üzerine, olay yerine çok sayıda itfaiye ekibi sevk edildi. Korkutan yangında ilk belirlemelere göre herhangi bir can kaybı ya da yaralanmanın olmadığı öğrenildi. İtfaiye ekiplerinin fabrikadaki yangını kontrol altına alma, söndürme ve soğutma çalışmaları ise tüm hızıyla devam ettiği kaydedildi. 26 Haz 2026 - 16:57 Trabzon - Trabzon Gündemi Yazdır Muhabir Whatsapp İhbar Hattı Yorum yazarak Günebakış Topluluk Kuralları’nı kabul etmiş bulunuyor ve yorumunuzla ilgili doğrudan veya dolaylı tüm sorumluluğu tek başınıza üstleniyorsunuz. Yazılan yorumla","Trabzon Arsin OSB'de Korkutan Yangın! Trabzon Arsin OSB'de Korkutan Yangın! Gunebakış Trabzon Arsin Organize Sanayi Bölgesi’ndeki Gündoğdu Mobilya fabrikasında yangın çıktı. Trabzon’un Arsin ilçesinde bulunan Organize Sanayi Bölgesi’nde (OSB) korku dolu anlar yaşandı. Bölgenin en çok işçi çalıştıran köklü kuruluşlarından biri olan Gündoğdu Mobilya fabrikasında yangın çıktı. Hızar Tozu Deposu Alev Aldı Günebakış Trabzon Haber WhatsApp İhbar Hattı’na gelen ilk görüntülere göre, yangının fabrikanın baca kısmında başladığı görüldü. Elde edilen bilgilere göre, fabrikaya ait hızar tozu deposunda henüz belirlenemeyen bir nedenle alevler yükseldi. İtfaiye Ekipleri Sevk Edildi Çevredeki vatandaşların ve fabrika görevlilerinin durumu fark ederek ihbarda bulunması üzerine, olay yerine çok sayıda itfaiye ekibi sevk edildi. Can Kaybı ve Yaralı Yok Korkutan yangında ilk belirlemelere göre herhangi bir can kaybı ya da yaralanmanın olmadığı öğrenildi. İtfaiye ekiplerinin fabrikadaki yangını kontrol altına alma, söndürme ve soğutma çalışmaları ise tüm hızıyla devam ettiği kaydedildi. Trabzon Arsin OSB'de Korkutan Yangın! Hızar Tozu Deposu Alev Aldı İtfaiye Ekipleri Sevk Edildi Trabzon ve Trabzonspor haberlerini öncelikli olarak görmek istiyorum. Günebakış Trabzon Haber WhatsApp İhbar Hattı’na gelen ilk görüntülere göre, yangının fabrikanın baca kısmında başladığı görüldü. Çevredeki vatandaşların ve fabrika görevlilerinin durumu fark ederek ihbarda bulunması üzerine, olay yerine çok sayıda itfaiye ekibi sevk edildi. Korkutan yangında ilk belirlemelere göre herhangi bir can kaybı ya da yaralanmanın olmadığı öğrenildi. 26 Haz 2026 - 16:57 Trabzon - Trabzon Gündemi Yazdır Muhabir Whatsapp İhbar Hattı Yorum yazarak Günebakış Topluluk Kuralları’nı kabul etmiş bulunuyor ve yorumunuzla ilgili doğrudan veya dolaylı tüm sorumluluğu tek başınıza üstleniyorsunuz.",browser_full_article,https://www.gunebakis.com.tr/trabzon-arsin-osbde-korkutan-yangin/28239779,Trabzon,Arsin,Arsin OSB | Trabzon Arsin OSB | Gunebakış Trabzon Arsin Organize Sanayi,,Hızar Tozu Deposu,,,firma yok,Hızar Tozu Deposu Arsin OSB Arsin Trabzon Türkiye,Oyman Makina Ltd,Oyman Makina Ltd,"firma adı yok, tesis/lokasyon ile maps tahmini var",36.36363636363637,Trabzon Arsin Organize Sanayi Bölge Müdürlüğü | Akmanlar Damper,169.25,4
