published,search_term,category,title,summary,link,matched_words,activity_type,raw_text,entity_source_text,article_fetch_status,resolved_article_url,city_candidates,district_candidates,neighborhood_candidates,street_candidates,facility_candidates,company_candidates,company_candidate_scores,entity_quality_note,maps_queries,maps_candidates,maps_best_guess,maps_status,maps_match_scores,maps_rejected_candidates,record_quality_score,duplicate_group_id
2026-06-26 10:22:00,MASAK raporu,Kara Para / MASAK / Bahis,MASAK raporu suç ağını ortaya çıkardı: 42 gözaltı,MASAK raporu suç ağını ortaya çıkardı: 42 gözaltı Yeni Journal,https://news.google.com/rss/articles/CBMiggFBVV95cUxOWHVTT0V0dGdCMWdVdl9HdWpvZU9HTjRsU0lNbWNwZEVJd01ISHFfT0xyQjRvWm9TQnJERE56RjJiNXo1Q2JHc3NYWkJGa0dJY3R5cWliMGI3amJ6Q1psa2RiMU1wQThZc3VndlZFclBHWVNVd2VKQ2JGLWVmVWpSVDZ30gGHAUFVX3lxTE1XWUJBRXlDMmZSZV9EX2loZ2g0Q2tsY3ZsTEpqMXlaakZCeVlmUUs5bDlzaGlfMzZ3MTJZMFJDVkRVZm4ydlhhVENKa2RQUVNrVHZsY0huOFVNOGNhN0ltcXRJWUwxWjN3V0RfUUtpYWJQWGd5bzR5VmpvdFhET3VKcVd2TVV6VQ?oc=5,masak,,MASAK raporu suç ağını ortaya çıkardı: 42 gözaltı Yeni Journal,MASAK raporu suç ağını ortaya çıkardı: 42 gözaltı MASAK raporu suç ağını ortaya çıkardı: 42 gözaltı Yeni Journal MASAK raporu suç ağını ortaya çıkardı: 42 gözaltı Yeni Journal,browser_failed,https://news.google.com/rss/articles/CBMiggFBVV95cUxOWHVTT0V0dGdCMWdVdl9HdWpvZU9HTjRsU0lNbWNwZEVJd01ISHFfT0xyQjRvWm9TQnJERE56RjJiNXo1Q2JHc3NYWkJGa0dJY3R5cWliMGI3amJ6Q1psa2RiMU1wQThZc3VndlZFclBHWVNVd2VKQ2JGLWVmVWpSVDZ30gGHAUFVX3lxTE1XWUJBRXlDMmZSZV9EX2loZ2g0Q2tsY3ZsTEpqMXlaakZCeVlmUUs5bDlzaGlfMzZ3MTJZMFJDVkRVZm4ydlhhVENKa2RQUVNrVHZsY0huOFVNOGNhN0ltcXRJWUwxWjN3V0RfUUtpYWJQWGd5bzR5VmpvdFhET3VKcVd2TVV6VQ?oc=5&hl=tr&gl=TR&ceid=TR:tr,,,,,,,,il yok | ilçe yok | firma yok | faaliyet/tesis yok,,,,maps araması yapılmadı,,,48.62,1
2026-06-26 11:08:17,MASAK,Kara Para / MASAK / Bahis,Yasa dışı bahis çetesinin 12 milyar liralık para trafiği MASAK raporuyla deşifre edildi,Yasa dışı bahis çetesinin 12 milyar liralık para trafiği MASAK raporuyla deşifre edildi radikal.com.tr,https://news.google.com/rss/articles/CBMixwFBVV95cUxQSzdxVV82VU9Jcl9LYXoyczBvUW5sSkZRaWRteXpob2FFYnNUaXBvQi00X2lpa01OZ1VoR2o1OTVKUEI1bEpOTm1zTDV2WGp0bGRsVjhObHN2UjA1VU0xQmVNbXJpamNqYUtCal9TTDdKUmc4azVKMlZ6Ym9mWXU4dGc4OVphd3hwOEQ5ZkM4QWF1endPQ2d6Rng1bTZCSGFMaTJrWFBXMm1NU2M5TnpFbGViclg2R3RpZ1IyOXJlV3lIY190R1pJ?oc=5,masak,,"Ankara Cumhuriyet Başsavcılığınca yasa dışı bahis, kara para aklama ve vergi kaçakçılığı suçlarını işlediği belirlenen organize suç örgütüne yönelik yürütülen soruşturmanın detaylarına ulaşıldı. Yargı kaynaklarından alınan bilgiye göre, Ankara merkezli 8 ilde düzenlenen eş zamanlı operasyonlarda, jandarma ekipleri tarafından 12 milyar 100 milyon liralık para trafiğini yönettiği belirlenen 53 şüpheliden 42’si gözaltına alındı. Ankara İl […] Gündem Yasa dışı bahis çetesinin 12 milyar liralık para trafiği MASAK raporuyla deşifre edildi 26 Haziran 2026 Ankara Cumhuriyet Başsavcılığınca yasa dışı bahis, kara para aklama ve vergi kaçakçılığı suçlarını işlediği belirlenen organize suç örgütüne yönelik yürütülen soruşturmanın detaylarına ulaşıldı. Yargı kaynaklarından alınan bilgiye göre, Ankara merkezli 8 ilde düzenlenen eş zamanlı operasyonlarda, jandarma ekipleri tarafından 12 milyar 100 milyon liralık para trafiğini yönettiği belirlenen 53 şüpheliden 42’si gözaltına alındı. Ankara İl Jandarma Komutanlığı ekiplerinin uzun süreli istihbari ve teknik takibi sonucunda, suç örgütünün finansal hareketleri takip edildi. Mali Suçları Araştırma Kurulu (MASAK) tarafından hazırlanan analiz raporlarında, organize suç örgütünün yasa dışı bahis​​​​​​​ ve şans oyunları üzerinden yürüttüğü sistemin toplam işlem hacminin tam 12 milyar 100 milyon lira olduğu tespit edildi. Suçtan elde edilen gelirlerin vergi kaçırmak ve izini kaybettirmek amacıyla organize bir şekilde aklandığı savcılık dosyasında yer aldı. Suç örgütü üyelerinin ev ve iş yerlerinde yapılan aramalarda, yasa dışı bahis platformlarını yönetmekte kullandıkları çok sayıda dijital materyal ele geçirildi. Adreslerde suç unsuru olduğu değerlendirilen 43 cep telefonu, 43 SIM kart, 10 dizüstü bilgisayar, 7 masaüstü bilgisayar, 25 USB bellek ve 1 tablete el konuldu. Ele geçirilen dijital materyaller, şifrelerinin kırılması, suç örgütünün yurt dışı bağlantılarının ve organizasyon şemasının tamamen deşifre edilebilmesi amacıyla Siber Suçlarla Mücadele ekiplerince incelemeye alındı. Ankara Cumhuriyet Başsavcılığı, “suç işlemek amacıyla örgüt kurma” ve “7258 sayılı Kanun’a muhalefet” suçlarının yanı sıra kara para aklama ve vergi kaçakçılığı boyutlarını da kapsayan soruşturmayı çok yönlü sürdürüyor. (AA) Önceki İçerik İran, Hürmüz Boğazı’ndan koordinasyonsuz geçiş konusunda uyardı SON GİRİLEN İÇERİKLER Dünya İran, Hürmüz Boğazı’ndan koordinasyonsuz geçiş konusunda uyardı Gündem Meteoroloji’den bazı bölgeler için fırtına ve kuvvetli yağış uyarısı Magazin Halil Ergün’den tartışılan sözleri sonrası ‘Atatürk’ açıklaması Gündem Hatay’da işçi servisi ile tırın çarpıştığı kazada 13 kişi yaralandı Spor Formula 1’de sıradaki durak Avusturya Devamını Göster Ankara Cumhuriyet Başsavcılığınca yasa dışı bahis, kara para aklama ve vergi kaçakçılığı suçlarını işlediği belirlenen organize suç örgütüne yönelik yürütülen soruşturmanın detaylarına ulaşıldı. Yargı kaynaklarından alınan bilgiye göre, Ankara merkezli 8 ilde düzenlenen eş zamanlı operasyonlarda, jandarma ekipleri tarafından 12 milyar 100 milyon liralık para trafiğini yönettiği belirlenen 53 şüpheliden 42’si gözaltına alındı. Ankara İl Jandarma Komutanlığı ekiplerinin uzun süreli istihbari ve teknik takibi sonucunda, suç örgütünün finansal hareketleri takip edildi. Mali Suçları Araştırma Kurulu (MASAK) tarafından hazırlanan analiz raporlarında, organize suç örgütünün yasa dışı bahis​​​​​​​ ve şans oyunları üzerinden yürüttüğü sistemin toplam işlem hacminin tam 12 milyar 100 milyon lira olduğu tespit edildi. Suçtan elde edilen gelirlerin vergi kaçırmak ve izini kaybettirmek amacıyla organize bir şekilde aklandığı savcılık dosyasında yer aldı. Suç örgütü üyelerinin ev ve iş yerlerinde yapılan aramalarda, yasa dışı bahis platformlarını yönetmekte kullandıkları çok sayıda dijital materyal ele geçirildi. Adreslerde suç unsuru olduğu değerlendirilen 43 cep telefonu, 43 SIM kart, 10 dizüstü bilgisayar, 7 masaüstü bilgisayar, 25 USB bellek ve 1 tablete el konuldu. Ele geçirilen dijital materyaller, şifrelerinin kırılması, suç örgütünün yurt dışı bağlantılarının ve organizasyon şemasının tamamen deşifre edilebilmesi amacıyla Siber Suçlarla Mücadele ekiplerince incelemeye alındı. Ankara Cumhuriyet Başsavcılığı, “suç işlemek amacıyla örgüt kurma” ve “7258 sayılı Kanun’a muhalefet” suçlarının yanı sıra kara para aklama ve vergi kaçakçılığı boyutlarını da kapsayan soruşturmayı çok yönlü sürdürüyor. (AA) Yasa dışı bahis çetesinin 12 milyar liralık para trafiği MASAK raporuyla deşifre edildi Ankara Cumhuriyet Başsavcılığınca yasa dışı bahis, kara para aklama ve vergi kaçakçılığı suçlarını işlediği belirlenen organize suç örgütüne yönelik yürütülen soruşturmanın detaylarına ulaşıldı. Yargı kaynaklarından alınan bilgiye göre, Ankara merkezli 8 ilde düzenlenen eş zamanlı operasyonlarda, jandarma ekipleri tarafından 12 milyar 100 milyon liralık para trafiğini yönettiği belirlenen 53 şüpheliden 42’si gözaltına alındı. Ankara İl Jandarma Komutanlığı ekiplerinin uzun süreli istihbari ve teknik takibi sonucunda, suç örgütünün finansal hareketleri takip edildi. Mali Suçları Araştırma Kurulu (MASAK) tarafından hazırlanan analiz raporlarında, organize suç örgütünün yasa dışı bahis​​​​​​​ ve şans oyunları üzerinden yürüttüğü sistemin toplam işlem hacminin tam 12 milyar 100 milyon lira olduğu tespit edildi. Suçtan elde edilen gelirlerin vergi kaçırmak ve izini kaybettirmek amacıyla organize bir şekilde aklandığı savcılık dosyasında yer aldı. Suç örgütü üyelerinin ev ve iş yerlerinde yapılan aramalarda, yasa dışı bahis platformlarını yönetmekte kullandıkları çok sayıda dijital materyal ele geçirildi. Adreslerde suç unsuru olduğu değerlendirilen 43 cep telefonu, 43 SIM kart, 10 dizüstü bilgisayar, 7 masaüstü bilgisayar, 25 USB bellek ve 1 tablete el konuldu. Ele geçirilen dijital materyaller, şifrelerinin kırılması, suç örgütünün yurt dışı bağlantılarının ve organizasyon şemasının tamamen deşifre edilebilmesi amacıyla Siber Suçlarla Mücadele ekiplerince incelemeye alındı. Ankara Cumhuriyet Başsavcılığı, “suç işlemek amacıyla örgüt kurma” ve “7258 sayılı Kanun’a muhalefet” suçlarının yanı sıra kara para aklama ve vergi kaçakçılığı boyutlarını da kapsayan soruşturmayı çok yönlü sürdürüyor. (AA)","Yasa dışı bahis çetesinin 12 milyar liralık para trafiği MASAK raporuyla deşifre edildi Yasa dışı bahis çetesinin 12 milyar liralık para trafiği MASAK raporuyla deşifre edildi radikal.com.tr Ankara Cumhuriyet Başsavcılığınca yasa dışı bahis, kara para aklama ve vergi kaçakçılığı suçlarını işlediği belirlenen organize suç örgütüne yönelik yürütülen soruşturmanın detaylarına ulaşıldı. Yargı kaynaklarından alınan bilgiye göre, Ankara merkezli 8 ilde düzenlenen eş zamanlı operasyonlarda, jandarma ekipleri tarafından 12 milyar 100 milyon liralık para trafiğini yönettiği belirlenen 53 şüpheliden 42’si gözaltına alındı. Ankara İl […] Gündem Yasa dışı bahis çetesinin 12 milyar liralık para trafiği MASAK raporuyla deşifre edildi 26 Haziran 2026 Ankara Cumhuriyet Başsavcılığınca yasa dışı bahis, kara para aklama ve vergi kaçakçılığı suçlarını işlediği belirlenen organize suç örgütüne yönelik yürütülen soruşturmanın detaylarına ulaşıldı. Ankara İl Jandarma Komutanlığı ekiplerinin uzun süreli istihbari ve teknik takibi sonucunda, suç örgütünün finansal hareketleri takip edildi. Mali Suçları Araştırma Kurulu (MASAK) tarafından hazırlanan analiz raporlarında, organize suç örgütünün yasa dışı bahis​​​​​​​ ve şans oyunları üzerinden yürüttüğü sistemin toplam işlem hacminin tam 12 milyar 100 milyon lira olduğu tespit edildi. Suçtan elde edilen gelirlerin vergi kaçırmak ve izini kaybettirmek amacıyla organize bir şekilde aklandığı savcılık dosyasında yer aldı. Suç örgütü üyelerinin ev ve iş yerlerinde yapılan aramalarda, yasa dışı bahis platformlarını yönetmekte kullandıkları çok sayıda dijital materyal ele geçirildi. Adreslerde suç unsuru olduğu değerlendirilen 43 cep telefonu, 43 SIM kart, 10 dizüstü bilgisayar, 7 masaüstü bilgisayar, 25 USB bellek ve 1 tablete el konuldu. Ele geçirilen dijital materyaller, şifrelerinin kırılması, suç örgütünün yurt dışı bağlantılarının ve organizasyon şemasının tamamen deşifre edilebilmesi amacıyla Siber Suçlarla Mücadele ekiplerince incelemeye alındı. Ankara Cumhuriyet Başsavcılığı, “suç işlemek amacıyla örgüt kurma” ve “7258 sayılı Kanun’a muhalefet” suçlarının yanı sıra kara para aklama ve vergi kaçakçılığı boyutlarını da kapsayan soruşturmayı çok yönlü sürdürüyor. (AA) Önceki İçerik İran, Hürmüz Boğazı’ndan koordinasyonsuz geçiş konusunda uyardı SON GİRİLEN İÇERİKLER Dünya İran, Hürmüz Boğazı’ndan koordinasyonsuz geçiş konusunda uyardı Gündem Meteoroloji’den bazı bölgeler için fırtına ve kuvvetli yağış uyarısı Magazin Halil Ergün’den tartışılan sözleri sonrası ‘Atatürk’ açıklaması Gündem Hatay’da işçi servisi ile tırın çarpıştığı kazada 13 kişi yaralandı Spor Formula 1’de sıradaki durak Avusturya Devamını Göster Ankara Cumhuriyet Başsavcılığınca yasa dışı bahis, kara para aklama ve vergi kaçakçılığı suçlarını işlediği belirlenen organize suç örgütüne yönelik yürütülen soruşturmanın detaylarına ulaşıldı. (AA) Yasa dışı bahis çetesinin 12 milyar liralık para trafiği MASAK raporuyla deşifre edildi Ankara Cumhuriyet Başsavcılığınca yasa dışı bahis, kara para aklama ve vergi kaçakçılığı suçlarını işlediği belirlenen organize suç örgütüne yönelik yürütülen soruşturmanın detaylarına ulaşıldı.",browser_full_article,https://www.radikal.com.tr/gundem/yasa-disi-bahis-cetesinin-12-milyar-liralik-para-trafigi-masak-raporuyla-desifre-edildi-33388/,Ankara | Hatay,,,,,,,ilçe yok | firma yok | faaliyet/tesis yok,,,,maps araması yapılmadı,,,110.0,2
2026-06-26 18:42:00,depo yangını,Fiziksel Risk / Yangın,Bursa'da fabrika yangını! Ekiplerden hızlı müdahale geldi...,Bursa'da fabrika yangını! Ekiplerden hızlı müdahale geldi... Bursada Bugün,https://news.google.com/rss/articles/CBMipwFBVV95cUxQdk5ub2V0Si1PTExwZUFSU25OSm9SZmM5aGtpem8ydUZjMFdueXJZZ0pxTUJYQUpMR3AtTVNBV2JWY2xMZGhNQXJUM1YxRW1YQW1kbkVxUFE0UUJNOXJIT1FhdlVLaGZqLWNERkZicHg5cFZQWTN1UjV3N1U1UUNuOWE4VjFDU3puaGlEY2dHVDJOcHM2b09HcTdBSHFHQlc2ajRBT2UwY9IBqgFBVV95cUxNdlRzVjRzZmMyVnZ6cDU1R3A2TEtlTFN2ZVNGR2xHc1dRZ3Q3ZENuNGxyaG9FcjQzSzdZUTlIVk5rWmFvYXdrMW9HZGFfNUdkMncxT1AwRG5FRXJndUFIWG1FWS1RZkFGZjlKYUJjV2M5VllnaWM1SkxXcnhEb2tqY19uQ0praG9VaXFlcmlKeVJtTEJseUFqdlZHUTh3X0lTMnpWTEdUR3pLZw?oc=5,fabrika,fabrika,Bursa'da fabrika yangını! Ekiplerden hızlı müdahale geldi... Bursada Bugün,Bursa'da fabrika yangını! Ekiplerden hızlı müdahale geldi... Bursa'da fabrika yangını! Ekiplerden hızlı müdahale geldi... Bursada Bugün Bursa'da fabrika yangını! Ekiplerden hızlı müdahale geldi...,browser_failed,https://news.google.com/rss/articles/CBMipwFBVV95cUxQdk5ub2V0Si1PTExwZUFSU25OSm9SZmM5aGtpem8ydUZjMFdueXJZZ0pxTUJYQUpMR3AtTVNBV2JWY2xMZGhNQXJUM1YxRW1YQW1kbkVxUFE0UUJNOXJIT1FhdlVLaGZqLWNERkZicHg5cFZQWTN1UjV3N1U1UUNuOWE4VjFDU3puaGlEY2dHVDJOcHM2b09HcTdBSHFHQlc2ajRBT2UwY9IBqgFBVV95cUxNdlRzVjRzZmMyVnZ6cDU1R3A2TEtlTFN2ZVNGR2xHc1dRZ3Q3ZENuNGxyaG9FcjQzSzdZUTlIVk5rWmFvYXdrMW9HZGFfNUdkMncxT1AwRG5FRXJndUFIWG1FWS1RZkFGZjlKYUJjV2M5VllnaWM1SkxXcnhEb2tqY19uQ0praG9VaXFlcmlKeVJtTEJseUFqdlZHUTh3X0lTMnpWTEdUR3pLZw?oc=5,Bursa,,,,,,,ilçe yok | firma yok | faaliyet/tesis yok,,,,maps araması yapılmadı,,,67.24,3
2026-06-26 13:57:00,depo yangını,Fiziksel Risk / Yangın,Trabzon Arsin OSB'de Korkutan Yangın!,Trabzon Arsin OSB'de Korkutan Yangın! Gunebakış,https://news.google.com/rss/articles/CBMigwFBVV95cUxOcTZMU1JRWU1xdlV4ZExIMWRNTkxmTEliaWpWc0tObW9EU1VvREVqWGNTVG1QeTFkNnJBaVlLeHZpaVJUY2hlSUx5RkUxUEt0RW5wS0xhdHM5WFFnanFFOU5UcEpTcXpEV0loQllyTFRjSVBmZ0REcnFoYXdYLWx3SDlsONIBgwFBVV95cUxOcTZMU1JRWU1xdlV4ZExIMWRNTkxmTEliaWpWc0tObW9EU1VvREVqWGNTVG1QeTFkNnJBaVlLeHZpaVJUY2hlSUx5RkUxUEt0RW5wS0xhdHM5WFFnanFFOU5UcEpTcXpEV0loQllyTFRjSVBmZ0REcnFoYXdYLWx3SDlsOA?oc=5,osb,,"Trabzon Arsin Organize Sanayi Bölgesi’ndeki Gündoğdu Mobilya fabrikasında yangın çıktı. Trabzon Arsin Organize Sanayi Bölgesi’ndeki Gündoğdu Mobilya fabrikasında yangın çıktı. Trabzon Arsin Organize Sanayi Bölgesi’ndeki Gündoğdu Mobilya fabrikasında yangın çıktı. 26 Haziran 2026 Cuma, 26 Haziran 2026 - Trabzon Gündemi Trabzon Arsin OSB'de Korkutan Yangın! Trabzon Arsin Organize Sanayi Bölgesi’ndeki Gündoğdu Mobilya fabrikasında yangın çıktı. Trabzon’un Arsin ilçesinde bulunan Organize Sanayi Bölgesi’nde (OSB) korku dolu anlar yaşandı. Bölgenin en çok işçi çalıştıran köklü kuruluşlarından biri olan Gündoğdu Mobilya fabrikasında yangın çıktı. Hızar Tozu Deposu Alev Aldı Günebakış Trabzon Haber WhatsApp İhbar Hattı’na gelen ilk görüntülere göre, yangının fabrikanın baca kısmında başladığı görüldü. Elde edilen bilgilere göre, fabrikaya ait hızar tozu deposunda henüz belirlenemeyen bir nedenle alevler yükseldi. İtfaiye Ekipleri Sevk Edildi Çevredeki vatandaşların ve fabrika görevlilerinin durumu fark ederek ihbarda bulunması üzerine, olay yerine çok sayıda itfaiye ekibi sevk edildi. Can Kaybı ve Yaralı Yok Korkutan yangında ilk belirlemelere göre herhangi bir can kaybı ya da yaralanmanın olmadığı öğrenildi. İtfaiye ekiplerinin fabrikadaki yangını kontrol altına alma, söndürme ve soğutma çalışmaları ise tüm hızıyla devam ettiği kaydedildi. YORUM YAP Trabzon'da Acı Haber! 4 Gündür Haber Alınamıyordu YKS Sonrası Ailesi Evde Ölü Buldu Trabzon'da Bir Dedenin Fedakarlığı! Torununa Can Oldu, Hastalığa Yenik Düştü Mattia Ahmet Minguzzi davasında karar! 7 yıl 20 gün hapis Trabzon'da KTÜ'den Tarihi Başarı! Dünya Sıralamasında 54 Basamak Birden Yükseldi Karadeniz’in En Başarılı Belediye Başkanları Anketinde Trabzon’dan 3 Başkan Öne Çıktı 26 Haziran 2026 Cuma, 26 Haziran 2026 - Trabzon Gündemi Trabzon Arsin OSB'de Korkutan Yangın! Trabzon Arsin Organize Sanayi Bölgesi’ndeki Gündoğdu Mobilya fabrikasında yangın çıktı. Trabzon’un Arsin ilçesinde bulunan Organize Sanayi Bölgesi’nde (OSB) korku dolu anlar yaşandı. Bölgenin en çok işçi çalıştıran köklü kuruluşlarından biri olan Gündoğdu Mobilya fabrikasında yangın çıktı. Hızar Tozu Deposu Alev Aldı Günebakış Trabzon Haber WhatsApp İhbar Hattı’na gelen ilk görüntülere göre, yangının fabrikanın baca kısmında başladığı görüldü. Elde edilen bilgilere göre, fabrikaya ait hızar tozu deposunda henüz belirlenemeyen bir nedenle alevler yükseldi. İtfaiye Ekipleri Sevk Edildi Çevredeki vatandaşların ve fabrika görevlilerinin durumu fark ederek ihbarda bulunması üzerine, olay yerine çok sayıda itfaiye ekibi sevk edildi. Can Kaybı ve Yaralı Yok Korkutan yangında ilk belirlemelere göre herhangi bir can kaybı ya da yaralanmanın olmadığı öğrenildi. İtfaiye ekiplerinin fabrikadaki yangını kontrol altına alma, söndürme ve soğutma çalışmaları ise tüm hızıyla devam ettiği kaydedildi. Trabzon Arsin OSB'de Korkutan Yangın! Hızar Tozu Deposu Alev Aldı İtfaiye Ekipleri Sevk Edildi Trabzon’un Arsin ilçesinde bulunan Organize Sanayi Bölgesi’nde (OSB) korku dolu anlar yaşandı. Bölgenin en çok işçi çalıştıran köklü kuruluşlarından biri olan Gündoğdu Mobilya fabrikasında yangın çıktı. Günebakış Trabzon Haber WhatsApp İhbar Hattı’na gelen ilk görüntülere göre, yangının fabrikanın baca kısmında başladığı görüldü. Elde edilen bilgilere göre, fabrikaya ait hızar tozu deposunda henüz belirlenemeyen bir nedenle alevler yükseldi. Çevredeki vatandaşların ve fabrika görevlilerinin durumu fark ederek ihbarda bulunması üzerine, olay yerine çok sayıda itfaiye ekibi sevk edildi. Korkutan yangında ilk belirlemelere göre herhangi bir can kaybı ya da yaralanmanın olmadığı öğrenildi. İtfaiye ekiplerinin fabrikadaki yangını kontrol altına alma, söndürme ve soğutma çalışmaları ise tüm hızıyla devam ettiği kaydedildi.","Trabzon Arsin OSB'de Korkutan Yangın! Trabzon Arsin OSB'de Korkutan Yangın! Gunebakış Trabzon Arsin Organize Sanayi Bölgesi’ndeki Gündoğdu Mobilya fabrikasında yangın çıktı. 26 Haziran 2026 Cuma, 26 Haziran 2026 - Trabzon Gündemi Trabzon Arsin OSB'de Korkutan Yangın! Trabzon’un Arsin ilçesinde bulunan Organize Sanayi Bölgesi’nde (OSB) korku dolu anlar yaşandı. Bölgenin en çok işçi çalıştıran köklü kuruluşlarından biri olan Gündoğdu Mobilya fabrikasında yangın çıktı. Hızar Tozu Deposu Alev Aldı Günebakış Trabzon Haber WhatsApp İhbar Hattı’na gelen ilk görüntülere göre, yangının fabrikanın baca kısmında başladığı görüldü. Elde edilen bilgilere göre, fabrikaya ait hızar tozu deposunda henüz belirlenemeyen bir nedenle alevler yükseldi. İtfaiye Ekipleri Sevk Edildi Çevredeki vatandaşların ve fabrika görevlilerinin durumu fark ederek ihbarda bulunması üzerine, olay yerine çok sayıda itfaiye ekibi sevk edildi. Can Kaybı ve Yaralı Yok Korkutan yangında ilk belirlemelere göre herhangi bir can kaybı ya da yaralanmanın olmadığı öğrenildi. İtfaiye ekiplerinin fabrikadaki yangını kontrol altına alma, söndürme ve soğutma çalışmaları ise tüm hızıyla devam ettiği kaydedildi. YORUM YAP Trabzon'da Acı Haber! 4 Gündür Haber Alınamıyordu YKS Sonrası Ailesi Evde Ölü Buldu Trabzon'da Bir Dedenin Fedakarlığı! 7 yıl 20 gün hapis Trabzon'da KTÜ'den Tarihi Başarı! Dünya Sıralamasında 54 Basamak Birden Yükseldi Karadeniz’in En Başarılı Belediye Başkanları Anketinde Trabzon’dan 3 Başkan Öne Çıktı 26 Haziran 2026 Cuma, 26 Haziran 2026 - Trabzon Gündemi Trabzon Arsin OSB'de Korkutan Yangın! Trabzon Arsin OSB'de Korkutan Yangın! Hızar Tozu Deposu Alev Aldı İtfaiye Ekipleri Sevk Edildi Trabzon’un Arsin ilçesinde bulunan Organize Sanayi Bölgesi’nde (OSB) korku dolu anlar yaşandı. Günebakış Trabzon Haber WhatsApp İhbar Hattı’na gelen ilk görüntülere göre, yangının fabrikanın baca kısmında başladığı görüldü. Çevredeki vatandaşların ve fabrika görevlilerinin durumu fark ederek ihbarda bulunması üzerine, olay yerine çok sayıda itfaiye ekibi sevk edildi. Korkutan yangında ilk belirlemelere göre herhangi bir can kaybı ya da yaralanmanın olmadığı öğrenildi.",browser_full_article,https://www.gunebakis.com.tr/amp/trabzon-arsin-osbde-korkutan-yangin/28239779,Trabzon,Arsin,Arsin OSB | Trabzon Arsin OSB | Gunebakış Trabzon Arsin Organize Sanayi,,Hızar Tozu Deposu,,,firma yok,Hızar Tozu Deposu Arsin OSB Arsin Trabzon Türkiye,Oyman Makina Ltd,Oyman Makina Ltd,"firma adı yok, tesis/lokasyon ile maps tahmini var",36.36363636363637,Trabzon Arsin Organize Sanayi Bölge Müdürlüğü | Akmanlar Damper,169.25,4
