published,search_term,category,title,summary,link,matched_words,activity_type,raw_text,entity_source_text,article_fetch_status,resolved_article_url,city_candidates,district_candidates,neighborhood_candidates,street_candidates,facility_candidates,company_candidates,company_candidate_scores,entity_quality_note,maps_queries,maps_candidates,maps_best_guess,maps_status,maps_match_scores,maps_rejected_candidates,record_quality_score,duplicate_group_id
2026-07-18 09:36:00,para aklama,Kara Para / MASAK / Bahis,MASAK'tan devrim niteliğinde karar: Kara para aklamada yeni dönem başladı!,MASAK'tan devrim niteliğinde karar: Kara para aklamada yeni dönem başladı! MANŞET İZ,https://news.google.com/rss/articles/CBMinAFBVV95cUxNTWZjT0VrOWxEeldQWk5ocnJ5QkpNUGxIeVRtX1BCSF9JZ1Z3bmpUR21sSkwzSDVEakFZOGxmcm1mb05ia1JNSDZIQXRtU1kwSjZZQmNPWGN0alB0empoOWlRRmM2Ti14OVNJME5ocHJwYWtBM2ZXNGt4djItNEhKWW1yNzhxdl9BX0xWb3R0NlJ6RTBEUk9VY3BvdGg?oc=5,masak,,"MASAK 2026-2030 strateji belgesini açıkladı! Kara para aklama ve terörün finansmanıyla mücadelede neler değişiyor? İşte şirketleri ve vatandaşları yakından ilgilendiren yeni denetim kuralları.. MASAK 2026-2030 strateji belgesini açıkladı! Kara para aklama ve terörün finansmanıyla mücadelede neler değişiyor? İşte şirketleri ve vatandaşları yakından ilgilendiren yeni denetim kuralları.. MASAK 2026-2030 strateji belgesini açıkladı! Kara para aklama ve terörün finansmanıyla mücadelede neler değişiyor? İşte şirketleri ve vatandaşları yakından ilgilendiren yeni denetim kuralları.. Gündem Ege Ekonomi İzmir Magazin Spor Politika Asayiş Çevre Sağlık Dünya Foto MASAK'tan devrim niteliğinde karar: Kara para aklamada yeni dönem başladı! MASAK 2026-2030 strateji belgesini açıkladı! Kara para aklama ve terörün finansmanıyla mücadelede neler değişiyor? İşte şirketleri ve vatandaşları yakından ilgilendiren yeni denetim kuralları.. Onurcan Kurtay Editör 18.07.2026 - 12:36 Yayınlanma Paylaş Linkedin Pinterest Telegram Yazdır Kopyala A - A + Paylaş Linkedin Pinterest Telegram Yazdır Kopyala A - A + Mali Suçları Araştırma Kurulu (MASAK) Başkanlığı, 2026-2030 yıllarını kapsayan yeni strateji belgesi çerçevesinde kara para aklama ve terörün finansmanı suçlarıyla mücadelede denetim mekanizmalarını güçlendirecek kapsamlı bir eylem planını devreye alıyor. ""Suç Gelirlerinin Aklanması ve Terörizmin Finansmanı ile Mücadele ve Müsadere Uygulamalarında Etkinliğin Artırılması Strateji Belgesi"" adıyla hazırlanan doküman, şüpheli işlemlerin önceliklendirilmesinden elektronik kayıt altyapısının genişletilmesine, kamu kurumları arasındaki koordinasyonun artırılmasına kadar geniş bir yelpazede yeni tedbirler öngörüyor. Giydiği tayt nedeniyle gündem olan vali görevden alındı İçeriği Görüntüle HEDEF, SUÇ GELİRİNDEN CAYDIRICI SONUÇ ALMAK Strateji belgesiyle Türkiye'de kara para aklama ve terörizmin finansmanı suçlarına ilişkin el koyma ve müsadere süreçlerinin adli ve idari boyutlarda daha etkili yürütülmesi amaçlanıyor. Belgede, ilgili yükümlülüklere uyumun artırılmasının yanı sıra suçluların elde ettikleri suç gelirinden fiilen mahrum bırakılmasına yönelik önleyici ve bastırıcı tedbirlerin kurumlar arası koordinasyonla hayata geçirilmesi de hedefler arasında sayılıyor. YÜKSEK RİSKLİ SUÇLARDA SORUŞTURMA ÖNCELİĞİ Eylem planına göre, Adalet Bakanlığı Ceza İşleri Genel Müdürlüğünün genelgesinde yüksek riskli kategoride tanımlanan suç tipleri ile nakit kontrolü kapsamında açılan adli soruşturmalarda yeni bir yaklaşım benimsenecek. Bu dosyalarda aklama suçunun işlendiğine dair emare bulunması halinde, ayrı bir soruşturmanın öncelikli olarak başlatılması sağlanacak. Karmaşık yapıdaki vakalara ilişkin şüpheli işlem bildirimleri de MASAK tarafından öncelikli olarak analiz edilecek, kurumdan gelen adli taleplerin yanıtlanma süreci hızlandırılacak. MASAK'ın hazırladığı raporların sonraki aşamalarda nasıl bir seyir izlediği ise ilgili kurumların katkısıyla sistematik biçimde izlenecek. KAĞIT KAYITLAR TARİH OLUYOR, TERÖR FİNANSMANINDA EŞ ZAMANLI SORUŞTURMA Planın önemli ayaklarından birini eski kayıtların dijital ortama taşınması oluşturuyor. Ticaret sicilindeki temel bilgilerin doğruluğunun teyidi için kamuya ait diğer veri sistemlerinden alınacak ek bilgilerle çapraz kontrol yapılacak, pay defterinin elektronik ortamda tutulması zorunluluğunun kapsamı genişletilerek geçmişe dönük kayıtların da sisteme aktarılması sağlanacak. Öte yandan finansman unsuru taşıyan her terörizm vakasında, ana soruşturmayla eş zamanlı olarak ayrı bir ""terörizmin finansmanı"" soruşturması açılması usul haline getirilecek. GERÇEK FAYDALANICI BİLGİLERİ ÇAPRAZ DENETİMDEN GEÇECEK Şirketlerin gerçek faydalanıcılık siciline yaptığı bildirimlerdeki olası hataların ortaya çıkarılması için Ticaret Bakanlığı ile Gelir İdaresi Başkanlığı, en az altı ayda bir ortak çalışma yürütecek. Gerçek faydalanıcılık sicili ile ticaret sicili arasında açıklanamayan bir uyumsuzluk tespit edilmesi durumunda, ilgili veriler gerekçeleriyle birlikte MASAK'a ve Vergi Denetim Kurulu Başkanlığına iletilecek. Bu tür durumlarda mükellefin risk analizi çalışmalarına dahil edilerek denetim programına alınması da ayrıca değerlendirmeye tabi tutulacak. YENİ ÇALIŞMA GRUPLARI KURUMLAR ARASI KOORDİNASYONU ARTIRACAK Strateji belgesinin uygulanmasını desteklemek amacıyla, kara para aklama ve terörizmin finansmanına dair tehdit ile kırılganlıkların değerlendirildiği mevcut çalışma gruplarına bağlı yeni alt gruplar oluşturulacak. Aklama ve Terörizmin Finansmanı Tehditleri Çalışma Grupları, MASAK temsilcisinin koordinasyonunda; Adalet Bakanlığı, Hakimler ve Savcılar Kurulu, İçişleri Bakanlığına bağlı ilgili birimler, Ticaret Bakanlığı Gümrükler Muhafaza Genel Müdürlüğü, Hazine ve Maliye Bakanlığı Muhasebat Genel Müdürlüğü, Çevre, Şehircilik ve İklim Değişikliği Bakanlığı Milli Emlak Genel Müdürlüğü ile Türkiye Cumhuriyet Merkez Bankasının teknik uzmanlarından oluşacak şekilde yapılandırılacak. İhtiyaç duyulması halinde bu gruplara bağlı olarak mevzuat geliştirme önerilerinin ele alınacağı Mevzuat Alt Çalışma Grubu ile devam eden operasyonel vakaların görüşüleceği Vaka Alt Çalışma Grubu da kurulabilecek. Ayrıca Kırılganlık Çalışma Grubu ve Yaptırımların İzlenmesi Çalışma Grubunun oluşturulması da planlanıyor. SONUÇLAR DÜZENLİ OLARAK CUMHURBAŞKANLIĞINA RAPORLANACAK Oluşturulacak ana çalışma gruplarının en az üç ayda bir bir araya gelmesi öngörülüyor. Strateji belgesi kapsamında belirlenen ulusal politikaların uygulanma durumu, stratejik amaç ve hedeflere ne ölçüde ulaşıldığı, faaliyetlerin gerçekleşme seviyesi, uygulamada karşılaşılan sorunlar ve bu sorunlara yönelik çözüm önerileri periyodik olarak Cumhurbaşkanlığına sunulacak. Böylece 2026-2030 döneminde kara para aklama ve terörün finansmanıyla mücadelede atılan adımların etkinliği merkezi düzeyde takip edilmiş olacak. Kaynak: HABER MERKEZİ Editörün Seçtiği İzmir’in hava trafiğinde dikkat çeken tablo: Yaz sezonunda Adnan Menderes'te dış hatlarda düşüş Editörün Seçtiği Göztepe yeni sezon formasını tanıttı: Formanın rengi ne? Editörün Seçtiği İzmir'de iskele 7. kattan düştü: 3 kardeş yaralı Editör Hakkında Onurcan Kurtay Bunlar da ilginizi çekebilir M","MASAK'tan devrim niteliğinde karar: Kara para aklamada yeni dönem başladı! MASAK'tan devrim niteliğinde karar: Kara para aklamada yeni dönem başladı! MANŞET İZ MASAK 2026-2030 strateji belgesini açıkladı! Kara para aklama ve terörün finansmanıyla mücadelede neler değişiyor? İşte şirketleri ve vatandaşları yakından ilgilendiren yeni denetim kuralları.. Gündem Ege Ekonomi İzmir Magazin Spor Politika Asayiş Çevre Sağlık Dünya Foto MASAK'tan devrim niteliğinde karar: Kara para aklamada yeni dönem başladı! Onurcan Kurtay Editör 18.07.2026 - 12:36 Yayınlanma Paylaş Linkedin Pinterest Telegram Yazdır Kopyala A - A + Paylaş Linkedin Pinterest Telegram Yazdır Kopyala A - A + Mali Suçları Araştırma Kurulu (MASAK) Başkanlığı, 2026-2030 yıllarını kapsayan yeni strateji belgesi çerçevesinde kara para aklama ve terörün finansmanı suçlarıyla mücadelede denetim mekanizmalarını güçlendirecek kapsamlı bir eylem planını devreye alıyor. ""Suç Gelirlerinin Aklanması ve Terörizmin Finansmanı ile Mücadele ve Müsadere Uygulamalarında Etkinliğin Artırılması Strateji Belgesi"" adıyla hazırlanan doküman, şüpheli işlemlerin önceliklendirilmesinden elektronik kayıt altyapısının genişletilmesine, kamu kurumları arasındaki koordinasyonun artırılmasına kadar geniş bir yelpazede yeni tedbirler öngörüyor. Giydiği tayt nedeniyle gündem olan vali görevden alındı İçeriği Görüntüle HEDEF, SUÇ GELİRİNDEN CAYDIRICI SONUÇ ALMAK Strateji belgesiyle Türkiye'de kara para aklama ve terörizmin finansmanı suçlarına ilişkin el koyma ve müsadere süreçlerinin adli ve idari boyutlarda daha etkili yürütülmesi amaçlanıyor. Belgede, ilgili yükümlülüklere uyumun artırılmasının yanı sıra suçluların elde ettikleri suç gelirinden fiilen mahrum bırakılmasına yönelik önleyici ve bastırıcı tedbirlerin kurumlar arası koordinasyonla hayata geçirilmesi de hedefler arasında sayılıyor. YÜKSEK RİSKLİ SUÇLARDA SORUŞTURMA ÖNCELİĞİ Eylem planına göre, Adalet Bakanlığı Ceza İşleri Genel Müdürlüğünün genelgesinde yüksek riskli kategoride tanımlanan suç tipleri ile nakit kontrolü kapsamında açılan adli soruşturmalarda yeni bir yaklaşım benimsenecek. Bu dosyalarda aklama suçunun işlendiğine dair emare bulunması halinde, ayrı bir soruşturmanın öncelikli olarak başlatılması sağlanacak. Karmaşık yapıdaki vakalara ilişkin şüpheli işlem bildirimleri de MASAK tarafından öncelikli olarak analiz edilecek, kurumdan gelen adli taleplerin yanıtlanma süreci hızlandırılacak. MASAK'ın hazırladığı raporların sonraki aşamalarda nasıl bir seyir izlediği ise ilgili kurumların katkısıyla sistematik biçimde izlenecek. KAĞIT KAYITLAR TARİH OLUYOR, TERÖR FİNANSMANINDA EŞ ZAMANLI SORUŞTURMA Planın önemli ayaklarından birini eski kayıtların dijital ortama taşınması oluşturuyor. Ticaret sicilindeki temel bilgilerin doğruluğunun teyidi için kamuya ait diğer veri sistemlerinden alınacak ek bilgilerle çapraz kontrol yapılacak, pay defterinin elektronik ortamda tutulması zorunluluğunun kapsamı genişletilerek geçmişe dönük kayıtların da sisteme aktarılması sağlanacak. Öte yandan finansman unsuru taşıyan her terörizm vakasında, ana soruşturmayla eş zamanlı olarak ayrı bir ""terörizmin finansmanı"" soruşturması açılması usul haline getirilecek. GERÇEK FAYDALANICI BİLGİLERİ ÇAPRAZ DENETİMDEN GEÇECEK Şirketlerin gerçek faydalanıcılık siciline yaptığı bildirimlerdeki olası hataların ortaya çıkarılması için Ticaret Bakanlığı ile Gelir İdaresi Başkanlığı, en az altı ayda bir ortak çalışma yürütecek. Gerçek faydalanıcılık sicili ile ticaret sicili arasında açıklanamayan bir uyumsuzluk tespit edilmesi durumunda, ilgili veriler gerekçeleriyle birlikte MASAK'a ve Vergi Denetim Kurulu Başkanlığına iletilecek. Bu tür durumlarda mükellefin risk analizi çalışmalarına dahil edilerek denetim programına alınması da ayrıca değerlendirmeye tabi tutulacak. YENİ ÇALIŞMA GRUPLARI KURUMLAR ARASI KOORDİNASYONU ARTIRACAK Strateji belgesinin uygulanmasını desteklemek amacıyla, kara para aklama ve terörizmin finansmanına dair tehdit ile kırılganlıkların değerlendirildiği mevcut çalışma gruplarına bağlı yeni alt gruplar oluşturulacak. Aklama ve Terörizmin Finansmanı Tehditleri Çalışma Grupları, MASAK temsilcisinin koordinasyonunda; Adalet Bakanlığı, Hakimler ve Savcılar Kurulu, İçişleri Bakanlığına bağlı ilgili birimler, Ticaret Bakanlığı Gümrükler Muhafaza Genel Müdürlüğü, Hazine ve Maliye Bakanlığı Muhasebat Genel Müdürlüğü, Çevre, Şehircilik ve İklim Değişikliği Bakanlığı Milli Emlak Genel Müdürlüğü ile Türkiye Cumhuriyet Merkez Bankasının teknik uzmanlarından oluşacak şekilde yapılandırılacak. İhtiyaç duyulması halinde bu gruplara bağlı olarak mevzuat geliştirme önerilerinin ele alınacağı Mevzuat Alt Çalışma Grubu ile devam eden operasyonel vakaların görüşüleceği Vaka Alt Çalışma Grubu da kurulabilecek. Ayrıca Kırılganlık Çalışma Grubu ve Yaptırımların İzlenmesi Çalışma Grubunun oluşturulması da planlanıyor. SONUÇLAR DÜZENLİ OLARAK CUMHURBAŞKANLIĞINA RAPORLANACAK Oluşturulacak ana çalışma gruplarının en az üç ayda bir bir araya gelmesi öngörülüyor. Strateji belgesi kapsamında belirlenen ulusal politikaların uygulanma durumu, stratejik amaç ve hedeflere ne ölçüde ulaşıldığı, faaliyetlerin gerçekleşme seviyesi, uygulamada karşılaşılan sorunlar ve bu sorunlara yönelik çözüm önerileri periyodik olarak Cumhurbaşkanlığına sunulacak. Böylece 2026-2030 döneminde kara para aklama ve terörün finansmanıyla mücadelede atılan adımların etkinliği merkezi düzeyde takip edilmiş olacak. Kaynak: HABER MERKEZİ Editörün Seçtiği İzmir’in hava trafiğinde dikkat çeken tablo: Yaz sezonunda Adnan Menderes'te dış hatlarda düşüş Editörün Seçtiği Göztepe yeni sezon formasını tanıttı: Formanın rengi ne? Editörün Seçtiği İzmir'de iskele 7.",browser_full_article,https://www.mansetiz.com/masaktan-devrim-niteliginde-karar-kara-para-aklamada-yeni-donem-basladi,İzmir,Menderes,,,,,,firma yok | faaliyet/tesis yok,,,,maps araması yapılmadı,,,107.0,14
2026-07-17 10:52:00,para aklama,Kara Para / MASAK / Bahis,"Banka İhbar Etti, MASAK Harekete Geçti! Oğuzhan Uğur’un Hesaplarındaki Para Trafiği Dikkat Çekti! İşte O Suçlamalar","Banka İhbar Etti, MASAK Harekete Geçti! Oğuzhan Uğur’un Hesaplarındaki Para Trafiği Dikkat Çekti! İşte O Suçlamalar politikam.com",https://news.google.com/rss/articles/CBMimwFBVV95cUxPeV9fQWlWQnhJWkhaUVlLV0pDTGFxSmh1aThQd1pLeHRDa0QxZm9YdjE0a3BpcUQzWkVETUU4TXhCZ3EzTUJ3am9zbkhEQXVYNE8yMG5lS0lGS2w4NTFqdjF6MDBPNWx1VVlKZ282VlZkcjJlalp6NGFMLU5qYnJKTlh5VzR4dmJRbHZUdExMTVVHTmI2UVVyRFJNRQ?oc=5,"banka, masak",finansal kuruluş,"Banka İhbar Etti, MASAK Harekete Geçti! Oğuzhan Uğur’un Hesaplarındaki Para Trafiği Dikkat Çekti! İşte O Suçlamalar politikam.com","Banka İhbar Etti, MASAK Harekete Geçti! Oğuzhan Uğur’un Hesaplarındaki Para Trafiği Dikkat Çekti! İşte O Suçlamalar Banka İhbar Etti, MASAK Harekete Geçti! Oğuzhan Uğur’un Hesaplarındaki Para Trafiği Dikkat Çekti! İşte O Suçlamalar politikam.com Banka İhbar Etti, MASAK Harekete Geçti! Oğuzhan Uğur’un Hesaplarındaki Para Trafiği Dikkat Çekti! İşte O Suçlamalar politikam.com",browser_failed,https://news.google.com/rss/articles/CBMimwFBVV95cUxPeV9fQWlWQnhJWkhaUVlLV0pDTGFxSmh1aThQd1pLeHRDa0QxZm9YdjE0a3BpcUQzWkVETUU4TXhCZ3EzTUJ3am9zbkhEQXVYNE8yMG5lS0lGS2w4NTFqdjF6MDBPNWx1VVlKZ282VlZkcjJlalp6NGFMLU5qYnJKTlh5VzR4dmJRbHZUdExMTVVHTmI2UVVyRFJNRQ?oc=5&hl=tr&gl=TR&ceid=TR:tr,,,,,,,,il yok | ilçe yok | firma yok | faaliyet/tesis yok,,,,maps araması yapılmadı,,,97.04,15
2026-07-17 13:07:56,sahtecilik,Diğer,Çankırı etiketiyle satılacak 49 ton sahte tuza gümrükte el konuldu,Çankırı etiketiyle satılacak 49 ton sahte tuza gümrükte el konuldu havadis.com,https://news.google.com/rss/articles/CBMiqAFBVV95cUxNWW9tajRoRjlOQXBIR2VsQ1lzSUlTZWR3czM5NHhabUJIdGllTTJNYjNFMTUwSjU1SjlMUVktLUxYRVpDTXM1aHRCalJEWTlkd0dfMXRzSG9Yd0xuNXRFeUFJLXpRNmZSam5tQ0M2dXpRWDgzS0NXY1VrZHozNnozMXZTTVNycGtiaFpfd0M1NG9xTkNVYng0MmZCMDM2cE5sVFhReS1NNlU?oc=5,"el konuldu, gümrük",,Çankırı etiketiyle satılacak 49 ton sahte tuza gümrükte el konuldu havadis.com,Çankırı etiketiyle satılacak 49 ton sahte tuza gümrükte el konuldu Çankırı etiketiyle satılacak 49 ton sahte tuza gümrükte el konuldu havadis.com Çankırı etiketiyle satılacak 49 ton sahte tuza gümrükte el konuldu havadis.com,browser_failed,https://news.google.com/rss/articles/CBMiqAFBVV95cUxNWW9tajRoRjlOQXBIR2VsQ1lzSUlTZWR3czM5NHhabUJIdGllTTJNYjNFMTUwSjU1SjlMUVktLUxYRVpDTXM1aHRCalJEWTlkd0dfMXRzSG9Yd0xuNXRFeUFJLXpRNmZSam5tQ0M2dXpRWDgzS0NXY1VrZHozNnozMXZTTVNycGtiaFpfd0M1NG9xTkNVYng0MmZCMDM2cE5sVFhReS1NNlU?oc=5&hl=tr&gl=TR&ceid=TR:tr,,,,,,,,il yok | ilçe yok | firma yok | faaliyet/tesis yok,,,,maps araması yapılmadı,,,61.28,16
2026-07-18 08:17:17,depo yangını,Fiziksel Risk / Yangın,Babaeski'de depo yangını itfaiye ekiplerince kontrol altına alındı,Babaeski'de depo yangını itfaiye ekiplerince kontrol altına alındı Yeni Birlik Gazetesi,https://news.google.com/rss/articles/CBMiuAFBVV95cUxQamJFRUpUSThaQjM5V0MzSzJTZHhTUlNVUkd2SXR3SzRfa1VMcS1WYjd5MTBrckh0dVNRSktSQmtYV2Q2M0Vyaklac2xzaFRpT1VMQ0xvbjJsYWhFRnRoNkF2VnBDM2NPX0NYWGNhcjFFMkNqQUtXeWNLOWFDcXBvUE16RTFIcmhKblRNME0wU25XcWZqZlRfaUJXOEljS19LajJQS01DeGpyTlJZdTN1dEhsdTJibXc2?oc=5,depo,depo,Babaeski'de depo yangını itfaiye ekiplerince kontrol altına alındı Yeni Birlik Gazetesi,Babaeski'de depo yangını itfaiye ekiplerince kontrol altına alındı Babaeski'de depo yangını itfaiye ekiplerince kontrol altına alındı Yeni Birlik Gazetesi Babaeski'de depo yangını itfaiye ekiplerince kontrol altına alındı Yeni Birlik Gazetesi,browser_failed,https://news.google.com/rss/articles/CBMiuAFBVV95cUxQamJFRUpUSThaQjM5V0MzSzJTZHhTUlNVUkd2SXR3SzRfa1VMcS1WYjd5MTBrckh0dVNRSktSQmtYV2Q2M0Vyaklac2xzaFRpT1VMQ0xvbjJsYWhFRnRoNkF2VnBDM2NPX0NYWGNhcjFFMkNqQUtXeWNLOWFDcXBvUE16RTFIcmhKblRNME0wU25XcWZqZlRfaUJXOEljS19LajJQS01DeGpyTlJZdTN1dEhsdTJibXc2?oc=5&hl=tr&gl=TR&ceid=TR:tr,Kırklareli,Babaeski,,,,,,firma yok | faaliyet/tesis yok,,,,maps araması yapılmadı,,,99.62,17
2026-07-17 16:29:02,depo yangını,Fiziksel Risk / Yangın,"Mersin Hali’nde Depo Yangını: Kasalar Yandı, İtfaiye Faciyı Önledi!","Mersin Hali’nde Depo Yangını: Kasalar Yandı, İtfaiye Faciyı Önledi! Mersin Haber",https://news.google.com/rss/articles/CBMiV0FVX3lxTE9SZkx1NEYwa0FtUy1hNnl1eHBlcFZGSjZoZ29xcVA2Z2lfSkVCbmVzcmlPbXdJVVl3NjlpVUMxaHF5ZVR4RG5LUGZYUFFIa25wbTlMdXFyWdIBV0FVX3lxTE9SZkx1NEYwa0FtUy1hNnl1eHBlcFZGSjZoZ29xcVA2Z2lfSkVCbmVzcmlPbXdJVVl3NjlpVUMxaHF5ZVR4RG5LUGZYUFFIa25wbTlMdXFyWQ?oc=5,depo,depo,"Mersin Hali’nde Depo Yangını: Kasalar Yandı, İtfaiye Faciyı Önledi! Mersin genelinde sıcak havalarla birlikte art arda gelen yangın haberlerine bir yenisi daha eklendi. Akdeniz ilçesinde bulunan Mersin Sebze ve Meyve Hali içerisindeki bir işletmeye ait kasaların bulunduğu depoda henüz belirlenemeyen bir nedenle yangın çıktı. 17 Temmuz 2026 @mersinhaber 'i takip et Binlerce ahşap ve plastik kasanın tutuşmasıyla büyüyen alevler hal esnafına büyük korku yaşattı. Alevler Bir Anda Büyüdü, Esnaf Seferber Oldu Edinilen bilgilere göre; hal kompleksi içindeki bir işletmenin depo bölümünden dumanların yükseldiğini gören esnaflar ve vatandaşlar duruma hemen müdahale etmeye çalıştı. Ancak depoda istifli halde bulunan ahşap ve plastik malzemelerin hızla tutuşmasıyla alevler kısa sürede tüm depoyu kapladı. Durumun 112 Acil Çağrı Merkezi'ne bildirilmesi üzerine olay yerine çok sayıda Mersin Büyükşehir Belediyesi itfaiye ekibi ve polis sevk edildi. Diğer Depolara Sıçramadan Kontrol Altına Alındı Mersin Hali gibi dükkanların yan yana ve bitişik nizamda bulunduğu kritik bir bölgede çıkan yangına, itfaiye ekipleri çok hızlı bir şekilde müdahale etti. İtfaiye erlerinin yoğun ve profesyonel çalışması sayesinde alevler, çevredeki diğer komşu depolara sıçramadan kontrol altına alınarak tamamen söndürüldü. Büyük Çapta Hasar Oluştu, Can Kaybı Yok Yangın sonrasında soğutma çalışmaları uzun süre devam ederken, depoda bulunan binlerce ahşap ve plastik kasa tamamen yanarak kül oldu. Olayda herhangi bir can kaybı ya da yaralanmanın yaşanmaması en büyük teselli olurken, yanan depoda büyük çapta maddi hasar meydana geldi. Polis ve itfaiye ekipleri, yangının çıkış nedenini belirlemek üzere geniş çaplı soruşturma başlattı. Ad Mersin Hali’nde Depo Yangını: Kasalar Yandı, İtfaiye Faciyı Önledi! Mersin genelinde sıcak havalarla birlikte art arda gelen yangın haberlerine bir yenisi daha eklendi. Akdeniz ilçesinde bulunan Mersin Sebze ve Meyve Hali içerisindeki bir işletmeye ait kasaların bulunduğu depoda henüz belirlenemeyen bir nedenle yangın çıktı. 17 Temmuz 2026 @mersinhaber 'i takip et Binlerce ahşap ve plastik kasanın tutuşmasıyla büyüyen alevler hal esnafına büyük korku yaşattı. Alevler Bir Anda Büyüdü, Esnaf Seferber Oldu Edinilen bilgilere göre; hal kompleksi içindeki bir işletmenin depo bölümünden dumanların yükseldiğini gören esnaflar ve vatandaşlar duruma hemen müdahale etmeye çalıştı. Ancak depoda istifli halde bulunan ahşap ve plastik malzemelerin hızla tutuşmasıyla alevler kısa sürede tüm depoyu kapladı. Durumun 112 Acil Çağrı Merkezi'ne bildirilmesi üzerine olay yerine çok sayıda Mersin Büyükşehir Belediyesi itfaiye ekibi ve polis sevk edildi. Diğer Depolara Sıçramadan Kontrol Altına Alındı Mersin Hali gibi dükkanların yan yana ve bitişik nizamda bulunduğu kritik bir bölgede çıkan yangına, itfaiye ekipleri çok hızlı bir şekilde müdahale etti. İtfaiye erlerinin yoğun ve profesyonel çalışması sayesinde alevler, çevredeki diğer komşu depolara sıçramadan kontrol altına alınarak tamamen söndürüldü. Büyük Çapta Hasar Oluştu, Can Kaybı Yok Yangın sonrasında soğutma çalışmaları uzun süre devam ederken, depoda bulunan binlerce ahşap ve plastik kasa tamamen yanarak kül oldu. Olayda herhangi bir can kaybı ya da yaralanmanın yaşanmaması en büyük teselli olurken, yanan depoda büyük çapta maddi hasar meydana geldi. Polis ve itfaiye ekipleri, yangının çıkış nedenini belirlemek üzere geniş çaplı soruşturma başlattı. Daha fazlası ve daha hızlı bilgi için sizde; Facebook'ta @mersihnaber 'i Instagram'da @mersinhaber 'i veya Twitter'da @mersinhaber 'i takip edebilirsiniz. İlk olarak anlık gelişmeleri sosyal medya hesaplarımızdan payla","Mersin Hali’nde Depo Yangını: Kasalar Yandı, İtfaiye Faciyı Önledi! Mersin Hali’nde Depo Yangını: Kasalar Yandı, İtfaiye Faciyı Önledi! Mersin Haber Mersin Hali’nde Depo Yangını: Kasalar Yandı, İtfaiye Faciyı Önledi! Mersin genelinde sıcak havalarla birlikte art arda gelen yangın haberlerine bir yenisi daha eklendi. Akdeniz ilçesinde bulunan Mersin Sebze ve Meyve Hali içerisindeki bir işletmeye ait kasaların bulunduğu depoda henüz belirlenemeyen bir nedenle yangın çıktı. 17 Temmuz 2026 @mersinhaber 'i takip et Binlerce ahşap ve plastik kasanın tutuşmasıyla büyüyen alevler hal esnafına büyük korku yaşattı. Alevler Bir Anda Büyüdü, Esnaf Seferber Oldu Edinilen bilgilere göre; hal kompleksi içindeki bir işletmenin depo bölümünden dumanların yükseldiğini gören esnaflar ve vatandaşlar duruma hemen müdahale etmeye çalıştı. Ancak depoda istifli halde bulunan ahşap ve plastik malzemelerin hızla tutuşmasıyla alevler kısa sürede tüm depoyu kapladı. Durumun 112 Acil Çağrı Merkezi'ne bildirilmesi üzerine olay yerine çok sayıda Mersin Büyükşehir Belediyesi itfaiye ekibi ve polis sevk edildi. Diğer Depolara Sıçramadan Kontrol Altına Alındı Mersin Hali gibi dükkanların yan yana ve bitişik nizamda bulunduğu kritik bir bölgede çıkan yangına, itfaiye ekipleri çok hızlı bir şekilde müdahale etti. İtfaiye erlerinin yoğun ve profesyonel çalışması sayesinde alevler, çevredeki diğer komşu depolara sıçramadan kontrol altına alınarak tamamen söndürüldü. Büyük Çapta Hasar Oluştu, Can Kaybı Yok Yangın sonrasında soğutma çalışmaları uzun süre devam ederken, depoda bulunan binlerce ahşap ve plastik kasa tamamen yanarak kül oldu. Olayda herhangi bir can kaybı ya da yaralanmanın yaşanmaması en büyük teselli olurken, yanan depoda büyük çapta maddi hasar meydana geldi. Polis ve itfaiye ekipleri, yangının çıkış nedenini belirlemek üzere geniş çaplı soruşturma başlattı. Ad Mersin Hali’nde Depo Yangını: Kasalar Yandı, İtfaiye Faciyı Önledi!",browser_full_article,https://www.mersinhaber.com/amp/haber/706354,Mersin,Akdeniz,,,,,,firma yok | faaliyet/tesis yok,,,,maps araması yapılmadı,,,104.5,18
