published,search_term,category,title,summary,link,matched_words,activity_type,raw_text,entity_source_text,article_fetch_status,resolved_article_url,city_candidates,district_candidates,neighborhood_candidates,street_candidates,facility_candidates,company_candidates,company_candidate_scores,entity_quality_note,maps_queries,maps_candidates,maps_best_guess,maps_status,maps_match_scores,maps_rejected_candidates,record_quality_score,duplicate_group_id
2026-07-03 18:41:00,yangın,Fiziksel Risk / Yangın,Ankara'da Trump'ın kalacağı otelin yakınında yangın: Metro istasyonu kapatıldı,Ankara'da Trump'ın kalacağı otelin yakınında yangın: Metro istasyonu kapatıldı soL Haber,https://news.google.com/rss/articles/CBMiswFBVV95cUxOSmJmRG43QlhCQnNKWnNnbEJUamlDRWktMjM0QjB2X01SSlZPMWxxQ2kxSGVodFpKOGpYQ0lvTnVlMkQ5TTZCdWZLYzhkTlViaGJxbTRqbUdQMThGTXF5ZFJVMThQSkhkT2daUnFSSFVYa2JEdUhjdTRwY3hBdXM5T2c5V3d3TFJMVEQ1QjRKVHpnWW85VURYU1RRMGVUS3J3NUVKdjFOU0ZLNnpMMGVnTUlOMA?oc=5,istasyon,akaryakıt tesisi,"NATO zirvesi için Ankara'ya gelecek olan ABD Başkanı Donald Trump'ın konaklayacağı otelin yakınındaki YDA Center'da yangın çıktı. Kontrol altına alınan... Ankara'da Trump'ın kalacağı otelin yakınında yangın: Metro istasyonu kapatıldı | soL haber Ankara'da Trump'ın kalacağı otelin yakınında yangın: Metro istasyonu kapatıldı NATO zirvesi için Ankara'ya gelecek olan ABD Başkanı Donald Trump'ın konaklayacağı otelin yakınındaki YDA Center'da yangın çıktı. Kontrol altına alınan yangın nedeniyle Söğütözü Metro İstasyonu geçici olarak kapatıldı. Haber Merkezi Yayın Tarihi: 04.07.2026 , 00:41 Ankara'da ABD Başkanı Donald Trump’ın NATO zirvesi ziyareti sırasında konaklayacağı JW Marriott Otel'in yakınında bulunan YDA Center'ın satış ofisinde yangın çıktı. Yangın nedeniyle oluşan yoğun dumanın istasyona ulaşması üzerine Söğütözü Metrosu geçici olarak hizmete kapatıldı. ABB: Yangın kontrol altında Ankara Büyükşehir Belediyesi (ABB) tarafından kazaya ilişkin yapılan açıklamada, Çankaya ilçesi Kızılırmak Mahallesi Dumlupınar Bulvarı'ndaki YDA Center satış ofisinde çıkan yangının kontrol altına alındığı bildirildi. İhbar üzerine itfaiye ekiplerinin hızla bölgeye sevk edildiği belirtilen açıklamada, ekiplerin satış ofisinin asma katında çıkan yangını büyük oranda kontrol altına aldığı ve soğutma çalışmalarının devam ettiği vurgulandı. Yaralı bulunmuyor Belediye açıklamasında, yangın nedeniyle dumandan etkilenen ya da yaralanan kimsenin olmadığı kaydedildi. Öte yandan, satış ofisindeki yangından yükselen dumanların metro istasyonu alanına ulaşması nedeniyle, Söğütözü Metro İstasyonu'nun önlem amaçlı geçici olarak kapatıldığı duyuruldu. soL Haber'i WhatsApp ve Telegram kanallarından takip edin, önemli gelişmeleri ve özel haberlerimizi kaçırmayın. İLGİLİ HABER NATO için ODTÜ yurtları boşaltılıyor: ODTÜ'lü öğrenciler eylem yaptı, 'Sokakta mı kalalım' diye sordu Haber Merkezi İLGİLİ HABER NATO için ODTÜ yurtları boşaltılıyor: ODTÜ'lü öğrenciler eylem yaptı, 'Sokakta mı kalalım' diye sordu soL YZ Beta, soL’un geliştirdiği ve soL arşiviyle çalışan bir yapay zeka robotudur. Kullanımı, soL abonelerine açıktır. Yükleniyor... Ankara'da Trump'ın kalacağı otelin yakınında yangın: Metro istasyonu kapatıldı NATO zirvesi için Ankara'ya gelecek olan ABD Başkanı Donald Trump'ın konaklayacağı otelin yakınındaki YDA Center'da yangın çıktı. Kontrol altına alınan yangın nedeniyle Söğütözü Metro İstasyonu geçici olarak kapatıldı. Haber Merkezi Yayın Tarihi: 04.07.2026 , 00:41 Ankara'da ABD Başkanı Donald Trump’ın NATO zirvesi ziyareti sırasında konaklayacağı JW Marriott Otel'in yakınında bulunan YDA Center'ın satış ofisinde yangın çıktı. Yangın nedeniyle oluşan yoğun dumanın istasyona ulaşması üzerine Söğütözü Metrosu geçici olarak hizmete kapatıldı. ABB: Yangın kontrol altında Ankara Büyükşehir Belediyesi (ABB) tarafından kazaya ilişkin yapılan açıklamada, Çankaya ilçesi Kızılırmak Mahallesi Dumlupınar Bulvarı'ndaki YDA Center satış ofisinde çıkan yangının kontrol altına alındığı bildirildi. İhbar üzerine itfaiye ekiplerinin hızla bölgeye sevk edildiği belirtilen açıklamada, ekiplerin satış ofisinin asma katında çıkan yangını büyük oranda kontrol altına aldığı ve soğutma çalışmalarının devam ettiği vurgulandı. Yaralı bulunmuyor Belediye açıklamasında, yangın nedeniyle dumandan etkilenen ya da yaralanan kimsenin olmadığı kaydedildi. Öte yandan, satış ofisindeki yangından yükselen dumanların metro istasyonu alanına ulaşması nedeniyle, Söğütözü Metro İstasyonu'nun önlem amaçlı geçici olarak kapatıldığı duyuruldu. soL Haber'i WhatsApp ve Telegram kanallarından takip edin, önemli gelişmeleri ve özel haberlerimizi kaçırmayın. İLGİLİ HABER NATO için ODTÜ yurtları boşaltılıyor: ODTÜ'lü öğrenciler eylem yaptı, 'Sokakta mı kalalım' diye sordu Haber Merkezi İLGİLİ HABER NATO için ODTÜ yurtları boşaltılıyor: ODTÜ'lü öğrenciler eylem yaptı, 'Sokakta mı kalalım' diye sordu soL YZ Beta, soL’un geliştirdiği ve soL arşiviyle çalışan bir yapay zeka robotudur. Kullanımı, soL abonelerine açıktır. Yükleniyor... Ankara'da Trump'ın kalacağı otelin yakınında yangın: Metro istasyonu kapatıldı NATO zirvesi için Ankara'ya gelecek olan ABD Başkanı Donald Trump'ın konaklayacağı otelin yakınındaki YDA Center'da yangın çıktı. Kontrol altına alınan yangın nedeniyle Söğütözü Metro İstasyonu geçici olarak kapatıldı. Haber Merkezi Yayın Tarihi: 04.07.2026 , 00:41 Ankara'da ABD Başkanı Donald Trump’ın NATO zirvesi ziyareti sırasında konaklayacağı JW Marriott Otel'in yakınında bulunan YDA Center'ın satış ofisinde yangın çıktı. Yangın nedeniyle oluşan yoğun dumanın istasyona ulaşması üzerine Söğütözü Metrosu geçici olarak hizmete kapatıldı. ABB: Yangın kontrol altında Ankara Büyükşehir Belediyesi (ABB) tarafından kazaya ilişkin yapılan açıklamada, Çankaya ilçesi Kızılırmak Mahallesi Dumlupınar Bulvarı'ndaki YDA Center satış ofisinde çıkan yangının kontrol altına alındığı bildirildi. İhbar üzerine itfaiye ekiplerinin hızla bölgeye sevk edildiği belirtilen açıklamada, ekiplerin satış ofisinin asma katında çıkan yangını büyük oranda kontrol altına aldığı ve soğutma çalışmalarının devam ettiği vurgulandı. Yaralı bulunmuyor Belediye açıklamasında, yangın nedeniyle dumandan etkilenen ya da yaralanan kimsenin olmadığı kaydedildi. Öte yandan, satış ofisindeki yangından yükselen dumanların metro istasyonu alanına ulaşması nedeniyle, Söğütözü Metro İstasyonu'nun önlem amaçlı geçici olarak kapatıldığı duyuruldu. soL Haber'i WhatsApp ve Telegram kanallarından takip edin, önemli gelişmeleri ve özel haberlerimizi kaçırmayın. İLGİLİ HABER NATO için ODTÜ yurtları boşaltılıyor: ODTÜ'lü öğrenciler eylem yaptı, 'Sokakta mı kalalım' diye sordu Haber Merkezi İLGİLİ HABER NATO için ODTÜ yurtları boşaltılıyor: ODTÜ'lü öğrenciler eylem yaptı, 'Sokakta mı kalalım' diye sordu soL YZ Beta, soL’un geliştirdiği ve soL arşiviyle çalışan bir yapay zeka robotudur. Kullanımı, soL abonelerine açıktır. Yükleniyor... Haber Merkezi Yayın Tarihi: 04.07.2026 , 00:41 Ankara'da ABD Başkanı Donald Trump’ın NATO zirvesi ziyareti sırasında konaklayacağı JW Marriott Otel'in yakınında bulunan YDA Center'ın satış ofisinde yangın çıktı. Yangın nedeniyle oluşan yoğun dumanın istasyona ulaşması üzerine Söğütözü Metrosu geçici olarak hizmete kapatıldı. ABB: Yangın kontrol altında Ankara Büyükşehir Belediyesi (ABB) tarafından kazaya ilişkin yapılan açıklamada, Çankaya ilçesi Kızılırmak Mahallesi Dumlupınar Bulvarı'ndaki YDA Center satış ofisinde çıkan yangının kontrol altına alındığı bildirildi. İhbar üzerine itfaiye ekiplerinin hızla bölgeye sevk edildiği belirtilen açıklamada, ekiplerin satış ofisinin asma katında çıkan yangını büyük oranda kontrol altına aldığı ve soğutma çalışmalarının devam ettiği vurgulandı. Yaralı bulunmuyor Belediye açıklamasında, yangın nedeniyle dumandan etkilenen ya da yaralanan kimsenin olmadığı kaydedildi. Öte yandan, satış ofisindeki yangından yükselen dumanların metro istasyonu alanına ulaşması nedeniyle, Söğütözü Metro İstasyonu'nun önlem amaçlı geçici olarak kapatıldığı duyuruldu. soL Haber'i WhatsApp ve Telegram kanallarından takip edin, önemli gelişmeleri ve özel haberlerimizi kaçırmayın. İLGİLİ HABER NATO için ODTÜ yurtları boşaltılıyor: ODTÜ'lü öğrenciler eylem yaptı, 'Sokakta mı kalalım' diye sordu Haber Merkezi İLGİLİ HABER NATO için ODTÜ yurtları boşaltılıyor: ODTÜ'lü öğrenciler eylem yaptı, 'Sokakta mı kalalım' diye sordu KİŞİSEL VERİLER HAKKINDA AYDINLATMA METNİ İşbu Kişisel Veriler Hakkında Aydınlatma Metni (“Aydınlatma Metni”) , 6698 sayılı Kişisel Verilerin Korunması Kanunu’nun (“Kanun”) 10. maddesi ile Aydınlatma Yükümlülüğünün Yerine Getirilmesinde Uyulacak Usul ve Esaslar Hakkında Tebliğ (“Tebliğ”) kapsamında veri sorumlusu sıfatıyla Gelenek Basım Yayım ve Ticaret Limited Şirketi (“soL Haber Portalı”) tarafından, soL Haber Portalı ile iletişime geçmiş olmanız kapsamında tarafınızı bilgilendirmek amacıyla hazırlanmıştır. Kişisel Verileriniz, haber.sol.org.tr adresinde mukim soL Haber Portalı tarafından; veri sorumlusu sıfatıyla, Kanun uyarınca, aşağıda sıralanan amaçlar çerçevesinde ve bu amaçlarla bağlantılı, sınırlı ve ölçülü şekilde, tarafımıza ulaştığı şekliyle, otomatik veya otomatik olmayan yöntemler ile kişisel verilerin doğruluğunu ve güncelliğini koruyarak aşağıda açıklanan kapsamda işlenecektir. İşbu Aydınlatma Metni’ni, yürürlükteki mevzuatta yapılabilecek değişiklikler çerçevesinde her zaman; kişisel verilerin işlenmesi ve aktarılması amaçlarında ve toplanma yöntemlerinde gerçekleşecek değişiklikler çerçevesinde ise ilgili kişisel veri sahiplerinin değişikliğe ilişkin rızası doğrultusunda güncelleme hakkımızı saklı tutuyoruz. Yapılan güncellemelerin takibini haber.sol.org.tr linkinden kolaylıkla sağlayabilirsiniz. İşbu Aydınlatma Metni kapsamında işlenen kişisel verileriniz şöyledir: Kimlik: *ad - soyad, İletişim: *cep telefon numarası, *şahsi e-posta adresi. Bu kişisel verilerinizin (1) işlenme amaçlarını, (2) kimlere ve hangi amaçla aktarılabileceğini, (3) toplanmasının yöntemini ve hukuki sebeplerini, (4) haklarınızı ve (5) saklama sürelerini aşağıda bilginize sunarız: (1) Kişisel Verilerinizin İşlenmesi Tarafımız, aşağıdaki amaçlar doğrultusunda, ilgili mevzuattan kaynaklanan kanuni yükümlülüklerimizi yerine getirebilmek için gerekli çalışmaların yapılabilmesini mümkün kılacak, işbu Aydınlatma Metni’nde belirlenen yöntemlerle toplanan kişisel verilerinizi sizlerden talep etmekteyiz. İşbu metin ile belirlenen amaçlar ve kapsam dışında kullanılmamak kaydıyla, veri güvenliğine ilişkin teknik ve idari tedbirleri de almak suretiyle Kanun’un 5. ve 6. maddelerinde belirtilen şartlar dahilinde işlenecektir. Kişisel verileriniz, Kanun’un 5. maddesinin (2) numaralı fıkrasının (b) bendinde belirtilen veri sorumlusunun meşru menfaatleri için veri işlenmesinin zorunlu olması; (c) bendinde belirtilen bir sözleşmenin kurulması veya ifasıyla doğrudan doğruya ilgili olması kaydıyla, sözleşmenin taraflarına ait kişisel verilerin işlenmesinin gerekli olması ve (e) bendinde belirtilen bir hakkın tesisi, kullanılması veya korunması için veri işlemenin zorunlu olması istisnalarına dayanılarak sizden alınmakta ve işlenmektedir. Ayrıca elde edilen kişisel veriler, soL Haber Portalı bünyesinde kullanılan bulut yazılım sistemleri ile yedekleme amacı başta olmak üzere işlenmektedir. *talep, şikayet, bilgi, isteklerin toplanması, *talebiniz doğrultusunda iletişime geçilmesi, *hizmetlerimizin geliştirilmesi, *performans ölçümü, *olumsuzlukların giderilmesi, *verilerin bulut sisteminde yedeklenmesi, *5651 Sayılı İnternet Ortamında Yapılan Yayınların Düzenlenmesi ve Bu Yayınlar Yoluyla İşlenen Suçlarla Mücadele Edilmesi Hakkında Kanun ve sair mevzuatta açıkça öngörüldüğü üzere trafik kayıtlarını tutma yükümlülüğümüzün yerine getirilmesi, *Hizmetlerimizin ihtiyaçlarınız doğrultusunda kişiselleştirilmesi, *Pazarlama analiz çalışmalarının yürütülmesi, *İş süreçlerinin iyileştirilmesine yönelik önlemlerin değerlendirilmesi. . Söz konusu kişisel verileriniz, yasal saklama süresi aşılmamak kaydıyla işleme amacının gerektirdiği süre boyunca saklanacak, bu süre sona erdiğinde usulüne uygun olarak imha edilecektir. (2) Kişisel Verilerinizin Aktarılması Kişisel verilerin üçüncü kişilerle paylaşımı açık rızaları doğrultusunda gerçekleşm","Ankara'da Trump'ın kalacağı otelin yakınında yangın: Metro istasyonu kapatıldı Ankara'da Trump'ın kalacağı otelin yakınında yangın: Metro istasyonu kapatıldı soL Haber NATO zirvesi için Ankara'ya gelecek olan ABD Başkanı Donald Trump'ın konaklayacağı otelin yakınındaki YDA Center'da yangın çıktı. Ankara'da Trump'ın kalacağı otelin yakınında yangın: Metro istasyonu kapatıldı | soL haber Ankara'da Trump'ın kalacağı otelin yakınında yangın: Metro istasyonu kapatıldı NATO zirvesi için Ankara'ya gelecek olan ABD Başkanı Donald Trump'ın konaklayacağı otelin yakınındaki YDA Center'da yangın çıktı. Kontrol altına alınan yangın nedeniyle Söğütözü Metro İstasyonu geçici olarak kapatıldı. Haber Merkezi Yayın Tarihi: 04.07.2026 , 00:41 Ankara'da ABD Başkanı Donald Trump’ın NATO zirvesi ziyareti sırasında konaklayacağı JW Marriott Otel'in yakınında bulunan YDA Center'ın satış ofisinde yangın çıktı. Yangın nedeniyle oluşan yoğun dumanın istasyona ulaşması üzerine Söğütözü Metrosu geçici olarak hizmete kapatıldı. ABB: Yangın kontrol altında Ankara Büyükşehir Belediyesi (ABB) tarafından kazaya ilişkin yapılan açıklamada, Çankaya ilçesi Kızılırmak Mahallesi Dumlupınar Bulvarı'ndaki YDA Center satış ofisinde çıkan yangının kontrol altına alındığı bildirildi. İhbar üzerine itfaiye ekiplerinin hızla bölgeye sevk edildiği belirtilen açıklamada, ekiplerin satış ofisinin asma katında çıkan yangını büyük oranda kontrol altına aldığı ve soğutma çalışmalarının devam ettiği vurgulandı. Yaralı bulunmuyor Belediye açıklamasında, yangın nedeniyle dumandan etkilenen ya da yaralanan kimsenin olmadığı kaydedildi. Öte yandan, satış ofisindeki yangından yükselen dumanların metro istasyonu alanına ulaşması nedeniyle, Söğütözü Metro İstasyonu'nun önlem amaçlı geçici olarak kapatıldığı duyuruldu. İLGİLİ HABER NATO için ODTÜ yurtları boşaltılıyor: ODTÜ'lü öğrenciler eylem yaptı, 'Sokakta mı kalalım' diye sordu Haber Merkezi İLGİLİ HABER NATO için ODTÜ yurtları boşaltılıyor: ODTÜ'lü öğrenciler eylem yaptı, 'Sokakta mı kalalım' diye sordu soL YZ Beta, soL’un geliştirdiği ve soL arşiviyle çalışan bir yapay zeka robotudur. Kullanımı, soL abonelerine açıktır. Ankara'da Trump'ın kalacağı otelin yakınında yangın: Metro istasyonu kapatıldı NATO zirvesi için Ankara'ya gelecek olan ABD Başkanı Donald Trump'ın konaklayacağı otelin yakınındaki YDA Center'da yangın çıktı. maddesi ile Aydınlatma Yükümlülüğünün Yerine Getirilmesinde Uyulacak Usul ve Esaslar Hakkında Tebliğ (“Tebliğ”) kapsamında veri sorumlusu sıfatıyla Gelenek Basım Yayım ve Ticaret Limited Şirketi (“soL Haber Portalı”) tarafından, soL Haber Portalı ile iletişime geçmiş olmanız kapsamında tarafınızı bilgilendirmek amacıyla hazırlanmıştır. Kişisel Verileriniz, haber.sol.org.tr adresinde mukim soL Haber Portalı tarafından; veri sorumlusu sıfatıyla, Kanun uyarınca, aşağıda sıralanan amaçlar çerçevesinde ve bu amaçlarla bağlantılı, sınırlı ve ölçülü şekilde, tarafımıza ulaştığı şekliyle, otomatik veya otomatik olmayan yöntemler ile kişisel verilerin doğruluğunu ve güncelliğini koruyarak aşağıda açıklanan kapsamda işlenecektir. İşbu Aydınlatma Metni’ni, yürürlükteki mevzuatta yapılabilecek değişiklikler çerçevesinde her zaman; kişisel verilerin işlenmesi ve aktarılması amaçlarında ve toplanma yöntemlerinde gerçekleşecek değişiklikler çerçevesinde ise ilgili kişisel veri sahiplerinin değişikliğe ilişkin rızası doğrultusunda güncelleme hakkımızı saklı tutuyoruz. İşbu Aydınlatma Metni kapsamında işlenen kişisel verileriniz şöyledir: Kimlik: *ad - soyad, İletişim: *cep telefon numarası, *şahsi e-posta adresi. Bu kişisel verilerinizin (1) işlenme amaçlarını, (2) kimlere ve hangi amaçla aktarılabileceğini, (3) toplanmasının yöntemini ve hukuki sebeplerini, (4) haklarınızı ve (5) saklama sürelerini aşağıda bilginize sunarız: (1) Kişisel Verilerinizin İşlenmesi Tarafımız, aşağıdaki amaçlar doğrultusunda, ilgili mevzuattan kaynaklanan kanuni yükümlülüklerimizi yerine getirebilmek için gerekli çalışmaların yapılabilmesini mümkün kılacak, işbu Aydınlatma Metni’nde belirlenen yöntemlerle toplanan kişisel verilerinizi sizlerden talep etmekteyiz. maddesinin (2) numaralı fıkrasının (b) bendinde belirtilen veri sorumlusunun meşru menfaatleri için veri işlenmesinin zorunlu olması; (c) bendinde belirtilen bir sözleşmenin kurulması veya ifasıyla doğrudan doğruya ilgili olması kaydıyla, sözleşmenin taraflarına ait kişisel verilerin işlenmesinin gerekli olması ve (e) bendinde belirtilen bir hakkın tesisi, kullanılması veya korunması için veri işlemenin zorunlu olması istisnalarına dayanılarak sizden alınmakta ve işlenmektedir. *talep, şikayet, bilgi, isteklerin toplanması, *talebiniz doğrultusunda iletişime geçilmesi, *hizmetlerimizin geliştirilmesi, *performans ölçümü, *olumsuzlukların giderilmesi, *verilerin bulut sisteminde yedeklenmesi, *5651 Sayılı İnternet Ortamında Yapılan Yayınların Düzenlenmesi ve Bu Yayınlar Yoluyla İşlenen Suçlarla Mücadele Edilmesi Hakkında Kanun ve sair mevzuatta açıkça öngörüldüğü üzere trafik kayıtlarını tutma yükümlülüğümüzün yerine getirilmesi, *Hizmetlerimizin ihtiyaçlarınız doğrultusunda kişiselleştirilmesi, *Pazarlama analiz çalışmalarının yürütülmesi, *İş süreçlerinin iyileştirilmesine yönelik önlemlerin değerlendirilmesi. Söz konusu kişisel verileriniz, yasal saklama süresi aşılmamak kaydıyla işleme amacının gerektirdiği süre boyunca saklanacak, bu süre sona erdiğinde usulüne uygun olarak imha edilecektir.",browser_full_article,https://haber.sol.org.tr/haber/ankarada-trumpin-kalacagi-otelin-yakininda-yangin-metro-istasyonu-kapatildi-411366,Ankara | Çankırı,Çankaya | Kızılırmak,,ilçesi Kızılırmak Mahallesi Dumlupınar Bulvarı,bir hakkın tesisi,Gelenek Basım Yayım ve Ticaret Limited Şirketi,Gelenek Basım Yayım ve Ticaret Limited Şirketi:104:body | Gelenek Basım Yayım ve Ticaret Limited Şirketi:raw_legal,iyi,Gelenek Basım Yayım ve Ticaret Limited Şirketi ilçesi Kızılırmak Mahallesi Dumlupınar Bulvarı Çankaya Ankara Türkiye,Gelenek Ve Gelecek,Gelenek Ve Gelecek,firma adı + güvenli maps adayı var,71.42857142857143,,252.8,28
2026-07-04 06:07:38,yangın,Fiziksel Risk / Yangın,İzmir Haberleri,İzmir Haberleri - OSB’lerden yangın itirazı - Yerel Haberler Hürriyet,https://news.google.com/rss/articles/CBMiiwFBVV95cUxOSFI3bC1ULWZwZFVwMnNwSk1CRzBIWnNUYUg1VkhQRWs4SHNydkhvU1N3cFZONWVnbjFFV2V0ajc2cjJlek0wNlJkZUl4QkdTTnFSaVJOSVNFR2lyVTVfY3BOckV4MXczamM4OU5JX21MX29iclhjSHY2Z3FLcnZJV2NuVHphLVU0SXZN?oc=5,osb,,İzmir Haberleri - OSB’lerden yangın itirazı - Yerel Haberler Hürriyet,İzmir Haberleri İzmir Haberleri - OSB’lerden yangın itirazı - Yerel Haberler Hürriyet İzmir Haberleri - OSB’lerden yangın itirazı - Yerel Haberler Hürriyet,browser_failed,https://news.google.com/rss/articles/CBMiiwFBVV95cUxOSFI3bC1ULWZwZFVwMnNwSk1CRzBIWnNUYUg1VkhQRWs4SHNydkhvU1N3cFZONWVnbjFFV2V0ajc2cjJlek0wNlJkZUl4QkdTTnFSaVJOSVNFR2lyVTVfY3BOckV4MXczamM4OU5JX21MX29iclhjSHY2Z3FLcnZJV2NuVHphLVU0SXZN?oc=5&hl=tr&gl=TR&ceid=TR:tr,,,,,,,,il yok | ilçe yok | firma yok | faaliyet/tesis yok,,,,maps araması yapılmadı,,,23.44,29
2026-07-03 21:09:21,yangın,Fiziksel Risk / Yangın,Malatya'da şantiyede işçilerin kaldığı konteyner yatakhanede yangın,Malatya'da şantiyede işçilerin kaldığı konteyner yatakhanede yangın İlke Haber Ajansı,https://news.google.com/rss/articles/CBMioAFBVV95cUxPLWI4YVRleU1aeWpJSlZVYVkxT2ktM2ZKeEozaFVyUk5Ha0wzMlRJbWI4Skx1UE1xTGwxSF9RZU5MOEZiU2ZPU29KeEtQVjVvQ2o2VURraHh3RHowMUxkSzlRZTFCeTljVmJIVFBrOG8yRUh1eHg2c3FQOENUVHdfc0lPb3ZBSHRtdk90UzI4Nk81WF8wVU1VbUFjd1dpSFMt?oc=5,şantiye,şantiye,"ilkha.com Güvenlik doğrulaması yapılıyor Bu web sitesi, kötü niyetli botlara karşı korunmak için bir güvenlik hizmeti kullanıyor. Web sitesi bir bot olmadığınızı doğrularken bu sayfa görüntülenir. Doğrulama başarılı. ilkha.com adresinin yanıt vermesi bekleniyor Güvenlik doğrulaması yapılıyor Doğrulama başarılı. ilkha.com adresinin yanıt vermesi bekleniyor Bu web sitesi, kötü niyetli botlara karşı korunmak için bir güvenlik hizmeti kullanıyor. Web sitesi bir bot olmadığınızı doğrularken bu sayfa görüntülenir.","Malatya'da şantiyede işçilerin kaldığı konteyner yatakhanede yangın Malatya'da şantiyede işçilerin kaldığı konteyner yatakhanede yangın İlke Haber Ajansı ilkha.com Güvenlik doğrulaması yapılıyor Bu web sitesi, kötü niyetli botlara karşı korunmak için bir güvenlik hizmeti kullanıyor. Web sitesi bir bot olmadığınızı doğrularken bu sayfa görüntülenir. ilkha.com adresinin yanıt vermesi bekleniyor Güvenlik doğrulaması yapılıyor Doğrulama başarılı. ilkha.com adresinin yanıt vermesi bekleniyor Bu web sitesi, kötü niyetli botlara karşı korunmak için bir güvenlik hizmeti kullanıyor.",browser_full_article,https://ilkha.com/guncel/malatyada-santiyede-iscilerin-kaldigi-konteyner-yatakhanede-yangin--544760,Malatya,,,,,,,ilçe yok | firma yok | faaliyet/tesis yok,,,,maps araması yapılmadı,,,85.88,30
2026-07-03 12:45:44,örgütlü suç,Operasyon / Soruşturma / Suç,Turizmin gözdesinde 3 suç örgütü çökertildi,Turizmin gözdesinde 3 suç örgütü çökertildi Nefes Gazetesi,https://news.google.com/rss/articles/CBMihgFBVV95cUxPRVQ5VzBRMXJEWXk2czN5SkdzS2czYkNORWRkNmdLS21MV3pkUWVuaXRpc2FaOHRQblRVQlNRcXJQM1NrWXRHQVdSb1NMT25YQWttVXJ2NDIyVjg3MkU4emVtWTFJZ0hXMlJFMlFYRFdCTV93QWlCa3k0LUFzb2JxMmxzWTg4d9IBhgFBVV95cUxPRVQ5VzBRMXJEWXk2czN5SkdzS2czYkNORWRkNmdLS21MV3pkUWVuaXRpc2FaOHRQblRVQlNRcXJQM1NrWXRHQVdSb1NMT25YQWttVXJ2NDIyVjg3MkU4emVtWTFJZ0hXMlJFMlFYRFdCTV93QWlCa3k0LUFzb2JxMmxzWTg4dw?oc=5,turizm,,"Muğla'da haziran ayında düzenlenen operasyonlarda 3 organize suç örgütü çökertilirken, gözaltına alınan 48 şüpheliden 29'u tutuklandı. Muğla'da haziran ayında düzenlenen operasyonlarda 3 organize suç örgütü çökertilirken, gözaltına alınan 48 şüpheliden 29'u tutuklandı. Muğla'da haziran ayında düzenlenen operasyonlarda 3 organize suç örgütü çökertilirken, gözaltına alınan 48 şüpheliden 29'u tutuklandı. Nefes Gazetesi Gündem Turizmin gözdesinde 3 suç örgütü çökertildi Muğla'da haziran ayında düzenlenen operasyonlarda 3 organize suç örgütü çökertilirken, gözaltına alınan 48 şüpheliden 29'u tutuklandı. HABERİN DEVAMI 03.07.2026 15:45 Güncelleme: 03.07.2026 15:45 P","Turizmin gözdesinde 3 suç örgütü çökertildi Turizmin gözdesinde 3 suç örgütü çökertildi Nefes Gazetesi Muğla'da haziran ayında düzenlenen operasyonlarda 3 organize suç örgütü çökertilirken, gözaltına alınan 48 şüpheliden 29'u tutuklandı. Nefes Gazetesi Gündem Turizmin gözdesinde 3 suç örgütü çökertildi Muğla'da haziran ayında düzenlenen operasyonlarda 3 organize suç örgütü çökertilirken, gözaltına alınan 48 şüpheliden 29'u tutuklandı.",browser_full_article,https://www.nefes.com.tr/amp/turizmin-gozdesinde-3-suc-orgutu-cokertildi-136135,Muğla,,,,,,,ilçe yok | firma yok | faaliyet/tesis yok,,,,maps araması yapılmadı,,,60.68,31
