published,search_term,category,title,summary,link,matched_words,activity_type,raw_text,entity_source_text,article_fetch_status,resolved_article_url,city_candidates,district_candidates,neighborhood_candidates,street_candidates,facility_candidates,company_candidates,company_candidate_scores,entity_quality_note,maps_queries,maps_candidates,maps_best_guess,maps_status,maps_match_scores,maps_rejected_candidates,record_quality_score,duplicate_group_id
2026-07-04 08:43:35,tesis yangını,Fiziksel Risk / Yangın,Diyarbakır'da anız yangını bir akaryakıt istasyonunu tehdit etti,Diyarbakır'da anız yangını bir akaryakıt istasyonunu tehdit etti havadis.com,https://news.google.com/rss/articles/CBMiqAFBVV95cUxPbFRvYllpSWNGQ1FFSy1tTUhnbTM4X1JyU1h5VlI1bTAzQnA1bnJXd1czYnpfNy1NSXMxSmNsN01PNEhXYUNXaFBwR09tM2lQM29Ja0JpVVY3aXZVczdfZVJEY2pQOEdQVTNlRC1CT3hDTWt5blVGc0J6S2tCMVNFVEZKejh0U3drSXJ3QmQ0bEprcXI1MlhUNmszaG5pcEtSbGJsZlgtYkg?oc=5,"akaryakıt istasyonu, istasyon",akaryakıt tesisi,"Diyarbakır-Bismil yolunda çıkan anız yangını rüzgarla akaryakıt istasyonuna sıçradı. Ekipler büyük bir felaketi son anda engelledi. Diyarbakır-Bismil yolunda çıkan anız yangını rüzgarla akaryakıt istasyonuna sıçradı. Ekipler büyük bir felaketi son anda engelledi. Diyarbakır-Bismil yolunda çıkan anız yangını rüzgarla akaryakıt istasyonuna sıçradı. Ekipler büyük bir felaketi son anda engelledi. Diyarbakır-Bismil yolunda çıkan anız yangını rüzgarla akaryakıt istasyonuna sıçradı. Ekipler büyük bir felaketi son anda engelledi. Facebook'ta Paylaş X'de Paylaş Whatsapp'tan Gönder YAYINLAMA: 04 Temmuz 2026 - 11:43 EDİTÖR: Havadis KAYNAK: Demirören Haber Ajansı Diyarbakır-Bismil karayolu üzerinde sabah saatlerinde başlayan anız yangını, kısa sürede bölgedeki bir akaryakıt istasyonunu hedef aldı. Rüzgarın etkisiyle kontrolsüzce yayılan alevler, istasyonun bahçesine kadar ulaştı. Bölgedeki insanların korkulu anlar yaşamasına neden olan yangına itfaiye ekipleri hızla müdahale etti. Yangın nasıl durduruldu İhbarın hemen ardından olay yerine gelen itfaiye ekipleri, alevlerin istasyonun yakıt tanklarına ulaşmasını önlemek için yoğun bir çalışma yürüttü. Ekiplerin hızlı müdahalesi sayesinde yangın, istasyonun ana binasına ve çevredeki diğer yapılara sıçramadan kontrol altına alındı. Peki şimdi ne olacak Bölgede soğutma çalışmaları tamamlanırken, yetkililer yangının kesin çıkış nedenini belirlemek için inceleme başlattı. Anız yakmanın bölgedeki tesisler ve çevre için yarattığı risk bir kez daha gözler önüne serilmiş oldu. Soruşturma sonucunda yangının ihmalden mi yoksa başka bir nedenden mi çıktığı netleşecek. Diyarbakır Silvan'da Malabadi Çayı'na giren genç kayboldu #Diyarbakır / 04 Temmuz 2026 Silvan'da balık tutmaya çıkan gençten acı haber bekleniyor #Diyarbakır / 04 Temmuz 2026 Diyarbakır’ın iki ilçesinde anız yangını paniği #Diyarbakır / 04 Temmuz 2026 Yo",Diyarbakır'da anız yangını bir akaryakıt istasyonunu tehdit etti Diyarbakır'da anız yangını bir akaryakıt istasyonunu tehdit etti havadis.com Diyarbakır-Bismil yolunda çıkan anız yangını rüzgarla akaryakıt istasyonuna sıçradı. Ekipler büyük bir felaketi son anda engelledi.,browser_full_article,https://www.havadis.com/diyarbakir/diyarbakirda-aniz-yangini-bir-akaryakit-istasyonunu-tehdit-etti/442453,Diyarbakır,Bismil,,,,,,firma yok | faaliyet/tesis yok,,,,maps araması yapılmadı,,,102.0,5
2026-07-04 09:53:00,MASAK,Kara Para / MASAK / Bahis,Soyer’den cezaevinden MASAK raporlu mesaj: Babanın bırakabileceği en büyük miras temiz bir isimdir,Soyer’den cezaevinden MASAK raporlu mesaj: Babanın bırakabileceği en büyük miras temiz bir isimdir İz Gazete,https://news.google.com/rss/articles/CBMivgFBVV95cUxNSzFXY3R2cDdoTzVFSDZMckFfTGRvY3NSX1g4c1ZWWHlXdi1OUDgzbU5KU0M4bHNtZ3BfX2NUM2cxVDJaa3Y5Y3Y5cVcyUzM1MkxmbTJoRHZKLTN5M0hndnc0ZkE5MjZDUU1SSXl4TGp3R2NyQ2M5Q19wOFhubC1SS08xN2g4T3c3V0duNHRjOHZXSFV1dmN3ZXhDN3dfNk1Ha3R2bVdYMVNuYU5rMkJNck45NzZyeERFMG13T2tB?oc=5,masak,,Soyer’den cezaevinden MASAK raporlu mesaj: Babanın bırakabileceği en büyük miras temiz bir isimdir İz Gazete,Soyer’den cezaevinden MASAK raporlu mesaj: Babanın bırakabileceği en büyük miras temiz bir isimdir Soyer’den cezaevinden MASAK raporlu mesaj: Babanın bırakabileceği en büyük miras temiz bir isimdir İz Gazete Soyer’den cezaevinden MASAK raporlu mesaj: Babanın bırakabileceği en büyük miras temiz bir isimdir İz Gazete,browser_failed,https://news.google.com/rss/articles/CBMivgFBVV95cUxNSzFXY3R2cDdoTzVFSDZMckFfTGRvY3NSX1g4c1ZWWHlXdi1OUDgzbU5KU0M4bHNtZ3BfX2NUM2cxVDJaa3Y5Y3Y5cVcyUzM1MkxmbTJoRHZKLTN5M0hndnc0ZkE5MjZDUU1SSXl4TGp3R2NyQ2M5Q19wOFhubC1SS08xN2g4T3c3V0duNHRjOHZXSFV1dmN3ZXhDN3dfNk1Ha3R2bVdYMVNuYU5rMkJNck45NzZyeERFMG13T2tB?oc=5&hl=tr&gl=TR&ceid=TR:tr,,,,,,,,il yok | ilçe yok | firma yok | faaliyet/tesis yok,,,,maps araması yapılmadı,,,93.08,6
2026-07-04 07:13:49,MASAK,Kara Para / MASAK / Bahis,Kayseri merkezli modem dolandırıcılığı operasyonu: MASAK raporunda 757 milyon liralık dev hacim netleşti,Kayseri merkezli modem dolandırıcılığı operasyonu: MASAK raporunda 757 milyon liralık dev hacim netleşti | Gündem Haberleri GZT,https://news.google.com/rss/articles/CBMi6wFBVV95cUxOaWtlUzNsc0lNTGRMV000YjNZOVdpb3BmNUY4UmlXWDlzaW1UdzI2UkdJUk1HbkNubTNzR24wMzFEV3gtNF9BakFGOW5kcXN5VTdSNG40T2lJa01VdE9GX3BQRXJKOF95cnFVeDFwMlNaNmo5c0s0RmdsZUZSVnlrSDBoNlBWNkkzeXdWQXdxN1BweTdreDVKMl9mQlN0blFjSHkzYU5zdGgxcjNlOWp0U1Nqb2pMbm9GZ1VESGlvTi1ybm9zLVN2VjNPV3BsRkJ4TFktWmZ6WjltZmJqZGladktXTjVqMGRERVZ3?oc=5,masak,,Kayseri merkezli modem dolandırıcılığı operasyonu: MASAK raporunda 757 milyon liralık dev hacim netleşti | Gündem Haberleri GZT,Kayseri merkezli modem dolandırıcılığı operasyonu: MASAK raporunda 757 milyon liralık dev hacim netleşti Kayseri merkezli modem dolandırıcılığı operasyonu: MASAK raporunda 757 milyon liralık dev hacim netleşti | Gündem Haberleri GZT Kayseri merkezli modem dolandırıcılığı operasyonu: MASAK raporunda 757 milyon liralık dev hacim netleşti | Gündem Haberleri GZT,browser_failed,https://news.google.com/rss/articles/CBMi6wFBVV95cUxOaWtlUzNsc0lNTGRMV000YjNZOVdpb3BmNUY4UmlXWDlzaW1UdzI2UkdJUk1HbkNubTNzR24wMzFEV3gtNF9BakFGOW5kcXN5VTdSNG40T2lJa01VdE9GX3BQRXJKOF95cnFVeDFwMlNaNmo5c0s0RmdsZUZSVnlrSDBoNlBWNkkzeXdWQXdxN1BweTdreDVKMl9mQlN0blFjSHkzYU5zdGgxcjNlOWp0U1Nqb2pMbm9GZ1VESGlvTi1ybm9zLVN2VjNPV3BsRkJ4TFktWmZ6WjltZmJqZGladktXTjVqMGRERVZ3?oc=5&hl=tr&gl=TR&ceid=TR:tr,Kayseri,,,,,,,ilçe yok | firma yok | faaliyet/tesis yok,,,,maps araması yapılmadı,,,111.02,7
2026-07-04 08:42:00,MASAK,Kara Para / MASAK / Bahis,Şanlıurfa'da MASAK destekli siber operasyon: 306 gözaltı,Şanlıurfa'da MASAK destekli siber operasyon: 306 gözaltı Şanlıurfa Gazetesi,https://news.google.com/rss/articles/CBMikgFBVV95cUxPU3lyRHNUR3dZdU1PeWQ3N2c3dGFDMUxVODBidVdOcDhDMXhLckpxejIybTNUelE2ZThnZ180MnR4NDFPQnlvVGtUdjR4cVZYRF95OEpVb0lEQkR5NzRrSURZRnd5ZWp1OTkzUWs4MHU3cy01NTNSV0g0Z2ZxeUFpNlBZVDBQcmw4NVgzeElnbFF1d9IBlwFBVV95cUxOZGhFSEx2cWdyeHpSWl85RktjdXhhY2Z3QmpPMTNmN0I1WHFVVDRSYW9JOGRSdV9ub3lmNV8zUkttc0NtNUdQdHhmR09BVkhKSkJqXzMwdG1rNlZ5TXVwT1BSaTlSN01mS3RRZG1xRFVOSWFzTXlPV3pZaDZrWkJIeklhZldQZm9OXzNQVDJEZzBvaXFqenZj?oc=5,masak,,"Şanlıurfa dahil 14 ilde İçişleri Bakanlığı koordinesinde MASAK destekli siber suç operasyonları düzenlendi. 306 kişi gözaltına alındı. Şanlıurfa dahil 14 ilde İçişleri Bakanlığı koordinesinde MASAK destekli siber suç operasyonları düzenlendi. 306 kişi gözaltına alındı. Şanlıurfa dahil 14 ilde İçişleri Bakanlığı koordinesinde MASAK destekli siber suç operasyonları düzenlendi. 306 kişi gözaltına alındı. Web sitemizden ayrılıyorsunuz Bu bağlantı sizi https://www.sanliurfagazetesi.com dışındaki bir siteye yönlendiriyor. Sayfada Kal Devam Et Şanlıurfa'da MASAK destekli siber operasyon: 306 gözaltı Şanlıurfa dahil 14 ilde İçişleri Bakanlığı koordinesinde MASAK destekli siber suç operasyonları düzenlendi. 306 kişi gözaltına alındı. İçişleri Bakanlığı, 14 il merkezli siber suç operasyonlarında 306 şüphelinin yakalandığını, bunlardan 18'inin tutuklandığını, 16'sı hakkında ise adli kontrol tedbiri uygulandığını bildirdi. İçişleri Bakanlığından yapılan açıklamaya göre, Emniyet Genel Müdürlüğü Siber Suçlarla Mücadele Daire Başkanlığı, MASAK ve Cumhuriyet Başsavcılıkları koordinesinde, İl Emniyet Müdürlükleri Siber Suçlarla Mücadele Şube Müdürlüklerince siber suçlara yönelik operasyonlar gerçekleştirildi. Ayrıca şüphelilerin, sosyal medya platformları ile oltalama (phishing) siteleri üzerinden ""yatırım dolandırıcılığı"", ""internet modem ücreti"" ve ""ürün bedeli"" temalarını kullanarak vatandaşları dolandırdıkları belirlendi. Bu bağlantı sizi https://www.sanliurfagazetesi.com dışındaki bir siteye yönlendiriyor.","Şanlıurfa'da MASAK destekli siber operasyon: 306 gözaltı Şanlıurfa'da MASAK destekli siber operasyon: 306 gözaltı Şanlıurfa Gazetesi Şanlıurfa dahil 14 ilde İçişleri Bakanlığı koordinesinde MASAK destekli siber suç operasyonları düzenlendi. 306 kişi gözaltına alındı. Sayfada Kal Devam Et Şanlıurfa'da MASAK destekli siber operasyon: 306 gözaltı Şanlıurfa dahil 14 ilde İçişleri Bakanlığı koordinesinde MASAK destekli siber suç operasyonları düzenlendi. İçişleri Bakanlığı, 14 il merkezli siber suç operasyonlarında 306 şüphelinin yakalandığını, bunlardan 18'inin tutuklandığını, 16'sı hakkında ise adli kontrol tedbiri uygulandığını bildirdi. İçişleri Bakanlığından yapılan açıklamaya göre, Emniyet Genel Müdürlüğü Siber Suçlarla Mücadele Daire Başkanlığı, MASAK ve Cumhuriyet Başsavcılıkları koordinesinde, İl Emniyet Müdürlükleri Siber Suçlarla Mücadele Şube Müdürlüklerince siber suçlara yönelik operasyonlar gerçekleştirildi. Ayrıca şüphelilerin, sosyal medya platformları ile oltalama (phishing) siteleri üzerinden ""yatırım dolandırıcılığı"", ""internet modem ücreti"" ve ""ürün bedeli"" temalarını kullanarak vatandaşları dolandırdıkları belirlendi.",browser_full_article,https://www.sanliurfagazetesi.com/sanliurfada-masak-destekli-siber-operasyon-306-gozalti,Şanlıurfa,,,,,,,ilçe yok | firma yok | faaliyet/tesis yok,,,,maps araması yapılmadı,,,79.75,8
2026-07-04 08:20:37,MASAK,Kara Para / MASAK / Bahis,Ordu'da 9 Kişi Tutuklandı MASAK Ortaya Çıkarttı Hesaplarda 324 Milyon TL,Ordu'da 9 Kişi Tutuklandı MASAK Ortaya Çıkarttı Hesaplarda 324 Milyon TL Ordu Gazete,https://news.google.com/rss/articles/CBMipwFBVV95cUxNbzliSWZjM0xsUVFjMGNMQzFqMC1aSzB6RWxVdjl6ejdjdjVhb3J6M3lTcTQ4QUVBVm56YXFiRFdQZEJxa1JTQ0xqc080RlhQbks4YkV3X0l0a0VOaU90VDNSMEI4ckpvcHNveWkwRzVzakJ4djc1WmI4UjgyU2szODBKY1UyTGtQMUNfRVRnRmswTnBpQnRVSG1kZjZpTHlqUkswRVQ1UQ?oc=5,masak,,Ordu'da 9 Kişi Tutuklandı MASAK Ortaya Çıkarttı Hesaplarda 324 Milyon TL Ordu Gazete,Ordu'da 9 Kişi Tutuklandı MASAK Ortaya Çıkarttı Hesaplarda 324 Milyon TL Ordu'da 9 Kişi Tutuklandı MASAK Ortaya Çıkarttı Hesaplarda 324 Milyon TL Ordu Gazete Ordu'da 9 Kişi Tutuklandı MASAK Ortaya Çıkarttı Hesaplarda 324 Milyon TL Ordu Gazete,browser_failed,https://news.google.com/rss/articles/CBMipwFBVV95cUxNbzliSWZjM0xsUVFjMGNMQzFqMC1aSzB6RWxVdjl6ejdjdjVhb3J6M3lTcTQ4QUVBVm56YXFiRFdQZEJxa1JTQ0xqc080RlhQbks4YkV3X0l0a0VOaU90VDNSMEI4ckpvcHNveWkwRzVzakJ4djc1WmI4UjgyU2szODBKY1UyTGtQMUNfRVRnRmswTnBpQnRVSG1kZjZpTHlqUkswRVQ1UQ?oc=5&hl=tr&gl=TR&ceid=TR:tr,Ordu,,,,,,,ilçe yok | firma yok | faaliyet/tesis yok,,,,maps araması yapılmadı,,,83.84,9
2026-07-04 02:41:02,MASAK,Kara Para / MASAK / Bahis,Erdoğan İmzalı Yeni MASAK Genelgesi Resmi Gazete'de Haberi,Erdoğan İmzalı Yeni MASAK Genelgesi Resmi Gazete'de Haberi bolgegundemi.com,https://news.google.com/rss/articles/CBMingFBVV95cUxQYXo0LWVDZ0M2VXZRQXNMTzdHLW5fRW43SFBydFozc0RqWnRKbXBRLWxFZjlZWG9Kb2t2UmZVLXkxTHI1YUZKdW1sZGlOeHZCMWM2Uk5iV0FoMC04TWhXXzZ2UklVUG5rUFBmQk9yVDZjem44RTR5Z1NmRHFYdmg0RmUxZWthbUVwSnExSTFnT1F3Wlk3UUlTbU1McmxCZw?oc=5,masak,,"Erdoğan İmzalı Yeni MASAK Genelgesi Resmi Gazete'de haberin detayları ve son dakika gelişmeleri. 2026-2030 strateji belgesi ve tüm yeni önlemler burada. Erdoğan İmzalı Yeni MASAK Genelgesi Resmi Gazete'de haberin detayları ve son dakika gelişmeleri. 2026-2030 strateji belgesi ve tüm yeni önlemler burada. Erdoğan İmzalı Yeni MASAK Genelgesi Resmi Gazete'de haberin detayları ve son dakika gelişmeleri. 2026-2030 strateji belgesi ve tüm yeni önlemler burada. Anasayfa » Gündem » Erdoğan İmzalı Yeni MASAK Genelgesi Resmi Gazete’de Erdoğan İmzalı Yeni MASAK Genelgesi Resmi Gazete’de Haber Merkezi Yayınlanma: 04.07.2026 - 05:35 👁️ 0 Görüntüleme Facebook Twitter WhatsApp Dinle 0.8x 1x Normal 1.2x 1.5x A- A+ Cumhurbaşkanı Recep Tayyip Erdoğan’ın imzasıyla yayımlanan genelge doğrultusunda, Türkiye’nin 2026-2030 dönemini kapsayan “Suç Gelirlerinin Aklanması ve Terörizmin Finansmanı ile Mücadele ve Müsadere Uygulamalarında Etkinliğin Artırılması Strateji Belgesi” Resmi Gazete’de ilan edildi. Yeni düzenleme, suçluları elde ettikleri gelirlerden mahrum bırakarak suçla mücadelede etkinliği artırmayı amaçlıyor. Önleyici Tedbirler ve Kurumlar Arası Koordinasyon Yayımlanan genelgeye göre, kolluk kuvvetleri ve istihbarat birimleri, suç eğilimlerinin tespiti ve vakalar özelinde ortak hareket edecek. Adli mercilerin soruşturma ve kovuşturma aşamalarını en kısa sürede tamamlaması hedeflenirken; suçtan kaynaklanan malvarlığı değerlerini aklama ile terörizmin finansmanı suçlarına karşı önlemler artırılacak. Finansal yükümlü gruplarının müşteriyi tanıma, şüpheli işlem bildirimi, kayıt tutma ve bu kayıtları yetkili makamlara sunma gibi kurallara uyması zorunlu kılınarak denetimler sıkılaştırılacak. FATF Kriterleri ve MASAK Koordinasyonu Küresel finansal sistemin güvenliğini tehdit eden suçlarla mücadele, Türkiye’nin 1991 yılından beri üye olduğu Mali Eylem Görev Gücü (FATF) standartları çerçevesinde yürütülüyor. FATF’nin teknik uyum ve etkililik kriterleri doğrultusunda hazırlanan strateji belgesi, 17 Temmuz 2021 tarihli ve 31544 sayılı Resmi Gazete’de yayımlanan 2021/16 sayılı Cumhurbaşkanlığı Genelgesi kapsamındaki 2021-2025 strateji belgesinin süresinin dolması üzerine devreye alındı. Yeni yol haritası, Mali Suçları Araştırma Kurulu Başkanlığının (MASAK) internet adresi üzerinden kamuoyuna sunulacak. Kamu Kurumlarına Hassasiyet Çağrısı Ulusal düzeyde risk temelli ve bütüncül bir yaklaşım sunan Strateji Belgesi; adli ve idari süreçlerin hızlandırılması ile kurumlar arası iş birliğinin güçlendirilmesini temel alıyor. MASAK koordinasyonunda yürütülecek ulusal risk değerlendirme çalışmaları, daha önce 21 Ekim 2016 tarihli ve 29864 sayılı Resmi Gazete’de yayımlanan 2016/22 sayılı Genelge esaslarına dayanarak yürütülmeye devam edecek. Genelge kapsamında, ilgili tüm kamu kurum ve kuruluşlarının üzerine düşen görevleri titizlikle yerine getirmesi ve strateji belgesinin uygulanma sürecine tam destek vermesi talep edildi. Kaynak: Hürriyet Benze","Erdoğan İmzalı Yeni MASAK Genelgesi Resmi Gazete'de Haberi Erdoğan İmzalı Yeni MASAK Genelgesi Resmi Gazete'de Haberi bolgegundemi.com Erdoğan İmzalı Yeni MASAK Genelgesi Resmi Gazete'de haberin detayları ve son dakika gelişmeleri. 2026-2030 strateji belgesi ve tüm yeni önlemler burada. Anasayfa » Gündem » Erdoğan İmzalı Yeni MASAK Genelgesi Resmi Gazete’de Erdoğan İmzalı Yeni MASAK Genelgesi Resmi Gazete’de Haber Merkezi Yayınlanma: 04.07.2026 - 05:35 👁️ 0 Görüntüleme Facebook Twitter WhatsApp Dinle 0.8x 1x Normal 1.2x 1.5x A- A+ Cumhurbaşkanı Recep Tayyip Erdoğan’ın imzasıyla yayımlanan genelge doğrultusunda, Türkiye’nin 2026-2030 dönemini kapsayan “Suç Gelirlerinin Aklanması ve Terörizmin Finansmanı ile Mücadele ve Müsadere Uygulamalarında Etkinliğin Artırılması Strateji Belgesi” Resmi Gazete’de ilan edildi. Yeni düzenleme, suçluları elde ettikleri gelirlerden mahrum bırakarak suçla mücadelede etkinliği artırmayı amaçlıyor. Önleyici Tedbirler ve Kurumlar Arası Koordinasyon Yayımlanan genelgeye göre, kolluk kuvvetleri ve istihbarat birimleri, suç eğilimlerinin tespiti ve vakalar özelinde ortak hareket edecek. Adli mercilerin soruşturma ve kovuşturma aşamalarını en kısa sürede tamamlaması hedeflenirken; suçtan kaynaklanan malvarlığı değerlerini aklama ile terörizmin finansmanı suçlarına karşı önlemler artırılacak. Finansal yükümlü gruplarının müşteriyi tanıma, şüpheli işlem bildirimi, kayıt tutma ve bu kayıtları yetkili makamlara sunma gibi kurallara uyması zorunlu kılınarak denetimler sıkılaştırılacak. FATF Kriterleri ve MASAK Koordinasyonu Küresel finansal sistemin güvenliğini tehdit eden suçlarla mücadele, Türkiye’nin 1991 yılından beri üye olduğu Mali Eylem Görev Gücü (FATF) standartları çerçevesinde yürütülüyor. FATF’nin teknik uyum ve etkililik kriterleri doğrultusunda hazırlanan strateji belgesi, 17 Temmuz 2021 tarihli ve 31544 sayılı Resmi Gazete’de yayımlanan 2021/16 sayılı Cumhurbaşkanlığı Genelgesi kapsamındaki 2021-2025 strateji belgesinin süresinin dolması üzerine devreye alındı. Yeni yol haritası, Mali Suçları Araştırma Kurulu Başkanlığının (MASAK) internet adresi üzerinden kamuoyuna sunulacak. Kamu Kurumlarına Hassasiyet Çağrısı Ulusal düzeyde risk temelli ve bütüncül bir yaklaşım sunan Strateji Belgesi; adli ve idari süreçlerin hızlandırılması ile kurumlar arası iş birliğinin güçlendirilmesini temel alıyor. MASAK koordinasyonunda yürütülecek ulusal risk değerlendirme çalışmaları, daha önce 21 Ekim 2016 tarihli ve 29864 sayılı Resmi Gazete’de yayımlanan 2016/22 sayılı Genelge esaslarına dayanarak yürütülmeye devam edecek. Genelge kapsamında, ilgili tüm kamu kurum ve kuruluşlarının üzerine düşen görevleri titizlikle yerine getirmesi ve strateji belgesinin uygulanma sürecine tam destek vermesi talep edildi.",browser_full_article,https://www.bolgegundemi.com/gundem/erdogan-imzali-yeni-masak-genelgesi-resmi-gazetede-77096.html,,,,,,,,il yok | ilçe yok | firma yok | faaliyet/tesis yok,,,,maps araması yapılmadı,,,60.75,10
