published,search_term,category,title,summary,link,matched_words,activity_type,raw_text,entity_source_text,article_fetch_status,resolved_article_url,city_candidates,district_candidates,neighborhood_candidates,street_candidates,facility_candidates,company_candidates,company_candidate_scores,entity_quality_note,maps_queries,maps_candidates,maps_best_guess,maps_status,maps_match_scores,maps_rejected_candidates,record_quality_score,duplicate_group_id
2026-07-08 10:37:39,MASAK,Kara Para / MASAK / Bahis,Altın şirketi görünümlü kara para çarkı! İstanbul'da milyonluk operasyon,Altın şirketi görünümlü kara para çarkı! İstanbul'da milyonluk operasyon Yeni Birlik Gazetesi,https://news.google.com/rss/articles/CBMitAFBVV95cUxOWUdQLV80MUZYV1VlOEY5MHdRSFM5Y0RsbWEzWHo5bjBuZUFrZmZXWGJTa2R1T0lmZnR3UTlfbTkxU09uUDJOVkVScHBsancxUTVWb2pUVTkwMkdwQUJoM2NZdC1Jb1BNUUFRTDhyS3BWM2ZaYnNQdEdsV253VmhHbkt5MVFxbFEtclpvbXRIZFotV1FkNHBpejROaHFXMERMVWxwdFJyU2hGekQtTWdTaEE3YXU?oc=5,şirket,şirket / firma,Altın şirketi görünümlü kara para çarkı! İstanbul'da milyonluk operasyon Yeni Birlik Gazetesi,Altın şirketi görünümlü kara para çarkı! İstanbul'da milyonluk operasyon Altın şirketi görünümlü kara para çarkı! İstanbul'da milyonluk operasyon Yeni Birlik Gazetesi Altın şirketi görünümlü kara para çarkı! İstanbul'da milyonluk operasyon Yeni Birlik Gazetesi,browser_failed,https://news.google.com/rss/articles/CBMitAFBVV95cUxOWUdQLV80MUZYV1VlOEY5MHdRSFM5Y0RsbWEzWHo5bjBuZUFrZmZXWGJTa2R1T0lmZnR3UTlfbTkxU09uUDJOVkVScHBsancxUTVWb2pUVTkwMkdwQUJoM2NZdC1Jb1BNUUFRTDhyS3BWM2ZaYnNQdEdsV253VmhHbkt5MVFxbFEtclpvbXRIZFotV1FkNHBpejROaHFXMERMVWxwdFJyU2hGekQtTWdTaEE3YXU?oc=5&hl=tr&gl=TR&ceid=TR:tr,İstanbul,,,,,,,ilçe yok | firma yok | faaliyet/tesis yok,,,,maps araması yapılmadı,,,86.18,1
2026-07-07 12:28:41,depo yangını,Fiziksel Risk / Yangın,Kepez’de Korkutan Yangın: İnşaat Deposu Kül Oldu,Kepez’de Korkutan Yangın: İnşaat Deposu Kül Oldu Akdeniz Gerçek,https://news.google.com/rss/articles/CBMilwFBVV95cUxQdVVCYS1uVWZHYlJVX0xrX21XNjN1OHZSbzBjWHZ3SXFuNWJSc0NKRVc3SGExN2hFVE9jTThKYVBBLW9RYkhLaVBvUGhYcnAwZjJHYnRBNWRpWm43QzZNLXF0dmhfT0ZmNVVWVHlIRmVteXh4TnVkTmk0R0N3dVpORU9oSmlLTldzV0hmVWZYZFdONUlnbmdN?oc=5,depo,depo,Kepez’de Korkutan Yangın: İnşaat Deposu Kül Oldu Akdeniz Gerçek,Kepez’de Korkutan Yangın: İnşaat Deposu Kül Oldu Kepez’de Korkutan Yangın: İnşaat Deposu Kül Oldu Akdeniz Gerçek Kepez’de Korkutan Yangın: İnşaat Deposu Kül Oldu Akdeniz Gerçek,browser_failed,https://news.google.com/rss/articles/CBMilwFBVV95cUxQdVVCYS1uVWZHYlJVX0xrX21XNjN1OHZSbzBjWHZ3SXFuNWJSc0NKRVc3SGExN2hFVE9jTThKYVBBLW9RYkhLaVBvUGhYcnAwZjJHYnRBNWRpWm43QzZNLXF0dmhfT0ZmNVVWVHlIRmVteXh4TnVkTmk0R0N3dVpORU9oSmlLTldzV0hmVWZYZFdONUlnbmdN?oc=5&hl=tr&gl=TR&ceid=TR:tr,Antalya,Kepez,,,İnşaat Deposu,,,firma yok,İnşaat Deposu Kepez Antalya Türkiye,Tile&Stone Depo | İzocam Antalya Depo | Sinerji Soğuk Hava Deposu | Özdemir iskele depo | Antalya Depo Yapı,Tile&Stone Depo,"firma adı yok, tesis/lokasyon ile maps tahmini var",48.275862068965516 | 47.05882352941177 | 60.0 | 42.42424242424242 | 38.70967741935484,,142.38,2
2026-07-07 13:14:20,depo yangını,Fiziksel Risk / Yangın,Bursa İnegöl'de Yumurta Deposunda Çıkan Yangın Sonrası 10 Yaşındaki Huzeyfe Gözyaşlarına Boğuldu,Bursa İnegöl'de Yumurta Deposunda Çıkan Yangın Sonrası 10 Yaşındaki Huzeyfe Gözyaşlarına Boğuldu Mersin Haber,https://news.google.com/rss/articles/CBMiV0FVX3lxTFBib3FtTzlHYjJoQXRJUlNQRFVFa0Z1V1JqLWZKbmxuOEZrejhlelhtVGVTSkdWdUNQY2tUdDliRUdTbEt1NE8wQ1dIZUxjTFFVM0J0N25Kd9IBV0FVX3lxTFBib3FtTzlHYjJoQXRJUlNQRFVFa0Z1V1JqLWZKbmxuOEZrejhlelhtVGVTSkdWdUNQY2tUdDliRUdTbEt1NE8wQ1dIZUxjTFFVM0J0N25Kdw?oc=5,depo,depo,Bursa İnegöl'de Yumurta Deposunda Çıkan Yangın Sonrası 10 Yaşındaki Huzeyfe Gözyaşlarına Boğuldu Mersin Haber,Bursa İnegöl'de Yumurta Deposunda Çıkan Yangın Sonrası 10 Yaşındaki Huzeyfe Gözyaşlarına Boğuldu Bursa İnegöl'de Yumurta Deposunda Çıkan Yangın Sonrası 10 Yaşındaki Huzeyfe Gözyaşlarına Boğuldu Mersin Haber Bursa İnegöl'de Yumurta Deposunda Çıkan Yangın Sonrası 10 Yaşındaki Huzeyfe Gözyaşlarına Boğuldu Mersin Haber,browser_failed,https://www.mersinhaber.com/amp/haber/697131,Bursa,İnegöl,,,,,,firma yok | faaliyet/tesis yok,,,,maps araması yapılmadı,,,120.34,3
2026-07-07 13:19:31,depo yangını,Fiziksel Risk / Yangın,Bursa'da depo yangını: Alevler her şeyi yok etti,Bursa'da depo yangını: Alevler her şeyi yok etti Bursa Hayat Gazetesi,https://news.google.com/rss/articles/CBMilAFBVV95cUxPRGFvZjljb2Y1bEhuMW00NUZYbnNJaXpVSUtYRFlKamlMRGpJWFF5dnNmZUNQRl9EZmttaU9nX3FRQ3RySF9Pd3d2U0FRQkYyeEpMMzRIb3VQNUliQVZSYnoyRW1ZQWhZY2ZvVzg1UVV5MmI4SXc5djRBMUViQVE2MkpDR0ZJN1BDQjh0VGMzWlZOVTdn?oc=5,depo,depo,Bursa'da depo yangını: Alevler her şeyi yok etti Bursa Hayat Gazetesi,Bursa'da depo yangını: Alevler her şeyi yok etti Bursa'da depo yangını: Alevler her şeyi yok etti Bursa Hayat Gazetesi Bursa'da depo yangını: Alevler her şeyi yok etti Bursa Hayat Gazetesi,browser_failed,https://news.google.com/rss/articles/CBMilAFBVV95cUxPRGFvZjljb2Y1bEhuMW00NUZYbnNJaXpVSUtYRFlKamlMRGpJWFF5dnNmZUNQRl9EZmttaU9nX3FRQ3RySF9Pd3d2U0FRQkYyeEpMMzRIb3VQNUliQVZSYnoyRW1ZQWhZY2ZvVzg1UVV5MmI4SXc5djRBMUViQVE2MkpDR0ZJN1BDQjh0VGMzWlZOVTdn?oc=5&hl=tr&gl=TR&ceid=TR:tr,Bursa,,,,,,,ilçe yok | firma yok | faaliyet/tesis yok,,,,maps araması yapılmadı,,,59.94,4
2026-07-08 08:54:27,depo yangını,Fiziksel Risk / Yangın,Malatya'da MSB'ye üretim yapan tekstil fabrikasında korkutan yangın,Malatya'da MSB'ye üretim yapan tekstil fabrikasında korkutan yangın Malatya Net Haber,https://news.google.com/rss/articles/CBMirwFBVV95cUxNVmZIYlpHalJzZXEwUmtEblRWUk5TUGZja2J6NWp5eXo5UDc5M3lMdUVJU2g4dDhDYkxSbEl3VTNhZ0t3MHV4RU4taUowT25SNWlZYUxJVkNpcndYSXJ0ajd4UEpPcTlBUTFDd2k0ZDVXajZaV3M5aDlhQ1BESmF1VldFTWxBOU9zelFyVi11d1BiTlNybjFRUHJUMDRUekdSWmpzbG9IdENUeHMzdTNJ?oc=5,"fabrika, tekstil, üretim",üretim tesisi | fabrika,"www.malatyanethaber.com.tr Güvenlik doğrulaması yapılıyor Bu web sitesi, kötü niyetli botlara karşı korunmak için bir güvenlik hizmeti kullanıyor. Web sitesi bir bot olmadığınızı doğrularken bu sayfa görüntülenir. Doğrulama başarılı. www.malatyanethaber.com.tr adresinin yanıt vermesi bekleniyor www.malatyanethaber.com.tr Güvenlik doğrulaması yapılıyor Doğrulama başarılı. www.malatyanethaber.com.tr adresinin yanıt vermesi bekleniyor Bu web sitesi, kötü niyetli botlara karşı korunmak için bir güvenlik hizmeti kullanıyor. Web sitesi bir bot olmadığınızı doğrularken bu sayfa görüntülenir.","Malatya'da MSB'ye üretim yapan tekstil fabrikasında korkutan yangın Malatya'da MSB'ye üretim yapan tekstil fabrikasında korkutan yangın Malatya Net Haber www.malatyanethaber.com.tr Güvenlik doğrulaması yapılıyor Bu web sitesi, kötü niyetli botlara karşı korunmak için bir güvenlik hizmeti kullanıyor. Web sitesi bir bot olmadığınızı doğrularken bu sayfa görüntülenir. www.malatyanethaber.com.tr adresinin yanıt vermesi bekleniyor www.malatyanethaber.com.tr Güvenlik doğrulaması yapılıyor Doğrulama başarılı.",browser_full_article,https://www.malatyanethaber.com.tr/malatya-da-msb-ye-uretim-yapan-tekstil-fabrikasinda-korkutan-yangin/111039/,Malatya,,,,,,,ilçe yok | firma yok | faaliyet/tesis yok,,,,maps araması yapılmadı,,,86.66,5
2026-07-07 13:57:55,depo yangını,Fiziksel Risk / Yangın,Balıkesir Edremit’te Saman Deposu Yangını,Balıkesir Edremit’te Saman Deposu Yangını Gazete Merhaba,https://news.google.com/rss/articles/CBMihwFBVV95cUxQSkVrNjFxVnRzZUZmdkkwRVd4WHpyZVAyV1E0QXBhaDhsanpLMnJHdWRKOXdYZ3FWbUlWYlY1NE9DSm9DMUdPbGhId093OXdRMXY0cnYycVd1cUpvUUo0cEVNZGhmQjQ2SjdPQU1TN1dyeGhoU3lQdHlHZFdpaEIzTncwaDFkeG_SAYwBQVVfeXFMTVowWXR1VkRJb3h1T3BsUS0yWjJyMjdGZmY0eTNWZ1JPNHBaTDlBSEk5NU9qOHh1V1NBdkNTb2RlN2I5cUdRelFDak9taHVmLU83WUJjMldfc19VeHlvbTFDeEZxRllyLXNzczA3eU9oQWRCUHUya1Q1ZjJzbks1aVhLLWczZFIzVnFCWGQ?oc=5,depo,depo,Balıkesir Edremit’te Saman Deposu Yangını Gazete Merhaba,Balıkesir Edremit’te Saman Deposu Yangını Balıkesir Edremit’te Saman Deposu Yangını Gazete Merhaba Balıkesir Edremit’te Saman Deposu Yangını Gazete Merhaba,browser_failed,https://gazetemerhaba.com/asayis/balikesir-edremitte-saman-deposu-yangini-119095,Balıkesir | Van,Edremit,,,te Saman Deposu,,,firma yok,te Saman Deposu Edremit Balıkesir Türkiye,Edremit,Edremit,"firma adı yok, tesis/lokasyon ile maps tahmini var",36.36363636363637,,137.06,6
2026-07-08 09:01:22,kara para,Kara Para / MASAK / Bahis,"Türk Bahis Baronuna Avrupa'da Kıskaç: Fedlan Kılıçaslan'ın Hesapları Bloke Edildi, Pasaportuna El Konuldu","Türk Bahis Baronuna Avrupa'da Kıskaç: Fedlan Kılıçaslan'ın Hesapları Bloke Edildi, Pasaportuna El Konuldu Afyon Türkeli Gazetesi",https://news.google.com/rss/articles/CBMi3gFBVV95cUxNQXpJYzRXdHphOV9wcXBsdVNaZ25vLURjcTB0UDItYVo3LWpNVGd6VkFQVmdaR1ItaTJjU1QxQTlheVN6WXVlN2NYdER6d0lDLVZWWWFYclRlZ2FVWFhLMVNMNk1uZ0N5TmZHalR5dE9wYzItWnRQakNLYTBaUXBid0duSjRMdDNpdDZsNXowMlJoSl9GTGNUU214SWw1VG1MM0VoUUU1QjVZckljZC04U09VZlhiN2FoNWFqT2ljYng1WDAyeUs1b2RoS2RnUHNEWkV0YnVmbm84Q1JUREE?oc=5,el konuldu,,"Türk Bahis Baronuna Avrupa'da Kıskaç: Fedlan Kılıçaslan'ın Hesapları Bloke Edildi, Pasaportuna El Konuldu Afyon Türkeli Gazetesi","Türk Bahis Baronuna Avrupa'da Kıskaç: Fedlan Kılıçaslan'ın Hesapları Bloke Edildi, Pasaportuna El Konuldu Türk Bahis Baronuna Avrupa'da Kıskaç: Fedlan Kılıçaslan'ın Hesapları Bloke Edildi, Pasaportuna El Konuldu Afyon Türkeli Gazetesi Türk Bahis Baronuna Avrupa'da Kıskaç: Fedlan Kılıçaslan'ın Hesapları Bloke Edildi, Pasaportuna El Konuldu Afyon Türkeli Gazetesi",browser_failed,https://news.google.com/rss/articles/CBMi3gFBVV95cUxNQXpJYzRXdHphOV9wcXBsdVNaZ25vLURjcTB0UDItYVo3LWpNVGd6VkFQVmdaR1ItaTJjU1QxQTlheVN6WXVlN2NYdER6d0lDLVZWWWFYclRlZ2FVWFhLMVNMNk1uZ0N5TmZHalR5dE9wYzItWnRQakNLYTBaUXBid0duSjRMdDNpdDZsNXowMlJoSl9GTGNUU214SWw1VG1MM0VoUUU1QjVZckljZC04U09VZlhiN2FoNWFqT2ljYng1WDAyeUs1b2RoS2RnUHNEWkV0YnVmbm84Q1JUREE?oc=5&hl=tr&gl=TR&ceid=TR:tr,,,,,,,,il yok | ilçe yok | firma yok | faaliyet/tesis yok,,,,maps araması yapılmadı,,,101.78,7
