published,search_term,category,title,summary,link,matched_words,activity_type,raw_text,entity_source_text,article_fetch_status,resolved_article_url,city_candidates,district_candidates,neighborhood_candidates,street_candidates,facility_candidates,company_candidates,company_candidate_scores,entity_quality_note,maps_queries,maps_candidates,maps_best_guess,maps_status,maps_match_scores,maps_rejected_candidates,record_quality_score,duplicate_group_id
2026-07-01 13:33:42,üretim tesisi yangını,Fiziksel Risk / Yangın,Dikkat! Kavurucu Sıcaklar Geldi: Sanayi Tesislerinde Yangın Riski Tırmanıyor,Dikkat! Kavurucu Sıcaklar Geldi: Sanayi Tesislerinde Yangın Riski Tırmanıyor Akdeniz Gerçek,https://news.google.com/rss/articles/CBMivgFBVV95cUxORnBvS194ZmgxTWZJck1oek5NNzFfZG9Sc1lUTjd6Q1VyRU85akpFa3NJZXNBQ2EwSlBlNE5wOUptZy1TWl9IX2NnTnRySTdSUTlRb2lFQ2ZpYk1ZQmxYZmtiZmhUcWx3NkJ2NnhmNGVzZDFmd1FDdy1xM3hTN3hmRVFIZDU4cnNodzF6Um03TFJqTlNFZDhaOGMydnVQMFNDRExGMjRRUlYwUFJkNmNiWS1OZDY1bVBuTkZZWEpn?oc=5,"sanayi, tesis",,Dikkat! Kavurucu Sıcaklar Geldi: Sanayi Tesislerinde Yangın Riski Tırmanıyor Akdeniz Gerçek,Dikkat! Kavurucu Sıcaklar Geldi: Sanayi Tesislerinde Yangın Riski Tırmanıyor Dikkat! Kavurucu Sıcaklar Geldi: Sanayi Tesislerinde Yangın Riski Tırmanıyor Akdeniz Gerçek Kavurucu Sıcaklar Geldi: Sanayi Tesislerinde Yangın Riski Tırmanıyor Akdeniz Gerçek,browser_failed,https://news.google.com/rss/articles/CBMivgFBVV95cUxORnBvS194ZmgxTWZJck1oek5NNzFfZG9Sc1lUTjd6Q1VyRU85akpFa3NJZXNBQ2EwSlBlNE5wOUptZy1TWl9IX2NnTnRySTdSUTlRb2lFQ2ZpYk1ZQmxYZmtiZmhUcWx3NkJ2NnhmNGVzZDFmd1FDdy1xM3hTN3hmRVFIZDU4cnNodzF6Um03TFJqTlNFZDhaOGMydnVQMFNDRExGMjRRUlYwUFJkNmNiWS1OZDY1bVBuTkZZWEpn?oc=5&hl=tr&gl=TR&ceid=TR:tr,,,,,,,,il yok | ilçe yok | firma yok | faaliyet/tesis yok,,,,maps araması yapılmadı,,,77.66,1
2026-07-02 06:30:26,MASAK raporu,Diğer,Seferihisar’da finansal deprem: Başkan hariç tüm tutukluların mal varlığı donduruldu!,Seferihisar’da finansal deprem: Başkan hariç tüm tutukluların mal varlığı donduruldu! Egeyön Haber,https://news.google.com/rss/articles/CBMiugFBVV95cUxOTGtnVUJDaFIxOXBDd3VZOWdKLU5PN2dFd25ZSlhPUEZDclpyTjY1MGNhci14ZjdGMHllSHJxT2JpLURuZ29kMnJqcjI2N2dRcUNJaU43RDlaV3NaMGRZU2p0aWV0eEZIVzdsUXM3cnFpSHo5bW1YUWhDVVBCdmduQkx3cWlORE1VZ29VeU5WckxxR1RFR0U2bUdhOEc1V21peThWVXR6V0N2bWN6UXV3amRGWUF3RlJyT1E?oc=5,mal varlığı,,Seferihisar’da finansal deprem: Başkan hariç tüm tutukluların mal varlığı donduruldu! Egeyön Haber,Seferihisar’da finansal deprem: Başkan hariç tüm tutukluların mal varlığı donduruldu! Seferihisar’da finansal deprem: Başkan hariç tüm tutukluların mal varlığı donduruldu! Egeyön Haber Seferihisar’da finansal deprem: Başkan hariç tüm tutukluların mal varlığı donduruldu!,browser_failed,https://news.google.com/rss/articles/CBMiugFBVV95cUxOTGtnVUJDaFIxOXBDd3VZOWdKLU5PN2dFd25ZSlhPUEZDclpyTjY1MGNhci14ZjdGMHllSHJxT2JpLURuZ29kMnJqcjI2N2dRcUNJaU43RDlaV3NaMGRZU2p0aWV0eEZIVzdsUXM3cnFpSHo5bW1YUWhDVVBCdmduQkx3cWlORE1VZ29VeU5WckxxR1RFR0U2bUdhOEc1V21peThWVXR6V0N2bWN6UXV3amRGWUF3RlJyT1E?oc=5&hl=tr&gl=TR&ceid=TR:tr,İzmir,Seferihisar,,,,,,firma yok | faaliyet/tesis yok,,,,maps araması yapılmadı,,,111.98,2
2026-07-01 13:12:00,MASAK raporu,Kara Para / MASAK / Bahis,Bolu'da rüşvet operasyonu! MASAK raporu ortaya çıkardı: 10 şüpheli hakkında gözaltı kararı,Bolu'da rüşvet operasyonu! MASAK raporu ortaya çıkardı: 10 şüpheli hakkında gözaltı kararı Türkgün,https://news.google.com/rss/articles/CBMiwwFBVV95cUxPdlRUUXJjUWVudW5kT3pUUW1zVGhneHNFNGxuaVhRVzNrYVc2VU94NDZZMWhweXY3ZXA4ZGNMdTRmNmRuTmc3ZEcwS2ZVVW1pWndVOVg2SjI3bE0yTERxZFJkekpXS1RmUkdrb05MR0ZickZSU1VDUnUyWU5iS3VBRTdPTEstRDBoSkl0WF9TTE5fb0VMejFWeTh1S21vRExjN1oweHNZbnpRMTJYaTFsQWJTVFA4YmQyZ0tGekF0cm9uQTg?oc=5,masak,,"www.turkgun.com Güvenlik doğrulaması yapılıyor Bu web sitesi, kötü niyetli botlara karşı korunmak için bir güvenlik hizmeti kullanıyor. Web sitesi bir bot olmadığınızı doğrularken bu sayfa görüntülenir. Doğrulama başarılı. www.turkgun.com adresinin yanıt vermesi bekleniyor Güvenlik doğrulaması yapılıyor Doğrulama başarılı. www.turkgun.com adresinin yanıt vermesi bekleniyor Bu web sitesi, kötü niyetli botlara karşı korunmak için bir güvenlik hizmeti kullanıyor. Web sitesi bir bot olmadığınızı doğrularken bu sayfa görüntülenir.","Bolu'da rüşvet operasyonu! MASAK raporu ortaya çıkardı: 10 şüpheli hakkında gözaltı kararı Bolu'da rüşvet operasyonu! MASAK raporu ortaya çıkardı: 10 şüpheli hakkında gözaltı kararı Türkgün www.turkgun.com Güvenlik doğrulaması yapılıyor Bu web sitesi, kötü niyetli botlara karşı korunmak için bir güvenlik hizmeti kullanıyor. Web sitesi bir bot olmadığınızı doğrularken bu sayfa görüntülenir. www.turkgun.com adresinin yanıt vermesi bekleniyor Güvenlik doğrulaması yapılıyor Doğrulama başarılı. www.turkgun.com adresinin yanıt vermesi bekleniyor Bu web sitesi, kötü niyetli botlara karşı korunmak için bir güvenlik hizmeti kullanıyor.",browser_full_article,https://www.turkgun.com/gundem/boluda-rusvet-operasyonu-masak-raporu-ortaya-cikardi-10-supheli-hakkinda-gozalti-karari/383032,Bolu,,,,,,,ilçe yok | firma yok | faaliyet/tesis yok,,,,maps araması yapılmadı,,,90.81,3
2026-07-02 10:30:22,yangın,Fiziksel Risk / Yangın,Kocaeli'de palet fabrikasında çıkan yangın söndürüldü,Kocaeli'de palet fabrikasında çıkan yangın söndürüldü Habername.com,https://news.google.com/rss/articles/CBMiqwFBVV95cUxQWFByc1lxYTBjY1hiVW9ZdEdZMENPekZMRjNUYUZ4VEwtVXJfTmdxMlE4VnNuaUhPOWRfMDI1b0VrTWVwSG9FakRqcHBUQlU5WGxJdnR2RFVTQTNIUDFoakdhZGRILWpfR2lSU25uYkU2OFFySGdFbmVCRUJOS0szazFtX1JxcXdWWWNURTJidkU5UV81X1luOW11U21OR1NNSzR4dmpYWnoxZFHSAasBQVVfeXFMUFhQcnNZcWEwY2NYYlVvWXRHWTBDT3pGTEYzVGFGeFRMLVVyX05ncTJROFZzbmlITzlkXzAyNW9Fa01lcEhvRWpEanBwVEJVOVhsSXZ0dkRVU0EzSFAxaGpHYWRkSC1qX0dpUlNubmJFNjhRckhnRW5lQkVCTktLM2sxbV9ScXF3VlljVEUyYnZFOVFfNV9ZbjltdVNtTkdTTUs0eHZqWFp6MWRR?oc=5,fabrika,fabrika,"Kocaeli'de palet fabrikasında çıkan yangın söndürüldü Kocaeli'nin Gebze ilçesinde palet fabrikasında çıkan yangın, itfaiye ekiplerinin müdahalesiyle söndürüldü. 02 Temmuz 2026 Perşembe 13:30 KOCAELİ (AA) - Kocaeli'nin Gebze ilçesinde palet fabrikasında çıkan yangın, itfaiye ekiplerinin müdahalesiyle söndürüldü. Tavşanlı Mahallesi Atatürk Caddesi'ndeki palet fabrikasında sabah saatlerinde henüz bilinmeyen nedenle yangın çıktı. Alevlerin büyümesiyle yangını fark eden çevredekiler, durumu yetkililere bildirdi. İhbar üzerine bölgeye itfaiye ve jandarma ekipleri sevk edildi. Ekiplerin yaklaşık 2 saatlik çalışması sonucu söndürülen yangın, fabrikada hasara yol açtı. İlk yorum yazan siz olun Gündem Haberleri KOCAELİ (AA) - Kocaeli'nin Gebze ilçesinde palet fabrikasında çıkan yangın, itfaiye ekiplerinin müdahalesiyle söndürüldü. Tavşanlı Mahallesi Atatürk Caddesi'ndeki palet fabrikasında sabah saatlerinde henüz bilinmeyen nedenle yangın çıktı. Alevlerin büyümesiyle yangını fark eden çevredekiler, durumu yetkililere bildirdi. İhbar üzerine bölgeye itfaiye ve jandarma ekipleri sevk edildi. Ekiplerin yaklaşık 2 saatlik çalışması sonucu söndürülen yangın, fabrikada hasara yol açtı. Kocaeli'de palet fabrikasında çıkan yangın söndürüldü Kocaeli'nin Gebze ilçesinde palet fabrikasında çıkan yangın, itfaiye ekiplerinin müdahalesiyle söndürüldü. KOCAELİ (AA) - Kocaeli'nin Gebze ilçesinde palet fabrikasında çıkan yangın, itfaiye ekiplerinin müdahalesiyle söndürüldü. Tavşanlı Mahallesi Atatürk Caddesi'ndeki palet fabrikasında sabah saatlerinde henüz bilinmeyen nedenle yangın çıktı. Alevlerin büyümesiyle yangını fark eden çevredekiler, durumu yetkililere bildirdi. İhbar üzerine bölgeye itfaiye ve jandarma ekipleri sevk edildi. Ekiplerin yaklaşık 2 saatlik çalışması sonucu söndürülen yangın, fabrikada hasara yol açtı.","Kocaeli'de palet fabrikasında çıkan yangın söndürüldü Kocaeli'de palet fabrikasında çıkan yangın söndürüldü Habername.com Kocaeli'de palet fabrikasında çıkan yangın söndürüldü Kocaeli'nin Gebze ilçesinde palet fabrikasında çıkan yangın, itfaiye ekiplerinin müdahalesiyle söndürüldü. 02 Temmuz 2026 Perşembe 13:30 KOCAELİ (AA) - Kocaeli'nin Gebze ilçesinde palet fabrikasında çıkan yangın, itfaiye ekiplerinin müdahalesiyle söndürüldü. Tavşanlı Mahallesi Atatürk Caddesi'ndeki palet fabrikasında sabah saatlerinde henüz bilinmeyen nedenle yangın çıktı. Alevlerin büyümesiyle yangını fark eden çevredekiler, durumu yetkililere bildirdi. İhbar üzerine bölgeye itfaiye ve jandarma ekipleri sevk edildi. Ekiplerin yaklaşık 2 saatlik çalışması sonucu söndürülen yangın, fabrikada hasara yol açtı. İlk yorum yazan siz olun Gündem Haberleri KOCAELİ (AA) - Kocaeli'nin Gebze ilçesinde palet fabrikasında çıkan yangın, itfaiye ekiplerinin müdahalesiyle söndürüldü. KOCAELİ (AA) - Kocaeli'nin Gebze ilçesinde palet fabrikasında çıkan yangın, itfaiye ekiplerinin müdahalesiyle söndürüldü.",browser_full_article_dom,https://news.google.com/rss/articles/CBMiqwFBVV95cUxQWFByc1lxYTBjY1hiVW9ZdEdZMENPekZMRjNUYUZ4VEwtVXJfTmdxMlE4VnNuaUhPOWRfMDI1b0VrTWVwSG9FakRqcHBUQlU5WGxJdnR2RFVTQTNIUDFoakdhZGRILWpfR2lSU25uYkU2OFFySGdFbmVCRUJOS0szazFtX1JxcXdWWWNURTJidkU5UV81X1luOW11U21OR1NNSzR4dmpYWnoxZFHSAasBQVVfeXFMUFhQcnNZcWEwY2NYYlVvWXRHWTBDT3pGTEYzVGFGeFRMLVVyX05ncTJROFZzbmlITzlkXzAyNW9Fa01lcEhvRWpEanBwVEJVOVhsSXZ0dkRVU0EzSFAxaGpHYWRkSC1qX0dpUlNubmJFNjhRckhnRW5lQkVCTktLM2sxbV9ScXF3VlljVEUyYnZFOVFfNV9ZbjltdVNtTkdTTUs0eHZqWFp6MWRR?oc=5&hl=tr&gl=TR&ceid=TR:tr,Kocaeli | Kütahya,Gebze | Tavşanlı,Tavşanlı Mahallesi,Tavşanlı Mahallesi Atatürk Caddesi,,,,firma yok | faaliyet/tesis yok,,,,maps araması yapılmadı,,,128.25,4
