published,search_term,category,title,summary,link,matched_words,activity_type,raw_text,entity_source_text,article_fetch_status,resolved_article_url,city_candidates,district_candidates,neighborhood_candidates,street_candidates,facility_candidates,company_candidates,company_candidate_scores,entity_quality_note,maps_queries,maps_candidates,maps_best_guess,maps_status,maps_match_scores,maps_rejected_candidates,record_quality_score,duplicate_group_id
2026-06-26 13:06:00,konkordato,İflas / Konkordato / Mali Sorun,"Bolu Gerede'de dev fabrikada üretim durdu: Konkordato talebi reddedildi, işten çıkarmalar başladı","Bolu Gerede'de dev fabrikada üretim durdu: Konkordato talebi reddedildi, işten çıkarmalar başladı Bolu Gündem",https://news.google.com/rss/articles/CBMi0gFBVV95cUxNQVlyVmVaNEFISGxYQ2w5eURUTWcybm9IZUJBQzZPTmh4V0ZPWDdEZEZ1WnpQZ1Iyd1c4QVpsX21WakJuZFpGVHNRbUtnalFkWGFGYmRFeHFPOEZ5NUJtVGllMk1WcnQ5XzVTYmJqM2xRZXlMdi0zNXBYeWZxSXplVmlEenRaYnJ6U1cyaHR6djI1ZHVOcEg0djRVckZfQmw0X2JJWGVtamI3NTlNa1I4Z1ZDeXR1VTVDamFXVjhqaVdWQWtPZVhKMkZZXzhRMG5aYkHSAdcBQVVfeXFMTnR2MzFMa0N2cGJXU2lKWmZRZXR0ZHRmWjc3WGY5MjF5RGIteE1zLTFwQVpSSjVWMXJ3Y19WcldsQTY1aXVpcVBoeXFxYldHQ0dpRFdSc25Zd0MwRkVMT1VLYWVlVWpUeENXRnoyTUU5SkFOYnpIVTkwUUFYTVc0SXFTaW5HVTBzelJuSWVNUUlKaVRfV2UxTlRKUEd4WkhSZWhZVW5aSWdjdV82Yllsbk1yLTJWWjhxRG5DRHlyREhtbEYwNEh6MlUyUnpFeF85ZFlOSERvNTg?oc=5,"fabrika, üretim",üretim tesisi | fabrika,"Bolu Gerede OSB'nin önde gelen sanayi kuruluşlarından İlamet Metal'in konkordato talebi mahkemece reddedildi. Üretimin durduğu dev fabrikada başlayan işten çıkarma dalgasının perde arkası ve yasal sürecin tüm detayları. Bolu Gerede OSB'nin önde gelen sanayi kuruluşlarından İlamet Metal'in konkordato talebi mahkemece reddedildi. Üretimin durduğu dev fabrikada başlayan işten çıka... Bolu Gerede OSB'nin önde gelen sanayi kuruluşlarından İlamet Metal'in konkordato talebi mahkemece reddedildi. Üretimin durduğu dev fabrikada başlayan işten çıkarma dalgasının perde arkası ve yasal sürecin tüm detayları. Bolu'nun Gerede ilçesindeki Organize Sanayi Bölgesi'nde (OSB) faaliyet gösteren dev sanayi kuruluşu İlamet Metal'in bir süredir devam eden konkordato süreci, mahkemenin ret kararıyla sona erdi. Kararın ardından fabrikada üretimin geçici olarak durdurulduğu ve işçi çıkarmalarının başladığı bildirildi. Gerede OSB'nin önemli üretim tesislerinden biri olan İlamet Metal Nakliye Sanayi ve Ticaret Limited Şirketi'nin mali darboğazı aşmak için başvurduğu yasal süreç olumsuz sonuçlandı. Gerede 2. Asliye Hukuk Mahkemesi'nde görülen davada, şirketin konkordato talebi mahkeme heyeti tarafından reddedildi. Bu gelişmeyle birlikte, bölge istihdamı ve sanayisi için kritik önem taşıyan fabrikada belirsizlik dönemi başladı. Bu haberi kaçırmayın Hadrianopolis kazılarında yeni sezon: Antik kentin gizemi Gerede sınırlarına uzanıyor mu? Devamını Oku Komiser heyetinin görevi ve koruma tedbirleri son buldu Mahkemenin yayımladığı resmi karara göre, şirket hakkında daha önce verilmiş olan geçici mühlet kararı ve bu kapsamda şirketi koruyan tüm tedbirler resmen kaldırıldı. Süreci mali ve hukuki açıdan denetlemek, aynı zamanda takip etmek üzere görevlendirilen üç kişilik bağımsız konkordato komiser heyetinin görevine de yasal olarak son verildi. Artık şirketin alacaklılara karşı yasal bir koruma kalkanı bulunmuyor. 5 aylık yasal süreç nasıl gelişmişti? Şirketin mali durumunu toparlayabilmesi amacıyla yasal süreç ilk olarak kış aylarında başlamıştı. 3 Şubat 2026: Gerede 2. Asliye Hukuk Mahkemesi, İlamet Metal'e mali tablolarını düzenlemesi için üç aylık geçici mühlet tanıdı. 30 Nisan 2026: Mahkeme, şirketin talebi ve sürecin gidişatını göz önünde bulundurarak bu mühleti iki ay daha uzatma kararı aldı. 24 Haziran 2026: Y apılan son değerlendirmeler neticesinde mahkeme konkordato talebini kesin olarak reddederek süreci noktaladı. Üretim bandı durdu, istihdam darbe aldı Hukuki korumanın kalkmasının fabrikadaki yankıları ise ağır oldu. Edinilen bilgilere ve yerel kaynakların iddialarına göre, İlamet Metal'in Gerede'deki dev üretim tesisinde faaliyetler geçici olarak tamamen durduruldu. Çarkların durmasına paralel olarak, şirket yönetiminin çalışanlarla yollarını ayırmaya başladığı öğrenildi. Gerede ekonomisi için büyük önem taşıyan tesisteki işten çıkarmaların boyutu ve işçilerin kıdem tazminatı gibi yasal haklarının durumu ise bölge halkı tarafından endişeyle takip ediliyor. Bolu Gerede'de dev fabrikada üretim durdu: Konkordato talebi reddedildi, işten çıkarmalar başladı Komiser heyetinin görevi ve koruma tedbirleri son buldu 5 aylık yasal süreç nasıl gelişmişti? Üretim bandı durdu, istihdam darbe aldı Bolu Gerede OSB'nin önde gelen sanayi kuruluşlarından İlamet Metal'in konkordato talebi mahkemece reddedildi. Üretimin durduğu dev fabrikada başlayan işten çıkarma dalgasının perde arkası ve yasal sürecin tüm detayları. Bolu'nun Gerede ilçesindeki Organize Sanayi Bölgesi'nde (OSB) faaliyet gösteren dev sanayi kuruluşu İlamet Metal'in bir süredir devam eden konkordato süreci, mahkemenin ret kararıyla sona erdi. Kararın ardından fabrikada üretimin geçici olarak durdurulduğu ve işçi çıkarmalarının başladığı bildirildi. Gerede OSB'nin önemli üretim tesislerinden biri olan İlamet Metal Nakliye Sanayi ve Ticaret Limited Şirketi'nin mali darboğazı aşmak için başvurduğu yasal süreç olumsuz sonuçlandı. Gerede 2. Asliye Hukuk Mahkemesi'nde görülen davada, şirketin konkordato talebi mahkeme heyeti tarafından reddedildi. Bu gelişmeyle birlikte, bölge istihdamı ve sanayisi için kritik önem taşıyan fabrikada belirsizlik dönemi başladı. Mahkemenin yayımladığı resmi karara göre, şirket hakkında daha önce verilmiş olan geçici mühlet kararı ve bu kapsamda şirketi koruyan tüm tedbirler resmen kaldırıldı. Süreci mali ve hukuki açıdan denetlemek, aynı zamanda takip etmek üzere görevlendirilen üç kişilik bağımsız konkordato komiser heyetinin görevine de yasal olarak son verildi. Artık şirketin alacaklılara karşı yasal bir koruma kalkanı bulunmuyor. Şirketin mali durumunu toparlayabilmesi amacıyla yasal süreç ilk olarak kış aylarında başlamıştı. 3 Şubat 2026: Gerede 2. Asliye Hukuk Mahkemesi, İlamet Metal'e mali tablolarını düzenlemesi için üç aylık geçici mühlet tanıdı. 30 Nisan 2026: Mahkeme, şirketin talebi ve sürecin gidişatını göz önünde bulundurarak bu mühleti iki ay daha uzatma kararı aldı. 24 Haziran 2026: Y apılan son değerlendirmeler neticesinde mahkeme konkordato talebini kesin olarak reddederek süreci noktaladı. Hukuki korumanın kalkmasının fabrikadaki yankıları ise ağır oldu. Edinilen bilgilere ve yerel kaynakların iddialarına göre, İlamet Metal'in Gerede'deki dev üretim tesisinde faaliyetler geçici olarak tamamen durduruldu. Çarkların durmasına paralel olarak, şirket yönetiminin çalışanlarla yollarını ayırmaya başladığı öğrenildi. Gerede ekonomisi için büyük önem taşıyan tesisteki işten çıkarmaların boyutu ve işçilerin kıdem tazminatı gibi yasal haklarının durumu ise bölge halkı tarafından endişeyle takip ediliyor. 26 Haz 2026 - 16:06 Bolu / Gerede - Güncel Yazdır Yorum yazarak Bolu Gündem Topluluk Kuralları’nı kabul etmiş bulunuyor ve yorumunuzla ilgili doğrudan veya dolaylı tüm sorumluluğu tek başınıza üstleniyorsunuz. Yazılan yorumlardan","Bolu Gerede'de dev fabrikada üretim durdu: Konkordato talebi reddedildi, işten çıkarmalar başladı Bolu Gerede'de dev fabrikada üretim durdu: Konkordato talebi reddedildi, işten çıkarmalar başladı Bolu Gündem Bolu Gerede OSB'nin önde gelen sanayi kuruluşlarından İlamet Metal'in konkordato talebi mahkemece reddedildi. Üretimin durduğu dev fabrikada başlayan işten çıkarma dalgasının perde arkası ve yasal sürecin tüm detayları. Üretimin durduğu dev fabrikada başlayan işten çıka... Bolu'nun Gerede ilçesindeki Organize Sanayi Bölgesi'nde (OSB) faaliyet gösteren dev sanayi kuruluşu İlamet Metal'in bir süredir devam eden konkordato süreci, mahkemenin ret kararıyla sona erdi. Kararın ardından fabrikada üretimin geçici olarak durdurulduğu ve işçi çıkarmalarının başladığı bildirildi. Gerede OSB'nin önemli üretim tesislerinden biri olan İlamet Metal Nakliye Sanayi ve Ticaret Limited Şirketi'nin mali darboğazı aşmak için başvurduğu yasal süreç olumsuz sonuçlandı. Asliye Hukuk Mahkemesi'nde görülen davada, şirketin konkordato talebi mahkeme heyeti tarafından reddedildi. Bu gelişmeyle birlikte, bölge istihdamı ve sanayisi için kritik önem taşıyan fabrikada belirsizlik dönemi başladı. Bu haberi kaçırmayın Hadrianopolis kazılarında yeni sezon: Antik kentin gizemi Gerede sınırlarına uzanıyor mu? Devamını Oku Komiser heyetinin görevi ve koruma tedbirleri son buldu Mahkemenin yayımladığı resmi karara göre, şirket hakkında daha önce verilmiş olan geçici mühlet kararı ve bu kapsamda şirketi koruyan tüm tedbirler resmen kaldırıldı. Süreci mali ve hukuki açıdan denetlemek, aynı zamanda takip etmek üzere görevlendirilen üç kişilik bağımsız konkordato komiser heyetinin görevine de yasal olarak son verildi. Artık şirketin alacaklılara karşı yasal bir koruma kalkanı bulunmuyor. 5 aylık yasal süreç nasıl gelişmişti? Şirketin mali durumunu toparlayabilmesi amacıyla yasal süreç ilk olarak kış aylarında başlamıştı. Asliye Hukuk Mahkemesi, İlamet Metal'e mali tablolarını düzenlemesi için üç aylık geçici mühlet tanıdı. 30 Nisan 2026: Mahkeme, şirketin talebi ve sürecin gidişatını göz önünde bulundurarak bu mühleti iki ay daha uzatma kararı aldı. 24 Haziran 2026: Y apılan son değerlendirmeler neticesinde mahkeme konkordato talebini kesin olarak reddederek süreci noktaladı. Üretim bandı durdu, istihdam darbe aldı Hukuki korumanın kalkmasının fabrikadaki yankıları ise ağır oldu. Edinilen bilgilere ve yerel kaynakların iddialarına göre, İlamet Metal'in Gerede'deki dev üretim tesisinde faaliyetler geçici olarak tamamen durduruldu. Çarkların durmasına paralel olarak, şirket yönetiminin çalışanlarla yollarını ayırmaya başladığı öğrenildi. Gerede ekonomisi için büyük önem taşıyan tesisteki işten çıkarmaların boyutu ve işçilerin kıdem tazminatı gibi yasal haklarının durumu ise bölge halkı tarafından endişeyle takip ediliyor. Bolu Gerede'de dev fabrikada üretim durdu: Konkordato talebi reddedildi, işten çıkarmalar başladı Komiser heyetinin görevi ve koruma tedbirleri son buldu 5 aylık yasal süreç nasıl gelişmişti? Üretim bandı durdu, istihdam darbe aldı Bolu Gerede OSB'nin önde gelen sanayi kuruluşlarından İlamet Metal'in konkordato talebi mahkemece reddedildi. Mahkemenin yayımladığı resmi karara göre, şirket hakkında daha önce verilmiş olan geçici mühlet kararı ve bu kapsamda şirketi koruyan tüm tedbirler resmen kaldırıldı. Hukuki korumanın kalkmasının fabrikadaki yankıları ise ağır oldu. 26 Haz 2026 - 16:06 Bolu / Gerede - Güncel Yazdır Yorum yazarak Bolu Gündem Topluluk Kuralları’nı kabul etmiş bulunuyor ve yorumunuzla ilgili doğrudan veya dolaylı tüm sorumluluğu tek başınıza üstleniyorsunuz.",browser_full_article,https://www.bolugundem.com/haber/28239325/bolu-geredede-dev-fabrikada-uretim-durdu-konkordato-talebi-reddedildi-isten-cikarmalar-basladi,Bolu,Gerede,Gerede OSB | darbe aldı Bolu Gerede OSB | nun Gerede ilçesindeki Organize Sanayi,,,İlamet Metal Nakliye Sanayi ve Ticaret Limited Şirketi'nin,İlamet Metal Nakliye Sanayi ve Ticaret Limited Şirketi'nin:57:body,faaliyet/tesis yok,İlamet Metal Nakliye Sanayi ve Ticaret Limited Şirketi'nin Gerede OSB Gerede Bolu Türkiye,İlamet Metal Ltd Şti,İlamet Metal Ltd Şti,firma adı + güvenli maps adayı var,76.47058823529412,,244.15,28
2026-06-26 13:33:02,bahis operasyonu,Kara Para / MASAK / Bahis,MASAK'a takıldılar: 12 milyarlık yasa dışı bahis ağına operasyon haberi,MASAK'a takıldılar: 12 milyarlık yasa dışı bahis ağına operasyon haberi Finans Gündem,https://news.google.com/rss/articles/CBMirAFBVV95cUxQTVREYjM0bm13UmVOYl9EcVB0cWd4bkdteGxZQUlOZF93dUEyQldvZmtYZTVjSVpSMmlWcjF4cl9jSHdDb0cwYTQ0UUZtWXVvUmpvZ2lJal9GaEtGZU9wZXNkM0JPUDgxakJCOWNQVEY3VGN4QmNDeERHVjRXOHRvdXFhc0ZTZWFQNjhxQmtmcmQzMXJLUTZ3TF9WdTJZd3U2WkVTWkoxWUUwVmRD?oc=5,masak,,MASAK'a takıldılar: 12 milyarlık yasa dışı bahis ağına operasyon haberi Finans Gündem,MASAK'a takıldılar: 12 milyarlık yasa dışı bahis ağına operasyon haberi MASAK'a takıldılar: 12 milyarlık yasa dışı bahis ağına operasyon haberi Finans Gündem MASAK'a takıldılar: 12 milyarlık yasa dışı bahis ağına operasyon haberi Finans Gündem,browser_failed,https://news.google.com/rss/articles/CBMirAFBVV95cUxQTVREYjM0bm13UmVOYl9EcVB0cWd4bkdteGxZQUlOZF93dUEyQldvZmtYZTVjSVpSMmlWcjF4cl9jSHdDb0cwYTQ0UUZtWXVvUmpvZ2lJal9GaEtGZU9wZXNkM0JPUDgxakJCOWNQVEY3VGN4QmNDeERHVjRXOHRvdXFhc0ZTZWFQNjhxQmtmcmQzMXJLUTZ3TF9WdTJZd3U2WkVTWkoxWUUwVmRD?oc=5&hl=tr&gl=TR&ceid=TR:tr,,,,,,,,il yok | ilçe yok | firma yok | faaliyet/tesis yok,,,,maps araması yapılmadı,,,63.6,29
2026-06-26 17:45:46,tasfiye,İflas / Konkordato / Mali Sorun,"Eğitim-İş Bakan Tekin’e Seslendi, “Parasız Eğitim Tasfiye Ediliyor”","Eğitim-İş Bakan Tekin’e Seslendi, “Parasız Eğitim Tasfiye Ediliyor” Bilim ve Sağlık Haber Ajansı",https://news.google.com/rss/articles/CBMikgFBVV95cUxQb3lhNHgtbmJsUVFBNHVvX0NqREZoYWRsYXh3bWdxN2V2eWlhd2o4M3BwUFdpbXlhTloxVkNJbTZQUm1iSG9LX2JXSHhXSmNFR0FGX1VQMzJBbjB0alljZmJYbEpmMFBuMmlzXzhjdTU1SXRDbHgyVHRtY215MHNPV3JNSVRpTU1aNTB0MlB1V19NZw?oc=5,sağlık,,"www.bsha.com.tr Güvenlik doğrulaması yapılıyor Bu web sitesi, kötü niyetli botlara karşı korunmak için bir güvenlik hizmeti kullanıyor. Web sitesi bir bot olmadığınızı doğrularken bu sayfa görüntülenir. Doğrulama başarılı. www.bsha.com.tr adresinin yanıt vermesi bekleniyor Güvenlik doğrulaması yapılıyor Doğrulama başarılı. www.bsha.com.tr adresinin yanıt vermesi bekleniyor Bu web sitesi, kötü niyetli botlara karşı korunmak için bir güvenlik hizmeti kullanıyor. Web sitesi bir bot olmadığınızı doğrularken bu sayfa görüntülenir.","Eğitim-İş Bakan Tekin’e Seslendi, “Parasız Eğitim Tasfiye Ediliyor” Eğitim-İş Bakan Tekin’e Seslendi, “Parasız Eğitim Tasfiye Ediliyor” Bilim ve Sağlık Haber Ajansı www.bsha.com.tr Güvenlik doğrulaması yapılıyor Bu web sitesi, kötü niyetli botlara karşı korunmak için bir güvenlik hizmeti kullanıyor. Web sitesi bir bot olmadığınızı doğrularken bu sayfa görüntülenir. www.bsha.com.tr adresinin yanıt vermesi bekleniyor Güvenlik doğrulaması yapılıyor Doğrulama başarılı. www.bsha.com.tr adresinin yanıt vermesi bekleniyor Bu web sitesi, kötü niyetli botlara karşı korunmak için bir güvenlik hizmeti kullanıyor.",browser_full_article,https://www.bsha.com.tr/egitim-is-bakan-tekine-seslendi-parasiz-egitim-tasfiye-ediliyor/,,,,,,Bilim ve Sağlık,Bilim ve Sağlık:166:body+summary,il yok | ilçe yok | faaliyet/tesis yok,Bilim ve Sağlık Türkiye,Bilim Sağlık Hizmetler | Sağlık Bilimleri Üniversitesi | Bilim OSGB | SBT SAĞLIK BİLİM VE TEKNOLOJİLERİ A.Ş | Antalya Bilim Üniversitesi Güllük Yerleşkesi,Bilim Sağlık Hizmetler,firma adı + güvenli maps adayı var,100 | 68.18181818181819 | 66.66666666666666 | 75.0 | 50.0,,184.81,30
2026-06-26 12:57:00,tasfiye,İflas / Konkordato / Mali Sorun,"Dünya devi firmadan büyük tasfiye! Fabrikalarını kapatıyor, 100 bin kişi işsiz kalacak!","Dünya devi firmadan büyük tasfiye! Fabrikalarını kapatıyor, 100 bin kişi işsiz kalacak! tv100 Haber",https://news.google.com/rss/articles/CBMiwgFBVV95cUxPWkFKV0N6aU9xMFA4VXY5RVJLeVZQcEpVUlFubjVqcmdLMDdRdkxOUjI4eW9JS0I5a2doQmFjTUlZSlV5VjB6ZWliNm1MdVVJX1N5WWhYaXQtVko1NUJKMGl6V3ItMS1mX0NDdmR0aXFuQlRxNWdQaGhQRDJmczNBamZkRDUwRTdoelBST1VLM3B1MzlGQm9FbGJpRU13dXBJYVoxWnNKRXRGdU9MWUhKaWFNRVNDN2ZULTN4eTdEY3g3Z9IBwgFBVV95cUxPWkFKV0N6aU9xMFA4VXY5RVJLeVZQcEpVUlFubjVqcmdLMDdRdkxOUjI4eW9JS0I5a2doQmFjTUlZSlV5VjB6ZWliNm1MdVVJX1N5WWhYaXQtVko1NUJKMGl6V3ItMS1mX0NDdmR0aXFuQlRxNWdQaGhQRDJmczNBamZkRDUwRTdoelBST1VLM3B1MzlGQm9FbGJpRU13dXBJYVoxWnNKRXRGdU9MWUhKaWFNRVNDN2ZULTN4eTdEY3g3Zw?oc=5,"fabrika, firma",fabrika | şirket / firma,"TV100 Alman otomotiv devi Volkswagen'de tarihi bir küçülme planı gündemde. İddialara göre şirket, yeniden yapılanma kapsamında 100 binden fazla çalışanla yollarını ayırmayı ve 4 fabrikasını kapatmayı değerlendiriyor. TV100 Alman otomotiv devi Volkswagen'in, şirket tarihinin en kapsamlı yeniden yapılanma sürecine hazırlandığı öne sürüldü. İddiaya göre şirket, 100 binden fazla çalışanla yollarını ayırmayı ve dört fabrikasını kapatmayı planlıyor. Dünya devi firmadan büyük tasfiye! Fabrikalarını kapatıyor, 100 bin kişi işsiz kalacak! Alman otomotiv devi Volkswagen'de tarihi bir küçülme planı gündemde. İddialara göre şirket, yeniden yapılanma kapsamında 100 binden fazla çalışanla yollarını ayırmayı ve 4 fabrikasını kapatmayı değerlendiriyor. Dünya devi firmadan büyük tasfiye! Fabrikalarını kapatıyor, 100 bin kişi işsiz kalacak! Alman otomotiv devi Volkswagen'de tarihi bir küçülme planı gündemde. İddialara göre şirket, yeniden yapılanma kapsamında 100 binden fazla çalışanla yollarını ayırmayı ve 4 fabrikasını kapatmayı değerlendiriyor.","Dünya devi firmadan büyük tasfiye! Fabrikalarını kapatıyor, 100 bin kişi işsiz kalacak! Dünya devi firmadan büyük tasfiye! Fabrikalarını kapatıyor, 100 bin kişi işsiz kalacak! tv100 Haber TV100 Alman otomotiv devi Volkswagen'de tarihi bir küçülme planı gündemde. İddialara göre şirket, yeniden yapılanma kapsamında 100 binden fazla çalışanla yollarını ayırmayı ve 4 fabrikasını kapatmayı değerlendiriyor. TV100 Alman otomotiv devi Volkswagen'in, şirket tarihinin en kapsamlı yeniden yapılanma sürecine hazırlandığı öne sürüldü. İddiaya göre şirket, 100 binden fazla çalışanla yollarını ayırmayı ve dört fabrikasını kapatmayı planlıyor. Dünya devi firmadan büyük tasfiye! Fabrikalarını kapatıyor, 100 bin kişi işsiz kalacak! Alman otomotiv devi Volkswagen'de tarihi bir küçülme planı gündemde.",browser_full_article,https://www.tv100.com/amp/dunya-devi-firmadan-buyuk-tasfiye-fabrikalarini-kapatiyor-100-bin-kisi-issiz-kalacak-galeri-862119,,,,,,,,il yok | ilçe yok | firma yok | faaliyet/tesis yok,,,,maps araması yapılmadı,,,94.7,31
2026-06-26 12:31:56,yolsuzluk,Banka / Finansal Kuruluş,İl Parti Komitesi İçişleri Dairesi ile Vietnam Devlet Bankası 8. Bölge Parti Komitesi arasında bir iş birliği anlaşması imzalandı.,İl Parti Komitesi İçişleri Dairesi ile Vietnam Devlet Bankası 8. Bölge Parti Komitesi arasında bir iş birliği anlaşması imzalandı. Vietnam.vn,https://news.google.com/rss/articles/CBMitwFBVV95cUxQei05OTdkNDNxUEcxUVN0V05aS1QtdnVITEtzSlJzc1ZPZnUzVDlkZ2lGb0pEQ3hxZFlLdmllUzlmRWlteGs0RUdNRXh6NXRMdHBFdHItVkxHakRRaHlqdGpVQ3U2QkhnM2p4OFliQ3RvOHpERjZfbmZmZkVlV0M0V2lwLWpibVZDa25EaGtpRVJBQ2kzYkNGWE5DaEh1U0lXNDJaQmZtWTJvbkZIUFB1Nl9QLTliWlU?oc=5,banka,finansal kuruluş,İl Parti Komitesi İçişleri Dairesi ile Vietnam Devlet Bankası 8. Bölge Parti Komitesi arasında bir iş birliği anlaşması imzalandı. Vietnam.vn,İl Parti Komitesi İçişleri Dairesi ile Vietnam Devlet Bankası 8. Bölge Parti Komitesi arasında bir iş birliği anlaşması imzalandı. İl Parti Komitesi İçişleri Dairesi ile Vietnam Devlet Bankası 8. Bölge Parti Komitesi arasında bir iş birliği anlaşması imzalandı. Vietnam.vn İl Parti Komitesi İçişleri Dairesi ile Vietnam Devlet Bankası 8. Bölge Parti Komitesi arasında bir iş birliği anlaşması imzalandı.,browser_failed,https://news.google.com/rss/articles/CBMitwFBVV95cUxQei05OTdkNDNxUEcxUVN0V05aS1QtdnVITEtzSlJzc1ZPZnUzVDlkZ2lGb0pEQ3hxZFlLdmllUzlmRWlteGs0RUdNRXh6NXRMdHBFdHItVkxHakRRaHlqdGpVQ3U2QkhnM2p4OFliQ3RvOHpERjZfbmZmZkVlV0M0V2lwLWpibVZDa25EaGtpRVJBQ2kzYkNGWE5DaEh1U0lXNDJaQmZtWTJvbkZIUFB1Nl9QLTliWlU?oc=5&hl=tr&gl=TR&ceid=TR:tr,,,,,,,,il yok | ilçe yok | firma yok | faaliyet/tesis yok,,,,maps araması yapılmadı,,,107.66,32
2026-06-26 07:56:43,yolsuzluk,Diğer,Memurların mal varlığı ve gelirleri üzerindeki denetimi güçlendirin.,Memurların mal varlığı ve gelirleri üzerindeki denetimi güçlendirin. Vietnam.vn,https://news.google.com/rss/articles/CBMijAFBVV95cUxNdlZzcjAwalMxVDBWMHd2R2VCOFZfX3lpNm1paG5qMlRpbVdqamxFSEJKWGNmTU1ZUzh0T2lvRGlvTnd1TV9wODczblFCYjJQUThCRWJOVWVna2lKUi1kNmQ2WmcwejFfT3lKeFROSmpqaEZQcUZfM0FHYWNSWXpWVnpsWkNyWjg2c0pQbw?oc=5,mal varlığı,,Memurların mal varlığı ve gelirleri üzerindeki denetimi güçlendirin. Vietnam.vn,Memurların mal varlığı ve gelirleri üzerindeki denetimi güçlendirin. Memurların mal varlığı ve gelirleri üzerindeki denetimi güçlendirin. Vietnam.vn Memurların mal varlığı ve gelirleri üzerindeki denetimi güçlendirin.,browser_failed,https://news.google.com/rss/articles/CBMijAFBVV95cUxNdlZzcjAwalMxVDBWMHd2R2VCOFZfX3lpNm1paG5qMlRpbVdqamxFSEJKWGNmTU1ZUzh0T2lvRGlvTnd1TV9wODczblFCYjJQUThCRWJOVWVna2lKUi1kNmQ2WmcwejFfT3lKeFROSmpqaEZQcUZfM0FHYWNSWXpWVnpsWkNyWjg2c0pQbw?oc=5&hl=tr&gl=TR&ceid=TR:tr,,,,,,,,il yok | ilçe yok | firma yok | faaliyet/tesis yok,,,,maps araması yapılmadı,,,62.54,33
2026-06-26 16:11:05,dolandırıcılık,Dolandırıcılık / Sahtecilik,"Yeni dolandırıcılık yöntemi: Taşımacılık hizmeti kiralayan kişileri kandırarak depozito alıyorlar, ardından parayı çalıyorlar.","Yeni dolandırıcılık yöntemi: Taşımacılık hizmeti kiralayan kişileri kandırarak depozito alıyorlar, ardından parayı çalıyorlar. Vietnam.vn",https://news.google.com/rss/articles/CBMijAFBVV95cUxOVDBHQXc1cFNTUV94OGx0aVI3Z0QtZjdHamh3Z3FVMWZJMzZBMkpOcUsxbndpTGJwYVRHMF9ISl9MdDNJQTZsT0hGVUxWTW96ek51blU3RFIzdTJvcm9LN1FOUHZIc211WjRGZGZFVllWYmIwNlZvRktqMHQ4bXpBa2QzTm9pb1ZhaWNaSg?oc=5,depo,depo,"Yeni dolandırıcılık yöntemi: Taşımacılık hizmeti kiralayan kişileri kandırarak depozito alıyorlar, ardından parayı çalıyorlar. Vietnam.vn","Yeni dolandırıcılık yöntemi: Taşımacılık hizmeti kiralayan kişileri kandırarak depozito alıyorlar, ardından parayı çalıyorlar. Yeni dolandırıcılık yöntemi: Taşımacılık hizmeti kiralayan kişileri kandırarak depozito alıyorlar, ardından parayı çalıyorlar. Vietnam.vn Yeni dolandırıcılık yöntemi: Taşımacılık hizmeti kiralayan kişileri kandırarak depozito alıyorlar, ardından parayı çalıyorlar.",browser_failed,https://news.google.com/rss/articles/CBMijAFBVV95cUxOVDBHQXc1cFNTUV94OGx0aVI3Z0QtZjdHamh3Z3FVMWZJMzZBMkpOcUsxbndpTGJwYVRHMF9ISl9MdDNJQTZsT0hGVUxWTW96ek51blU3RFIzdTJvcm9LN1FOUHZIc211WjRGZGZFVllWYmIwNlZvRktqMHQ4bXpBa2QzTm9pb1ZhaWNaSg?oc=5&hl=tr&gl=TR&ceid=TR:tr,,,,,,,,il yok | ilçe yok | firma yok | faaliyet/tesis yok,,,,maps araması yapılmadı,,,114.62,34
