published,search_term,category,title,summary,link,matched_words,activity_type,raw_text,entity_source_text,article_fetch_status,resolved_article_url,city_candidates,district_candidates,neighborhood_candidates,street_candidates,facility_candidates,company_candidates,company_candidate_scores,entity_quality_note,maps_queries,maps_candidates,maps_best_guess,maps_status,maps_match_scores,maps_rejected_candidates,record_quality_score,duplicate_group_id
2026-06-24 02:30:00,depo yangını,Fiziksel Risk / Yangın,Beyaz Eşya Deposunda Yangın Paniği! Çok Sayıda Ürün Kullanılamaz Hale Geldi,Beyaz Eşya Deposunda Yangın Paniği! Çok Sayıda Ürün Kullanılamaz Hale Geldi Merzifon Bilgi Gazetesi,https://news.google.com/rss/articles/CBMiwwFBVV95cUxPUmE4eF9XSFFydnk1di1CaVFYLXNsU0ZSeHhrTTJLQ0RyMDJwaHMxdHY4bnlDbXU4cDFVdTBRNU52QTJUZnliU0kwWjJ3VGxWRGlJaUdXX05Sd0ctV202X2prZVFWUmM1aUZLNWkwZ3JwNmY2MEQyWGh3OUk5NURFd0F6ZmRSTEg5NDVRRWpsaXVCSFl2bFQzRUt0RmhiX3lIX1oya1JqMzFPOUpWa1VuOEJ3bmdDRTJjQjM0aVB2dmpsZUk?oc=5,depo,depo,Zonguldak’ın Karadeniz Ereğli ilçesinde beyaz eşya tamiri yapılan bir iş yerinin deposunda çıkan yangın paniğe neden oldu. Zonguldak’ın Karadeniz Ereğli ilçesinde beyaz eşya tamiri yapılan bir iş yerinin deposunda çıkan yangın paniğe neden oldu. Zonguldak’ın Karadeniz Ereğli ilçesinde beyaz eşya tamiri yapılan bir iş yerinin deposunda çıkan yangın paniğe neden oldu.,Beyaz Eşya Deposunda Yangın Paniği! Çok Sayıda Ürün Kullanılamaz Hale Geldi Beyaz Eşya Deposunda Yangın Paniği! Çok Sayıda Ürün Kullanılamaz Hale Geldi Merzifon Bilgi Gazetesi Zonguldak’ın Karadeniz Ereğli ilçesinde beyaz eşya tamiri yapılan bir iş yerinin deposunda çıkan yangın paniğe neden oldu.,browser_full_article,https://www.merzifonbilgigazetesi.com/asayis/beyaz-esya-deposunda-yangin-panigi-cok-sayida-urun-kullanilamaz-hale-geldi/69626,Zonguldak | Konya,Ereğli,,,,,,firma yok | faaliyet/tesis yok,,,,maps araması yapılmadı,,,109.93,7
2026-06-24 14:40:40,tesis yangını,Fiziksel Risk / Yangın,Rusya'daki Orenburg Gaz İşleme Tesisine Saldırı: Yangın!,Rusya'daki Orenburg Gaz İşleme Tesisine Saldırı: Yangın! bolgegundemi.com,https://news.google.com/rss/articles/CBMilwFBVV95cUxQTmFtRzAySl9Reko4X3FLaXJ5ZTFRTXVLR0JSUW93QWYtbGYyNnFLcUQ2dXpHWlprbkMyMkRkOFZXR3kzdnFidkE3aGVRUm96cHRLMWQ5MS1tTnF6QjZmYTR6dU5Yc3NybG1zUmkycl9xRlVPdGJhMVpKbWRYLXAxWTZOa0J2eW1CRThTbEI2LTNDc3czdVo0?oc=5,tesis,,17:47 Cüneyt Yüksel ve Nurettin Alan 12. Yargı Paketini Sundu 17:47 Fenerbahçe Stoper Arıyor Galatasaray Hız Kesmiyor 17:46 Fransa’da İlk Ebola Vakası Doğrulandı 17:44 Bodrum Gümüşlük Denizinden 250 Kilo Atık Çıkarıldı 17:42 Antalya’da Hediye Hin’den site yönetimine aidat davası,Rusya'daki Orenburg Gaz İşleme Tesisine Saldırı: Yangın! Rusya'daki Orenburg Gaz İşleme Tesisine Saldırı: Yangın! bolgegundemi.com 17:47 Cüneyt Yüksel ve Nurettin Alan 12. Yargı Paketini Sundu 17:47 Fenerbahçe Stoper Arıyor Galatasaray Hız Kesmiyor 17:46 Fransa’da İlk Ebola Vakası Doğrulandı 17:44 Bodrum Gümüşlük Denizinden 250 Kilo Atık Çıkarıldı 17:42 Antalya’da Hediye Hin’den site yönetimine aidat davası,browser_full_article_dom,https://news.google.com/rss/articles/CBMilwFBVV95cUxQTmFtRzAySl9Reko4X3FLaXJ5ZTFRTXVLR0JSUW93QWYtbGYyNnFLcUQ2dXpHWlprbkMyMkRkOFZXR3kzdnFidkE3aGVRUm96cHRLMWQ5MS1tTnF6QjZmYTR6dU5Yc3NybG1zUmkycl9xRlVPdGJhMVpKbWRYLXAxWTZOa0J2eW1CRThTbEI2LTNDc3czdVo0?oc=5&hl=tr&gl=TR&ceid=TR:tr,Antalya,,,,,,,ilçe yok | firma yok | faaliyet/tesis yok,,,,maps araması yapılmadı,,,67.04,8
2026-06-24 06:52:00,konkordato,İflas / Konkordato / Mali Sorun,"Dezenflasyon programı tablosu: İcra iflas dosya sayısı 3 milyon 450 bin arttı, 5 bin 861 firma konkordato kararı aldı","Dezenflasyon programı tablosu: İcra iflas dosya sayısı 3 milyon 450 bin arttı, 5 bin 861 firma konkordato kararı aldı T24",https://news.google.com/rss/articles/CBMi5AFBVV95cUxQcmo0eG9rdXk0elNvcFVyUTVPeTV3U1JWWGdYRG5YOWg2aHNuSnpVSHgzWHVVNHRTeUwxbXE4ZDBLZXVvUUtveVozc1R5ckN3NzQxZDJzamQzT2FyUG1hb3lxMTJaVGtOOW5ZVlNib1hMUVBNaUdhMjQzVExoN0wtUWhkbTNTUDhTNzVLRHZlSDZmelkyRjViaTZmbHB1bENfQWlrdFJkZWN4WE5XUTVWMDBVQnRzMXVkMXNpcXdoVF9UTlNvTGw0TFZvaGN0NzB6WUtzMGxaMkJDQldlUURXbktwUmo?oc=5,firma,şirket / firma,"Dezenflasyon programı tablosu: İcra iflas dosya sayısı 3 milyon 450 bin arttı, 5 bin 861 firma konkordato kararı aldı Dezenflasyon programı tablosu: İcra iflas dosya sayısı 3 milyon 450 bin arttı, 5 bin 861 firma konkordato kararı aldı Dezenflasyon programı tablosu: İcra iflas dosya sayısı 3 milyon 450 bin arttı, 5 bin 861 firma konkordato kararı aldı Magazin Çevre Sağlık Eğitim Üç yıldır uygulanan dezenflasyon programı süresince icra ve iflas dosya sayısı 3 milyon 450 bin artarken, 5 bin 861 firma konkordato kararı aldı. Ekonomim'den Hüseyin Gökçe'nin haberine göre; enflasyonu talep kaynaklı olarak görüp iç talebi kısmaya yönelik önlemlerle birlikte uygulanan dezenflasyon programı üçüncü yılını doldurdu. 2023 yılı Haziran ayında yüzde 38.21 seviyesinde olan yıllık enflasyon, program döneminde yüzde 75.45’e (2024 Mayıs) kadar yükselirken, bu yılın Mayıs ayı itibarıyla yüzde 32.61 olarak ölçüldü. Yani 3 yıllık program boyunca enflasyon sadece 5.6 puan geriledi. 2023 yılı 9 Haziran itibarıyla mahkemelerdeki icra iflas dosyası sayısı 21 milyon 683 bin seviyesindeyken, 8 Haziran 2026’da 25 milyon 134 bine çıktı. Yani programın uygulanma döneminde toplam icra iflas dosyası sayısı 3 milyon 450 bin 758 arttı. Ödeme güçlüğü çeken şirketlerin borçlarına geçici erteleme sonucunu doğuran konkordato kararı verilen şirketlerin sayısı, program döneminde önceki yılları adeta katladı. 2023 yılından 2026 yılı Mayıs ayına kadar konkordato geçici mühlet kararı verilen firma sayısı 5 bin 861’e ulaştı. Geçici mühlet kararı verilen firma sayısı 2023 yılında 519 iken, 2024’te bin 723’e, 2025’te 2 bin 817’ye çıktı. Baykuş, yusufçuk, yılan balığı, arı, karınca, nilüfer; küçük mucitlerden müthiş tarım projeleri! ( ALINTI ) Yazı Boyutu × 21 px Küçük (14px) Büyük (30px) Varsayılan T24. Tüm Hakları Saklıdır. Zorunlu Tanımlama Bilgileri Bu tanımlama bilgileri, web sitesinin çalışması için gereklidir ve sistemlerimizde kapatılamaz. Bunlar genellikle yalnızca sizin işlemlerinizi gerçekleştirmek için ayarlanmıştır. Bu işlemler, gizlilik tercihlerinizi belirlemek, oturum açmak veya form doldurmak gibi hizmet taleplerinizi içerir. Tarayıcınızı, bu tanımlama bilgilerini engelleyecek veya bunlar hakkında sizi uyaracak şekilde ayarlayabilirsiniz ancak bu durumda sitenin bazı bölümleri çalışmayabilir. Performans Tanımlama Bilgileri Bu tanımlama bilgileri, sitemizin performansını ölçebilmemiz ve iyileştirebilmemiz için sitenin ziyaret edilme sayısını ve trafik kaynaklarını sayabilmemizi sağlar. Hangi sayfaların en fazla ve en az ziyaret edildiğini ve ziyaretçilerin sitede nasıl gezindiklerini öğrenmemize yardımcı olurlar. Bu tanımlama bilgilerinin topladığı tüm bilgiler derlenir ve bu nedenle anonimdir. Bu tanımlama bilgilerine izin vermezseniz sitemizi ne zaman ziyaret ettiğinizi bilemeyiz. Etkilenen çözümler: Google Yandex Basın İlan Kurumu Kapalı Performans Tanımlama Bilgileri Açık Performans Tanımlama Bilgileri Bu tanımlama bilgileri, sitemizin performansını ölçebilmemiz ve iyileştirebilmemiz için sitenin ziyaret edilme sayısını ve trafik kaynaklarını sayabilmemizi sağlar. Hangi sayfaların en fazla ve en az ziyaret edildiğini ve ziyaretçilerin sitede nasıl gezindiklerini öğrenmemize yardımcı olurlar. Bu tanımlama bilgilerinin topladığı tüm bilgiler derlenir ve bu nedenle anonimdir. Bu tanımlama bilgilerine izin vermezseniz sitemizi ne zaman ziyaret ettiğinizi bilemeyiz. Etkilenen çözümler: Google Yandex Basın İlan Kurumu Kapalı Performans Tanımlama Bilgileri Açık İşlevsel Tanımlama Bilgileri Bu tanımlama bilgileri, videolar ile canlı sohbet gibi gelişmiş işlevler ve kişiselleştirme olanağı sunabilmemizi sağlar. Bunlar, bizim tarafımızdan veya sayfalarımızda hizmetlerinden faydalandığımız üçüncü taraf sağlayıcılarca ayarlanabilir. Bu tanımlama bilgilerine izin vermezseniz bu işlevlerden tümü veya bazıları doğru şekilde çalışmayabilir. Etkilenen çözümler: Google Tag Manager Kapalı İşlevsel Tanımlama Bilgileri Açık İşlevsel Tanımlama Bilgileri Bu tanımlama bilgileri, videolar ile canlı sohbet gibi gelişmiş işlevler ve kişiselleştirme olanağı sunabilmemizi sağlar. Bunlar, bizim tarafımızdan veya sayfalarımızda hizmetlerinden faydalandığımız üçüncü taraf sağlayıcılarca ayarlanabilir. Bu tanımlama bilgilerine izin vermezseniz bu işlevlerden tümü veya bazıları doğru şekilde çalışmayabilir. Etkilenen çözümler: Google Tag Manager Kapalı İşlevsel Tanımlama Bilgileri Açık Kapalı Hedefleme Amaçlı Tanımlama Bilgileri Açık Sosyal Medya Tanımlama Bilgileri Bu tanımlama bilgileri, içeriğimizi arkadaşlarınız ve ağınızla paylaşabi","Dezenflasyon programı tablosu: İcra iflas dosya sayısı 3 milyon 450 bin arttı, 5 bin 861 firma konkordato kararı aldı Dezenflasyon programı tablosu: İcra iflas dosya sayısı 3 milyon 450 bin arttı, 5 bin 861 firma konkordato kararı aldı T24 Dezenflasyon programı tablosu: İcra iflas dosya sayısı 3 milyon 450 bin arttı, 5 bin 861 firma konkordato kararı aldı Dezenflasyon programı tablosu: İcra iflas dosya sayısı 3 milyon 450 bin arttı, 5 bin 861 firma konkordato kararı aldı Dezenflasyon programı tablosu: İcra iflas dosya sayısı 3 milyon 450 bin arttı, 5 bin 861 firma konkordato kararı aldı Magazin Çevre Sağlık Eğitim Üç yıldır uygulanan dezenflasyon programı süresince icra ve iflas dosya sayısı 3 milyon 450 bin artarken, 5 bin 861 firma konkordato kararı aldı. Ekonomim'den Hüseyin Gökçe'nin haberine göre; enflasyonu talep kaynaklı olarak görüp iç talebi kısmaya yönelik önlemlerle birlikte uygulanan dezenflasyon programı üçüncü yılını doldurdu. 2023 yılı Haziran ayında yüzde 38.21 seviyesinde olan yıllık enflasyon, program döneminde yüzde 75.45’e (2024 Mayıs) kadar yükselirken, bu yılın Mayıs ayı itibarıyla yüzde 32.61 olarak ölçüldü. Yani 3 yıllık program boyunca enflasyon sadece 5.6 puan geriledi. 2023 yılı 9 Haziran itibarıyla mahkemelerdeki icra iflas dosyası sayısı 21 milyon 683 bin seviyesindeyken, 8 Haziran 2026’da 25 milyon 134 bine çıktı. Yani programın uygulanma döneminde toplam icra iflas dosyası sayısı 3 milyon 450 bin 758 arttı. Ödeme güçlüğü çeken şirketlerin borçlarına geçici erteleme sonucunu doğuran konkordato kararı verilen şirketlerin sayısı, program döneminde önceki yılları adeta katladı. 2023 yılından 2026 yılı Mayıs ayına kadar konkordato geçici mühlet kararı verilen firma sayısı 5 bin 861’e ulaştı. Geçici mühlet kararı verilen firma sayısı 2023 yılında 519 iken, 2024’te bin 723’e, 2025’te 2 bin 817’ye çıktı. Baykuş, yusufçuk, yılan balığı, arı, karınca, nilüfer; küçük mucitlerden müthiş tarım projeleri! Zorunlu Tanımlama Bilgileri Bu tanımlama bilgileri, web sitesinin çalışması için gereklidir ve sistemlerimizde kapatılamaz. Bunlar genellikle yalnızca sizin işlemlerinizi gerçekleştirmek için ayarlanmıştır. Tarayıcınızı, bu tanımlama bilgilerini engelleyecek veya bunlar hakkında sizi uyaracak şekilde ayarlayabilirsiniz ancak bu durumda sitenin bazı bölümleri çalışmayabilir. Hangi sayfaların en fazla ve en az ziyaret edildiğini ve ziyaretçilerin sitede nasıl gezindiklerini öğrenmemize yardımcı olurlar. Bu tanımlama bilgilerinin topladığı tüm bilgiler derlenir ve bu nedenle anonimdir. Etkilenen çözümler: Google Yandex Basın İlan Kurumu Kapalı Performans Tanımlama Bilgileri Açık Performans Tanımlama Bilgileri Bu tanımlama bilgileri, sitemizin performansını ölçebilmemiz ve iyileştirebilmemiz için sitenin ziyaret edilme sayısını ve trafik kaynaklarını sayabilmemizi sağlar. Bunlar, bizim tarafımızdan veya sayfalarımızda hizmetlerinden faydalandığımız üçüncü taraf sağlayıcılarca ayarlanabilir.",browser_full_article,"https://t24.com.tr/ekonomi/dezenflasyon-programi-tablosu-icra-iflas-dosya-sayisi-3-milyon-450-bin-artti-5-bin-861-firma-konkordato-karari-aldi,1331212",,,,,,,,il yok | ilçe yok | firma yok | faaliyet/tesis yok,,,,maps araması yapılmadı,,,109.75,9
2026-06-24 13:45:59,konkordato,İflas / Konkordato / Mali Sorun,Konya'dan dünyaya binlerce makine satan firma konkordato ilan etti!,Konya'dan dünyaya binlerce makine satan firma konkordato ilan etti! Merhaba Gazetesi,https://news.google.com/rss/articles/CBMiqwFBVV95cUxNWHhHTTczcHJjSjcwNlV5b1FyOF9QQ2pzbFpETzBGY3N4MnFnWUlaZU1yVnlzNEVULUZkR0xnSzRjTWh1cUxBZk56d2hWN3paZ3JwcEMyU1B4N0pLNVZMN21JMDZoS05hV1hpM0d0X0ZiLVA3RGlOVC1kWlVzS2pFWF9iQ1JFdU1uSVdqdVJmNl9hRU54elV6UDRRNVNWQlVPbGlPNk5qRHBKWGPSAbsBQVVfeXFMTlp5VE9fbzJVV2JVeDI4NU9vT1hBUWJCbENaSVlSdElVeUh0a2NEb0JvYllzMWFpRXJsUm5NdjRMRFdMQi02X3VrczRMM0xwSVhXQktmSkdBdmhSUDRNVnVSbmFZanhEUk03NVZ2OHZwTUU2QUVRUHJIaVlyaDdzRF94ZllESzMyMU9yQmxKaTFRS0lYVERocFgxVWRJc0xsV3Z6b0NBWVFoRTA0N05xdXFvd09vS0E3eWxsSQ?oc=5,firma,şirket / firma,Konya'dan dünyaya binlerce makine satan firma konkordato ilan etti! Merhaba Gazetesi,Konya'dan dünyaya binlerce makine satan firma konkordato ilan etti! Konya'dan dünyaya binlerce makine satan firma konkordato ilan etti! Merhaba Gazetesi Konya'dan dünyaya binlerce makine satan firma konkordato ilan etti!,browser_failed,https://news.google.com/rss/articles/CBMiqwFBVV95cUxNWHhHTTczcHJjSjcwNlV5b1FyOF9QQ2pzbFpETzBGY3N4MnFnWUlaZU1yVnlzNEVULUZkR0xnSzRjTWh1cUxBZk56d2hWN3paZ3JwcEMyU1B4N0pLNVZMN21JMDZoS05hV1hpM0d0X0ZiLVA3RGlOVC1kWlVzS2pFWF9iQ1JFdU1uSVdqdVJmNl9hRU54elV6UDRRNVNWQlVPbGlPNk5qRHBKWGPSAbsBQVVfeXFMTlp5VE9fbzJVV2JVeDI4NU9vT1hBUWJCbENaSVlSdElVeUh0a2NEb0JvYllzMWFpRXJsUm5NdjRMRFdMQi02X3VrczRMM0xwSVhXQktmSkdBdmhSUDRNVnVSbmFZanhEUk03NVZ2OHZwTUU2QUVRUHJIaVlyaDdzRF94ZllESzMyMU9yQmxKaTFRS0lYVERocFgxVWRJc0xsV3Z6b0NBWVFoRTA0N05xdXFvd09vS0E3eWxsSQ?oc=5&hl=tr&gl=TR&ceid=TR:tr,Konya,,,,,,,ilçe yok | firma yok | faaliyet/tesis yok,,,,maps araması yapılmadı,,,81.34,10
2026-06-24 08:32:08,iflas,İflas / Konkordato / Mali Sorun,Çeyrek asırlık köklü firma iflas etti: Sektörde büyük yankı uyandırdı,Çeyrek asırlık köklü firma iflas etti: Sektörde büyük yankı uyandırdı Yeniçağ Gazetesi,https://news.google.com/rss/articles/CBMiswFBVV95cUxNUkdIUzJqb1pLZTFnbzB6Vk80TG9jcVp1RWl4bUFra1B3VG9HVmxLU2FMYUxzOHlYVDg0VmtOdEJHTnMzcGNCdVNESzhSWDVESjg4S1ZYNkFfX29SV1B2VmJiUGh3RWc1bHRfUXNzNERROUQyUXlyZlVpWWdXVzVoU1FCaU1pUEVFbWVxQmVicXJYODlqTXo0aGtLTEloZS1TaEphckpfYnhHcjYzM3pIRzh3RQ?oc=5,firma,şirket / firma,Çeyrek asırlık köklü firma iflas etti: Sektörde büyük yankı uyandırdı Yeniçağ Gazetesi,Çeyrek asırlık köklü firma iflas etti: Sektörde büyük yankı uyandırdı Çeyrek asırlık köklü firma iflas etti: Sektörde büyük yankı uyandırdı Yeniçağ Gazetesi Çeyrek asırlık köklü firma iflas etti: Sektörde büyük yankı uyandırdı Yeniçağ Gazetesi,browser_failed,https://www.yenicaggazetesi.com/ceyrek-asirlik-koklu-firma-iflas-etti-sektorde-buyuk-yanki-uyandirdi-1043986h.htm,,,,,,,,il yok | ilçe yok | firma yok | faaliyet/tesis yok,,,,maps araması yapılmadı,,,72.86,11
2026-06-24 10:20:54,iflas,İflas / Konkordato / Mali Sorun,26 yıllık nakliye firması iflas etti:,26 yıllık nakliye firması iflas etti: Karaman Uyanış Gazetesi,https://news.google.com/rss/articles/CBMihgFBVV95cUxQUU9PdjZZampUeERRZDRwM05lSmVsaXJlZHJrVnlVVFJWN0xBZjZUeXVTd0NkSXpQaXJDbmViaWNrU1Y1cWdQRmdrb1NKRXg0RmdtRElIR01mcEJEWWoxOHRZZVlTQlNlamd3dXZ3YWlFUU0tTlZkUTh0Zmc0aVRtbVhSbUJYZ9IBhgFBVV95cUxQUU9PdjZZampUeERRZDRwM05lSmVsaXJlZHJrVnlVVFJWN0xBZjZUeXVTd0NkSXpQaXJDbmViaWNrU1Y1cWdQRmdrb1NKRXg0RmdtRElIR01mcEJEWWoxOHRZZVlTQlNlamd3dXZ3YWlFUU0tTlZkUTh0Zmc0aVRtbVhSbUJYZw?oc=5,"firma, nakliye",şirket / firma,"26 yıllık nakliye firması iflas etti: Yayınlanma: 24.06.2026 13:20 Güncelleme: 24.06.2026 13:20 İstanbul’da uzun yıllardır lojistik ve taşımacılık alanında faaliyet gösteren Malatya Atılım Nakliyat Anbarı ve Dağıtım Ticaret Limited Şirketi için iflas kararı verildi. Ekonomik dalgalanmalar ve artan maliyetler, taşımacılık sektöründe faaliyet gösteren firmaları zorlamaya devam ediyor. İstanbul merkezli köklü nakliye şirketlerinden Malatya Atılım Nakliyat Anbarı ve Dağıtım Ticaret Limited Şirketi de mali sıkıntıları aşamayarak iflas sürecine girdi. 1998 yılında kurulan ve yaklaşık 26 yıldır taşımacılık alanında hizmet veren şirket hakkında mahkemeden nihai karar çıktı. Mahkeme şirketin iflasına hükmetti Malatya Atılım Nakliyat hakkında görülen dava Bakırköy 1. Asliye Ticaret Mahkemesi’nde karara bağlandı. 2026/269 esas sayılı dosya kapsamında yapılan değerlendirmede, şirketin ticari faaliyetlerini sürdüremeyeceği kanaatine varıldı. Mahkeme, 18 Haziran 2026 tarihinde saat 10.51 itibarıyla şirketin iflasına hükmetti. Kararla birlikte firmanın yönetimi ve mal varlığı üzerindeki süreç iflas masasına devredildi. Tasfiye işlemleri başladı Bakırköy 1. İcra Dairesi tarafından yayımlanan resmi ilana göre, İstanbul Ticaret Sicil Müdürlüğü’ne kayıtlı şirketin tasfiye işlemleri başlatıldı. Şirketin iflas süreci, “2026/33 İflas” numaralı dosya üzerinden yürütülecek. Bu kapsamda alacaklılar, borçlar, şirket varlıkları ve tasfiye işlemleri iflas mevzuatı çerçevesinde değerlendirilecek. Zeytinburnu ve Büyükçekmece’de faaliyet gösteriyordu Malatya Atılım Nakliyat, İstanbul’da özellikle Zeytinburnu Nakliyeciler Sitesi ve Büyükçekmece’deki merkezleriyle biliniyordu. Firma, uzun yıllar boyunca şehirler arası taşımacılık ve dağıtım hizmetleriyle sektörde yer aldı. Çeyrek asrı aşan geçmişe sahip şirketin iflası, lojistik ve nakliye sektöründe dikkat çeken gelişmelerden biri oldu. Sektörde maliyet baskısı artıyor Nakliye ve lojistik sektöründe son dönemde akaryakıt, personel, bakım, araç giderleri ve kira maliyetlerindeki artış firmaların finansal yükünü ağırlaştırıyor. Özellikle orta ölçekli taşımacılık şirketleri, daralan kâr marjları ve tahsilat sorunları nedeniyle ayakta kalmakta zorlanıyor. Malatya Atılım Nakliyat için verilen iflas kararı da sektörde yaşanan ekonomik baskının son örneklerinden biri olarak değerlendiriliyor. Devamını Okumak İçin Tıklayınız 26 yıllık nakliye firması iflas etti: İstanbul’da uzun yıllardır lojistik ve taşımacılık alanında faaliyet gösteren Malatya Atılım Nakliyat Anbarı ve Dağıtım Ticaret Limited Şirketi için iflas kararı verildi. Ekonomik dalgalanmalar ve artan maliyetler, taşımacılık sektöründe faaliyet gösteren firmaları zorlamaya devam ediyor. İstanbul merkezli köklü nakliye şirketlerinden Malatya Atılım Nakliyat Anbarı ve Dağıtım Ticaret Limited Şirketi de mali sıkıntıları aşamayarak iflas sürecine girdi. 1998 yılında kurulan ve yaklaşık 26 yıldır taşımacılık alanında hizmet veren şirket hakkında mahkemeden nihai karar çıktı. Mahkeme şirketin iflasına hükmetti Malatya Atılım Nakliyat hakkında görülen dava Bakırköy 1. Asliye Ticaret Mahkemesi’nde karara bağlandı. 2026/269 esas sayılı dosya kapsamında yapılan değerlendirmede, şirketin ticari faaliyetlerini sürdüremeyeceği kanaatine varıldı. Mahkeme, 18 Haziran 2026 tarihinde saat 10.51 itibarıyla şirketin iflasına hükmetti. Kararla birlikte firmanın yönetimi ve mal varlığı üzerindeki süreç iflas masasına devredildi. Tasfiye işlemleri başladı Bakırköy 1. İcra Dairesi tarafından yayımlanan resmi ilana göre, İstanbul Ticaret Sicil Müdürlüğü’ne kayıtlı şirketin tasfiye işlemleri başlatıldı. Şirketin iflas süreci, “2026/33 İflas” numaralı dosya üzerinden yürütülecek. Bu kapsamda alacaklılar, borçlar, şirket varlıkları ve tasfiye işlemleri iflas mevzuatı çerçevesinde değerlendirilecek. Zeytinburnu ve Büyükçekmece’de faaliyet gösteriyordu Malatya Atılım Nakliyat, İstanbul’da özellikle Zeytinburnu Nakliyeciler Sitesi ve Büyükçekmece’deki merkezleriyle biliniyordu. Firma, uzun yıllar boyunca şehirler arası taşımacılık ve dağıtım hizmetleriyle sektörde yer aldı. Çeyrek asrı aşan geçmişe sahip şirketin iflası, lojistik ve nakliye sektöründe dikkat çeken gelişmelerden biri oldu. Sektörde maliyet baskısı artıyor Nakliye ve lojistik sektöründe son dönemde akaryakıt, personel, bakım, araç giderleri ve kira maliyetlerindeki artış firmaların finansal yükünü ağırlaştırıyor. Özellikle orta ölçekli taşımacılık şirketleri, daralan kâr marjları ve tahsilat sorunları nedeniyle ayakta kalmakta zorlanıyor. Malatya Atılım Nakliyat için verilen iflas kararı da sektörde yaşanan ekonomik baskının son örneklerinden biri olarak değerlendiriliyor.","26 yıllık nakliye firması iflas etti: 26 yıllık nakliye firması iflas etti: Karaman Uyanış Gazetesi 26 yıllık nakliye firması iflas etti: Yayınlanma: 24.06.2026 13:20 Güncelleme: 24.06.2026 13:20 İstanbul’da uzun yıllardır lojistik ve taşımacılık alanında faaliyet gösteren Malatya Atılım Nakliyat Anbarı ve Dağıtım Ticaret Limited Şirketi için iflas kararı verildi. Ekonomik dalgalanmalar ve artan maliyetler, taşımacılık sektöründe faaliyet gösteren firmaları zorlamaya devam ediyor. İstanbul merkezli köklü nakliye şirketlerinden Malatya Atılım Nakliyat Anbarı ve Dağıtım Ticaret Limited Şirketi de mali sıkıntıları aşamayarak iflas sürecine girdi. 1998 yılında kurulan ve yaklaşık 26 yıldır taşımacılık alanında hizmet veren şirket hakkında mahkemeden nihai karar çıktı. Mahkeme şirketin iflasına hükmetti Malatya Atılım Nakliyat hakkında görülen dava Bakırköy 1. Asliye Ticaret Mahkemesi’nde karara bağlandı. 2026/269 esas sayılı dosya kapsamında yapılan değerlendirmede, şirketin ticari faaliyetlerini sürdüremeyeceği kanaatine varıldı. Mahkeme, 18 Haziran 2026 tarihinde saat 10.51 itibarıyla şirketin iflasına hükmetti. Kararla birlikte firmanın yönetimi ve mal varlığı üzerindeki süreç iflas masasına devredildi. Tasfiye işlemleri başladı Bakırköy 1. İcra Dairesi tarafından yayımlanan resmi ilana göre, İstanbul Ticaret Sicil Müdürlüğü’ne kayıtlı şirketin tasfiye işlemleri başlatıldı. Şirketin iflas süreci, “2026/33 İflas” numaralı dosya üzerinden yürütülecek. Bu kapsamda alacaklılar, borçlar, şirket varlıkları ve tasfiye işlemleri iflas mevzuatı çerçevesinde değerlendirilecek. Zeytinburnu ve Büyükçekmece’de faaliyet gösteriyordu Malatya Atılım Nakliyat, İstanbul’da özellikle Zeytinburnu Nakliyeciler Sitesi ve Büyükçekmece’deki merkezleriyle biliniyordu. Firma, uzun yıllar boyunca şehirler arası taşımacılık ve dağıtım hizmetleriyle sektörde yer aldı. Çeyrek asrı aşan geçmişe sahip şirketin iflası, lojistik ve nakliye sektöründe dikkat çeken gelişmelerden biri oldu. Sektörde maliyet baskısı artıyor Nakliye ve lojistik sektöründe son dönemde akaryakıt, personel, bakım, araç giderleri ve kira maliyetlerindeki artış firmaların finansal yükünü ağırlaştırıyor. Özellikle orta ölçekli taşımacılık şirketleri, daralan kâr marjları ve tahsilat sorunları nedeniyle ayakta kalmakta zorlanıyor. Malatya Atılım Nakliyat için verilen iflas kararı da sektörde yaşanan ekonomik baskının son örneklerinden biri olarak değerlendiriliyor. Devamını Okumak İçin Tıklayınız 26 yıllık nakliye firması iflas etti: İstanbul’da uzun yıllardır lojistik ve taşımacılık alanında faaliyet gösteren Malatya Atılım Nakliyat Anbarı ve Dağıtım Ticaret Limited Şirketi için iflas kararı verildi.",browser_full_article_dom,https://news.google.com/rss/articles/CBMihgFBVV95cUxQUU9PdjZZampUeERRZDRwM05lSmVsaXJlZHJrVnlVVFJWN0xBZjZUeXVTd0NkSXpQaXJDbmViaWNrU1Y1cWdQRmdrb1NKRXg0RmdtRElIR01mcEJEWWoxOHRZZVlTQlNlamd3dXZ3YWlFUU0tTlZkUTh0Zmc0aVRtbVhSbUJYZ9IBhgFBVV95cUxQUU9PdjZZampUeERRZDRwM05lSmVsaXJlZHJrVnlVVFJWN0xBZjZUeXVTd0NkSXpQaXJDbmViaWNrU1Y1cWdQRmdrb1NKRXg0RmdtRElIR01mcEJEWWoxOHRZZVlTQlNlamd3dXZ3YWlFUU0tTlZkUTh0Zmc0aVRtbVhSbUJYZw?oc=5&hl=tr&gl=TR&ceid=TR:tr,İstanbul,Büyükçekmece,,,,,,firma yok | faaliyet/tesis yok,,,,maps araması yapılmadı,,,84.75,12
