published,search_term,category,title,summary,link,matched_words,activity_type,raw_text,entity_source_text,article_fetch_status,resolved_article_url,city_candidates,district_candidates,neighborhood_candidates,street_candidates,facility_candidates,company_candidates,company_candidate_scores,entity_quality_note,maps_queries,maps_candidates,maps_best_guess,maps_status,maps_match_scores,maps_rejected_candidates,record_quality_score,duplicate_group_id
2026-06-25 17:59:52,MASAK,Kara Para / MASAK / Bahis,Tokat Belediye Başkanı Çakar'dan Yerel Yönetim Hamlesi: Kent Konseyi ve MASAK,Tokat Belediye Başkanı Çakar'dan Yerel Yönetim Hamlesi: Kent Konseyi ve MASAK HaberGo,https://news.google.com/rss/articles/CBMirgFBVV95cUxNelQ5TVlCSncwM2h5ZG5PRFh3cloycWZLU2lCVkdfNTJvWEIta1RGc2htX0ZMRkRYbGdOSlQwNE5DUUZ6TmJLSkR0czhVTHdvT0NLcnN2NG5heFFVaXpra0VteXVQT1FZWm43Rl9jMUNSR3pRVXBMeHJRWE42X1MyOU0wSEpKV2IzUUU0MWtLT19iVURaQUY1WTczWk9yNXZBNVRXWWNGaE94UFp1WkHSAbMBQVVfeXFMUHVIOXF3bmx5TkhFMTVQa2ZQOGE1QklqMlVKRjVjMGVCV0t2dDRFOXdaODh0a0RpZkkySWhIMWJkUHc0S202TlZyb0p0NGdDNFBfb1c1OWFDNG9jamVETnYtVlo4UGk2ZHpBWU9zR1JuNFFtYlVLeGVDUjlIUlJlT2FEVnh3OHRkTzkyOFRsNVBYalJHRlRCeEhNblpkUHU5UHNRMkFFVzlkZV8tWVVPaFVvdmc?oc=5,masak,,"Tokat Belediye Başkanı Çakar, Kocaeli'de Kent Konseyi modelini tanıttı ve MASAK mevzuat değişikliklerine uyum sürecinin detaylarını paylaştı. Tokat Belediye Başkanı Çakar, Kocaeli'de Kent Konseyi modelini tanıttı ve MASAK mevzuat değişikliklerine uyum sürecinin detaylarını paylaştı. Tokat Belediye Başkanı Çakar, Kocaeli'de Kent Konseyi modelini tanıttı ve MASAK mevzuat değişikliklerine uyum sürecinin detaylarını paylaştı. Tokat Belediye Başkanı Çakar'dan Yerel Yönetim Hamlesi: Kent Konseyi ve MASAK Tokat Belediye Başkanı Çakar, Kocaeli'de Kent Konseyi modelini tanıtırken, belediyenin MASAK mevzuat değişikliklerine tam uyum sürecini başlattığını açıkladı.","Tokat Belediye Başkanı Çakar'dan Yerel Yönetim Hamlesi: Kent Konseyi ve MASAK Tokat Belediye Başkanı Çakar'dan Yerel Yönetim Hamlesi: Kent Konseyi ve MASAK HaberGo Tokat Belediye Başkanı Çakar, Kocaeli'de Kent Konseyi modelini tanıttı ve MASAK mevzuat değişikliklerine uyum sürecinin detaylarını paylaştı. Tokat Belediye Başkanı Çakar'dan Yerel Yönetim Hamlesi: Kent Konseyi ve MASAK Tokat Belediye Başkanı Çakar, Kocaeli'de Kent Konseyi modelini tanıtırken, belediyenin MASAK mevzuat değişikliklerine tam uyum sürecini başlattığını açıkladı.",browser_full_article,https://www.habergo.com.tr/haber/tokat-belediye-baskani-cakar-dan-yerel-yonetim-hamlesi-kent-konseyi-ve-masak,Kocaeli,,,,,,,ilçe yok | firma yok | faaliyet/tesis yok,,,,maps araması yapılmadı,,,92.37,13
2026-06-26 11:09:10,tesis yangını,Fiziksel Risk / Yangın,Eskişehir'de geri dönüşüm tesisinde çıkan yangın söndürüldü,Eskişehir'de geri dönüşüm tesisinde çıkan yangın söndürüldü ensondakika.com.tr,https://news.google.com/rss/articles/CBMirAFBVV95cUxQc1BfbEdoVTlJZXJsZGNYeGVzU0k2R3RMN2o5MXJvSWlwOG9SaWg3dnhtVjZmUFdJNVZWZTR2S29aNlFfQjVrX21fOTc1NGtpT21YbDVzUjdCME1LVkxVOUc1WUNnSUlzNktBaWxLckd5QWJKakxpTXFMZ09UYVB3V1dqRnRtRG0yblB5UVJpR1pnVllOT3NYVUNUQXc4ekM0YVJ2cmEtTG1TTU5w0gGsAUFVX3lxTFBzUF9sR2hVOUllcmxkY1h4ZXNTSTZHdEw3ajkxcm9JaXA4b1JpaDd2eG1WNmZQV0k1VlZlNHZLb1o2UV9CNWtfbV85NzU0a2lPbVhsNXNSN0IwTUtWTFU5RzVZQ2dJSXM2S0FpbEtyR3lBYkpqTGlNcUxnT1RhUHdXV2pGdG1EbTJuUHlRUmlHWmdWWU5Pc1hVQ1RBdzh6QzRhUnZyYS1MbVNNTnA?oc=5,tesis,,"Eskişehir - Eskişehir'de geri dönüşüm tesisinde çıkan yangın, itfaiye ekiplerinin müdahalesiyle söndürüldü. Paylaş Tweetle Whatsapp Telegram Eskişehir'de geri dönüşüm tesisinde çıkan yangın söndürüldü 26 Haziran 2026 - 14:09 TAKİP ET Eskişehir - Eskişehir'de geri dönüşüm tesisinde çıkan yangın, itfaiye ekiplerinin müdahalesiyle söndürüldü. Eskişehir Haberleri - Eskişehir'de geri dönüşüm tesisinde çıkan yangın, itfaiye ekiplerinin müdahalesiyle söndürüldü. Kanlıpınar Mahallesi 12022. Sokak'ta bulunan geri dönüşüm tesisinde henüz belirlenemeyen nedenle yangın çıktı. İhbar üzerine olay yerine yönlendirilen itfaiye ekipleri, yangına müdahale etti. Ekiplerin uzun uğraşları sonucu söndürülen yangının çıkış nedeni araştırılıyor. Eskişehir Geri dönüşüm tesisi yangın Eskişehir'de geri dönüşüm tesisinde çıkan yangın söndürüldü İlginizi Çekebilecek Haberler Eskişehir - Eskişehir'de geri dönüşüm tesisinde çıkan yangın, itfaiye ekiplerinin müdahalesiyle söndürüldü. Eskişehir Haberleri - Eskişehir'de geri dönüşüm tesisinde çıkan yangın, itfaiye ekiplerinin müdahalesiyle söndürüldü. Kanlıpınar Mahallesi 12022. Sokak'ta bulunan geri dönüşüm tesisinde henüz belirlenemeyen nedenle yangın çıktı. İhbar üzerine olay yerine yönlendirilen itfaiye ekipleri, yangına müdahale etti. Ekiplerin uzun uğraşları sonucu söndürülen yangının çıkış nedeni araştırılıyor.","Eskişehir'de geri dönüşüm tesisinde çıkan yangın söndürüldü Eskişehir'de geri dönüşüm tesisinde çıkan yangın söndürüldü ensondakika.com.tr Eskişehir - Eskişehir'de geri dönüşüm tesisinde çıkan yangın, itfaiye ekiplerinin müdahalesiyle söndürüldü. Paylaş Tweetle Whatsapp Telegram Eskişehir'de geri dönüşüm tesisinde çıkan yangın söndürüldü 26 Haziran 2026 - 14:09 TAKİP ET Eskişehir - Eskişehir'de geri dönüşüm tesisinde çıkan yangın, itfaiye ekiplerinin müdahalesiyle söndürüldü. Eskişehir Haberleri - Eskişehir'de geri dönüşüm tesisinde çıkan yangın, itfaiye ekiplerinin müdahalesiyle söndürüldü. Kanlıpınar Mahallesi 12022. Sokak'ta bulunan geri dönüşüm tesisinde henüz belirlenemeyen nedenle yangın çıktı. İhbar üzerine olay yerine yönlendirilen itfaiye ekipleri, yangına müdahale etti. Ekiplerin uzun uğraşları sonucu söndürülen yangının çıkış nedeni araştırılıyor. Eskişehir Geri dönüşüm tesisi yangın Eskişehir'de geri dönüşüm tesisinde çıkan yangın söndürüldü İlginizi Çekebilecek Haberler Eskişehir - Eskişehir'de geri dönüşüm tesisinde çıkan yangın, itfaiye ekiplerinin müdahalesiyle söndürüldü.",browser_full_article,https://www.ensondakika.com.tr/amp/haber/eskisehir-de-geri-donusum-tesisinde-cikan-yangin-sonduruldu/664746/,Eskişehir,,Kanlıpınar Mahallesi,,Eskişehir Geri dönüşüm tesisi,,,ilçe yok | firma yok,Eskişehir Geri dönüşüm tesisi Kanlıpınar Mahallesi Eskişehir Türkiye,ÇAKMANOĞLU METAL GERİ DÖNÜŞÜM | Ersaha Geri Kazanım Tesis | Benli Geri Dönüşüm | Eskişehir Büyükşehir Belediyesi 2. Sınıf Düzenli Depolama Tesisi | Seyis geri dönüşüm,ÇAKMANOĞLU METAL GERİ DÖNÜŞÜM,"firma adı yok, tesis/lokasyon ile maps tahmini var",58.53658536585366 | 55.55555555555556 | 80.0 | 71.11111111111111 | 80.0,,168.56,14
2026-06-25 15:26:03,tesis yangını,Fiziksel Risk / Yangın,Edirne Keşan'da Katı Atık Bertaraf Tesisi'nde çıkan yangın kısa sürede söndürüldü.,Edirne Keşan'da Katı Atık Bertaraf Tesisi'nde çıkan yangın kısa sürede söndürüldü. Mersin Haber,https://news.google.com/rss/articles/CBMiV0FVX3lxTE9uWGgyYUlvUEdBRjhtTGM5OWRVNmhyRk1tY3E2U1pVY2hKNjR2X1E2VmE1Rk9XYXdyaWd3ek83STFNS3pRQVVvbDNraWlhMm9ETVFhUlJmc9IBV0FVX3lxTE9uWGgyYUlvUEdBRjhtTGM5OWRVNmhyRk1tY3E2U1pVY2hKNjR2X1E2VmE1Rk9XYXdyaWd3ek83STFNS3pRQVVvbDNraWlhMm9ETVFhUlJmcw?oc=5,tesis,,"Edirne Keşan'da Katı Atık Bertaraf Tesisi'nde çıkan yangın kısa sürede söndürüldü. Edirne'nin Keşan ilçesindeki Katı Atık Bertaraf Tesisi'nin plastik ayrıştırma bölümünde meydana gelen yangın, zamanında müdahale ile kontrol altına alındı. 25 Haziran 2026 @mersinhaber 'i takip et Alınan bilgilere göre, Paşayiğit Mahallesi yakınlarındaki Günekab Katı Atık Bertaraf Tesisi'nin plastik ayrıştırma ünitesinde, henüz belirlenemeyen bir sebepten yangın çıktı. Rüzgarın etkisiyle hızla yayılan alevleri gören çevredekiler, durumu hemen itfaiye ekiplerine bildirdi. Yangının etkisi, şehrin uzak yerlerinden bile dumanların yükselmesiyle fark edildi. Olay yerine hızla intikal eden itfaiye ekipleri ve Orman İşletme Müdürlüğü'ne bağlı ekipler, yangını tesisin diğer bölümlerine sıçramadan kontrol altına almayı başardı. Yangın söndürüldükten sonra bölgede soğutma çalışmaları devam etti. Yangının çıkış sebebi ile ilgili olarak incelemelerin başlatıldığı bildirildi. Alınan bilgilere göre, Paşayiğit Mahallesi yakınlarındaki Günekab Katı Atık Bertaraf Tesisi'nin plastik ayrıştırma ünitesinde, henüz belirlenemeyen bir sebepten yangın çıktı. Rüzgarın etkisiyle hızla yayılan alevleri gören çevredekiler, durumu hemen itfaiye ekiplerine bildirdi. Yangının etkisi, şehrin uzak yerlerinden bile dumanların yükselmesiyle fark edildi. Olay yerine hızla intikal eden itfaiye ekipleri ve Orman İşletme Müdürlüğü'ne bağlı ekipler, yangını tesisin diğer bölümlerine sıçramadan kontrol altına almayı başardı. Yangın söndürüldükten sonra bölgede soğutma çalışmaları devam etti. Yangının çıkış sebebi ile ilgili olarak incelemelerin başlatıldığı bildirildi. 25 Haziran 2026 @mersinhaber 'i takip et Alınan bilgilere göre, Paşayiğit Mahallesi yakınlarındaki Günekab Katı Atık Bertaraf Tesisi'nin plastik ayrıştırma ünitesinde, henüz belirlenemeyen bir sebepten yangın çıktı. Rüzgarın etkisiyle hızla yayılan alevleri gören çevredekiler, durumu hemen itfaiye ekiplerine bildirdi. Yangının etkisi, şehrin uzak yerlerinden bile dumanların yükselmesiyle fark edildi. Olay yerine hızla intikal eden itfaiye ekipleri ve Orman İşletme Müdürlüğü'ne bağlı ekipler, yangını tesisin diğer bölümlerine sıçramadan kontrol altına almayı başardı. Yangın söndürüldükten sonra bölgede soğutma çalışmaları devam etti. Yangının çıkış sebebi ile ilgili olarak incelemelerin başlatıldığı bildirildi. Edirne Keşan'da Katı Atık Bertaraf Tesisi'nde çıkan yangın kısa sürede söndürüldü. Edirne'nin Keşan ilçesindeki Katı Atık Bertaraf Tesisi'nin plastik ayrıştırma bölümünde meydana gelen yangın, zamanında müdahale ile kontrol altına alındı.","Edirne Keşan'da Katı Atık Bertaraf Tesisi'nde çıkan yangın kısa sürede söndürüldü. Edirne Keşan'da Katı Atık Bertaraf Tesisi'nde çıkan yangın kısa sürede söndürüldü. Mersin Haber Edirne Keşan'da Katı Atık Bertaraf Tesisi'nde çıkan yangın kısa sürede söndürüldü. Edirne'nin Keşan ilçesindeki Katı Atık Bertaraf Tesisi'nin plastik ayrıştırma bölümünde meydana gelen yangın, zamanında müdahale ile kontrol altına alındı. 25 Haziran 2026 @mersinhaber 'i takip et Alınan bilgilere göre, Paşayiğit Mahallesi yakınlarındaki Günekab Katı Atık Bertaraf Tesisi'nin plastik ayrıştırma ünitesinde, henüz belirlenemeyen bir sebepten yangın çıktı. Rüzgarın etkisiyle hızla yayılan alevleri gören çevredekiler, durumu hemen itfaiye ekiplerine bildirdi. Yangının etkisi, şehrin uzak yerlerinden bile dumanların yükselmesiyle fark edildi. Olay yerine hızla intikal eden itfaiye ekipleri ve Orman İşletme Müdürlüğü'ne bağlı ekipler, yangını tesisin diğer bölümlerine sıçramadan kontrol altına almayı başardı. Yangın söndürüldükten sonra bölgede soğutma çalışmaları devam etti. Yangının çıkış sebebi ile ilgili olarak incelemelerin başlatıldığı bildirildi. Alınan bilgilere göre, Paşayiğit Mahallesi yakınlarındaki Günekab Katı Atık Bertaraf Tesisi'nin plastik ayrıştırma ünitesinde, henüz belirlenemeyen bir sebepten yangın çıktı.",browser_full_article,https://www.mersinhaber.com/amp/haber/684631,Edirne,Keşan,Paşayiğit Mahallesi,,Atık Bertaraf Tesisi,,,firma yok,Atık Bertaraf Tesisi Paşayiğit Mahallesi Keşan Edirne Türkiye,Güney Edirne Katı Atık Birliği,Güney Edirne Katı Atık Birliği,"firma adı yok, tesis/lokasyon ile maps tahmini var",44.0,,211.75,15
2026-06-26 08:37:14,konkordato,İflas / Konkordato / Mali Sorun,"Bursa'da konkordato ve iflas dosyalarında peş peşe kararlar! Otomotiv, metal, tekstil şirketleri...","Bursa'da konkordato ve iflas dosyalarında peş peşe kararlar! Otomotiv, metal, tekstil şirketleri... Bursa Hakimiyet",https://news.google.com/rss/articles/CBMi2AFBVV95cUxOR1hOd3VaU2ozemRfTVlscTAyNWxYR3NHSTQ0Y1llMHFvTHdoTm1LYUtBY1lRVXMzZXdoV2ZlQzFMT3VHV3JULU02VGNmRktxbGlRWnlHVXlpSjlISWQzNU5sem02LUZxaUNlaFBsRFNlakFWWHBWUVNnRjJXVmVvN0tBRDUwcXIyQ0xjUGtRLXVRNEMyMlZkV042QU4wSXFmTldxbUlodFpCVEpJQlJpLXZ2YWNSYVZmS1NJMDJQaHE4NE5IYVp4VzE2Q2RibjBlQV8xNWp3ZUs?oc=5,"otomotiv, tekstil, şirket",şirket / firma,"Bursa Ticaret Mahkemeleri'nden şirketleri yakından ilgilendiren önemli kararlar çıktı. Bir otomotiv ve metal grubu için 3 aylık geçici konkordato mühleti verilirken, iki tekstil şirketinin konkordato süreci ise mahkeme kararıyla sona erdi. Bursa'da konkordato ve iflas dosyalarında peş peşe kararlar! Otomotiv, metal, tekstil şirketleri... Bursa Ticaret Mahkemeleri'nden şirketleri yakından ilgilendiren önemli kararlar çıktı. Bir otomotiv ve metal grubu için 3 aylık geçici konkordato mühleti verilirken, iki tekstil şirketinin konkordato süreci ise mahkeme kararıyla sona erdi. Bursa'da konkordato başvurularına ilişkin yargı süreçleri hız kesmeden devam ediyor. Bursa 2. Asliye Ticaret Mahkemesi, otomotiv ve metal sektöründe faaliyet gösteren iki şirket ile şirket ortaklarının konkordato başvurusunu değerlendirerek 3 aylık geçici mühlet kararı verdi. Aynı dönemde Bursa 1. Asliye Ticaret Mahkemesi ise iki farklı dosyada konkordato taleplerini reddederek daha önce verilen kesin mühletlerin kaldırılmasına hükmetti. METALSAN VE METSAN GROUP'A 3 AYLIK GEÇİCİ MÜHLET Bursa 2. Asliye Ticaret Mahkemesi'nin 2026/377 Esas sayılı dosyasında; Metalsan Kaplama Sanayi ve Ticaret A.Ş., Metsan Group Metal Sanayi ve Ticaret Ltd. Şti., Selda Kıv, Hasan Kıv, Halil Uçan tarafından yapılan konkordato başvurusu şekli yönden uygun bulunarak kabul edildi. Mahkeme, 23 Haziran 2026 saat 16.00'dan itibaren geçerli olmak üzere 3 aylık geçici mühlet verilmesine karar verdi. İCRA TAKİPLERİ DURDURULDU Geçici mühlet kararıyla birlikte İcra ve İflas Kanunu kapsamında önemli koruma tedbirleri de devreye girdi. Mahkeme kararı doğrultusunda; Şirketler hakkında yeni icra takibi başlatılamayacak. Devam eden icra takipleri durdurulacak. İhtiyati haciz ve ihtiyati tedbir kararları uygulanmayacak. Rehinli alacaklara ilişkin takipler belirli şartlarla devam edebilecek ancak rehinli malların satışı yapılamayacak. Ayrıca geçici mühlet süresince şirketlerin gerçekleştireceği tüm önemli işlemler, konkordato komiserleri kurulunun onayına bağlı olacak. ÜÇ KİŞİLİK KONKORDATO KOMİSERİ KURULU GÖREVLENDİRİLDİ Mahkeme tarafından konkordato sürecini denetlemek amacıyla üç kişilik komiser heyeti oluşturuldu. Komiser kurulunda; Hukukçu Begüm Yoldaş, Bağımsız Denetçi Ahmet Dalyan, Makine Mühendisi Fürkan Gökçayır, görev yapacak. Ayrıca şirketlerin karşılıksız kalan çeklerine ""karşılıksızdır"" ibaresi yerine ""konkordato tedbiri"" şerhi düşülmesine karar verildi. Mahkeme, kesin mühlet talebini değerlendirmek üzere duruşmayı 16 Eylül 2026 saat 14.00'a erteledi. Alacaklılar ise ilan tarihinden itibaren 7 gün içinde konkordato talebine itiraz edebilecek. KOZMOS TEKSTİL'İN KONKORDATO SÜRECİ SONA ERDİ Bursa 1. Asliye Ticaret Mahkemesi'nin 2025/247 Esas sayılı dosyasında ise; Enver Uğur Tutluoğlu, Sefer Özdemir, Selim Özdemir ve Kozmos Tekstil ve Geri Dönüşüm Sanayi Ticaret Limited Şirketi tarafından yapılan konkordato başvuruları reddedildi. Mahkeme Verilen kesin mühletin kendiliğinden sona erdiğine, Daha önce uygulanan tüm tedbirlerin kaldırılmasına, Konkordato Komiseri Savaş Altan'ın görevine son verilmesine karar verdi. Şirket hakkında ise iflas şartlarının oluşmadığı belirtilerek iflas kararı verilmesine yer olmadığına hükmedildi. ADEKS TEKSTİL DOSYASINDA DA TEDBİRLER KALDIRILDI Bursa 1. Asliye Ticaret Mahkemesi'nin 2025/237 Esas sayılı dosyasında ise Ahmet Bülent Dalkılıç ile Adeks Tekstil Sanayi ve Ticaret Limited Şirketinin konkordato talepleri, davacıların feragati nedeniyle reddedildi. Mahkeme Kesin mühlet kararının sona erdiğini, Konkordato kapsamında uygulanan tüm koruma tedbirlerinin kaldırıldığını, Konkordato Komiseri Engin Dinçeli'nin görevine son verildiğini karara bağladı. Mahkeme ayrıca Adeks Tekstil açısından da iflas şartlarının oluşmadığına hükmederek şirket hakkında iflas kararı verilmesine yer olmadığına karar verdi. BURSA'DA KONKORDATO DOSYALARINDA HAREKETLİ SÜREÇ Son mahkeme kararlarıyla birlikte Bursa'da konkordato süreçlerinde farklı sonuçlar ortaya çıktı. Metal ve otomotiv sektöründe faaliyet gösteren iki şirkete geçici koruma sağlanırken, iki tekstil şirketinin konkordato süreçleri ise mahkeme kararıyla sona erdi. Önümüzdeki aylarda özellikle Metalsan Kaplama ve Metsan Group hakkında verilecek kesin mühlet kararı, şirketlerin mali geleceği açısından belirleyici olacak.","Bursa'da konkordato ve iflas dosyalarında peş peşe kararlar! Otomotiv, metal, tekstil şirketleri... Bursa'da konkordato ve iflas dosyalarında peş peşe kararlar! Otomotiv, metal, tekstil şirketleri... Bursa Hakimiyet Bursa Ticaret Mahkemeleri'nden şirketleri yakından ilgilendiren önemli kararlar çıktı. Bir otomotiv ve metal grubu için 3 aylık geçici konkordato mühleti verilirken, iki tekstil şirketinin konkordato süreci ise mahkeme kararıyla sona erdi. Bursa'da konkordato ve iflas dosyalarında peş peşe kararlar! Otomotiv, metal, tekstil şirketleri... Bursa'da konkordato başvurularına ilişkin yargı süreçleri hız kesmeden devam ediyor. Asliye Ticaret Mahkemesi, otomotiv ve metal sektöründe faaliyet gösteren iki şirket ile şirket ortaklarının konkordato başvurusunu değerlendirerek 3 aylık geçici mühlet kararı verdi. Asliye Ticaret Mahkemesi ise iki farklı dosyada konkordato taleplerini reddederek daha önce verilen kesin mühletlerin kaldırılmasına hükmetti. METALSAN VE METSAN GROUP'A 3 AYLIK GEÇİCİ MÜHLET Bursa 2. Asliye Ticaret Mahkemesi'nin 2026/377 Esas sayılı dosyasında; Metalsan Kaplama Sanayi ve Ticaret A.Ş., Metsan Group Metal Sanayi ve Ticaret Ltd. Şti., Selda Kıv, Hasan Kıv, Halil Uçan tarafından yapılan konkordato başvurusu şekli yönden uygun bulunarak kabul edildi. Mahkeme kararı doğrultusunda; Şirketler hakkında yeni icra takibi başlatılamayacak. Ayrıca geçici mühlet süresince şirketlerin gerçekleştireceği tüm önemli işlemler, konkordato komiserleri kurulunun onayına bağlı olacak. ÜÇ KİŞİLİK KONKORDATO KOMİSERİ KURULU GÖREVLENDİRİLDİ Mahkeme tarafından konkordato sürecini denetlemek amacıyla üç kişilik komiser heyeti oluşturuldu. Komiser kurulunda; Hukukçu Begüm Yoldaş, Bağımsız Denetçi Ahmet Dalyan, Makine Mühendisi Fürkan Gökçayır, görev yapacak. Ayrıca şirketlerin karşılıksız kalan çeklerine ""karşılıksızdır"" ibaresi yerine ""konkordato tedbiri"" şerhi düşülmesine karar verildi. Alacaklılar ise ilan tarihinden itibaren 7 gün içinde konkordato talebine itiraz edebilecek. KOZMOS TEKSTİL'İN KONKORDATO SÜRECİ SONA ERDİ Bursa 1. Asliye Ticaret Mahkemesi'nin 2025/247 Esas sayılı dosyasında ise; Enver Uğur Tutluoğlu, Sefer Özdemir, Selim Özdemir ve Kozmos Tekstil ve Geri Dönüşüm Sanayi Ticaret Limited Şirketi tarafından yapılan konkordato başvuruları reddedildi. Mahkeme Verilen kesin mühletin kendiliğinden sona erdiğine, Daha önce uygulanan tüm tedbirlerin kaldırılmasına, Konkordato Komiseri Savaş Altan'ın görevine son verilmesine karar verdi. Şirket hakkında ise iflas şartlarının oluşmadığı belirtilerek iflas kararı verilmesine yer olmadığına hükmedildi. ADEKS TEKSTİL DOSYASINDA DA TEDBİRLER KALDIRILDI Bursa 1. Asliye Ticaret Mahkemesi'nin 2025/237 Esas sayılı dosyasında ise Ahmet Bülent Dalkılıç ile Adeks Tekstil Sanayi ve Ticaret Limited Şirketinin konkordato talepleri, davacıların feragati nedeniyle reddedildi. Mahkeme Kesin mühlet kararının sona erdiğini, Konkordato kapsamında uygulanan tüm koruma tedbirlerinin kaldırıldığını, Konkordato Komiseri Engin Dinçeli'nin görevine son verildiğini karara bağladı. Mahkeme ayrıca Adeks Tekstil açısından da iflas şartlarının oluşmadığına hükmederek şirket hakkında iflas kararı verilmesine yer olmadığına karar verdi. BURSA'DA KONKORDATO DOSYALARINDA HAREKETLİ SÜREÇ Son mahkeme kararlarıyla birlikte Bursa'da konkordato süreçlerinde farklı sonuçlar ortaya çıktı. Metal ve otomotiv sektöründe faaliyet gösteren iki şirkete geçici koruma sağlanırken, iki tekstil şirketinin konkordato süreçleri ise mahkeme kararıyla sona erdi. Önümüzdeki aylarda özellikle Metalsan Kaplama ve Metsan Group hakkında verilecek kesin mühlet kararı, şirketlerin mali geleceği açısından belirleyici olacak.",browser_full_article,https://www.bursahakimiyet.com.tr/bursa/bursa-da-konkordato-ve-iflas-dosyalarinda-pes-pese-kararlar-otomotiv-metal-tekstil-sirketleri-1657034,Bursa,,,,,Metalsan Kaplama Sanayi ve Ticaret A.Ş | Metsan Group Metal Sanayi ve Ticaret Ltd. Şti,Metalsan Kaplama Sanayi ve Ticaret A.Ş:122:body | Metalsan Kaplama Sanayi ve Ticaret A.Ş:raw_legal | Metsan Group Metal Sanayi ve Ticaret Ltd. Şti:raw_legal,ilçe yok | faaliyet/tesis yok,Metalsan Kaplama Sanayi ve Ticaret A.Ş Bursa Türkiye | Metsan Group Metal Sanayi ve Ticaret Ltd. Şti Bursa Türkiye,Metalsan Çinko Kaplama Merkez | Metalsan Çinko Kaplama Şube | Bay Metsan,Metalsan Çinko Kaplama Merkez,firma adı + güvenli maps adayı var,100 | 100 | 75.0,,209.65,16
