published,search_term,category,title,summary,link,matched_words,activity_type,raw_text,entity_source_text,article_fetch_status,resolved_article_url,city_candidates,district_candidates,neighborhood_candidates,street_candidates,facility_candidates,company_candidates,company_candidate_scores,entity_quality_note,maps_queries,maps_candidates,maps_best_guess,maps_status,maps_match_scores,maps_rejected_candidates,record_quality_score,duplicate_group_id
2026-07-02 21:03:44,rüşvet,Diğer,"Kara Kuvvetleri Komutanlığı'ndaki lojistik ihale şebekesi hakim karşısında! Sanıklar suçu birbirine atıp rüşvete ""komisyon"" dedi!","Kara Kuvvetleri Komutanlığı'ndaki lojistik ihale şebekesi hakim karşısında! Sanıklar suçu birbirine atıp rüşvete ""komisyon"" dedi! Yeni Akit Gazetesi",https://news.google.com/rss/articles/CBMihwJBVV95cUxOcGFsb1ZhY0xEcE1yUHRYSjNZbzRqQjJBSnVmNDgxVE1PZVFFaFQwbThHT3JaSFJNS1hPTHNTZWl2ak9nWW9yUTgzYzNpaGZtZnJjc01OX0tORjRPSUtFSUtrZGNqeWdkdnM0amtneTRqQlpPd09lWFVCQUpaTV9CU254bVZLTUFKWFRkSWdrOGlUN1AyN1dWRkN3WXBYM2J4am1BT0JocWMwWVZZNFlSbVBNNDRhVnJCMUpNZXF2bzIzczlJckhVZXlhSDdFSjJoNGVEb3QyeXVQQTdlMXVhNjRBT1JxVXhzMnY4RzVjZEtwVHFaMjhCck41cHhDb3puUjQzdlZ2SdIB_AFBVV95cUxNbTFYUnhfLURYZG9UWUE5NFlXMTFsRlVFTkVyckhIclJsazBYaDNCSnIzX05rTEZUUnhfNlVTNTFuU29Qdm9DT1I0MXBJbzhJMFNQZzFGb2pXMmtvRUZHaHBNSG0xdXRpTUpWcFNqeTNBRVh2SXdzNWt5TDJ0OFA3dDlibElTRTFERVNQSjhvY1Z4bnpkbHlxbVRVLVBIQVFzX2tCa1dSYmtGeVJXd0c1R2JmVXZyZXlZUWZKVmpoRzVtNmtBbVhmUHFaX29TS2NtMngxOVh3ZmVoVVJVUEVFVEtDNjBEMlM1ZUVWdUdrRl9wSHczZHo1Z1dIUmk?oc=5,lojistik,,"Devletin göz bebeği Kara Kuvvetleri Komutanlığı’nda askeri yük ve yolcu taşıma faaliyetlerine sinsi yöntemlerle fesat karıştırıp rüşvet çarkı döndüren 19 sanıklı dev şebekenin yargılanmasına Ankara 1. Ağır Ceza Mahkemesi'nde başlandı. Lojistik Komutanlığı bünyesindeki hak ediş süreçlerini hortumlayarak kamuyu zarara uğratmakla suçlanan 5'i tutuklu sanıklar, adliyede hakim karşısında adeta birbirini satarak ve kirli ilişkilerini ""borç-alacak"" kılıfına uydurmaya çalışarak paçayı kurtarma derdine düştü. Devletin göz bebeği Kara Kuvvetleri Komutanlığı’nda askeri yük ve yolcu taşıma faaliyetlerine sinsi yöntemlerle fesat karıştırıp rüşvet çarkı döndüren 19 sanıklı dev şebekenin yargılanmasına Ankara 1. Ağır Ceza Mahkemesi'nde başlandı. Lojistik Komutanlığı bünyesindeki hak ediş süreçlerini hortumlayarak kamuyu zarara uğratmakla suçlanan 5'i tutuklu sanıklar, adliyede hakim karşısında adeta birbirini satarak ve kirli ilişkilerini ""borç-alacak"" kılıfına uydurmaya çalışarak paçayı kurtarma derdine düştü. Devletin göz bebeği Kara Kuvvetleri Komutanlığı’nda askeri yük ve yolcu taşıma faaliyetlerine sinsi yöntemlerle fesat karıştırıp rüşvet çarkı döndüren 19 sanıklı dev şebekenin yargılanmasına Ankara 1. Ağır Ceza Mahkemesi'nde başlandı. Lojistik Komutanlığı bünyesindeki hak ediş süreçlerini hortumlayarak kamuyu zarara uğratmakla suçlanan 5'i tutuklu sanıklar, adliyede hakim karşısında adeta birbirini satarak ve kirli ilişkilerini ""borç-alacak"" kılıfına uydurmaya çalışarak paçayı kurtarma derdine düştü. Gündem Kara Kuvvetleri Komutanlığı'ndaki lojistik ihale şebekesi hakim karşısında! Sanıklar suçu birbirine atıp rüşvete ""komisyon"" dedi! Devletin göz bebeği Kara Kuvvetleri Komutanlığı’nda askeri yük ve yolcu taşıma faaliyetlerine sinsi yöntemlerle fesat karıştırıp rüşvet çarkı döndüren 19 sanıklı dev şebekenin yargılanmasına Ankara 1. Ağır Ceza Mahkemesi'nde başlandı. Lojistik Komutanlığı bünyesindeki hak ediş süreçlerini hortumlayarak kamuyu zarara uğratmakla suçlanan 5'i tutuklu sanıklar, adliyede hakim karşısında adeta birbirini satarak ve kirli ilişkilerini ""borç-alacak"" kılıfına uydurmaya çalışarak paçayı kurtarma derdine düştü. Devamını Gör Kara Kuvvetleri Komutanlığı'ndaki lojistik ihale şebekesi hakim karşısında! Sanıklar suçu birbirine atıp rüşvete ""komisyon"" dedi! - Yeni Akit https://www.yeniakit.com.tr/kart/haber/kara-kuvvetleri-komutanligindaki-lojistik-ihale-sebekesi-hakim-karsisinda-saniklar-sucu-birbirine-atip-rusvete-komisyon-dedi-2010624.html ... x WhatsApp İhbar Hattı +90 (553) 313 94 23 Devletin göz bebeği Kara Kuvvetleri Komutanlığı’nda askeri yük ve yolcu taşıma faaliyetlerine sinsi yöntemlerle fesat karıştırıp rüşvet çarkı döndüren 19 sanıklı dev şebekenin yargılanmasına Ankara 1. Ağır Ceza Mahkemesi'nde başlandı. Lojistik Komutanlığı bünyesindeki hak ediş süreçlerini hortumlayarak kamuyu zarara uğratmakla suçlanan 5'i tutuklu sanıklar, adliyede hakim karşısında adeta birbirini satarak ve kirli ilişkilerini ""borç-alacak"" kılıfına uydurmaya çalışarak paçayı kurtarma derdine düştü. Devamını Gör Kara Kuvvetleri Komutanlığı'ndaki lojistik ihale şebekesi hakim karşısında! Sanıklar suçu birbirine atıp rüşvete ""komisyon"" dedi! Devletin göz bebeği Kara Kuvvetleri Komutanlığı’nda askeri yük ve yolcu taşıma faaliyetlerine sinsi yöntemlerle fesat karıştırıp rüşvet çarkı döndüren 19 sanıklı dev şebekenin yargılanmasına Ankara 1. Ağır Ceza Mahkemesi'nde başlandı. Lojistik Komutanlığı bünyesindeki hak ediş süreçlerini hortumlayarak kamuyu zarara uğratmakla suçlanan 5'i tutuklu sanıklar, adliyede hakim karşısında adeta birbirini satarak ve kirli ilişkilerini ""borç-alacak"" kılıfına uydurmaya çalışarak paçayı kurtarma derdine düştü.","Kara Kuvvetleri Komutanlığı'ndaki lojistik ihale şebekesi hakim karşısında! Sanıklar suçu birbirine atıp rüşvete ""komisyon"" dedi! Kara Kuvvetleri Komutanlığı'ndaki lojistik ihale şebekesi hakim karşısında! Sanıklar suçu birbirine atıp rüşvete ""komisyon"" dedi! Yeni Akit Gazetesi Devletin göz bebeği Kara Kuvvetleri Komutanlığı’nda askeri yük ve yolcu taşıma faaliyetlerine sinsi yöntemlerle fesat karıştırıp rüşvet çarkı döndüren 19 sanıklı dev şebekenin yargılanmasına Ankara 1. Ağır Ceza Mahkemesi'nde başlandı. Lojistik Komutanlığı bünyesindeki hak ediş süreçlerini hortumlayarak kamuyu zarara uğratmakla suçlanan 5'i tutuklu sanıklar, adliyede hakim karşısında adeta birbirini satarak ve kirli ilişkilerini ""borç-alacak"" kılıfına uydurmaya çalışarak paçayı kurtarma derdine düştü. Gündem Kara Kuvvetleri Komutanlığı'ndaki lojistik ihale şebekesi hakim karşısında! Sanıklar suçu birbirine atıp rüşvete ""komisyon"" dedi! Devamını Gör Kara Kuvvetleri Komutanlığı'ndaki lojistik ihale şebekesi hakim karşısında! - Yeni Akit https://www.yeniakit.com.tr/kart/haber/kara-kuvvetleri-komutanligindaki-lojistik-ihale-sebekesi-hakim-karsisinda-saniklar-sucu-birbirine-atip-rusvete-komisyon-dedi-2010624.html ... x WhatsApp İhbar Hattı +90 (553) 313 94 23 Devletin göz bebeği Kara Kuvvetleri Komutanlığı’nda askeri yük ve yolcu taşıma faaliyetlerine sinsi yöntemlerle fesat karıştırıp rüşvet çarkı döndüren 19 sanıklı dev şebekenin yargılanmasına Ankara 1.",browser_full_article,https://www.yeniakit.com.tr/kart/haber/kara-kuvvetleri-komutanligindaki-lojistik-ihale-sebekesi-hakim-karsisinda-saniklar-sucu-birbirine-atip-rusvete-komisyon-dedi-2010624.html,,,,,,,,il yok | ilçe yok | firma yok | faaliyet/tesis yok,,,,maps araması yapılmadı,,,122.5,23
2026-07-02 08:15:20,dolandırıcılık,Dolandırıcılık / Sahtecilik,Nitelikli dolandırıcılık ve mal varlığı değerlerini aklamaya yönelik 23 ildeki operasyonlarda 307 şüpheli yakalandı,Nitelikli dolandırıcılık ve mal varlığı değerlerini aklamaya yönelik 23 ildeki operasyonlarda 307 şüpheli yakalandı Anka Haber,https://news.google.com/rss/articles/CBMi5wFBVV95cUxOLUlNM2x3eFNpWDAzOGdGdDdENjhMMFQ2MjZ2TUJjcnIta3M1a1lsWjQ2Q3JNalJSWEJzbmpJdTFUYXdtOUYzMkhvY2N4R2ZrQWhkUWhZSHozbFhfSUhxejAya01YbDlMdkJDTm0wLWpQeHRna0c0SWVDbXhIbzU0V1J0cmVHTE9mdEJiMGdWUG1ndjFnMW80djViaWp2THM1STNCVVlvbXNHN1A1QXhsTVZJMmxZeWxQcWF1MFFoUnUzUmpLOUVXTzVLR25xaFdUNmZUbGpZaFQwcFU4dTI0S082UzRXT3c?oc=5,mal varlığı,,"İçişleri Bakanlığı, 23 ilde nitelikli dolandırıcılık ve mal varlığı değerlerini aklama suçlarına yönelik düzenlenen operasyonlarda 307 şüphelinin yakalandığını bildirdi. İçişleri Bakanlığı, 23 ilde nitelikli dolandırıcılık ve mal varlığı değerlerini aklama suçlarına yönelik düzenlenen operasyonlarda 307 şüphelinin yakalandığını bildirdi. İçişleri Bakanlığı, 23 ilde nitelikli dolandırıcılık ve mal varlığı değerlerini aklama suçlarına yönelik düzenlenen operasyonlarda 307 şüphelinin yakalandığını bildirdi. (ANKARA) - İçişleri Bakanlığı, 23 ilde nitelikli dolandırıcılık ve mal varlığı değerlerini aklama suçlarına yönelik düzenlenen operasyonlarda 307 şüphelinin yakalandığını bildirdi. İçişleri Bakanlığı'ndan yapılan yazılı açıklamada, şunlar kaydedildi: ""Emniyet Genel Müdürlüğü Asayiş Daire Başkanlığı ile Cumhuriyet Başsavcılıkları koordinesinde; İl Emniyet Müdürlükleri Asayiş Şube Müdürlüklerince nitelikli dolandırıcılık ve suçtan kaynaklanan mal varlığı değerlerini aklama suçlarına yönelik 23 ilde son 1 ayda 45 ayrı operasyon düzenlendi. Adana, Afyonkarahisar, Ankara, Antalya, Bursa, Çanakkale, Diyarbakır, Edirne, Elazığ, Erzurum, Eskişehir, Gaziantep, Isparta, İzmir, Mersin, İstanbul, Nevşehir, Sakarya, Samsun, Tekirdağ, Tokat, Van ve Osmaniye’de gerçekleştirilen operasyonlarda 307 şüpheli yakalandı. Şüphelilerin banka hesaplarında 5 milyar 388 milyon TL işlem hacmi bulunduğu tespit edildi. Operasyonlar sonucu; çok sayıda iletişim ve bilişim ekipmanı ile dijital materyal, suçtan elde edildiği değerlendirilen bir miktar döviz, altın, ruhsatsız silah ve mühimmat ele geçirildi. Kahraman Polislerimizi, Asayiş Daire Başkanlığımızı, Cumhuriyet Başsavcılıklarımızı ve emeği geçenleri tebrik ediyoruz."" Nitelikli dolandırıcılık ve mal varlığı değerlerini aklamaya yönelik 23 ildeki operasyonlarda 307 şüpheli yakalandı (ANKARA) - İçişleri Bakanlığı, 23 ilde nitelikli dolandırıcılık ve mal varlığı değerlerini aklama suçlarına yönelik düzenlenen operasyonlarda 307 şüphelinin yakalandığını bildirdi. İçişleri Bakanlığı'ndan yapılan yazılı açıklamada, şunlar kaydedildi: ""Emniyet Genel Müdürlüğü Asayiş Daire Başkanlığı ile Cumhuriyet Başsavcılıkları koordinesinde; İl Emniyet Müdürlükleri Asayiş Şube Müdürlüklerince nitelikli dolandırıcılık ve suçtan kaynaklanan mal varlığı değerlerini aklama suçlarına yönelik 23 ilde son 1 ayda 45 ayrı operasyon düzenlendi. Adana, Afyonkarahisar, Ankara, Antalya, Bursa, Çanakkale, Diyarbakır, Edirne, Elazığ, Erzurum, Eskişehir, Gaziantep, Isparta, İzmir, Mersin, İstanbul, Nevşehir, Sakarya, Samsun, Tekirdağ, Tokat, Van ve Osmaniye’de gerçekleştirilen operasyonlarda 307 şüpheli yakalandı. Şüphelilerin banka hesaplarında 5 milyar 388 milyon TL işlem hacmi bulunduğu tespit edildi. Operasyonlar sonucu; çok sayıda iletişim ve bilişim ekipmanı ile dijital materyal, suçtan elde edildiği değerlendirilen bir miktar döviz, altın, ruhsatsız silah ve mühimmat ele geçirildi. Kahraman Polislerimizi, Asayiş Daire Başkanlığımızı, Cumhuriyet Başsavcılıklarımızı ve emeği geçenleri tebrik ediyoruz.""","Nitelikli dolandırıcılık ve mal varlığı değerlerini aklamaya yönelik 23 ildeki operasyonlarda 307 şüpheli yakalandı Nitelikli dolandırıcılık ve mal varlığı değerlerini aklamaya yönelik 23 ildeki operasyonlarda 307 şüpheli yakalandı Anka Haber İçişleri Bakanlığı, 23 ilde nitelikli dolandırıcılık ve mal varlığı değerlerini aklama suçlarına yönelik düzenlenen operasyonlarda 307 şüphelinin yakalandığını bildirdi. (ANKARA) - İçişleri Bakanlığı, 23 ilde nitelikli dolandırıcılık ve mal varlığı değerlerini aklama suçlarına yönelik düzenlenen operasyonlarda 307 şüphelinin yakalandığını bildirdi. İçişleri Bakanlığı'ndan yapılan yazılı açıklamada, şunlar kaydedildi: ""Emniyet Genel Müdürlüğü Asayiş Daire Başkanlığı ile Cumhuriyet Başsavcılıkları koordinesinde; İl Emniyet Müdürlükleri Asayiş Şube Müdürlüklerince nitelikli dolandırıcılık ve suçtan kaynaklanan mal varlığı değerlerini aklama suçlarına yönelik 23 ilde son 1 ayda 45 ayrı operasyon düzenlendi. Adana, Afyonkarahisar, Ankara, Antalya, Bursa, Çanakkale, Diyarbakır, Edirne, Elazığ, Erzurum, Eskişehir, Gaziantep, Isparta, İzmir, Mersin, İstanbul, Nevşehir, Sakarya, Samsun, Tekirdağ, Tokat, Van ve Osmaniye’de gerçekleştirilen operasyonlarda 307 şüpheli yakalandı. Operasyonlar sonucu; çok sayıda iletişim ve bilişim ekipmanı ile dijital materyal, suçtan elde edildiği değerlendirilen bir miktar döviz, altın, ruhsatsız silah ve mühimmat ele geçirildi. Kahraman Polislerimizi, Asayiş Daire Başkanlığımızı, Cumhuriyet Başsavcılıklarımızı ve emeği geçenleri tebrik ediyoruz."" Nitelikli dolandırıcılık ve mal varlığı değerlerini aklamaya yönelik 23 ildeki operasyonlarda 307 şüpheli yakalandı (ANKARA) - İçişleri Bakanlığı, 23 ilde nitelikli dolandırıcılık ve mal varlığı değerlerini aklama suçlarına yönelik düzenlenen operasyonlarda 307 şüphelinin yakalandığını bildirdi.",browser_full_article,https://ankahaber.net/haber/nitelikli-dolandiricilik-ve-mal-varligi-degerlerini-aklamaya-yonelik-23-ildeki-operasyonlarda-307-supheli-yakalandi-0173a27e,Osmaniye,,,,,,,ilçe yok | firma yok | faaliyet/tesis yok,,,,maps araması yapılmadı,,,130.0,24
2026-07-02 09:23:17,dolandırıcılık,Dolandırıcılık / Sahtecilik,"SHB, dolandırıcılık olabileceğinden şüpheli hesaplardan para transferi yapıldığına dair kullanıcıları uyaran bir özellik kullanıma sundu.","SHB, dolandırıcılık olabileceğinden şüpheli hesaplardan para transferi yapıldığına dair kullanıcıları uyaran bir özellik kullanıma sundu. Vietnam.vn",https://news.google.com/rss/articles/CBMinAFBVV95cUxQQ2laTUdVU0EwNFVIOXMyNTFoRGsxREw5VVNuSDZzU1lfVFBuRDFSUWVGWDR3UnhzckVJMHN5VG1aX2F3RDRlUHlkVW1ueXBZSFkzUnlfd3VPeXhjMmRRbm5NenFYX0R5cGZ2dlBudV9LN2hkUDNkRE9lWFpZdm9DSVRHZGNSQWpSMnVvRzB1SXpBWGlNTWFZb1VrNmQ?oc=5,para transferi,,"SHB, dolandırıcılık olabileceğinden şüpheli hesaplardan para transferi yapıldığına dair kullanıcıları uyaran bir özellik kullanıma sundu. Vietnam.vn","SHB, dolandırıcılık olabileceğinden şüpheli hesaplardan para transferi yapıldığına dair kullanıcıları uyaran bir özellik kullanıma sundu. SHB, dolandırıcılık olabileceğinden şüpheli hesaplardan para transferi yapıldığına dair kullanıcıları uyaran bir özellik kullanıma sundu. Vietnam.vn SHB, dolandırıcılık olabileceğinden şüpheli hesaplardan para transferi yapıldığına dair kullanıcıları uyaran bir özellik kullanıma sundu.",browser_failed,https://news.google.com/rss/articles/CBMinAFBVV95cUxQQ2laTUdVU0EwNFVIOXMyNTFoRGsxREw5VVNuSDZzU1lfVFBuRDFSUWVGWDR3UnhzckVJMHN5VG1aX2F3RDRlUHlkVW1ueXBZSFkzUnlfd3VPeXhjMmRRbm5NenFYX0R5cGZ2dlBudV9LN2hkUDNkRE9lWFpZdm9DSVRHZGNSQWpSMnVvRzB1SXpBWGlNTWFZb1VrNmQ?oc=5&hl=tr&gl=TR&ceid=TR:tr,,,,,,,,il yok | ilçe yok | firma yok | faaliyet/tesis yok,,,,maps araması yapılmadı,,,122.98,25
2026-07-02 11:17:24,dolandırıcılık,Dolandırıcılık / Sahtecilik,"Şüpheli dolandırıcılık işlemleri kapsamında 5,2 trilyon VND tutarında banka işlemi bloke edildi.","Şüpheli dolandırıcılık işlemleri kapsamında 5,2 trilyon VND tutarında banka işlemi bloke edildi. Vietnam.vn",https://news.google.com/rss/articles/CBMinAFBVV95cUxOWEd6WTc2VWJPcWJvMlE4S180UEIxX05aelZPV3l1T21KbmpLU0VnWGFkdFRjVXhWR2w3VEJ0RFljNEhFV3djZFRwS3lyVEdKalpDWHJpWmktREpDTFF3SEZiajdPdHVYVzRVSVoxMVhwYzYzd1dwTDNkZ3FrNG96aEN6eGtLU3hDSHh0d0VyZV91U2paNHkyTm53ZmE?oc=5,banka,finansal kuruluş,"Şüpheli dolandırıcılık işlemleri kapsamında 5,2 trilyon VND tutarında banka işlemi bloke edildi. Vietnam.vn","Şüpheli dolandırıcılık işlemleri kapsamında 5,2 trilyon VND tutarında banka işlemi bloke edildi. Şüpheli dolandırıcılık işlemleri kapsamında 5,2 trilyon VND tutarında banka işlemi bloke edildi. Vietnam.vn Şüpheli dolandırıcılık işlemleri kapsamında 5,2 trilyon VND tutarında banka işlemi bloke edildi.",browser_failed,https://news.google.com/rss/articles/CBMinAFBVV95cUxOWEd6WTc2VWJPcWJvMlE4S180UEIxX05aelZPV3l1T21KbmpLU0VnWGFkdFRjVXhWR2w3VEJ0RFljNEhFV3djZFRwS3lyVEdKalpDWHJpWmktREpDTFF3SEZiajdPdHVYVzRVSVoxMVhwYzYzd1dwTDNkZ3FrNG96aEN6eGtLU3hDSHh0d0VyZV91U2paNHkyTm53ZmE?oc=5&hl=tr&gl=TR&ceid=TR:tr,,,,,,,,il yok | ilçe yok | firma yok | faaliyet/tesis yok,,,,maps araması yapılmadı,,,81.82,26
2026-07-02 08:16:00,banka dolandırıcılığı,Banka / Finansal Kuruluş,Emekli banka yöneticisine bile aynı tuzak! Bin 758 adet Cumhuriyet altınını kaptırmıştı: Şüpheliler adliyeye sevk edildi,Emekli banka yöneticisine bile aynı tuzak! Bin 758 adet Cumhuriyet altınını kaptırmıştı: Şüpheliler adliyeye sevk edildi Hürriyet,https://news.google.com/rss/articles/CBMi7wFBVV95cUxQN1VlbmpwYmdISjdRemswOVJCcE9NaVBRUC1nRzVDcDJMclpncHZfUEM0Q284MnlDZTU1QWFRd2NMeW1VYzdGTTNEajFDbHVuZjlmR01RSXJneFpEbnVvNmhwSE8tMFB1c1RrV2FmUm1acWYtUlBVYURDSjZWa1dTQWJJLWlXZDVEcjFpbUQ3SlZpWTFBV0hra2FNdkg4V3ZvLUFjNDdrYmNNZzRUVldBdXR6dDVnZzBXU2VUbU1TV2NJNGhqZWotTWZELTdOY2QzMGVLZUNrRDdyWmYyT3FwSUZsamh0dER0RU1zNFBuYw?oc=5,banka,finansal kuruluş,"Beşiktaş’ta telefonla arayıp polis olduklarını söyleyerek kandırdıkları 83 yaşındaki Dinçer K.’nın bin 758 Cumhuriyet altınını çalan 5 şüpheli adliyeye sevk... Haberler - Beşiktaş’ta telefonla arayıp polis olduklarını söyleyerek kandırdıkları 83 yaşındaki Dinçer K.’nın bin 758 Cumhuriyet altınını çalan 5 şüpheli adliyeye sevk edildi. Beşiktaş’ta telefonla arayıp polis olduklarını söyleyerek kandırdıkları 83 yaşındaki Dinçer K.’nın bin 758 Cumhuriyet altınını çalan 5 şüpheli adliyeye sevk... Ali AKSOYER / İSTANBUL, (DHA) Oluşturulma Tarihi: Temmuz 02, 2026 11:16 Beşiktaş’ta telefonla arayıp polis olduklarını söyleyerek kandırdıkları 83 yaşındaki Dinçer K.’nın bin 758 Cumhuriyet altınını çalan 5 şüpheli adliyeye sevk edildi. Haberin Devamı Beşiktaş ’ta 16 Nisan'da meydana gelen olayda 83 yaşındaki Dinçer K. polise başvurarak dolandırıldığını söyleyip şikâyetçi olmuştu. Para ve Sermaye piyasaları uzmanı olduğu söyleyen ve Bankalarda üst düzey yöneticilik yaptıktan sonra emekli olan Dinçer K., telefonla arayan ve polis olduğunu söyleyen kişilere inanarak bin 758 Cumhuriyet altınını dolandırıcılara teslim etti. Asayiş Şube Müdürlüğü, Dolandırıcılık Büro Amirliği ekipleri tarafından yapılan soruşturmada olaya karıştıkları belirlenen 5 şüpheli Şanlıurfa'da yapılan operasyonla gözaltına alınmıştı. Haberlerimizi Google’da Takip Edin En güncel haberlere ve son dakika gelişmelerine Google üzerinden anında ulaşmak için bizi favorilerinize ekleyin. Google’da tercih edilen kaynak olarak ekleyin Haberin Devamı İstanbul’a getirilerek sorgulanan şüphelilerin işlemleri tamamlandı. 5 şüpheli işlemlerinin ardından adliyeye sevk edildi. Öte yandan şüphelilerden Mehmet U.’nun mağdur Dinçer K.’nın yanına gelerek içinde altın bulunan çantayı alan kişi olduğu belirlendi. Diğer şüphelilerin de olaya yardım ve yataklık yaptıkları belirlendi. Dolandırıcılık Büro Amirliği ekiplerinin firarda olan iki kişinin yakalanması için çalışmalara devam ettiği öğrenildi. Haberle ilgili daha fazlası: #Dolandırıcılık #Altın Dolandırıcılığı #Telefon Dolandırıcılığı Ali AKSOYER / İSTANBUL, (DHA) Oluşturulma Tarihi: Temmuz 02, 2026 11:16 Beşiktaş’ta telefonla arayıp polis olduklarını söyleyerek kandırdıkları 83 yaşındaki Dinçer K.’nın bin 758 Cumhuriyet altınını çalan 5 şüpheli adliyeye sevk edildi. Haberin Devamı Beşiktaş ’ta 16 Nisan'da meydana gelen olayda 83 yaşındaki Dinçer K. polise başvurarak dolandırıldığını söyleyip şikâyetçi olmuştu. Para ve Sermaye piyasaları uzmanı olduğu söyleyen ve Bankalarda üst düzey yöneticilik yaptıktan sonra emekli olan Dinçer K., telefonla arayan ve polis olduğunu söyleyen kişilere inanarak bin 758 Cumhuriyet altınını dolandırıcılara teslim etti. Asayiş Şube Müdürlüğü, Dolandırıcılık Büro Amirliği ekipleri tarafından yapılan soruşturmada olaya karıştıkları belirlenen 5 şüpheli Şanlıurfa'da yapılan operasyonla gözaltına alınmıştı. Haberlerimizi Google’da Takip Edin En güncel haberlere ve son dakika gelişmelerine Google üzerinden anında ulaşmak için bizi favorilerinize ekleyin. Google’da tercih edilen kaynak olarak ekleyin Haberin Devamı İstanbul’a getirilerek sorgulanan şüphelilerin işlemleri tamamlandı. 5 şüpheli işlemlerinin ardından adliyeye sevk edildi. Öte yandan şüphelilerden Mehmet U.’nun mağdur Dinçer K.’nın yanına gelerek içinde altın bulunan çantayı alan kişi olduğu belirlendi. Diğer şüphelilerin de olaya yardım ve yataklık yaptıkları belirlendi. Dolandırıcılık Büro Amirliği ekiplerinin firarda olan iki kişinin yakalanması için çalışmalara devam ettiği öğrenildi. Haberlerimizi Google’da Takip Edin En güncel haberlere ve son dakika gelişmelerine Google üzerinden anında ulaşmak için bizi favorilerinize ekleyin. × GÜNDEM DÜNYA BİGPARA ANASAYFA BORSA DÖVİZ ALTIN VİOP&VARANT ANALİZ KOBİ KRİPTO PARALAR SPOR ARENA ANASAYFA FUTBOL BASKETBOL VOLEYBOL CANLI SKOR KELEBEK ANASAYFA EKRANDA HAYAT SEYAHAT STİL FAKİR HAUSGERATE İLE LEZZETLİ TARİFLER SAĞLIK YAŞAM ANASAYFA CUMARTESİ PAZAR LEZZETLİ HAYAT ÇOCUKLA HAYAT SEYAHAT YAZARLAR RESMİ İLANLAR ASTROLOJİ TÜMÜ EKONOMİ TV REHBERİ MAHMURE HÜRRİYET AİLE VİDEO ASTROLOJİ HESAPLAMA ARAÇLARI BULMACA EN İYİ ON LEZİZZ TEKNOLOJİ FOTO GALERİ RAMAZAN KİTAP SANA","Emekli banka yöneticisine bile aynı tuzak! Bin 758 adet Cumhuriyet altınını kaptırmıştı: Şüpheliler adliyeye sevk edildi Emekli banka yöneticisine bile aynı tuzak! Bin 758 adet Cumhuriyet altınını kaptırmıştı: Şüpheliler adliyeye sevk edildi Hürriyet Beşiktaş’ta telefonla arayıp polis olduklarını söyleyerek kandırdıkları 83 yaşındaki Dinçer K.’nın bin 758 Cumhuriyet altınını çalan 5 şüpheli adliyeye sevk... Haberler - Beşiktaş’ta telefonla arayıp polis olduklarını söyleyerek kandırdıkları 83 yaşındaki Dinçer K.’nın bin 758 Cumhuriyet altınını çalan 5 şüpheli adliyeye sevk edildi. Ali AKSOYER / İSTANBUL, (DHA) Oluşturulma Tarihi: Temmuz 02, 2026 11:16 Beşiktaş’ta telefonla arayıp polis olduklarını söyleyerek kandırdıkları 83 yaşındaki Dinçer K.’nın bin 758 Cumhuriyet altınını çalan 5 şüpheli adliyeye sevk edildi. Haberin Devamı Beşiktaş ’ta 16 Nisan'da meydana gelen olayda 83 yaşındaki Dinçer K. polise başvurarak dolandırıldığını söyleyip şikâyetçi olmuştu. Para ve Sermaye piyasaları uzmanı olduğu söyleyen ve Bankalarda üst düzey yöneticilik yaptıktan sonra emekli olan Dinçer K., telefonla arayan ve polis olduğunu söyleyen kişilere inanarak bin 758 Cumhuriyet altınını dolandırıcılara teslim etti. Asayiş Şube Müdürlüğü, Dolandırıcılık Büro Amirliği ekipleri tarafından yapılan soruşturmada olaya karıştıkları belirlenen 5 şüpheli Şanlıurfa'da yapılan operasyonla gözaltına alınmıştı.",browser_full_article,https://www.hurriyet.com.tr/gundem/emekli-banka-yoneticisine-bile-ayni-tuzak-758-adet-cumhuriyet-altinini-kaptirmisti-supheliler-adliyeye-sevk-edildi-43226107,Şanlıurfa | İstanbul,Beşiktaş,,,,,,firma yok | faaliyet/tesis yok,,,,maps araması yapılmadı,,,141.25,27
